data,settore,azienda,sindacato,ambito_geografico,modalita,dettagli_link,revocato,data_dal_iso,data_al_iso,data_sort,data_iso
Dal 07-07-2025 al 08-07-2025,Trasporto ferroviario,"GRUPPO FSI, MERCITALIA RAIL, TRENITALIA, TRENITALIA TPER SCARL",Assemblea Nazionale Pdm/pdb,NAZIONALE,dalle ore 21.00 del 7/07 alle ore 18.00 dell' 8/07,https://www.cgsse.it/calendario-scioperi/dettaglio-sciopero/369508,false,2025-07-07,2025-07-08,2025-07-07,
Dal 22-07-2025 al 23-07-2025,Trasporto merci su rotaia,GTS RAIL,"Filt Cgil, Fit Cisl, Uiltrasporti, Ugl Ferrovieri, Fast Confsal",NAZIONALE,dalle ore 16:01del22/07 alle ore 16.00 del 23/07,https://www.cgsse.it/calendario-scioperi/dettaglio-sciopero/369506,false,2025-07-22,2025-07-23,2025-07-22,
08-07-2025,Igiene ambientale,MEA,"Filcams Cgil, Fp Cgil",PALMI,,https://www.cgsse.it/calendario-scioperi/dettaglio-sciopero/369492,false,2025-07-08,2025-07-08,2025-07-08,2025-07-08
08-07-2025,Vigili del fuoco,MINISTERO DELL'INTERNO,"Fp Cgil, Fns Cisl, Conapo, Usb Vvf, Uilpa Vvf, Ugl Vvf",FOGGIA,dalle ore 9.30 alle ore 12.30,https://www.cgsse.it/calendario-scioperi/dettaglio-sciopero/369489,false,2025-07-08,2025-07-08,2025-07-08,2025-07-08
Dal 09-07-2025 al 10-07-2025,"Trasporto aereo, Istituti di vigilanza",AZIENDE DEL SETTORE,"Filcams Cgil, Fisascat Cisl, Uiltucs",TOSCANA,"dalle ore 22.00 del 9/7 alle ore 22.00 del 10/7, addetti ai servizi di controllo in ambito aeroportuale dalle ore 00.00 alle ore 23.59 del 10/7",https://www.cgsse.it/calendario-scioperi/dettaglio-sciopero/369475,false,2025-07-09,2025-07-10,2025-07-09,
10-07-2025,Trasporto aereo,EASYJET AIRLINE LIMITED,Usb Lavoro Privato,NAZIONALE,dalle ore 00.00 alle ore 23.59,https://www.cgsse.it/calendario-scioperi/dettaglio-sciopero/369470,false,2025-07-10,2025-07-10,2025-07-10,2025-07-10
10-07-2025,Trasporto aereo,AIRPORT HANDLING,Usb Lavoro Privato,"MILANO, VARESE",dalle ore 00.00 alle 23.59,https://www.cgsse.it/calendario-scioperi/dettaglio-sciopero/369457,false,2025-07-10,2025-07-10,2025-07-10,2025-07-10
Dal 07-07-2025 al 08-07-2025,"Trasporto merci su rotaia, Trasporto pubblico locale, Trasporto ferroviario, Plurisettoriale nazionale",AZIENDE CHE SVOLGONO ATTIVITA FERROVIARIA,Sgb,NAZIONALE,dalle ore 21:00 del 7/7 alle ore 18:00 dell' 8/7,https://www.cgsse.it/calendario-scioperi/dettaglio-sciopero/369455,false,2025-07-07,2025-07-08,2025-07-07,
15-07-2025,Trasporto pubblico locale,AUTOLINEE TOSCANE,Fast Confsal,PISA,"dalle ore 17,30 alle ore 21,30",https://www.cgsse.it/calendario-scioperi/dettaglio-sciopero/369453,false,2025-07-15,2025-07-15,2025-07-15,2025-07-15
11-07-2025,Regioni e autonomie Locali,COMUNE DI PISA,"Rsu, Fp Cgil, Cub Pubblico Impiego",PISA,intera giornata lavorativa del personale educativo,https://www.cgsse.it/calendario-scioperi/dettaglio-sciopero/369451,false,2025-07-11,2025-07-11,2025-07-11,2025-07-11
25-06-2025,Trasporto aereo,GDA HANDLING,Usb Lavoro Privato,BRESCIA,dalle ore 07:00 alle ore 19:00,https://www.cgsse.it/calendario-scioperi/dettaglio-sciopero/369442,false,2025-06-25,2025-06-25,2025-06-25,2025-06-25
25-06-2025,Trasporto aereo,GDA HANDLING,Usb Lavoro Privato,BRESCIA,dalle ore 07:00 alle ore 19:00,https://www.cgsse.it/calendario-scioperi/dettaglio-sciopero/369442,true,2025-06-25,2025-06-25,2025-06-25,2025-06-25
Dal 07-07-2025 al 08-07-2025,Trasporto merci su rotaia,CAPTRAIN ITALIA,"Filt Cgil, Fit Cisl, Uiltrasporti",NAZIONALE,dalle ore 21.00 del 7/7 alle ore 18.00 dell'8/7,https://www.cgsse.it/calendario-scioperi/dettaglio-sciopero/369417,false,2025-07-07,2025-07-08,2025-07-07,
09-07-2025,Distribuzione farmaci e logistica farmaceutica,PHSE,Si Cobas,SAN MARTINO IN STRADA,intera giornata,https://www.cgsse.it/calendario-scioperi/dettaglio-sciopero/369413,false,2025-07-09,2025-07-09,2025-07-09,2025-07-09
04-07-2025,"Ricerca, Università",CONSORZIO CINECA,"Filcams Cgil, Fisascat Cisl, Uiltucs",NAZIONALE,intera giornata,https://www.cgsse.it/calendario-scioperi/dettaglio-sciopero/369411,false,2025-07-04,2025-07-04,2025-07-04,2025-07-04
02-07-2025,Vigili del fuoco,MINISTERO DELL'INTERNO,"Fp Cgil, Fns Cisl, Conapo, Usb Vvf, Uilpa Vvf, Ugl Vvf",FOGGIA,dalle ore 9.30 alle ore 12.30,https://www.cgsse.it/calendario-scioperi/dettaglio-sciopero/369395,false,2025-07-02,2025-07-02,2025-07-02,2025-07-02
02-07-2025,Vigili del fuoco,MINISTERO DELL'INTERNO,"Fp Cgil, Fns Cisl, Conapo, Usb Vvf, Uilpa Vvf, Ugl Vvf",FOGGIA,dalle ore 9.30 alle ore 12.30,https://www.cgsse.it/calendario-scioperi/dettaglio-sciopero/369395,true,2025-07-02,2025-07-02,2025-07-02,2025-07-02
01-07-2025,Pulizie e multiservizi,ROMEO GESTIONI,"Orsa Filsa, Fisascat Cisl",NAPOLI,intera giornata,https://www.cgsse.it/calendario-scioperi/dettaglio-sciopero/369371,false,2025-07-01,2025-07-01,2025-07-01,2025-07-01
03-07-2025,Pulizie e multiservizi,MIORELLI SERVICE,Flaica Cub,SCAFATI,intera giornata,https://www.cgsse.it/calendario-scioperi/dettaglio-sciopero/369366,false,2025-07-03,2025-07-03,2025-07-03,2025-07-03
03-07-2025,Pulizie e multiservizi,MIORELLI SERVICE,Flaica Cub,SCAFATI,intera giornata,https://www.cgsse.it/calendario-scioperi/dettaglio-sciopero/369366,true,2025-07-03,2025-07-03,2025-07-03,2025-07-03
Dal 30-06-2025 al 07-07-2025,Pulizie e multiservizi,MIORELLI SERVICE,Flaica Cub,SCAFATI,intero turno di lavoro,https://www.cgsse.it/calendario-scioperi/dettaglio-sciopero/369364,true,2025-06-30,2025-07-07,2025-06-30,
Dal 30-06-2025 al 07-07-2025,Pulizie e multiservizi,MIORELLI SERVICE,Flaica Cub,SCAFATI,intero turno di lavoro,https://www.cgsse.it/calendario-scioperi/dettaglio-sciopero/369354,false,2025-06-30,2025-07-07,2025-06-30,
01-07-2025,Igiene ambientale,MONTECO,"Fp Cgil, Fit Cisl, Fiadel, Uiltrasporti",LECCE,dalle ore 00.00 alle ore 23.59,https://www.cgsse.it/calendario-scioperi/dettaglio-sciopero/369317,true,2025-07-01,2025-07-01,2025-07-01,2025-07-01
26-07-2025,Trasporto aereo,VOLOTEA,Uiltrasporti,NAZIONALE,"dalle ore 13.00 alle ore 17.00, escluso i voli da e per l’aeroporto di palermo",https://www.cgsse.it/calendario-scioperi/dettaglio-sciopero/369264,false,2025-07-26,2025-07-26,2025-07-26,2025-07-26
18-07-2025,Servizio sanitario nazionale,SANITASERVICE ASL FG,"Uil Fpl, Usb",FOGGIA,intera giornata,https://www.cgsse.it/calendario-scioperi/dettaglio-sciopero/369255,false,2025-07-18,2025-07-18,2025-07-18,2025-07-18
04-07-2025,Servizio sanitario nazionale,"COOPLAT, CTS, REKEEP",Filcams Cgil,EMPOLI,intera giornata,https://www.cgsse.it/calendario-scioperi/dettaglio-sciopero/369252,false,2025-07-04,2025-07-04,2025-07-04,2025-07-04
13-07-2025,Trasporto pubblico locale,TPL LINEA,"Filt Cgil, Fit Cisl, Uiltrasporti, Faisa Cisal, Ugl Fna, Sial Cobas",SAVONA,da inizio turno alle ore 5.00 dalle 8.30 alle 17.30 e dalle 20.00 a fine turno,https://www.cgsse.it/calendario-scioperi/dettaglio-sciopero/369228,false,2025-07-13,2025-07-13,2025-07-13,2025-07-13
15-07-2025,Regioni e autonomie Locali,SABATO VIAGGI,Faisa Cisal,ROMA,dalle ore 12.30 alle ore 16.30,https://www.cgsse.it/calendario-scioperi/dettaglio-sciopero/369203,false,2025-07-15,2025-07-15,2025-07-15,2025-07-15
07-07-2025,Regioni e autonomie Locali,PAOLO SCOPPIO AUTOLINEE,Faisa Cisal,ROMA,dalle ore 12.30 alle ore 16.30,https://www.cgsse.it/calendario-scioperi/dettaglio-sciopero/369201,false,2025-07-07,2025-07-07,2025-07-07,2025-07-07
19-07-2025,Trasporto pubblico locale,SATI,"Filt Cgil, Faisa Cisal, Ugl Autoferro",CAMPOBASSO,dalle ore 8.30 alle ore 12.30,https://www.cgsse.it/calendario-scioperi/dettaglio-sciopero/369190,false,2025-07-19,2025-07-19,2025-07-19,2025-07-19
30-06-2025,Ministeri,"ADECCO, RANDSTAD","Felsa Cisl, Nidil Cgil, Uiltemp",NAZIONALE,intero turno di lavoro,https://www.cgsse.it/calendario-scioperi/dettaglio-sciopero/369179,false,2025-06-30,2025-06-30,2025-06-30,2025-06-30
26-07-2025,Trasporto pubblico locale,EAV,Orsa Trasporti,"ISCHIA, PROCIDA",dalle ore 19.55 alle ore 23.55,https://www.cgsse.it/calendario-scioperi/dettaglio-sciopero/369127,false,2025-07-26,2025-07-26,2025-07-26,2025-07-26
30-06-2025,Pulizie e multiservizi,LA NITIDA MULTISERVIZI,Ugl,NAPOLI,intera giornata,https://www.cgsse.it/calendario-scioperi/dettaglio-sciopero/369098,false,2025-06-30,2025-06-30,2025-06-30,2025-06-30
01-07-2025,Pulizie e multiservizi,ROMEO GESTIONI,Fisascat Cisl,NOCERA INFERIORE,intera giornata,https://www.cgsse.it/calendario-scioperi/dettaglio-sciopero/369088,false,2025-07-01,2025-07-01,2025-07-01,2025-07-01
14-07-2025,Trasporto pubblico locale,AUTOSERVIZI RUSSO,Faisa Cisal,PALERMO,dalle ore 9.30 alle ore 13.30,https://www.cgsse.it/calendario-scioperi/dettaglio-sciopero/369056,false,2025-07-14,2025-07-14,2025-07-14,2025-07-14
14-07-2025,Trasporto pubblico locale,INTERBUS,Faisa Cisal,ENNA,dalle ore 09.30 alle ore 13.30,https://www.cgsse.it/calendario-scioperi/dettaglio-sciopero/369054,false,2025-07-14,2025-07-14,2025-07-14,2025-07-14
14-07-2025,Trasporto pubblico locale,SEGESTA AUTOLINEE,Faisa Cisal,PALERMO,dalle ore 09:30 alle ore 13:30,https://www.cgsse.it/calendario-scioperi/dettaglio-sciopero/369052,false,2025-07-14,2025-07-14,2025-07-14,2025-07-14
14-07-2025,Trasporto pubblico locale,ETNA TRASPORTI,Faisa Cisal,CATANIA,dalle ore 09.30 alle ore 13.30,https://www.cgsse.it/calendario-scioperi/dettaglio-sciopero/369050,false,2025-07-14,2025-07-14,2025-07-14,2025-07-14
01-07-2025,Farmacie,FARMACIE PRIVATE,"Filcams Cgil, Fisascat Cisl, Uiltucs",LAZIO,dalle ore 8:00 alle ore 12:00,https://www.cgsse.it/calendario-scioperi/dettaglio-sciopero/369048,false,2025-07-01,2025-07-01,2025-07-01,2025-07-01
23-06-2025,Servizio sanitario nazionale,COOP FBB,Cub Sanità,ALPIGNANO,intera giornata,https://www.cgsse.it/calendario-scioperi/dettaglio-sciopero/369023,true,2025-06-23,2025-06-23,2025-06-23,2025-06-23
18-07-2025,Trasporto pubblico locale,"ATC ESERCIZIO, AUTOSERVIZI RICCITELLI, TROTTA BUS SERVICE","Filt Cgil, Uiltrasporti, Ugl Fna, Cobas",LA SPEZIA,dalle ore 11.00 alle ore 15.00 personale di linea e officine,https://www.cgsse.it/calendario-scioperi/dettaglio-sciopero/368998,false,2025-07-18,2025-07-18,2025-07-18,2025-07-18
26-06-2025,Pulizie e multiservizi,LA NITIDA MULTISERVIZI,Ugl,NAPOLI,intera giornata,https://www.cgsse.it/calendario-scioperi/dettaglio-sciopero/368993,true,2025-06-26,2025-06-26,2025-06-26,2025-06-26
25-06-2025,Trasporto pubblico locale,SATI,"Filt Cgil, Faisa Cisal, Ugl Autoferro",CAMPOBASSO,dalle ore 8.30 alle ore 12.30,https://www.cgsse.it/calendario-scioperi/dettaglio-sciopero/368978,true,2025-06-25,2025-06-25,2025-06-25,2025-06-25
15-07-2025,Trasporto pubblico locale,AUTOGUIDOVIE,"Filt Cgil, Fit Cisl, Uiltrasporti, Ugl","BOLOGNA , MILANO , PAVIA , CREMONA , MONZA E DELLA BRIANZA, MANTOVA , LODI",dalle ore 8.30 alle ore 12.30,https://www.cgsse.it/calendario-scioperi/dettaglio-sciopero/368966,false,2025-07-15,2025-07-15,2025-07-15,2025-07-15
24-06-2025,Igiene ambientale,MONTECO,Ugl,LECCE,dalle ore 00.00 alle ore 23.59,https://www.cgsse.it/calendario-scioperi/dettaglio-sciopero/368961,true,2025-06-24,2025-06-24,2025-06-24,2025-06-24
10-07-2025,Trasporto aereo,SOGAERSECURITY,Ugl Trasporto Aereo,CAGLIARI,"dalle ore 13.00 alle ore 17.00, escluse le attività da e per l'aeroporto di palermo",https://www.cgsse.it/calendario-scioperi/dettaglio-sciopero/368946,false,2025-07-10,2025-07-10,2025-07-10,2025-07-10
24-06-2025,Pulizie e multiservizi,ROMEO GESTIONI,Fisascat Cisl,NOCERA INFERIORE,intera giornata,https://www.cgsse.it/calendario-scioperi/dettaglio-sciopero/368915,true,2025-06-24,2025-06-24,2025-06-24,2025-06-24
Dal 07-07-2025 al 08-07-2025,"Trasporto merci su rotaia, Trasporto pubblico locale, Trasporto ferroviario, PLURISETTORIALE TRASPORTI",AZIENDE CHE SVOLGONO ATTIVITA FERROVIARIA,Cub Trasporti,NAZIONALE,dalle ore 21.00 del 7/07 alle ore 18.00 dell' 8/07,https://www.cgsse.it/calendario-scioperi/dettaglio-sciopero/368903,false,2025-07-07,2025-07-08,2025-07-07,
01-07-2025,Elettricità,GRUPPO ACEA,"Filctem Cgil, Femca Cisl, Flaei Cisl, Uiltec Uil",ROMA,ultime 4 ore di lavoro per ogni turno,https://www.cgsse.it/calendario-scioperi/dettaglio-sciopero/368901,true,2025-07-01,2025-07-01,2025-07-01,2025-07-01
13-06-2025,Igiene ambientale,AMBIENTE ENERGIA E TERRITORIO,Fit Cisl,VALMONTONE,intero turno di lavoro,https://www.cgsse.it/calendario-scioperi/dettaglio-sciopero/368896,false,2025-06-13,2025-06-13,2025-06-13,2025-06-13
26-06-2025,Trasporto pubblico locale,AUTOGUIDOVIE,"Filt Cgil, Fit Cisl, Uiltrasporti, Ugl","BOLOGNA , MILANO , PAVIA , CREMONA , MONZA E DELLA BRIANZA, MANTOVA , LODI",dalle ore 8.30 alle ore 12.30,https://www.cgsse.it/calendario-scioperi/dettaglio-sciopero/368890,true,2025-06-26,2025-06-26,2025-06-26,2025-06-26
13-06-2025,Igiene ambientale,AMBIENTE ENERGIA E TERRITORIO,"Fp Cgil, Uiltrasporti, Fiadel",VALMONTONE,intero turno di lavoro,https://www.cgsse.it/calendario-scioperi/dettaglio-sciopero/368871,false,2025-06-13,2025-06-13,2025-06-13,2025-06-13
13-07-2025,Trasporto pubblico locale,TPL LINEA,"Filt Cgil, Fit Cisl, Uiltrasporti, Faisa Cisal, Ugl Fna, Sial Cobas",SAVONA,da inizio turno alle ore 5.00 dalle 8.30 alle 17.30 e dalle 20.00 a fine turno,https://www.cgsse.it/calendario-scioperi/dettaglio-sciopero/368867,true,2025-07-13,2025-07-13,2025-07-13,2025-07-13
Dal 25-06-2025 al 03-07-2025,Avvocati,SETTORE GIUSTIZIA,Camera Penale Di Nocera Inferiore,NOCERA INFERIORE,"astensione dalle udienze e da ogni attività giudiziaria nel settore penale per i giorni 25, 26, 27, 28, 30 giugno e 1, 2, 3 luglio 2025",https://www.cgsse.it/calendario-scioperi/dettaglio-sciopero/368859,false,2025-06-25,2025-07-03,2025-06-25,
26-06-2025,Servizio sanitario nazionale,"COOPLAT, CTS, REKEEP",Filcams Cgil,EMPOLI,intera giornata,https://www.cgsse.it/calendario-scioperi/dettaglio-sciopero/368844,true,2025-06-26,2025-06-26,2025-06-26,2025-06-26
24-06-2025,Igiene ambientale,MONTECO,"Fp Cgil, Fit Cisl, Fiadel, Uiltrasporti",LECCE,dalle ore 00.00 alle ore 23.59,https://www.cgsse.it/calendario-scioperi/dettaglio-sciopero/368820,true,2025-06-24,2025-06-24,2025-06-24,2025-06-24
Dal 31-05-2025 al 07-06-2025,Carburanti,"GALDIERI & FIGLI, ITALIANA PETROLI",Comitato Spontaneo,SALERNO,,https://www.cgsse.it/calendario-scioperi/dettaglio-sciopero/368814,false,2025-05-31,2025-06-07,2025-05-31,
23-06-2025,Igiene ambientale,ECOBURGUS,Fiadel Cisal,CARINI,4 ore,https://www.cgsse.it/calendario-scioperi/dettaglio-sciopero/368811,true,2025-06-23,2025-06-23,2025-06-23,2025-06-23
05-07-2025,Trasporto pubblico locale,ARST,Orsa,"SASSARI , NUORO , CAGLIARI , ORISTANO",intera giornata,https://www.cgsse.it/calendario-scioperi/dettaglio-sciopero/368789,false,2025-07-05,2025-07-05,2025-07-05,2025-07-05
21-06-2025,Regioni e autonomie Locali,COMUNE DI ALCAMO,Fp Cgil,ALCAMO,dalle ore 00.00 alle ore 24.00 del personale della polizia municipale,https://www.cgsse.it/calendario-scioperi/dettaglio-sciopero/368787,true,2025-06-21,2025-06-21,2025-06-21,2025-06-21
20-06-2025,Servizio sanitario nazionale,ISTITUTO ORTOPEDICO RIZZOLI,Fp Cgil,BAGHERIA,intera giornata,https://www.cgsse.it/calendario-scioperi/dettaglio-sciopero/368781,false,2025-06-20,2025-06-20,2025-06-20,2025-06-20
23-06-2025,Avvocati,SETTORE GIUSTIZIA,Camera Penale Di Santa Maria Capua Vetere,SANTA MARIA CAPUA VETERE,astensione dalle udienze e dalle attività giudiziarie nel settore penale,https://www.cgsse.it/calendario-scioperi/dettaglio-sciopero/368779,false,2025-06-23,2025-06-23,2025-06-23,2025-06-23
Dal 23-06-2025 al 24-06-2025,Regioni e autonomie Locali,LIFE PROJECT,Sul,REGGIO DI CALABRIA,intere giornate,https://www.cgsse.it/calendario-scioperi/dettaglio-sciopero/368777,false,2025-06-23,2025-06-24,2025-06-23,
23-06-2025,Ministeri,"ADECCO, RANDSTAD","Felsa Cisl, Nidil Cgil, Uiltemp",NAZIONALE,intera giornata,https://www.cgsse.it/calendario-scioperi/dettaglio-sciopero/368741,true,2025-06-23,2025-06-23,2025-06-23,2025-06-23
10-07-2025,Trasporto aereo,SWISSPORT ITALIA,Fit Cisl,MILANO,24 ore,https://www.cgsse.it/calendario-scioperi/dettaglio-sciopero/368736,false,2025-07-10,2025-07-10,2025-07-10,2025-07-10
10-07-2025,Trasporto aereo,SWISSPORT ITALIA,Filt Cgil,MILANO,24 ore,https://www.cgsse.it/calendario-scioperi/dettaglio-sciopero/368734,false,2025-07-10,2025-07-10,2025-07-10,2025-07-10
20-07-2025,Trasporto ferroviario,SALA BLU RFI,Orsa Trasporti,MILANO,dalle ore 9.00 alle ore 16.59,https://www.cgsse.it/calendario-scioperi/dettaglio-sciopero/368732,false,2025-07-20,2025-07-20,2025-07-20,2025-07-20
20-06-2025,Servizio sanitario nazionale,ISTITUTO ORTOPEDICO RIZZOLI,Fp Cgil,BAGHERIA,intera giornata,https://www.cgsse.it/calendario-scioperi/dettaglio-sciopero/368720,true,2025-06-20,2025-06-20,2025-06-20,2025-06-20
20-06-2025,Trasporto pubblico locale,ARST,Orsa,"SASSARI , NUORO , CAGLIARI , ORISTANO",intera giornata,https://www.cgsse.it/calendario-scioperi/dettaglio-sciopero/368718,true,2025-06-20,2025-06-20,2025-06-20,2025-06-20
10-07-2025,Trasporto aereo,SWISSPORT ITALIA,Uiltrasporti,MILANO,24 ore,https://www.cgsse.it/calendario-scioperi/dettaglio-sciopero/368714,false,2025-07-10,2025-07-10,2025-07-10,2025-07-10
14-07-2025,Telecomunicazioni,ASSTEL,Ugl Telecomunicazioni,NAZIONALE,intera giornata,https://www.cgsse.it/calendario-scioperi/dettaglio-sciopero/368682,false,2025-07-14,2025-07-14,2025-07-14,2025-07-14
24-06-2025,Servizio sanitario nazionale,IRCSS GIOVANNI PAOLO II,Usppi,BARI,intera giornata,https://www.cgsse.it/calendario-scioperi/dettaglio-sciopero/368680,true,2025-06-24,2025-06-24,2025-06-24,2025-06-24
20-06-2025,Trasporto merci su rotaia,CAPTRAIN ITALIA,"Filt Cgil, Fit Cisl, Uiltrasporti",NAZIONALE,dalle ore 13.00 alle ore 21.00,https://www.cgsse.it/calendario-scioperi/dettaglio-sciopero/368671,false,2025-06-20,2025-06-20,2025-06-20,2025-06-20
10-07-2025,Trasporto aereo,ROMEO GESTIONI,"Filt Cgil, Fit Cisl, Ugl Ta, Usb Lavoro Privato",NAPOLI,dalle ore 11.00 alle ore 15.00,https://www.cgsse.it/calendario-scioperi/dettaglio-sciopero/368658,false,2025-07-10,2025-07-10,2025-07-10,2025-07-10
Dal 20-07-2025 al 21-07-2025,Trasporto ferroviario,TRENITALIA,Orsa Trasporti,"PIEMONTE, VALLE D'AOSTA",dalle ore 3.00 del 20/07 alle ore 2.00 del 21/07,https://www.cgsse.it/calendario-scioperi/dettaglio-sciopero/368651,false,2025-07-20,2025-07-21,2025-07-20,
01-07-2025,Elicotteri,ELILOMBARDIA,Uiltrasporti,NAZIONALE,dalle ore 10:00 alle ore 18:00 per tutto il personale (tecnici e piloti),https://www.cgsse.it/calendario-scioperi/dettaglio-sciopero/368625,false,2025-07-01,2025-07-01,2025-07-01,2025-07-01
01-07-2025,Elicotteri,ELILOMBARDIA,Uiltrasporti,NAZIONALE,dalle ore 10:00 alle ore 18:00 per tutto il personale (tecnici e piloti),https://www.cgsse.it/calendario-scioperi/dettaglio-sciopero/368625,true,2025-07-01,2025-07-01,2025-07-01,2025-07-01
20-06-2025,Elettricità,ENEL,"Filctem Cgil, Flaei Cisl, Uiltec Uil",FIRENZE,intera giornata,https://www.cgsse.it/calendario-scioperi/dettaglio-sciopero/368619,false,2025-06-20,2025-06-20,2025-06-20,2025-06-20
24-06-2025,Elicotteri,ELILOMBARDIA,Uiltrasporti,NAZIONALE,dalle ore 10:00 alle ore 18:00 per tutto il personale (tecnici e piloti),https://www.cgsse.it/calendario-scioperi/dettaglio-sciopero/368602,true,2025-06-24,2025-06-24,2025-06-24,2025-06-24
20-06-2025,Elettricità,"E-DISTRIBUZIONE, ENEL","Filctem Cgil, Flaei Cisl, Uiltec Uil",NAZIONALE,’intera giornata,https://www.cgsse.it/calendario-scioperi/dettaglio-sciopero/368593,false,2025-06-20,2025-06-20,2025-06-20,2025-06-20
Dal 07-07-2025 al 08-07-2025,Trasporto ferroviario,"GRUPPO FSI, MERCITALIA RAIL, TRENITALIA, TRENITALIA TPER SCARL",Assemblea Nazionale Pdm/pdb,NAZIONALE,dalle ore 21.00 del 7/07 alle ore 18.00 dell' 8/07,https://www.cgsse.it/calendario-scioperi/dettaglio-sciopero/368578,false,2025-07-07,2025-07-08,2025-07-07,
Dal 07-07-2025 al 08-07-2025,Trasporto ferroviario,"GRUPPO FSI, MERCITALIA RAIL, TRENITALIA, TRENITALIA TPER SCARL",Assemblea Nazionale Pdm/pdb,NAZIONALE,dalle ore 21.00 del 7/07 alle ore 18.00 dell' 8/07,https://www.cgsse.it/calendario-scioperi/dettaglio-sciopero/368578,true,2025-07-07,2025-07-08,2025-07-07,
21-06-2025,Vigili del fuoco,MINISTERO DELL'INTERNO,"Conapo, Uil Pa, Fp Cgil, Confsal, Usb, Fns Cisl, Federdistat Cisal",PIEMONTE,dalle ore 9.00 alle ore 13.00,https://www.cgsse.it/calendario-scioperi/dettaglio-sciopero/368564,true,2025-06-21,2025-06-21,2025-06-21,2025-06-21
14-07-2025,Telecomunicazioni,ASSTEL,"Slc Cgil, Fistel Cisl, Uilcom Uil",NAZIONALE,intera giornata,https://www.cgsse.it/calendario-scioperi/dettaglio-sciopero/368557,false,2025-07-14,2025-07-14,2025-07-14,2025-07-14
18-07-2025,Trasporto pubblico locale,NET (NORD EST TRASPORTI),Al Cobas,"MONZA, TREZZO SULL'ADDA","dalle ore 18,00 alle ore 22,00 personale viaggiante urbano monza ed extraurbano trezzo",https://www.cgsse.it/calendario-scioperi/dettaglio-sciopero/368548,false,2025-07-18,2025-07-18,2025-07-18,2025-07-18
20-06-2025,Trasporto aereo,ROMEO GESTIONI,"Filt Cgil, Fit Cisl, Ugl Ta, Usb Lavoro Privato",NAPOLI,dalle ore 11.00 alle ore 15.00,https://www.cgsse.it/calendario-scioperi/dettaglio-sciopero/368526,true,2025-06-20,2025-06-20,2025-06-20,2025-06-20
20-06-2025,Generale nazionale,TUTTE LE CATEGORIE PUBBLICHE E PRIVATE,Si Cobas,NAZIONALE,"intera giornata. per i vigili del fuoco dalle ore 9.00 alle ore 13.00, per i lavoratori delle ferrovie dalle 21.00 del 19/06 alle 21.00 del 20/06",https://www.cgsse.it/calendario-scioperi/dettaglio-sciopero/368513,false,2025-06-20,2025-06-20,2025-06-20,2025-06-20
20-06-2025,Metalmeccanici,AZIENDE DEL SETTORE CCNL FEDERMECCANICA/ASSITAL,"Fim Cisl, Fiom Cgil, Uilm Uil",NAZIONALE,8 ore di sciopero per l’intera giornata o turno di lavoro,https://www.cgsse.it/calendario-scioperi/dettaglio-sciopero/368491,false,2025-06-20,2025-06-20,2025-06-20,2025-06-20
13-06-2025,Servizio sanitario nazionale,ISTITUTO ORTOPEDICO RIZZOLI,Fp Cgil,BAGHERIA,intera giornata,https://www.cgsse.it/calendario-scioperi/dettaglio-sciopero/368486,true,2025-06-13,2025-06-13,2025-06-13,2025-06-13
13-06-2025,Istituti di vigilanza,ANCR SECURITY,"Filcams Cgil, Fisascat Cisl, Uiltucs",CATANIA,,https://www.cgsse.it/calendario-scioperi/dettaglio-sciopero/368461,false,2025-06-13,2025-06-13,2025-06-13,2025-06-13
10-07-2025,Trasporto aereo,SWISSPORT ITALIA,Cub Trasporti,MILANO,dalle ore 00.00 alle ore 23.59,https://www.cgsse.it/calendario-scioperi/dettaglio-sciopero/368436,false,2025-07-10,2025-07-10,2025-07-10,2025-07-10
30-06-2025,Regioni e autonomie Locali,"ASILI NIDO, SCUOLE COMUNALI",Csle,NAZIONALE,intera giornata,https://www.cgsse.it/calendario-scioperi/dettaglio-sciopero/368434,false,2025-06-30,2025-06-30,2025-06-30,2025-06-30
18-04-2025,Trasporto aereo,ROMEO GESTIONI,"Ugl Ta, Filt Cgil, Fit Cisl, Usb",NAPOLI,dalle ore 11.00 alle ore 15.00 lavoratori operanti presso l'appalto gesac dell'aeroporto di capodichino,https://www.cgsse.it/calendario-scioperi/dettaglio-sciopero/368432,false,2025-04-18,2025-04-18,2025-04-18,2025-04-18
20-06-2025,Generale nazionale,TUTTE LE CATEGORIE PUBBLICHE E PRIVATE,Flai,NAZIONALE,"intera giornata. per i vigili del fuoco dalle ore 9.00 alle ore 13.00, per i lavoratori delle ferrovie dalle 21.00 del 19/06 alle 20.59 del 20/06, per i lavoratori delle autostrade dalle 22.00 del 19/06 alle 21.59 del 20/06",https://www.cgsse.it/calendario-scioperi/dettaglio-sciopero/368427,true,2025-06-20,2025-06-20,2025-06-20,2025-06-20
30-06-2025,Servizio sanitario nazionale,ASL VCO,Uil Fpl,VERBANO-CUSIO-OSSOLA,intera giornata o turno di lavoro],https://www.cgsse.it/calendario-scioperi/dettaglio-sciopero/368390,false,2025-06-30,2025-06-30,2025-06-30,2025-06-30
20-06-2025,Generale nazionale,TUTTE LE CATEGORIE PUBBLICHE E PRIVATE,"Proclamante: Sgb, Cub, Usb
Aderente:S.b.m. Sindacato Di Base Multicategoriale, Fi-si, Fisi",NAZIONALE,"per i vvf dalle 9.00 alle 13.00, per i lavoratori delle ferrovie dalle 21.00 del 19/06 alle 20.59 del 20/06, per i lav.ri delle autostrade dalle 22.00 del 19/06 alle 21.59 del 20/06.per il ssn sono escluse le coop.ve kos care e kos servizi.",https://www.cgsse.it/calendario-scioperi/dettaglio-sciopero/368388,false,2025-06-20,2025-06-20,2025-06-20,2025-06-20
26-07-2025,Trasporto aereo,"COMPARTO AEREO, AEROPORTUALE E INDOTTO DEGLI AEROPORTI",Cub Trasporti,NAZIONALE,dalle ore 13.00 alle ore 17.00,https://www.cgsse.it/calendario-scioperi/dettaglio-sciopero/368382,false,2025-07-26,2025-07-26,2025-07-26,2025-07-26
20-06-2025,Regioni e autonomie Locali,COMUNE DI GENOVA,Fp Cgil,GENOVA,intera giornata,https://www.cgsse.it/calendario-scioperi/dettaglio-sciopero/368377,false,2025-06-20,2025-06-20,2025-06-20,2025-06-20
18-06-2025,Servizio sanitario nazionale,"KOS CARE , KOS SERVIZI",Fp Cgil,PARMA,prime 2 ore di ogni turno,https://www.cgsse.it/calendario-scioperi/dettaglio-sciopero/368375,false,2025-06-18,2025-06-18,2025-06-18,2025-06-18
10-07-2025,Trasporto aereo,SEA,Cub Trasporti,"VARESE , MILANO",dalle ore 00.00 alle ore 23.59 personale autisti aeroporti di linate e malpensa,https://www.cgsse.it/calendario-scioperi/dettaglio-sciopero/368368,false,2025-07-10,2025-07-10,2025-07-10,2025-07-10
07-07-2025,Trasporto pubblico locale,ATC,Cub Trasporti,LA SPEZIA,dalle ore 11.00 alle ore 15.00,https://www.cgsse.it/calendario-scioperi/dettaglio-sciopero/368363,false,2025-07-07,2025-07-07,2025-07-07,2025-07-07
10-07-2025,Trasporto aereo,AVIATION SERVICE,Flai Trasporti E Servizi,VENEZIA,24 ore,https://www.cgsse.it/calendario-scioperi/dettaglio-sciopero/368350,false,2025-07-10,2025-07-10,2025-07-10,2025-07-10
10-07-2025,Trasporto aereo,ASSOHANDLERS,Flai Trasporti E Servizi,NAZIONALE,24 ore,https://www.cgsse.it/calendario-scioperi/dettaglio-sciopero/368346,false,2025-07-10,2025-07-10,2025-07-10,2025-07-10
13-06-2025,Istituti di vigilanza,AZIENDE DEL SETTORE,"Filcams Cgil, Fisascat Cisl, Uiltucs",TOSCANA,sciopero di 2 ore con astensione dalla prestazione lavorativa durante la terza e la quarta ora di tutti i turni che avranno inizio nella fascia oraria compresa tra le ore 00.00 e le ore 24:00,https://www.cgsse.it/calendario-scioperi/dettaglio-sciopero/368344,false,2025-06-13,2025-06-13,2025-06-13,2025-06-13
20-06-2025,Servizio sanitario nazionale,OSPEDALE SAN RAFFAELE MILANO,Usi Sanità,MILANO,intera giornata del personale non medico e non dirigente,https://www.cgsse.it/calendario-scioperi/dettaglio-sciopero/368335,false,2025-06-20,2025-06-20,2025-06-20,2025-06-20
20-06-2025,Servizio sanitario nazionale,SANITASERVICE ASL FG,Uil Fpl,FOGGIA,intera giornata,https://www.cgsse.it/calendario-scioperi/dettaglio-sciopero/368327,true,2025-06-20,2025-06-20,2025-06-20,2025-06-20
09-06-2025,Metalmeccanici,ROMEO GESTIONI,"Fiom Cgil, Fim Cisl",NAPOLI,8 ore,https://www.cgsse.it/calendario-scioperi/dettaglio-sciopero/368317,false,2025-06-09,2025-06-09,2025-06-09,2025-06-09
20-06-2025,Trasporto aereo,AVIATION SERVICE,Flai Trasporti E Servizi,VENEZIA,24 ore,https://www.cgsse.it/calendario-scioperi/dettaglio-sciopero/368309,true,2025-06-20,2025-06-20,2025-06-20,2025-06-20
20-06-2025,Trasporto aereo,ASSOHANDLERS,Flai Trasporti E Servizi,NAZIONALE,24 ore,https://www.cgsse.it/calendario-scioperi/dettaglio-sciopero/368305,true,2025-06-20,2025-06-20,2025-06-20,2025-06-20
09-06-2025,Trasporto merci su rotaia,MEDWAY ITALIA,Usb Lavoro Privato,LOMBARDIA,dalle ore 16:00 alle ore 23:59,https://www.cgsse.it/calendario-scioperi/dettaglio-sciopero/368299,false,2025-06-09,2025-06-09,2025-06-09,2025-06-09
20-06-2025,Servizio sanitario nazionale,OSPEDALE SAN RAFFAELE MILANO,"Proclamante:Rsu
Aderente:Fp Cgil, Fp Cisl, Fpl Uil, Cub Sanità",MILANO,intera giornata del personale non medico e non dirigente,https://www.cgsse.it/calendario-scioperi/dettaglio-sciopero/368294,false,2025-06-20,2025-06-20,2025-06-20,2025-06-20
20-06-2025,Elettricità,ENEL GREEN POWER,Ugl Chimici,LOMBARDIA,prime 4 ore della giornata lavorativa,https://www.cgsse.it/calendario-scioperi/dettaglio-sciopero/368287,true,2025-06-20,2025-06-20,2025-06-20,2025-06-20
06-06-2025,Pulizie e multiservizi,MAXSIMA,Fisascat Cisl,NAPOLI,intera giornata,https://www.cgsse.it/calendario-scioperi/dettaglio-sciopero/368284,true,2025-06-06,2025-06-06,2025-06-06,2025-06-06
24-06-2025,Avvocati,SETTORE GIUSTIZIA,Unione Regionale Degli Ordini Forensi Della Sardegna,SARDEGNA,"astensione dalle udienze civili, penali e amministrative",https://www.cgsse.it/calendario-scioperi/dettaglio-sciopero/368279,false,2025-06-24,2025-06-24,2025-06-24,2025-06-24
06-06-2025,Metalmeccanici,ROMEO GESTIONI,"Fiom Cgil, Fim Cisl",NAPOLI,8 ore,https://www.cgsse.it/calendario-scioperi/dettaglio-sciopero/368277,true,2025-06-06,2025-06-06,2025-06-06,2025-06-06
20-06-2025,Generale nazionale,TUTTE LE CATEGORIE PUBBLICHE E PRIVATE,S.b.m. Sindacato Di Base Multicategoriale,NAZIONALE,"intera giornata. per i vigili del fuoco dalle ore 8.00 alle ore 14.00, per i lavoratori delle ferrovie dalle 21.00 del 19/06 alle 21.00 del 20/06, per i lavoratori delle autostrade dalle 22.00 del 19/06 alle 22.00 del 20/06",https://www.cgsse.it/calendario-scioperi/dettaglio-sciopero/368274,true,2025-06-20,2025-06-20,2025-06-20,2025-06-20
20-06-2025,Elettricità,ENEL GREEN POWER,"Filctem Cgil, Flaei Cisl, Uiltec Uil","SONDRIO , BERGAMO , BRESCIA",4 ore,https://www.cgsse.it/calendario-scioperi/dettaglio-sciopero/368261,true,2025-06-20,2025-06-20,2025-06-20,2025-06-20
Dal 26-05-2025 al 27-05-2025,Regioni e autonomie Locali,COOPERATIVA ANIMAZIONE VALDOCCO,Cub Sanità,TORINO,intero turni di lavoro,https://www.cgsse.it/calendario-scioperi/dettaglio-sciopero/368242,false,2025-05-26,2025-05-27,2025-05-26,
09-06-2025,Trasporto merci su rotaia,CAPTRAIN ITALIA,"Filt Cgil, Fit Cisl, Uiltrasporti",NAZIONALE,dalle ore 16.00 alle ore 23.59,https://www.cgsse.it/calendario-scioperi/dettaglio-sciopero/368238,true,2025-06-09,2025-06-09,2025-06-09,2025-06-09
04-07-2025,Igiene ambientale,"JOB ITALIA, SAM","Fiadel, Fp Cgil",PAGANI,intera giornata,https://www.cgsse.it/calendario-scioperi/dettaglio-sciopero/368168,false,2025-07-04,2025-07-04,2025-07-04,2025-07-04
20-06-2025,Igiene ambientale,"DM TECHNOLOGY, WM MAGENTA",Flaica Cub,CASTEL VOLTURNO,dalle ore 00.01 del 12/06 alle ore 23.59 del 13/06,https://www.cgsse.it/calendario-scioperi/dettaglio-sciopero/368162,false,2025-06-20,2025-06-20,2025-06-20,2025-06-20
06-06-2025,Istituti di vigilanza,BTV,"Filcams Cgil, Fisascat Cisl, Uiltcs",REGGIO NELL'EMILIA,intera giornata,https://www.cgsse.it/calendario-scioperi/dettaglio-sciopero/368149,true,2025-06-06,2025-06-06,2025-06-06,2025-06-06
26-07-2025,Trasporto aereo,"COMPARTO AEREO, AEROPORTUALE E INDOTTO DEGLI AEROPORTI",Cub Trasporti,NAZIONALE,dalle ore 13.00 alle ore 17.00,https://www.cgsse.it/calendario-scioperi/dettaglio-sciopero/368101,true,2025-07-26,2025-07-26,2025-07-26,2025-07-26
09-06-2025,Trasporto pubblico locale,ATC,Cub Trasporti,LA SPEZIA,dalle ore 11.00 alle ore 15.00,https://www.cgsse.it/calendario-scioperi/dettaglio-sciopero/368099,true,2025-06-09,2025-06-09,2025-06-09,2025-06-09
Dal 30-06-2025 al 01-07-2025,Igiene ambientale,GEOFOR,Rsu,PISA,intere giornate,https://www.cgsse.it/calendario-scioperi/dettaglio-sciopero/368083,false,2025-06-30,2025-07-01,2025-06-30,
20-06-2025,Metalmeccanici,AZIENDE DEL COMPARTO,"Fiom Cgil, Uilm Uil, Fim Cisl",TRENTO,intera giornata,https://www.cgsse.it/calendario-scioperi/dettaglio-sciopero/368061,false,2025-06-20,2025-06-20,2025-06-20,2025-06-20
04-06-2025,Trasporto merci su rotaia,CAPTRAIN ITALIA,"Filt Cgil, Fit Cisl, Uiltrasporti",NAZIONALE,dalle ore 16.00 alle ore 23.59,https://www.cgsse.it/calendario-scioperi/dettaglio-sciopero/368057,true,2025-06-04,2025-06-04,2025-06-04,2025-06-04
03-06-2025,Poste,POSTE ITALIANE,Cobas Poste,ROMA,intero turno di lavoro a decorrere dal primo turno montante notturno,https://www.cgsse.it/calendario-scioperi/dettaglio-sciopero/368049,false,2025-06-03,2025-06-03,2025-06-03,2025-06-03
05-06-2025,Metalmeccanici,AZIENDE DEL COMPARTO,"Fiom Cgil, Uilm Uil, Fim Cisl",TRENTO,ultime 4 ore di ciascun turno di lavoro,https://www.cgsse.it/calendario-scioperi/dettaglio-sciopero/368045,false,2025-06-05,2025-06-05,2025-06-05,2025-06-05
17-07-2025,Trasporto marittimo,CARONTE & TOURIST,"Rsu, Filt Cgil, Fit Cisl, Uiltrasporti, Uslac-Uncdim-Smacd, Federmar Cisal, Confintesa","MESSINA, REGGIO DI CALABRIA",dalle ore 9.00 alle ore 17.00,https://www.cgsse.it/calendario-scioperi/dettaglio-sciopero/368021,true,2025-07-17,2025-07-17,2025-07-17,2025-07-17
03-06-2025,Poste,POSTE ITALIANE,"Cobas Poste, Cub Poste, Slg Cub Poste",NAZIONALE,intero turno di lavoro,https://www.cgsse.it/calendario-scioperi/dettaglio-sciopero/368009,false,2025-06-03,2025-06-03,2025-06-03,2025-06-03
Dal 07-07-2025 al 08-07-2025,"Trasporto merci su rotaia, Trasporto pubblico locale, Trasporto ferroviario, PLURISETTORIALE TRASPORTI",AZIENDE CHE SVOLGONO ATTIVITA FERROVIARIA,Cub Trasporti,NAZIONALE,dalle ore 21.00 del 7/07 alle ore 18.00 dell' 8/07,https://www.cgsse.it/calendario-scioperi/dettaglio-sciopero/368003,true,2025-07-07,2025-07-08,2025-07-07,
11-06-2025,Pulizie e multiservizi,DUSSMANN SERVICE,"Filcams Cgil, Fisascat Cisl","NOALE, DOLO, MIRANO",intera giornata e/o turno di lavoro,https://www.cgsse.it/calendario-scioperi/dettaglio-sciopero/368001,true,2025-06-11,2025-06-11,2025-06-11,2025-06-11
Dal 09-06-2025 al 11-06-2025,Avvocati,SETTORE GIUSTIZIA,Ordine Distrettuale Degli Avvocati L'aquila,L'AQUILA,astensione dall'attività giudiziaria degli avvocati,https://www.cgsse.it/calendario-scioperi/dettaglio-sciopero/367985,false,2025-06-09,2025-06-11,2025-06-09,
20-06-2025,Ministeri,SLEM,Fisascat Cisl,"AVERSA, CARINOLA, SANTA MARIA CAPUA VETERE",intera giornata,https://www.cgsse.it/calendario-scioperi/dettaglio-sciopero/367976,true,2025-06-20,2025-06-20,2025-06-20,2025-06-20
04-06-2025,Trasporto pubblico locale,AUTOLINEE TOSCANE,Cobas Lavoro Privato,"PRATO , PISTOIA , FIRENZE",dalle ore 17:30 alle ore 21:30,https://www.cgsse.it/calendario-scioperi/dettaglio-sciopero/367972,false,2025-06-04,2025-06-04,2025-06-04,2025-06-04
Dal 15-06-2025 al 16-06-2025,Istituti di vigilanza,AZIENDE DEL SETTORE,"Filcams Cgil, Fisascat Cisl, Uiltucs",PUGLIA,intero turno di lavoro dalle ore 00.00 del 15/06 alle ore 24.00 del 16/06,https://www.cgsse.it/calendario-scioperi/dettaglio-sciopero/367949,false,2025-06-15,2025-06-16,2025-06-15,
03-06-2025,Poste,POSTE ITALIANE,"Slc Cgil, Uilposte",NAZIONALE,intero turno di lavoro,https://www.cgsse.it/calendario-scioperi/dettaglio-sciopero/367945,false,2025-06-03,2025-06-03,2025-06-03,2025-06-03
03-06-2025,Trasporto pubblico locale,ARST,Orsa,"SASSARI , NUORO , CAGLIARI , ORISTANO",settore automobilistico tutte le sedi territoriali: dalle ore 16.44 alle ore 20.44. trenino verde tutte le sedi territoriali: dalle 18.00 alle 22.00. settore metro tranviario cagliari: dalle 18.41 alle 22.41 metro tranviario sassari dalle 17.10 alle 21.10,https://www.cgsse.it/calendario-scioperi/dettaglio-sciopero/367939,false,2025-06-03,2025-06-03,2025-06-03,2025-06-03
03-06-2025,Telecomunicazioni,NETWORK CONTACTS,"Slc Cgil, Fistel Cisl, Uilcom Uil, Ugl Comunicazioni",CROTONE,intero turno di lavoro,https://www.cgsse.it/calendario-scioperi/dettaglio-sciopero/367935,false,2025-06-03,2025-06-03,2025-06-03,2025-06-03
23-06-2025,Servizio sanitario nazionale,ASL VCO,Uil Fpl,VERBANO-CUSIO-OSSOLA,intera giornata o turno di lavoro],https://www.cgsse.it/calendario-scioperi/dettaglio-sciopero/367930,true,2025-06-23,2025-06-23,2025-06-23,2025-06-23
Dal 12-06-2025 al 13-06-2025,Igiene ambientale,"DM TECHNOLOGY, WM MAGENTA",Flaica Cub,CASTEL VOLTURNO,dalle ore 00.01 del 12/06 alle ore 23.59 del 13/06,https://www.cgsse.it/calendario-scioperi/dettaglio-sciopero/367928,true,2025-06-12,2025-06-13,2025-06-12,
20-06-2025,Generale nazionale,TUTTE LE CATEGORIE PUBBLICHE E PRIVATE,Sgb,NAZIONALE,"intera giornata. per i vigili del fuoco dalle ore 8.00 alle ore 14.00, per i lavoratori delle ferrovie dalle 21.00 del 19/06 alle 21.00 del 20/06, per i lavoratori delle autostrade dalle 22.00 del 19/06 alle 22.00 del 20/06",https://www.cgsse.it/calendario-scioperi/dettaglio-sciopero/367889,true,2025-06-20,2025-06-20,2025-06-20,2025-06-20
04-06-2025,Igiene ambientale,DM TECHNOLOGY,"Fp Cgil, Fit Cisl",MARIGLIANO,interi turni di lavoro,https://www.cgsse.it/calendario-scioperi/dettaglio-sciopero/367877,false,2025-06-04,2025-06-04,2025-06-04,2025-06-04
06-07-2025,Trasporto aereo,MODITECH,"Fiom Cgil, Uilm Uil",ROMA,dalle ore 13.00 alle ore 17.00,https://www.cgsse.it/calendario-scioperi/dettaglio-sciopero/367858,false,2025-07-06,2025-07-06,2025-07-06,2025-07-06
03-06-2025,Trasporto ferroviario,RFI,Cub Trasporti,NAZIONALE,dalle ore 00.00 alle ore 23.00,https://www.cgsse.it/calendario-scioperi/dettaglio-sciopero/367854,false,2025-06-03,2025-06-03,2025-06-03,2025-06-03
20-06-2025,Generale nazionale,TUTTE LE CATEGORIE PUBBLICHE E PRIVATE,"Proclamante:Cub
Aderente:Fisi",NAZIONALE,"intera giornata. per i vigili del fuoco dalle ore 8.00 alle ore 14.00, per i lavoratori delle ferrovie dalle 21.00 del 19/06 alle 21.00 del 20/06, per i lavoratori delle autostrade dalle 22.00 del 19/06 alle 22.00 del 20/06",https://www.cgsse.it/calendario-scioperi/dettaglio-sciopero/367844,true,2025-06-20,2025-06-20,2025-06-20,2025-06-20
13-06-2025,Servizio sanitario nazionale,OSPEDALE SAN RAFFAELE MILANO,Usi Sanità,MILANO,intera giornata del personale non medico e non dirigente,https://www.cgsse.it/calendario-scioperi/dettaglio-sciopero/367829,true,2025-06-13,2025-06-13,2025-06-13,2025-06-13
30-05-2025,Trasporto marittimo,CARONTE & TOURIST,"Rsu, Filt Cgil, Fit Cisl, Uiltrasporti, Uslac-Uncdim-Smacd, Federmar Cisal, Confintesa","MESSINA, REGGIO DI CALABRIA",dalle ore 9.00 alle ore 17.00,https://www.cgsse.it/calendario-scioperi/dettaglio-sciopero/367785,true,2025-05-30,2025-05-30,2025-05-30,2025-05-30
16-06-2025,Regioni e autonomie Locali,COMUNE DI GENOVA,Fp Cgil,GENOVA,intera giornata,https://www.cgsse.it/calendario-scioperi/dettaglio-sciopero/367772,true,2025-06-16,2025-06-16,2025-06-16,2025-06-16
03-06-2025,Igiene ambientale,"ICOS, SEA",Fp Cgil,ARAGONA,intera giornata o turno di lavoro,https://www.cgsse.it/calendario-scioperi/dettaglio-sciopero/367770,true,2025-06-03,2025-06-03,2025-06-03,2025-06-03
13-06-2025,Servizio sanitario nazionale,OSPEDALE SAN RAFFAELE MILANO,Rsu,MILANO,intera giornata del personale non medico e non dirigente,https://www.cgsse.it/calendario-scioperi/dettaglio-sciopero/367762,true,2025-06-13,2025-06-13,2025-06-13,2025-06-13
30-05-2025,Trasporto pubblico locale,TUA,"Filt Cgil, Fit Cisl, Uiltrasporti, Faisa Cisal",ABRUZZO,intera giornata con le fasce garantite dalle ore 5.30 alle ore 8.30 e dalle ore 13.00 alle ore 16.00,https://www.cgsse.it/calendario-scioperi/dettaglio-sciopero/367754,true,2025-05-30,2025-05-30,2025-05-30,2025-05-30
Dal 16-06-2025 al 17-06-2025,Igiene ambientale,VELIA AMBIENTE,Filas,NOLA,intera giornata,https://www.cgsse.it/calendario-scioperi/dettaglio-sciopero/367747,true,2025-06-16,2025-06-17,2025-06-16,
16-06-2025,Elettricità,ENEL GREEN POWER,Ugl Chimici,LOMBARDIA,prime 4 ore della giornata lavorativa,https://www.cgsse.it/calendario-scioperi/dettaglio-sciopero/367744,true,2025-06-16,2025-06-16,2025-06-16,2025-06-16
29-05-2025,Ministeri,MINISTERO DELLA GIUSTIZIA,"Fp Cgil, Uil Pa",AOSTA,intera giornata o turno di lavoro,https://www.cgsse.it/calendario-scioperi/dettaglio-sciopero/367740,false,2025-05-29,2025-05-29,2025-05-29,2025-05-29
06-06-2025,Trasporto pubblico locale,SAD,Uilt Sgk,BOLZANO,fasce garantite dalle ore 9.00 alle ore 13.00 e dalle 19.00 alle 21.00,https://www.cgsse.it/calendario-scioperi/dettaglio-sciopero/367719,true,2025-06-06,2025-06-06,2025-06-06,2025-06-06
16-06-2025,Elettricità,ENEL GREEN POWER,"Filctem Cgil, Flaei Cisl, Uiltec Uil","SONDRIO , BERGAMO , BRESCIA",4 ore,https://www.cgsse.it/calendario-scioperi/dettaglio-sciopero/367710,true,2025-06-16,2025-06-16,2025-06-16,2025-06-16
28-05-2025,Taxi,TAXI,Taxi Bari S.c.,BARI,dalle ore 9.00 alle ore 21.00,https://www.cgsse.it/calendario-scioperi/dettaglio-sciopero/367704,false,2025-05-28,2025-05-28,2025-05-28,2025-05-28
28-05-2025,Taxi,TAXI,"Proclamante:Orsa Taxi
Aderente:Cobas Lavoro Privato",NAPOLI,dalle ore 8.00 alle ore 22.00,https://www.cgsse.it/calendario-scioperi/dettaglio-sciopero/367702,false,2025-05-28,2025-05-28,2025-05-28,2025-05-28
30-05-2025,Pulizie e multiservizi,MIORELLI SERVICE,Usb Lavoro Privato,TRENTO,intera giornata,https://www.cgsse.it/calendario-scioperi/dettaglio-sciopero/367698,false,2025-05-30,2025-05-30,2025-05-30,2025-05-30
28-05-2025,Pulizie e multiservizi,MIORELLI SERVICE,Usb Lavoro Privato,TRENTO,intera giornata,https://www.cgsse.it/calendario-scioperi/dettaglio-sciopero/367686,true,2025-05-28,2025-05-28,2025-05-28,2025-05-28
Dal 04-06-2025 al 05-06-2025,Trasporto merci su rotaia,GTS RAIL,"Filt Cgil, Fit Cisl, Uiltrasporti, Ugl Ferrovieri, Fast Confsal",NAZIONALE,dalle ore 16:01del 4/06 alle ore 16.00 del 5/06,https://www.cgsse.it/calendario-scioperi/dettaglio-sciopero/367674,false,2025-06-04,2025-06-05,2025-06-04,
Dal 08-06-2025 al 09-06-2025,Trasporto merci su rotaia,GTS RAIL,"Filt Cgil, Fit Cisl, Uiltrasporti, Ugl Ferrovieri, Fast Confsal",NAZIONALE,dalle ore 16:01del 8/06 alle ore 16.00 del 9/06,https://www.cgsse.it/calendario-scioperi/dettaglio-sciopero/367657,true,2025-06-08,2025-06-09,2025-06-08,
28-05-2025,Trasporto aereo,AIRPORT HANDLING,Usb Lavoro Privato,"MILANO, VARESE",dalle ore 13.00 alle 17.00,https://www.cgsse.it/calendario-scioperi/dettaglio-sciopero/367645,false,2025-05-28,2025-05-28,2025-05-28,2025-05-28
13-06-2025,Trasporto aereo,AVIATION SERVICE,Flai Trasporti E Servizi,VENEZIA,24 ore,https://www.cgsse.it/calendario-scioperi/dettaglio-sciopero/367643,true,2025-06-13,2025-06-13,2025-06-13,2025-06-13
26-05-2025,Igiene ambientale,GESAM,Usb Lavoro Privato,SANTA MARINELLA,intero turno dalle ore 6.00 alle ore 12.20 per il tueno di mattina e dalle 13.00 alle 19.20 per il turno pomeridiano,https://www.cgsse.it/calendario-scioperi/dettaglio-sciopero/367631,true,2025-05-26,2025-05-26,2025-05-26,2025-05-26
28-05-2025,Taxi,TAXI,"Proclamante:Usb Taxi
Aderente:Cobas Lavoro Privato",LAMEZIA TERME,dalle ore 8.00 alle ore 22.00,https://www.cgsse.it/calendario-scioperi/dettaglio-sciopero/367629,false,2025-05-28,2025-05-28,2025-05-28,2025-05-28
26-05-2025,Trasporto marittimo,CARONTE & TOURIST,"Rsu, Filt Cgil, Fit Cisl, Uiltrasporti, Uslac-Uncdim-Smacd, Federmar Cisal, Confintesa","MESSINA, REGGIO DI CALABRIA",dalle ore 9.00 alle ore 17.00,https://www.cgsse.it/calendario-scioperi/dettaglio-sciopero/367621,true,2025-05-26,2025-05-26,2025-05-26,2025-05-26
20-06-2025,Generale nazionale,TUTTE LE CATEGORIE PUBBLICHE E PRIVATE,"Proclamante:Usb
Aderente:Fi-si",NAZIONALE,intera giornata. per i vigili del fuoco dalle ore 8.00 alle ore 14.00,https://www.cgsse.it/calendario-scioperi/dettaglio-sciopero/367613,true,2025-06-20,2025-06-20,2025-06-20,2025-06-20
28-05-2025,Taxi,TAXI,"Proclamante:Usb Taxi
Aderente:Cobas Lavoro Privato",ROMA,dalle ore 8.00 alle ore 22.00,https://www.cgsse.it/calendario-scioperi/dettaglio-sciopero/367605,false,2025-05-28,2025-05-28,2025-05-28,2025-05-28
28-05-2025,Taxi,TAXI,"Proclamante:Usb Taxi
Aderente:Cobas Lavoro Privato",TORINO,dalle ore 8.00 alle ore 22.00,https://www.cgsse.it/calendario-scioperi/dettaglio-sciopero/367603,false,2025-05-28,2025-05-28,2025-05-28,2025-05-28
28-05-2025,Taxi,TAXI,"Proclamante:Usb Taxi
Aderente:Cobas Lavoro Privato",NAPOLI,dalle ore 8.00 alle ore 22.00,https://www.cgsse.it/calendario-scioperi/dettaglio-sciopero/367601,false,2025-05-28,2025-05-28,2025-05-28,2025-05-28
06-06-2025,Istituti di vigilanza,BTV,"Filcams Cgil, Fisascat Cisl, Uiltcs",NAZIONALE,intera giornata,https://www.cgsse.it/calendario-scioperi/dettaglio-sciopero/367595,false,2025-06-06,2025-06-06,2025-06-06,2025-06-06
31-05-2025,Trasporto pubblico locale,APT SPA,Ugl Fna,GORIZIA,dalle ore 19.00 alle ore 23.00,https://www.cgsse.it/calendario-scioperi/dettaglio-sciopero/367587,false,2025-05-31,2025-05-31,2025-05-31,2025-05-31
03-06-2025,"Servizio sanitario nazionale, Pulizie e multiservizi",GOSER,Sgb,NAPOLI,intera giornata,https://www.cgsse.it/calendario-scioperi/dettaglio-sciopero/367576,false,2025-06-03,2025-06-03,2025-06-03,2025-06-03
30-05-2025,Trasporto pubblico locale,ATC,Faisa Cisal,CASERTA,dalle ore 9.00 alle ore 13.00,https://www.cgsse.it/calendario-scioperi/dettaglio-sciopero/367555,false,2025-05-30,2025-05-30,2025-05-30,2025-05-30
23-05-2025,Trasporto ferroviario,"AZIENDE DEL COMPARTO, GRUPPO FSI",Usb Lavoro Privato,NAZIONALE,dalle ore 01.00 alle ore 23.59,https://www.cgsse.it/calendario-scioperi/dettaglio-sciopero/367551,false,2025-05-23,2025-05-23,2025-05-23,2025-05-23
23-05-2025,Trasporto ferroviario,"GRUPPO FSI, MERCITALIA RAIL, TRENITALIA, TRENITALIA TPER SCARL",Assemblea Nazionale Pdm/pdb,NAZIONALE,dalle ore 9.00 alle ore 17.00,https://www.cgsse.it/calendario-scioperi/dettaglio-sciopero/367547,false,2025-05-23,2025-05-23,2025-05-23,2025-05-23
24-05-2025,Trasporto pubblico locale,MOM,Sgb,TREVISO,dalle ore 17.30 alle ore 21.30,https://www.cgsse.it/calendario-scioperi/dettaglio-sciopero/367543,false,2025-05-24,2025-05-24,2025-05-24,2025-05-24
28-05-2025,Trasporto aereo,SWISSPORT ITALIA,Fit Cisl,MILANO,dalle ore 13.00 alle ore 17.00,https://www.cgsse.it/calendario-scioperi/dettaglio-sciopero/367541,false,2025-05-28,2025-05-28,2025-05-28,2025-05-28
23-05-2025,"Trasporto merci su rotaia, Trasporto pubblico locale, Trasporto ferroviario, Plurisettoriale nazionale",AZIENDE CHE SVOLGONO ATTIVITA FERROVIARIA,Sgb,NAZIONALE,dalle ore 1:00 alle ore 23:59,https://www.cgsse.it/calendario-scioperi/dettaglio-sciopero/367535,false,2025-05-23,2025-05-23,2025-05-23,2025-05-23
30-05-2025,Trasporto pubblico locale,SETA,Usb Lavoro Privato,"MODENA, PIACENZA, REGGIO NELL'EMILIA","personale viaggiante urbano dalle ore 17.30 alle ore 21.30, personale viaggiante extraurbano dalle ore 17.00 alle ore 21.00",https://www.cgsse.it/calendario-scioperi/dettaglio-sciopero/367533,false,2025-05-30,2025-05-30,2025-05-30,2025-05-30
Dal 15-06-2025 al 16-06-2025,Trasporto ferroviario,TRENITALIA,Orsa Trasporti,"PIEMONTE, VALLE D'AOSTA",dalle ore 3.00 del 15/06 alle ore 2.00 del 16/06,https://www.cgsse.it/calendario-scioperi/dettaglio-sciopero/367528,true,2025-06-15,2025-06-16,2025-06-15,
30-05-2025,Generale provinciale,TUTTE LE CATEGORIE PUBBLICHE E PRIVATE,"Cub, Sindacato Di Base Multicategoriale",TRENTO,"intera giornata. sono esclusi dallo sciopero le aziende che applicano i ccnl aris/aiop, aris/rsa, aiop/rsa oltre alle aziende del settore ferroviario e trasporto pubblico locale. per i vigili del fuoco lo sciopero è dalle ore 8.00 alle ore 14.00",https://www.cgsse.it/calendario-scioperi/dettaglio-sciopero/367521,false,2025-05-30,2025-05-30,2025-05-30,2025-05-30
23-05-2025,"Metalmeccanici, Plurisettoriale nazionale",SETTORI AFFERENTI AI COMPARTI INDUSTRIALI,Usb Lavoro Privato,NAZIONALE,sciopero di 8 ore o intero turno di lavoro,https://www.cgsse.it/calendario-scioperi/dettaglio-sciopero/367518,false,2025-05-23,2025-05-23,2025-05-23,2025-05-23
28-05-2025,Trasporto pubblico locale,AUTOGUIDOVIE,Usb Lavoro Privato,"MILANO , PAVIA , CREMONA , MONZA E DELLA BRIANZA","da inizio servizio alle ore 05.30, dalle ore 08.30 alle ore 15.00 e dalle ore 18.00 al termine del servizio",https://www.cgsse.it/calendario-scioperi/dettaglio-sciopero/367516,false,2025-05-28,2025-05-28,2025-05-28,2025-05-28
28-05-2025,Trasporto aereo,SWISSPORT ITALIA,Uiltrasporti,MILANO,dalle ore 13.00 alle ore 17.00,https://www.cgsse.it/calendario-scioperi/dettaglio-sciopero/367513,false,2025-05-28,2025-05-28,2025-05-28,2025-05-28
Dal 26-05-2025 al 27-05-2025,Igiene ambientale,DHI SPA,Uiltrasporti,MACERATA CAMPANIA,intere giornate,https://www.cgsse.it/calendario-scioperi/dettaglio-sciopero/367508,true,2025-05-26,2025-05-27,2025-05-26,
28-05-2025,Trasporto aereo,SWISSPORT ITALIA,Filt Cgil,MILANO,dalle ore 13.00 alle ore 17.00,https://www.cgsse.it/calendario-scioperi/dettaglio-sciopero/367505,false,2025-05-28,2025-05-28,2025-05-28,2025-05-28
Dal 26-05-2025 al 28-05-2025,Regioni e autonomie Locali,LIFE PROJECT,Sul,REGGIO DI CALABRIA,intere giornate,https://www.cgsse.it/calendario-scioperi/dettaglio-sciopero/367500,true,2025-05-26,2025-05-28,2025-05-26,
22-05-2025,Sanità privata,ICS MAUGERI,Usb Lavoro Privato,MILANO,intera giornata per tutti i turni di lavoro,https://www.cgsse.it/calendario-scioperi/dettaglio-sciopero/367488,false,2025-05-22,2025-05-22,2025-05-22,2025-05-22
13-06-2025,Trasporto aereo,"COMPARTO AEREO, AEROPORTUALE E INDOTTO DEGLI AEROPORTI",Cub Trasporti,NAZIONALE,dalle ore 13.00 alle ore 17.00,https://www.cgsse.it/calendario-scioperi/dettaglio-sciopero/367486,true,2025-06-13,2025-06-13,2025-06-13,2025-06-13
19-05-2025,Igiene ambientale,AAMPS,"Fp Cgil, Fiadel, Uiltrasporti, Fit Cisl, Rsu",LIVORNO,intera giornata,https://www.cgsse.it/calendario-scioperi/dettaglio-sciopero/367465,false,2025-05-19,2025-05-19,2025-05-19,2025-05-19
27-05-2025,"Servizio sanitario nazionale, Plurisettoriale provinciale","COOPERATIVE SOCIALI, SOCIETÀ E ASSOCIAZIONI OPERANTI NEI SETTORI SOCIO-SANITARI-ASSISTENZIALI-EDUCATIVI",Cub Sanità,TORINO,"intera giornata escluso il personale nelle che applicano il contratto aris/aiop, aris ras e aiop rsa",https://www.cgsse.it/calendario-scioperi/dettaglio-sciopero/367455,false,2025-05-27,2025-05-27,2025-05-27,2025-05-27
28-05-2025,Trasporto aereo,EASYJET AIRLINE LIMITED,Usb Lavoro Privato,NAZIONALE,dalle ore 13.00 alle ore 17.00,https://www.cgsse.it/calendario-scioperi/dettaglio-sciopero/367449,false,2025-05-28,2025-05-28,2025-05-28,2025-05-28
15-06-2025,Trasporto pubblico locale,ANM,Fisi,NAPOLI,dalle ore 12.45 alle ore 16.45,https://www.cgsse.it/calendario-scioperi/dettaglio-sciopero/367439,false,2025-06-15,2025-06-15,2025-06-15,2025-06-15
19-05-2025,Pulizie e multiservizi,ROMEO GESTIONI,"Orsa Filsa, Fisascat Cisl",NAPOLI,intera giornata,https://www.cgsse.it/calendario-scioperi/dettaglio-sciopero/367432,true,2025-05-19,2025-05-19,2025-05-19,2025-05-19
11-07-2025,Trasporto aereo,GESAP,"Uiltrasporti, Filt Cgil, Fit Cisl, Ugl",PALERMO,dalle ore 00.00 alle ore 23.59,https://www.cgsse.it/calendario-scioperi/dettaglio-sciopero/367407,false,2025-07-11,2025-07-11,2025-07-11,2025-07-11
19-05-2025,Igiene ambientale,GEOFOR,Rsu,PISA,intera giornata,https://www.cgsse.it/calendario-scioperi/dettaglio-sciopero/367399,false,2025-05-19,2025-05-19,2025-05-19,2025-05-19
Dal 05-07-2025 al 07-07-2025,Trasporto marittimo,GRANDI NAVI VELOCI,Ugl Mare E porti,NAZIONALE,dalle ore 14.00 del 5/07 alle ore 13.59 del 7/07,https://www.cgsse.it/calendario-scioperi/dettaglio-sciopero/367346,true,2025-07-05,2025-07-07,2025-07-05,
20-05-2025,Trasporto pubblico locale,CONEROBUS,"Filt Cgil, Fit Cisl, Uiltrasporti, Faisa Cisal",ANCONA,dalle ore 11.30 alle ore 15.30,https://www.cgsse.it/calendario-scioperi/dettaglio-sciopero/367342,true,2025-05-20,2025-05-20,2025-05-20,2025-05-20
17-05-2025,Trasporto ferroviario,"GRUPPO FSI, MERCITALIA RAIL, TRENITALIA, TRENITALIA TPER SCARL",Assemblea Nazionale Pdm/pdb,NAZIONALE,dalle ore 9.00 alle ore 17.00,https://www.cgsse.it/calendario-scioperi/dettaglio-sciopero/367331,true,2025-05-17,2025-05-17,2025-05-17,2025-05-17
27-05-2025,Trasporto aereo,EASYJET AIRLINE LIMITED,Usb Lavoro Privato,NAZIONALE,dalle ore 13.00 alle ore 17.00,https://www.cgsse.it/calendario-scioperi/dettaglio-sciopero/367315,true,2025-05-27,2025-05-27,2025-05-27,2025-05-27
14-05-2025,Pulizie e multiservizi,ROMEO GESTIONI,"Usb Lavoro Privato, Faisa Cisal",NAPOLI,intera giornata,https://www.cgsse.it/calendario-scioperi/dettaglio-sciopero/367306,false,2025-05-14,2025-05-14,2025-05-14,2025-05-14
17-05-2025,"Trasporto merci su rotaia, Trasporto pubblico locale, Trasporto ferroviario, Plurisettoriale nazionale",AZIENDE CHE SVOLGONO ATTIVITA FERROVIARIA,Sgb,NAZIONALE,"dalle ore 1:00 alle ore 23:59, escluso il settore manutenzione infrastruttura",https://www.cgsse.it/calendario-scioperi/dettaglio-sciopero/367281,true,2025-05-17,2025-05-17,2025-05-17,2025-05-17
17-05-2025,Trasporto ferroviario,"AZIENDE DEL COMPARTO, GRUPPO FSI",Usb Lavoro Privato,NAZIONALE,dalle ore 01.00 alle ore 23.59 ad eccezione del personale mobile della direzione business regionale della società trenitalia per il piemonte e valle d’aosta il cui sciopero inizierà dalle ore 3.00 del 17/05,https://www.cgsse.it/calendario-scioperi/dettaglio-sciopero/367276,true,2025-05-17,2025-05-17,2025-05-17,2025-05-17
14-05-2025,Igiene ambientale,VELIA AMBIENTE,Filas,MADDALONI,intera giornata,https://www.cgsse.it/calendario-scioperi/dettaglio-sciopero/367240,false,2025-05-14,2025-05-14,2025-05-14,2025-05-14
01-06-2025,Trasporto pubblico locale,AMT GENOVA,Cub Trasporti,GENOVA,"servizio urbano da inizio serv. alle 5.30, dalle 9.30/17 e dalle 21/fine serv., provinciale da inizio serv. alle 6, dalle 9/17 e dalle 20 a fine serv., ferrovie genova/casella inizio serv. alle 6.30, dalle 9.30/17.30 e dalle 20.30 a fine serv.",https://www.cgsse.it/calendario-scioperi/dettaglio-sciopero/367185,false,2025-06-01,2025-06-01,2025-06-01,2025-06-01
Dal 16-05-2025 al 21-05-2025,Telecomunicazioni,"TELECONTACT, TIM",Ugl Telecomunicazione,NAZIONALE,"personale full time 120 minuti a fine turno, personale part time 60 minuti a fine turno",https://www.cgsse.it/calendario-scioperi/dettaglio-sciopero/367183,false,2025-05-16,2025-05-21,2025-05-16,
19-05-2025,Distribuzione farmaci e logistica farmaceutica,PLF SOCIETA’ COOPERATIVA,Filt Cgil,CASALPUSTERLENGO,intera giornata,https://www.cgsse.it/calendario-scioperi/dettaglio-sciopero/367174,true,2025-05-19,2025-05-19,2025-05-19,2025-05-19
20-05-2025,Trasporto pubblico locale,BUSITALIA SITA NORD,Usb Lavoro Privato,UMBRIA,"perugia e spoleto fasce garantite dalle 6.00 alle 9.00 e dalle 12.00 alle 15.00, terni fasce garantite dalle 6.30 alle 9.30 e dalle 12.30 alle 15.30, servizi ferroviari fasce garantite dalle 5.45 alle 8.45 e dalle 11,45 alle ore 14.45",https://www.cgsse.it/calendario-scioperi/dettaglio-sciopero/367170,false,2025-05-20,2025-05-20,2025-05-20,2025-05-20
22-06-2025,Trasporto aereo,MODITECH,"Fiom Cgil, Uilm Uil",ROMA,dalle ore 10.00 alle ore 12.00 e dalle ore 14.00 alle ore 16.00,https://www.cgsse.it/calendario-scioperi/dettaglio-sciopero/367163,true,2025-06-22,2025-06-22,2025-06-22,2025-06-22
18-05-2025,Regioni e autonomie Locali,COMUNE DI VERONA,Cse Flpl,VERONA,intera giornata,https://www.cgsse.it/calendario-scioperi/dettaglio-sciopero/367160,false,2025-05-18,2025-05-18,2025-05-18,2025-05-18
29-05-2025,Avvocati,SETTORE GIUSTIZIA,Camera Penale Di Enna,ENNA,astensione dalle udienze e dalle attività giudiziarie nel settore penale,https://www.cgsse.it/calendario-scioperi/dettaglio-sciopero/367155,false,2025-05-29,2025-05-29,2025-05-29,2025-05-29
27-05-2025,Avvocati,SETTORE GIUSTIZIA,Camera Penale Di Enna,ENNA,astensione dalle udienze e dalle attività giudiziarie nel settore penale,https://www.cgsse.it/calendario-scioperi/dettaglio-sciopero/367153,false,2025-05-27,2025-05-27,2025-05-27,2025-05-27
Dal 12-06-2025 al 13-06-2025,Avvocati,SETTORE GIUSTIZIA,Camera Penale Irpina,AVELLINO,astensione dalle attività giudiziarie,https://www.cgsse.it/calendario-scioperi/dettaglio-sciopero/367151,false,2025-06-12,2025-06-13,2025-06-12,
Dal 07-05-2025 al 14-05-2025,Distribuzione farmaci e logistica farmaceutica,PLF SOCIETA’ COOPERATIVA,Filt Cgil,CASALPUSTERLENGO,,https://www.cgsse.it/calendario-scioperi/dettaglio-sciopero/367149,true,2025-05-07,2025-05-14,2025-05-07,
16-05-2025,Igiene ambientale,DM TECHNOLOGY,Cobas Lavoro Privato,ROCCA DI PAPA,intero truno,https://www.cgsse.it/calendario-scioperi/dettaglio-sciopero/367147,false,2025-05-16,2025-05-16,2025-05-16,2025-05-16
22-05-2025,Poste,POSTE ITALIANE,"Slc Cgil, Uil Poste",BRESCIA,ultime 2 ore del turno notturno 22.30 - 05.57 e 23.30 - 06.57 del 22/05; prime 2 ore del turno 04.30 – 11.57; ultime 2 ore del turno 07.00 – 14.27; ultime 2 ore dei turni pomeridiani 13.30 20.57 e 15.00 – 22.27.settore trasporti prime 2 ore del turno,https://www.cgsse.it/calendario-scioperi/dettaglio-sciopero/367140,true,2025-05-22,2025-05-22,2025-05-22,2025-05-22
16-05-2025,Pulizie e multiservizi,ROMEO GESTIONI,"Orsa Filsa, Fisascat Cisl",NAPOLI,intera giornata,https://www.cgsse.it/calendario-scioperi/dettaglio-sciopero/367137,true,2025-05-16,2025-05-16,2025-05-16,2025-05-16
18-05-2025,Trasporto aereo,EASYJET AIRLINE LIMITED,Usb Lavoro Privato,NAZIONALE,dalle ore 13.00 alle ore 17.00,https://www.cgsse.it/calendario-scioperi/dettaglio-sciopero/367134,true,2025-05-18,2025-05-18,2025-05-18,2025-05-18
10-05-2025,Elettricità,ENEL,"Filctem Cgil, Flaei Cisl, Uiltec Uil",FIRENZE,sciopero del lavoro straordinario,https://www.cgsse.it/calendario-scioperi/dettaglio-sciopero/367058,false,2025-05-10,2025-05-10,2025-05-10,2025-05-10
12-06-2025,Elettricità,ENEL,"Filctem Cgil, Flaei Cisl, Uiltec Uil",FIRENZE,prime 4 ore della giornata lavorativa,https://www.cgsse.it/calendario-scioperi/dettaglio-sciopero/367054,true,2025-06-12,2025-06-12,2025-06-12,2025-06-12
29-05-2025,Elettricità,ENEL,"Filctem Cgil, Flaei Cisl, Uiltec Uil",FIRENZE,prime 4 ore della giornata lavorativa,https://www.cgsse.it/calendario-scioperi/dettaglio-sciopero/367050,false,2025-05-29,2025-05-29,2025-05-29,2025-05-29
Dal 16-06-2025 al 17-06-2025,Trasporto ferroviario,TRENORD,Orsa Trasporti,LOMBARDIA,dalle ore 3:00 del 16/06 alle ore 2:00 del 17/06,https://www.cgsse.it/calendario-scioperi/dettaglio-sciopero/367026,false,2025-06-16,2025-06-17,2025-06-16,
12-05-2025,"Ricerca, Università",MUR,Usb Pi,NAZIONALE,intera giornata,https://www.cgsse.it/calendario-scioperi/dettaglio-sciopero/367024,false,2025-05-12,2025-05-12,2025-05-12,2025-05-12
14-05-2025,Pulizie e multiservizi,ROMEO GESTIONI,"Usb Lavoro Privato, Faisa Cisal",NAPOLI,intera giornata,https://www.cgsse.it/calendario-scioperi/dettaglio-sciopero/367021,true,2025-05-14,2025-05-14,2025-05-14,2025-05-14
Dal 14-06-2025 al 15-06-2025,Trasporto ferroviario,RFI,Uiltrasporti,SARDEGNA,dalle ore 21.00 del 14/06 alle ore 20.59 del 15/06,https://www.cgsse.it/calendario-scioperi/dettaglio-sciopero/367014,true,2025-06-14,2025-06-15,2025-06-14,
12-05-2025,Università,MIM,Flc Cgil,PALERMO,intera giornata del personale docente dell’università di palermo,https://www.cgsse.it/calendario-scioperi/dettaglio-sciopero/367006,false,2025-05-12,2025-05-12,2025-05-12,2025-05-12
02-05-2025,Istituti di vigilanza,VEDETTA 2 MONDIALPOL,"Filcams Cgil, Fisascat Cisl, Uiltucs",MILANO,dalle ore 6.00 alle ore 10.00,https://www.cgsse.it/calendario-scioperi/dettaglio-sciopero/367003,true,2025-05-02,2025-05-02,2025-05-02,2025-05-02
16-05-2025,Metalmeccanici,INSIEL SPA,"Fiom Cgil, Uilm Uil, Fim Cisl",FRIULI VENEZIA GIULIA,ultime 8 ore a partire dal turno delle ore 22.00 del 15/5,https://www.cgsse.it/calendario-scioperi/dettaglio-sciopero/366982,false,2025-05-16,2025-05-16,2025-05-16,2025-05-16
17-05-2025,Trasporto pubblico locale,AMT GENOVA,Ugl Fna,GENOVA,"servizio urbano da inizio serv. alle 5.30, dalle 9.30/17 e dalle 21./fine serv., provinciale da inizio serv. alle 6, dalle 9/17 e dalle 20 a fine serv., ferrovie genova/casella inizio serv. alle 6.30, dalle 9.30/17.30 e dalle 20.30 a fine serv.",https://www.cgsse.it/calendario-scioperi/dettaglio-sciopero/366972,false,2025-05-17,2025-05-17,2025-05-17,2025-05-17
05-05-2025,Trasporto pubblico locale,AUTOLINEE TOSCANE,"Filt Cgil, Fit Cisl, Uiltrasporti, Faisa Cisal",PRATO,dalle ore 8.29 alle ore 12.29,https://www.cgsse.it/calendario-scioperi/dettaglio-sciopero/366949,false,2025-05-05,2025-05-05,2025-05-05,2025-05-05
20-05-2025,Enti pubblici non economici,ANAC,"Fisac Cgil, First Cisl, Uilca Uil, Sibc Cisal, Ugl",ROMA,dalle ore 9.30 alle ore 17.30,https://www.cgsse.it/calendario-scioperi/dettaglio-sciopero/366940,false,2025-05-20,2025-05-20,2025-05-20,2025-05-20
17-05-2025,Trasporto ferroviario,"AZIENDE DEL COMPARTO, GRUPPO FSI",Usb Lavoro Privato,NAZIONALE,dalle ore 00.00 alle ore 23.00 ad eccezione del personale mobile della direzione business regionale della società trenitalia per il piemonte e valle d’aosta il cui sciopero inizierà dalle ore 3.00 del 17/05,https://www.cgsse.it/calendario-scioperi/dettaglio-sciopero/366931,true,2025-05-17,2025-05-17,2025-05-17,2025-05-17
12-05-2025,Pulizie e multiservizi,COPMA,Usb Lavoro Privato,"NAPOLI, NOLA",intera giornata,https://www.cgsse.it/calendario-scioperi/dettaglio-sciopero/366926,false,2025-05-12,2025-05-12,2025-05-12,2025-05-12
12-05-2025,Igiene ambientale,GEOFOR,Rsu,PISA,intera giornata,https://www.cgsse.it/calendario-scioperi/dettaglio-sciopero/366923,true,2025-05-12,2025-05-12,2025-05-12,2025-05-12
17-05-2025,"Trasporto merci su rotaia, Trasporto pubblico locale, Trasporto ferroviario, PLURISETTORIALE TRASPORTI",AZIENDE CHE SVOLGONO ATTIVITA FERROVIARIA,Cub Trasporti,NAZIONALE,dalle ore 01.00 alle ore 23.59,https://www.cgsse.it/calendario-scioperi/dettaglio-sciopero/366918,true,2025-05-17,2025-05-17,2025-05-17,2025-05-17
30-04-2025,Pulizie e multiservizi,ROMEO GESTIONI,"Fismic Confsal, Rsa",ROMA,dalle ore 8.00 alle ore 10.00,https://www.cgsse.it/calendario-scioperi/dettaglio-sciopero/366905,false,2025-04-30,2025-04-30,2025-04-30,2025-04-30
12-06-2025,Elettricità,ENEL,"Filctem Cgil, Flaei Cisl, Uiltec Uil",NAZIONALE,prime 4 ore di della giornata lavorativa,https://www.cgsse.it/calendario-scioperi/dettaglio-sciopero/366887,true,2025-06-12,2025-06-12,2025-06-12,2025-06-12
29-05-2025,Elettricità,ENEL,"Filctem Cgil, Flaei Cisl, Uiltec Uil",NAZIONALE,prime 2 ore della giornata lavorativa,https://www.cgsse.it/calendario-scioperi/dettaglio-sciopero/366883,false,2025-05-29,2025-05-29,2025-05-29,2025-05-29
12-05-2025,Elettricità,ENEL,"Filctem Cgil, Flaei Cisl, Uiltec Uil",NAZIONALE,prime 2 ore della giornata lavorativa,https://www.cgsse.it/calendario-scioperi/dettaglio-sciopero/366879,false,2025-05-12,2025-05-12,2025-05-12,2025-05-12
14-05-2025,Pulizie e multiservizi,ROMEO GESTIONI,"Filcams Cgil, Fisascat Cisl, Uiltrasporti, Ugl, Cub Trasporti",NAPOLI,intera giornata,https://www.cgsse.it/calendario-scioperi/dettaglio-sciopero/366867,false,2025-05-14,2025-05-14,2025-05-14,2025-05-14
16-05-2025,Pulizie e multiservizi,CLEAN SERVICE,Sgb,NAPOLI,intera giornata,https://www.cgsse.it/calendario-scioperi/dettaglio-sciopero/366838,false,2025-05-16,2025-05-16,2025-05-16,2025-05-16
16-06-2025,Istituti di vigilanza,AZIENDE DEL SETTORE,"Filcams Cgil, Fisascat Cisl, Uiltucs",PUGLIA,intero turno di lavoro,https://www.cgsse.it/calendario-scioperi/dettaglio-sciopero/366829,true,2025-06-16,2025-06-16,2025-06-16,2025-06-16
13-05-2025,Trasporto pubblico locale,BUSITALIA SITA NORD,Usb Lavoro Privato,UMBRIA,"perugia e spoleto fasce garantite dalle 6.00 alle 9.00 e dalle 12.00 alle 15.00, terni fasce garantite dalle 6.30 alle 9.30 e dalle 12.30 alle 15.30, servizi ferroviari fasce garantite dalle 5.45 alle 8.45 e dalle 11,45 alle ore 14.45",https://www.cgsse.it/calendario-scioperi/dettaglio-sciopero/366822,true,2025-05-13,2025-05-13,2025-05-13,2025-05-13
09-05-2025,Pulizie e multiservizi,COPMA,Usb Lavoro Privato,"NAPOLI, NOLA",intera giornata,https://www.cgsse.it/calendario-scioperi/dettaglio-sciopero/366820,true,2025-05-09,2025-05-09,2025-05-09,2025-05-09
09-05-2025,Metalmeccanici,INSIEL SPA,"Fiom Cgil, Uilm Uil, Fim Cisl",FRIULI VENEZIA GIULIA,ultime 8 ore a partire dal turno delle ore 22.00 del 8/5,https://www.cgsse.it/calendario-scioperi/dettaglio-sciopero/366818,true,2025-05-09,2025-05-09,2025-05-09,2025-05-09
12-05-2025,Università,MUR,Flc Cgil,NAZIONALE,intera giornata,https://www.cgsse.it/calendario-scioperi/dettaglio-sciopero/366805,false,2025-05-12,2025-05-12,2025-05-12,2025-05-12
12-05-2025,Università,MUR,"Clap, Adl Cobas, Confederazione Cobas",NAZIONALE,intera giornata,https://www.cgsse.it/calendario-scioperi/dettaglio-sciopero/366797,false,2025-05-12,2025-05-12,2025-05-12,2025-05-12
12-05-2025,Regioni e autonomie Locali,LIFE PROJECT,Sul,REGGIO DI CALABRIA,intera giornata,https://www.cgsse.it/calendario-scioperi/dettaglio-sciopero/366793,false,2025-05-12,2025-05-12,2025-05-12,2025-05-12
12-05-2025,"Plurisettoriale nazionale, Università","COOPERATIVE SOCIALI, ENTI PUBBLICI DI RICERCA, MUR",Usi 1912,NAZIONALE,intera giornata,https://www.cgsse.it/calendario-scioperi/dettaglio-sciopero/366791,false,2025-05-12,2025-05-12,2025-05-12,2025-05-12
25-05-2025,Trasporto pubblico locale,ANM,Fisi,NAPOLI,dalle ore 12.45 alle ore 16.45,https://www.cgsse.it/calendario-scioperi/dettaglio-sciopero/366789,true,2025-05-25,2025-05-25,2025-05-25,2025-05-25
10-05-2025,Vigili del fuoco,MINISTERO DELL'INTERNO,"Fp Cgil Vvf, Fns Cisl, Conapo, Usb-Vvf, Uilpa Vvf",LIVORNO,dalle ore 08.00 alle ore 12.00,https://www.cgsse.it/calendario-scioperi/dettaglio-sciopero/366787,false,2025-05-10,2025-05-10,2025-05-10,2025-05-10
30-04-2025,Trasporto pubblico locale,GEST,Cobas Lavoro Privato,FIRENZE,dalle ore 21.00 fino al termine del servizio,https://www.cgsse.it/calendario-scioperi/dettaglio-sciopero/366781,false,2025-04-30,2025-04-30,2025-04-30,2025-04-30
12-05-2025,Igiene ambientale,DHI SPA,Uiltrasporti,MACERATA CAMPANIA,dalle ore 00.01 alle ore 23.59,https://www.cgsse.it/calendario-scioperi/dettaglio-sciopero/366770,false,2025-05-12,2025-05-12,2025-05-12,2025-05-12
12-05-2025,Igiene ambientale,B. RECYCLING,Uiltrasporti,FRANCOLISE,dalle ore 00.01 alle ore 23.59 per tutti i turni di lavoro,https://www.cgsse.it/calendario-scioperi/dettaglio-sciopero/366766,false,2025-05-12,2025-05-12,2025-05-12,2025-05-12
13-05-2025,Plurisettoriale nazionale,"COOPERATIVE SOCIALI, SOCIETÀ E ASSOCIAZIONI OPERANTI NEI SETTORI SOCIO-SANITARI-ASSISTENZIALI-EDUCATIVI","Proclamante:Usb Lavoro Privato
Aderente:Cub Sur, Cub Sanità, Clap",NAZIONALE,"intera giornata, escluso il personale delle strutture che applicano il ccnl aris/aiop, aris rsa e aiop rsa",https://www.cgsse.it/calendario-scioperi/dettaglio-sciopero/366764,false,2025-05-13,2025-05-13,2025-05-13,2025-05-13
Dal 28-04-2025 al 30-04-2025,"Servizio sanitario nazionale, Metalmeccanici",OTIS SERVIZI,Fiom Cgil,"MODENA , BOLOGNA",ultime quattro ore del 28/04 e prime quattro ore del 30/04,https://www.cgsse.it/calendario-scioperi/dettaglio-sciopero/366761,false,2025-04-28,2025-04-30,2025-04-28,
12-05-2025,Università,MUR,"Cub Sur, Flaica Cub",NAZIONALE,intera giornata di tutto il personale che presta servizio a qualunque titolo presso le università italiane,https://www.cgsse.it/calendario-scioperi/dettaglio-sciopero/366758,false,2025-05-12,2025-05-12,2025-05-12,2025-05-12
06-05-2025,Trasporto ferroviario,TRENITALIA,"Ugl, Orsa, Fast",LIGURIA,dalle ore 9.01 alle ore 17.00,https://www.cgsse.it/calendario-scioperi/dettaglio-sciopero/366753,false,2025-05-06,2025-05-06,2025-05-06,2025-05-06
26-05-2025,Pulizie e multiservizi,SAF,Ugl,ROMA,intera giornata,https://www.cgsse.it/calendario-scioperi/dettaglio-sciopero/366747,true,2025-05-26,2025-05-26,2025-05-26,2025-05-26
Dal 27-05-2025 al 05-06-2025,Avvocati,SETTORE GIUSTIZIA,Ordine Degli Avvocati Di Nuoro,NUORO,astensione dalle udienze civili e penali e da ogni altra attività giudiziaria,https://www.cgsse.it/calendario-scioperi/dettaglio-sciopero/366745,false,2025-05-27,2025-06-05,2025-05-27,
Dal 07-05-2025 al 08-05-2025,Igiene ambientale,"DM TECHNOLOGY, WM MAGENTA",Flaica Cub,CASTEL VOLTURNO,dalle ore 00.01 del 7/05 alle ore 23.59 dell' 8/05,https://www.cgsse.it/calendario-scioperi/dettaglio-sciopero/366743,false,2025-05-07,2025-05-08,2025-05-07,
06-05-2025,Trasporto ferroviario,TRENITALIA,Filt Cgil,LIGURIA,dalle ore 9.01 alle ore 17.00,https://www.cgsse.it/calendario-scioperi/dettaglio-sciopero/366735,false,2025-05-06,2025-05-06,2025-05-06,2025-05-06
28-04-2025,Igiene ambientale,AMBIENTE SPA,"Fp Cgil, Fit Cisl, Uiltrasporti, Fiadel, Ugl, Rsu",PESCARA,intera giornata su tutti i turni di lavoro,https://www.cgsse.it/calendario-scioperi/dettaglio-sciopero/366722,false,2025-04-28,2025-04-28,2025-04-28,2025-04-28
12-05-2025,Pulizie e multiservizi,ROMEO GESTIONI,Ugl,NAPOLI,dalle ore 00.00 alle ore 24.00,https://www.cgsse.it/calendario-scioperi/dettaglio-sciopero/366715,true,2025-05-12,2025-05-12,2025-05-12,2025-05-12
19-05-2025,Trasporto pubblico locale,ATM MESSINA,"Fit Cisl, Faisa Cisal, Orsa",MESSINA,dalle ore 00.01 alle ore 23.59,https://www.cgsse.it/calendario-scioperi/dettaglio-sciopero/366713,false,2025-05-19,2025-05-19,2025-05-19,2025-05-19
09-05-2025,Trasporto aereo,AVIATION SERVICES,Flai Ts,VENEZIA,dalle ore 13.00 alle ore 17.00,https://www.cgsse.it/calendario-scioperi/dettaglio-sciopero/366705,false,2025-05-09,2025-05-09,2025-05-09,2025-05-09
06-05-2025,Igiene ambientale,ROMEO GESTIONI,Fial Ambiente E Servizi,"GIUGLIANO IN CAMPANIA, TUFINO",dalle ore 00.01 alle ore 24.00,https://www.cgsse.it/calendario-scioperi/dettaglio-sciopero/366702,true,2025-05-06,2025-05-06,2025-05-06,2025-05-06
22-05-2025,Sanità privata,AIOP-ARIS,"Proclamante:Ugl Salute
Aderente:Coina",NAZIONALE,intera giornata/turno di lavoro per tutto il personale non medico,https://www.cgsse.it/calendario-scioperi/dettaglio-sciopero/366699,false,2025-05-22,2025-05-22,2025-05-22,2025-05-22
03-06-2025,Trasporto ferroviario,RFI,"Cobas Lavoro Privato, Coordinamento Ferrovieri",NAZIONALE,dalle ore 00.01 alle ore 23.00,https://www.cgsse.it/calendario-scioperi/dettaglio-sciopero/366693,false,2025-06-03,2025-06-03,2025-06-03,2025-06-03
03-06-2025,Trasporto ferroviario,RFI,Assemblea Nazionale Lavoratori Manutenzione Rfi,NAZIONALE,dalle ore 00.01 alle ore 23.00,https://www.cgsse.it/calendario-scioperi/dettaglio-sciopero/366690,false,2025-06-03,2025-06-03,2025-06-03,2025-06-03
02-05-2025,Istituti di vigilanza,VEDETTA 2 MONDIALPOL,"Filcams Cgil, Fisascat Cisl, Uiltucs",MILANO,intera giornata per tutti i turni di lavoro,https://www.cgsse.it/calendario-scioperi/dettaglio-sciopero/366688,true,2025-05-02,2025-05-02,2025-05-02,2025-05-02
28-04-2025,"Istituti di vigilanza, Servizio sanitario nazionale","COSMOPOL, VIGILANTES GROUP","Filcams Cgil, Fisascat Cisl",FERMO,intero turno di lavoro,https://www.cgsse.it/calendario-scioperi/dettaglio-sciopero/366684,true,2025-04-28,2025-04-28,2025-04-28,2025-04-28
30-05-2025,Trasporto aereo,SEA,Cub Trasporti,"VARESE , MILANO",dalle ore 00.00 alle ore 23.59 personale autisti aeroporti di linate e malpensa,https://www.cgsse.it/calendario-scioperi/dettaglio-sciopero/366668,true,2025-05-30,2025-05-30,2025-05-30,2025-05-30
Dal 29-04-2025 al 30-04-2025,Pulizie e multiservizi,ISS ITALIA,Fisascat Cisl,NAPOLI,intero turno di lavoro,https://www.cgsse.it/calendario-scioperi/dettaglio-sciopero/366665,true,2025-04-29,2025-04-30,2025-04-29,
Dal 17-05-2025 al 18-05-2025,Trasporto ferroviario,TRENITALIA,Orsa Trasporti,"PIEMONTE, VALLE D'AOSTA",dalle ore 3.00 del 17/05 alle ore 2.00 del 18/05,https://www.cgsse.it/calendario-scioperi/dettaglio-sciopero/366647,true,2025-05-17,2025-05-18,2025-05-17,
Dal 17-05-2025 al 18-05-2025,Trasporto ferroviario,TRENITALIA,Orsa Trasporti,"PIEMONTE, VALLE D'AOSTA",dalle ore 3.00 del 17/05 alle ore 2.00 del 18/05,https://www.cgsse.it/calendario-scioperi/dettaglio-sciopero/366645,true,2025-05-17,2025-05-18,2025-05-17,
05-05-2025,Pulizie e multiservizi,SAF,Ugl,ROMA,intera giornata,https://www.cgsse.it/calendario-scioperi/dettaglio-sciopero/366642,true,2025-05-05,2025-05-05,2025-05-05,2025-05-05
29-04-2025,Sanità privata,RSA VILLA DELLE ROSE,Cub Sanità,CAVA DE' TIRRENI,dalle ore 00.01 alle ore 23.59,https://www.cgsse.it/calendario-scioperi/dettaglio-sciopero/366640,false,2025-04-29,2025-04-29,2025-04-29,2025-04-29
23-05-2025,Trasporto pubblico locale,EAV,Confail Faisa,NAPOLI,dalle ore 8.30 alle ore 12.30 per il solo personale della control room divisione trasporto ferroviario,https://www.cgsse.it/calendario-scioperi/dettaglio-sciopero/366638,true,2025-05-23,2025-05-23,2025-05-23,2025-05-23
12-05-2025,Metalmeccanici,AZIENDE DEL COMPARTO,"Fiom Cgil, Uilm Uil, Fim Cisl","VITERBO , RIETI , ROMA",intera giornata,https://www.cgsse.it/calendario-scioperi/dettaglio-sciopero/366625,false,2025-05-12,2025-05-12,2025-05-12,2025-05-12
06-05-2025,Trasporto pubblico locale,AUTOLINEE TOSCANE,Usb,LIVORNO,dalle ore 17:30 alle ore 21:30,https://www.cgsse.it/calendario-scioperi/dettaglio-sciopero/366613,false,2025-05-06,2025-05-06,2025-05-06,2025-05-06
07-05-2025,Scuola,IIS CAVAZZI,"Flc Cgil, Cisl Scuola, Snals Confsal, Gilda Unams, Rsu",PAVULLO NEL FRIGNANO,intera giornata,https://www.cgsse.it/calendario-scioperi/dettaglio-sciopero/366595,false,2025-05-07,2025-05-07,2025-05-07,2025-05-07
12-05-2025,Igiene ambientale,GISEC,"Uiltrasporti, Rsu",CASERTA,dalle ore 00.01 alle ore 23.59 per tutti i turni di lavoro,https://www.cgsse.it/calendario-scioperi/dettaglio-sciopero/366589,false,2025-05-12,2025-05-12,2025-05-12,2025-05-12
12-05-2025,Igiene ambientale,AAMPS,"Fp Cgil, Fiadel, Uiltrasporti, Fit Cisl, Rsu",LIVORNO,intera giornata,https://www.cgsse.it/calendario-scioperi/dettaglio-sciopero/366581,true,2025-05-12,2025-05-12,2025-05-12,2025-05-12
05-05-2025,Igiene ambientale,GESAM,Usb Lavoro Privato,SANTA MARINELLA,intero turno dalle ore 6.00 alle ore 12.20 per il tueno di mattina e dalle 13.00 alle 19.20 per il turno pomeridiano,https://www.cgsse.it/calendario-scioperi/dettaglio-sciopero/366544,true,2025-05-05,2025-05-05,2025-05-05,2025-05-05
28-04-2025,Taxi,TAXI,"Uiltrasporti, Uritaxi, Unica Taxi Cgil, Confartigianato Taxi, Sitafi Federtaxi-Cisal, Ugl Taxi",FIRENZE,intera giornata con garanzia delle seguenti fasce orarie: dalle 22.00 alle 2.00 e dalle 4.00 alle 8.00,https://www.cgsse.it/calendario-scioperi/dettaglio-sciopero/366524,true,2025-04-28,2025-04-28,2025-04-28,2025-04-28
26-05-2025,Trasporto aereo,SEA,Cub Trasporti,"VARESE , MILANO",dalle ore 00.00 alle ore 23.59 personale autisti aeroporti di linate e malpensa,https://www.cgsse.it/calendario-scioperi/dettaglio-sciopero/366474,true,2025-05-26,2025-05-26,2025-05-26,2025-05-26
28-04-2025,Metalmeccanici,SAVIT,Fiom Cgil,UMBRIA,otto ore per ogni turno,https://www.cgsse.it/calendario-scioperi/dettaglio-sciopero/366472,false,2025-04-28,2025-04-28,2025-04-28,2025-04-28
30-04-2025,Metalmeccanici,AZIENDE DEL COMPARTO,"Fiom Cgil, Uilm Uil, Fim Cisl",SALERNO,otto ore,https://www.cgsse.it/calendario-scioperi/dettaglio-sciopero/366469,false,2025-04-30,2025-04-30,2025-04-30,2025-04-30
30-05-2025,Trasporto pubblico locale,ATAF,Faisa Cisal,FOGGIA,"dalle ore 00.00 alle ore 5.30, dalle 8.30 alle 12.30 e dalle 15.30 a fine servizio",https://www.cgsse.it/calendario-scioperi/dettaglio-sciopero/366464,false,2025-05-30,2025-05-30,2025-05-30,2025-05-30
Dal 23-05-2025 al 24-05-2025,"Scuola, Regioni e autonomie Locali","AMMINISTRAZIONI COMUNALI, MIM","Csle, Conalpe",NAZIONALE,"intere giornate, escluso la città di genova e per la città di livorno lo sciopero è confermato solo per la giornata del 24/5",https://www.cgsse.it/calendario-scioperi/dettaglio-sciopero/366460,false,2025-05-23,2025-05-24,2025-05-23,
09-05-2025,Trasporto aereo,ASSOHANDLERS,Flai Trasporti E Servizi,NAZIONALE,dalle ore 13.00 alle ore 17.00,https://www.cgsse.it/calendario-scioperi/dettaglio-sciopero/366458,false,2025-05-09,2025-05-09,2025-05-09,2025-05-09
24-04-2025,Taxi,TAXI,Taxi Bari S.c.,BARI,dalle ore 9.00 alle ore 18.00,https://www.cgsse.it/calendario-scioperi/dettaglio-sciopero/366452,true,2025-04-24,2025-04-24,2025-04-24,2025-04-24
24-04-2025,Taxi,TAXI,Usb,ROMA,dalle ore 8.00 alle ore 22.00,https://www.cgsse.it/calendario-scioperi/dettaglio-sciopero/366449,true,2025-04-24,2025-04-24,2025-04-24,2025-04-24
28-04-2025,Pulizie e multiservizi,ISS ITALIA,"Usb, Confail, Ulssa",NAPOLI,intera giornata,https://www.cgsse.it/calendario-scioperi/dettaglio-sciopero/366446,false,2025-04-28,2025-04-28,2025-04-28,2025-04-28
Dal 05-05-2025 al 07-05-2025,Avvocati,SETTORE GIUSTIZIA,Unioni Camere Penali Italiane,NAZIONALE,"astensione dalle udienze e dalle attività giudiziaria nel settore penale esclusi i circondari di tempio pausania, trapani e chieti",https://www.cgsse.it/calendario-scioperi/dettaglio-sciopero/366440,false,2025-05-05,2025-05-07,2025-05-05,
24-04-2025,Taxi,TAXI,"Uiltrasporti, Uritaxi, Unica Taxi Cgil, Confartigianato Taxi, Sitafi Federtaxi-Cisal, Ugl Taxi",FIRENZE,intera giornata,https://www.cgsse.it/calendario-scioperi/dettaglio-sciopero/366438,true,2025-04-24,2025-04-24,2025-04-24,2025-04-24
06-05-2025,"Trasporto merci su rotaia, Trasporto merci su gomma, Trasporto ferroviario, Plurisettoriale nazionale","CONFCOOPERATIVE, LEGACOOP , GRUPPO FERROVIE DELLO STATO, TRENITALIA TPER, TRENORD, ANCP, RAIL CARGO CARRIER, RAIL TRACTION COMPANY","Ugl Ferrovieri, Fast Confsal, Orsa Trasporti",NAZIONALE,dalle ore 9:01 alle ore 16:59,https://www.cgsse.it/calendario-scioperi/dettaglio-sciopero/366431,false,2025-05-06,2025-05-06,2025-05-06,2025-05-06
20-05-2025,Trasporto pubblico locale,AZIENDE DEL TRASPORTO PUBBLICO LOCALE,"Filt Cgil, Fit Cisl, Faisa Cisal, Ugl, Usb Lavoro Privato",MOLISE,dalle ore 19.00 alle ore 23.00,https://www.cgsse.it/calendario-scioperi/dettaglio-sciopero/366427,false,2025-05-20,2025-05-20,2025-05-20,2025-05-20
11-05-2025,Regioni e autonomie Locali,COMUNE DI BIELLA,Cse Flpl,BIELLA,intera giornata lavorativa del personale del corpo di polizia locale,https://www.cgsse.it/calendario-scioperi/dettaglio-sciopero/366418,true,2025-05-11,2025-05-11,2025-05-11,2025-05-11
24-04-2025,Servizio sanitario nazionale,FONDAZIONE ODA,Usb Lavoro Privato,CATANIA,intera giornata,https://www.cgsse.it/calendario-scioperi/dettaglio-sciopero/366416,false,2025-04-24,2025-04-24,2025-04-24,2025-04-24
Dal 12-05-2025 al 14-05-2025,Avvocati,SETTORE GIUSTIZIA,Camera Penale Di Chieti,CHIETI,astensione dalle udienze penali e dalle attività processuali,https://www.cgsse.it/calendario-scioperi/dettaglio-sciopero/366414,false,2025-05-12,2025-05-14,2025-05-12,
29-04-2025,Metalmeccanici,AZIENDE DEL COMPARTO,"Fiom Cgil, Uilm Uil, Fim Cisl","VITERBO , RIETI , ROMA",4 ore a fine turno,https://www.cgsse.it/calendario-scioperi/dettaglio-sciopero/366412,true,2025-04-29,2025-04-29,2025-04-29,2025-04-29
23-04-2025,Metalmeccanici,AZIENDE DEL COMPARTO,"Fiom Cgil, Uilm Uil, Fim Cisl","VITERBO , RIETI , ROMA",4 ore a fine turno,https://www.cgsse.it/calendario-scioperi/dettaglio-sciopero/366408,true,2025-04-23,2025-04-23,2025-04-23,2025-04-23
28-04-2025,Pulizie e multiservizi,"ISS ITALIA A.BARBATO, M.S. SERVIZI","Usb, Confail, Ulssa",NAPOLI,intera giornata,https://www.cgsse.it/calendario-scioperi/dettaglio-sciopero/366394,true,2025-04-28,2025-04-28,2025-04-28,2025-04-28
12-05-2025,Igiene ambientale,A2A AMBIENTE,"Fp Cgil, Fit Cisl, Fiadel, Uiltrasporti",CAIVANO,intera giornata su tutti i turni di lavoro del personale impiegato presso il tmb,https://www.cgsse.it/calendario-scioperi/dettaglio-sciopero/366370,false,2025-05-12,2025-05-12,2025-05-12,2025-05-12
09-05-2025,Trasporto pubblico locale,AMTS CATANIA,Cub Trasporti,CATANIA,dalle ore 00.01 alle ore 23.59,https://www.cgsse.it/calendario-scioperi/dettaglio-sciopero/366362,false,2025-05-09,2025-05-09,2025-05-09,2025-05-09
09-05-2025,Trasporto aereo,SWISSPORT ITALIA,Cub Trasporti,MILANO,dalle ore 13.00 alle ore 17.00,https://www.cgsse.it/calendario-scioperi/dettaglio-sciopero/366339,false,2025-05-09,2025-05-09,2025-05-09,2025-05-09
Dal 06-05-2025 al 07-05-2025,Regioni e autonomie Locali,AMICO BUS,Usb Lavoro Privato,"CASCINA, CALCI",intere giornate,https://www.cgsse.it/calendario-scioperi/dettaglio-sciopero/366333,false,2025-05-06,2025-05-07,2025-05-06,
Dal 18-04-2025 al 25-04-2025,Trasporto pubblico locale,IAS TOURING,Faisa Cisal,CORIGLIANO-ROSSANO,astensione collettiva dalla prestazione delle mansioni ritenute contrattualmente non dovute,https://www.cgsse.it/calendario-scioperi/dettaglio-sciopero/366321,false,2025-04-18,2025-04-25,2025-04-18,
12-05-2025,Pulizie e multiservizi,ROMEO GESTIONI,Ugl,NAPOLI,dalle ore 00.00 alle ore 24.00,https://www.cgsse.it/calendario-scioperi/dettaglio-sciopero/366302,true,2025-05-12,2025-05-12,2025-05-12,2025-05-12
18-04-2025,Trasporto aereo,ROMEO GESTIONI,Ugl Ta,NAPOLI,dalle ore 12.00 alle ore 16.00 lavoratori operanti presso l'appalto gesac dell'aeroporto di capodichino,https://www.cgsse.it/calendario-scioperi/dettaglio-sciopero/366279,true,2025-04-18,2025-04-18,2025-04-18,2025-04-18
05-05-2025,Trasporto pubblico locale,ANM,Uiltrasporti,NAPOLI,dalle ore 9.00 alle ore 17.00 personale settore funicolari,https://www.cgsse.it/calendario-scioperi/dettaglio-sciopero/366271,false,2025-05-05,2025-05-05,2025-05-05,2025-05-05
07-05-2025,Trasporto pubblico locale,AUTOGUIDOVIE,Usb Lavoro Privato,"MILANO , PAVIA , CREMONA , MONZA E DELLA BRIANZA",dalle ore 11:00 alle ore 15:00,https://www.cgsse.it/calendario-scioperi/dettaglio-sciopero/366268,false,2025-05-07,2025-05-07,2025-05-07,2025-05-07
09-05-2025,Trasporto pubblico locale,BRESCIA TRASPORTI,Cobas Lavoro Privato,BRESCIA,dalle ore 17.30 alle ore 21.30,https://www.cgsse.it/calendario-scioperi/dettaglio-sciopero/366248,false,2025-05-09,2025-05-09,2025-05-09,2025-05-09
09-05-2025,Trasporto pubblico locale,BRESCIA TRASPORTI,Orsa Trasporti,BRESCIA,dalle ore 17.30 alle ore 21.30,https://www.cgsse.it/calendario-scioperi/dettaglio-sciopero/366243,false,2025-05-09,2025-05-09,2025-05-09,2025-05-09
22-05-2025,Sanità privata,AIOP-ARIS,"Proclamante:Fp Cgil, Fp Cisl, Uil Fpl
Aderente:Cse Flp",NAZIONALE,intera giornata,https://www.cgsse.it/calendario-scioperi/dettaglio-sciopero/366232,false,2025-05-22,2025-05-22,2025-05-22,2025-05-22
26-04-2025,Trasporto pubblico locale,SAD,Uilt Sgk,BOLZANO,dalle ore 00.00 alle ore 04.00,https://www.cgsse.it/calendario-scioperi/dettaglio-sciopero/366228,false,2025-04-26,2025-04-26,2025-04-26,2025-04-26
07-05-2025,Trasporto pubblico locale,TUA,Ugl,"PESCARA, CHIETI",dalle ore 9.00 alle ore 13.00,https://www.cgsse.it/calendario-scioperi/dettaglio-sciopero/366226,false,2025-05-07,2025-05-07,2025-05-07,2025-05-07
23-04-2025,Metalmeccanici,AZIENDE DEL COMPARTO,"Fiom Cgil, Uilm Uil, Fim Cisl",TRENTO,intera giornata e/o turno di lavoro,https://www.cgsse.it/calendario-scioperi/dettaglio-sciopero/366215,false,2025-04-23,2025-04-23,2025-04-23,2025-04-23
29-04-2025,Igiene ambientale,DM TECHNOLOGY,"Uiltrasporti, Rsu",SOMMA VESUVIANA,dalle ore 00.01 alle ore 23.59,https://www.cgsse.it/calendario-scioperi/dettaglio-sciopero/366195,false,2025-04-29,2025-04-29,2025-04-29,2025-04-29
07-05-2025,Istruzione e ricerca,MIM,Unicobas Scuola & Università,NAZIONALE,prima ora del turno antimeridiano e/o ultima ora del turno pomeridiano personale docente e ata a tempo determinato ed indeterminato in italia e all'estero,https://www.cgsse.it/calendario-scioperi/dettaglio-sciopero/366177,false,2025-05-07,2025-05-07,2025-05-07,2025-05-07
26-04-2025,Trasporto pubblico locale,AMT GENOVA,Ugl Fna,GENOVA,"servizio urbano e ferrovie genova/casella dalle ore 9.30 alle ore 17.00, servzio provinciale dalle ore 9.00 alle ore 17.00",https://www.cgsse.it/calendario-scioperi/dettaglio-sciopero/366175,false,2025-04-26,2025-04-26,2025-04-26,2025-04-26
Dal 15-04-2025 al 16-04-2025,Istituti di vigilanza,PEGASO SECURITY,"Filcams Cgil, Fisascat Cisl, Uiltucs",NAZIONALE,astensione per tutti i turni di lavoro del 15 e 16 aprile,https://www.cgsse.it/calendario-scioperi/dettaglio-sciopero/366173,false,2025-04-15,2025-04-16,2025-04-15,
06-05-2025,Scuola,IIS CAVAZZI,"Flc Cgil, Cisl Scuola, Snals Confsal, Gilda Unams, Rsu",PAVULLO NEL FRIGNANO,intera giornata,https://www.cgsse.it/calendario-scioperi/dettaglio-sciopero/366169,true,2025-05-06,2025-05-06,2025-05-06,2025-05-06
03-05-2025,Trasporto aereo,EASYJET AIRLINE LIMITED,"Filt Cgil, Uiltrasporti",NAZIONALE,intera giornata del personale piloti,https://www.cgsse.it/calendario-scioperi/dettaglio-sciopero/366161,true,2025-05-03,2025-05-03,2025-05-03,2025-05-03
Dal 05-05-2025 al 06-05-2025,Trasporto ferroviario,"AZIENDE DEL COMPARTO, GRUPPO FSI",Usb Lavoro Privato,NAZIONALE,dalle ore 21.00 del 5/05 alle ore 20.59 del 6/05,https://www.cgsse.it/calendario-scioperi/dettaglio-sciopero/366145,true,2025-05-05,2025-05-06,2025-05-05,
29-04-2025,Metalmeccanici,ROMEO GESTIONI,"Fiom Cgil, Fim Cisl",NAPOLI,sciopero di otto ore,https://www.cgsse.it/calendario-scioperi/dettaglio-sciopero/366134,true,2025-04-29,2025-04-29,2025-04-29,2025-04-29
Dal 20-05-2025 al 21-05-2025,Trasporto merci su rotaia,GTS RAIL,"Filt Cgil, Fit Cisl, Uiltrasporti, Ugl Ferrovieri, Fast Confsal",NAZIONALE,dalle ore 16:01del 20/05 alle ore 16.00 del 21/05,https://www.cgsse.it/calendario-scioperi/dettaglio-sciopero/366122,true,2025-05-20,2025-05-21,2025-05-20,
15-04-2025,Sanità privata,RSA VILLA DELLE ROSE,Cub Sanità,CAVA DE' TIRRENI,intera giornata,https://www.cgsse.it/calendario-scioperi/dettaglio-sciopero/366108,false,2025-04-15,2025-04-15,2025-04-15,2025-04-15
01-05-2025,Generale nazionale,TUTTE LE CATEGORIE PUBBLICHE E PRIVATE,Usi-Cit,NAZIONALE,intera giornata.per il corpo nazionale dei vigili del fuoco lo sciopero è limitato al turno mattutino,https://www.cgsse.it/calendario-scioperi/dettaglio-sciopero/366098,false,2025-05-01,2025-05-01,2025-05-01,2025-05-01
24-04-2025,Servizio sanitario nazionale,ASST BRESCIA,Fi-si,BRESCIA,intera giornata,https://www.cgsse.it/calendario-scioperi/dettaglio-sciopero/366084,false,2025-04-24,2025-04-24,2025-04-24,2025-04-24
Dal 12-04-2025 al 19-04-2025,Trasporto pubblico locale,IAS TOURING,Faisa Cisal,CORIGLIANO-ROSSANO,astensione collettiva dalla prestazione delle mansioni ritenute contrattualmente non dovute,https://www.cgsse.it/calendario-scioperi/dettaglio-sciopero/366079,true,2025-04-12,2025-04-19,2025-04-12,
16-04-2025,Igiene ambientale,A2A AMBIENTE,"Fp Cgil, Fit Cisl, Fiadel, Uiltrasporti",CAIVANO,intera giornata su tutti i turni di lavoro del personale impiegato presso il tmb,https://www.cgsse.it/calendario-scioperi/dettaglio-sciopero/366077,true,2025-04-16,2025-04-16,2025-04-16,2025-04-16
29-04-2025,Igiene ambientale,ISVEC,Uiltrasporti,PIEDIMONTE MATESE,dalle ore 00.01 alle ore 23.59,https://www.cgsse.it/calendario-scioperi/dettaglio-sciopero/366071,false,2025-04-29,2025-04-29,2025-04-29,2025-04-29
Dal 07-04-2025 al 14-04-2025,Trasporto pubblico locale,IAS TOURING,Faisa Cisal,CORIGLIANO-ROSSANO,astensione collettiva dalla prestazione delle mansioni ritenute contrattualmente non dovute,https://www.cgsse.it/calendario-scioperi/dettaglio-sciopero/366061,true,2025-04-07,2025-04-14,2025-04-07,
19-04-2025,Metalmeccanici,ROMEO GESTIONI,"Fiom Cgil, Fim Cisl",NAPOLI,sciopero di otto ore dei lavoratori operanti nel cantiere  anm colli aminei ,https://www.cgsse.it/calendario-scioperi/dettaglio-sciopero/366048,true,2025-04-19,2025-04-19,2025-04-19,2025-04-19
12-05-2025,Pulizie e multiservizi,COOPSERVICE,"Sls, Cub",PADOVA,intero turno di lavoro,https://www.cgsse.it/calendario-scioperi/dettaglio-sciopero/366023,false,2025-05-12,2025-05-12,2025-05-12,2025-05-12
Dal 05-05-2025 al 09-05-2025,Avvocati,SETTORE GIUSTIZIA,Consiglio Dell'ordine Degli Avvocati Di trapani,TRAPANI,astensione dalle udienze civili e penali e da ogni altra attività giudiziaria,https://www.cgsse.it/calendario-scioperi/dettaglio-sciopero/366021,false,2025-05-05,2025-05-09,2025-05-05,
09-04-2025,Metalmeccanici,ROMEO GESTIONI,"Fiom Cgil, Fim Cisl",NAPOLI,sciopero di otto ore dei lavoratori operanti nel cantiere  anm colli aminei ,https://www.cgsse.it/calendario-scioperi/dettaglio-sciopero/366015,true,2025-04-09,2025-04-09,2025-04-09,2025-04-09
05-05-2025,Regioni e autonomie Locali,COMUNE DI VERONA,Fp Cgil,VERONA,2 ore alla fine di ciascun turno lavorativo,https://www.cgsse.it/calendario-scioperi/dettaglio-sciopero/366006,true,2025-05-05,2025-05-05,2025-05-05,2025-05-05
22-04-2025,Regioni e autonomie Locali,COMUNE DI VERONA,Fp Cgil,VERONA,2 ore alla fine di ciascun turno lavorativo,https://www.cgsse.it/calendario-scioperi/dettaglio-sciopero/366004,true,2025-04-22,2025-04-22,2025-04-22,2025-04-22
09-05-2025,Trasporto aereo,"COMPARTO AEREO, AEROPORTUALE E INDOTTO DEGLI AEROPORTI",Cub Trasporti,NAZIONALE,dalle ore 13.00 alle ore 17.00,https://www.cgsse.it/calendario-scioperi/dettaglio-sciopero/365999,true,2025-05-09,2025-05-09,2025-05-09,2025-05-09
17-04-2025,Avvocati,SETTORE GIUSTIZIA,Camera Penale Di Santa Maria Capua Vetere,SANTA MARIA CAPUA VETERE,astensione dalle udienze e dalle attività giudiziarie nel settore penale,https://www.cgsse.it/calendario-scioperi/dettaglio-sciopero/365995,false,2025-04-17,2025-04-17,2025-04-17,2025-04-17
09-05-2025,Trasporto pubblico locale,AMTS CATANIA,Cub Trasporti,CATANIA,dalle ore 00.01 alle ore 24.00,https://www.cgsse.it/calendario-scioperi/dettaglio-sciopero/365988,true,2025-05-09,2025-05-09,2025-05-09,2025-05-09
14-04-2025,Pulizie e multiservizi,COOPSERVICE,Sls,PADOVA,intero turno di lavoro,https://www.cgsse.it/calendario-scioperi/dettaglio-sciopero/365977,true,2025-04-14,2025-04-14,2025-04-14,2025-04-14
11-05-2025,Trasporto pubblico locale,EAV,Orsa Trasporti,NAPOLI,dalle ore 8:30 alle 16:30 e dalle 19:30 a fine servizio,https://www.cgsse.it/calendario-scioperi/dettaglio-sciopero/365973,false,2025-05-11,2025-05-11,2025-05-11,2025-05-11
11-04-2025,Igiene ambientale,MURACA,Slai Cobas,MILETO,intera giornata,https://www.cgsse.it/calendario-scioperi/dettaglio-sciopero/365969,false,2025-04-11,2025-04-11,2025-04-11,2025-04-11
07-04-2025,Servizio sanitario nazionale,"GRADED, ROMEO GESTIONI, SIRAM","Fiom Cgil, Fim Cisl",NAPOLI,otto ore per ogni turno di lavoro,https://www.cgsse.it/calendario-scioperi/dettaglio-sciopero/365967,true,2025-04-07,2025-04-07,2025-04-07,2025-04-07
14-04-2025,Trasporto pubblico locale,ANM,Uiltrasporti,NAPOLI,dalle ore 9.00 alle ore 17.00 personale settore funicolari,https://www.cgsse.it/calendario-scioperi/dettaglio-sciopero/365962,true,2025-04-14,2025-04-14,2025-04-14,2025-04-14
18-05-2025,Regioni e autonomie Locali,COMUNE DI NOTO,"Fp Cgil, Uilfpl",NOTO,intera giornata,https://www.cgsse.it/calendario-scioperi/dettaglio-sciopero/365958,true,2025-05-18,2025-05-18,2025-05-18,2025-05-18
11-04-2025,"Trasporto merci su gomma, Regioni e autonomie Locali",SERVIZI INTEGRATI,Si Cobas,MILANO,intera giornata,https://www.cgsse.it/calendario-scioperi/dettaglio-sciopero/365953,false,2025-04-11,2025-04-11,2025-04-11,2025-04-11
07-05-2025,Trasporto pubblico locale,TUA,"Filt Cgil, Fit Cisl, Uiltrasporti, Faisa Cisal",ABRUZZO,dalle ore 9.00 alle ore 13.00,https://www.cgsse.it/calendario-scioperi/dettaglio-sciopero/365950,false,2025-05-07,2025-05-07,2025-05-07,2025-05-07
11-04-2025,"Trasporto merci su gomma, Regioni e autonomie Locali",FOR SERVICE,Si Cobas,MILANO,intera giornata,https://www.cgsse.it/calendario-scioperi/dettaglio-sciopero/365945,false,2025-04-11,2025-04-11,2025-04-11,2025-04-11
09-04-2025,Trasporto aereo,EASYJET AIRLINE LIMITED,"Filt Cgil, Uiltrasporti, Fit Cisl",NAZIONALE,dalle ore 10.30 alle ore 14.30 assistenti di volo,https://www.cgsse.it/calendario-scioperi/dettaglio-sciopero/365943,false,2025-04-09,2025-04-09,2025-04-09,2025-04-09
08-04-2025,Igiene ambientale,MURACA,Slai Cobas,MILETO,intera giornata,https://www.cgsse.it/calendario-scioperi/dettaglio-sciopero/365939,true,2025-04-08,2025-04-08,2025-04-08,2025-04-08
11-04-2025,Trasporto pubblico locale,BRESCIA TRASPORTI,Cobas Lavoro Privato,BRESCIA,dalle ore 17.30 alle ore 21.30,https://www.cgsse.it/calendario-scioperi/dettaglio-sciopero/365937,true,2025-04-11,2025-04-11,2025-04-11,2025-04-11
11-04-2025,Trasporto pubblico locale,BRESCIA TRASPORTI,Orsa Trasporti,BRESCIA,dalle ore 17.30 alle ore 21.30,https://www.cgsse.it/calendario-scioperi/dettaglio-sciopero/365935,true,2025-04-11,2025-04-11,2025-04-11,2025-04-11
19-05-2025,Trasporto pubblico locale,CONTRAM,"Filt Cgil, Fit Cisl, Uiltrasporti, Faisa Cisal",MARCHE,dalle ore 11.30 alle ore 15.30,https://www.cgsse.it/calendario-scioperi/dettaglio-sciopero/365931,true,2025-05-19,2025-05-19,2025-05-19,2025-05-19
14-04-2025,Avvocati,SETTORE GIUSTIZIA,Camera Penale Di Roma,ROMA,astensione dalle udienze e dalle attività giudiziarie nel settore penale,https://www.cgsse.it/calendario-scioperi/dettaglio-sciopero/365911,false,2025-04-14,2025-04-14,2025-04-14,2025-04-14
11-04-2025,Igiene ambientale,GENERAL ENTERPRISE,Fp Cgil,SASSANO,intera giornata,https://www.cgsse.it/calendario-scioperi/dettaglio-sciopero/365890,true,2025-04-11,2025-04-11,2025-04-11,2025-04-11
22-05-2025,Sanità privata,AIOP-ARIS,"Fp Cgil, Fp Cisl, Uil Fpl",NAZIONALE,intera giornata,https://www.cgsse.it/calendario-scioperi/dettaglio-sciopero/365881,true,2025-05-22,2025-05-22,2025-05-22,2025-05-22
06-04-2025,Regioni e autonomie Locali,COMUNE DI VERONA,Cse Flpl,VERONA,prime tre ore di ogni turno del personale della polizia locale,https://www.cgsse.it/calendario-scioperi/dettaglio-sciopero/365877,true,2025-04-06,2025-04-06,2025-04-06,2025-04-06
07-04-2025,Trasporto pubblico locale,AMTS CATANIA,Cub Trasporti,CATANIA,dalle ore 00.01 alle ore 24.00,https://www.cgsse.it/calendario-scioperi/dettaglio-sciopero/365871,true,2025-04-07,2025-04-07,2025-04-07,2025-04-07
11-04-2025,Pulizie e multiservizi,ROMEO GESTIONI,Ugl,NAPOLI,dalle ore 00.00 alle ore 24.00,https://www.cgsse.it/calendario-scioperi/dettaglio-sciopero/365868,true,2025-04-11,2025-04-11,2025-04-11,2025-04-11
07-04-2025,"Trasporto merci su gomma, Regioni e autonomie Locali",SERVIZI INTEGRATI,Si Cobas,MILANO,intera giornata,https://www.cgsse.it/calendario-scioperi/dettaglio-sciopero/365859,true,2025-04-07,2025-04-07,2025-04-07,2025-04-07
09-04-2025,Trasporto aereo,"COMPARTO AEREO, AEROPORTUALE E INDOTTO DEGLI AEROPORTI",Cub Trasporti,NAZIONALE,dalle ore 10.30 alle ore 14.30 escluso il persanle enav,https://www.cgsse.it/calendario-scioperi/dettaglio-sciopero/365853,true,2025-04-09,2025-04-09,2025-04-09,2025-04-09
06-04-2025,Trasporto pubblico locale,EAV,Orsa Trasporti,NAPOLI,"dalle 00:01 alle 23:59, fatte salve le fasce di garanzia aziendali",https://www.cgsse.it/calendario-scioperi/dettaglio-sciopero/365850,true,2025-04-06,2025-04-06,2025-04-06,2025-04-06
29-03-2025,Regioni e autonomie Locali,COMUNE DI LIVORNO,Uilfpl,LIVORNO,dalle ore 12.00 alle ore 14.00 personale della polizia locale,https://www.cgsse.it/calendario-scioperi/dettaglio-sciopero/365841,true,2025-03-29,2025-03-29,2025-03-29,2025-03-29
07-04-2025,Sanità privata,"CLINICA MEDITERRANEA, IOS, TRUSSO CARDIOMED",Fp Cisl,"NAPOLI, POMIGLIANO D'ARCO, OTTAVIANO",dalle ore 00.00 alle ore 24.00,https://www.cgsse.it/calendario-scioperi/dettaglio-sciopero/365836,true,2025-04-07,2025-04-07,2025-04-07,2025-04-07
11-04-2025,Generale nazionale,TUTTI I SETTORI PUBBLICI E PRIVATI,Si Cobas,NAZIONALE,"dalle ore 00,00 alle ore 23,59, i vigili del fuoco lo sciopero sarà articolato dalle 8:00 alle 14:00 si escludono dallo sciopero i bacini d'utenza interessati da scioperi proclamati precedentemente e il trasporto ferroviario",https://www.cgsse.it/calendario-scioperi/dettaglio-sciopero/365807,false,2025-04-11,2025-04-11,2025-04-11,2025-04-11
07-05-2025,Scuola,MIM,"Proclamante:Cobas Scuola
Aderente:Fisi",NAZIONALE,"intera giornata per la scuola primaria, scuola dell'infanzia e scuola secondaria di primo grado",https://www.cgsse.it/calendario-scioperi/dettaglio-sciopero/365800,false,2025-05-07,2025-05-07,2025-05-07,2025-05-07
04-04-2025,Trasporto pubblico locale,TUA,"Filt Cgil, Fit Cisl, Uiltrasporti, Faisa Cisal",ABRUZZO,dalle ore 9.00 alle ore 13.00,https://www.cgsse.it/calendario-scioperi/dettaglio-sciopero/365798,true,2025-04-04,2025-04-04,2025-04-04,2025-04-04
14-04-2025,Trasporto pubblico locale,ATAF,Faisa Cisal,FOGGIA,dalle ore 8.30 alle ore 12.30,https://www.cgsse.it/calendario-scioperi/dettaglio-sciopero/365787,false,2025-04-14,2025-04-14,2025-04-14,2025-04-14
31-03-2025,"Trasporto merci su gomma, Regioni e autonomie Locali",FOR SERVICE,Si Cobas,MILANO,intera giornata,https://www.cgsse.it/calendario-scioperi/dettaglio-sciopero/365785,true,2025-03-31,2025-03-31,2025-03-31,2025-03-31
31-03-2025,"Trasporto merci su gomma, Regioni e autonomie Locali",SERVIZI INTEGRATI,Si Cobas,MILANO,intera giornata,https://www.cgsse.it/calendario-scioperi/dettaglio-sciopero/365783,true,2025-03-31,2025-03-31,2025-03-31,2025-03-31
07-04-2025,"Igiene ambientale, Pulizie e multiservizi",ISS ITALIA,Fisascat Cisl,NAPOLI,intero turno di lavoro,https://www.cgsse.it/calendario-scioperi/dettaglio-sciopero/365781,false,2025-04-07,2025-04-07,2025-04-07,2025-04-07
04-04-2025,Trasporto pubblico locale,LA PANORAMICA,"Filt Cgil, Fit Cisl, Faisa Cisal",CHIETI,"dalle ore 00.00 alle ore 6.00, dalle 9.00 alle 12.00 e dalle 15.00 alle 24.00",https://www.cgsse.it/calendario-scioperi/dettaglio-sciopero/365778,false,2025-04-04,2025-04-04,2025-04-04,2025-04-04
11-04-2025,Servizio sanitario nazionale,ASU GI,"Uil Fpl, Nursind",TRIESTE,dalle ore 00.00 alle ore 24.00,https://www.cgsse.it/calendario-scioperi/dettaglio-sciopero/365764,false,2025-04-11,2025-04-11,2025-04-11,2025-04-11
23-04-2025,Appalti ferroviari,LA GARDENIA,"Filt Cgil, Fit Cisl, Uiltrasporti",NAZIONALE,secondo mezzo turno per ogni turno di lavoro,https://www.cgsse.it/calendario-scioperi/dettaglio-sciopero/365758,false,2025-04-23,2025-04-23,2025-04-23,2025-04-23
Dal 08-05-2025 al 09-05-2025,Circolazione e sicurezza stradale,SITAF SPA,Filt Cgil,TORINO,dalle ore 22.00 dell'8/5 alle ore 22.00 del 9/5 astensione dal lavoro per 4 ore,https://www.cgsse.it/calendario-scioperi/dettaglio-sciopero/365754,false,2025-05-08,2025-05-09,2025-05-08,
Dal 17-05-2025 al 18-05-2025,Trasporto ferroviario,RFI,Uiltrasporti,SARDEGNA,dalle ore 21.00 del 17/5 alle ore 20.59 del 18 maggio,https://www.cgsse.it/calendario-scioperi/dettaglio-sciopero/365752,true,2025-05-17,2025-05-18,2025-05-17,
Dal 13-04-2025 al 14-04-2025,Trasporto marittimo,GRANDI NAVI VELOCI,"Proclamante:Ugl Mare E porti
Aderente:Orsa Marittimi",NAZIONALE,dalle ore 20.00 del 13/04 alle ore 19.59 del 14/04,https://www.cgsse.it/calendario-scioperi/dettaglio-sciopero/365750,false,2025-04-13,2025-04-14,2025-04-13,
Dal 02-04-2025 al 03-04-2025,Regioni e autonomie Locali,AMICO BUS,Usb Lavoro Privato,"CASCINA, CALCI",intere giornate,https://www.cgsse.it/calendario-scioperi/dettaglio-sciopero/365725,false,2025-04-02,2025-04-03,2025-04-02,
Dal 27-05-2025 al 28-05-2025,Trasporto ferroviario,TRENORD,Orsa Trasporti,LOMBARDIA,dalle ore 3:00 del 27/05 alle ore 2:00 del 28/05,https://www.cgsse.it/calendario-scioperi/dettaglio-sciopero/365718,true,2025-05-27,2025-05-28,2025-05-27,
31-03-2025,Istituti di vigilanza,VEDETTA 2 MONDIALPOL,"Filcams Cgil, Fisascat Cisl, Uiltucs",MILANO,intero turno di lavoro dalle ore 00.01 alle ore 24.00,https://www.cgsse.it/calendario-scioperi/dettaglio-sciopero/365716,false,2025-03-31,2025-03-31,2025-03-31,2025-03-31
31-03-2025,Servizio sanitario nazionale,TEMPOR SPA,"Nidil Cgil, Felsa Cisl, Uiltemp",RIETI,intera giornata articolata su tutti i turni di lavoro,https://www.cgsse.it/calendario-scioperi/dettaglio-sciopero/365705,false,2025-03-31,2025-03-31,2025-03-31,2025-03-31
Dal 11-04-2025 al 12-04-2025,Trasporto ferroviario,"GRUPPO FSI, MERCITALIA RAIL, TRENITALIA, TRENITALIA TPER",Assemblea Nazionale Pdm/pdb,NAZIONALE,dalle ore 3.00 dell’11/04 alle ore 2.00 del 12/04,https://www.cgsse.it/calendario-scioperi/dettaglio-sciopero/365682,true,2025-04-11,2025-04-12,2025-04-11,
Dal 01-04-2025 al 02-04-2025,Pulizie e multiservizi,LA LUCENTE,Ugl,POMIGLIANO D'ARCO,intere giornate,https://www.cgsse.it/calendario-scioperi/dettaglio-sciopero/365680,false,2025-04-01,2025-04-02,2025-04-01,
01-04-2025,Igiene ambientale,ACTA,Fit Cisl,POTENZA,dalle ore 7.00 alle ore 11.00,https://www.cgsse.it/calendario-scioperi/dettaglio-sciopero/365665,false,2025-04-01,2025-04-01,2025-04-01,2025-04-01
03-04-2025,Avvocati,SETTORE GIUSTIZIA,Consiglio Dell' Ordine Degli Avvocati Napoli,NAPOLI,astensione da tutte le udienze civili e penali,https://www.cgsse.it/calendario-scioperi/dettaglio-sciopero/365663,false,2025-04-03,2025-04-03,2025-04-03,2025-04-03
05-04-2025,Igiene ambientale,DOMO ENGINEERING PLASTICS ITALY S.P.A.,S.b.m. Sindacato Di Base Multicategoriale,ARCO,"dalle ore 5.00 alle ore 21.00, primo turno 5.00-13.00 secondo turno 13.00-21.00",https://www.cgsse.it/calendario-scioperi/dettaglio-sciopero/365657,false,2025-04-05,2025-04-05,2025-04-05,2025-04-05
Dal 28-04-2025 al 30-04-2025,Avvocati,SETTORE GIUSTIZIA,Ordine Degli Avvacoti Di Tempio Pausania,TEMPIO PAUSANIA,astensione dalle udienze civili e penali e da ogni altra attività giudiziaria,https://www.cgsse.it/calendario-scioperi/dettaglio-sciopero/365648,false,2025-04-28,2025-04-30,2025-04-28,
01-04-2025,Trasporto pubblico locale,AMT GENOVA,Cub Trasporti,GENOVA,dalle ore 11.30 alle ore 15.30,https://www.cgsse.it/calendario-scioperi/dettaglio-sciopero/365643,false,2025-04-01,2025-04-01,2025-04-01,2025-04-01
Dal 27-03-2025 al 28-03-2025,Servizio sanitario nazionale,TEMPOR SPA,"Nidil Cgil, Felsa Cisl, Uiltemp",RIETI,intere giornate articolate su tutti i turni di lavoro,https://www.cgsse.it/calendario-scioperi/dettaglio-sciopero/365595,true,2025-03-27,2025-03-28,2025-03-27,
30-03-2025,Circolazione e sicurezza stradale,CAS - CONSORZIO AUTOSTRADE SICILIANE,Cub Trasporti,SICILIA,quattro ore a fine turno,https://www.cgsse.it/calendario-scioperi/dettaglio-sciopero/365564,false,2025-03-30,2025-03-30,2025-03-30,2025-03-30
06-05-2025,"Trasporto merci su rotaia, Trasporto ferroviario, PLURISETTORIALE TRASPORTI","FSI, TRENORD, TRENITALIA TPER, RAIL CARGO CARRIER ITALY, RAIL TRACTION COMPANY","Filt Cgil, Fit Cisl, Uiltrasporti",NAZIONALE,dalle ore 9.01 alle ore 17.00,https://www.cgsse.it/calendario-scioperi/dettaglio-sciopero/365562,false,2025-05-06,2025-05-06,2025-05-06,2025-05-06
Dal 11-04-2025 al 12-04-2025,"Trasporto merci su rotaia, Trasporto ferroviario, PLURISETTORIALE TRASPORTI",AZIENDE CHE SVOLGONO ATTIVITA FERROVIARIA,Usb Lavoro Privato,NAZIONALE,dalle ore 3.00 dell’11/04 alle ore 2.00 del12/04,https://www.cgsse.it/calendario-scioperi/dettaglio-sciopero/365558,false,2025-04-11,2025-04-12,2025-04-11,
09-04-2025,Trasporto aereo,SEA,Cub Trasporti,"VARESE , MILANO",dalle ore 10.30 alle ore 14.30 personale autisti aeroporti di linate e malpensa,https://www.cgsse.it/calendario-scioperi/dettaglio-sciopero/365550,false,2025-04-09,2025-04-09,2025-04-09,2025-04-09
31-03-2025,Telecomunicazioni,MEDIATICA,"Proclamante:Slc Cgil, Fistel Cisl, Uilcom Uil
Aderente:Usb Lavoro Privato",NAZIONALE,intera giornata,https://www.cgsse.it/calendario-scioperi/dettaglio-sciopero/365547,false,2025-03-31,2025-03-31,2025-03-31,2025-03-31
13-04-2025,Trasporto pubblico locale,AMAT,Cub Trasporti,PALERMO,dalle ore 8.30 alle ore 17.30 e dalle 23.59,https://www.cgsse.it/calendario-scioperi/dettaglio-sciopero/365508,false,2025-04-13,2025-04-13,2025-04-13,2025-04-13
01-04-2025,Trasporto pubblico locale,SVT,"Fit Cisl, Faisa Cisal, Usb Lavoro Privato",VICENZA,dalle ore 17.00 alle ore 21.00,https://www.cgsse.it/calendario-scioperi/dettaglio-sciopero/365489,false,2025-04-01,2025-04-01,2025-04-01,2025-04-01
04-04-2025,Servizio sanitario nazionale,ASU GI,"Uil Fpl, Nursind",TRIESTE,dalle ore 00.00 alle ore 24.00,https://www.cgsse.it/calendario-scioperi/dettaglio-sciopero/365470,true,2025-04-04,2025-04-04,2025-04-04,2025-04-04
04-04-2025,Scuola,MIUR,Usb Pubblico Impiego,NAZIONALE,intera giornata,https://www.cgsse.it/calendario-scioperi/dettaglio-sciopero/365450,false,2025-04-04,2025-04-04,2025-04-04,2025-04-04
31-03-2025,Istituti di vigilanza,PEGASO SECURITY,"Filcams Cgil, Fisascat Cisl, Uiltucs",NAZIONALE,intero turno di lavoro per tutti i turni di lavoro,https://www.cgsse.it/calendario-scioperi/dettaglio-sciopero/365448,false,2025-03-31,2025-03-31,2025-03-31,2025-03-31
28-03-2025,Metalmeccanici,AZIENDE DEL COMPARTO,"Fiom Cgil, Fim Cisl, Uilm",SALERNO,otto ore,https://www.cgsse.it/calendario-scioperi/dettaglio-sciopero/365434,false,2025-03-28,2025-03-28,2025-03-28,2025-03-28
04-04-2025,Università,MUR,Usb Pubblico Impiego,NAZIONALE,intera giornata,https://www.cgsse.it/calendario-scioperi/dettaglio-sciopero/365430,false,2025-04-04,2025-04-04,2025-04-04,2025-04-04
Dal 28-03-2025 al 29-03-2025,Servizio sanitario nazionale,SE.MA.,"Fiom Cgil, Fim Cisl, Rsu",L'AQUILA,dalle ore 6.00 del 28/03 alle ore 6.00 del 29/03 e il blocco di ogni forma di lavoro straordinario,https://www.cgsse.it/calendario-scioperi/dettaglio-sciopero/365420,false,2025-03-28,2025-03-29,2025-03-28,
25-04-2025,Regioni e autonomie Locali,COMUNE DI COLLEGNO,Cse Flpl,COLLEGNO,intera giornata del personale della polizia locale,https://www.cgsse.it/calendario-scioperi/dettaglio-sciopero/365416,false,2025-04-25,2025-04-25,2025-04-25,2025-04-25
27-03-2025,Sanità privata,RSA VILLA DELLE ROSE,Cub Sanità,CAVA DE' TIRRENI,dalle ore 00.01 alle ore 23.59,https://www.cgsse.it/calendario-scioperi/dettaglio-sciopero/365414,true,2025-03-27,2025-03-27,2025-03-27,2025-03-27
01-04-2025,Trasporto pubblico locale,TPL LINEA,"Filt Cgil, Fit Cisl, Uiltrasporti, Faisa Cisal, Ugl Fna, Rsu, Sial Cobas",SAVONA,dalle ore 10.15 alle ore 14.15,https://www.cgsse.it/calendario-scioperi/dettaglio-sciopero/365412,false,2025-04-01,2025-04-01,2025-04-01,2025-04-01
10-04-2025,Avvocati,SETTORE GIUSTIZIA,Camera Penale Di Napoli Nord In Aversa,AVERSA,astensione dalle udienze e dalle attività giudiziarie nel settore penale,https://www.cgsse.it/calendario-scioperi/dettaglio-sciopero/365392,false,2025-04-10,2025-04-10,2025-04-10,2025-04-10
26-03-2025,Metalmeccanici,AZIENDE DEL COMPARTO,"Fiom Cgil, Uilm Uil, Fim Cisl",SARDEGNA,intera giornata,https://www.cgsse.it/calendario-scioperi/dettaglio-sciopero/365385,false,2025-03-26,2025-03-26,2025-03-26,2025-03-26
26-03-2025,Metalmeccanici,TECNOCASIC,"Fiom Cgil, Uilm Uil, Fim Cisl",CAGLIARI,intera giornata,https://www.cgsse.it/calendario-scioperi/dettaglio-sciopero/365381,false,2025-03-26,2025-03-26,2025-03-26,2025-03-26
28-03-2025,Metalmeccanici,AZIENDE DEL COMPARTO,"Fiom Cgil, Fim Cisl",CASERTA,otto ore,https://www.cgsse.it/calendario-scioperi/dettaglio-sciopero/365372,false,2025-03-28,2025-03-28,2025-03-28,2025-03-28
09-04-2025,Trasporto aereo,"COMPARTO AEREO, AEROPORTUALE E INDOTTO DEGLI AEROPORTI","Proclamante:Cub Trasporti
Aderente:Adl Varese",NAZIONALE,dalle ore 12.00 alle ore 16.00,https://www.cgsse.it/calendario-scioperi/dettaglio-sciopero/365361,true,2025-04-09,2025-04-09,2025-04-09,2025-04-09
25-03-2025,Pulizie e multiservizi,ROMEO GESTIONI,Usb,NAPOLI,dalle ore 00.00 alle ore 23.59,https://www.cgsse.it/calendario-scioperi/dettaglio-sciopero/365358,false,2025-03-25,2025-03-25,2025-03-25,2025-03-25
24-03-2025,Regioni e autonomie Locali,"COOP ORSA, COOP QUADRIFOGLIO",Sgb,BOLOGNA,intera giornata,https://www.cgsse.it/calendario-scioperi/dettaglio-sciopero/365354,false,2025-03-24,2025-03-24,2025-03-24,2025-03-24
24-03-2025,Regioni e autonomie Locali,COOPERATIVA CADIAI,Sgb,BOLOGNA,intera giornata,https://www.cgsse.it/calendario-scioperi/dettaglio-sciopero/365350,false,2025-03-24,2025-03-24,2025-03-24,2025-03-24
24-03-2025,Regioni e autonomie Locali,COMUNE DI BOLOGNA,Sgb,BOLOGNA,intera giornata per tutto il personale dei servizi 0/6,https://www.cgsse.it/calendario-scioperi/dettaglio-sciopero/365346,false,2025-03-24,2025-03-24,2025-03-24,2025-03-24
26-03-2025,Igiene ambientale,DM TECHNOLOGY,Uiltrasporti,VITULAZIO,dalle ore 00.01 alle ore 23.59,https://www.cgsse.it/calendario-scioperi/dettaglio-sciopero/365307,false,2025-03-26,2025-03-26,2025-03-26,2025-03-26
Dal 07-04-2025 al 14-04-2025,Avvocati,SETTORE GIUSTIZIA,Ordine Degli Avvocati Di Nuoro,NUORO,astensione dalle udienze civili e penali e da ogni altra attività giudiziaria,https://www.cgsse.it/calendario-scioperi/dettaglio-sciopero/365303,false,2025-04-07,2025-04-14,2025-04-07,
Dal 31-03-2025 al 02-04-2025,Servizio sanitario nazionale,SECURPOL,Usb Lavoro Privato,NAPOLI,dalle ore 07:00 del 31/3 alle ore 06:59 del 2/4 del personale settore vigilanza privata – guardie giurate,https://www.cgsse.it/calendario-scioperi/dettaglio-sciopero/365298,false,2025-03-31,2025-04-02,2025-03-31,
22-05-2025,Sanità privata,AIOP-ARIS,Ugl Salute,NAZIONALE,intera giornata/turno di lavoro per tutto il personale non medico,https://www.cgsse.it/calendario-scioperi/dettaglio-sciopero/365290,true,2025-05-22,2025-05-22,2025-05-22,2025-05-22
28-03-2025,Metalmeccanici,AZIENDE DEL COMPARTO,"Proclamante:Fiom Cgil, Uilm Uil, Fim Cisl
Aderente:Felsa Cisl, Nidil Cgil, Uiltemp",NAZIONALE,intera giornata o turno di lavoro con esclusione della regione sardegna e della città di firenze,https://www.cgsse.it/calendario-scioperi/dettaglio-sciopero/365288,false,2025-03-28,2025-03-28,2025-03-28,2025-03-28
09-04-2025,Trasporto aereo,GESAP,"Uiltrasporti, Filt Cgil, Fit Cisl, Ugl",PALERMO,dalle ore 10.00 alle ore 18.00,https://www.cgsse.it/calendario-scioperi/dettaglio-sciopero/365278,false,2025-04-09,2025-04-09,2025-04-09,2025-04-09
22-05-2025,Sanità privata,AIOP-ARIS,"Fp Cgil, Fp Cisl, Uil Fpl",NAZIONALE,intera giornata,https://www.cgsse.it/calendario-scioperi/dettaglio-sciopero/365273,true,2025-05-22,2025-05-22,2025-05-22,2025-05-22
26-03-2025,Metalmeccanici,AZIENDE COMPARTO METALMECCANICO,"Fim Cisl, Fiom Cgil, Uilm Uil",PISTOIA,intero turno di lavoro,https://www.cgsse.it/calendario-scioperi/dettaglio-sciopero/365245,false,2025-03-26,2025-03-26,2025-03-26,2025-03-26
26-03-2025,Igiene ambientale,MIRAMARE SERVIZI,Fial,"RAVELLO, AMALFI, SCALA, PRAIANO, VIETRI SUL MARE, POSITANO, MINORI, ATRANI, CONCA DEI MARINI, MAIORI, CETARA, TRAMONTI, FURORE",intera giornata,https://www.cgsse.it/calendario-scioperi/dettaglio-sciopero/365241,true,2025-03-26,2025-03-26,2025-03-26,2025-03-26
Dal 23-03-2025 al 25-03-2025,Istituti di vigilanza,"SICURITALIA IVRI, SICURITALIA SERVIZI DI SICUREZZA",Cisal Sinalv,"COMO , MILANO , PAVIA , LECCO , LODI",dalle ore 15.00 del 23/03 alle ore 15.00 del 25/03,https://www.cgsse.it/calendario-scioperi/dettaglio-sciopero/365239,false,2025-03-23,2025-03-25,2025-03-23,
21-03-2025,Trasporto pubblico locale,BUSITALIA SITA NORD,Usb Lavoro Privato,UMBRIA,"perugia e spoleto fasce garantite dalle 6.00 alle 9.00 e dalle 12.00 alle 15.00, terni fasce garantite dalle 6.30 alle 9.30 e dalle 12.30 alle 15.30, servizi ferroviari fasce garantite dalle 5.45 alle 8.45 e dalle 11,45 alle ore 14.45",https://www.cgsse.it/calendario-scioperi/dettaglio-sciopero/365237,false,2025-03-21,2025-03-21,2025-03-21,2025-03-21
26-03-2025,Metalmeccanici,AZIENDE COMPARTO METALMECCANICO,"Fim Cisl, Fiom Cgil, Uilm Uil","PRATO , PISTOIA , FIRENZE",intero turno di lavoro,https://www.cgsse.it/calendario-scioperi/dettaglio-sciopero/365235,false,2025-03-26,2025-03-26,2025-03-26,2025-03-26
Dal 19-03-2025 al 29-03-2025,Servizio sanitario nazionale,LADISA RISTORAZIONE,Usb,COSENZA,sciopero parziale lavoratori addetti alla refezione ospedaliera asp cosenza,https://www.cgsse.it/calendario-scioperi/dettaglio-sciopero/365229,true,2025-03-19,2025-03-29,2025-03-19,
20-03-2025,Pulizie e multiservizi,COLSER,Usb Lavoro Privato,TOSCANA,dalle ore 7.00 alle ore 20.00,https://www.cgsse.it/calendario-scioperi/dettaglio-sciopero/365220,false,2025-03-20,2025-03-20,2025-03-20,2025-03-20
20-03-2025,Igiene ambientale,IGM RIFIUTI INDUSTRIALI SRL,Fp Cgil,GIARRE,intera giornata,https://www.cgsse.it/calendario-scioperi/dettaglio-sciopero/365218,false,2025-03-20,2025-03-20,2025-03-20,2025-03-20
07-04-2025,Regioni e autonomie Locali,COMUNE DI BOLOGNA,Rsu,BOLOGNA,intera giornata. servizi educativi e dell’infanzia 0-6.,https://www.cgsse.it/calendario-scioperi/dettaglio-sciopero/365215,false,2025-04-07,2025-04-07,2025-04-07,2025-04-07
01-04-2025,Trasporto pubblico locale,AZIENDE DEL SETTORE,"Filt Cgil, Fit Cisl, Uiltrasporti, Faisa Cisal, Ugl",NAZIONALE,"intera giornata con articolazione oraria a livello territoriale escluse le aziende: anm, amat, ferrovie del sudest, gtt, ferrovie udine cividale, st, tft, ferrovia adriatico sangritana, tua, ferrovie del gargano, ferrotramviaria",https://www.cgsse.it/calendario-scioperi/dettaglio-sciopero/365205,true,2025-04-01,2025-04-01,2025-04-01,2025-04-01
19-03-2025,Igiene ambientale,GEMA,Fiadel,CATANIA,intera giornata,https://www.cgsse.it/calendario-scioperi/dettaglio-sciopero/365198,true,2025-03-19,2025-03-19,2025-03-19,2025-03-19
24-03-2025,Trasporto aereo,EASYJET AIRLINE LIMITED,Anpac,NAZIONALE,dalle ore 00.01 alle ore 24.00,https://www.cgsse.it/calendario-scioperi/dettaglio-sciopero/365196,false,2025-03-24,2025-03-24,2025-03-24,2025-03-24
07-04-2025,Regioni e autonomie Locali,COMUNE DI BOLOGNA,Sgb,BOLOGNA,intera giornata,https://www.cgsse.it/calendario-scioperi/dettaglio-sciopero/365193,true,2025-04-07,2025-04-07,2025-04-07,2025-04-07
18-03-2025,Regioni e autonomie Locali,AMICO BUS,Usb Lavoro Privato,"CASCINA, CALCI",intera giornata,https://www.cgsse.it/calendario-scioperi/dettaglio-sciopero/365191,false,2025-03-18,2025-03-18,2025-03-18,2025-03-18
28-04-2025,Trasporto pubblico locale,AMT GENOVA,Cub Trasporti,GENOVA,dalle ore 11.45 alle ore 15.45,https://www.cgsse.it/calendario-scioperi/dettaglio-sciopero/365189,true,2025-04-28,2025-04-28,2025-04-28,2025-04-28
20-03-2025,Igiene ambientale,IGM RIFIUTI INDUSTRIALI SRL,"Fp Cgil, Fiadel, Uiltrasporti",MODICA,intera giornata,https://www.cgsse.it/calendario-scioperi/dettaglio-sciopero/365186,true,2025-03-20,2025-03-20,2025-03-20,2025-03-20
19-03-2025,Igiene ambientale,"DM TECHNOLOGY, WM MAGENTA",Flaica Cub,CASTEL VOLTURNO,dalle ore 00.01 alle ore 23.59,https://www.cgsse.it/calendario-scioperi/dettaglio-sciopero/365182,false,2025-03-19,2025-03-19,2025-03-19,2025-03-19
28-03-2025,Trasporto aereo,"COMPARTO AEREO, AEROPORTUALE E INDOTTO DEGLI AEROPORTI",Cub Trasporti,NAZIONALE,dalle ore 12.00 alle ore 16.00,https://www.cgsse.it/calendario-scioperi/dettaglio-sciopero/365180,true,2025-03-28,2025-03-28,2025-03-28,2025-03-28
26-04-2025,Trasporto pubblico locale,AZIENDE TRASPORTO PUBBLICO LOCALE,Confail Faisa,NAZIONALE,sciopero di 4 ore con articolazione oraria a livello territoriale],https://www.cgsse.it/calendario-scioperi/dettaglio-sciopero/365176,true,2025-04-26,2025-04-26,2025-04-26,2025-04-26
Dal 06-05-2025 al 07-05-2025,Trasporto ferroviario,TRENORD,Orsa Trasporti,LOMBARDIA,dalle ore 3:00 del 6/05 alle ore 2:00 del 7/05,https://www.cgsse.it/calendario-scioperi/dettaglio-sciopero/365174,true,2025-05-06,2025-05-07,2025-05-06,
05-05-2025,Trasporto pubblico locale,AZIENDE TRASPORTO PUBBLICO LOCALE,Confail Faisa,NAZIONALE,sciopero di 4 ore con articolazione oraria a livello territoriale],https://www.cgsse.it/calendario-scioperi/dettaglio-sciopero/365172,true,2025-05-05,2025-05-05,2025-05-05,2025-05-05
08-03-2025,Generale provinciale,TUTTE LE CATEGORIE DEL LAVORO PRIVATO,Confederazione Cobas,TORINO,"otto ore o intero turno di lavoro, con esclusione del trasporto pubblico locale, trasporto ferroviario e vigili del fuoco",https://www.cgsse.it/calendario-scioperi/dettaglio-sciopero/365167,false,2025-03-08,2025-03-08,2025-03-08,2025-03-08
31-03-2025,Trasporto pubblico locale,AMAT,"Filt Cgil, Fit Cisl, Uiltrasporti, Faisa Cisal, Cobas Trasporti, Orsa Trasporti, Ugl Autoferro",PALERMO,dalle ore 8.30 alle ore 17.30,https://www.cgsse.it/calendario-scioperi/dettaglio-sciopero/365165,true,2025-03-31,2025-03-31,2025-03-31,2025-03-31
21-03-2025,Regioni e autonomie Locali,COOPERATIVA CADIAI,Sgb,BOLOGNA,intera giornata,https://www.cgsse.it/calendario-scioperi/dettaglio-sciopero/365157,true,2025-03-21,2025-03-21,2025-03-21,2025-03-21
07-05-2025,Scuola,MIM,"Proclamante: Sgb, Cub Sur
Aderente:Fisi",NAZIONALE,prima ora del turno antimeridiano e/o ultima ora del turno pomeridiano personale docente e ata a tempo determinato ed indeterminato in italia e all'estero,https://www.cgsse.it/calendario-scioperi/dettaglio-sciopero/365155,false,2025-05-07,2025-05-07,2025-05-07,2025-05-07
22-03-2025,Trasporto pubblico locale,EAV,Orsa Trasporti,NAPOLI,dalle ore 19.40 alle ore 23.40,https://www.cgsse.it/calendario-scioperi/dettaglio-sciopero/365152,false,2025-03-22,2025-03-22,2025-03-22,2025-03-22
28-03-2025,Istituti di vigilanza,VERISURE ITALY,"Filcams Cgil, Fisascat Cisl",NAZIONALE,intera giornata,https://www.cgsse.it/calendario-scioperi/dettaglio-sciopero/365147,false,2025-03-28,2025-03-28,2025-03-28,2025-03-28
20-03-2025,Servizio sanitario nazionale,MARKAS,Usb Lavoro Privato,"MONTESCANO, PAVIA",intera giornata,https://www.cgsse.it/calendario-scioperi/dettaglio-sciopero/365144,false,2025-03-20,2025-03-20,2025-03-20,2025-03-20
22-03-2025,Trasporto pubblico locale,ARST,Faisa Cisal,SASSARI,personale viaggiante settore automobilistico - dalle 15:59 alle 23:59 personale viaggiante settore ferrovia - dalle 15:59 alle 23.59 personale viaggiante settore metrotranviario dalle 11:14 alle 13:29 e dalle 15:45 alle 22.00,https://www.cgsse.it/calendario-scioperi/dettaglio-sciopero/365142,true,2025-03-22,2025-03-22,2025-03-22,2025-03-22
24-03-2025,Trasporto aereo,EASYJET AIRLINE LIMITED,"Filt Cgil, Uiltrasporti",NAZIONALE,intera giornata,https://www.cgsse.it/calendario-scioperi/dettaglio-sciopero/365136,false,2025-03-24,2025-03-24,2025-03-24,2025-03-24
21-03-2025,Regioni e autonomie Locali,"COOP ORSA, COOP QUADRIFOGLIO",Sgb,BOLOGNA,intera giornata,https://www.cgsse.it/calendario-scioperi/dettaglio-sciopero/365131,true,2025-03-21,2025-03-21,2025-03-21,2025-03-21
Dal 31-03-2025 al 04-04-2025,Trasporto merci su gomma,AUTOTRASPORTO MERCI,"Proclamante:Trasportounito Flap
Aderente:A.s.r. Autotrasportatori Sardi Riuniti",NAZIONALE,dalle ore 00.00 del 31/03 alle ore 24.00 del 4/04,https://www.cgsse.it/calendario-scioperi/dettaglio-sciopero/365110,true,2025-03-31,2025-04-04,2025-03-31,
08-03-2025,Plurisettoriale territoriale,"SETTORI DEL COMMERCIO, DEL TURISMO E DEI SERVIZI",Filcams Cgil,LUCCA,intera giornata,https://www.cgsse.it/calendario-scioperi/dettaglio-sciopero/365098,false,2025-03-08,2025-03-08,2025-03-08,2025-03-08
18-03-2025,Pulizie e multiservizi,LA LUCENTE,Ugl,POMIGLIANO D'ARCO,intera giornata,https://www.cgsse.it/calendario-scioperi/dettaglio-sciopero/365094,false,2025-03-18,2025-03-18,2025-03-18,2025-03-18
21-03-2025,Trasporto pubblico locale,AZIENDE DEL SETTORE,"Adl Cobas, Sgb, Cub Trasporti, Cobas Lavoro Privato",NAZIONALE,"intera giornata con articolazione oraria a livello territoriale sono escluse le seguenti aziende: amat palermo, eav e anm di napoli e amt di genova",https://www.cgsse.it/calendario-scioperi/dettaglio-sciopero/365091,false,2025-03-21,2025-03-21,2025-03-21,2025-03-21
07-03-2025,Sanità privata,RSA VILLA DELLE ROSE,Cub Sanità,CAVA DE' TIRRENI,sciopero di otto ore per ogni turno lavorativo,https://www.cgsse.it/calendario-scioperi/dettaglio-sciopero/365053,true,2025-03-07,2025-03-07,2025-03-07,2025-03-07
10-03-2025,Energia e petrolio,VERSALIS,"Proclamante:Filctem Cgil
Aderente:Nidil Cgil",NAZIONALE,intera giornata,https://www.cgsse.it/calendario-scioperi/dettaglio-sciopero/365050,false,2025-03-10,2025-03-10,2025-03-10,2025-03-10
31-03-2025,Telecomunicazioni,"3G, CALL2NET, ONEOS, CCONE, GRUPPO INGO, NETWORK CONTACTS, PMC PLUS","Proclamante:Slc Cgil, Fistel Cisl, Uilcom Uil
Aderente:Usb Lavoro Privato",NAZIONALE,intera giornata,https://www.cgsse.it/calendario-scioperi/dettaglio-sciopero/365033,false,2025-03-31,2025-03-31,2025-03-31,2025-03-31
07-03-2025,Istituti di vigilanza,SECURPOL ITALIA VIGILANZA,"Fisascat Cisl, Uiltucs",PALERMO,intera giornata,https://www.cgsse.it/calendario-scioperi/dettaglio-sciopero/365023,false,2025-03-07,2025-03-07,2025-03-07,2025-03-07
Dal 12-04-2025 al 13-04-2025,Trasporto pubblico locale,AMT,Orsa,GENOVA,dalle ore 22.30 del 12/04 alle ore 2.30 del 13/04,https://www.cgsse.it/calendario-scioperi/dettaglio-sciopero/365017,false,2025-04-12,2025-04-13,2025-04-12,
Dal 28-02-2025 al 07-03-2025,Trasporto merci su gomma,AUTOTRASPORTO MERCI,Usb Lavoro Privato,NAZIONALE,con articolazione in base alla distribuzione territoriale degli aderenti,https://www.cgsse.it/calendario-scioperi/dettaglio-sciopero/364969,false,2025-02-28,2025-03-07,2025-02-28,
14-03-2025,Igiene ambientale,ECOCE SRL,Cisal Fiadel,CASALUCE,intera giornata,https://www.cgsse.it/calendario-scioperi/dettaglio-sciopero/364963,true,2025-03-14,2025-03-14,2025-03-14,2025-03-14
10-03-2025,Pulizie e multiservizi,LA LUCENTE,Ugl,POMIGLIANO D'ARCO,intera giornata,https://www.cgsse.it/calendario-scioperi/dettaglio-sciopero/364911,true,2025-03-10,2025-03-10,2025-03-10,2025-03-10
Dal 08-03-2025 al 09-03-2025,Trasporto pubblico locale,ATM GENOVA,Orsa Trasporti,GENOVA,dalle ore 21.00 dell' 8/03 alle ore 5.00 del 9/03,https://www.cgsse.it/calendario-scioperi/dettaglio-sciopero/364909,false,2025-03-08,2025-03-09,2025-03-08,
10-03-2025,Regioni e autonomie Locali,SLEM,Filcams Cgil,RAPOLLA,intera giornata,https://www.cgsse.it/calendario-scioperi/dettaglio-sciopero/364907,true,2025-03-10,2025-03-10,2025-03-10,2025-03-10
10-03-2025,Telecomunicazioni,ASSOCONTACT,Ugl Comunicazioni,NAZIONALE,intera giornata,https://www.cgsse.it/calendario-scioperi/dettaglio-sciopero/364898,true,2025-03-10,2025-03-10,2025-03-10,2025-03-10
21-03-2025,Telecomunicazioni,"AC AGENCY,ACUS,ASSIST DIGITAL,AT TRADE,CALL CENTER ONE,INNOVA SEMPLICE,COLLIGO,COVISIAN,INGO,LINETECH CUSTOMER,CARE LINETECH BUSINESS SERVICES, MEDIATICA, MEDIATICA DIGITAL , MEDIACONTACT, NETWORK CONTACTS,3G,4U,7C ITALIA,+DIGIT,PCM PLUS,QUALITY LAB",Usb Lavoro Privato,NAZIONALE,"intero orario di lavoro di ciascun turno compreso tra le ore 00,00 e le ore 23,59",https://www.cgsse.it/calendario-scioperi/dettaglio-sciopero/364893,false,2025-03-21,2025-03-21,2025-03-21,2025-03-21
08-03-2025,Plurisettoriale territoriale,"SETTORI DEL COMMERCIO, DEL TURISMO E DEI SERVIZI",Filcams Cgil,PISTOIA,intera giornata,https://www.cgsse.it/calendario-scioperi/dettaglio-sciopero/364872,true,2025-03-08,2025-03-08,2025-03-08,2025-03-08
24-03-2025,Trasporto aereo,ASSOHANDLERS,Flai Trasporti E Servizi,NAZIONALE,intera giornata,https://www.cgsse.it/calendario-scioperi/dettaglio-sciopero/364855,false,2025-03-24,2025-03-24,2025-03-24,2025-03-24
08-03-2025,Plurisettoriale territoriale,"SETTORI DEL COMMERCIO, DEL TURISMO E DEI SERVIZI",Filcams Cgil,GROSSETO,intera giornata,https://www.cgsse.it/calendario-scioperi/dettaglio-sciopero/364841,true,2025-03-08,2025-03-08,2025-03-08,2025-03-08
08-03-2025,Plurisettoriale territoriale,"SETTORI DEL COMMERCIO, DEL TURISMO E DEI SERVIZI",Filcams Cgil,PISA,intera giornata,https://www.cgsse.it/calendario-scioperi/dettaglio-sciopero/364837,true,2025-03-08,2025-03-08,2025-03-08,2025-03-08
08-03-2025,Generale nazionale,TUTTE LE CATEGORIE PUBBLICHE E PRIVATE,"Adl Cobas, Clap",NAZIONALE,intera giornata dalle ore 00.01 alle ore 23.59 compreso il primo turno montante per i turnisti con esclusione dell'intero settore dei trasporti,https://www.cgsse.it/calendario-scioperi/dettaglio-sciopero/364832,true,2025-03-08,2025-03-08,2025-03-08,2025-03-08
Dal 08-04-2025 al 09-04-2025,"Trasporto merci su rotaia, Trasporto pubblico locale, Trasporto ferroviario, PLURISETTORIALE TRASPORTI",AZIENDE CHE SVOLGONO ATTIVITA FERROVIARIA,Cub Trasporti,NAZIONALE,dalle ore 21.00 dell' 8/04 alle ore 20.59 del 9/04,https://www.cgsse.it/calendario-scioperi/dettaglio-sciopero/364829,true,2025-04-08,2025-04-09,2025-04-08,
10-03-2025,Telecomunicazioni,"3G, CALL2NET, ONEOS, CCONE, GRUPPO INGO, NETWORK CONTACTS","Slc Cgil, Fistel Cisl, Uilcom Uil",NAZIONALE,intero turno di lavoro,https://www.cgsse.it/calendario-scioperi/dettaglio-sciopero/364794,true,2025-03-10,2025-03-10,2025-03-10,2025-03-10
Dal 11-04-2025 al 12-04-2025,Trasporto ferroviario,TRENITALIA,Orsa Trasporti,"PIEMONTE, VALLE D'AOSTA",dalle ore 3.00 del 11/04 alle ore 2.00 del 12/04,https://www.cgsse.it/calendario-scioperi/dettaglio-sciopero/364786,false,2025-04-11,2025-04-12,2025-04-11,
08-03-2025,Generale provinciale,TUTTE LE CATEGORIE PUBBLICHE E PRIVATE,Confederazione Cobas,BOLOGNA,intera giornata con esclusione del settore trasporti e vigili del fuoco,https://www.cgsse.it/calendario-scioperi/dettaglio-sciopero/364766,false,2025-03-08,2025-03-08,2025-03-08,2025-03-08
08-03-2025,Generale nazionale,TUTTE LE CATEGORIE PUBBLICHE E PRIVATE,"Proclamante:Usb
Aderente:Usb Lavoro Privato, Usb Pubblico Impiego, Fp Cgil Roma E Lazio",NAZIONALE,intera giornata con esclusione dell'intero settore dei trasporti e del comparto sanità pubblica della regione sardegna,https://www.cgsse.it/calendario-scioperi/dettaglio-sciopero/364754,false,2025-03-08,2025-03-08,2025-03-08,2025-03-08
Dal 10-03-2025 al 11-03-2025,Circolazione e sicurezza stradale,SOCOTEC ITALIA,"Fillea Cgil, Filcams Cgil",GENOVA,dalle ore 8.00 del 10/03 alle ore 8.00 dell' 11/03,https://www.cgsse.it/calendario-scioperi/dettaglio-sciopero/364750,false,2025-03-10,2025-03-11,2025-03-10,
08-03-2025,Sanità privata,SETTORE SANITÀ PRIVATA,Cobas Sanita Universita Ricerca,NAZIONALE,intera giornata del personale del settore privato che opera a diverso titolo nella sanità e nell’assistenza,https://www.cgsse.it/calendario-scioperi/dettaglio-sciopero/364744,false,2025-03-08,2025-03-08,2025-03-08,2025-03-08
08-03-2025,Servizio sanitario nazionale,SETTORE SANITÀ PUBBLICA,Cobas Sanita Universita Ricerca,NAZIONALE,intera giornata del personale del servizio sanitario nazionale,https://www.cgsse.it/calendario-scioperi/dettaglio-sciopero/364742,false,2025-03-08,2025-03-08,2025-03-08,2025-03-08
21-03-2025,"Trasporto pubblico locale, Regioni e autonomie Locali",SCHIAFFINI TRAVEL,Slm Fast Confsal,"CASTEL GANDOLFO, VELLETRI, GENAZZANO, MONTE PORZIO CATONE, ROCCA DI PAPA, OLEVANO ROMANO, NETTUNO, NEMI, RIANO, CIAMPINO, TREVIGNANO ROMANO, SAN CESAREO, FRASCATI, PONZA, PONTINIA, ANGUILLARA SABAZIA, FORMELLO, MARINO","dalle ore 8.30 alle ore 17.00 e dalle 20.00 a fine servizio mentre per il bacino di latina da inizio servizio alle ore 6.30, dalle 9.30 alle 13.30 e dalle 16.30 a fine servizio",https://www.cgsse.it/calendario-scioperi/dettaglio-sciopero/364737,false,2025-03-21,2025-03-21,2025-03-21,2025-03-21
Dal 10-03-2025 al 11-03-2025,Igiene ambientale,AMBIENTE SPA,"Fp Cgil, Fit Cisl, Uiltrasporti, Fiadel, Ugl",PESCARA,intere giornate,https://www.cgsse.it/calendario-scioperi/dettaglio-sciopero/364735,true,2025-03-10,2025-03-11,2025-03-10,
19-03-2025,Regioni e autonomie Locali,COOPERATIVA SOCIALE FAST,"Proclamante:Usb
Aderente:Unicobas Scuola E Universita",LIVORNO,"dalle ore 8.00 alle ore 14.00 del personale in appalto al servizio di assistenza specialistica negli istituti superiori: vespucci-colombo, buontalenti-cappellini-orlando e liceo enriques",https://www.cgsse.it/calendario-scioperi/dettaglio-sciopero/364726,false,2025-03-19,2025-03-19,2025-03-19,2025-03-19
21-03-2025,Trasporto pubblico locale,GEST,Cobas Lavoro Privato,FIRENZE,"da inizio servizio alle ore 6.30, dalle ore 9.30 alle ore 17.00, dalle ore 20.00 a fine servizio",https://www.cgsse.it/calendario-scioperi/dettaglio-sciopero/364724,false,2025-03-21,2025-03-21,2025-03-21,2025-03-21
08-03-2025,Generale regionale,SETTORI PUBBLICI E PRIVATI,Confederazione Cobas,FRIULI VENEZIA GIULIA,"intera giornata, con esclusione del settore trasporti e vigili del fuoco",https://www.cgsse.it/calendario-scioperi/dettaglio-sciopero/364722,false,2025-03-08,2025-03-08,2025-03-08,2025-03-08
28-02-2025,Regioni e autonomie Locali,COOPERATIVA SOCIALE FAST,Usb,LIVORNO,"intero turno di lavoro del personale in appalto al servizio di assistenza specialistica negli istituti superiori: vespucci-colombo, buontalenti-cappellini-orlando e liceo enriques",https://www.cgsse.it/calendario-scioperi/dettaglio-sciopero/364712,true,2025-02-28,2025-02-28,2025-02-28,2025-02-28
Dal 18-03-2025 al 20-03-2025,Avvocati,SETTORE GIUSTIZIA,Camera Penale Di Pescara,PESCARA,astensione collettiva dalle udienze e da ogni attività giudiziaria nel settore penale,https://www.cgsse.it/calendario-scioperi/dettaglio-sciopero/364710,false,2025-03-18,2025-03-20,2025-03-18,
30-03-2025,Trasporto pubblico locale,ANM,Usb Lavoro Privato,NAPOLI,dalle ore 12.45 alle ore 16.45],https://www.cgsse.it/calendario-scioperi/dettaglio-sciopero/364702,false,2025-03-30,2025-03-30,2025-03-30,2025-03-30
24-02-2025,Trasporto pubblico locale,"GRUPPO ATM, NET","Filt Cgil, Fit Cisl, Uiltrasporti, Faisa Cisal, Ugl, Orsa","COMO , MILANO , MONZA E DELLA BRIANZA",dalle ore 20.00 a termine servizio,https://www.cgsse.it/calendario-scioperi/dettaglio-sciopero/364698,false,2025-02-24,2025-02-24,2025-02-24,2025-02-24
06-03-2025,Igiene ambientale,GISEC,Usb Lavoro Privato,CASERTA,intera giornata,https://www.cgsse.it/calendario-scioperi/dettaglio-sciopero/364688,true,2025-03-06,2025-03-06,2025-03-06,2025-03-06
10-03-2025,Trasporto pubblico locale,AMTS CATANIA,"Proclamante:Faisa Cisal
Aderente:Uiltrasporti, Ugl, Orsa",CATANIA,dalle ore 12.00 alle ore 16.00,https://www.cgsse.it/calendario-scioperi/dettaglio-sciopero/364686,false,2025-03-10,2025-03-10,2025-03-10,2025-03-10
Dal 24-03-2025 al 28-03-2025,Trasporto merci su gomma,AUTOTRASPORTO MERCI,Trasportounito Flap,NAZIONALE,dalle ore 00.00 del 24/03 alle ore 24.00 del 28/03,https://www.cgsse.it/calendario-scioperi/dettaglio-sciopero/364680,true,2025-03-24,2025-03-28,2025-03-24,
21-03-2025,Trasporto pubblico locale,AMT GENOVA,Ugl Fna,GENOVA,"servizio urbano e ferrovie genova/casella dalle ore 11.30 alle ore 15.30, servzio provinciale dalle ore 10.30 alle ore 14.30",https://www.cgsse.it/calendario-scioperi/dettaglio-sciopero/364678,false,2025-03-21,2025-03-21,2025-03-21,2025-03-21
08-03-2025,Istruzione e ricerca,MIM,Flc Cgil,NAZIONALE,intera giornata,https://www.cgsse.it/calendario-scioperi/dettaglio-sciopero/364675,false,2025-03-08,2025-03-08,2025-03-08,2025-03-08
31-03-2025,Trasporto merci su rotaia,GTS RAIL,"Filt Cgil, Fit Cisl, Uiltrasporti, Ugl Ferrovieri, Fast Confsal",NAZIONALE,dalle ore 16:01 alle ore 23:59,https://www.cgsse.it/calendario-scioperi/dettaglio-sciopero/364673,false,2025-03-31,2025-03-31,2025-03-31,2025-03-31
21-03-2025,Trasporto pubblico locale,CSC MOBILITÀ,"Ugl Fna, Uiltrasporti, Filt Cgil",LATINA,da inizio servizio alle ore 6.30 dalle 9.30 alle 13.30 e dalle 16.30 a fine servizio,https://www.cgsse.it/calendario-scioperi/dettaglio-sciopero/364664,false,2025-03-21,2025-03-21,2025-03-21,2025-03-21
Dal 09-03-2025 al 10-03-2025,Trasporto pubblico locale,ANM,Usb Lavoro Privato,NAPOLI,dalle ore 3.01 del 9/03 alle ore 3.00 del 10/03],https://www.cgsse.it/calendario-scioperi/dettaglio-sciopero/364643,true,2025-03-09,2025-03-10,2025-03-09,
Dal 18-03-2025 al 19-03-2025,"Trasporto merci su rotaia, Trasporto ferroviario, PLURISETTORIALE TRASPORTI",AZIENDE CHE SVOLGONO ATTIVITA FERROVIARIA,Usb Lavoro Privato,NAZIONALE,alle ore 21.00 del 18/03 alle ore 20.59 del 19/03 con esclusione della divisione business e sviluppo intermodale della direzione regionale piemonte e valle d'aosta,https://www.cgsse.it/calendario-scioperi/dettaglio-sciopero/364629,true,2025-03-18,2025-03-19,2025-03-18,
Dal 10-03-2025 al 14-03-2025,Avvocati,SETTORE GIUSTIZIA,Consiglio Dell'ordine Degli Avvocati Di lagonegro,LAGONEGRO,astensione dalle udienze civili e penali,https://www.cgsse.it/calendario-scioperi/dettaglio-sciopero/364615,false,2025-03-10,2025-03-14,2025-03-10,
08-03-2025,Generale regionale,TUTTE LE CATEGORIE PUBBLICHE E PRIVATE,Fp Cgil,TOSCANA,intera giornata. per i turnisti compreso il primo turno montante,https://www.cgsse.it/calendario-scioperi/dettaglio-sciopero/364611,false,2025-03-08,2025-03-08,2025-03-08,2025-03-08
Dal 15-03-2025 al 16-03-2025,Trasporto pubblico locale,AMT,Orsa,GENOVA,dalle ore 22.30 del 15/03 alle ore 2.30 del 16/03,https://www.cgsse.it/calendario-scioperi/dettaglio-sciopero/364607,true,2025-03-15,2025-03-16,2025-03-15,
05-03-2025,Trasporto pubblico locale,ASM TAORMINA,"Filt Cgil, Uiltrasporti, Ugl",TAORMINA,dalle ore 10.00 alle ore 14.00,https://www.cgsse.it/calendario-scioperi/dettaglio-sciopero/364605,true,2025-03-05,2025-03-05,2025-03-05,2025-03-05
22-03-2025,Trasporto pubblico locale,EAV,Orsa Trasporti,NAPOLI,dalle ore 19.40 alle ore 23.40,https://www.cgsse.it/calendario-scioperi/dettaglio-sciopero/364590,false,2025-03-22,2025-03-22,2025-03-22,2025-03-22
19-03-2025,Trasporto ferroviario,"GRUPPO FERROVIE DELLO STATO, ITALO - NTV, TRENITALIA TPER, TRENORD","Ugl Ferrovieri, Fast Confsal, Orsa Trasporti",NAZIONALE,dalle ore 9:01 alle ore 16:59,https://www.cgsse.it/calendario-scioperi/dettaglio-sciopero/364588,false,2025-03-19,2025-03-19,2025-03-19,2025-03-19
01-04-2025,Trasporto pubblico locale,ATM MESSINA,"Fit Cisl, Faisa Cisal, Orsa",MESSINA,dalle ore 16.00 alle ore 23.59,https://www.cgsse.it/calendario-scioperi/dettaglio-sciopero/364566,false,2025-04-01,2025-04-01,2025-04-01,2025-04-01
20-03-2025,Igiene ambientale,TEKNOSERVICE,"Fp Cgil, Uiltrasporti",CAPOTERRA,intera giornata,https://www.cgsse.it/calendario-scioperi/dettaglio-sciopero/364553,false,2025-03-20,2025-03-20,2025-03-20,2025-03-20
11-03-2025,Avvocati,SETTORE GIUSTIZIA,Camera Penale Irpina,AVELLINO,astensione dalle attività giudiziarie,https://www.cgsse.it/calendario-scioperi/dettaglio-sciopero/364518,false,2025-03-11,2025-03-11,2025-03-11,2025-03-11
07-03-2025,Trasporto pubblico locale,ANM,Uiltrasporti,NAPOLI,dalle ore 12.00 alle ore 16.00 del personale settore funicolari,https://www.cgsse.it/calendario-scioperi/dettaglio-sciopero/364515,false,2025-03-07,2025-03-07,2025-03-07,2025-03-07
08-03-2025,Trasporto pubblico locale,EAV,Orsa Trasporti,NAPOLI,dalle ore 19.40 alle ore 23.40,https://www.cgsse.it/calendario-scioperi/dettaglio-sciopero/364492,true,2025-03-08,2025-03-08,2025-03-08,2025-03-08
Dal 21-03-2025 al 22-03-2025,Trasporto ferroviario,TRENITALIA,Orsa Trasporti,"PIEMONTE, VALLE D'AOSTA",dalle ore 3.00 del 21/03 alle ore 2.00 del 22/03,https://www.cgsse.it/calendario-scioperi/dettaglio-sciopero/364490,true,2025-03-21,2025-03-22,2025-03-21,
18-03-2025,Trasporto aereo,SEA PRIME,Usb Lavoro Privato,MILANO,dalle ore 00.00 alle ore 23.59,https://www.cgsse.it/calendario-scioperi/dettaglio-sciopero/364486,false,2025-03-18,2025-03-18,2025-03-18,2025-03-18
Dal 18-03-2025 al 20-03-2025,Trasporto marittimo,CARONTE & TOURIST ISOLE MINORI SPA,"Filt Cgil, Fit Cisl, Uiltrasporti",SICILIA,dalle ore 5.00 del 18/03 alle ore 4.59 del 20/03,https://www.cgsse.it/calendario-scioperi/dettaglio-sciopero/364478,false,2025-03-18,2025-03-20,2025-03-18,
03-03-2025,Igiene ambientale,TEKNOSERVICE,"Fp Cgil, Uiltrasporti",CAPOTERRA,intera giornata,https://www.cgsse.it/calendario-scioperi/dettaglio-sciopero/364466,true,2025-03-03,2025-03-03,2025-03-03,2025-03-03
07-05-2025,Scuola,MIM,"Proclamante:Cobas Scuola Sardegna
Aderente:Sindacato Sociale Di Base-ssb",NAZIONALE,intera giornata,https://www.cgsse.it/calendario-scioperi/dettaglio-sciopero/364455,false,2025-05-07,2025-05-07,2025-05-07,2025-05-07
24-02-2025,Igiene ambientale,ASECO,"Usb Lavoro Privato, Fiom Cgil",TARANTO,"ultime due ore del primo turno,dalle ore 13.00 alle ore 15.00 per il secondo turno e dalle ore 00.20 alle 2.20 per il terzo turno",https://www.cgsse.it/calendario-scioperi/dettaglio-sciopero/364451,true,2025-02-24,2025-02-24,2025-02-24,2025-02-24
26-02-2025,Igiene ambientale,MURACA,Slai Cobas,"NICOTERA, MILETO, ROMBIOLO",intera giornata,https://www.cgsse.it/calendario-scioperi/dettaglio-sciopero/364448,false,2025-02-26,2025-02-26,2025-02-26,2025-02-26
31-03-2025,Telecomunicazioni,AZIENDE DEL SETTORE,"Slc Cgil, Fistel Cisl, Uilcom Uil",NAZIONALE,intera giornata,https://www.cgsse.it/calendario-scioperi/dettaglio-sciopero/364397,false,2025-03-31,2025-03-31,2025-03-31,2025-03-31
28-02-2025,Credito,BANCA D'ITALIA,"Falbi, Sibc Cisal",NAZIONALE,"ultime 4 ore di ogni turno del personale addetto alla rete territoriale, per i dipendenti in regime di part time l'astensione è limitata alle ultime 2 ore di ogni turno",https://www.cgsse.it/calendario-scioperi/dettaglio-sciopero/364393,false,2025-02-28,2025-02-28,2025-02-28,2025-02-28
08-03-2025,Plurisettoriale territoriale,"PUBBLICA AMMINISTRAZIONE, SANITÀ, IGIENE AMBIENTALE, TERZO SETTORE",Fp Cgil,BOLOGNA,intera giornata,https://www.cgsse.it/calendario-scioperi/dettaglio-sciopero/364389,false,2025-03-08,2025-03-08,2025-03-08,2025-03-08
Dal 24-02-2025 al 25-02-2025,Circolazione e sicurezza stradale,SOCOTEC ITALIA,"Fillea Cgil, Filcams Cgil",GENOVA,dalle ore 8.00 del 24/02 alle ore 8.00 del 25/02,https://www.cgsse.it/calendario-scioperi/dettaglio-sciopero/364387,false,2025-02-24,2025-02-25,2025-02-24,
Dal 14-02-2025 al 15-02-2025,Circolazione e sicurezza stradale,SOCOTEC ITALIA,"Fillea Cgil, Filcams Cgil",GENOVA,dalle ore 8.00 del 14/02 alle ore 8.00 del 15/02,https://www.cgsse.it/calendario-scioperi/dettaglio-sciopero/364382,true,2025-02-14,2025-02-15,2025-02-14,
28-02-2025,Metalmeccanici,AZIENDE DEL COMPARTO,"Fiom Cgil, Uilm Uil, Fim Cisl",SALERNO,otto ore,https://www.cgsse.it/calendario-scioperi/dettaglio-sciopero/364366,false,2025-02-28,2025-02-28,2025-02-28,2025-02-28
25-02-2025,Metalmeccanici,AZIENDE DEL COMPARTO,"Fiom Cgil, Uilm Uil, Fim Cisl",SALERNO,otto ore,https://www.cgsse.it/calendario-scioperi/dettaglio-sciopero/364362,false,2025-02-25,2025-02-25,2025-02-25,2025-02-25
21-02-2025,Metalmeccanici,AZIENDE DEL COMPARTO,"Fiom Cgil, Uilm Uil, Fim Cisl",SALERNO,otto ore,https://www.cgsse.it/calendario-scioperi/dettaglio-sciopero/364358,false,2025-02-21,2025-02-21,2025-02-21,2025-02-21
01-04-2025,Trasporto pubblico locale,ATM MESSINA,"Fit Cisl, Faisa Cisal, Orsa",MESSINA,dalle ore 9.30 alle ore 12.30 e dalle ore 16.00 alle ore 21.00,https://www.cgsse.it/calendario-scioperi/dettaglio-sciopero/364340,true,2025-04-01,2025-04-01,2025-04-01,2025-04-01
Dal 27-02-2025 al 28-02-2025,Servizio sanitario nazionale,ASL TARANTO,M.a.s.t. Movimento Autisti Soccorritori S.e.u. 118 Taranto,TARANTO,intere giornate,https://www.cgsse.it/calendario-scioperi/dettaglio-sciopero/364329,true,2025-02-27,2025-02-28,2025-02-27,
24-02-2025,Circolazione e sicurezza stradale,ISGRÒ COSTRUZIONI,Fiom Cgil,MESSINA,dalle ore 10.00 alle ore 18.00 operai del servizio di sorveglianza autostradale,https://www.cgsse.it/calendario-scioperi/dettaglio-sciopero/364292,false,2025-02-24,2025-02-24,2025-02-24,2025-02-24
16-03-2025,Trasporto aereo,ASSOHANDLERS,Flai Trasporti E Servizi,NAZIONALE,intera giornata,https://www.cgsse.it/calendario-scioperi/dettaglio-sciopero/364290,true,2025-03-16,2025-03-16,2025-03-16,2025-03-16
24-02-2025,Trasporto aereo,AEROITALIA,"Filt Cgil, Uiltrasporti, Anpac, Anp",NAZIONALE,"dalle ore 12.00 alle ore 16.00 del personale navigante (piloti e assistenti di volo), con esclusione dei voli da e per palermo e venezia",https://www.cgsse.it/calendario-scioperi/dettaglio-sciopero/364284,false,2025-02-24,2025-02-24,2025-02-24,2025-02-24
21-02-2025,Metalmeccanici,TECNOCASIC,"Fiom Cgil, Uilm Uil, Fim Cisl",CAGLIARI,intera giornata,https://www.cgsse.it/calendario-scioperi/dettaglio-sciopero/364264,false,2025-02-21,2025-02-21,2025-02-21,2025-02-21
21-02-2025,Sanità privata,"RISTOSAN & VALESAN, SODEXO ITALIA","Filcams Cgil, Fisascat Cisl, Uiltucs, Orsa Filsa",NAPOLI,intera giornata e/o turno di lavoro,https://www.cgsse.it/calendario-scioperi/dettaglio-sciopero/364249,true,2025-02-21,2025-02-21,2025-02-21,2025-02-21
21-02-2025,Sanità privata,CENTRO RIABILITAZIONE SAN ROCCO,Fpl Uil,"CASOLI, ATESSA",intera giornata,https://www.cgsse.it/calendario-scioperi/dettaglio-sciopero/364243,true,2025-02-21,2025-02-21,2025-02-21,2025-02-21
08-03-2025,Generale nazionale,TUTTE LE CATEGORIE PUBBLICHE E PRIVATE,"Proclamante:Cub
Aderente:Cub Sanità, Cub Poste, Adl Cobas, Clap",NAZIONALE,intera giornata con esclusione dell'intero settore dei trasporti e del comparto sanità pubblica della regione sardegna,https://www.cgsse.it/calendario-scioperi/dettaglio-sciopero/364240,false,2025-03-08,2025-03-08,2025-03-08,2025-03-08
21-02-2025,Igiene ambientale,ISVEC,Usb Lavoro Privato,TEVEROLA,intero turno di lavoro,https://www.cgsse.it/calendario-scioperi/dettaglio-sciopero/364238,false,2025-02-21,2025-02-21,2025-02-21,2025-02-21
Dal 24-02-2025 al 25-02-2025,Avvocati,SETTORE GIUSTIZIA,Camera Penale Ferrarese,FERRARA,astensione dalle udienze e da ogni attività giudiziaria nel settore penale,https://www.cgsse.it/calendario-scioperi/dettaglio-sciopero/364215,false,2025-02-24,2025-02-25,2025-02-24,
25-04-2025,Regioni e autonomie Locali,COMUNE DI COLLEGNO,Cse Flpl,COLLEGNO,intera giornata del personale della polizia locale,https://www.cgsse.it/calendario-scioperi/dettaglio-sciopero/364210,true,2025-04-25,2025-04-25,2025-04-25,2025-04-25
21-02-2025,Metalmeccanici,AZIENDE DEL COMPARTO,"Fiom Cgil, Uilm Uil, Fim Cisl",TRENTO,intera giornata,https://www.cgsse.it/calendario-scioperi/dettaglio-sciopero/364207,false,2025-02-21,2025-02-21,2025-02-21,2025-02-21
25-02-2025,Pulizie e multiservizi,"EGEA GLOBAL SERVICE, GRUPPO MERIDIANO",Filcams Cgil,CALTAGIRONE,intera giornata,https://www.cgsse.it/calendario-scioperi/dettaglio-sciopero/364184,true,2025-02-25,2025-02-25,2025-02-25,2025-02-25
13-02-2025,Trasporto pubblico locale,ATAC,"Usb Lavoro Privato, Orsa Tpl",ROMA,dalle ore 20.00 alle ore 24.00 del personale dipendente del deposito di magliana superficie,https://www.cgsse.it/calendario-scioperi/dettaglio-sciopero/364182,false,2025-02-13,2025-02-13,2025-02-13,2025-02-13
10-03-2025,Trasporto pubblico locale,ATM MESSINA,"Filt Cgil, Uiltrasporti, Ugl Autoferro",MESSINA,dalle ore 16.00 alle ore 20.00,https://www.cgsse.it/calendario-scioperi/dettaglio-sciopero/364148,true,2025-03-10,2025-03-10,2025-03-10,2025-03-10
21-03-2025,Regioni e autonomie Locali,COMUNE DI BOLOGNA,Sgb,BOLOGNA,intera giornata per tutto il personale dei servizi 0/6,https://www.cgsse.it/calendario-scioperi/dettaglio-sciopero/364144,true,2025-03-21,2025-03-21,2025-03-21,2025-03-21
24-02-2025,Trasporto aereo,EASYJET AIRLINE LIMITED,Anpac,NAZIONALE,dalle ore 12.00 alle ore 16.00 con esclusione dei voli da e per gli aeroporti di palermo e venezia,https://www.cgsse.it/calendario-scioperi/dettaglio-sciopero/364136,false,2025-02-24,2025-02-24,2025-02-24,2025-02-24
Dal 19-02-2025 al 20-02-2025,Avvocati,SETTORE GIUSTIZIA,Camera Penale Di Rimini,RIMINI,astensione dalle udienze e da ogni attività giudiziaria nel settore penale,https://www.cgsse.it/calendario-scioperi/dettaglio-sciopero/364133,false,2025-02-19,2025-02-20,2025-02-19,
24-02-2025,Trasporto aereo,EASYJET AIRLINE LIMITED,"Filt Cgil, Uiltrasporti",NAZIONALE,dalle ore 12.00 alle ore 16.00 con esclusione dei voli da e per gli aeroporti di palermo e venezia,https://www.cgsse.it/calendario-scioperi/dettaglio-sciopero/364126,false,2025-02-24,2025-02-24,2025-02-24,2025-02-24
Dal 18-03-2025 al 20-03-2025,MAGISTRATI TOGATI E ONORARI,MINISTERO DELLA GIUSTIZIA,Associazione Magistrati Tributari,NAZIONALE,astensione dalle udienze,https://www.cgsse.it/calendario-scioperi/dettaglio-sciopero/364112,false,2025-03-18,2025-03-20,2025-03-18,
Dal 19-02-2025 al 20-02-2025,Avvocati,SETTORE GIUSTIZIA,Camera Penale Della Romagna,"RAVENNA , FORLI'-CESENA",astensione dalle udienze e da ogni attività giudiziaria nel settore penale,https://www.cgsse.it/calendario-scioperi/dettaglio-sciopero/364108,false,2025-02-19,2025-02-20,2025-02-19,
Dal 19-02-2025 al 20-02-2025,Avvocati,SETTORE GIUSTIZIA,Camera Penale Di Bologna,BOLOGNA,astensione dalle udienze e da ogni attività giudiziaria nel settore penale,https://www.cgsse.it/calendario-scioperi/dettaglio-sciopero/364098,false,2025-02-19,2025-02-20,2025-02-19,
Dal 20-02-2025 al 21-02-2025,Avvocati,SETTORE GIUSTIZIA,Camera Penale Di Piacenza,PIACENZA,astensione dalle udienze e da ogni attività giudiziaria nel settore penale,https://www.cgsse.it/calendario-scioperi/dettaglio-sciopero/364096,false,2025-02-20,2025-02-21,2025-02-20,
Dal 20-02-2025 al 21-02-2025,Avvocati,SETTORE GIUSTIZIA,Camera Penale Di Reggio Emilia,REGGIO NELL'EMILIA,astensione dalle udienze e da ogni attività giudiziaria nel settore penale,https://www.cgsse.it/calendario-scioperi/dettaglio-sciopero/364091,false,2025-02-20,2025-02-21,2025-02-20,
24-02-2025,Avvocati,SETTORE GIUSTIZIA,Associazione Forense Isola D'ischia,ISCHIA,astensione da tutte le udienze civili e penali,https://www.cgsse.it/calendario-scioperi/dettaglio-sciopero/364088,false,2025-02-24,2025-02-24,2025-02-24,2025-02-24
28-02-2025,Acqua,"ACQUA AMBIENTE MARCHE SRL, VALLI VARANENSI SRL, CENTRO MARCHE ACQUE SRL, APM MACERATA SPA, ASTEA SPA, ATAC CIVITANOVA SPA, ASSM SPA, ASSEM SPA, UNIDRA SCRL, S.I. MARCHE SCRL","Filctem Cgil, Femca Cisl, Flaei Cisl, Uiltec Uil","ANCONA , MACERATA",intero turno di lavoro,https://www.cgsse.it/calendario-scioperi/dettaglio-sciopero/364069,false,2025-02-28,2025-02-28,2025-02-28,2025-02-28
Dal 20-02-2025 al 21-02-2025,Avvocati,SETTORE GIUSTIZIA,Camera Penale Di Parma,PARMA,astensione dalle udienze e da ogni attività giudiziaria nel settore penale,https://www.cgsse.it/calendario-scioperi/dettaglio-sciopero/364014,false,2025-02-20,2025-02-21,2025-02-20,
Dal 17-02-2025 al 18-02-2025,Regioni e autonomie Locali,"TERZO MILLENNIO, ASD, NASCE UN SORRISO, OZANAM, SOCRATE",Confsafi,"CASTEL MORRONE, CASERTA, SAN NICOLA LA STRADA, CASAGIOVE",intere giornate,https://www.cgsse.it/calendario-scioperi/dettaglio-sciopero/364012,false,2025-02-17,2025-02-18,2025-02-17,
16-02-2025,Regioni e autonomie Locali,COMUNE DI VERONA,Cse Flpl,VERONA,intera giornata,https://www.cgsse.it/calendario-scioperi/dettaglio-sciopero/364009,false,2025-02-16,2025-02-16,2025-02-16,2025-02-16
Dal 19-02-2025 al 20-02-2025,Avvocati,SETTORE GIUSTIZIA,Camera Penale Di Modena,MODENA,astensione dalle udienze e da ogni attività giudiziaria nel settore penale,https://www.cgsse.it/calendario-scioperi/dettaglio-sciopero/364000,false,2025-02-19,2025-02-20,2025-02-19,
06-02-2025,Igiene ambientale,MURACA,Slai Cobas,NICOTERA,intera giornata,https://www.cgsse.it/calendario-scioperi/dettaglio-sciopero/363994,false,2025-02-06,2025-02-06,2025-02-06,2025-02-06
23-02-2025,Trasporto ferroviario,"GRUPPO FERROVIE DELLO STATO, ITALO - NTV, TRENITALIA TPER, TRENORD","Ugl Ferrovieri, Fast Confsal, Orsa Trasporti",NAZIONALE,dalle ore 9:01 alle ore 16:59,https://www.cgsse.it/calendario-scioperi/dettaglio-sciopero/363964,true,2025-02-23,2025-02-23,2025-02-23,2025-02-23
28-02-2025,Trasporto aereo,EASYJET AIRLINE LIMITED,Anpac,NAZIONALE,dalle ore 12.00 alle ore 16.00,https://www.cgsse.it/calendario-scioperi/dettaglio-sciopero/363958,true,2025-02-28,2025-02-28,2025-02-28,2025-02-28
Dal 16-02-2025 al 18-02-2025,Istituti di vigilanza,SICURITALIA IVRI,Cisal Sinalv,"COMO , MILANO , PAVIA , LECCO , LODI",dalle ore 15.00 del 16/02 alle ore 15.00 del 18/02,https://www.cgsse.it/calendario-scioperi/dettaglio-sciopero/363953,false,2025-02-16,2025-02-18,2025-02-16,
28-02-2025,Trasporto aereo,EASYJET AIRLINE LIMITED,"Filt Cgil, Uiltrasporti",NAZIONALE,dalle ore 12.00 alle ore 16.00,https://www.cgsse.it/calendario-scioperi/dettaglio-sciopero/363948,true,2025-02-28,2025-02-28,2025-02-28,2025-02-28
Dal 17-02-2025 al 18-02-2025,Sanità privata,CENTRO SERAPIDE,Fp Cgil,POZZUOLI,dalle ore 8.00 del 17/02 alle ore 8.00 del 18/02,https://www.cgsse.it/calendario-scioperi/dettaglio-sciopero/363945,false,2025-02-17,2025-02-18,2025-02-17,
08-11-2024,Trasporto pubblico locale,AZIENDA DEL SETTORE,Sinai,LECCE,intera giornata con il rispetto delle fascie di garanzia,https://www.cgsse.it/calendario-scioperi/dettaglio-sciopero/363925,false,2024-11-08,2024-11-08,2024-11-08,2024-11-08
17-02-2025,Pulizie e multiservizi,"CNS CONSORZIO NAZIONALE SERVIZI, DIEMME, GOSER, IBM, PULIM",Usb Lavoro Privato,NAPOLI,intera giornata,https://www.cgsse.it/calendario-scioperi/dettaglio-sciopero/363923,false,2025-02-17,2025-02-17,2025-02-17,2025-02-17
16-03-2025,Regioni e autonomie Locali,COMUNE DI COLLEGNO,Cse Flpl,COLLEGNO,intera giornata del personale della polizia locale,https://www.cgsse.it/calendario-scioperi/dettaglio-sciopero/363916,true,2025-03-16,2025-03-16,2025-03-16,2025-03-16
17-02-2025,Igiene ambientale,E. GIOVI,Fit Cisl,ROMA,intero turno di lavoro,https://www.cgsse.it/calendario-scioperi/dettaglio-sciopero/363913,false,2025-02-17,2025-02-17,2025-02-17,2025-02-17
26-02-2025,Trasporto pubblico locale,ATM MESSINA,"Filt Cgil, Uiltrasporti, Ugl Autoferro",MESSINA,dalle ore 16.00 alle ore 20.00,https://www.cgsse.it/calendario-scioperi/dettaglio-sciopero/363911,true,2025-02-26,2025-02-26,2025-02-26,2025-02-26
16-02-2025,Pulizie e multiservizi,ISS ITALIA,Ugl,NAPOLI,intera giornata,https://www.cgsse.it/calendario-scioperi/dettaglio-sciopero/363907,false,2025-02-16,2025-02-16,2025-02-16,2025-02-16
19-02-2025,Scuola,LICEO STATALE NORBERTO ROSA,"Proclamante:Flc Cgil
Aderente:Cub Sur",SUSA,intera giornata,https://www.cgsse.it/calendario-scioperi/dettaglio-sciopero/363904,false,2025-02-19,2025-02-19,2025-02-19,2025-02-19
28-02-2025,Trasporto aereo,BGY INTERNATIONAL SERVICES SRL,Cub Trasporti,BERGAMO,dalle ore 12.00 alle ore 16.00,https://www.cgsse.it/calendario-scioperi/dettaglio-sciopero/363901,true,2025-02-28,2025-02-28,2025-02-28,2025-02-28
26-02-2025,Regioni e autonomie Locali,COMUNE DI BOLOGNA,Sgb,BOLOGNA,intera giornata del personale della polizia locale,https://www.cgsse.it/calendario-scioperi/dettaglio-sciopero/363899,false,2025-02-26,2025-02-26,2025-02-26,2025-02-26
28-02-2025,Trasporto aereo,AGS HANDLING,Cub Trasporti,BERGAMO,dalle ore 12.00 alle ore 16.00,https://www.cgsse.it/calendario-scioperi/dettaglio-sciopero/363895,true,2025-02-28,2025-02-28,2025-02-28,2025-02-28
14-02-2025,Ministeri,AZIENDE E STRUTTURE DEL SETTORE,Sgb,NAPOLI,intera giornata,https://www.cgsse.it/calendario-scioperi/dettaglio-sciopero/363891,false,2025-02-14,2025-02-14,2025-02-14,2025-02-14
16-03-2025,Trasporto aereo,TECHNO SKY,"Filt Cgil, Rsu",MILANO,personale h35 dalle ore 12:00 alle ore 16:00,https://www.cgsse.it/calendario-scioperi/dettaglio-sciopero/363889,true,2025-03-16,2025-03-16,2025-03-16,2025-03-16
24-02-2025,Trasporto pubblico locale,AZIENDE DEL SETTORE,Usb Lavoro Privato,NAZIONALE,"intera giornata con articolazione oraria a livello territoriale. sono escluse dallo sciopero le aziende: sabato viaggi, ferrovie appulo lucane e p.scoppio di bari, amat di palermo, autoservizi tessitore di vasto, fnm milano",https://www.cgsse.it/calendario-scioperi/dettaglio-sciopero/363886,false,2025-02-24,2025-02-24,2025-02-24,2025-02-24
08-03-2025,Generale nazionale,TUTTE LE CATEGORIE PUBBLICHE E PRIVATE,Slai Cobas Per Il Sindacato Di classe,NAZIONALE,"intera giornata, per il personale addetto alla circolazione e attività ferroviaria dalle ore 00:00 alle ore 21:00, per i vigili del fuoco dalle ore 8:00 alle ore 14:00",https://www.cgsse.it/calendario-scioperi/dettaglio-sciopero/363882,false,2025-03-08,2025-03-08,2025-03-08,2025-03-08
14-02-2025,Trasporto pubblico locale,AUTOGUIDOVIE SPA,"Fit Cisl, Ugl",PAVIA,"da inizio servizio alle ore 5.329, dalle ore 8.31 alle ore 14.59 e dalle ore 18.01 a fine servizio",https://www.cgsse.it/calendario-scioperi/dettaglio-sciopero/363880,false,2025-02-14,2025-02-14,2025-02-14,2025-02-14
Dal 22-02-2025 al 23-02-2025,"Trasporto merci su rotaia, Trasporto ferroviario, PLURISETTORIALE TRASPORTI",AZIENDE CHE SVOLGONO ATTIVITA FERROVIARIA,"Proclamante:Usb Lavoro Privato
Aderente:Assemblea Nazionale Pdm/pdb",NAZIONALE,dalle ore 21.00 del 22/02 alle ore 20.59 del 23/02,https://www.cgsse.it/calendario-scioperi/dettaglio-sciopero/363850,true,2025-02-22,2025-02-23,2025-02-22,
11-02-2025,Regioni e autonomie Locali,COMUNE DI VARESE,"Fp Cgil, Al Cobas, Cisl Fp, Uil Fpl, Csa, Rsu",VARESE,dalle ore 8.00 alle ore 10.00,https://www.cgsse.it/calendario-scioperi/dettaglio-sciopero/363842,false,2025-02-11,2025-02-11,2025-02-11,2025-02-11
09-02-2025,Ministeri,SOCIETA COOPERATIVE CULTURE,Filcams Cgil,TORINO,intero turno di lavoro con garanzia del servizio dalle ore 9.00 alle ore 13.30,https://www.cgsse.it/calendario-scioperi/dettaglio-sciopero/363835,false,2025-02-09,2025-02-09,2025-02-09,2025-02-09
09-02-2025,Ministeri,SOCIETA COOPERATIVE CULTURE,Usb,TORINO,intero turno di lavoro con garanzia del servizio dalle ore 9.00 alle ore 13.30,https://www.cgsse.it/calendario-scioperi/dettaglio-sciopero/363810,false,2025-02-09,2025-02-09,2025-02-09,2025-02-09
13-02-2025,"Sanità privata, Servizio sanitario nazionale",AZIENDE SANITARIE ACCREDITATE AL SERVIZIO SANTARIO NAZIONALE,Cimop,NAZIONALE,intera giornata,https://www.cgsse.it/calendario-scioperi/dettaglio-sciopero/363808,false,2025-02-13,2025-02-13,2025-02-13,2025-02-13
09-02-2025,Trasporto pubblico locale,ANM,Usb Lavoro Privato,NAPOLI,dalle ore 12.45 alle ore 16.45,https://www.cgsse.it/calendario-scioperi/dettaglio-sciopero/363806,false,2025-02-09,2025-02-09,2025-02-09,2025-02-09
15-03-2025,Trasporto pubblico locale,AMAT,Cub Trasporti,PALERMO,dalle ore 11.00 alle ore 15.00,https://www.cgsse.it/calendario-scioperi/dettaglio-sciopero/363804,false,2025-03-15,2025-03-15,2025-03-15,2025-03-15
10-02-2025,Trasporto pubblico locale,ATM MESSINA,"Fit Cisl, Faisa Cisal, Orsa",MESSINA,dalle ore 16.00 alle ore 20.00,https://www.cgsse.it/calendario-scioperi/dettaglio-sciopero/363799,false,2025-02-10,2025-02-10,2025-02-10,2025-02-10
06-09-2024,Telecomunicazioni,"ASSIST DIGITAL, COVISIAN, MEDIATICA, NETWORK CONTACTS","Slc Cgil, Fistel Cisl, Ugl Telecomunicazioni",PUGLIA,,https://www.cgsse.it/calendario-scioperi/dettaglio-sciopero/363794,false,2024-09-06,2024-09-06,2024-09-06,2024-09-06
04-10-2024,Servizio sanitario nazionale,POLYGON,Fiom Cgil,ROMA,8 ore di ogni turno,https://www.cgsse.it/calendario-scioperi/dettaglio-sciopero/363739,true,2024-10-04,2024-10-04,2024-10-04,2024-10-04
10-02-2025,"Gas, Acqua",GRUPPO AMAG,"Filctem Cgil, Femca Cisl, Uiltec Uil",ALESSANDRIA,otto ore,https://www.cgsse.it/calendario-scioperi/dettaglio-sciopero/363718,false,2025-02-10,2025-02-10,2025-02-10,2025-02-10
05-02-2025,Istituti di vigilanza,COSMOPOL,Filcams Cgil,AVELLINO,dalle ore 00:01 alle ore 24:00,https://www.cgsse.it/calendario-scioperi/dettaglio-sciopero/363708,false,2025-02-05,2025-02-05,2025-02-05,2025-02-05
24-02-2025,Trasporto pubblico locale,AUTOSERVIZI TESSITORE,Faisa Cisal,VASTO,dalle ore 9:00 alle ore 13:00,https://www.cgsse.it/calendario-scioperi/dettaglio-sciopero/363699,true,2025-02-24,2025-02-24,2025-02-24,2025-02-24
10-02-2025,Vigili del fuoco,MINISTERO DELL'INTERNO,"Fp Cgil Vvf, Fns Cisl, Uilpa Vvf, Confsal Vvf, Usb",MESSINA,"personale operativo dalle ore 9:00 alle ore 13.00, personale giornaliero o amministrativo intera giornata",https://www.cgsse.it/calendario-scioperi/dettaglio-sciopero/363697,false,2025-02-10,2025-02-10,2025-02-10,2025-02-10
28-02-2025,Trasporto pubblico locale,SABATO VIAGGI,"Filt Cgil, Fit Cisl, Faisa Cisal",BARI,"dalle ore 00.01 alle ore 5.29, dalle ore 8.30 alle ore 12.29, dalle ore 15.30 a fine servizio",https://www.cgsse.it/calendario-scioperi/dettaglio-sciopero/363691,false,2025-02-28,2025-02-28,2025-02-28,2025-02-28
28-02-2025,Trasporto pubblico locale,FERROVIE APPULO LUCANE,Faisa Cisal,BARI,"dalle ore 00.01 alle ore 5.29, dalle 8.30 alle 12.29 e dalle 15.30 alle 24.00",https://www.cgsse.it/calendario-scioperi/dettaglio-sciopero/363681,false,2025-02-28,2025-02-28,2025-02-28,2025-02-28
06-02-2025,Servizio sanitario nazionale,DUSSMANN,"Ugl, Orsa",NAPOLI,intera giornata,https://www.cgsse.it/calendario-scioperi/dettaglio-sciopero/363636,false,2025-02-06,2025-02-06,2025-02-06,2025-02-06
28-01-2025,Trasporto pubblico locale,EAV,Usb,NAPOLI,dalle ore 8.20 alle ore 12.20,https://www.cgsse.it/calendario-scioperi/dettaglio-sciopero/363633,false,2025-01-28,2025-01-28,2025-01-28,2025-01-28
28-01-2025,Trasporto pubblico locale,EAV,"Filt Cgil, Fit Cisl, Uiltrasporti, Ugl, Faisa Cisal",NAPOLI,dalle ore 8.20 alle ore 12.20,https://www.cgsse.it/calendario-scioperi/dettaglio-sciopero/363631,false,2025-01-28,2025-01-28,2025-01-28,2025-01-28
14-02-2025,Trasporto pubblico locale,CSC MOBILITÀ,"Ugl Fna, Uiltrasporti, Filt Cgil",LATINA,dalle ore 16:30 alle ore 20:30,https://www.cgsse.it/calendario-scioperi/dettaglio-sciopero/363625,false,2025-02-14,2025-02-14,2025-02-14,2025-02-14
06-02-2025,Telecomunicazioni,KONECTA,"Slc Cgil, Uilcom Uil",GENOVA,intera giornata,https://www.cgsse.it/calendario-scioperi/dettaglio-sciopero/363621,false,2025-02-06,2025-02-06,2025-02-06,2025-02-06
13-02-2025,Avvocati,SETTORE GIUSTIZIA,Camera Penale Di Nola,NOLA,astensione dalle udienze e da ogni attività giudiziaria nel settore penale,https://www.cgsse.it/calendario-scioperi/dettaglio-sciopero/363618,false,2025-02-13,2025-02-13,2025-02-13,2025-02-13
28-01-2025,Trasporto pubblico locale,EAV,Confail Faisa,NAPOLI,dalle ore 8.20 alle ore 12.20,https://www.cgsse.it/calendario-scioperi/dettaglio-sciopero/363616,false,2025-01-28,2025-01-28,2025-01-28,2025-01-28
28-01-2025,Trasporto pubblico locale,EAV,Orsa Trasporti,NAPOLI,dalle ore 8.20 alle ore 12.20,https://www.cgsse.it/calendario-scioperi/dettaglio-sciopero/363614,false,2025-01-28,2025-01-28,2025-01-28,2025-01-28
07-02-2025,Igiene ambientale,IDEALSERVICE,Fit Cisl,CIGOGNOLA,dalle ore 00.01 alle ore 6.20,https://www.cgsse.it/calendario-scioperi/dettaglio-sciopero/363580,false,2025-02-07,2025-02-07,2025-02-07,2025-02-07
22-02-2025,Igiene ambientale,PRIMAVERA,"Fp Cgil, Fit Cisl, Uiltrasporti, Fiadel, Usb",TORRE ANNUNZIATA,intera giornata o turno di lavoro,https://www.cgsse.it/calendario-scioperi/dettaglio-sciopero/363575,true,2025-02-22,2025-02-22,2025-02-22,2025-02-22
11-02-2025,Servizio sanitario nazionale,CONSORZIO TOSCANA SERVIZI,"Filcams Cgil, Fisascat Cisl, Uiltrasporti",TOSCANA,intera giornata o turno di lavoro,https://www.cgsse.it/calendario-scioperi/dettaglio-sciopero/363569,false,2025-02-11,2025-02-11,2025-02-11,2025-02-11
07-02-2025,Istituti di vigilanza,EUROPOLICE,Uiltucs,CATANIA,intera giornata,https://www.cgsse.it/calendario-scioperi/dettaglio-sciopero/363490,true,2025-02-07,2025-02-07,2025-02-07,2025-02-07
08-03-2025,Generale nazionale,TUTTE LE CATEGORIE PUBBLICHE E PRIVATE,Usi-Cit,NAZIONALE,"intera giornata con esclusione di gesap palermo, aviation services (presso aeroporto di venezia) e comparto sanità pubblica della regione sardegna",https://www.cgsse.it/calendario-scioperi/dettaglio-sciopero/363486,false,2025-03-08,2025-03-08,2025-03-08,2025-03-08
10-02-2025,Servizio sanitario nazionale,CIR FOOD,Confsal,PAVIA,"primo turno dalle ore 6:30 alle 10:30, secondo turno dalle 10:30 alle 15:30, terzo turno dalle 16:00 alle 20:30",https://www.cgsse.it/calendario-scioperi/dettaglio-sciopero/363481,true,2025-02-10,2025-02-10,2025-02-10,2025-02-10
03-02-2025,Igiene ambientale,LOVERAL SRL,Fp Cgil,"LETOJANNI, CASTELMOLA, GAGGI, GALLODORO, MONGIUFFI MELIA",intera giornata,https://www.cgsse.it/calendario-scioperi/dettaglio-sciopero/363479,true,2025-02-03,2025-02-03,2025-02-03,2025-02-03
03-02-2025,Avvocati,SETTORE GIUSTIZIA,Coordinamento Camere Penali Calabresi,CALABRIA,astensione dalle attività giudiziarie nel settore penale escluso il circondario di cosenza,https://www.cgsse.it/calendario-scioperi/dettaglio-sciopero/363475,false,2025-02-03,2025-02-03,2025-02-03,2025-02-03
05-02-2025,Pulizie e multiservizi,PULITORI E AFFINI,Cub,ISTRANA,dalle ore 00.00 del 5/02 alle ore 00.00 del 6/02,https://www.cgsse.it/calendario-scioperi/dettaglio-sciopero/363472,false,2025-02-05,2025-02-05,2025-02-05,2025-02-05
03-02-2025,Istituti di vigilanza,EUROPOLICE,Uiltucs,CATANIA,intera giornata,https://www.cgsse.it/calendario-scioperi/dettaglio-sciopero/363458,true,2025-02-03,2025-02-03,2025-02-03,2025-02-03
03-02-2025,Igiene ambientale,IGM RIFIUTI INDUSTRIALI SRL,"Fp Cgil, Fiadel, Uiltrasporti",MODICA,intera giornata,https://www.cgsse.it/calendario-scioperi/dettaglio-sciopero/363453,true,2025-02-03,2025-02-03,2025-02-03,2025-02-03
03-02-2025,Telecomunicazioni,"AC AGENCY, ACUS, AT TRADE, CALL CENTER ONE, CALL2NET, CLOUDCARE, COLLIGO, INGO, LINETECH CUSTOMER CARE, LINETECH BUSINESS SERVICES, LS DATA, MEDIATICA, MEDIATICA DIGITAL, MEDIACONTACT, NETWORK CONTACTS, ONE OS, 3G, 4U, 7C ITALIA, +DIGIT, PMC PLUS, QUALITY LAB, TECNOCALL, WECAN CONSULTING","Proclamante:Slc Cgil, Fistel Cisl, Uilcom Uil
Aderente:Usb",NAZIONALE,intera giornata,https://www.cgsse.it/calendario-scioperi/dettaglio-sciopero/363449,false,2025-02-03,2025-02-03,2025-02-03,2025-02-03
28-02-2025,Trasporto aereo,AVIATION SERVICES,Flai Ts,VENEZIA,24 ore,https://www.cgsse.it/calendario-scioperi/dettaglio-sciopero/363443,false,2025-02-28,2025-02-28,2025-02-28,2025-02-28
23-01-2025,Trasporto pubblico locale,GEST,Cobas Lavoro Privato,FIRENZE,dalle ore 20.00 alle ore 24.00,https://www.cgsse.it/calendario-scioperi/dettaglio-sciopero/363439,false,2025-01-23,2025-01-23,2025-01-23,2025-01-23
23-01-2025,Trasporto pubblico locale,"AUTOLINEE TOSCANE, F.LLI ALTERINI, GEST","Filt Cgil, Fit Cisl, Uiltrasporti, Faisa Cisal",FIRENZE,autolinee toscane e f.lli alterini dalle ore 8.30 alle ore 12.29. gest dalle ore 20.00 alle ore 24.00,https://www.cgsse.it/calendario-scioperi/dettaglio-sciopero/363437,false,2025-01-23,2025-01-23,2025-01-23,2025-01-23
Dal 31-01-2025 al 01-02-2025,Trasporto marittimo,CARONTE & TOURIST ISOLE MINORI SPA,"Filt Cgil, Fit Cisl, Uiltrasporti",SICILIA,dalle ore 8.00 del 31/01 alle ore 7.59 del 1/02,https://www.cgsse.it/calendario-scioperi/dettaglio-sciopero/363429,false,2025-01-31,2025-02-01,2025-01-31,
27-02-2025,MAGISTRATI TOGATI E ONORARI,MINISTERO DELLA GIUSTIZIA,Associazione Nazionale Magistrati,NAZIONALE,astensione dall’attività giudiziaria,https://www.cgsse.it/calendario-scioperi/dettaglio-sciopero/363425,false,2025-02-27,2025-02-27,2025-02-27,2025-02-27
Dal 30-01-2025 al 01-02-2025,Trasporto marittimo,CARONTE & TOURIST ISOLE MINORI SPA,Ugl Mare E porti,SICILIA,dalle ore 8.00 del 30/01 alle ore 8.00 del 1/02,https://www.cgsse.it/calendario-scioperi/dettaglio-sciopero/363423,false,2025-01-30,2025-02-01,2025-01-30,
01-03-2025,Trasporto pubblico locale,AMAT,"Filt Cgil, Fit Cisl, Uiltrasporti, Faisa Cisal, Cobas Trasporti, Orsa Trasporti, Ugl Autoferro",PALERMO,dalle ore 9.30 alle ore 17.30,https://www.cgsse.it/calendario-scioperi/dettaglio-sciopero/363421,false,2025-03-01,2025-03-01,2025-03-01,2025-03-01
03-02-2025,Telecomunicazioni,SOFTLAB NEXT,"Slc Cgil, Fistel Cisl",PISTOIA,intero turno di lavoro,https://www.cgsse.it/calendario-scioperi/dettaglio-sciopero/363410,false,2025-02-03,2025-02-03,2025-02-03,2025-02-03
Dal 06-02-2025 al 07-02-2025,Servizio sanitario nazionale,DUSSMANN SERVICE,"Confial, Usb, Fast Confsal",LATINA,dalle ore 7.00 del 6/02 alle ore 7.00 del 7/02,https://www.cgsse.it/calendario-scioperi/dettaglio-sciopero/363396,true,2025-02-06,2025-02-07,2025-02-06,
09-02-2025,Trasporto ferroviario,TRENITALIA,Orsa Trasporti,PIEMONTE,dalle ore 9.00 alle ore 16.59.,https://www.cgsse.it/calendario-scioperi/dettaglio-sciopero/363392,false,2025-02-09,2025-02-09,2025-02-09,2025-02-09
14-02-2025,Trasporto pubblico locale,AUTOLINEE TOSCANE,Cobas Lavoro Privato,FIRENZE,"da inizio servizio alle ore 4.14, dalle ore 8.15 alle ore 12.29, dalle ore 14.30 a fine servizio",https://www.cgsse.it/calendario-scioperi/dettaglio-sciopero/363390,false,2025-02-14,2025-02-14,2025-02-14,2025-02-14
29-01-2025,Igiene ambientale,VELIA AMBIENTE,Ugl,TORRE DEL GRECO,intera giornata,https://www.cgsse.it/calendario-scioperi/dettaglio-sciopero/363388,false,2025-01-29,2025-01-29,2025-01-29,2025-01-29
29-01-2025,Avvocati,SETTORE GIUSTIZIA,Camera Penale Di Santa Maria Capua Vetere,SANTA MARIA CAPUA VETERE,astensione dalle udienze e da ogni attività giudiziaria nel settore penale,https://www.cgsse.it/calendario-scioperi/dettaglio-sciopero/363386,false,2025-01-29,2025-01-29,2025-01-29,2025-01-29
26-01-2025,Ministeri,SOCIETA COOPERATIVE CULTURE,Filcams Cgil,TORINO,intero turno di lavoro con garanzia del servizio dalle ore 9.00 alle ore 13.30,https://www.cgsse.it/calendario-scioperi/dettaglio-sciopero/363363,false,2025-01-26,2025-01-26,2025-01-26,2025-01-26
26-01-2025,Ministeri,SOCIETA COOPERATIVE CULTURE,Usb,TORINO,intero turno di lavoro con garanzia del servizio dalle ore 9.00 alle ore 13.30,https://www.cgsse.it/calendario-scioperi/dettaglio-sciopero/363360,false,2025-01-26,2025-01-26,2025-01-26,2025-01-26
03-02-2025,Telecomunicazioni,ASSOCONTACT,Ugl Comunicazioni,NAZIONALE,intera giornata,https://www.cgsse.it/calendario-scioperi/dettaglio-sciopero/363358,false,2025-02-03,2025-02-03,2025-02-03,2025-02-03
03-02-2025,Telecomunicazioni,AZIENDE DEL SETTORE,"Slc Cgil, Fistel Cisl, Uilcom Uil",NAZIONALE,intera giornata,https://www.cgsse.it/calendario-scioperi/dettaglio-sciopero/363347,false,2025-02-03,2025-02-03,2025-02-03,2025-02-03
05-02-2025,Trasporto aereo,SPD,Usb Lavoro Privato,MILANO,dalle ore 00.00 alle ore 23.59,https://www.cgsse.it/calendario-scioperi/dettaglio-sciopero/363334,false,2025-02-05,2025-02-05,2025-02-05,2025-02-05
31-01-2025,Trasporto pubblico locale,MOVIBUS,Usb Lavoro Privato,MILANO,"da inizio servizio alle ore 5:30, dalle ore 8:30 alle ore 12:30 e dalle 15:30 a fine servizio",https://www.cgsse.it/calendario-scioperi/dettaglio-sciopero/363331,false,2025-01-31,2025-01-31,2025-01-31,2025-01-31
27-01-2025,Servizio sanitario nazionale,SANTESPEDITO,Uiltucs,MILANO,intera giornata,https://www.cgsse.it/calendario-scioperi/dettaglio-sciopero/363329,true,2025-01-27,2025-01-27,2025-01-27,2025-01-27
27-01-2025,Regioni e autonomie Locali,COOPERATIVA GEA,Fp Cgil,ALESSANDRIA,intera giornata,https://www.cgsse.it/calendario-scioperi/dettaglio-sciopero/363327,false,2025-01-27,2025-01-27,2025-01-27,2025-01-27
28-01-2025,Trasporto marittimo,RIMORCHIATORI NAPOLETANI,"Filt Cgil, Fit Cisl, Uiltrasporti",TARANTO,dalle ore 6.00 alle ore 18.00,https://www.cgsse.it/calendario-scioperi/dettaglio-sciopero/363313,false,2025-01-28,2025-01-28,2025-01-28,2025-01-28
28-01-2025,Igiene ambientale,BMTS AMBIENTE,"Fp Cgil, Uiltrasporti","SICULIANA, MONTALLEGRO",intera prestazione lavorativa,https://www.cgsse.it/calendario-scioperi/dettaglio-sciopero/363309,true,2025-01-28,2025-01-28,2025-01-28,2025-01-28
31-01-2025,"Trasporto pubblico locale, Regioni e autonomie Locali",SCHIAFFINI TRAVEL,Slm Fast Confsal,"CASTEL GANDOLFO, VELLETRI, GENAZZANO, MONTE PORZIO CATONE, ROCCA DI PAPA, OLEVANO ROMANO, NETTUNO, NEMI, RIANO, CIAMPINO, TREVIGNANO ROMANO, SAN CESAREO, FRASCATI, PONZA, PONTINIA, ANGUILLARA SABAZIA, FORMELLO, MARINO",dalle ore 12.30 alle ore 16.30,https://www.cgsse.it/calendario-scioperi/dettaglio-sciopero/363283,false,2025-01-31,2025-01-31,2025-01-31,2025-01-31
14-02-2025,Trasporto pubblico locale,GRUPPO ATM,Al Cobas,"MILANO , MONZA E DELLA BRIANZA","gruppo atm personale viaggiante di superficie, metropolitana, agenti di stazione, serv. poma 8.45 -15.00 e 18,00-fine servizio, net - urbano monza: 9.00 -11.50 e 14.50-fine servizio, extraurbano trezzo 8.45-15.00 e 18.00-fine servizio",https://www.cgsse.it/calendario-scioperi/dettaglio-sciopero/363279,false,2025-02-14,2025-02-14,2025-02-14,2025-02-14
27-01-2025,Trasporto pubblico locale,BUSITALIA SITA NORD,Usb Lavoro Privato,UMBRIA,"perugia e spoleto fasce garantite dalle 6.00 alle 9.00 e dalle 12.00 alle 15.00, terni fasce garantite dalle 6.30 alle 9.30 e dalle 12.30 alle 15.30, servizi ferroviari fasce garantite dalle 5.45 alle 8.45 e dalle 11,45 alle ore 14.45",https://www.cgsse.it/calendario-scioperi/dettaglio-sciopero/363272,false,2025-01-27,2025-01-27,2025-01-27,2025-01-27
28-01-2025,"Servizio sanitario nazionale, Metalmeccanici",OTIS SERVIZI,Fiom Cgil,"MODENA , BOLOGNA",intera giornata,https://www.cgsse.it/calendario-scioperi/dettaglio-sciopero/363261,false,2025-01-28,2025-01-28,2025-01-28,2025-01-28
08-02-2025,Trasporto ferroviario,RFI,"Uiltrasporti, Ugl Ferrovieri, Orsa Ferrovie, Fast Confsal, Fit Cisl",SARDEGNA,dalle ore 9.01 alle ore 17.00,https://www.cgsse.it/calendario-scioperi/dettaglio-sciopero/363246,false,2025-02-08,2025-02-08,2025-02-08,2025-02-08
17-01-2025,Trasporto pubblico locale,START ROMAGNA,"Uiltrasporti, Usb Lavoro Privato, Fit Cisl, Filt Cgil, Ugl Autoferro",FORLI'-CESENA,dalle ore 00:00 alle ore 24:00 fatte salve le fasce di garanzia previste dal regolamento di servizio aziendale,https://www.cgsse.it/calendario-scioperi/dettaglio-sciopero/363229,true,2025-01-17,2025-01-17,2025-01-17,2025-01-17
22-01-2025,Trasporto pubblico locale,LA PANORAMICA,"Filt Cgil, Fit Cisl, Faisa Cisal",CHIETI,dalle ore 9.00 alle ore 12.00,https://www.cgsse.it/calendario-scioperi/dettaglio-sciopero/363224,false,2025-01-22,2025-01-22,2025-01-22,2025-01-22
14-02-2025,Trasporto pubblico locale,GEST,Cobas Lavoro Privato,FIRENZE,"da inizio servizio alle ore 6.30, dalle ore 9.30 alle ore 17.00, dalle ore 20.00 a fine servizio",https://www.cgsse.it/calendario-scioperi/dettaglio-sciopero/363220,false,2025-02-14,2025-02-14,2025-02-14,2025-02-14
15-02-2025,Trasporto ferroviario,RFI,"Filt Cgil, Fit Cisl, Uiltrasporti, Slm Fast, Orsa",TRENTINO ALTO ADIGE,dalle ore 9.01 alle ore 17.00,https://www.cgsse.it/calendario-scioperi/dettaglio-sciopero/363212,false,2025-02-15,2025-02-15,2025-02-15,2025-02-15
17-01-2025,Pulizie e multiservizi,"DUSSMANN, RECLEAN",Fisal C/o Cisal Sinalv,LOMBARDIA,intero turno di lavoro,https://www.cgsse.it/calendario-scioperi/dettaglio-sciopero/363204,true,2025-01-17,2025-01-17,2025-01-17,2025-01-17
24-01-2025,Avvocati,SETTORE GIUSTIZIA,Camera Penale Di Modena,MODENA,astensione dall’attività giudiziaria,https://www.cgsse.it/calendario-scioperi/dettaglio-sciopero/363200,false,2025-01-24,2025-01-24,2025-01-24,2025-01-24
Dal 05-02-2025 al 07-02-2025,Avvocati,SETTORE GIUSTIZIA,Camera Penale Veronese,VERONA,astensione dalle udienze e da ogni attività giudiziaria nel settore penale,https://www.cgsse.it/calendario-scioperi/dettaglio-sciopero/363198,true,2025-02-05,2025-02-07,2025-02-05,
27-01-2025,Servizio sanitario nazionale,ASL VCO,Uil Fpl,VERBANO-CUSIO-OSSOLA,intera giornata o turno di lavoro],https://www.cgsse.it/calendario-scioperi/dettaglio-sciopero/363196,false,2025-01-27,2025-01-27,2025-01-27,2025-01-27
17-02-2025,Acqua,SICILIACQUE,Cisal Federenergia,SICILIA,sciopero di 1 ora a fine turno,https://www.cgsse.it/calendario-scioperi/dettaglio-sciopero/363191,false,2025-02-17,2025-02-17,2025-02-17,2025-02-17
10-02-2025,Acqua,SICILIACQUE,Cisal Federenergia,SICILIA,sciopero di 1 ora a fine turno,https://www.cgsse.it/calendario-scioperi/dettaglio-sciopero/363189,false,2025-02-10,2025-02-10,2025-02-10,2025-02-10
03-02-2025,Acqua,SICILIACQUE,Cisal Federenergia,SICILIA,sciopero di 1 ora a fine turno,https://www.cgsse.it/calendario-scioperi/dettaglio-sciopero/363187,false,2025-02-03,2025-02-03,2025-02-03,2025-02-03
Dal 22-01-2025 al 24-01-2025,Trasporto marittimo,"CARONTE & TOURIST ISOLE MINORI SPA, SIREMAR",Ugl Mare E porti,SICILIA,dalle ore 8.00 del 22/01 alle ore 7.59 del 24/01,https://www.cgsse.it/calendario-scioperi/dettaglio-sciopero/363185,true,2025-01-22,2025-01-24,2025-01-22,
05-02-2025,Trasporto aereo,SEA PRIME,Usb Lavoro Privato,MILANO,dalle ore 12.00 alle ore 16.00,https://www.cgsse.it/calendario-scioperi/dettaglio-sciopero/363183,false,2025-02-05,2025-02-05,2025-02-05,2025-02-05
15-01-2025,Servizio sanitario nazionale,"ADAPTA, PACIFICO","Filctem Cgil, Femca Cisl, Uiltec Uil",LAZIO,intero turno di lavoro,https://www.cgsse.it/calendario-scioperi/dettaglio-sciopero/363172,false,2025-01-15,2025-01-15,2025-01-15,2025-01-15
21-01-2025,Appalti ferroviari,COOPSERVICE,Sgb Fit Cisl,BOLZANO,seconda metà di lavoro per ogni turno,https://www.cgsse.it/calendario-scioperi/dettaglio-sciopero/363159,false,2025-01-21,2025-01-21,2025-01-21,2025-01-21
Dal 09-02-2025 al 10-02-2025,Trasporto ferroviario,TRENITALIA,Orsa Trasporti,"PIEMONTE, VALLE D'AOSTA",dalle ore 3.00 del 9/02 alle ore 2.00 del 10/02,https://www.cgsse.it/calendario-scioperi/dettaglio-sciopero/363157,false,2025-02-09,2025-02-10,2025-02-09,
29-01-2025,Vigili del fuoco,MINISTERO DELL'INTERNO,Fns Cisl,SALERNO,dalle ore 9.00 alle ore 13.00,https://www.cgsse.it/calendario-scioperi/dettaglio-sciopero/363152,false,2025-01-29,2025-01-29,2025-01-29,2025-01-29
13-01-2025,Metalmeccanici,AZIENDE DEL COMPARTO,"Fiom Cgil, Fim Cisl, Uilm",BELLUNO,intera giornata,https://www.cgsse.it/calendario-scioperi/dettaglio-sciopero/363148,false,2025-01-13,2025-01-13,2025-01-13,2025-01-13
28-01-2025,Servizio sanitario nazionale,RSA ALFA COLUMBUS,Uilfpl,LASTRA A SIGNA,lo sciopero riguarderà i turni di mattina e pomeriggio con esclusione del turno notturno montante e smontante del 28/01,https://www.cgsse.it/calendario-scioperi/dettaglio-sciopero/363130,false,2025-01-28,2025-01-28,2025-01-28,2025-01-28
Dal 28-01-2025 al 30-01-2025,Avvocati,SETTORE GIUSTIZIA,Consiglio Dell'ordine Degli Avvocati Di cosenza,COSENZA,astensione dalle udienze civili e penali,https://www.cgsse.it/calendario-scioperi/dettaglio-sciopero/363128,false,2025-01-28,2025-01-30,2025-01-28,
31-01-2025,Ministeri,MINISTERO DELLA GIUSTIZIA,Usb Pubblico Impiego,NAZIONALE,intera giornata dei lavoratori a tempo determinato pnrr,https://www.cgsse.it/calendario-scioperi/dettaglio-sciopero/363126,false,2025-01-31,2025-01-31,2025-01-31,2025-01-31
21-01-2025,Igiene ambientale,DM TECHNOLOGY,Fiadel,ARDEA,intera giornata,https://www.cgsse.it/calendario-scioperi/dettaglio-sciopero/363122,false,2025-01-21,2025-01-21,2025-01-21,2025-01-21
21-01-2025,Trasporto pubblico locale,FERROVIE DEL SUD EST,"Filt Cgil, Fit Cisl, Faisa Cisal, Uiltrasporti",BARI,dalle ore 15.40 alle ore 19.39,https://www.cgsse.it/calendario-scioperi/dettaglio-sciopero/363110,false,2025-01-21,2025-01-21,2025-01-21,2025-01-21
02-02-2025,Trasporto pubblico locale,GTT,Fast Confsal,TORINO,sciopero di 24 ore con rispetto delle fasce di garanzia,https://www.cgsse.it/calendario-scioperi/dettaglio-sciopero/363105,false,2025-02-02,2025-02-02,2025-02-02,2025-02-02
09-02-2025,Trasporto pubblico locale,AMAT,Cub Trasporti,PALERMO,dalle ore 8.30 alle ore 17.30 e dalle ore 20.30 alle ore 23.59,https://www.cgsse.it/calendario-scioperi/dettaglio-sciopero/363100,false,2025-02-09,2025-02-09,2025-02-09,2025-02-09
Dal 25-01-2025 al 26-01-2025,"Trasporto merci su rotaia, Trasporto ferroviario, Plurisettoriale nazionale",AZIENDE CHE SVOLGONO ATTIVITA FERROVIARIA,Usb Lavoro Privato,NAZIONALE,dalle ore 21.01 del 25/01 alle ore 4.59 del 26/01 esclusa la società ferrovie del sud est di bari,https://www.cgsse.it/calendario-scioperi/dettaglio-sciopero/363098,false,2025-01-25,2025-01-26,2025-01-25,
14-01-2025,Servizio sanitario nazionale,OSPEDALE DELLE APUANE,"Fp Cgil, Aaroi Emac",MASSA CARRARA,"intera giornata dei dirigenti medici anestesisti rianimatori , per i turnisti compreso il primo turno montante",https://www.cgsse.it/calendario-scioperi/dettaglio-sciopero/363089,true,2025-01-14,2025-01-14,2025-01-14,2025-01-14
15-01-2025,Metalmeccanici,AZIENDE DEL COMPARTO,"Fiom Cgil, Uilm Uil, Fim Cisl",SALERNO,intera giornata,https://www.cgsse.it/calendario-scioperi/dettaglio-sciopero/363083,false,2025-01-15,2025-01-15,2025-01-15,2025-01-15
Dal 13-01-2025 al 14-01-2025,Pulizie e multiservizi,DUSSMAN SERVICE,"Confial, Usb, Fast Confsal",LATINA,dalle ore 7.00 del 13/01 alle ore 7.00 del 14/01,https://www.cgsse.it/calendario-scioperi/dettaglio-sciopero/363079,false,2025-01-13,2025-01-14,2025-01-13,
Dal 25-01-2025 al 26-01-2025,"Trasporto merci su rotaia, Trasporto pubblico locale, Trasporto ferroviario, Plurisettoriale nazionale",AZIENDE CHE SVOLGONO ATTIVITA FERROVIARIA,Cub Trasporti,NAZIONALE,dalle ore 21:00 del 25/01 alle ore 20:59 del 26/01,https://www.cgsse.it/calendario-scioperi/dettaglio-sciopero/363060,false,2025-01-25,2025-01-26,2025-01-25,
12-01-2025,Trasporto pubblico locale,AMAT,Cub Trasporti,PALERMO,dalle ore 8.30 alle ore 17.30 e dalle ore 20.30 alle ore 23.59,https://www.cgsse.it/calendario-scioperi/dettaglio-sciopero/363050,true,2025-01-12,2025-01-12,2025-01-12,2025-01-12
13-01-2025,Metalmeccanici,AZIENDE DEL COMPARTO,"Fiom Cgil, Fim Cisl, Uilm",UMBRIA,intera giornata,https://www.cgsse.it/calendario-scioperi/dettaglio-sciopero/363042,false,2025-01-13,2025-01-13,2025-01-13,2025-01-13
05-02-2025,Trasporto aereo,ASSOHANDLERS,Flai Trasporti E Servizi,NAZIONALE,intera giornata,https://www.cgsse.it/calendario-scioperi/dettaglio-sciopero/363036,false,2025-02-05,2025-02-05,2025-02-05,2025-02-05
04-01-2025,Igiene ambientale,"IDEALSERVICE, REVET",Filctem Cgil,PONTEDERA,intera giornata,https://www.cgsse.it/calendario-scioperi/dettaglio-sciopero/363032,true,2025-01-04,2025-01-04,2025-01-04,2025-01-04
28-12-2024,Igiene ambientale,"IDEALSERVICE, REVET",Filctem Cgil,PONTEDERA,intera giornata,https://www.cgsse.it/calendario-scioperi/dettaglio-sciopero/363030,true,2024-12-28,2024-12-28,2024-12-28,2024-12-28
18-01-2025,Trasporto pubblico locale,ARST,Faisa Cisal,SASSARI,dalle ore 18.30 alle ore 22.30,https://www.cgsse.it/calendario-scioperi/dettaglio-sciopero/363025,false,2025-01-18,2025-01-18,2025-01-18,2025-01-18
15-01-2025,Metalmeccanici,AZIENDE DEL COMPARTO,"Fiom Cgil, Uilm Uil, Fim Cisl",LAZIO,intera giornata,https://www.cgsse.it/calendario-scioperi/dettaglio-sciopero/363020,false,2025-01-15,2025-01-15,2025-01-15,2025-01-15
Dal 09-01-2025 al 17-01-2025,Avvocati,SETTORE GIUSTIZIA,Camera Penale Di Nocera Inferiore,NOCERA INFERIORE,astensione dall'attività giudiziaria degli avvocati,https://www.cgsse.it/calendario-scioperi/dettaglio-sciopero/363008,false,2025-01-09,2025-01-17,2025-01-09,
10-01-2025,Telecomunicazioni,AZIENDE DEL SETTORE,Usb,NAZIONALE,dalle ore 00.00 alle ore 23.59,https://www.cgsse.it/calendario-scioperi/dettaglio-sciopero/363006,false,2025-01-10,2025-01-10,2025-01-10,2025-01-10
10-01-2025,Trasporto aereo,ICTS ITALIA,Filcams Cgil,PISA,dalle ore 00.00 alle ore 23.59,https://www.cgsse.it/calendario-scioperi/dettaglio-sciopero/363004,false,2025-01-10,2025-01-10,2025-01-10,2025-01-10
28-02-2025,Trasporto aereo,GESAP,"Uiltrasporti, Filt Cgil, Fit Cisl, Ugl",PALERMO,dalle ore 12.00 alle ore 16.00,https://www.cgsse.it/calendario-scioperi/dettaglio-sciopero/362993,false,2025-02-28,2025-02-28,2025-02-28,2025-02-28
13-01-2025,Trasporto ferroviario,RFI,"Filt Cgil, Fit Cisl, Uiltrasporti, Ugl, Orsa, Fast Confsal",SARDEGNA,dalle ore 9.01 alle ore 17.00,https://www.cgsse.it/calendario-scioperi/dettaglio-sciopero/362988,true,2025-01-13,2025-01-13,2025-01-13,2025-01-13
03-01-2025,Credito,MONTE DEI PASCHI DI SIENA,Fisac Cgil,VERCELLI,sciopero di 7 ore e 30 minuti dei lavoratori del gruppo mps,https://www.cgsse.it/calendario-scioperi/dettaglio-sciopero/362978,false,2025-01-03,2025-01-03,2025-01-03,2025-01-03
Dal 09-01-2025 al 10-01-2025,Trasporto ferroviario,RFI,Cub Trasporti,NAZIONALE,dalle ore 21.00 del 9/01 alle 20.59 del 10/01,https://www.cgsse.it/calendario-scioperi/dettaglio-sciopero/362974,false,2025-01-09,2025-01-10,2025-01-09,
08-01-2025,Servizio sanitario nazionale,ASL VCO,Uil Fpl,VERBANO-CUSIO-OSSOLA,intera giornata o turno di lavoro],https://www.cgsse.it/calendario-scioperi/dettaglio-sciopero/362961,false,2025-01-08,2025-01-08,2025-01-08,2025-01-08
Dal 15-01-2025 al 17-01-2025,Avvocati,SETTORE GIUSTIZIA,Coordinamento Camere Penali Calabresi,CALABRIA,astensione dalle udienze e dalle attività giudiziarie nel settore penale di 3 gg ad esclusione del circondario di cosenza,https://www.cgsse.it/calendario-scioperi/dettaglio-sciopero/362959,false,2025-01-15,2025-01-17,2025-01-15,
31-01-2025,Trasporto pubblico locale,GRUPPO ATM,Al Cobas,"MILANO , MONZA E DELLA BRIANZA","gruppo atm personale viaggiante di superficie, metropolitana, agenti di stazione, serv. poma 8.45 -15.00 e 18,00-fine servizio, net - urbano monza: 9.00 -11.50 e 14.50-fine servizio, extraurbano trezzo 8.45-15.00 e 18.00-fine servizio",https://www.cgsse.it/calendario-scioperi/dettaglio-sciopero/362957,true,2025-01-31,2025-01-31,2025-01-31,2025-01-31
10-01-2025,Servizio sanitario nazionale,OSPEDALE DELLE APUANE,"Fp Cgil, Aaroi Emac",MASSA CARRARA,"intera giornata dei dirigenti medici anestesisti rianimatori , per i turnisti compreso il primo turno montante",https://www.cgsse.it/calendario-scioperi/dettaglio-sciopero/362955,true,2025-01-10,2025-01-10,2025-01-10,2025-01-10
13-01-2025,Metalmeccanici,GRADED,Fiom Cgil,CASERTA,sciopero di 8 ore,https://www.cgsse.it/calendario-scioperi/dettaglio-sciopero/362952,false,2025-01-13,2025-01-13,2025-01-13,2025-01-13
13-01-2025,Metalmeccanici,CODEMAR,"Fiom Cgil, Fim Cisl",MARCIANISE,sciopero di 8 ore,https://www.cgsse.it/calendario-scioperi/dettaglio-sciopero/362948,false,2025-01-13,2025-01-13,2025-01-13,2025-01-13
13-01-2025,Metalmeccanici,SIRAM,"Fiom Cgil, Fim Cisl",CASERTA,sciopero di 8 ore,https://www.cgsse.it/calendario-scioperi/dettaglio-sciopero/362945,false,2025-01-13,2025-01-13,2025-01-13,2025-01-13
16-01-2025,Vigili del fuoco,MINISTERO DELL'INTERNO,Uil Pa Vvf,CATANZARO,dalle ore 10:00 alle ore 14:00,https://www.cgsse.it/calendario-scioperi/dettaglio-sciopero/362939,false,2025-01-16,2025-01-16,2025-01-16,2025-01-16
Dal 31-12-2024 al 01-01-2025,Istituti di vigilanza,ALL SYSTEM,Cisal Sinalv,"COMO , MILANO , MONZA E DELLA BRIANZA, LODI",dalle ore 15.00 del 31/12/2024 alle ore 15.00 del 01/01/2025,https://www.cgsse.it/calendario-scioperi/dettaglio-sciopero/362930,false,2024-12-31,2025-01-01,2024-12-31,
09-01-2025,Servizio sanitario nazionale,"CLEAN SERVICE, COPMA","Filcams Cgil, Fisascat Cisl, Uiltrasporti",ROMA,intero turno di lavoro,https://www.cgsse.it/calendario-scioperi/dettaglio-sciopero/362921,false,2025-01-09,2025-01-09,2025-01-09,2025-01-09
Dal 13-01-2025 al 20-01-2025,Avvocati,SETTORE GIUSTIZIA,Ordine Degli Avvocati Di Nuoro,NUORO,astensione dalle udienze civili e penali e da ogni altra attività giudiziaria,https://www.cgsse.it/calendario-scioperi/dettaglio-sciopero/362915,false,2025-01-13,2025-01-20,2025-01-13,
15-01-2025,Elettricità,HERA SERVIZI ENERGIA,"Fiom Cgil, Fim Cisl","PADOVA , ROVIGO",sciopero di 8 ore,https://www.cgsse.it/calendario-scioperi/dettaglio-sciopero/362911,false,2025-01-15,2025-01-15,2025-01-15,2025-01-15
15-02-2025,Metalmeccanici,AZIENDE DEL COMPARTO,"Fiom Cgil, Uilm Uil, Fim Cisl",SALERNO,otto ore,https://www.cgsse.it/calendario-scioperi/dettaglio-sciopero/362907,false,2025-02-15,2025-02-15,2025-02-15,2025-02-15
15-01-2025,Metalmeccanici,HERA SERVIZI ENERGIA,"Fiom Cgil, Fim Cisl","PADOVA , ROVIGO",sciopero di 8 ore,https://www.cgsse.it/calendario-scioperi/dettaglio-sciopero/362896,false,2025-01-15,2025-01-15,2025-01-15,2025-01-15
Dal 31-12-2024 al 01-01-2025,Istituti di vigilanza,CIVIS,Cisal Sinalv,"COMO , MILANO , MONZA E DELLA BRIANZA, LODI",dalle ore 15.00 del 31/12/2024 alle ore 15.00 del 01/01/2025,https://www.cgsse.it/calendario-scioperi/dettaglio-sciopero/362889,false,2024-12-31,2025-01-01,2024-12-31,
14-01-2025,Metalmeccanici,AZIENDE DEL COMPARTO,"Fiom Cgil, Uilm Uil, Fim Cisl",TRENTO,intera giornata,https://www.cgsse.it/calendario-scioperi/dettaglio-sciopero/362887,false,2025-01-14,2025-01-14,2025-01-14,2025-01-14
17-01-2025,Trasporto aereo,AVIATION SERVICES,Ugl,CATANIA,dalle ore 00.00 alle ore 23.59,https://www.cgsse.it/calendario-scioperi/dettaglio-sciopero/362844,true,2025-01-17,2025-01-17,2025-01-17,2025-01-17
Dal 31-12-2024 al 01-01-2025,Istituti di vigilanza,SICURITALIA IVRI,Cisal Sinalv,"COMO , MILANO , PAVIA , MONZA E DELLA BRIANZA, LECCO , LODI",dalle ore 15.00 del 31/12/2024 alle ore 15.00 del 01/01/2025,https://www.cgsse.it/calendario-scioperi/dettaglio-sciopero/362840,false,2024-12-31,2025-01-01,2024-12-31,
17-01-2025,Trasporto aereo,GESAP,"Uiltrasporti, Filt Cgil, Fit Cisl, Ugl",PALERMO,dalle ore 12.00 alle ore 16.00,https://www.cgsse.it/calendario-scioperi/dettaglio-sciopero/362837,true,2025-01-17,2025-01-17,2025-01-17,2025-01-17
08-01-2025,Regioni e autonomie Locali,COMUNE DI PAVIA,Uil Fpl,PAVIA,sciopero di 2 ore del corpo di polizia locale prime due ore del 1° turno e ultime due ore del 2° e 3° turno],https://www.cgsse.it/calendario-scioperi/dettaglio-sciopero/362829,false,2025-01-08,2025-01-08,2025-01-08,2025-01-08
Dal 25-01-2025 al 26-01-2025,"Trasporto merci su rotaia, Trasporto pubblico locale, Trasporto ferroviario, Plurisettoriale nazionale",AZIENDE CHE SVOLGONO ATTIVITA FERROVIARIA,"Proclamante: Sgb
Aderente:Assemblea Nazionale Pdm/pdb",NAZIONALE,"dalle ore 21:00 del 25/01 alle ore 20:59 del 26/01, escluso il settore manutenzione infrastruttura di rfi e le ferrovie sud-est",https://www.cgsse.it/calendario-scioperi/dettaglio-sciopero/362820,false,2025-01-25,2025-01-26,2025-01-25,
27-12-2024,Vigili del fuoco,MINISTERO DELL'INTERNO,Uil Pa Vvf,CATANZARO,dalle ore 10:00 alle ore 14:00,https://www.cgsse.it/calendario-scioperi/dettaglio-sciopero/362816,true,2024-12-27,2024-12-27,2024-12-27,2024-12-27
Dal 09-01-2025 al 17-01-2025,Avvocati,SETTORE GIUSTIZIA,Camera Penale Salernitana,SALERNO,astensione dall'attività giudiziaria degli avvocati,https://www.cgsse.it/calendario-scioperi/dettaglio-sciopero/362814,false,2025-01-09,2025-01-17,2025-01-09,
07-01-2025,Servizio sanitario nazionale,"CLEAN SERVICE, COPMA","Filcams Cgil, Fisascat Cisl, Uiltrasporti",ROMA,intero turno di lavoro,https://www.cgsse.it/calendario-scioperi/dettaglio-sciopero/362797,true,2025-01-07,2025-01-07,2025-01-07,2025-01-07
10-01-2025,Trasporto aereo,SPD,Usb Lavoro Privato,MILANO,dalle ore 12.00 alle ore 16.00,https://www.cgsse.it/calendario-scioperi/dettaglio-sciopero/362793,false,2025-01-10,2025-01-10,2025-01-10,2025-01-10
08-01-2025,"Servizio sanitario nazionale, Regioni e autonomie Locali",AZIENDE PUBBLICHE E PRIVATE DEL SETTORE SANITARIO-SOCIO SANITARIO-SOCIO ASSISTENZIALE,Usb Lavoro Privato,PUGLIA,intera giornata,https://www.cgsse.it/calendario-scioperi/dettaglio-sciopero/362788,false,2025-01-08,2025-01-08,2025-01-08,2025-01-08
15-01-2025,Metalmeccanici,AZIENDE DEL COMPARTO,"Fiom Cgil, Uilm Uil, Fim Cisl",LOMBARDIA,ultime 4 ore per ogni turno di lavoro,https://www.cgsse.it/calendario-scioperi/dettaglio-sciopero/362786,false,2025-01-15,2025-01-15,2025-01-15,2025-01-15
26-01-2025,Trasporto pubblico locale,AMT,Cub Trasporti,GENOVA,servizio extraurbano dalle ore 10.30 alle ore 14.30 per il personale viaggiante e dalle ore 10.30 alle ore 14.00 per il personale addetto alle biglietterie,https://www.cgsse.it/calendario-scioperi/dettaglio-sciopero/362763,false,2025-01-26,2025-01-26,2025-01-26,2025-01-26
28-01-2025,Ministeri,"CICLAT, COOPERATIVA NUOVI ORIZZONTI, RICINA, VERBATIM","Filcams Cgil, Fisascat Cisl, Uiltrasporti",NAZIONALE,intera giornata o turno di lavoro,https://www.cgsse.it/calendario-scioperi/dettaglio-sciopero/362746,false,2025-01-28,2025-01-28,2025-01-28,2025-01-28
13-12-2024,"Trasporto merci su rotaia, Trasporto ferroviario, Appalti ferroviari",AZIENDE DEL COMPARTO FERROVIARIO MERCI E VIAGGIATORI,"Filt Cgil, Uiltrasporti, Orsa",EMILIA ROMAGNA,dalle ore 9.00 alle ore 17.00,https://www.cgsse.it/calendario-scioperi/dettaglio-sciopero/362736,false,2024-12-13,2024-12-13,2024-12-13,2024-12-13
13-12-2024,"Trasporto merci su rotaia, Trasporto ferroviario",AZIENDE DEL COMPARTO FERROVIARIO MERCI E VIAGGIATORI,"Sgb, Cub Trasporti",NAZIONALE,dalle ore 13.00 alle ore 21.00,https://www.cgsse.it/calendario-scioperi/dettaglio-sciopero/362688,false,2024-12-13,2024-12-13,2024-12-13,2024-12-13
23-12-2024,Trasporto marittimo,GAMBA SERVICE,Confail,NAPOLI,intera giornata,https://www.cgsse.it/calendario-scioperi/dettaglio-sciopero/362682,true,2024-12-23,2024-12-23,2024-12-23,2024-12-23
16-12-2024,Servizio sanitario nazionale,AIAS,Ugl,AVELLINO,dalle ore 10.00 alle ore 12.00,https://www.cgsse.it/calendario-scioperi/dettaglio-sciopero/362630,true,2024-12-16,2024-12-16,2024-12-16,2024-12-16
21-12-2024,Regioni e autonomie Locali,COMUNE DI PAVIA,Uil Fpl,PAVIA,intera giornata del corpo di polizia locale,https://www.cgsse.it/calendario-scioperi/dettaglio-sciopero/362625,true,2024-12-21,2024-12-21,2024-12-21,2024-12-21
Dal 16-12-2024 al 17-12-2024,Servizio sanitario nazionale,DUSSMANN SERVICE SRL,"Confail, Fast Confsal",LATINA,dalle ore 7.00 del 16/2 alle ore 7.00 del 17/12,https://www.cgsse.it/calendario-scioperi/dettaglio-sciopero/362623,true,2024-12-16,2024-12-17,2024-12-16,
11-12-2024,Generale nazionale,AZIENDE PUBBLICHE E PRIVATE,"Cgil, Cisl, Uil",NAZIONALE,dalle ore 13.30 alle ore 17.30 per i lavoratori full time. per i turnisti ultime 4 ore del turno,https://www.cgsse.it/calendario-scioperi/dettaglio-sciopero/362582,false,2024-12-11,2024-12-11,2024-12-11,2024-12-11
27-12-2024,Istituti di vigilanza,FIDELITAS,"Filcams Cgil, Fisascat Cisl, Uiltucs Uil",ROMA,intera giornata,https://www.cgsse.it/calendario-scioperi/dettaglio-sciopero/362547,true,2024-12-27,2024-12-27,2024-12-27,2024-12-27
24-12-2024,Istituti di vigilanza,FIDELITAS,"Filcams Cgil, Fisascat Cisl, Uiltucs Uil",ROMA,intera giornata,https://www.cgsse.it/calendario-scioperi/dettaglio-sciopero/362543,true,2024-12-24,2024-12-24,2024-12-24,2024-12-24
05-02-2025,Trasporto aereo,ENAV,Fast Confsal Av Unica,PALERMO,dalle ore 00.01 alle ore 24.00,https://www.cgsse.it/calendario-scioperi/dettaglio-sciopero/362535,true,2025-02-05,2025-02-05,2025-02-05,2025-02-05
18-12-2024,Avvocati,SETTORE GIUSTIZIA,Camera Penale Di Cosenza,COSENZA,astensione dalle udienze e dalle attività giudiziarie nel settore penale,https://www.cgsse.it/calendario-scioperi/dettaglio-sciopero/362528,false,2024-12-18,2024-12-18,2024-12-18,2024-12-18
24-01-2025,Trasporto pubblico locale,SAIS AUTOLINEE,"Filt Cgil, Uiltrasporti, Faisa Cisal, Ugl","RAGUSA , SIRACUSA , PALERMO , MESSINA , ENNA , CATANIA",dalle ore 9.00 alle ore 13.00,https://www.cgsse.it/calendario-scioperi/dettaglio-sciopero/362526,true,2025-01-24,2025-01-24,2025-01-24,2025-01-24
15-12-2024,Trasporto aereo,ICTS ITALIA,Filcams Cgil,PISA,dalle ore 13.00 alle ore 17.00,https://www.cgsse.it/calendario-scioperi/dettaglio-sciopero/362518,false,2024-12-15,2024-12-15,2024-12-15,2024-12-15
17-12-2024,Servizio sanitario nazionale,SANITASERVICE ASL BR,"Uil Fpl, Cisl Fp",BRINDISI,dalle ore 7.00 alle ore 14.00 del personale del 118,https://www.cgsse.it/calendario-scioperi/dettaglio-sciopero/362516,true,2024-12-17,2024-12-17,2024-12-17,2024-12-17
16-12-2024,Enti pubblici non economici,ANAC,"Fisac Cgil, First Cisl, Uilca Uil",ROMA,dalle ore 9.30 alle ore 12.30,https://www.cgsse.it/calendario-scioperi/dettaglio-sciopero/362512,false,2024-12-16,2024-12-16,2024-12-16,2024-12-16
18-12-2024,Università,CONSORZIO CINECA,"Fp Cgil, Rsu",ROMA,intero turno di lavoro,https://www.cgsse.it/calendario-scioperi/dettaglio-sciopero/362508,true,2024-12-18,2024-12-18,2024-12-18,2024-12-18
09-12-2024,Trasporto ferroviario,"TRENITALIA, TRENITALIA TPER",Ugl Ferrovieri,EMILIA ROMAGNA,dalle ore 9.00 alle ore 16.59,https://www.cgsse.it/calendario-scioperi/dettaglio-sciopero/362505,false,2024-12-09,2024-12-09,2024-12-09,2024-12-09
09-12-2024,Trasporto ferroviario,"TRENITALIA, TRENITALIA TPER",Fast Confsal,EMILIA ROMAGNA,dalle ore 9.00 alle ore 16.59,https://www.cgsse.it/calendario-scioperi/dettaglio-sciopero/362498,false,2024-12-09,2024-12-09,2024-12-09,2024-12-09
09-12-2024,Trasporto ferroviario,"TRENITALIA, TRENITALIA TPER",Faisa Cisal,EMILIA ROMAGNA,dalle ore 9.00 alle ore 16.59,https://www.cgsse.it/calendario-scioperi/dettaglio-sciopero/362494,false,2024-12-09,2024-12-09,2024-12-09,2024-12-09
09-12-2024,Trasporto ferroviario,"TRENITALIA, TRENITALIA TPER","Orsa, Filt Cgil, Fit Cisl, Uiltrasporti",EMILIA ROMAGNA,dalle ore 9.00 alle ore 16.59,https://www.cgsse.it/calendario-scioperi/dettaglio-sciopero/362487,false,2024-12-09,2024-12-09,2024-12-09,2024-12-09
16-12-2024,Vigili del fuoco,MINISTERO DELL'INTERNO,Fns Cisl,SALERNO,dalle ore 09.00 alle ore 13.00,https://www.cgsse.it/calendario-scioperi/dettaglio-sciopero/362481,true,2024-12-16,2024-12-16,2024-12-16,2024-12-16
10-01-2025,Trasporto aereo,AVIATION SERVICES,Flai Ts,VENEZIA,24 ore,https://www.cgsse.it/calendario-scioperi/dettaglio-sciopero/362466,false,2025-01-10,2025-01-10,2025-01-10,2025-01-10
18-12-2024,Università,CONSORZIO CINECA,Rsu,MILANO,intero turno di lavoro,https://www.cgsse.it/calendario-scioperi/dettaglio-sciopero/362460,true,2024-12-18,2024-12-18,2024-12-18,2024-12-18
15-12-2024,Pulizie e multiservizi,MARKAS,Usilda,MILANO,intero turno di lavoro,https://www.cgsse.it/calendario-scioperi/dettaglio-sciopero/362454,false,2024-12-15,2024-12-15,2024-12-15,2024-12-15
Dal 08-01-2025 al 09-01-2025,Trasporto marittimo,RIMORCHIATORI NAPOLETANI,Ugl,TARANTO,dalle ore 12.00 dell' 8/01 alle ore 12.00 del 9/01,https://www.cgsse.it/calendario-scioperi/dettaglio-sciopero/362437,false,2025-01-08,2025-01-09,2025-01-08,
18-12-2024,Università,CONSORZIO CINECA,"Filcams Cgil, Rsu",BOLOGNA,intero turno di lavoro,https://www.cgsse.it/calendario-scioperi/dettaglio-sciopero/362423,true,2024-12-18,2024-12-18,2024-12-18,2024-12-18
20-01-2025,Trasporto ferroviario,RFI,"Filt Cgil, Fit Cisl, Uiltrasporti, Slm Fast, Orsa",TRENTINO ALTO ADIGE,dalle ore 9.01 alle ore 17.00,https://www.cgsse.it/calendario-scioperi/dettaglio-sciopero/362420,true,2025-01-20,2025-01-20,2025-01-20,2025-01-20
20-12-2024,Metalmeccanici,TECNOCASIC,"Fiom Cgil, Uilm Uil, Fsm Cisl",CAGLIARI,8 ore,https://www.cgsse.it/calendario-scioperi/dettaglio-sciopero/362406,true,2024-12-20,2024-12-20,2024-12-20,2024-12-20
16-12-2024,Avvocati,SETTORE GIUSTIZIA,Camera Penale Di Santa Maria Capua Vetere,SANTA MARIA CAPUA VETERE,astensione dalle udienze e da ogni attività giudiziaria nel settore penale,https://www.cgsse.it/calendario-scioperi/dettaglio-sciopero/362398,false,2024-12-16,2024-12-16,2024-12-16,2024-12-16
28-02-2025,Servizio sanitario nazionale,AZIENDE E STRUTTURE DEL SETTORE,Nursing Up,SARDEGNA,dalle ore 00.00 alle ore 24.00,https://www.cgsse.it/calendario-scioperi/dettaglio-sciopero/362375,true,2025-02-28,2025-02-28,2025-02-28,2025-02-28
16-12-2024,Regioni e autonomie Locali,"ASSISTENZA 2000, CONSORZIO DI LIBERE IMPRESE, CSS SOCIETÀ COOPERATIVA ONLUS, SOLIDARIETA E LAVORO SCRL",Fisascat Cisl,BARI,dalle ore 10.00 alle ore 13.00,https://www.cgsse.it/calendario-scioperi/dettaglio-sciopero/362372,false,2024-12-16,2024-12-16,2024-12-16,2024-12-16
10-01-2025,Trasporto aereo,SEA SPA,Cub Trasporti,NAZIONALE,dalle ore 00.00 alle ore 23.59,https://www.cgsse.it/calendario-scioperi/dettaglio-sciopero/362370,false,2025-01-10,2025-01-10,2025-01-10,2025-01-10
10-01-2025,Trasporto aereo,AIRPORT HANDLING,Cub Trasporti,"MILANO, VARESE",dalle ore 00.00 alle 23.59,https://www.cgsse.it/calendario-scioperi/dettaglio-sciopero/362365,false,2025-01-10,2025-01-10,2025-01-10,2025-01-10
15-12-2024,Trasporto aereo,ICTS ITALIA,Filcams Cgil,PISA,intera giornata dalle ore 00.00 alle ore 23.59. fasce orarie garantite dalle ore 07.00 alle ore 10.00 e dalle ore 18.00 alle ore 21.00,https://www.cgsse.it/calendario-scioperi/dettaglio-sciopero/362363,true,2024-12-15,2024-12-15,2024-12-15,2024-12-15
15-12-2024,Trasporto aereo,BGY INTERNATIONAL SERVICES SRL,Cub Trasporti,BERGAMO,dalle ore 13.00 alle ore 17.00,https://www.cgsse.it/calendario-scioperi/dettaglio-sciopero/362361,true,2024-12-15,2024-12-15,2024-12-15,2024-12-15
15-12-2024,Trasporto aereo,AGS HANDLING,Cub Trasporti,BERGAMO,dalle ore 13.00 alle ore 17.00,https://www.cgsse.it/calendario-scioperi/dettaglio-sciopero/362356,true,2024-12-15,2024-12-15,2024-12-15,2024-12-15
21-01-2025,Trasporto pubblico locale,SABATO VIAGGI,"Filt Cgil, Fit Cisl, Faisa Cisal",BARI,dalle 15:40 alle ore 19:39,https://www.cgsse.it/calendario-scioperi/dettaglio-sciopero/362354,false,2025-01-21,2025-01-21,2025-01-21,2025-01-21
13-12-2024,Metalmeccanici,"INSIEL SPA, SIRAM","Fim Cisl, Fiom Cgil, Uilm Uil",FRIULI VENEZIA GIULIA,dalle ore 00.00 alle ore 24.00,https://www.cgsse.it/calendario-scioperi/dettaglio-sciopero/362350,false,2024-12-13,2024-12-13,2024-12-13,2024-12-13
14-12-2024,Igiene ambientale,IGM RIFIUTI INDUSTRIALI SRL,Fp Cgil,MODICA,intera giornata,https://www.cgsse.it/calendario-scioperi/dettaglio-sciopero/362346,true,2024-12-14,2024-12-14,2024-12-14,2024-12-14
13-12-2024,"Elettricità, Gas",UNARETI,"Filctem Cgil, Uiltec Uil",BERGAMO,intera giornata lavorativa,https://www.cgsse.it/calendario-scioperi/dettaglio-sciopero/362344,false,2024-12-13,2024-12-13,2024-12-13,2024-12-13
13-12-2024,"Elettricità, Gas",UNARETI,"Filctem Cgil, Uiltec Uil",PAVIA,intera giornata lavorativa,https://www.cgsse.it/calendario-scioperi/dettaglio-sciopero/362335,false,2024-12-13,2024-12-13,2024-12-13,2024-12-13
13-12-2024,"Elettricità, Gas",UNARETI,"Filctem Cgil, Uiltec Uil",LODI,intera giornata lavorativa,https://www.cgsse.it/calendario-scioperi/dettaglio-sciopero/362329,false,2024-12-13,2024-12-13,2024-12-13,2024-12-13
13-12-2024,"Elettricità, Gas",UNARETI,"Filctem Cgil, Uiltec Uil",MILANO,intera giornata lavorativa,https://www.cgsse.it/calendario-scioperi/dettaglio-sciopero/362323,false,2024-12-13,2024-12-13,2024-12-13,2024-12-13
13-12-2024,"Elettricità, Gas",UNARETI,"Filctem Cgil, Uiltec Uil",CREMONA,intera giornata lavorativa,https://www.cgsse.it/calendario-scioperi/dettaglio-sciopero/362316,false,2024-12-13,2024-12-13,2024-12-13,2024-12-13
13-12-2024,"Elettricità, Gas","LDRETI, UNARETI","Filctem Cgil, Uiltec Uil",BRESCIA,intera giornata lavorativa,https://www.cgsse.it/calendario-scioperi/dettaglio-sciopero/362303,false,2024-12-13,2024-12-13,2024-12-13,2024-12-13
13-12-2024,Igiene ambientale,ISVEC,Filas,SAN MARCELLINO,intero turno di lavoro,https://www.cgsse.it/calendario-scioperi/dettaglio-sciopero/362289,false,2024-12-13,2024-12-13,2024-12-13,2024-12-13
22-01-2025,Trasporto pubblico locale,AUTOGUIDOVIE SPA,"Fit Cisl, Ugl",PAVIA,"da inizio srvizio alle ore 5.30, dalle ore 8.30 alle ore 15.00 e dalle ore 18.00 a fine servizio",https://www.cgsse.it/calendario-scioperi/dettaglio-sciopero/362285,false,2025-01-22,2025-01-22,2025-01-22,2025-01-22
24-01-2025,Scuola,ICS GLOBEDUCATE MILANO LUDUM,Flc Cgil,MILANO,intera giornata,https://www.cgsse.it/calendario-scioperi/dettaglio-sciopero/362282,true,2025-01-24,2025-01-24,2025-01-24,2025-01-24
13-12-2024,Servizio sanitario nazionale,AZIENDE APPALTO CUP,"Filcams Cgil, Fisascat Cisl, Uiltucs, Uiltrasporti",CHIETI,intero turno di lavoro,https://www.cgsse.it/calendario-scioperi/dettaglio-sciopero/362271,false,2024-12-13,2024-12-13,2024-12-13,2024-12-13
Dal 05-02-2025 al 06-02-2025,Trasporto ferroviario,TRENORD,Orsa Ferrovie,LOMBARDIA,dalle ore 3:00 del 5/02 alle ore 2:00 del 6/02,https://www.cgsse.it/calendario-scioperi/dettaglio-sciopero/362264,false,2025-02-05,2025-02-06,2025-02-05,
Dal 11-12-2024 al 12-12-2024,Trasporto marittimo,RIMORCHIATORI NAPOLETANI,Ugl,TARANTO,dalle ore 12.00 del giorno 11/12 alle ore 12.00 del 12/12,https://www.cgsse.it/calendario-scioperi/dettaglio-sciopero/362260,true,2024-12-11,2024-12-12,2024-12-11,
13-12-2024,Servizio sanitario nazionale,SECURPOL,Usb Lavoro Privato,NAPOLI,dalle ore 00.00 alle ore 23.59,https://www.cgsse.it/calendario-scioperi/dettaglio-sciopero/362247,false,2024-12-13,2024-12-13,2024-12-13,2024-12-13
13-12-2024,"Sanità privata, Servizio sanitario nazionale",AZIENDE SANITARIE ACCREDITATE AL SERVIZIO SANTARIO NAZIONALE,Cimop,NAZIONALE,intera giornata,https://www.cgsse.it/calendario-scioperi/dettaglio-sciopero/362215,true,2024-12-13,2024-12-13,2024-12-13,2024-12-13
Dal 09-02-2025 al 10-02-2025,Trasporto ferroviario,TRENITALIA,Orsa Trasporti,"PIEMONTE, VALLE D'AOSTA",dalle ore 3.00 del 9/02 alle ore 2.00 del 10/02,https://www.cgsse.it/calendario-scioperi/dettaglio-sciopero/362213,true,2025-02-09,2025-02-10,2025-02-09,
20-12-2024,Sanità privata,CIR FOOD,Confsal,PAVIA,8 ore,https://www.cgsse.it/calendario-scioperi/dettaglio-sciopero/362207,true,2024-12-20,2024-12-20,2024-12-20,2024-12-20
13-12-2024,Regioni e autonomie Locali,"COOPERATIVA SOCIALE ESSEQUADRO, COOPERATIVA SOCIALE MAGI E.T.S.",Fp Cgil,SILIQUA,intera giornata,https://www.cgsse.it/calendario-scioperi/dettaglio-sciopero/362198,false,2024-12-13,2024-12-13,2024-12-13,2024-12-13
12-12-2024,Sanità privata,CASA DI RIPOSO JEAN BONIFACE FESTAZ,"Fp Cgil, Fp Cisl, Uil Fpl",AOSTA,intera giornata,https://www.cgsse.it/calendario-scioperi/dettaglio-sciopero/362186,true,2024-12-12,2024-12-12,2024-12-12,2024-12-12
21-01-2025,Trasporto pubblico locale,PAOLO SCOPPIO & FIGLI,"Filt Cgil, Faisa Cisal, Fit Cisl",BARI,dalle ore 15.40 alle ore 19.39,https://www.cgsse.it/calendario-scioperi/dettaglio-sciopero/362182,false,2025-01-21,2025-01-21,2025-01-21,2025-01-21
21-01-2025,Trasporto pubblico locale,FERROVIE APPULO LUCANE,Faisa Cisal,BARI,dalle ore 15:40 alle ore 19:39,https://www.cgsse.it/calendario-scioperi/dettaglio-sciopero/362175,false,2025-01-21,2025-01-21,2025-01-21,2025-01-21
21-01-2025,Trasporto pubblico locale,ATAP SPA,"Proclamante:Filt Cgil, Fit Cisl, Cambiamenti M410
Aderente:Ugl","VERCELLI , BIELLA",dalle ore 8.30 alle ore 13.00 e dalle ore 15.00 a fine servizio,https://www.cgsse.it/calendario-scioperi/dettaglio-sciopero/362173,true,2025-01-21,2025-01-21,2025-01-21,2025-01-21
10-01-2025,"Scuola, Regioni e autonomie Locali","AMMINISTRAZIONI COMUNALI, MIM",Csle,NAZIONALE,"intera giornata per tutto il personale docente e ata e, tutto il personale educativo delle scuole comunali di ogni ordine e grado",https://www.cgsse.it/calendario-scioperi/dettaglio-sciopero/362151,false,2025-01-10,2025-01-10,2025-01-10,2025-01-10
29-11-2024,Pulizie e multiservizi,TECNOEDILNET,Ugl,NAPOLI,intera giornata,https://www.cgsse.it/calendario-scioperi/dettaglio-sciopero/362084,true,2024-11-29,2024-11-29,2024-11-29,2024-11-29
Dal 06-12-2024 al 07-12-2024,Igiene ambientale,ISVEC,Filas,SAN MARCELLINO,dalle ore 04:00 del 6/12 alle ore 04:00 del 7/12,https://www.cgsse.it/calendario-scioperi/dettaglio-sciopero/362004,true,2024-12-06,2024-12-07,2024-12-06,
14-01-2025,Radio e TV,RAI,"Slc Cgil, Fnc Ugl",TOSCANA,intera giornata,https://www.cgsse.it/calendario-scioperi/dettaglio-sciopero/361988,true,2025-01-14,2025-01-14,2025-01-14,2025-01-14
Dal 13-12-2024 al 14-12-2024,Servizio sanitario nazionale,SECURPOL,Usb Lavoro Privato,NAPOLI,dalle ore 07.00 del 13/12 alle ore 06.59 del 14/12,https://www.cgsse.it/calendario-scioperi/dettaglio-sciopero/361981,true,2024-12-13,2024-12-14,2024-12-13,
10-01-2025,Trasporto ferroviario,RFI,Assemblea Nazionale Lavoratori Manutenzione Rfi,NAZIONALE,intera prestazione di lavoro,https://www.cgsse.it/calendario-scioperi/dettaglio-sciopero/361972,false,2025-01-10,2025-01-10,2025-01-10,2025-01-10
Dal 25-01-2025 al 26-01-2025,"Trasporto merci su rotaia, Trasporto pubblico locale, Trasporto ferroviario, Plurisettoriale nazionale",AZIENDE CHE SVOLGONO ATTIVITA FERROVIARIA,Cub Trasporti,NAZIONALE,dalle ore 21:00 del 25/01 alle ore 20:59 del 26/01,https://www.cgsse.it/calendario-scioperi/dettaglio-sciopero/361970,true,2025-01-25,2025-01-26,2025-01-25,
06-12-2024,Regioni e autonomie Locali,"COOPERATIVA SOCIALE ESSEQUADRO, COOPERATIVA SOCIALE MAGI E.T.S.",Fp Cgil,SILIQUA,intera giornata,https://www.cgsse.it/calendario-scioperi/dettaglio-sciopero/361968,true,2024-12-06,2024-12-06,2024-12-06,2024-12-06
Dal 09-01-2025 al 10-01-2025,Trasporto ferroviario,RFI,"Cobas Lavoro Privato, Coordinamento Ferrovieri",NAZIONALE,dalle ore 21.00 del 9/01 alle ore 20.59 del 10/01,https://www.cgsse.it/calendario-scioperi/dettaglio-sciopero/361966,false,2025-01-09,2025-01-10,2025-01-09,
21-01-2025,Trasporto pubblico locale,FERROVIE DEL SUD EST,"Filt Cgil, Fit Cisl, Faisa Cisal, Uiltrasporti","BARI , TARANTO , LECCE",dalle ore 15.40 alle ore 19.39,https://www.cgsse.it/calendario-scioperi/dettaglio-sciopero/361922,false,2025-01-21,2025-01-21,2025-01-21,2025-01-21
03-12-2024,Regioni e autonomie Locali,ADISS MULTISERVICE,Usb Lavoro Privato,COSENZA,intera giornata,https://www.cgsse.it/calendario-scioperi/dettaglio-sciopero/361911,true,2024-12-03,2024-12-03,2024-12-03,2024-12-03
21-01-2025,Trasporto pubblico locale,SGM,Uiltrasporti,LECCE,dalle ore 9:30 alle ore 12:30,https://www.cgsse.it/calendario-scioperi/dettaglio-sciopero/361906,false,2025-01-21,2025-01-21,2025-01-21,2025-01-21
03-12-2024,Servizio sanitario nazionale,AZIENDE APPALTO CUP,"Filcams Cgil, Fisascat Cisl, Uiltucs, Uiltrasporti",CHIETI,intero turno di lavoro,https://www.cgsse.it/calendario-scioperi/dettaglio-sciopero/361904,true,2024-12-03,2024-12-03,2024-12-03,2024-12-03
23-12-2024,Radio e TV,GRUPPO RAI,Cisal Comunicazione,NAZIONALE,intera giornata,https://www.cgsse.it/calendario-scioperi/dettaglio-sciopero/361899,false,2024-12-23,2024-12-23,2024-12-23,2024-12-23
15-12-2024,Regioni e autonomie Locali,COMUNE DI COLLEGNO,Cse Flpl,COLLEGNO,intera giornata lavorativa del personale appartenente al corpo di polizia locale,https://www.cgsse.it/calendario-scioperi/dettaglio-sciopero/361868,true,2024-12-15,2024-12-15,2024-12-15,2024-12-15
05-02-2025,Trasporto aereo,ENAV,"Filt Cgil, Uiltrasporti",ROMA,dalle ore 13:00 alle ore 17:00,https://www.cgsse.it/calendario-scioperi/dettaglio-sciopero/361848,true,2025-02-05,2025-02-05,2025-02-05,2025-02-05
05-02-2025,Trasporto aereo,ENAV,"Filt Cgil, Uiltrasporti",ROMA,dalle ore 13:00 alle ore 17:00,https://www.cgsse.it/calendario-scioperi/dettaglio-sciopero/361843,true,2025-02-05,2025-02-05,2025-02-05,2025-02-05
22-11-2024,Istituti di vigilanza,PEGASO SECURITY,"Filcams Cgil, Uiltucs",GENOVA,dalle ore 00.01 alle ore 23.59,https://www.cgsse.it/calendario-scioperi/dettaglio-sciopero/361838,false,2024-11-22,2024-11-22,2024-11-22,2024-11-22
06-12-2024,Igiene ambientale,PRIMAVERA,"Fp Cgil, Fit Cisl, Uiltrasporti, Ugl, Fiadel, Usb",TORRE ANNUNZIATA,intera giornata,https://www.cgsse.it/calendario-scioperi/dettaglio-sciopero/361830,true,2024-12-06,2024-12-06,2024-12-06,2024-12-06
Dal 09-12-2024 al 13-12-2024,Trasporto merci su gomma,AZIENDE DEL SETTORE AUTOTRASPORTO MERCI,Comitato Trasporto Siciliano,SICILIA,dalle ore 00.01 del 9/12/2024 alle ore 24.00 del 13/12/2024,https://www.cgsse.it/calendario-scioperi/dettaglio-sciopero/361818,true,2024-12-09,2024-12-13,2024-12-09,
15-12-2024,Trasporto aereo,ASSOHANDLERS,Flai Trasporti E Servizi,NAZIONALE,dalle ore 13.00 alle ore 17.00,https://www.cgsse.it/calendario-scioperi/dettaglio-sciopero/361813,false,2024-12-15,2024-12-15,2024-12-15,2024-12-15
15-12-2024,Trasporto aereo,TECHNO SKY,"Filt Cgil, Rsu",MILANO,personale h35 dalle ore 12:00 alle ore 16:00,https://www.cgsse.it/calendario-scioperi/dettaglio-sciopero/361790,true,2024-12-15,2024-12-15,2024-12-15,2024-12-15
01-12-2024,Regioni e autonomie Locali,COMUNE DI COLLEGNO,Cse Flpl,COLLEGNO,intera giornata del personale appartenente al corpo di polizia locale,https://www.cgsse.it/calendario-scioperi/dettaglio-sciopero/361787,true,2024-12-01,2024-12-01,2024-12-01,2024-12-01
13-12-2024,Regioni e autonomie Locali,ASP SPA,Usb Lavoro Privato,CIAMPINO,intera giornata e/o turno di lavoro,https://www.cgsse.it/calendario-scioperi/dettaglio-sciopero/361755,false,2024-12-13,2024-12-13,2024-12-13,2024-12-13
10-12-2024,Distribuzione farmaci e logistica farmaceutica,COMIFAR,"Filcams Cgil, Fisascat Cisl, Uiltucs",CARINARO,intero turno di lavoro,https://www.cgsse.it/calendario-scioperi/dettaglio-sciopero/361736,false,2024-12-10,2024-12-10,2024-12-10,2024-12-10
29-11-2024,Igiene ambientale,SAP.NA.,Fial,NAPOLI,dalle ore 00.01 alle ore 24.00,https://www.cgsse.it/calendario-scioperi/dettaglio-sciopero/361674,true,2024-11-29,2024-11-29,2024-11-29,2024-11-29
02-12-2024,Servizio sanitario nazionale,118 SANITASERVICE ASL BRINDISI,Uil Fpl,BRINDISI,dalle ore 11.00 alle ore 14.00,https://www.cgsse.it/calendario-scioperi/dettaglio-sciopero/361671,true,2024-12-02,2024-12-02,2024-12-02,2024-12-02
07-12-2024,Igiene ambientale,ECOTECNICA,Confintesa,"VEGLIE, COPERTINO, PORTO CESAREO, CARMIANO, LEQUILE, LEVERANO, MONTERONI DI LECCE, ARNESANO, GALATINA",intera giornata,https://www.cgsse.it/calendario-scioperi/dettaglio-sciopero/361659,true,2024-12-07,2024-12-07,2024-12-07,2024-12-07
22-01-2025,Trasporto pubblico locale,GEST,Cobas Lavoro Privato,FIRENZE,"da inizio servizio alle ore 6.30, dalle ore 9.30 alle ore 17.00 e, dalle ore 20.00 a fine servizio",https://www.cgsse.it/calendario-scioperi/dettaglio-sciopero/361657,true,2025-01-22,2025-01-22,2025-01-22,2025-01-22
29-11-2024,Trasporto aereo,ICTS ITALIA,Filcams Cgil,PISA,intera giornata dalle ore 00.00 alle ore 23.59. fasce orarie garantite dalle ore 07.00 alle ore 10.00 e dalle ore 18.00 alle ore 21.00,https://www.cgsse.it/calendario-scioperi/dettaglio-sciopero/361653,false,2024-11-29,2024-11-29,2024-11-29,2024-11-29
29-11-2024,Trasporto aereo,ASSOHANDLERS,Flai Trasporti E Servizi,NAZIONALE,dalle ore 14.00 alle ore 18.00,https://www.cgsse.it/calendario-scioperi/dettaglio-sciopero/361650,true,2024-11-29,2024-11-29,2024-11-29,2024-11-29
09-12-2024,Radio e TV,RAI,"Slc Cgil, Fnc Ugl",TOSCANA,intera giornata,https://www.cgsse.it/calendario-scioperi/dettaglio-sciopero/361639,true,2024-12-09,2024-12-09,2024-12-09,2024-12-09
21-01-2025,Trasporto pubblico locale,FERROVIE APPULO LUCANE,Faisa Cisal,BARI,dalle ore 15:40 alle ore 19:39,https://www.cgsse.it/calendario-scioperi/dettaglio-sciopero/361617,true,2025-01-21,2025-01-21,2025-01-21,2025-01-21
08-01-2025,Trasporto marittimo,"CARONTE & TOURIST ISOLE MINORI SPA, SIREMAR",Ugl Mare E porti,SICILIA,intera giornata,https://www.cgsse.it/calendario-scioperi/dettaglio-sciopero/361614,false,2025-01-08,2025-01-08,2025-01-08,2025-01-08
04-12-2024,"Sanità privata, Servizio sanitario nazionale",AZIENDE SANITARIE ACCREDITATE AL SERVIZIO SANTARIO NAZIONALE,Cimop,NAZIONALE,intera giornata,https://www.cgsse.it/calendario-scioperi/dettaglio-sciopero/361609,true,2024-12-04,2024-12-04,2024-12-04,2024-12-04
15-12-2024,Trasporto aereo,AIRPORT HANDLING,Cub Trasporti,"MILANO, VARESE",dalle ore 00.00 alle 23.59,https://www.cgsse.it/calendario-scioperi/dettaglio-sciopero/361602,true,2024-12-15,2024-12-15,2024-12-15,2024-12-15
21-01-2025,Trasporto pubblico locale,ATAP SPA,"Filt Cgil, Fit Cisl, Cambiamenti M410, Ugl","VERCELLI , BIELLA",dalle ore 8.30 alle ore 13.00 e dalle ore 15.00 a fine servizio,https://www.cgsse.it/calendario-scioperi/dettaglio-sciopero/361597,true,2025-01-21,2025-01-21,2025-01-21,2025-01-21
10-01-2025,Trasporto pubblico locale,FERROVIE DELLA CALABRIA,Faisa Cisal,CALABRIA,dalle ore 11.30 alle ore 15.30,https://www.cgsse.it/calendario-scioperi/dettaglio-sciopero/361588,false,2025-01-10,2025-01-10,2025-01-10,2025-01-10
15-12-2024,Trasporto aereo,ENAV,"Filt Cgil, Uiltrasporti",VARESE,dalle ore 13:00 alle ore 17:00,https://www.cgsse.it/calendario-scioperi/dettaglio-sciopero/361573,true,2024-12-15,2024-12-15,2024-12-15,2024-12-15
15-12-2024,Trasporto aereo,ENAV,"Filt Cgil, Uiltrasporti",BERGAMO,dalle ore 13:00 alle ore 17:00,https://www.cgsse.it/calendario-scioperi/dettaglio-sciopero/361570,true,2024-12-15,2024-12-15,2024-12-15,2024-12-15
15-12-2024,Trasporto aereo,ENAV,"Filt Cgil, Uiltrasporti",MILANO,dalle ore 13:00 alle ore 17:00,https://www.cgsse.it/calendario-scioperi/dettaglio-sciopero/361567,true,2024-12-15,2024-12-15,2024-12-15,2024-12-15
13-12-2024,Avvocati,SETTORE GIUSTIZIA,Consiglio Dell'ordine Degli Avvocati Di nola,NOLA,astensione dalle udienze civili e penali,https://www.cgsse.it/calendario-scioperi/dettaglio-sciopero/361543,false,2024-12-13,2024-12-13,2024-12-13,2024-12-13
15-12-2024,Trasporto aereo,ENAV,"Filt Cgil, Uiltrasporti",PARMA,dalle ore 13.00 alle ore 17.00,https://www.cgsse.it/calendario-scioperi/dettaglio-sciopero/361541,true,2024-12-15,2024-12-15,2024-12-15,2024-12-15
29-11-2024,Trasporto pubblico locale,FERROVIE DELLA CALABRIA,Faisa Cisal,CALABRIA,dalle ore 11.30 alle ore 15.30,https://www.cgsse.it/calendario-scioperi/dettaglio-sciopero/361523,true,2024-11-29,2024-11-29,2024-11-29,2024-11-29
15-12-2024,Trasporto aereo,ENAV,"Filt Cgil, Uiltrasporti",MILANO,dalle ore 13:00 alle ore 17:00,https://www.cgsse.it/calendario-scioperi/dettaglio-sciopero/361521,true,2024-12-15,2024-12-15,2024-12-15,2024-12-15
29-11-2024,Servizio sanitario nazionale,"L'OPEROSA, REKEEP",Adl Cobas,BOLOGNA,dalle ore 00.00 alle ore 23.59,https://www.cgsse.it/calendario-scioperi/dettaglio-sciopero/361507,true,2024-11-29,2024-11-29,2024-11-29,2024-11-29
15-11-2024,Servizio sanitario nazionale,FONDAZIONE ODA,Usb Lavoro Privato,CATANIA,intera giornata,https://www.cgsse.it/calendario-scioperi/dettaglio-sciopero/361505,false,2024-11-15,2024-11-15,2024-11-15,2024-11-15
29-11-2024,Trasporto aereo,"DUSSMANN SERVICE SRL, SPD",Adl Varese,MILANO,dalle ore 00.00 alle ore 24.00,https://www.cgsse.it/calendario-scioperi/dettaglio-sciopero/361503,true,2024-11-29,2024-11-29,2024-11-29,2024-11-29
13-12-2024,Avvocati,SETTORE GIUSTIZIA,Ordine Degli Avvocati Benevento,BENEVENTO,astensione dalle udienze civili e penali,https://www.cgsse.it/calendario-scioperi/dettaglio-sciopero/361387,false,2024-12-13,2024-12-13,2024-12-13,2024-12-13
Dal 09-12-2024 al 10-12-2024,Trasporto merci su gomma,AZIENDE DEL SETTORE TRASPORTO MERCI,"Filt Cgil, Fit Cisl, Uiltrasporti",NAZIONALE,intero turno di lavoro,https://www.cgsse.it/calendario-scioperi/dettaglio-sciopero/361315,false,2024-12-09,2024-12-10,2024-12-09,
19-11-2024,Pulizie e multiservizi,"ATI MERANESE SERVIZI, ISS ITALIA","Filcams Cigl, Fisascat Cisl, Uiltucs",FROSINONE,intero turno,https://www.cgsse.it/calendario-scioperi/dettaglio-sciopero/361304,true,2024-11-19,2024-11-19,2024-11-19,2024-11-19
29-11-2024,Trasporto aereo,AIRPORT HANDLING,Cub Trasporti,"MILANO, VARESE",dalle ore 00.00 alle 23.59,https://www.cgsse.it/calendario-scioperi/dettaglio-sciopero/361295,true,2024-11-29,2024-11-29,2024-11-29,2024-11-29
19-11-2024,Pulizie e multiservizi,"ATI MERANESE SERVIZI, ISS ITALIA","Filcams Cigl, Fisascat Cisl, Uiltucs",LATINA,intero turno,https://www.cgsse.it/calendario-scioperi/dettaglio-sciopero/361217,true,2024-11-19,2024-11-19,2024-11-19,2024-11-19
Dal 21-11-2024 al 22-11-2024,Pulizie e multiservizi,TECNOEDILNET,Ugl,NAPOLI,intere giornate,https://www.cgsse.it/calendario-scioperi/dettaglio-sciopero/361180,true,2024-11-21,2024-11-22,2024-11-21,
09-12-2024,"Scuola, Regioni e autonomie Locali","AMMINISTRAZIONI COMUNALI, MIM",Csle,NAZIONALE,intera giornata per tutto il personale docente e ata e tutto il personale educativo scuole comunali di ogni ordine e grado,https://www.cgsse.it/calendario-scioperi/dettaglio-sciopero/361150,true,2024-12-09,2024-12-09,2024-12-09,2024-12-09
29-11-2024,Generale nazionale,TUTTI I SETTORI PUBBLICI E PRIVATI,Usi 1912,NAZIONALE,intera giornata,https://www.cgsse.it/calendario-scioperi/dettaglio-sciopero/361148,false,2024-11-29,2024-11-29,2024-11-29,2024-11-29
27-11-2024,Avvocati,SETTORE GIUSTIZIA,Associazione Forense Isola D'ischia,ISCHIA,astensione da tutte le udienze civili e penali,https://www.cgsse.it/calendario-scioperi/dettaglio-sciopero/361146,false,2024-11-27,2024-11-27,2024-11-27,2024-11-27
12-11-2024,Regioni e autonomie Locali,COMUNE DI ROMA,"Fp Cgil, Fp Cisl, Fpl Uil",ROMA,intera giornata del corpo di polizia locale,https://www.cgsse.it/calendario-scioperi/dettaglio-sciopero/361133,false,2024-11-12,2024-11-12,2024-11-12,2024-11-12
22-11-2024,Plurisettoriale provinciale,AZIENDE DEL SETTORE,"Filctem Cgil, Uiltec Uil","PARMA , FERRARA , RAVENNA",intero turno di lavoro,https://www.cgsse.it/calendario-scioperi/dettaglio-sciopero/361129,true,2024-11-22,2024-11-22,2024-11-22,2024-11-22
20-11-2024,Servizio sanitario nazionale,FONDAZIONE POLICLINICO GEMELLI,Coina,ROMA,dalle ore 00.00 alle ore 24.00,https://www.cgsse.it/calendario-scioperi/dettaglio-sciopero/361087,false,2024-11-20,2024-11-20,2024-11-20,2024-11-20
12-01-2025,Trasporto ferroviario,RFI,"Filt Cgil, Fit Cisl, Uiltrasporti, Fast Confsal, Orsa, Ugl",FIRENZE,dalle ore 9.00 alle ore 16.59,https://www.cgsse.it/calendario-scioperi/dettaglio-sciopero/361079,false,2025-01-12,2025-01-12,2025-01-12,2025-01-12
11-11-2024,Istituti di vigilanza,PEGASO SECURITY,"Filcams Cgil, Uiltucs",GENOVA,intera giornata,https://www.cgsse.it/calendario-scioperi/dettaglio-sciopero/361065,true,2024-11-11,2024-11-11,2024-11-11,2024-11-11
15-11-2024,Igiene ambientale,DM TECHNOLOGY,Fp Cgil,CASTEL VOLTURNO,intera giornata,https://www.cgsse.it/calendario-scioperi/dettaglio-sciopero/361062,true,2024-11-15,2024-11-15,2024-11-15,2024-11-15
02-12-2024,Credito,BCC ICCREA,"Fabi, First Cisl, Fisac Cgil, Ugl Credito, Uilca Uil",NAZIONALE,intera giornata,https://www.cgsse.it/calendario-scioperi/dettaglio-sciopero/361060,false,2024-12-02,2024-12-02,2024-12-02,2024-12-02
18-11-2024,Trasporto pubblico locale,CIALONE TOUR,Usb Lavoro Privato,FROSINONE,dalle ore 10.00 alle ore 14.00,https://www.cgsse.it/calendario-scioperi/dettaglio-sciopero/361018,false,2024-11-18,2024-11-18,2024-11-18,2024-11-18
29-11-2024,Scuola,MIM,Sisa,NAZIONALE,intera giornata,https://www.cgsse.it/calendario-scioperi/dettaglio-sciopero/361016,true,2024-11-29,2024-11-29,2024-11-29,2024-11-29
19-11-2024,Trasporto pubblico locale,AUTOGUIDOVIE SPA,"Fit Cisl, Ugl",PAVIA,dalle ore 11.00 alle ore 15.00,https://www.cgsse.it/calendario-scioperi/dettaglio-sciopero/361014,false,2024-11-19,2024-11-19,2024-11-19,2024-11-19
17-11-2024,Regioni e autonomie Locali,COOP CULTURE,Usb Lavoro Privato,MILANO,intera giornata,https://www.cgsse.it/calendario-scioperi/dettaglio-sciopero/361011,false,2024-11-17,2024-11-17,2024-11-17,2024-11-17
08-11-2024,Regioni e autonomie Locali,COMUNE DI ROMA,Ugl,ROMA,personale della polizia locale dalle ore 16.00 a fine servizio,https://www.cgsse.it/calendario-scioperi/dettaglio-sciopero/361005,false,2024-11-08,2024-11-08,2024-11-08,2024-11-08
08-11-2024,Regioni e autonomie Locali,COMUNE DI ROMA,Csa,ROMA,personale della polizia locale dalle ore 16.00 a fine servizio,https://www.cgsse.it/calendario-scioperi/dettaglio-sciopero/361003,false,2024-11-08,2024-11-08,2024-11-08,2024-11-08
Dal 14-12-2024 al 15-12-2024,Trasporto ferroviario,MERCITALIA SHUNTING & TERMINAL,Orsa Trasporti,PIEMONTE,dalle ore 21.00 del 14/12 alle ore 20.59 del 15/12,https://www.cgsse.it/calendario-scioperi/dettaglio-sciopero/360997,true,2024-12-14,2024-12-15,2024-12-14,
Dal 18-11-2024 al 19-11-2024,Igiene ambientale,E-KORU,"Fp Cgil, Fit Cisl, Uiltrasporti, Fiadel",VILLA SAN GIOVANNI,dalle ore 06:01 del 18/11 alle ore 05:59 del 19/11 intero turno di lavoro.,https://www.cgsse.it/calendario-scioperi/dettaglio-sciopero/360995,false,2024-11-18,2024-11-19,2024-11-18,
13-12-2024,Avvocati,SETTORE GIUSTIZIA,Consiglio Dell'ordine Degli Avvocati Di avellino,AVELLINO,astensione degli avvocati da tutte le attività giudiziarie civili dinanzi al giudice di pace del circondario di avellino,https://www.cgsse.it/calendario-scioperi/dettaglio-sciopero/360989,false,2024-12-13,2024-12-13,2024-12-13,2024-12-13
15-12-2024,Trasporto aereo,AVIATION SERVICE,Ugl,CATANIA,dalle ore 13.00 alle ore 17.00,https://www.cgsse.it/calendario-scioperi/dettaglio-sciopero/360987,false,2024-12-15,2024-12-15,2024-12-15,2024-12-15
18-11-2024,Trasporto pubblico locale,ANM,"Orsa Tpl, Usb Lavoro Privato, Faisa Confail",NAPOLI,dalle ore 11.00 alle ore 15.00,https://www.cgsse.it/calendario-scioperi/dettaglio-sciopero/360985,true,2024-11-18,2024-11-18,2024-11-18,2024-11-18
13-12-2024,Trasporto pubblico locale,SGM,Uiltrasporti,LECCE,dalle ore 09:30 alle ore 12:30,https://www.cgsse.it/calendario-scioperi/dettaglio-sciopero/360973,true,2024-12-13,2024-12-13,2024-12-13,2024-12-13
10-01-2025,Trasporto pubblico locale,AZIENDE TRASPORTO PUBBLICO LOCALE,Confail Faisa,NAZIONALE,sciopero di 4 ore con articolazione oraria a livello territoriale],https://www.cgsse.it/calendario-scioperi/dettaglio-sciopero/360950,false,2025-01-10,2025-01-10,2025-01-10,2025-01-10
13-12-2024,Avvocati,SETTORE GIUSTIZIA,Consiglio Ordine Avvocati Torre Annunziata,TORRE ANNUNZIATA,astensione dalle udienze civili e penali,https://www.cgsse.it/calendario-scioperi/dettaglio-sciopero/360948,false,2024-12-13,2024-12-13,2024-12-13,2024-12-13
19-11-2024,Regioni e autonomie Locali,CONSORZIO VALCOMINO,"Fp Cgil, Fp Cisl, Uil Fpl","MONTORIO ROMANO, MARCELLINA, MORICONE, PALOMBARA SABINA, SANT'ANGELO ROMANO, MONTELIBRETTI, NEROLA, MONTEFLAVIO, GUIDONIA MONTECELIO",intero turno di lavoro,https://www.cgsse.it/calendario-scioperi/dettaglio-sciopero/360946,false,2024-11-19,2024-11-19,2024-11-19,2024-11-19
16-11-2024,Ministeri,OPERA LABORATORI FIORENTINI,"Filcams Cgil, Uiltucs Uil",FIRENZE,intera giornata,https://www.cgsse.it/calendario-scioperi/dettaglio-sciopero/360934,false,2024-11-16,2024-11-16,2024-11-16,2024-11-16
19-11-2024,Trasporto pubblico locale,ARRIVA ITALIA,Rsu,BRESCIA,"da inizio servizio alle ore 6.00, dalle ore 9.00 alle ore 11.30 e dalle ore 14.30 a fine servizio",https://www.cgsse.it/calendario-scioperi/dettaglio-sciopero/360931,false,2024-11-19,2024-11-19,2024-11-19,2024-11-19
18-11-2024,Trasporto pubblico locale,ANM,Orsa Trasporti,NAPOLI,dalle ore 11.00 alle ore 15.00,https://www.cgsse.it/calendario-scioperi/dettaglio-sciopero/360914,true,2024-11-18,2024-11-18,2024-11-18,2024-11-18
05-11-2024,Trasporto ferroviario,TRENITALIA,Cat,TOSCANA,dalle ore 9:01 alle ore 16.59,https://www.cgsse.it/calendario-scioperi/dettaglio-sciopero/360911,false,2024-11-05,2024-11-05,2024-11-05,2024-11-05
05-11-2024,Trasporto ferroviario,AZIENDE CHE SVOLGONO ATTIVITA FERROVIARIA,"Sgb, Cub",NAZIONALE,dalle ore 9:00 alle ore 17.00,https://www.cgsse.it/calendario-scioperi/dettaglio-sciopero/360909,false,2024-11-05,2024-11-05,2024-11-05,2024-11-05
05-11-2024,Trasporto ferroviario,"FS SECURITY, ITALO - NTV, TRENITALIA, TRENITALIA TPER, TRENORD",Usb,NAZIONALE,dalle ore 9:01 alle ore 16:59,https://www.cgsse.it/calendario-scioperi/dettaglio-sciopero/360906,false,2024-11-05,2024-11-05,2024-11-05,2024-11-05
13-12-2024,Trasporto pubblico locale,FERROVIE DEL SUD EST,"Filt Cgil, Fit Cisl, Faisa Cisal, Uiltrasporti","BARI , TARANTO , LECCE",dalle ore 08.00 alle ore 11.59,https://www.cgsse.it/calendario-scioperi/dettaglio-sciopero/360898,true,2024-12-13,2024-12-13,2024-12-13,2024-12-13
07-11-2024,Regioni e autonomie Locali,LUPIAE SERVIZI,Confintesa,LECCE,,https://www.cgsse.it/calendario-scioperi/dettaglio-sciopero/360889,false,2024-11-07,2024-11-07,2024-11-07,2024-11-07
05-11-2024,Trasporto ferroviario,"FS SECURITY, ITALO - NTV, TRENITALIA, TRENITALIA TPER, TRENORD","Filt Cgil, Fit Cisl, Uil Trasporti, Ugl Ferrovieri, Fast Confsal, Orsa Trasporti",NAZIONALE,dalle ore 9:01 alle ore 16:59,https://www.cgsse.it/calendario-scioperi/dettaglio-sciopero/360887,false,2024-11-05,2024-11-05,2024-11-05,2024-11-05
15-11-2024,Igiene ambientale,ARCOBALENO,Usb Lavoro Privato,TORINO,intero turno di lavoro,https://www.cgsse.it/calendario-scioperi/dettaglio-sciopero/360878,false,2024-11-15,2024-11-15,2024-11-15,2024-11-15
14-11-2024,Pulizie e multiservizi,MARKAS,Uiltucs Uil,CARAVINO,intera giornata,https://www.cgsse.it/calendario-scioperi/dettaglio-sciopero/360876,false,2024-11-14,2024-11-14,2024-11-14,2024-11-14
13-12-2024,Avvocati,SETTORE GIUSTIZIA,Consiglio Ordine Avvocati Napoli,NAPOLI,astensione dalle udienze civili e penali,https://www.cgsse.it/calendario-scioperi/dettaglio-sciopero/360874,false,2024-12-13,2024-12-13,2024-12-13,2024-12-13
14-11-2024,Trasporto marittimo,RIMORCHIATORI NAPOLETANI,Ugl,TARANTO,dalle ore 00.00 alle ore 24.00,https://www.cgsse.it/calendario-scioperi/dettaglio-sciopero/360871,false,2024-11-14,2024-11-14,2024-11-14,2024-11-14
16-11-2024,Ministeri,"GALLERIA DELL' ACCADEMIA DI FIRENZE, MUSEI DEL BARGELLO","Filcams Cgil, Uiltucs Uil",FIRENZE,intera giornata,https://www.cgsse.it/calendario-scioperi/dettaglio-sciopero/360841,true,2024-11-16,2024-11-16,2024-11-16,2024-11-16
14-11-2024,Servizio sanitario nazionale,"L'OPEROSA, REKEEP",Adl Cobas,BOLOGNA,dalle ore 00.00 alle ore 23.59,https://www.cgsse.it/calendario-scioperi/dettaglio-sciopero/360838,true,2024-11-14,2024-11-14,2024-11-14,2024-11-14
09-12-2024,Servizio sanitario nazionale,ASL VCO,Uil Fpl,VERBANO-CUSIO-OSSOLA,intera giornata o turno di lavoro],https://www.cgsse.it/calendario-scioperi/dettaglio-sciopero/360834,true,2024-12-09,2024-12-09,2024-12-09,2024-12-09
29-11-2024,Generale nazionale,TUTTI I SETTORI PUBBLICI E PRIVATI,"Proclamante:Sial Cobas, Adl Cobas, Clap, Confederazione Cobas
Aderente:Cobas Lavoro Privato",NAZIONALE,"dalle ore 00.01 alle ore 23.59, per i vvf dalle ore 8.00 alle ore 14.0, escluso dallo sciopero il trasporto ferroviario, trasporto merci e il personale del ministero di grazia e giustizia.",https://www.cgsse.it/calendario-scioperi/dettaglio-sciopero/360832,false,2024-11-29,2024-11-29,2024-11-29,2024-11-29
Dal 13-11-2024 al 14-11-2024,Igiene ambientale,"BLU WORK, CONSORZIO AIRONE, DM TECHNOLOGY, L'IGIENE URBANA, L'IGIENE URBANA EVOLUTION","Fiadel, Fp Cgil, Fit Cisl",ARDEA,intere giornate per tutti i turni di lavoro,https://www.cgsse.it/calendario-scioperi/dettaglio-sciopero/360827,false,2024-11-13,2024-11-14,2024-11-13,
Dal 25-11-2024 al 29-11-2024,Avvocati,SETTORE GIUSTIZIA,Camera Penale Di Palmi,PALMI,astensione dalle udienze e da ogni attività giudiziaria nel settore penale di 5 gg,https://www.cgsse.it/calendario-scioperi/dettaglio-sciopero/360823,false,2024-11-25,2024-11-29,2024-11-25,
15-11-2024,Servizio sanitario nazionale,POLYGON,Fiom Cgil,NAZIONALE,ultime 4 ore di ogni turno,https://www.cgsse.it/calendario-scioperi/dettaglio-sciopero/360818,false,2024-11-15,2024-11-15,2024-11-15,2024-11-15
16-11-2024,Telecomunicazioni,"SOFTLAB NEXT, TECNOCALL","Slc Cgil, Fistel Cisl",PISTOIA,ultime due ore del turno,https://www.cgsse.it/calendario-scioperi/dettaglio-sciopero/360805,true,2024-11-16,2024-11-16,2024-11-16,2024-11-16
12-11-2024,Trasporto aereo,ICTS ITALIA,Filcams Cgil,PISA,dalle ore 13.00 alle ore 16:59,https://www.cgsse.it/calendario-scioperi/dettaglio-sciopero/360800,false,2024-11-12,2024-11-12,2024-11-12,2024-11-12
07-11-2024,Regioni e autonomie Locali,SKP VIGILANZA,"Proclamante:Filcams Cgil, Fisascat Cisl
Aderente:Cobas Pubblico Impiego",SANREMO,,https://www.cgsse.it/calendario-scioperi/dettaglio-sciopero/360793,true,2024-11-07,2024-11-07,2024-11-07,2024-11-07
12-11-2024,Plurisettoriale territoriale,AZIENDE DEL SETTORE,"Cgil, Cisl, Uil",SIRACUSA,"8 ore dei lavoratori delle categorie chimici, energia, metalmeccanici, trasporti, edili, e servizi, operanti presso il sito versalis di ragusa",https://www.cgsse.it/calendario-scioperi/dettaglio-sciopero/360788,false,2024-11-12,2024-11-12,2024-11-12,2024-11-12
11-11-2024,Servizio sanitario nazionale,ASL BOLOGNA,Fimmg,BOLOGNA,sciopero dei medici di medicina generale,https://www.cgsse.it/calendario-scioperi/dettaglio-sciopero/360784,false,2024-11-11,2024-11-11,2024-11-11,2024-11-11
04-11-2024,Pulizie e multiservizi,NUOVA PERLA,Fisascat Cisl,ARZANO,,https://www.cgsse.it/calendario-scioperi/dettaglio-sciopero/360782,false,2024-11-04,2024-11-04,2024-11-04,2024-11-04
29-11-2024,Trasporto pubblico locale,FERROVIE APPULO LUCANE,Faisa Cisal,BARI,dalle ore 15:40 alle ore 19:39,https://www.cgsse.it/calendario-scioperi/dettaglio-sciopero/360780,true,2024-11-29,2024-11-29,2024-11-29,2024-11-29
31-10-2024,Telecomunicazioni,NETWORK CONTACTS,Usb Lavoro Privato,TARANTO,intero orario di lavoro di ogni turno,https://www.cgsse.it/calendario-scioperi/dettaglio-sciopero/360773,true,2024-10-31,2024-10-31,2024-10-31,2024-10-31
Dal 24-11-2024 al 25-11-2024,Trasporto ferroviario,TRENITALIA,Orsa Trasporti,"PIEMONTE, VALLE D'AOSTA",dalle ore 03.00 del 24/11 alle ore 02.00 del 25/11,https://www.cgsse.it/calendario-scioperi/dettaglio-sciopero/360759,false,2024-11-24,2024-11-25,2024-11-24,
29-11-2024,Generale nazionale,TUTTI I SETTORI PUBBLICI E PRIVATI,"Proclamante:Cgil, Uil
Aderente:Fiom Cgil, Uilm, Slc Cgil, Uilposte, Flai Cgil, Filbi Uil, Filctem Cgil, Uiltec, Uila, Uil Scuola Rua, Uiltucs, Fp Cgil, Filcams Cgil, Uil Fpl, Nidil Cgil, Uiltemp, Flc Cgil",NAZIONALE,"intera giornata, per i vvf dalle ore 10.00 alle ore 14.00 escluso il trasporto ferroviario e trasporto merci su rotaia",https://www.cgsse.it/calendario-scioperi/dettaglio-sciopero/360757,false,2024-11-29,2024-11-29,2024-11-29,2024-11-29
18-11-2024,Telecomunicazioni,"SOFTLAB NEXT, TECNOCALL","Slc Cgil, Fistel Cisl",PISTOIA,prime due ore del turno,https://www.cgsse.it/calendario-scioperi/dettaglio-sciopero/360737,true,2024-11-18,2024-11-18,2024-11-18,2024-11-18
15-11-2024,Telecomunicazioni,"SOFTLAB NEXT, TECNOCALL","Slc Cgil, Fistel Cisl",PISTOIA,ultime due ore del turno,https://www.cgsse.it/calendario-scioperi/dettaglio-sciopero/360734,true,2024-11-15,2024-11-15,2024-11-15,2024-11-15
19-11-2024,Igiene ambientale,AAMPS,"Fp Cgil, Fit Cisl, Fiadel, Uiltrasporti",LIVORNO,intero turno di lavoro,https://www.cgsse.it/calendario-scioperi/dettaglio-sciopero/360679,false,2024-11-19,2024-11-19,2024-11-19,2024-11-19
08-11-2024,Trasporto pubblico locale,START ROMAGNA,"Fit Cisl, Uiltrasporti, Ugl Autoferro, Faisa Cisal, Filt Cgil",RIMINI,dalle ore 09.00 alle ore 13.00,https://www.cgsse.it/calendario-scioperi/dettaglio-sciopero/360669,true,2024-11-08,2024-11-08,2024-11-08,2024-11-08
Dal 25-11-2024 al 29-11-2024,Avvocati,SETTORE GIUSTIZIA,Camera Penale Di Locri,LOCRI,astensione dalle udienze e da ogni attività giudiziaria che si svolgono nel circondario del tribunale di locri di 5 gg,https://www.cgsse.it/calendario-scioperi/dettaglio-sciopero/360663,false,2024-11-25,2024-11-29,2024-11-25,
08-11-2024,Generale nazionale,SETTORE INDUSTRIALE,Usb Lavoro Privato,NAZIONALE,dalle ore 00.01 alle ore 23.59,https://www.cgsse.it/calendario-scioperi/dettaglio-sciopero/360652,false,2024-11-08,2024-11-08,2024-11-08,2024-11-08
12-11-2024,Regioni e autonomie Locali,NAPOLI SERVIZI,Fisascat Cisl,NAPOLI,intero turno,https://www.cgsse.it/calendario-scioperi/dettaglio-sciopero/360644,false,2024-11-12,2024-11-12,2024-11-12,2024-11-12
Dal 12-11-2024 al 13-11-2024,Trasporto ferroviario,RFI,Cub Trasporti,NAZIONALE,dalle ore 21.00 del 12/11 alle ore 20.59 del 13/11,https://www.cgsse.it/calendario-scioperi/dettaglio-sciopero/360638,false,2024-11-12,2024-11-13,2024-11-12,
12-11-2024,Trasporto aereo,ADB,"Filt Cgil, Fit Cisl, Uiltrasporti, Ugl Ta",BOLOGNA,dalle ore 13.00 alle ore 17.00,https://www.cgsse.it/calendario-scioperi/dettaglio-sciopero/360636,false,2024-11-12,2024-11-12,2024-11-12,2024-11-12
12-11-2024,Plurisettoriale territoriale,AZIENDE DEL SETTORE,"Cgil, Uil",SIRACUSA,"sciopero di 8 ore di tutte le lavoratrici e lavoratori delle categorie: chimici, energia, metalmeccanici, trasporti, edili, servizi, impegnati nell'area industriale del petrolchimico siracusano",https://www.cgsse.it/calendario-scioperi/dettaglio-sciopero/360631,false,2024-11-12,2024-11-12,2024-11-12,2024-11-12
11-11-2024,Igiene ambientale,5 VALLI SERVIZI,"Fp Cgil, Uiltrasporti",ALESSANDRIA,intera giornata,https://www.cgsse.it/calendario-scioperi/dettaglio-sciopero/360607,false,2024-11-11,2024-11-11,2024-11-11,2024-11-11
12-11-2024,Trasporto aereo,"ADR ASSISTANCE, AVIATION SERVICE",Usb Lavoro Privato,FIUMICINO,dalle ore 13.00 alle ore 17.00,https://www.cgsse.it/calendario-scioperi/dettaglio-sciopero/360600,false,2024-11-12,2024-11-12,2024-11-12,2024-11-12
06-11-2024,Pulizie e multiservizi,"ISS FACILITY SERVICES, TECNOEDILNET",Ugl,NAPOLI,intera giornata,https://www.cgsse.it/calendario-scioperi/dettaglio-sciopero/360598,false,2024-11-06,2024-11-06,2024-11-06,2024-11-06
08-11-2024,Trasporto pubblico locale,AZIENDE TRASPORTO PUBBLICO LOCALE,"Cobas Lavoro Privato, Adl Cobas, Sgb, Cub Trasporti",NAZIONALE,sciopero di 24 ore con articolazione oraria a livello territoriale,https://www.cgsse.it/calendario-scioperi/dettaglio-sciopero/360582,false,2024-11-08,2024-11-08,2024-11-08,2024-11-08
15-12-2024,Trasporto aereo,TECHNO SKY,"Filt Cgil, Uiltrasporti, Rsu","BARI, BRINDISI",intera giornata. personale h35 dalle ore 00.01 alle ore 23.59,https://www.cgsse.it/calendario-scioperi/dettaglio-sciopero/360537,true,2024-12-15,2024-12-15,2024-12-15,2024-12-15
Dal 09-12-2024 al 13-12-2024,Avvocati,SETTORE GIUSTIZIA,Camera Penale Irpina,AVELLINO,astensione dalle udienze e dalle attività giudiziarie penali di 5 gg,https://www.cgsse.it/calendario-scioperi/dettaglio-sciopero/360489,false,2024-12-09,2024-12-13,2024-12-09,
15-11-2024,Scuola,MIM,Anief,NAZIONALE,intera giornata,https://www.cgsse.it/calendario-scioperi/dettaglio-sciopero/360487,false,2024-11-15,2024-11-15,2024-11-15,2024-11-15
15-11-2024,Istruzione e ricerca,"MIM, MUR",Adl Cobas,LOMBARDIA,intera giornata,https://www.cgsse.it/calendario-scioperi/dettaglio-sciopero/360485,false,2024-11-15,2024-11-15,2024-11-15,2024-11-15
09-11-2024,Servizio sanitario nazionale,"L'OPEROSA, REKEEP",Adl Cobas,BOLOGNA,dalle ore 00.00 alle ore 23.59,https://www.cgsse.it/calendario-scioperi/dettaglio-sciopero/360452,true,2024-11-09,2024-11-09,2024-11-09,2024-11-09
05-11-2024,Igiene ambientale,DHI - DI NARDI HOLDING INDUSTRALE,Fit Cisl,CASAGIOVE,intera giornata,https://www.cgsse.it/calendario-scioperi/dettaglio-sciopero/360448,true,2024-11-05,2024-11-05,2024-11-05,2024-11-05
25-10-2024,Generale territoriale,TUTTI I SETTORI PUBBLICI E PRIVATI,Cobas,BOLOGNA,intera giornata,https://www.cgsse.it/calendario-scioperi/dettaglio-sciopero/360446,false,2024-10-25,2024-10-25,2024-10-25,2024-10-25
25-11-2024,Radio e TV,RAI,"Slc Cgil, Fnc Ugl",TOSCANA,intera giornata,https://www.cgsse.it/calendario-scioperi/dettaglio-sciopero/360437,true,2024-11-25,2024-11-25,2024-11-25,2024-11-25
20-11-2024,Servizio sanitario nazionale,AZIENDE PUBBLICHE E PRIVATE DEL SETTORE,"Proclamante:Anaao Assomed, Cimo Fesmed, Nursing Up
Aderente:Sicambiacon, Cobas Pi, Anmi Assomed Sivemp Fpm, Fedir, Coina",NAZIONALE,intera giornata,https://www.cgsse.it/calendario-scioperi/dettaglio-sciopero/360422,false,2024-11-20,2024-11-20,2024-11-20,2024-11-20
25-10-2024,Generale territoriale,TUTTI I SETTORI PUBBLICI E PRIVATI,Sgb,BOLOGNA,intera giornata,https://www.cgsse.it/calendario-scioperi/dettaglio-sciopero/360416,false,2024-10-25,2024-10-25,2024-10-25,2024-10-25
07-11-2024,Ministeri,MINISTERO BENI CULTURALI,"Fp Cgil, Fp Cisl, Uil Pa, Usb",MILANO,intera giornata del personale della pinacoteca brera e biblioteca braidense,https://www.cgsse.it/calendario-scioperi/dettaglio-sciopero/360399,false,2024-11-07,2024-11-07,2024-11-07,2024-11-07
05-11-2024,Ministeri,OPERA LABORATORI FIORENTINI,"Filcams Cgil, Uiltucs Uil",FIRENZE,intera giornata del personale impiegato presso la galleria degli uffizi e opificio delle pietre dure,https://www.cgsse.it/calendario-scioperi/dettaglio-sciopero/360392,false,2024-11-05,2024-11-05,2024-11-05,2024-11-05
Dal 06-11-2024 al 07-11-2024,Igiene ambientale,IGM RIFIUTI INDUSTRIALI SRL,Fiadel Csa,MODICA,intere giornate,https://www.cgsse.it/calendario-scioperi/dettaglio-sciopero/360389,false,2024-11-06,2024-11-07,2024-11-06,
Dal 01-11-2024 al 02-11-2024,Regioni e autonomie Locali,SOCIETÀ COOPERATIVA CULTURE,Usb Lavoro Privato,MILANO,intere giornate,https://www.cgsse.it/calendario-scioperi/dettaglio-sciopero/360385,true,2024-11-01,2024-11-02,2024-11-01,
Dal 01-11-2024 al 02-11-2024,Regioni e autonomie Locali,"DUSSMANN, SOCIETÀ COOPERATIVA CULTURE",Usb Lavoro Privato,MILANO,intere giornate,https://www.cgsse.it/calendario-scioperi/dettaglio-sciopero/360383,true,2024-11-01,2024-11-02,2024-11-01,
18-11-2024,Trasporto pubblico locale,ANM,"Filt Cgil, Fit Cisl, Uiltrasporti, Ugl Fna, Faisa Cisal",NAPOLI,"dalle ore 11,00 alle ore 15,00",https://www.cgsse.it/calendario-scioperi/dettaglio-sciopero/360378,true,2024-11-18,2024-11-18,2024-11-18,2024-11-18
23-10-2024,Trasporto ferroviario,TRENITALIA TPER,Fast Confsal,EMILIA ROMAGNA,dalle ore 11:00 alle ore 15:00,https://www.cgsse.it/calendario-scioperi/dettaglio-sciopero/360372,false,2024-10-23,2024-10-23,2024-10-23,2024-10-23
23-10-2024,Trasporto pubblico locale,EAV,"Filt Cgil, Fit Cisl, Uiltrasporti, Ugl Fna, Faisa Cisal",NAPOLI,dalle ore 08.20 alle ore 12.20,https://www.cgsse.it/calendario-scioperi/dettaglio-sciopero/360370,false,2024-10-23,2024-10-23,2024-10-23,2024-10-23
23-10-2024,Trasporto ferroviario,TRENITALIA TPER,"Filt Cgil, Fit Cisl, Uiltrasporti, Orsa",EMILIA ROMAGNA,dalle ore 11:00 alle ore 15:00,https://www.cgsse.it/calendario-scioperi/dettaglio-sciopero/360358,false,2024-10-23,2024-10-23,2024-10-23,2024-10-23
31-10-2024,Scuola,MIM,Cobas Scuola,EMILIA ROMAGNA,intera giornata,https://www.cgsse.it/calendario-scioperi/dettaglio-sciopero/360350,true,2024-10-31,2024-10-31,2024-10-31,2024-10-31
23-10-2024,Trasporto pubblico locale,EAV,Faisa Confail,NAPOLI,dalle ore 08.20 alle ore 12.20,https://www.cgsse.it/calendario-scioperi/dettaglio-sciopero/360343,false,2024-10-23,2024-10-23,2024-10-23,2024-10-23
23-10-2024,Trasporto pubblico locale,EAV,Usb Lavoro Privato,NAPOLI,dalle ore 08.20 alle ore 12.20,https://www.cgsse.it/calendario-scioperi/dettaglio-sciopero/360340,false,2024-10-23,2024-10-23,2024-10-23,2024-10-23
12-01-2025,Trasporto ferroviario,TRENITALIA,"Filt Cgil, Fit Cisl, Uiltrasporti, Fast Confsal, Orsa",ABRUZZO,dalle ore 9.00 alle ore 16.59,https://www.cgsse.it/calendario-scioperi/dettaglio-sciopero/360338,false,2025-01-12,2025-01-12,2025-01-12,2025-01-12
23-10-2024,Trasporto pubblico locale,EAV,Orsa Trasporti,NAPOLI,dalle ore 08.20 alle ore 12.20,https://www.cgsse.it/calendario-scioperi/dettaglio-sciopero/360331,false,2024-10-23,2024-10-23,2024-10-23,2024-10-23
31-10-2024,Scuola,MIM,Cobas Scuola,SICILIA,intera giornata,https://www.cgsse.it/calendario-scioperi/dettaglio-sciopero/360329,true,2024-10-31,2024-10-31,2024-10-31,2024-10-31
31-10-2024,Servizio sanitario nazionale,RANDSTAD ITALIA,"Nidil Cgil, Felsa Cisl, Uiltemp",ROMA,intera giornata,https://www.cgsse.it/calendario-scioperi/dettaglio-sciopero/360320,false,2024-10-31,2024-10-31,2024-10-31,2024-10-31
27-10-2024,Trasporto aereo,ICTS ITALIA,Filcams Cgil,PISA,dalle ore 13.00 alle ore 16:59,https://www.cgsse.it/calendario-scioperi/dettaglio-sciopero/360312,false,2024-10-27,2024-10-27,2024-10-27,2024-10-27
31-10-2024,Scuola,MIM,Flc Cgil,NAZIONALE,intera giornata del personale dirigente scolastico,https://www.cgsse.it/calendario-scioperi/dettaglio-sciopero/360308,true,2024-10-31,2024-10-31,2024-10-31,2024-10-31
Dal 08-11-2024 al 09-11-2024,Igiene ambientale,"ICOS, SEA SRL","Fp Cgil, Fit Cisl, Uiltrasporti",ARAGONA,intere giornate,https://www.cgsse.it/calendario-scioperi/dettaglio-sciopero/360290,false,2024-11-08,2024-11-09,2024-11-08,
15-12-2024,Trasporto aereo,TECHNO SKY,"Filt Cgil, Uiltrasporti, Rsu","BARI, BRINDISI",intera giornata. personale h35 dalle ore 00.01 alle ore 23.59,https://www.cgsse.it/calendario-scioperi/dettaglio-sciopero/360271,true,2024-12-15,2024-12-15,2024-12-15,2024-12-15
12-11-2024,Trasporto aereo,ASC HANDLING,Fast Confsal,CATANIA,dalle ore 13.00 alle ore 17.00,https://www.cgsse.it/calendario-scioperi/dettaglio-sciopero/360267,true,2024-11-12,2024-11-12,2024-11-12,2024-11-12
15-12-2024,Trasporto aereo,TECHNO SKY,"Filt Cgil, Uiltrasporti, Rsu",MILANO,personale h35 dalle ore 13:00 alle ore 17:00,https://www.cgsse.it/calendario-scioperi/dettaglio-sciopero/360262,true,2024-12-15,2024-12-15,2024-12-15,2024-12-15
30-10-2024,Igiene ambientale,GEOFOR,Usb Lavoro Privato,PISA,intera giornata,https://www.cgsse.it/calendario-scioperi/dettaglio-sciopero/360258,false,2024-10-30,2024-10-30,2024-10-30,2024-10-30
30-10-2024,Igiene ambientale,TEKRA,Usb Lavoro Privato,AVERSA,intera giornata,https://www.cgsse.it/calendario-scioperi/dettaglio-sciopero/360256,false,2024-10-30,2024-10-30,2024-10-30,2024-10-30
31-10-2024,Scuola,MIM,Cobas Scuola,UMBRIA,intera giornata,https://www.cgsse.it/calendario-scioperi/dettaglio-sciopero/360254,true,2024-10-31,2024-10-31,2024-10-31,2024-10-31
31-10-2024,Plurisettoriale nazionale,PUBBLICO IMPIEGO,"Proclamante:Cib Unicobas
Aderente:Cub Sur, Fisi",NAZIONALE,"intera gionata, personale pubblico impiego, della scuola e dei vigili del fuoco, escluso funzioni locali limitatamente ai servizi cimiteriali e ai servizi di polizia municipale e ai vigili del fuoco limitatamente al personale operante presso le sedi aerop",https://www.cgsse.it/calendario-scioperi/dettaglio-sciopero/360243,false,2024-10-31,2024-10-31,2024-10-31,2024-10-31
28-10-2024,Trasporto pubblico locale,EAV,Usb Lavoro Privato,NAPOLI,dalle ore 9.00 alle ore 13.00,https://www.cgsse.it/calendario-scioperi/dettaglio-sciopero/360238,false,2024-10-28,2024-10-28,2024-10-28,2024-10-28
11-11-2024,Trasporto aereo,SPD,Usb Lavoro Privato,MILANO,dalle ore 13.00 alle ore 17.00,https://www.cgsse.it/calendario-scioperi/dettaglio-sciopero/360236,true,2024-11-11,2024-11-11,2024-11-11,2024-11-11
31-10-2024,Pulizie e multiservizi,DUSSMAN SERVICE,Flm Uniti Cub,TORINO,4 ore a partire da inizio turno,https://www.cgsse.it/calendario-scioperi/dettaglio-sciopero/360229,false,2024-10-31,2024-10-31,2024-10-31,2024-10-31
10-11-2024,Trasporto ferroviario,RFI,"Filt Cgil, Fit Cisl, Uiltrasporti, Ugl, Fast, Orsa",FIRENZE,dalle ore 09.00 alle ore 16.59,https://www.cgsse.it/calendario-scioperi/dettaglio-sciopero/360227,true,2024-11-10,2024-11-10,2024-11-10,2024-11-10
29-10-2024,Ministeri,OPERA LABORATORI FIORENTINI,"Filcams Cgil, Uiltucs","PRATO , PISTOIA , FIRENZE",intera giornata,https://www.cgsse.it/calendario-scioperi/dettaglio-sciopero/360218,true,2024-10-29,2024-10-29,2024-10-29,2024-10-29
28-10-2024,Trasporto pubblico locale,START,Usb Lavoro Privato,ASCOLI PICENO,"dalle ore 08:30 alle ore 17:00 e dalle ore 20:00 sino a fine servizio, esclusi dallo sciopero i servizi per disabili e i servizi scuolabus.",https://www.cgsse.it/calendario-scioperi/dettaglio-sciopero/360198,false,2024-10-28,2024-10-28,2024-10-28,2024-10-28
13-12-2024,Generale nazionale,TUTTE LE CATEGORIE PUBBLICHE E PRIVATE,"Proclamante:Usb
Aderente:Fi-si",NAZIONALE,intera giornata. per i vvf dalle ore 9.00 alle ore 13.00 per le imprese che svolgono attività ferroviaria merci e viaggiatori dalle ore 21.00 del 12/12 alle ore 20.59 del 13/12,https://www.cgsse.it/calendario-scioperi/dettaglio-sciopero/360196,false,2024-12-13,2024-12-13,2024-12-13,2024-12-13
Dal 23-11-2024 al 24-11-2024,Trasporto merci su rotaia,AZIENDE CHE SVOLGONO ATTIVITA FERROVIARIA,"Proclamante:Usb Lavoro Privato
Aderente:Assemblea Nazionale Pdm/pdb",NAZIONALE,dalle ore 21:00 del 23/11 alle ore 20:59 del 24/11,https://www.cgsse.it/calendario-scioperi/dettaglio-sciopero/360194,false,2024-11-23,2024-11-24,2024-11-23,
Dal 29-10-2024 al 30-10-2024,Energia e petrolio,CNP ENERGIA,Uilm Uil,ROMA,dalle ore 07:00 del 29/10 alle ore 07:00 del 30/10,https://www.cgsse.it/calendario-scioperi/dettaglio-sciopero/360188,true,2024-10-29,2024-10-30,2024-10-29,
12-11-2024,Trasporto aereo,ASC HANDLING,Cub Trasporti,CATANIA,dalle ore 13.00 alle ore 17.00,https://www.cgsse.it/calendario-scioperi/dettaglio-sciopero/360184,false,2024-11-12,2024-11-12,2024-11-12,2024-11-12
04-11-2024,Servizio sanitario nazionale,RTI SAN BERNARDO,Uilfpl,BRINDISI,intera giornata,https://www.cgsse.it/calendario-scioperi/dettaglio-sciopero/360182,true,2024-11-04,2024-11-04,2024-11-04,2024-11-04
07-11-2024,Igiene ambientale,RIECO,Usb Lavoro Privato,TOLFA,intero turno di lavoro,https://www.cgsse.it/calendario-scioperi/dettaglio-sciopero/360168,false,2024-11-07,2024-11-07,2024-11-07,2024-11-07
15-12-2024,Trasporto aereo,TECHNO SKY,"Filt Cgil, Uiltrasporti",NAZIONALE,intera giornata. personale h35 dalle ore 00.01 alle ore 23.59,https://www.cgsse.it/calendario-scioperi/dettaglio-sciopero/360156,true,2024-12-15,2024-12-15,2024-12-15,2024-12-15
Dal 04-11-2024 al 06-11-2024,Avvocati,SETTORE GIUSTIZIA,Unione Camere Penali Italiane,NAZIONALE,"astensione dalle udienze e da ogni attività giudiziaria nel settore penale di 3 gg sono esclusi i circondari di paola, castrovillari e rossano.",https://www.cgsse.it/calendario-scioperi/dettaglio-sciopero/360153,false,2024-11-04,2024-11-06,2024-11-04,
29-11-2024,Generale nazionale,TUTTI I SETTORI PUBBLICI E PRIVATI,"Proclamante:Cub, Sgb
Aderente:Adl Varese, Usi Cit, Flai",NAZIONALE,"dalle ore 00,01 alle ore 23,59, i vvf dalle ore 8.00 alle ore 14.00, escluso dallo sciopero il trasporto ferroviario e trasporto merci e il personale del ministero di grazia e giustizia.",https://www.cgsse.it/calendario-scioperi/dettaglio-sciopero/360149,false,2024-11-29,2024-11-29,2024-11-29,2024-11-29
08-11-2024,Trasporto pubblico locale,AMTAB,"Uitrasporti, Cisas",BARI,dalle ore 08.30 alle ore 12.30 e dalle 15.30 alle 19.30,https://www.cgsse.it/calendario-scioperi/dettaglio-sciopero/360146,true,2024-11-08,2024-11-08,2024-11-08,2024-11-08
31-10-2024,Scuola,MIM,Fensir,NAZIONALE,intera giornata,https://www.cgsse.it/calendario-scioperi/dettaglio-sciopero/360143,true,2024-10-31,2024-10-31,2024-10-31,2024-10-31
24-10-2024,Regioni e autonomie Locali,ODA,Usb Lavoro Privato,CATANIA,intera giornata,https://www.cgsse.it/calendario-scioperi/dettaglio-sciopero/360139,false,2024-10-24,2024-10-24,2024-10-24,2024-10-24
24-10-2024,Sanità privata,OPERA DIOCESANA DI ASSISTENZA,Usb Lavoro Privato,CATANIA,intera giornata,https://www.cgsse.it/calendario-scioperi/dettaglio-sciopero/360134,true,2024-10-24,2024-10-24,2024-10-24,2024-10-24
07-12-2024,Ministeri,"BIBLIOTECA BRAIDENSE, PINACOTECA DI BRERA","Fp Cgil, Cisl Fp, Uilpa, Usb",MILANO,intera giornata,https://www.cgsse.it/calendario-scioperi/dettaglio-sciopero/360128,true,2024-12-07,2024-12-07,2024-12-07,2024-12-07
Dal 23-11-2024 al 24-11-2024,Trasporto ferroviario,AZIENDE CHE SVOLGONO ATTIVITA FERROVIARIA,"Proclamante:Usb Lavoro Privato
Aderente:Assemblea Nazionale Pdm/pdb",NAZIONALE,"dalle ore 21:00 del 23/11 alle ore 20:59 del 24/11, escluso il personale mobile della direzione business regionale piemonte e valle d’aosta della società trenitalia",https://www.cgsse.it/calendario-scioperi/dettaglio-sciopero/360123,false,2024-11-23,2024-11-24,2024-11-23,
28-10-2024,Noleggio con conducente,TROTTA BUS SERVICES SPA,Usb Lavoro Privato,ROMA,intero turno,https://www.cgsse.it/calendario-scioperi/dettaglio-sciopero/360118,true,2024-10-28,2024-10-28,2024-10-28,2024-10-28
28-10-2024,Regioni e autonomie Locali,TROTTA BUS SERVICES SPA,Usb Lavoro Privato,ROMA,scuola bus sarà garantito il solo trasporto del mattino all’entrata della scuola,https://www.cgsse.it/calendario-scioperi/dettaglio-sciopero/360116,true,2024-10-28,2024-10-28,2024-10-28,2024-10-28
28-10-2024,Trasporto pubblico locale,TROTTA BUS SERVICES SPA,Usb Lavoro Privato,FIUMICINO,dalle ore 12.00 alle ore 16.00,https://www.cgsse.it/calendario-scioperi/dettaglio-sciopero/360114,false,2024-10-28,2024-10-28,2024-10-28,2024-10-28
28-10-2024,Trasporto ferroviario,FS PARK,Orsa,PIEMONTE,dalle ore 09.01 alle ore 16.59,https://www.cgsse.it/calendario-scioperi/dettaglio-sciopero/360112,false,2024-10-28,2024-10-28,2024-10-28,2024-10-28
31-10-2024,Scuola,ANINSEI,Flc Cgil,NAZIONALE,intera giornata,https://www.cgsse.it/calendario-scioperi/dettaglio-sciopero/360107,false,2024-10-31,2024-10-31,2024-10-31,2024-10-31
Dal 30-10-2024 al 31-10-2024,Regioni e autonomie Locali,SERVIZI INTEGRATI,Slai Cobas Per Il Sindacato Di classe,TARANTO,intere giornate,https://www.cgsse.it/calendario-scioperi/dettaglio-sciopero/360098,false,2024-10-30,2024-10-31,2024-10-30,
Dal 24-11-2024 al 25-11-2024,Trasporto ferroviario,TRENITALIA,Orsa Trasporti,"PIEMONTE, VALLE D'AOSTA",dalle ore 03.00 del 24/11 alle ore 02.59 del 25/11,https://www.cgsse.it/calendario-scioperi/dettaglio-sciopero/360095,true,2024-11-24,2024-11-25,2024-11-24,
11-11-2024,Scuola,MIM,"Proclamante:Anquap
Aderente:Aida Scuole",NAZIONALE,intera giornata,https://www.cgsse.it/calendario-scioperi/dettaglio-sciopero/360079,false,2024-11-11,2024-11-11,2024-11-11,2024-11-11
21-10-2024,Regioni e autonomie Locali,NAPOLI SERVIZI,"Fisal, Usb, Uap",NAPOLI,"astensione dal lavoro di un’ora , a fine turno",https://www.cgsse.it/calendario-scioperi/dettaglio-sciopero/360066,true,2024-10-21,2024-10-21,2024-10-21,2024-10-21
18-10-2024,Regioni e autonomie Locali,NAPOLI SERVIZI,"Fisal, Usb, Uap",NAPOLI,"astensione dal lavoro di un’ora , a fine turno",https://www.cgsse.it/calendario-scioperi/dettaglio-sciopero/360062,true,2024-10-18,2024-10-18,2024-10-18,2024-10-18
17-10-2024,Regioni e autonomie Locali,NAPOLI SERVIZI,"Fisal, Usb, Uap",NAPOLI,"astensione dal lavoro di un’ora , a fine turno",https://www.cgsse.it/calendario-scioperi/dettaglio-sciopero/360058,true,2024-10-17,2024-10-17,2024-10-17,2024-10-17
29-10-2024,Pulizie e multiservizi,COOPSERVICE,"Sgb, Orsa Filsa",NAPOLI,intero turno di lavoro,https://www.cgsse.it/calendario-scioperi/dettaglio-sciopero/360028,true,2024-10-29,2024-10-29,2024-10-29,2024-10-29
31-10-2024,Istruzione e ricerca,MIM,Flc Cgil,NAZIONALE,intera giornata,https://www.cgsse.it/calendario-scioperi/dettaglio-sciopero/360007,false,2024-10-31,2024-10-31,2024-10-31,2024-10-31
06-11-2024,Radio e TV,GRUPPO RAI,Cisal Comunicazione,NAZIONALE,intera giornata,https://www.cgsse.it/calendario-scioperi/dettaglio-sciopero/359996,false,2024-11-06,2024-11-06,2024-11-06,2024-11-06
Dal 31-10-2024 al 07-11-2024,Liberi professionisti,DOTTORI COMMERCIALISTI E ESPERTI CONTABILI,"Anc, Andoc, Fiddoc, Unico",NAZIONALE,dalle ore 24.00 del 30/10 alle ore 24.00 del 7/11,https://www.cgsse.it/calendario-scioperi/dettaglio-sciopero/359986,false,2024-10-31,2024-11-07,2024-10-31,
08-11-2024,Sanità privata,FONDAZIONE ISTITUTO SAN CAMILLO,Alssap,CENTALLO,sciopero di 24 ore a partire dalle ore 06.00 dell' 8/11,https://www.cgsse.it/calendario-scioperi/dettaglio-sciopero/359974,false,2024-11-08,2024-11-08,2024-11-08,2024-11-08
29-11-2024,Trasporto aereo,AVIATION SERVICES,Flai Ts,VENEZIA,dalle ore 14.00 alle ore 18.00,https://www.cgsse.it/calendario-scioperi/dettaglio-sciopero/359971,false,2024-11-29,2024-11-29,2024-11-29,2024-11-29
29-11-2024,Trasporto aereo,SEA,Cub Trasporti,NAZIONALE,dalle ore 00.00 alle ore 23.59,https://www.cgsse.it/calendario-scioperi/dettaglio-sciopero/359969,false,2024-11-29,2024-11-29,2024-11-29,2024-11-29
14-11-2024,Appalti ferroviari,DUSSMANN SERVICE SRL,"Filt Cgil, Fit Cisl, Uiltrasporti, Ugl Ferrovieri, Salpas Orsa, Slm Fast Confsal",ROMA,intero turno per ogni turno di lavoro,https://www.cgsse.it/calendario-scioperi/dettaglio-sciopero/359967,true,2024-11-14,2024-11-14,2024-11-14,2024-11-14
29-10-2024,Igiene ambientale,DHI - DI NARDI HOLDING INDUSTRALE,Fit Cisl,CASAGIOVE,intera giornata,https://www.cgsse.it/calendario-scioperi/dettaglio-sciopero/359960,true,2024-10-29,2024-10-29,2024-10-29,2024-10-29
27-10-2024,Trasporto aereo,ICTS ITALIA,Filcams Cgil,PISA,dalle ore 00.00 alle ore 23:59,https://www.cgsse.it/calendario-scioperi/dettaglio-sciopero/359958,true,2024-10-27,2024-10-27,2024-10-27,2024-10-27
25-10-2024,Servizio sanitario nazionale,RANDSTAD ITALIA,"Nidil Cgil, Felsa Cisl, Uiltemp",ROMA,intera giornata,https://www.cgsse.it/calendario-scioperi/dettaglio-sciopero/359956,true,2024-10-25,2024-10-25,2024-10-25,2024-10-25
29-10-2024,Trasporto pubblico locale,ARRIVA ITALIA,Rsu,BRESCIA,dalle ore 14.30 alle ore 18.30,https://www.cgsse.it/calendario-scioperi/dettaglio-sciopero/359949,false,2024-10-29,2024-10-29,2024-10-29,2024-10-29
Dal 25-10-2024 al 26-10-2024,Igiene ambientale,"ICOS, SEA SRL","Fp Cgil, Fit Cisl, Uiltrasporti",ARAGONA,intere giornate,https://www.cgsse.it/calendario-scioperi/dettaglio-sciopero/359947,true,2024-10-25,2024-10-26,2024-10-25,
27-10-2024,Trasporto aereo,SKY ALPS,Uiltrasporti,NAZIONALE,dalle ore 13.00 alle ore 17.00 per il personale navigante,https://www.cgsse.it/calendario-scioperi/dettaglio-sciopero/359938,false,2024-10-27,2024-10-27,2024-10-27,2024-10-27
Dal 08-11-2024 al 09-11-2024,Sanità privata,OSPEDALE DI SANTA VIOLA,Fials,BOLOGNA,dalle ore 7.00 del 8/11 alle ore 7.00 del 9/11,https://www.cgsse.it/calendario-scioperi/dettaglio-sciopero/359930,false,2024-11-08,2024-11-09,2024-11-08,
25-11-2024,Ministeri,MINISTERO DELLA GIUSTIZIA,Confintesa,NAZIONALE,intera giornata,https://www.cgsse.it/calendario-scioperi/dettaglio-sciopero/359917,false,2024-11-25,2024-11-25,2024-11-25,2024-11-25
30-10-2024,Avvocati,SETTORE GIUSTIZIA,Camera Penale Di Santa Maria Capua Vetere,SANTA MARIA CAPUA VETERE,astensione dalle udienze e da ogni attività giudiziarie nel settore penale,https://www.cgsse.it/calendario-scioperi/dettaglio-sciopero/359912,true,2024-10-30,2024-10-30,2024-10-30,2024-10-30
06-11-2024,Regioni e autonomie Locali,COMUNE DI MASSA LUBRENSE,"Uil Fpl, Cisl Fp, Fp Cgil",MASSA LUBRENSE,dalle ore 12.00 alle ore 14.00 del corpo di polizia locale,https://www.cgsse.it/calendario-scioperi/dettaglio-sciopero/359903,false,2024-11-06,2024-11-06,2024-11-06,2024-11-06
13-11-2024,Trasporto ferroviario,RFI,Assemblea Nazionale Lavoratori Manutenzione Rfi,NAZIONALE,intera prestazione di lavoro,https://www.cgsse.it/calendario-scioperi/dettaglio-sciopero/359899,false,2024-11-13,2024-11-13,2024-11-13,2024-11-13
13-11-2024,Trasporto ferroviario,RFI,"Cobas Lavoro Privato, Coordinamento Ferrovieri",NAZIONALE,intera prestazione di lavoro,https://www.cgsse.it/calendario-scioperi/dettaglio-sciopero/359897,false,2024-11-13,2024-11-13,2024-11-13,2024-11-13
28-10-2024,Trasporto pubblico locale,ATAP SPA,"Filt Cgil, Fit Cisl, Cambiamenti M410, Faisa Cisal","VERCELLI , BIELLA",dalle ore 16.00 alle ore 20.00,https://www.cgsse.it/calendario-scioperi/dettaglio-sciopero/359889,false,2024-10-28,2024-10-28,2024-10-28,2024-10-28
24-10-2024,Sanità privata,CENTRO RIABILITAZIONE SAN ROCCO,Fpl Uil,"CASOLI, ATESSA",intera giornata,https://www.cgsse.it/calendario-scioperi/dettaglio-sciopero/359884,true,2024-10-24,2024-10-24,2024-10-24,2024-10-24
23-10-2024,Pulizie e multiservizi,COOPSERVICE,"Sgb, Orsa Filsa",NAPOLI,intero turno di lavoro,https://www.cgsse.it/calendario-scioperi/dettaglio-sciopero/359868,true,2024-10-23,2024-10-23,2024-10-23,2024-10-23
Dal 24-10-2024 al 25-10-2024,Igiene ambientale,GENERAL ENTERPRISE,Filas,POLLA,sciopero di 24 ore da inizio turno del 24/10 fino ad inizio turno del 25/10,https://www.cgsse.it/calendario-scioperi/dettaglio-sciopero/359859,true,2024-10-24,2024-10-25,2024-10-24,
22-10-2024,Trasporto marittimo,RIMORCHIATORI NAPOLETANI,Ugl,TARANTO,dalle ore 07.00 alle ore 19.00,https://www.cgsse.it/calendario-scioperi/dettaglio-sciopero/359844,false,2024-10-22,2024-10-22,2024-10-22,2024-10-22
08-11-2024,Trasporto pubblico locale,AZIENDE TRASPORTO PUBBLICO LOCALE,"Cobas Lavoro Privato, Adl Cobas, Sgb, Cub Trasporti",NAZIONALE,sciopero di 24 ore con articolazione oraria a livello territoriale,https://www.cgsse.it/calendario-scioperi/dettaglio-sciopero/359838,true,2024-11-08,2024-11-08,2024-11-08,2024-11-08
25-10-2024,Metalmeccanici,"CASARTIGIANI, CNA, CONFAPI, CONFARTIGIANATO , FEDERAZIONE GOMMAPLASTICA, FEDERCHIMICA, LEGA DELLE COOPERATIVE, SMI, UNIC, UNIONCHIMICA, UNIONTESSILE","Filctem Cgil, Femca Cisl, Uiltec Uil",NAZIONALE,intera giornata,https://www.cgsse.it/calendario-scioperi/dettaglio-sciopero/359806,false,2024-10-25,2024-10-25,2024-10-25,2024-10-25
25-10-2024,Energia e petrolio,"CASARTIGIANI, CNA, CONFAPI, CONFARTIGIANATO , FEDERAZIONE GOMMAPLASTICA, FEDERCHIMICA, LEGA DELLE COOPERATIVE, SMI, UNIC, UNIONCHIMICA, UNIONTESSILE","Filctem Cgil, Femca Cisl, Uiltec Uil",NAZIONALE,intera giornata,https://www.cgsse.it/calendario-scioperi/dettaglio-sciopero/359802,false,2024-10-25,2024-10-25,2024-10-25,2024-10-25
19-11-2024,Trasporto pubblico locale,AMAT,"Filt Cgil, Fit Cisl, Uiltrasporti, Faisa Cisal, Cobas Trasporti, Orsa Trasporti, Ugl Autoferro",PALERMO,dalle ore 10.00 alle ore 14.00,https://www.cgsse.it/calendario-scioperi/dettaglio-sciopero/359783,false,2024-11-19,2024-11-19,2024-11-19,2024-11-19
02-11-2024,Sanità privata,FONDAZIONE DANELLI,Fi-si,LODI,intera giornata,https://www.cgsse.it/calendario-scioperi/dettaglio-sciopero/359757,false,2024-11-02,2024-11-02,2024-11-02,2024-11-02
11-12-2024,Regioni e autonomie Locali,SCUOLE DELLA PROVINCIA DI TRENTO,Cub,TRENTO,intera giornata,https://www.cgsse.it/calendario-scioperi/dettaglio-sciopero/359722,false,2024-12-11,2024-12-11,2024-12-11,2024-12-11
28-10-2024,Trasporto merci su rotaia,SBB CARGO ITALIA,Usb,LOMBARDIA,dalle ore 16.00 alle ore 23.59,https://www.cgsse.it/calendario-scioperi/dettaglio-sciopero/359715,false,2024-10-28,2024-10-28,2024-10-28,2024-10-28
04-11-2024,Regioni e autonomie Locali,COMUNE DI MASSA LUBRENSE,"Uil Fpl, Cisl Fp, Fp Cgil",MASSA LUBRENSE,dalle ore 12.00 alle ore 14.00 del corpo di polizia locale,https://www.cgsse.it/calendario-scioperi/dettaglio-sciopero/359703,true,2024-11-04,2024-11-04,2024-11-04,2024-11-04
15-12-2024,Trasporto aereo,ENAV,Fast Confsal Av Unica,VARESE,dalle ore 13:00 alle ore 17:00,https://www.cgsse.it/calendario-scioperi/dettaglio-sciopero/359688,false,2024-12-15,2024-12-15,2024-12-15,2024-12-15
29-10-2024,Igiene ambientale,DM TECHNOLOGY,"Fiadel, Fp Cgil, Uiltrasporti",SOMMA VESUVIANA,intera giornata per tutti i turni di lavoro,https://www.cgsse.it/calendario-scioperi/dettaglio-sciopero/359681,true,2024-10-29,2024-10-29,2024-10-29,2024-10-29
15-12-2024,Trasporto aereo,ENAV,"Ugl Ta, Fast Confsal Av Unica",MILANO,dalle ore 13:00 alle ore 17:00,https://www.cgsse.it/calendario-scioperi/dettaglio-sciopero/359673,true,2024-12-15,2024-12-15,2024-12-15,2024-12-15
11-11-2024,Scuola,MIM,Anquap,NAZIONALE,intera giornata,https://www.cgsse.it/calendario-scioperi/dettaglio-sciopero/359670,true,2024-11-11,2024-11-11,2024-11-11,2024-11-11
08-11-2024,Scuola,MIM,Anquap,NAZIONALE,intera giornata,https://www.cgsse.it/calendario-scioperi/dettaglio-sciopero/359667,true,2024-11-08,2024-11-08,2024-11-08,2024-11-08
07-11-2024,Igiene ambientale,COOP 134,Sgb,RIMINI,intera giornata,https://www.cgsse.it/calendario-scioperi/dettaglio-sciopero/359648,false,2024-11-07,2024-11-07,2024-11-07,2024-11-07
18-10-2024,Pulizie e multiservizi,"ISS FACILITY SERVICES, TECNOEDILNET",Ugl,NAPOLI,intera giornata,https://www.cgsse.it/calendario-scioperi/dettaglio-sciopero/359639,true,2024-10-18,2024-10-18,2024-10-18,2024-10-18
21-10-2024,Igiene ambientale,SMA CAMPANIA,Fial Ambiente E Servizi,NAPOLI,dalle ore 00.01 alle ore 23.59,https://www.cgsse.it/calendario-scioperi/dettaglio-sciopero/359637,true,2024-10-21,2024-10-21,2024-10-21,2024-10-21
18-10-2024,Pulizie e multiservizi,CONSORZIO COPERNICO SOCIETÀ CONSORTILE,Usb Lavoro Privato,NAPOLI,intera giornata,https://www.cgsse.it/calendario-scioperi/dettaglio-sciopero/359624,false,2024-10-18,2024-10-18,2024-10-18,2024-10-18
29-11-2024,Trasporto aereo,AGS HANDLING,Flai Trasporti E Servizi,NAZIONALE,intera giornata,https://www.cgsse.it/calendario-scioperi/dettaglio-sciopero/359619,true,2024-11-29,2024-11-29,2024-11-29,2024-11-29
18-10-2024,Trasporto pubblico locale,MOVIBUS,Usb Lavoro Privato,MILANO,dalle ore 16.00 alle ore 20.00,https://www.cgsse.it/calendario-scioperi/dettaglio-sciopero/359606,false,2024-10-18,2024-10-18,2024-10-18,2024-10-18
Dal 06-07-2024 al 07-07-2024,Trasporto pubblico locale,AZIENDE CHE SVOLGONO ATTIVITA FERROVIARIA,"Proclamante:Cub Trasporti, Sgb
Aderente:Assemblea Nazionale Pdm/pdb, Usb Lavoro Privato",NAZIONALE,intera giornata con il rispetto delle fasce di garanzia,https://www.cgsse.it/calendario-scioperi/dettaglio-sciopero/359521,false,2024-07-06,2024-07-07,2024-07-06,
Dal 06-07-2024 al 07-07-2024,Trasporto merci su rotaia,AZIENDE CHE SVOLGONO ATTIVITA FERROVIARIA,"Proclamante:Cub Trasporti, Sgb
Aderente:Assemblea Nazionale Pdm/pdb, Usb Lavoro Privato",NAZIONALE,dalle ore 21:00 del 6/07 alle ore 21:00 del 7/07,https://www.cgsse.it/calendario-scioperi/dettaglio-sciopero/359514,false,2024-07-06,2024-07-07,2024-07-06,
Dal 06-07-2024 al 07-07-2024,Trasporto ferroviario,AZIENDE CHE SVOLGONO ATTIVITA FERROVIARIA,"Proclamante:Cub Trasporti, Sgb
Aderente:Assemblea Nazionale Pdm/pdb, Usb Lavoro Privato",NAZIONALE,dalle ore 21:00 del 6/07 alle ore 21:00 del 7/07 ad esclusione dei dipendenti di trenitalia con sede di lavoro nell’officina di santa maria la bruna (na),https://www.cgsse.it/calendario-scioperi/dettaglio-sciopero/359507,false,2024-07-06,2024-07-07,2024-07-06,
Dal 16-05-2024 al 20-05-2024,Trasporto pubblico locale,AZIENDE CHE SVOLGONO ATTIVITA FERROVIARIA,"Cub Trasporti, Sgb, Usb Lavoro Privato",NAZIONALE,intera giornata con il rispetto delle fasce di garanzia,https://www.cgsse.it/calendario-scioperi/dettaglio-sciopero/359502,false,2024-05-16,2024-05-20,2024-05-16,
Dal 16-05-2024 al 20-05-2024,Trasporto merci su rotaia,AZIENDE CHE SVOLGONO ATTIVITA FERROVIARIA,"Cub Trasporti, Sgb, Usb Lavoro Privato",NAZIONALE,dalle ore 21.00 del 16/5 alle 20.59 del 17/5,https://www.cgsse.it/calendario-scioperi/dettaglio-sciopero/359498,false,2024-05-16,2024-05-20,2024-05-16,
Dal 16-05-2024 al 20-05-2024,Trasporto ferroviario,AZIENDE CHE SVOLGONO ATTIVITA FERROVIARIA,"Cub Trasporti, Sgb, Usb Lavoro Privato",NAZIONALE,dalle ore 3.00 del 19/5 alle ore 2.00 del 20/5 revocato con ordinanza ministeriale n.199 t,https://www.cgsse.it/calendario-scioperi/dettaglio-sciopero/359494,false,2024-05-16,2024-05-20,2024-05-16,
24-03-2024,Trasporto merci su rotaia,AZIENDE CHE SVOLGONO ATTIVITA FERROVIARIA,Cat,NAZIONALE,dalle ore 09:00 alle ore 16:59,https://www.cgsse.it/calendario-scioperi/dettaglio-sciopero/359490,false,2024-03-24,2024-03-24,2024-03-24,2024-03-24
24-03-2024,Trasporto ferroviario,AZIENDE CHE SVOLGONO ATTIVITA FERROVIARIA,Cat,NAZIONALE,dalle ore 09:00 alle ore 16:59,https://www.cgsse.it/calendario-scioperi/dettaglio-sciopero/359488,false,2024-03-24,2024-03-24,2024-03-24,2024-03-24
Dal 23-03-2024 al 24-03-2024,Trasporto pubblico locale,AZIENDE CHE SVOLGONO ATTIVITA FERROVIARIA,"Proclamante:Cub Trasporti, Sgb
Aderente:Usb Lavoro Privato",NAZIONALE,intera giornata con il rispetto delle fasce di garanzia,https://www.cgsse.it/calendario-scioperi/dettaglio-sciopero/359486,false,2024-03-23,2024-03-24,2024-03-23,
Dal 23-03-2024 al 24-03-2024,Trasporto merci su rotaia,AZIENDE CHE SVOLGONO ATTIVITA FERROVIARIA,"Proclamante:Cub Trasporti, Sgb
Aderente:Usb Lavoro Privato",NAZIONALE,dalle ore 21:00 del 23/03 alle ore 21:00 del 24/03,https://www.cgsse.it/calendario-scioperi/dettaglio-sciopero/359482,false,2024-03-23,2024-03-24,2024-03-23,
Dal 23-03-2024 al 24-03-2024,Trasporto ferroviario,AZIENDE CHE SVOLGONO ATTIVITA FERROVIARIA,"Proclamante:Cub Trasporti, Sgb
Aderente:Usb Lavoro Privato",NAZIONALE,dalle ore 21:00 del 23/03 alle ore 21:00 del 24/03,https://www.cgsse.it/calendario-scioperi/dettaglio-sciopero/359478,false,2024-03-23,2024-03-24,2024-03-23,
12-02-2024,Trasporto pubblico locale,AZIENDE CHE SVOLGONO ATTIVITA FERROVIARIA,"Cub Trasporti, Sgb",NAZIONALE,l'astensione è di 4 ore con revoca per la gtt di torino e ferrovie del sud est bari.,https://www.cgsse.it/calendario-scioperi/dettaglio-sciopero/359466,false,2024-02-12,2024-02-12,2024-02-12,2024-02-12
05-02-2024,Trasporto pubblico locale,AZIENDE CHE SVOLGONO ATTIVITA FERROVIARIA,"Cub Trasporti, Sgb",NAZIONALE,dalle ore 9:00 alle ore 17:00,https://www.cgsse.it/calendario-scioperi/dettaglio-sciopero/359463,true,2024-02-05,2024-02-05,2024-02-05,2024-02-05
12-02-2024,Trasporto merci su rotaia,AZIENDE CHE SVOLGONO ATTIVITA FERROVIARIA,"Cub Trasporti, Sgb",NAZIONALE,dalle ore 9:00 alle ore 17:00,https://www.cgsse.it/calendario-scioperi/dettaglio-sciopero/359458,false,2024-02-12,2024-02-12,2024-02-12,2024-02-12
05-02-2024,Trasporto merci su rotaia,AZIENDE CHE SVOLGONO ATTIVITA FERROVIARIA,"Cub Trasporti, Sgb",NAZIONALE,dalle ore 9:00 alle ore 17:00,https://www.cgsse.it/calendario-scioperi/dettaglio-sciopero/359455,true,2024-02-05,2024-02-05,2024-02-05,2024-02-05
12-02-2024,Trasporto ferroviario,AZIENDE CHE SVOLGONO ATTIVITA FERROVIARIA,"Cub Trasporti, Sgb",NAZIONALE,dalle ore 9:00 alle ore 17:00,https://www.cgsse.it/calendario-scioperi/dettaglio-sciopero/359450,false,2024-02-12,2024-02-12,2024-02-12,2024-02-12
05-02-2024,Trasporto ferroviario,AZIENDE CHE SVOLGONO ATTIVITA FERROVIARIA,"Cub Trasporti, Sgb",NAZIONALE,dalle ore 9:00 alle ore 17:00,https://www.cgsse.it/calendario-scioperi/dettaglio-sciopero/359447,true,2024-02-05,2024-02-05,2024-02-05,2024-02-05
08-10-2024,Trasporto ferroviario,AZIENDE DEL SETTORE,"Cgil, Cisl, Uil",BOLOGNA,2 ore di sciopero al termine di ogni turno o orario di lavoro,https://www.cgsse.it/calendario-scioperi/dettaglio-sciopero/359444,false,2024-10-08,2024-10-08,2024-10-08,2024-10-08
08-10-2024,Metalmeccanici,AZIENDE DEL COMPARTO,"Cgil, Cisl, Uil",BOLOGNA,2 ore di sciopero al termine di ogni turno o orario di lavoro,https://www.cgsse.it/calendario-scioperi/dettaglio-sciopero/359440,false,2024-10-08,2024-10-08,2024-10-08,2024-10-08
08-10-2024,Plurisettoriale territoriale,AZIENDE DEL SETTORE,"Cgil, Cisl, Uil",BOLOGNA,2 ore di sciopero al termine di ogni turno o orario di lavoro,https://www.cgsse.it/calendario-scioperi/dettaglio-sciopero/359436,false,2024-10-08,2024-10-08,2024-10-08,2024-10-08
17-10-2024,Igiene ambientale,COOP 134,Sgb,RIMINI,intera giornata,https://www.cgsse.it/calendario-scioperi/dettaglio-sciopero/359403,true,2024-10-17,2024-10-17,2024-10-17,2024-10-17
19-10-2024,Igiene ambientale,DM TECHNOLOGY,"Fiadel, Fp Cgil, Uiltrasporti",SOMMA VESUVIANA,intera giornata per tutti i turni di lavoro,https://www.cgsse.it/calendario-scioperi/dettaglio-sciopero/359401,true,2024-10-19,2024-10-19,2024-10-19,2024-10-19
Dal 12-10-2024 al 13-10-2024,Trasporto merci su rotaia,AZIENDE CHE SVOLGONO ATTIVITA FERROVIARIA,"Proclamante:Cub Trasporti, Sgb
Aderente:Assemblea Nazionale Pdm/pdb, Usb Lavoro Privato",NAZIONALE,dalle ore 21:00 del 12/10 alle ore 20:59 del 13/10,https://www.cgsse.it/calendario-scioperi/dettaglio-sciopero/359391,false,2024-10-12,2024-10-13,2024-10-12,
Dal 12-10-2024 al 13-10-2024,Trasporto ferroviario,AZIENDE CHE SVOLGONO ATTIVITA FERROVIARIA,"Proclamante:Cub Trasporti, Sgb
Aderente:Assemblea Nazionale Pdm/pdb, Usb Lavoro Privato",NAZIONALE,dalle ore 21:00 del 12/10 alle ore 20:59 del 13/10,https://www.cgsse.it/calendario-scioperi/dettaglio-sciopero/359374,false,2024-10-12,2024-10-13,2024-10-12,
18-10-2024,Igiene ambientale,IGM RIFIUTI INDUSTRIALI SRL,Fiadel Csa,MODICA,intera giornata,https://www.cgsse.it/calendario-scioperi/dettaglio-sciopero/359304,false,2024-10-18,2024-10-18,2024-10-18,2024-10-18
24-10-2024,Regioni e autonomie Locali,COMUNE DI MASSA LUBRENSE,"Uil Fpl, Cisl Fp, Fp Cgil",MASSA LUBRENSE,dalle ore 12.00 alle ore 14.00 del corpo di polizia locale,https://www.cgsse.it/calendario-scioperi/dettaglio-sciopero/359287,true,2024-10-24,2024-10-24,2024-10-24,2024-10-24
16-10-2024,Trasporto marittimo,"ANCIP, ASSITERMINAL, ASSOARMATORI, ASSOLOGISTICA, ASSOPORTI, CONFITARMA, UNIPORT-FISE",Usb,NAZIONALE,dalle ore 00.00 alle ore 23.59,https://www.cgsse.it/calendario-scioperi/dettaglio-sciopero/359280,false,2024-10-16,2024-10-16,2024-10-16,2024-10-16
18-10-2024,Igiene ambientale,"BLU WORK, CONSORZIO AIRONE, DM TECHNOLOGY, L'IGIENE URBANA EVOLUTION","Fiadel, Fp Cgil, Fit Cisl",ARDEA,24 ore per tutti i turni di lavoro,https://www.cgsse.it/calendario-scioperi/dettaglio-sciopero/359271,false,2024-10-18,2024-10-18,2024-10-18,2024-10-18
16-10-2024,Avvocati,SETTORE GIUSTIZIA,Camera Penale Di Bari,BARI,astensione dalle udienze e dalle attività giudiziarie,https://www.cgsse.it/calendario-scioperi/dettaglio-sciopero/359261,false,2024-10-16,2024-10-16,2024-10-16,2024-10-16
14-10-2024,Trasporto marittimo,CO.ME.T.,Fit Cisl,MILAZZO,dalle ore 8.30 alle ore 16.30,https://www.cgsse.it/calendario-scioperi/dettaglio-sciopero/359254,false,2024-10-14,2024-10-14,2024-10-14,2024-10-14
24-10-2024,Trasporto merci su rotaia,SBB CARGO ITALIA,Usb,LOMBARDIA,dalle ore 16.00 alle ore 23.59,https://www.cgsse.it/calendario-scioperi/dettaglio-sciopero/359252,true,2024-10-24,2024-10-24,2024-10-24,2024-10-24
13-10-2024,Regioni e autonomie Locali,COMUNE DI PAVIA,Uil Fpl,PAVIA,intera giornata del corpo di polizia locale,https://www.cgsse.it/calendario-scioperi/dettaglio-sciopero/359242,true,2024-10-13,2024-10-13,2024-10-13,2024-10-13
Dal 28-10-2024 al 31-10-2024,Avvocati,SETTORE GIUSTIZIA,Camera Penale Di Castrovillari,CASTROVILLARI,astensione dalle udienze e da ogni attività giudiziaria di 4 gg,https://www.cgsse.it/calendario-scioperi/dettaglio-sciopero/359234,false,2024-10-28,2024-10-31,2024-10-28,
15-10-2024,Igiene ambientale,"BLU WORK, CONSORZIO AIRONE, DM TECHNOLOGY, L'IGIENE URBANA EVOLUTION","Fiadel, Fp Cgil, Fit Cisl",ARDEA,24 ore su tutti i turni di lavoro,https://www.cgsse.it/calendario-scioperi/dettaglio-sciopero/359232,true,2024-10-15,2024-10-15,2024-10-15,2024-10-15
28-10-2024,Trasporto pubblico locale,ATAC,"Usb Lavoro Privato, Orsa Tpl",ROMA,dalle ore 8.30 alle ore 17.00 e dalle ore 20.00 a fine servizio,https://www.cgsse.it/calendario-scioperi/dettaglio-sciopero/359228,false,2024-10-28,2024-10-28,2024-10-28,2024-10-28
28-10-2024,Igiene ambientale,ARCOBALENO,Usb Lavoro Privato,TORINO,"intero turno di lavoro,",https://www.cgsse.it/calendario-scioperi/dettaglio-sciopero/359222,false,2024-10-28,2024-10-28,2024-10-28,2024-10-28
Dal 13-11-2024 al 14-11-2024,Servizio sanitario nazionale,SERVIZIO SANITARIO NAZIONALE,Fials,"PIACENZA , PARMA , REGGIO NELL'EMILIA, MODENA , BOLOGNA , FERRARA",dalle ore 07:00 del 13/11 alle ore 07:00 del 14/11,https://www.cgsse.it/calendario-scioperi/dettaglio-sciopero/359215,true,2024-11-13,2024-11-14,2024-11-13,
30-10-2024,Servizio sanitario nazionale,ASL VCO,Uil Fpl,VERBANO-CUSIO-OSSOLA,intera giornata o turno di lavoro],https://www.cgsse.it/calendario-scioperi/dettaglio-sciopero/359213,false,2024-10-30,2024-10-30,2024-10-30,2024-10-30
15-10-2024,Servizio sanitario nazionale,ASL CASERTA,"Fp Cgil, Fp Cisl, Fpl Uil, Nursing Up, Fials, Nursind","AVERSA, CARINOLA, CALVI RISORTA, SANTA MARIA CAPUA VETERE",intera giornata,https://www.cgsse.it/calendario-scioperi/dettaglio-sciopero/359205,true,2024-10-15,2024-10-15,2024-10-15,2024-10-15
03-10-2024,Trasporto pubblico locale,ARRIVA UDINE,Orsa Trasporti,UDINE,dalle ore 17.30 alle ore 19.30,https://www.cgsse.it/calendario-scioperi/dettaglio-sciopero/359197,false,2024-10-03,2024-10-03,2024-10-03,2024-10-03
03-10-2024,Trasporto pubblico locale,ARRIVA UDINE,Fit Cgil,UDINE,dalle ore 17.30 alle ore 19.30,https://www.cgsse.it/calendario-scioperi/dettaglio-sciopero/359195,false,2024-10-03,2024-10-03,2024-10-03,2024-10-03
14-10-2024,Pulizie e multiservizi,ISS ITALIA,Fisascat Cisl,NAPOLI,intero turno di lavoro,https://www.cgsse.it/calendario-scioperi/dettaglio-sciopero/359193,true,2024-10-14,2024-10-14,2024-10-14,2024-10-14
14-10-2024,Servizio sanitario nazionale,PIO X HUMANITAS,Fi-si,MILANO,,https://www.cgsse.it/calendario-scioperi/dettaglio-sciopero/359191,false,2024-10-14,2024-10-14,2024-10-14,2024-10-14
22-10-2024,Servizio sanitario nazionale,CLINICA HERMITAGE MAUGERI,Cisl Fp,NAPOLI,intera giornata,https://www.cgsse.it/calendario-scioperi/dettaglio-sciopero/359176,true,2024-10-22,2024-10-22,2024-10-22,2024-10-22
29-11-2024,Trasporto aereo,WIZZ AIR MALTA LTD,Filt Cgil,NAZIONALE,dalle ore 00.00 alle ore 24.00,https://www.cgsse.it/calendario-scioperi/dettaglio-sciopero/359168,false,2024-11-29,2024-11-29,2024-11-29,2024-11-29
13-10-2024,Trasporto ferroviario,MERCITALIA SHUNTING & TERMINAL,Orsa Trasporti,PIEMONTE,dalle ore 09.01 alle ore16.59,https://www.cgsse.it/calendario-scioperi/dettaglio-sciopero/359165,false,2024-10-13,2024-10-13,2024-10-13,2024-10-13
27-10-2024,Trasporto aereo,ASSOHANDLERS,Flai Trasporti E Servizi,NAZIONALE,dalle ore 13.00 alle ore 17.00,https://www.cgsse.it/calendario-scioperi/dettaglio-sciopero/359151,true,2024-10-27,2024-10-27,2024-10-27,2024-10-27
27-10-2024,Trasporto aereo,GH VENEZIA,Flai Trasporti E Servizi,VENEZIA,dalle ore 13.00 alle ore 17.00,https://www.cgsse.it/calendario-scioperi/dettaglio-sciopero/359149,true,2024-10-27,2024-10-27,2024-10-27,2024-10-27
27-10-2024,Trasporto aereo,SICURITALIA IVRI,Flai Trasporti E Servizi,VENEZIA,dalle ore 13.00 alle ore 17.00,https://www.cgsse.it/calendario-scioperi/dettaglio-sciopero/359147,true,2024-10-27,2024-10-27,2024-10-27,2024-10-27
Dal 20-10-2024 al 25-10-2024,Trasporto merci su gomma,AZIENDE DEL SETTORE AUTOTRASPORTO MERCI,Comitato Trasporto Siciliano,SICILIA,dalle ore 00.01 del 20/10/2024 alle ore 24.00 del 25/10/2024,https://www.cgsse.it/calendario-scioperi/dettaglio-sciopero/359145,true,2024-10-20,2024-10-25,2024-10-20,
14-10-2024,Igiene ambientale,ARCOBALENO,Usb Lavoro Privato,TORINO,"intero turno di lavoro,",https://www.cgsse.it/calendario-scioperi/dettaglio-sciopero/359141,true,2024-10-14,2024-10-14,2024-10-14,2024-10-14
18-10-2024,Regioni e autonomie Locali,ODA,Usb Lavoro Privato,CATANIA,intera giornata,https://www.cgsse.it/calendario-scioperi/dettaglio-sciopero/359129,true,2024-10-18,2024-10-18,2024-10-18,2024-10-18
07-10-2024,Regioni e autonomie Locali,ODA,Usb Lavoro Privato,CATANIA,intera giornata,https://www.cgsse.it/calendario-scioperi/dettaglio-sciopero/359127,false,2024-10-07,2024-10-07,2024-10-07,2024-10-07
18-10-2024,Sanità privata,ODA,Usb Lavoro Privato,CATANIA,intera giornata,https://www.cgsse.it/calendario-scioperi/dettaglio-sciopero/359125,true,2024-10-18,2024-10-18,2024-10-18,2024-10-18
07-10-2024,Sanità privata,ODA,Usb Lavoro Privato,CATANIA,intera giornata,https://www.cgsse.it/calendario-scioperi/dettaglio-sciopero/359123,false,2024-10-07,2024-10-07,2024-10-07,2024-10-07
Dal 14-10-2024 al 18-10-2024,Avvocati,SETTORE GIUSTIZIA,Camera Penale Di Crotone,CROTONE,astensione dalle attività giudiziarie della durata di 5 gg.,https://www.cgsse.it/calendario-scioperi/dettaglio-sciopero/359107,false,2024-10-14,2024-10-18,2024-10-14,
29-11-2024,Trasporto aereo,AVIAPARTNER HANDLING,Cub Trasporti,"MILANO, VARESE",dalle ore 00.00 alle 23.59,https://www.cgsse.it/calendario-scioperi/dettaglio-sciopero/359104,false,2024-11-29,2024-11-29,2024-11-29,2024-11-29
11-10-2024,Trasporto aereo,WIZZ AIR MALTA LTD,Filt Cgil,NAZIONALE,dalle ore 00.00 alle ore 24.00,https://www.cgsse.it/calendario-scioperi/dettaglio-sciopero/359102,true,2024-10-11,2024-10-11,2024-10-11,2024-10-11
05-10-2024,Trasporto pubblico locale,START ROMAGNA,"Fit Cisl, Uiltrasporti, Ugl Autoferro, Faisa Cisal, Usb, Filt Cgil",RIMINI,dalle ore 09.00 alle ore 13.00,https://www.cgsse.it/calendario-scioperi/dettaglio-sciopero/359100,true,2024-10-05,2024-10-05,2024-10-05,2024-10-05
13-10-2024,Trasporto ferroviario,TRENITALIA,Orsa Trasporti,"PIEMONTE, VALLE D'AOSTA",dalle ore 09:01 alle ore 16:59,https://www.cgsse.it/calendario-scioperi/dettaglio-sciopero/359093,false,2024-10-13,2024-10-13,2024-10-13,2024-10-13
15-10-2024,Servizio sanitario nazionale,CLINICA HERMITAGE MAUGERI,Cisl Fp,NAPOLI,intera giornata,https://www.cgsse.it/calendario-scioperi/dettaglio-sciopero/359087,true,2024-10-15,2024-10-15,2024-10-15,2024-10-15
30-09-2024,Regioni e autonomie Locali,SISPI,"Fim Cisl, Fiom Cgil",PALERMO,blocco totale dei servizi e delle attività del personale addetto alla manutenzione dell' infrastruttura tecnologica del comune di palermo,https://www.cgsse.it/calendario-scioperi/dettaglio-sciopero/359078,false,2024-09-30,2024-09-30,2024-09-30,2024-09-30
18-10-2024,Sanità privata,FONDAZIONE ISTITUTO SAN CAMILLO,Alssap,CENTALLO,sciopero di 24 ore a partire dalle ore 06.00 del 18/10,https://www.cgsse.it/calendario-scioperi/dettaglio-sciopero/359045,true,2024-10-18,2024-10-18,2024-10-18,2024-10-18
Dal 09-11-2024 al 10-11-2024,Trasporto ferroviario,TRENITALIA,"Filt Cgil, Uilt Uil, Ugl Ferrovieri, Fast Mobilita, Orsa",CAMPANIA,dalle ore 19.00 del 09/11 alle ore 18.00 del 10/11,https://www.cgsse.it/calendario-scioperi/dettaglio-sciopero/359025,false,2024-11-09,2024-11-10,2024-11-09,
18-10-2024,Sanità privata,OSPEDALE DI SANTA VIOLA,Fials,BOLOGNA,intera giornata,https://www.cgsse.it/calendario-scioperi/dettaglio-sciopero/359014,true,2024-10-18,2024-10-18,2024-10-18,2024-10-18
Dal 08-10-2024 al 09-10-2024,Igiene ambientale,"EMC2, SAN GERMANO, SIRIO",Uiltrasporti,PARMA,intere giornate,https://www.cgsse.it/calendario-scioperi/dettaglio-sciopero/359010,true,2024-10-08,2024-10-09,2024-10-08,
11-10-2024,Trasporto aereo,TECHNO SKY,"Filt Cgil, Uiltrasporti","BARI, BRINDISI",personale h35 dalle ore 13.00 alle ore 17.00; personale h36 ultime 4 ore di lavoro,https://www.cgsse.it/calendario-scioperi/dettaglio-sciopero/359000,false,2024-10-11,2024-10-11,2024-10-11,2024-10-11
07-10-2024,Regioni e autonomie Locali,SERVIZI INTEGRATI,Slai Cobas,TARANTO,intera giornata,https://www.cgsse.it/calendario-scioperi/dettaglio-sciopero/358971,false,2024-10-07,2024-10-07,2024-10-07,2024-10-07
08-10-2024,Igiene ambientale,"ICOS, SEA SRL","Fp Cgil, Fit Cisl, Uiltrasporti",ARAGONA,intera giornata,https://www.cgsse.it/calendario-scioperi/dettaglio-sciopero/358951,false,2024-10-08,2024-10-08,2024-10-08,2024-10-08
11-10-2024,Sanità privata,AZIENDE DELLA SANITA' PRIVATA,Cub Sanità,NAZIONALE,intera giornata per ogni turno di lavoro,https://www.cgsse.it/calendario-scioperi/dettaglio-sciopero/358920,false,2024-10-11,2024-10-11,2024-10-11,2024-10-11
08-10-2024,Ministeri,MINISTERO DELLA GIUSTIZIA,Comitato Nazionale Cancellieri Esperti,NAZIONALE,intera giornata,https://www.cgsse.it/calendario-scioperi/dettaglio-sciopero/358918,false,2024-10-08,2024-10-08,2024-10-08,2024-10-08
22-11-2024,Trasporto pubblico locale,ARRIVA ITALIA,Rsu,BRESCIA,dalle ore 14.30 alle ore 18.30,https://www.cgsse.it/calendario-scioperi/dettaglio-sciopero/358916,true,2024-11-22,2024-11-22,2024-11-22,2024-11-22
09-10-2024,Trasporto ferroviario,RFI,"Proclamante:Cub Trasporti
Aderente:Usb Lavoro Privato",NAZIONALE,intera giornata,https://www.cgsse.it/calendario-scioperi/dettaglio-sciopero/358895,false,2024-10-09,2024-10-09,2024-10-09,2024-10-09
Dal 10-10-2024 al 11-10-2024,Avvocati,SETTORE GIUSTIZIA,Camera Penale Di Torre Annunziata,TORRE ANNUNZIATA,astensione dalle attività giudiziarie di 2 gg,https://www.cgsse.it/calendario-scioperi/dettaglio-sciopero/358893,false,2024-10-10,2024-10-11,2024-10-10,
07-10-2024,Igiene ambientale,DHI SPA,Uiltrasporti,MACERATA CAMPANIA,intera giornata,https://www.cgsse.it/calendario-scioperi/dettaglio-sciopero/358885,true,2024-10-07,2024-10-07,2024-10-07,2024-10-07
05-10-2024,Trasporto pubblico locale,EAV,Orsa Trasporti,NAPOLI,dalle ore 19.40 alle ore 23.40,https://www.cgsse.it/calendario-scioperi/dettaglio-sciopero/358881,false,2024-10-05,2024-10-05,2024-10-05,2024-10-05
09-10-2024,Regioni e autonomie Locali,SCUOLE DELLA PROVINCIA DI TRENTO,Cub,TRENTO,intera giornata,https://www.cgsse.it/calendario-scioperi/dettaglio-sciopero/358879,true,2024-10-09,2024-10-09,2024-10-09,2024-10-09
04-10-2024,Servizio sanitario nazionale,"CICLAT, COLSER, COPMA, DUSSMANN, L'OPEROSA, TEAM SERVICE","Filcams Cgil, Fisascat Cisl",SALERNO,interi turni di lavoro,https://www.cgsse.it/calendario-scioperi/dettaglio-sciopero/358875,true,2024-10-04,2024-10-04,2024-10-04,2024-10-04
28-10-2024,Trasporto pubblico locale,BUSITALIA SITA NORD,Usb Lavoro Privato,UMBRIA,"perugia, spoleto fasce garantite dalle ore 06:00 alle 09:00 e dalle 12:00 alle 15:00. terni dalle ore 06:30 alle 09:30 e dalle 12:30 alle 15:30. servizi ferroviari fasce garantite dalle ore 05.45 alle 08.45 e dalle 11,45 alle 14.45",https://www.cgsse.it/calendario-scioperi/dettaglio-sciopero/358872,false,2024-10-28,2024-10-28,2024-10-28,2024-10-28
09-10-2024,Regioni e autonomie Locali,SISPI,"Fim Cisl, Fiom Cgil",PALERMO,blocco totale dei servizi e delle attività del personale addetto alla manutenzione dell'infrastruttura tecnologica del comune di palermo,https://www.cgsse.it/calendario-scioperi/dettaglio-sciopero/358867,true,2024-10-09,2024-10-09,2024-10-09,2024-10-09
05-10-2024,Trasporto pubblico locale,ARRIVA UDINE,Orsa Trasporti,UDINE,dalle ore 15.00 alle ore 19.00,https://www.cgsse.it/calendario-scioperi/dettaglio-sciopero/358864,false,2024-10-05,2024-10-05,2024-10-05,2024-10-05
04-10-2024,Pulizie e multiservizi,PULITORI E AFFINI,"Filcams Cgil, Fisascat Cisl, Uiltrasporti",GENOVA,intera giornata,https://www.cgsse.it/calendario-scioperi/dettaglio-sciopero/358854,false,2024-10-04,2024-10-04,2024-10-04,2024-10-04
11-10-2024,Trasporto aereo,ICTS ITALIA,Filcams Cgil,PISA,dalle ore 13:00 alle ore 16:59,https://www.cgsse.it/calendario-scioperi/dettaglio-sciopero/358847,false,2024-10-11,2024-10-11,2024-10-11,2024-10-11
05-10-2024,Trasporto pubblico locale,SETA,Usb Lavoro Privato,"MODENA, PIACENZA, REGGIO NELL'EMILIA",sciopero di 24 ore nel rispetto delle fasce di garanzia con modalità diversa per ogni bacino,https://www.cgsse.it/calendario-scioperi/dettaglio-sciopero/358845,false,2024-10-05,2024-10-05,2024-10-05,2024-10-05
04-10-2024,Appalti ferroviari,DUSSMANN SERVICE SRL,"Filt Cgil, Fit Cisl, Uiltrasporti, Ugl Ferrovieri, Salpas Orsa, Slm Fast Confsal",ROMA,intero turno per ogni turno di lavoro,https://www.cgsse.it/calendario-scioperi/dettaglio-sciopero/358821,false,2024-10-04,2024-10-04,2024-10-04,2024-10-04
30-09-2024,Pulizie e multiservizi,PULITORI E AFFINI,"Filcams Cgil, Fisascat Cisl, Uiltrasporti",GENOVA,intera giornata,https://www.cgsse.it/calendario-scioperi/dettaglio-sciopero/358814,true,2024-09-30,2024-09-30,2024-09-30,2024-09-30
08-11-2024,Trasporto pubblico locale,AZIENDE TRASPORTO PUBBLICO LOCALE,Confail Faisa,NAZIONALE,sciopero di 4 ore con articolazione oraria a livello territoriale],https://www.cgsse.it/calendario-scioperi/dettaglio-sciopero/358810,true,2024-11-08,2024-11-08,2024-11-08,2024-11-08
18-10-2024,Generale nazionale,TUTTI I SETTORI PUBBLICI E PRIVATI,Si Cobas,NAZIONALE,"intera giornata, esclusi i settori sanità pubblica e settori socio-sanitari-assistenziali, la società tekra di i.a. comune di siracusa,società atm trapani, imprese che svolgono attività ferroviarie, rfi, enav di palermo e olbia, technosky e easyjet",https://www.cgsse.it/calendario-scioperi/dettaglio-sciopero/358808,false,2024-10-18,2024-10-18,2024-10-18,2024-10-18
08-11-2024,Trasporto pubblico locale,AZIENDE TRASPORTO PUBBLICO LOCALE,"Filt Cgil, Fit Cisl, Uiltrasporti, Faisa Cisal, Ugl Fna",NAZIONALE,sciopero di 24 ore con articolazione oraria a livello territoriale],https://www.cgsse.it/calendario-scioperi/dettaglio-sciopero/358806,false,2024-11-08,2024-11-08,2024-11-08,2024-11-08
Dal 01-10-2024 al 02-10-2024,Igiene ambientale,"EMC2, SAN GERMANO, SIRIO",Uiltrasporti,PARMA,intere giornate,https://www.cgsse.it/calendario-scioperi/dettaglio-sciopero/358797,true,2024-10-01,2024-10-02,2024-10-01,
04-10-2024,Servizio sanitario nazionale,POLYGON,Fiom Cgil,"FELTRE, BELLUNO",intera giornata,https://www.cgsse.it/calendario-scioperi/dettaglio-sciopero/358792,true,2024-10-04,2024-10-04,2024-10-04,2024-10-04
04-10-2024,Servizio sanitario nazionale,POLYGON,Fiom Cgil,SALERNO,ultime 4 ore di ogni turno,https://www.cgsse.it/calendario-scioperi/dettaglio-sciopero/358774,true,2024-10-04,2024-10-04,2024-10-04,2024-10-04
04-10-2024,Servizio sanitario nazionale,POLYGON,Fiom Cgil,PALERMO,ultime 4 ore di ogni turno,https://www.cgsse.it/calendario-scioperi/dettaglio-sciopero/358764,true,2024-10-04,2024-10-04,2024-10-04,2024-10-04
Dal 03-10-2024 al 04-10-2024,Sanità privata,OSPEDALE DI SANTA VIOLA,Fials,BOLOGNA,dalle ore 07.00 del 03/10 alle ore 07.00 del 04/10,https://www.cgsse.it/calendario-scioperi/dettaglio-sciopero/358762,true,2024-10-03,2024-10-04,2024-10-03,
07-10-2024,Servizio sanitario nazionale,GSA GRUPPO SERVIZI ASSOCIATI,Filt Cgil,NAZIONALE,dalle ore 19.00 alle ore 21.00,https://www.cgsse.it/calendario-scioperi/dettaglio-sciopero/358759,false,2024-10-07,2024-10-07,2024-10-07,2024-10-07
07-10-2024,Circolazione e sicurezza stradale,GSA GRUPPO SERVIZI ASSOCIATI,Filt Cgil,NAZIONALE,dalle ore 19.00 alle ore 21.00,https://www.cgsse.it/calendario-scioperi/dettaglio-sciopero/358757,false,2024-10-07,2024-10-07,2024-10-07,2024-10-07
05-10-2024,Trasporto pubblico locale,FERROVIE DEL SUD EST E SERVIZI AUTOMOBILISTICI,"Filt Cgil, Fit Cisl, Faisa Cisal",LECCE,intera giornata,https://www.cgsse.it/calendario-scioperi/dettaglio-sciopero/358746,false,2024-10-05,2024-10-05,2024-10-05,2024-10-05
12-11-2024,Trasporto aereo,ENAV,"Filt Cgil, Uiltrasporti",PERUGIA,dalle ore 13.00 alle ore 17.00,https://www.cgsse.it/calendario-scioperi/dettaglio-sciopero/358711,false,2024-11-12,2024-11-12,2024-11-12,2024-11-12
12-11-2024,Trasporto aereo,ENAV,"Filt Cgil, Uiltrasporti",PARMA,dalle ore 13.00 alle ore 17.00,https://www.cgsse.it/calendario-scioperi/dettaglio-sciopero/358708,true,2024-11-12,2024-11-12,2024-11-12,2024-11-12
Dal 07-10-2024 al 11-10-2024,Avvocati,SETTORE GIUSTIZIA,Camera Penale Di Lamezia Terme,LAMEZIA TERME,astensione dalle udienze e dalle attività giudiziarie nel settore penale degli avvocati di 5 gg,https://www.cgsse.it/calendario-scioperi/dettaglio-sciopero/358655,false,2024-10-07,2024-10-11,2024-10-07,
30-09-2024,Trasporto aereo,ICTS ITALIA,Filcams Cgil,PISA,dalle ore 11:00 alle ore 14:59,https://www.cgsse.it/calendario-scioperi/dettaglio-sciopero/358606,true,2024-09-30,2024-09-30,2024-09-30,2024-09-30
27-10-2024,Trasporto aereo,EASYJET AIRLINE LIMITED,Uiltrasporti,NAZIONALE,"dalle ore 13.00 alle ore 17.00, con esclusione dei voli da e per olbia e i voli da e per gli aeroporti della regione liguria",https://www.cgsse.it/calendario-scioperi/dettaglio-sciopero/358602,true,2024-10-27,2024-10-27,2024-10-27,2024-10-27
03-10-2024,Igiene ambientale,RIECO,Usb Lavoro Privato,TOLFA,intero turno di lavoro,https://www.cgsse.it/calendario-scioperi/dettaglio-sciopero/358599,false,2024-10-03,2024-10-03,2024-10-03,2024-10-03
18-10-2024,Trasporto pubblico locale,AMTS CATANIA,Cub Trasporti,CATANIA,dalle ore 10.00 alle ore 14.00,https://www.cgsse.it/calendario-scioperi/dettaglio-sciopero/358588,false,2024-10-18,2024-10-18,2024-10-18,2024-10-18
Dal 26-09-2024 al 27-09-2024,Igiene ambientale,CZETA,Filas,SAN CIPRIANO D'AVERSA,intere giornate,https://www.cgsse.it/calendario-scioperi/dettaglio-sciopero/358586,false,2024-09-26,2024-09-27,2024-09-26,
02-10-2024,Scuola,MIM,Cobas Scuola Sardegna,SARDEGNA,intera giornata,https://www.cgsse.it/calendario-scioperi/dettaglio-sciopero/358584,false,2024-10-02,2024-10-02,2024-10-02,2024-10-02
11-10-2024,Trasporto aereo,TECHNO SKY,"Filt Cgil, Uiltrasporti","BARI, BRINDISI",personale h35 dalle ore 13.00 alle ore 17.00; personale h36 ultime 4 ore di lavoro,https://www.cgsse.it/calendario-scioperi/dettaglio-sciopero/358579,true,2024-10-11,2024-10-11,2024-10-11,2024-10-11
30-09-2024,Igiene ambientale,AMAG AMBIENTE,"Fp Cgil, Fit Cisl, Uiltrasporti, Fiadel",ALESSANDRIA,intera giornata,https://www.cgsse.it/calendario-scioperi/dettaglio-sciopero/358574,false,2024-09-30,2024-09-30,2024-09-30,2024-09-30
12-11-2024,Trasporto aereo,ENAV,"Filt Cgil, Uiltrasporti",BERGAMO,dalle ore 13.00 alle ore 17.00,https://www.cgsse.it/calendario-scioperi/dettaglio-sciopero/358569,true,2024-11-12,2024-11-12,2024-11-12,2024-11-12
12-11-2024,Trasporto aereo,ENAV,"Filt Cgil, Uiltrasporti",NAPOLI,dalle ore 13.00 alle ore 17.00,https://www.cgsse.it/calendario-scioperi/dettaglio-sciopero/358566,false,2024-11-12,2024-11-12,2024-11-12,2024-11-12
12-11-2024,Trasporto aereo,ENAV,"Filt Cgil, Uiltrasporti",BARI,dalle ore 13.00 alle ore 17.00,https://www.cgsse.it/calendario-scioperi/dettaglio-sciopero/358563,true,2024-11-12,2024-11-12,2024-11-12,2024-11-12
12-11-2024,Trasporto aereo,ENAV,"Filt Cgil, Uiltrasporti",PESCARA,dalle ore 13.00 alle ore 17.00,https://www.cgsse.it/calendario-scioperi/dettaglio-sciopero/358560,false,2024-11-12,2024-11-12,2024-11-12,2024-11-12
12-11-2024,Trasporto aereo,ENAV,"Filt Cgil, Uiltrasporti",ANCONA,dalle ore 13.00 alle ore 17.00,https://www.cgsse.it/calendario-scioperi/dettaglio-sciopero/358557,true,2024-11-12,2024-11-12,2024-11-12,2024-11-12
12-11-2024,Trasporto aereo,ENAV,"Filt Cgil, Uiltrasporti",LAMPEDUSA E LINOSA,dalle ore 13.00 alle ore 17.00,https://www.cgsse.it/calendario-scioperi/dettaglio-sciopero/358554,false,2024-11-12,2024-11-12,2024-11-12,2024-11-12
01-10-2024,Trasporto aereo,"DUSSMANN SERVICE SRL, SPD",Adl,MILANO,dalle ore 00.00 alle ore 24.00,https://www.cgsse.it/calendario-scioperi/dettaglio-sciopero/358546,false,2024-10-01,2024-10-01,2024-10-01,2024-10-01
23-09-2024,Igiene ambientale,"EMC2, SAN GERMANO, SIRIO",Uiltrasporti,PARMA,intera giornata,https://www.cgsse.it/calendario-scioperi/dettaglio-sciopero/358543,false,2024-09-23,2024-09-23,2024-09-23,2024-09-23
Dal 23-09-2024 al 27-09-2024,Avvocati,SETTORE GIUSTIZIA,Camera Penale Di Vibo Valentia,VIBO VALENTIA,astensione dalle udienze e dalle attività giudiziarie nel settore penale degli avvocati,https://www.cgsse.it/calendario-scioperi/dettaglio-sciopero/358539,false,2024-09-23,2024-09-27,2024-09-23,
23-09-2024,Pulizie e multiservizi,"MIORELLI SERVICE, VALES",Usb Lavoro Privato,TRENTO,intera giornata,https://www.cgsse.it/calendario-scioperi/dettaglio-sciopero/358537,true,2024-09-23,2024-09-23,2024-09-23,2024-09-23
20-09-2024,Trasporto pubblico locale,AMTS CATANIA,Cub Trasporti,CATANIA,dalle ore 10.00 alle ore 14.00,https://www.cgsse.it/calendario-scioperi/dettaglio-sciopero/358533,true,2024-09-20,2024-09-20,2024-09-20,2024-09-20
24-09-2024,Regioni e autonomie Locali,OSA COOPERATIVA SOCIALE,Usb Lavoro Privato,LATINA,intera giornata,https://www.cgsse.it/calendario-scioperi/dettaglio-sciopero/358527,false,2024-09-24,2024-09-24,2024-09-24,2024-09-24
24-09-2024,Trasporto aereo,AIRPORT GLOBAL SERVICES,Flai Trasporti E Servizi,VARESE,intera giornata,https://www.cgsse.it/calendario-scioperi/dettaglio-sciopero/358525,false,2024-09-24,2024-09-24,2024-09-24,2024-09-24
17-10-2024,Igiene ambientale,TEKRA,Ugl,SIRACUSA,intera giornata,https://www.cgsse.it/calendario-scioperi/dettaglio-sciopero/358512,true,2024-10-17,2024-10-17,2024-10-17,2024-10-17
Dal 26-09-2024 al 27-09-2024,Sanità privata,INNOTEC,Cse Fulscam,BARI,intere giornate o turni di lavoro,https://www.cgsse.it/calendario-scioperi/dettaglio-sciopero/358507,true,2024-09-26,2024-09-27,2024-09-26,
24-09-2024,Trasporto aereo,WIZZ AIR MALTA LTD,Filt Cgil,NAZIONALE,dalle ore 00.00 alle ore 24.00,https://www.cgsse.it/calendario-scioperi/dettaglio-sciopero/358503,false,2024-09-24,2024-09-24,2024-09-24,2024-09-24
24-09-2024,Trasporto aereo,AIRPORT GLOBAL SERVICES,"Filt Cgil, Fit Cisl, Uiltrasporti, Ugl Ta",NAZIONALE,dalle ore 00.01 alle ore 23.59,https://www.cgsse.it/calendario-scioperi/dettaglio-sciopero/358498,false,2024-09-24,2024-09-24,2024-09-24,2024-09-24
18-11-2024,Ministeri,MINISTERO DELLA GIUSTIZIA,Confintesa,NAZIONALE,intera giornata,https://www.cgsse.it/calendario-scioperi/dettaglio-sciopero/358483,true,2024-11-18,2024-11-18,2024-11-18,2024-11-18
23-09-2024,Taxi,SERVIZIO TAXI,"Uiltrasporti, Ascom Taxi, Confartigianato Taxi, Cna Fita, Unica Taxi Cgil, Uritaxi",BOLOGNA,dalle ore 08.00 alle ore 22.00,https://www.cgsse.it/calendario-scioperi/dettaglio-sciopero/358476,false,2024-09-23,2024-09-23,2024-09-23,2024-09-23
30-09-2024,Appalti ferroviari,VUOLO GROUP,Salpas Orsa,ROMA,astensione del turno intero (8 ore) per ogni turno/modulo di lavoro,https://www.cgsse.it/calendario-scioperi/dettaglio-sciopero/358469,false,2024-09-30,2024-09-30,2024-09-30,2024-09-30
11-10-2024,Sanità privata,AZIENDE PUBBLICHE E PRIVATE DEL SETTORE SANITARIO-SOCIO SANITARIO-SOCIO ASSISTENZIALE,"Proclamante:Cub Sanità
Aderente:Cobas Lavoro Privato, Fisi",NAZIONALE,intera giornata per ogni turno di lavoro,https://www.cgsse.it/calendario-scioperi/dettaglio-sciopero/358463,false,2024-10-11,2024-10-11,2024-10-11,2024-10-11
19-09-2024,Regioni e autonomie Locali,OSA COOPERATIVA SOCIALE,Usb Lavoro Privato,LATINA,8 ore per ogni turno di lavoro,https://www.cgsse.it/calendario-scioperi/dettaglio-sciopero/358458,true,2024-09-19,2024-09-19,2024-09-19,2024-09-19
24-09-2024,Trasporto aereo,GEASAR,Ugl Ta,OLBIA,"dalle 00,01 alle 23,59",https://www.cgsse.it/calendario-scioperi/dettaglio-sciopero/358451,false,2024-09-24,2024-09-24,2024-09-24,2024-09-24
23-09-2024,Pulizie e multiservizi,"BARBATO ITALIA, M.S. SERVIZI, MERANESE SERVIZI",Usb Lavoro Privato,"NAPOLI, CASTELLAMMARE DI STABIA",intera giornata,https://www.cgsse.it/calendario-scioperi/dettaglio-sciopero/358449,false,2024-09-23,2024-09-23,2024-09-23,2024-09-23
20-09-2024,Ministeri,OPERA LABORATORI FIORENTINI,Cobas Lavoro Privato,POMPEI,intero turno,https://www.cgsse.it/calendario-scioperi/dettaglio-sciopero/358412,true,2024-09-20,2024-09-20,2024-09-20,2024-09-20
05-10-2024,Trasporto pubblico locale,SETA,Orsa,"MODENA, PIACENZA, REGGIO NELL'EMILIA",intera giornata con il rispetto delle fasce di garanzia,https://www.cgsse.it/calendario-scioperi/dettaglio-sciopero/358405,false,2024-10-05,2024-10-05,2024-10-05,2024-10-05
Dal 12-10-2024 al 13-10-2024,Plurisettoriale nazionale,AZIENDE CHE SVOLGONO ATTIVITA FERROVIARIA,"Proclamante:Cub Trasporti, Sgb
Aderente:Assemblea Nazionale Pdm/pdb, Usb Lavoro Privato",NAZIONALE,dalle ore 21:00 del 12/10 alle ore 20:59 del 13/10,https://www.cgsse.it/calendario-scioperi/dettaglio-sciopero/358402,false,2024-10-12,2024-10-13,2024-10-12,
11-10-2024,Trasporto aereo,ENAV,"Filt Cgil, Uiltrasporti",PALERMO,dalle ore 13.00 alle ore 17.00,https://www.cgsse.it/calendario-scioperi/dettaglio-sciopero/358399,false,2024-10-11,2024-10-11,2024-10-11,2024-10-11
Dal 19-09-2024 al 20-09-2024,Sanità privata,INNOTEC,Cse Fulscam,BARI,intere giornate o turni di lavoro,https://www.cgsse.it/calendario-scioperi/dettaglio-sciopero/358396,true,2024-09-19,2024-09-20,2024-09-19,
23-09-2024,Igiene ambientale,ECOFAP,Filcams Cgil,BIANCO,intera giornata,https://www.cgsse.it/calendario-scioperi/dettaglio-sciopero/358392,false,2024-09-23,2024-09-23,2024-09-23,2024-09-23
09-10-2024,Trasporto ferroviario,RFI,Assemblea Nazionale Lavoratori Manutenzione Rfi,NAZIONALE,intera prestazione di lavoro,https://www.cgsse.it/calendario-scioperi/dettaglio-sciopero/358390,false,2024-10-09,2024-10-09,2024-10-09,2024-10-09
09-10-2024,Trasporto ferroviario,RFI,"Cobas Lavoro Privato, Coordinamento Ferrovieri",NAZIONALE,intera prestazione di lavoro,https://www.cgsse.it/calendario-scioperi/dettaglio-sciopero/358388,false,2024-10-09,2024-10-09,2024-10-09,2024-10-09
20-09-2024,Ministeri,DIRETTORI DEL MINISTERO DELLA GIUSTIZIA,Coordinamento Nazionale Direttori Giustizia,NAZIONALE,intera giornata,https://www.cgsse.it/calendario-scioperi/dettaglio-sciopero/358385,false,2024-09-20,2024-09-20,2024-09-20,2024-09-20
20-09-2024,Appalti ferroviari,DUSSMANN SERVICE SRL,"Filt Cgil, Fit Cisl, Uiltrasporti, Ugl Ferrovieri, Salpas Orsa, Slm Fast Confsal",ROMA,sciopero di mezzo turno di lavoro per ogni turno di lavoro,https://www.cgsse.it/calendario-scioperi/dettaglio-sciopero/358383,false,2024-09-20,2024-09-20,2024-09-20,2024-09-20
24-09-2024,Trasporto aereo,AIRPORT GLOBAL SERVICES,"Filt Cgil, Fit Cisl, Uiltrasporti, Ugl Ta",VARESE,intera giornata,https://www.cgsse.it/calendario-scioperi/dettaglio-sciopero/358370,true,2024-09-24,2024-09-24,2024-09-24,2024-09-24
18-10-2024,Trasporto pubblico locale,AZIENDE TRASPORTO PUBBLICO LOCALE,Al Cobas,NAZIONALE,intera giornata con articolazione oraria a livello territoriale è esclusa dallo sciopero la regione emilia romagna e l'azienda atm di trapani],https://www.cgsse.it/calendario-scioperi/dettaglio-sciopero/358364,false,2024-10-18,2024-10-18,2024-10-18,2024-10-18
30-09-2024,Trasporto pubblico locale,TPL LINEA,"Proclamante:Filt Cgil, Fit Cisl, Uiltrasporti, Faisa Cisal, Ugl Fna, Rsu
Aderente:Sial Cobas",SAVONA,"da inizio turno alle ore 05:00, dalle ore 08:30 alle ore 17:30 e dalle ore 20:00 a fine turno.",https://www.cgsse.it/calendario-scioperi/dettaglio-sciopero/358360,false,2024-09-30,2024-09-30,2024-09-30,2024-09-30
20-09-2024,Trasporto pubblico locale,SETA,Usb Lavoro Privato,"MODENA, PIACENZA, REGGIO NELL'EMILIA",sciopero di 24 ore nel rispetto delle fasce di garanzia con modalità diversa per ogni bacino in merito agli accordi aziendali,https://www.cgsse.it/calendario-scioperi/dettaglio-sciopero/358352,false,2024-09-20,2024-09-20,2024-09-20,2024-09-20
25-10-2024,Ministeri,MINISTERO DELLA GIUSTIZIA,Confintesa,NAZIONALE,intera giornata,https://www.cgsse.it/calendario-scioperi/dettaglio-sciopero/358350,true,2024-10-25,2024-10-25,2024-10-25,2024-10-25
20-09-2024,Trasporto pubblico locale,BUSITALIA SITA NORD,Usb Lavoro Privato,UMBRIA,"perugia, spoleto fasce garantite dalle ore 06:00 alle 09:00 e dalle 12:00 alle 15:00. terni dalle ore 06:30 alle 09:30 e dalle 12:30 alle 15:30. servizi ferroviari fasce garantite dalle ore 05.45 alle 08.45 e dalle 11,45 alle 14.45",https://www.cgsse.it/calendario-scioperi/dettaglio-sciopero/358346,false,2024-09-20,2024-09-20,2024-09-20,2024-09-20
17-09-2024,Igiene ambientale,TEKRA,Ugl,SIRACUSA,intera giornata,https://www.cgsse.it/calendario-scioperi/dettaglio-sciopero/358341,true,2024-09-17,2024-09-17,2024-09-17,2024-09-17
12-11-2024,Trasporto aereo,ENAV,"Filt Cgil, Uiltrasporti",ROMA,dalle ore 13:00 alle ore 17:00,https://www.cgsse.it/calendario-scioperi/dettaglio-sciopero/358331,true,2024-11-12,2024-11-12,2024-11-12,2024-11-12
11-10-2024,Trasporto aereo,TECHNO SKY,"Filt Cgil, Uiltrasporti, Rsu Techno Sky",MILANO,personale h35 dalle ore 13.00 alle ore 17.00; personale h36 ultime 4 ore di lavoro,https://www.cgsse.it/calendario-scioperi/dettaglio-sciopero/358301,false,2024-10-11,2024-10-11,2024-10-11,2024-10-11
09-10-2024,Trasporto merci su rotaia,"DB CARGO ITALIA, SBB CARGO ITALIA","Filt Cgil, Fit Cisl, Uiltrasporti",LOMBARDIA,dalle ore 9.01 alle ore 17.00,https://www.cgsse.it/calendario-scioperi/dettaglio-sciopero/358267,true,2024-10-09,2024-10-09,2024-10-09,2024-10-09
Dal 30-09-2024 al 04-10-2024,Trasporto merci su gomma,AZIENDE DEL SETTORE AUTOTRASPORTO MERCI,Comitato Trasporto Siciliano,SICILIA,dalle ore 00.01 del 30/09 alle ore 24.00 del 4/10,https://www.cgsse.it/calendario-scioperi/dettaglio-sciopero/358261,true,2024-09-30,2024-10-04,2024-09-30,
16-09-2024,Igiene ambientale,GEOFOR,Usb Lavoro Privato,PISA,intera giornata,https://www.cgsse.it/calendario-scioperi/dettaglio-sciopero/358234,false,2024-09-16,2024-09-16,2024-09-16,2024-09-16
11-10-2024,Trasporto aereo,TECHNO SKY,"Filt Cgil, Uiltrasporti",NAZIONALE,personale h35 dalle ore 13.00 alle ore 17.00; personale h36 ultime 4 ore di lavoro,https://www.cgsse.it/calendario-scioperi/dettaglio-sciopero/358232,false,2024-10-11,2024-10-11,2024-10-11,2024-10-11
15-10-2024,Trasporto pubblico locale,ATM TRAPANI,"Filt Cgil, Fit Cisl, Faisa Cisal, Ugl",TRAPANI,dalle ore 12.00 alle ore 16.00,https://www.cgsse.it/calendario-scioperi/dettaglio-sciopero/358229,false,2024-10-15,2024-10-15,2024-10-15,2024-10-15
24-09-2024,Trasporto aereo,ADB,"Filt Cgil, Fit Cisl, Uiltrasporti, Ugl Ta",BOLOGNA,dalle ore 12.00 alle ore 16.00,https://www.cgsse.it/calendario-scioperi/dettaglio-sciopero/358222,false,2024-09-24,2024-09-24,2024-09-24,2024-09-24
11-10-2024,Regioni e autonomie Locali,AZIENDE PUBBLICHE E PRIVATE DEL SETTORE SANITARIO-SOCIO SANITARIO-SOCIO ASSISTENZIALE,"Proclamante:Cub Sanità
Aderente:Cobas Lavoro Privato, Fisi",NAZIONALE,intera giornata per ogni turno di lavoro,https://www.cgsse.it/calendario-scioperi/dettaglio-sciopero/358207,false,2024-10-11,2024-10-11,2024-10-11,2024-10-11
11-10-2024,Servizio sanitario nazionale,AZIENDE PUBBLICHE E PRIVATE DEL SETTORE SANITARIO-SOCIO SANITARIO-SOCIO ASSISTENZIALE,"Proclamante:Cub Sanità
Aderente:Cobas Lavoro Privato, Fisi",NAZIONALE,intera giornata per ogni turno di lavoro,https://www.cgsse.it/calendario-scioperi/dettaglio-sciopero/358190,false,2024-10-11,2024-10-11,2024-10-11,2024-10-11
24-09-2024,Trasporto aereo,AGS HANDLING,Cub Trasporti,BERGAMO,dalle ore 00.00 alle ore 23.59,https://www.cgsse.it/calendario-scioperi/dettaglio-sciopero/358186,false,2024-09-24,2024-09-24,2024-09-24,2024-09-24
13-09-2024,Igiene ambientale,CZETA,Filas,SAN CIPRIANO D'AVERSA,da inizio turno di lavoro,https://www.cgsse.it/calendario-scioperi/dettaglio-sciopero/358184,false,2024-09-13,2024-09-13,2024-09-13,2024-09-13
16-09-2024,Igiene ambientale,IGM RIFIUTI INDUSTRIALI SRL,Fiadel Csa,MODICA,intera giornata,https://www.cgsse.it/calendario-scioperi/dettaglio-sciopero/358163,false,2024-09-16,2024-09-16,2024-09-16,2024-09-16
12-09-2024,Servizio sanitario nazionale,FONDAZIONE SANTA LUCIA,Ugl Salute,ROMA,intera giornata / turno di lavoro,https://www.cgsse.it/calendario-scioperi/dettaglio-sciopero/358114,true,2024-09-12,2024-09-12,2024-09-12,2024-09-12
20-09-2024,Pulizie e multiservizi,"CONSORZIO NAZIONALE COOPERATIVE PLURISERVIZI, CONSORZIO STABILE EURO GLOBAL SERVICE, COOPERATIVA PORTABAGAGLI PLURISERVIZI, PULITORI E AFFINI","Usb Lavoro Privato, Faisa Cisal",NAPOLI,intera giornata,https://www.cgsse.it/calendario-scioperi/dettaglio-sciopero/358107,false,2024-09-20,2024-09-20,2024-09-20,2024-09-20
20-09-2024,Trasporto pubblico locale,ATAC,"Usb Lavoro Privato, Orsa Tpl",ROMA,dalle ore 08:30 alle ore 12:30,https://www.cgsse.it/calendario-scioperi/dettaglio-sciopero/358103,false,2024-09-20,2024-09-20,2024-09-20,2024-09-20
05-09-2024,Trasporto pubblico locale,AZIENDE TRASPORTO PUBBLICO LOCALE,"Filt Cgil, Fit Cisl, Uiltrasporti, Faisa Cisal",TOSCANA,4 ore con modalità aziendali,https://www.cgsse.it/calendario-scioperi/dettaglio-sciopero/358094,false,2024-09-05,2024-09-05,2024-09-05,2024-09-05
Dal 16-09-2024 al 20-09-2024,Avvocati,SETTORE GIUSTIZIA,Camera Penale Di Cosenza,COSENZA,astensione dalle udienze e dalle attività giudiziarie nel settore penale degli avvocati,https://www.cgsse.it/calendario-scioperi/dettaglio-sciopero/358085,false,2024-09-16,2024-09-20,2024-09-16,
24-09-2024,Trasporto aereo,AVIAPARTNER HANDLING,Cub Trasporti,"MILANO, VARESE",dalle ore 00.00 alle 23.59,https://www.cgsse.it/calendario-scioperi/dettaglio-sciopero/358079,false,2024-09-24,2024-09-24,2024-09-24,2024-09-24
19-09-2024,Circolazione e sicurezza stradale,CAS - CONSORZIO AUTOSTRADE SICILIANE,Orsa,SICILIA,"dalle ore 10.00 alle ore 14.00 degli agenti tecnici esattori nelle tratte a18 (messina-catania, siracusa-gela) e a20 (messina-palermo)",https://www.cgsse.it/calendario-scioperi/dettaglio-sciopero/358077,false,2024-09-19,2024-09-19,2024-09-19,2024-09-19
22-09-2024,Regioni e autonomie Locali,COMUNE DI UDINE,Uil Fpl,UDINE,intera giornata del personale della polizia locale,https://www.cgsse.it/calendario-scioperi/dettaglio-sciopero/358074,false,2024-09-22,2024-09-22,2024-09-22,2024-09-22
22-09-2024,Regioni e autonomie Locali,COMUNE DI UDINE,"Fp Cgil, Fp Cisl, Cisal",UDINE,intera giornata di tutto il personale della polizia locale,https://www.cgsse.it/calendario-scioperi/dettaglio-sciopero/358070,false,2024-09-22,2024-09-22,2024-09-22,2024-09-22
12-09-2024,Servizio sanitario nazionale,FONDAZIONE SANTA LUCIA,"Adonp, Cida",ROMA,intero turno di lavoro,https://www.cgsse.it/calendario-scioperi/dettaglio-sciopero/358066,true,2024-09-12,2024-09-12,2024-09-12,2024-09-12
12-09-2024,Servizio sanitario nazionale,FONDAZIONE SANTA LUCIA,Cimop,ROMA,intero turno di lavoro,https://www.cgsse.it/calendario-scioperi/dettaglio-sciopero/358059,true,2024-09-12,2024-09-12,2024-09-12,2024-09-12
20-09-2024,Sanità privata,I.R.C.C.S. HUMANITAS,Cimop,ROZZANO,intera giornata,https://www.cgsse.it/calendario-scioperi/dettaglio-sciopero/358052,false,2024-09-20,2024-09-20,2024-09-20,2024-09-20
12-09-2024,Servizio sanitario nazionale,FONDAZIONE SANTA LUCIA,"Fp Cgil, Cisl Fp, Uil Fpl",ROMA,intero turno di lavoro,https://www.cgsse.it/calendario-scioperi/dettaglio-sciopero/358050,true,2024-09-12,2024-09-12,2024-09-12,2024-09-12
09-09-2024,Trasporto pubblico locale,APT SPA,Ugl,GORIZIA,dalle ore 16.00 alle ore 23.59,https://www.cgsse.it/calendario-scioperi/dettaglio-sciopero/358043,false,2024-09-09,2024-09-09,2024-09-09,2024-09-09
27-09-2024,Appalti ferroviari,L'OPEROSA,"Filt Cgil, Fit Cisl, Uiltrasporti, Fast Confsal",PIEMONTE,sciopero di mezzo turno alla fine della prestazione lavorativa,https://www.cgsse.it/calendario-scioperi/dettaglio-sciopero/358028,false,2024-09-27,2024-09-27,2024-09-27,2024-09-27
09-09-2024,Trasporto pubblico locale,FERROVIE DEL SUD EST E SERVIZI AUTOMOBILISTICI,"Filt Cgil, Fit Cisl, Faisa Cisal",LECCE,dalle ore 19.30 alle ore 23:30,https://www.cgsse.it/calendario-scioperi/dettaglio-sciopero/358023,false,2024-09-09,2024-09-09,2024-09-09,2024-09-09
20-09-2024,Igiene ambientale,RIECAM,Usb Lavoro Privato,TARQUINIA,intero turno di lavoro,https://www.cgsse.it/calendario-scioperi/dettaglio-sciopero/358014,false,2024-09-20,2024-09-20,2024-09-20,2024-09-20
08-09-2024,Regioni e autonomie Locali,COMUNE DI PAVIA,"Cisl Fp, Uil Fpl",PAVIA,intera giornata lavorativa del corpo di polizia locale,https://www.cgsse.it/calendario-scioperi/dettaglio-sciopero/358012,true,2024-09-08,2024-09-08,2024-09-08,2024-09-08
07-09-2024,Trasporto aereo,ENAV,"Filt Cgil, Uiltrasporti",NAZIONALE,dalle ore 13:00 alle ore 17:00,https://www.cgsse.it/calendario-scioperi/dettaglio-sciopero/357939,true,2024-09-07,2024-09-07,2024-09-07,2024-09-07
20-09-2024,Regioni e autonomie Locali,ROMA CAPITALE SERVIZI EDUCATIVI E SCOLASTICI,"Cobas P.I., Usb Pi",ROMA,lo sciopero comporterà l'astensione per l'intera durata da tutti i turni di lavoro,https://www.cgsse.it/calendario-scioperi/dettaglio-sciopero/357915,false,2024-09-20,2024-09-20,2024-09-20,2024-09-20
09-09-2024,Regioni e autonomie Locali,PAOLO SCOPPIO AUTOLINEE,Faisa Cisal,ROMA,dalle ore 08.30 alle ore 16.30,https://www.cgsse.it/calendario-scioperi/dettaglio-sciopero/357912,false,2024-09-09,2024-09-09,2024-09-09,2024-09-09
09-09-2024,Regioni e autonomie Locali,SABATO VIAGGI,Faisa Cisal,ROMA,dalle ore 08.30 alle ore 16.30,https://www.cgsse.it/calendario-scioperi/dettaglio-sciopero/357910,false,2024-09-09,2024-09-09,2024-09-09,2024-09-09
24-09-2024,Trasporto aereo,EASYJET AIRLINE LIMITED,Uiltrasporti,NAZIONALE,dalle ore 13.00 alle ore 17.00,https://www.cgsse.it/calendario-scioperi/dettaglio-sciopero/357908,true,2024-09-24,2024-09-24,2024-09-24,2024-09-24
09-09-2024,Trasporto pubblico locale,AUTOSERVIZI ZANI EVARISTO,"Filt Cgil, Fit Cisl, Uiltrasporti, Faisa Cisal",VIMERCATE,dalle ore 08.45 alle ore 12.45,https://www.cgsse.it/calendario-scioperi/dettaglio-sciopero/357906,false,2024-09-09,2024-09-09,2024-09-09,2024-09-09
10-09-2024,Ministeri,DIRETTORI DEL MINISTERO DELLA GIUSTIZIA,Coordinamento Nazionale Direttori Giustizia,NAZIONALE,intera giornata,https://www.cgsse.it/calendario-scioperi/dettaglio-sciopero/357901,true,2024-09-10,2024-09-10,2024-09-10,2024-09-10
06-09-2024,Servizio sanitario nazionale,"AT SERVIZI, AUTHENTICA",Fisascat Cisl,MILANO,intero turno di lavoro,https://www.cgsse.it/calendario-scioperi/dettaglio-sciopero/357899,false,2024-09-06,2024-09-06,2024-09-06,2024-09-06
06-09-2024,Servizio sanitario nazionale,"AUTHENTICA, PORTERAGE",Fisascat Cisl,MILANO,intero turno di lavoro,https://www.cgsse.it/calendario-scioperi/dettaglio-sciopero/357894,false,2024-09-06,2024-09-06,2024-09-06,2024-09-06
09-09-2024,Trasporto pubblico locale,COTRAL,Faisa Cisal,LAZIO,dalle ore 08.30 alle ore 16.30,https://www.cgsse.it/calendario-scioperi/dettaglio-sciopero/357892,false,2024-09-09,2024-09-09,2024-09-09,2024-09-09
20-09-2024,Trasporto pubblico locale,EAV,Usb Lavoro Privato,NAPOLI,intera giornata con rispetto delle fasce di garanzia,https://www.cgsse.it/calendario-scioperi/dettaglio-sciopero/357884,false,2024-09-20,2024-09-20,2024-09-20,2024-09-20
03-09-2024,Regioni e autonomie Locali,BMS,"Filcams Cgil, Fisascat Cisl, Uitrasporti",BRINDISI,intera giornata,https://www.cgsse.it/calendario-scioperi/dettaglio-sciopero/357880,false,2024-09-03,2024-09-03,2024-09-03,2024-09-03
28-08-2024,Trasporto pubblico locale,START ROMAGNA,"Fit Cisl, Uiltrasporti, Ugl Autoferro, Faisa Cisal, Usb, Filt Cgil",RAVENNA,intera giornata con rispetto delle fasce di garanzia,https://www.cgsse.it/calendario-scioperi/dettaglio-sciopero/357868,false,2024-08-28,2024-08-28,2024-08-28,2024-08-28
07-09-2024,Trasporto aereo,MODITECH,"Fiom Cgil, Uilm Uil",ROMA,dalle ore 13.00 alle ore 17.00,https://www.cgsse.it/calendario-scioperi/dettaglio-sciopero/357856,false,2024-09-07,2024-09-07,2024-09-07,2024-09-07
03-09-2024,Pulizie e multiservizi,BMS,"Filcams Cgil, Fisascat Cisl, Uitrasporti",BRINDISI,intera giornata,https://www.cgsse.it/calendario-scioperi/dettaglio-sciopero/357836,false,2024-09-03,2024-09-03,2024-09-03,2024-09-03
24-09-2024,Trasporto aereo,AIRPORT HANDLING,Cub Trasporti,NAZIONALE,dalle ore 00.00 alle ore 23.59,https://www.cgsse.it/calendario-scioperi/dettaglio-sciopero/357824,false,2024-09-24,2024-09-24,2024-09-24,2024-09-24
24-09-2024,Trasporto aereo,SEA,Cub Trasporti,NAZIONALE,dalle ore 00.00 alle ore 23.59,https://www.cgsse.it/calendario-scioperi/dettaglio-sciopero/357822,false,2024-09-24,2024-09-24,2024-09-24,2024-09-24
Dal 19-09-2024 al 20-09-2024,Trasporto ferroviario,RFI,Ugl Ferrovieri,BOLOGNA,dalle ore 21.59 del 19/09 alle ore 21.59 del 20/09,https://www.cgsse.it/calendario-scioperi/dettaglio-sciopero/357814,false,2024-09-19,2024-09-20,2024-09-19,
08-09-2024,Regioni e autonomie Locali,COMUNE DI SESTO FIORENTINO,Csa,SESTO FIORENTINO,intera giornata o turno di lavoro del corpo della polizia municipale,https://www.cgsse.it/calendario-scioperi/dettaglio-sciopero/357798,false,2024-09-08,2024-09-08,2024-09-08,2024-09-08
02-09-2024,Servizio sanitario nazionale,NUOVA ITALPOL,Uiltucs,"LUCERA, FOGGIA",intera giornata,https://www.cgsse.it/calendario-scioperi/dettaglio-sciopero/357796,false,2024-09-02,2024-09-02,2024-09-02,2024-09-02
07-09-2024,Trasporto aereo,TAH,Usb Lavoro Privato,"FIRENZE, PISA",dalle ore 13:00 alle ore 17:00,https://www.cgsse.it/calendario-scioperi/dettaglio-sciopero/357794,false,2024-09-07,2024-09-07,2024-09-07,2024-09-07
02-09-2024,Sanità privata,FONDAZIONE DANELLI,Fi-si,LODI,intera giornata,https://www.cgsse.it/calendario-scioperi/dettaglio-sciopero/357791,false,2024-09-02,2024-09-02,2024-09-02,2024-09-02
24-09-2024,Trasporto ferroviario,MERCITALIA RAIL,"Filt Cgil, Fit Cisl, Uiltrasporti, Orsa",EMILIA ROMAGNA,dalle ore 00:00 alle ore 23:59,https://www.cgsse.it/calendario-scioperi/dettaglio-sciopero/357783,false,2024-09-24,2024-09-24,2024-09-24,2024-09-24
23-09-2024,Sanità privata,AZIENDE DELLA SANITÀ PRIVATA ASSOCIATE AIOP ED ARIS,Ugl Sanita,NAZIONALE,intera giornata per ogni turno di lavoro,https://www.cgsse.it/calendario-scioperi/dettaglio-sciopero/357766,false,2024-09-23,2024-09-23,2024-09-23,2024-09-23
16-09-2024,Sanità privata,UNEBA,Ugl Salute,NAZIONALE,intera giornata o turno di lavoro,https://www.cgsse.it/calendario-scioperi/dettaglio-sciopero/357764,false,2024-09-16,2024-09-16,2024-09-16,2024-09-16
07-09-2024,Trasporto aereo,CONSULTA,Usb Lavoro Privato,"FIRENZE, PISA",dalle ore 13:00 alle ore 17:00,https://www.cgsse.it/calendario-scioperi/dettaglio-sciopero/357746,false,2024-09-07,2024-09-07,2024-09-07,2024-09-07
09-09-2024,Trasporto pubblico locale,ACTV,"Filt Cgil, Fit Cisl, Uilt Uil, Ugl, Faisa Cisal",VENEZIA,dalle ore 10.00 alle ore 16.00,https://www.cgsse.it/calendario-scioperi/dettaglio-sciopero/357718,false,2024-09-09,2024-09-09,2024-09-09,2024-09-09
20-09-2024,Trasporto pubblico locale,KYMA MOBILITA,Ugl,TARANTO,dalle ore 20:00 alle ore 24:00,https://www.cgsse.it/calendario-scioperi/dettaglio-sciopero/357673,false,2024-09-20,2024-09-20,2024-09-20,2024-09-20
07-09-2024,Trasporto aereo,GEASAR,Ugl Ta,OLBIA,dalle ore 13:00 alle ore 17:00,https://www.cgsse.it/calendario-scioperi/dettaglio-sciopero/357667,false,2024-09-07,2024-09-07,2024-09-07,2024-09-07
16-08-2024,Sanità privata,FONDAZIONE DANELLI,Fisi,LODI,intera giornata,https://www.cgsse.it/calendario-scioperi/dettaglio-sciopero/357646,true,2024-08-16,2024-08-16,2024-08-16,2024-08-16
Dal 16-09-2024 al 17-09-2024,Circolazione e sicurezza stradale,GSA GRUPPO SERVIZI ASSOCIATI,Sgb,"BOLOGNA , FIRENZE",dalle ore 08.00 del 16/09 alle ore 08.00 del 17/09,https://www.cgsse.it/calendario-scioperi/dettaglio-sciopero/357585,false,2024-09-16,2024-09-17,2024-09-16,
16-09-2024,Igiene ambientale,DM TECHNOLOGY,Ugl,ROCCA DI PAPA,intera giornata,https://www.cgsse.it/calendario-scioperi/dettaglio-sciopero/357572,false,2024-09-16,2024-09-16,2024-09-16,2024-09-16
Dal 08-09-2024 al 09-09-2024,Trasporto ferroviario,"GRUPPO FSI, MERCITALIA RAIL, TRENITALIA, TRENITALIA TPER SCARL",Assemblea Nazionale Pdm/pdb,NAZIONALE,dalle ore 03.00 del 08/09 alle ore 02.00 del 09/09,https://www.cgsse.it/calendario-scioperi/dettaglio-sciopero/357562,false,2024-09-08,2024-09-09,2024-09-08,
31-10-2024,Plurisettoriale nazionale,PUBBLICO IMPIEGO,"Proclamante:Usb Pubblico Impiego
Aderente:Fi-si",NAZIONALE,"sciopero del pubblico impiego, della scuola e dei vvf, escluso funzioni locali limitatamente ai servizi cimiteriali e ai servizi di polizia municipale e ai vigili del fuoco limitatamente al personale operante presso le sedi aeroportuali",https://www.cgsse.it/calendario-scioperi/dettaglio-sciopero/357550,false,2024-10-31,2024-10-31,2024-10-31,2024-10-31
Dal 02-09-2024 al 03-09-2024,Servizio sanitario nazionale,"A.O.U., USL",Fials,MODENA,dalle ore 07:00 del 02/09 alle ore 07:00 del 03/09,https://www.cgsse.it/calendario-scioperi/dettaglio-sciopero/357547,false,2024-09-02,2024-09-03,2024-09-02,
23-09-2024,Radio e TV,GRUPPO RAI,"Slc Cgil, Fistel Cisl, Uilcom Uil, Fnc Ugl, Snater",NAZIONALE,intero turno di lavoro esclusa la regione sardegna,https://www.cgsse.it/calendario-scioperi/dettaglio-sciopero/357488,false,2024-09-23,2024-09-23,2024-09-23,2024-09-23
07-09-2024,Trasporto aereo,AIRPORT GLOBAL SERVICES,Flai Trasporti E Servizi,VARESE,dalle ore 13.00 alle ore 17.00,https://www.cgsse.it/calendario-scioperi/dettaglio-sciopero/357479,false,2024-09-07,2024-09-07,2024-09-07,2024-09-07
09-09-2024,Trasporto pubblico locale,START,"Filt Cgil, Fit Cisl, Uiltrasporti, Usb",ASCOLI PICENO,dalle ore 11.30 alle ore 15.30,https://www.cgsse.it/calendario-scioperi/dettaglio-sciopero/357463,false,2024-09-09,2024-09-09,2024-09-09,2024-09-09
12-09-2024,Radio e TV,RAI,"Slc Cgil, Uilcom Uil, Fistel Cisl",SARDEGNA,intera giornata,https://www.cgsse.it/calendario-scioperi/dettaglio-sciopero/357454,false,2024-09-12,2024-09-12,2024-09-12,2024-09-12
27-08-2024,Consorzi di bonifica,CONSORZIO DI BONIFICA CENTRO SUD PUGLIA,Filbi Uil,"BARI , TARANTO , LECCE",intera giornata,https://www.cgsse.it/calendario-scioperi/dettaglio-sciopero/357440,false,2024-08-27,2024-08-27,2024-08-27,2024-08-27
27-09-2024,Trasporto pubblico locale,ARST,Fit Cisl,OLBIA,dalle ore 09.30 alle ore 13.29 e dalle ore 16.30 alle ore 20.29,https://www.cgsse.it/calendario-scioperi/dettaglio-sciopero/357438,true,2024-09-27,2024-09-27,2024-09-27,2024-09-27
Dal 10-08-2024 al 11-08-2024,Circolazione e sicurezza stradale,CONCESSIONI DEL TIRRENO,"Filt Cgil, Fit Cisl, Uiltrasporti, Sla Cisal","LUCCA, VIAREGGIO","lavoratori maep, esattori e assistenti all’esazione: dalle ore 06.00 del 10/08 alle ore 22.00 del 11/08",https://www.cgsse.it/calendario-scioperi/dettaglio-sciopero/357436,true,2024-08-10,2024-08-11,2024-08-10,
13-09-2024,Appalti ferroviari,GRUPPO SAM,"Filt Cgil, Ugl Ferrovieri",CAMPANIA,sciopero di mezzo turno per ogni prestazione lavorativa,https://www.cgsse.it/calendario-scioperi/dettaglio-sciopero/357409,true,2024-09-13,2024-09-13,2024-09-13,2024-09-13
01-08-2024,Igiene ambientale,DM TECHNOLOGY,Usb,SANT'AGATA DE' GOTI,intera giornata,https://www.cgsse.it/calendario-scioperi/dettaglio-sciopero/357400,true,2024-08-01,2024-08-01,2024-08-01,2024-08-01
09-08-2024,Consorzi di bonifica,CONSORZIO DI BONIFICA CENTRO SUD PUGLIA,Filbi Uil,"BARI , TARANTO , LECCE",intera giornata,https://www.cgsse.it/calendario-scioperi/dettaglio-sciopero/357398,true,2024-08-09,2024-08-09,2024-08-09,2024-08-09
07-09-2024,Trasporto aereo,AGS HANDLING,"Filt Cgil, Fit Cisl, Uiltrasporti, Ugl Ta",NAZIONALE,dalle ore 13.00 alle ore 17.00,https://www.cgsse.it/calendario-scioperi/dettaglio-sciopero/357396,false,2024-09-07,2024-09-07,2024-09-07,2024-09-07
07-09-2024,Trasporto aereo,AIRPORT GLOBAL SERVICES,"Filt Cgil, Fit Cisl, Uiltrasporti, Ugl Ta",VARESE,dalle ore 13.00 alle ore 17.00,https://www.cgsse.it/calendario-scioperi/dettaglio-sciopero/357387,false,2024-09-07,2024-09-07,2024-09-07,2024-09-07
09-09-2024,Università,CONSORZIO CINECA,"Filcams Cgil, Fisascat Cisl, Uiltucs",NAZIONALE,intero turno di lavoro,https://www.cgsse.it/calendario-scioperi/dettaglio-sciopero/357191,false,2024-09-09,2024-09-09,2024-09-09,2024-09-09
20-09-2024,Trasporto pubblico locale,AMAT,Cub Trasporti,PALERMO,dalle ore 08.30 alle ore 17.30 e dalle ore 20.30 a fine servizio,https://www.cgsse.it/calendario-scioperi/dettaglio-sciopero/357187,false,2024-09-20,2024-09-20,2024-09-20,2024-09-20
11-11-2024,Trasporto aereo,ENAV,"Filt Cgil, Uiltrasporti",NAZIONALE,dalle ore 13:00 alle ore 17:00,https://www.cgsse.it/calendario-scioperi/dettaglio-sciopero/357180,true,2024-11-11,2024-11-11,2024-11-11,2024-11-11
Dal 31-07-2024 al 03-08-2024,Telecomunicazioni,AZIENDE DEL SETTORE,"Slc Cgil, Fistel Cisl, Uilcom Uil",NAZIONALE,"8 ore di sciopero suddivise in 2 ore al giorno dal 31/07 al 03/08. l’astensione dal lavoro avverrà secondo la declinazione di seguito indicata: 31 luglio inizio turno, 1 agosto fine turno, 2 agosto inizio turno, 3 agosto fine turno.",https://www.cgsse.it/calendario-scioperi/dettaglio-sciopero/357167,true,2024-07-31,2024-08-03,2024-07-31,
09-08-2024,Pulizie e multiservizi,COOPSERVICE,"Filcams Cgil, Fisascat Cisl",ASCOLI PICENO,intero turno di lavoro,https://www.cgsse.it/calendario-scioperi/dettaglio-sciopero/357145,true,2024-08-09,2024-08-09,2024-08-09,2024-08-09
09-09-2024,Trasporto pubblico locale,AMTAB,"Uitrasporti, Cisas",BARI,4 ore,https://www.cgsse.it/calendario-scioperi/dettaglio-sciopero/357140,false,2024-09-09,2024-09-09,2024-09-09,2024-09-09
09-09-2024,Trasporto pubblico locale,EAV,"Filt Cgil, Fit Cisl, Uiltrasporti, Faisa Cisal, Ugl Fna",NAPOLI,dalle ore 09.00 alle ore 13.00 della dtf-divisione trasporto ferroviario],https://www.cgsse.it/calendario-scioperi/dettaglio-sciopero/357129,false,2024-09-09,2024-09-09,2024-09-09,2024-09-09
30-07-2024,Trasporto merci su rotaia,GTS RAIL,Ugl Ferrovieri,NAZIONALE,dalle ore 16.01 alle ore 23.59,https://www.cgsse.it/calendario-scioperi/dettaglio-sciopero/357062,false,2024-07-30,2024-07-30,2024-07-30,2024-07-30
30-07-2024,Trasporto merci su rotaia,GTS RAIL,Fast Confsal,NAZIONALE,dalle ore 16.01 alle ore 23.59,https://www.cgsse.it/calendario-scioperi/dettaglio-sciopero/357060,false,2024-07-30,2024-07-30,2024-07-30,2024-07-30
30-07-2024,Trasporto merci su rotaia,GTS RAIL,Filt Cgil,NAZIONALE,dalle ore 16.01 alle ore 23.59,https://www.cgsse.it/calendario-scioperi/dettaglio-sciopero/357058,false,2024-07-30,2024-07-30,2024-07-30,2024-07-30
26-07-2024,Trasporto ferroviario,TRENITALIA TPER,"Filt Cgil, Fit Cisl, Uiltrasporti, Orsa",BOLOGNA,dalle ore 11:00 alle ore 15:00,https://www.cgsse.it/calendario-scioperi/dettaglio-sciopero/357051,false,2024-07-26,2024-07-26,2024-07-26,2024-07-26
04-08-2024,Circolazione e sicurezza stradale,CONCESSIONI DEL TIRRENO,"Filt Cgil, Fit Cisl, Uiltrasporti, Sla Cisal","LUCCA, VIAREGGIO",lavoratori maep dalle ore 02.00 alle ore 22.00 esattori e assistenti all’esazione dalle ore 06.00 alle ore 22.00,https://www.cgsse.it/calendario-scioperi/dettaglio-sciopero/357046,true,2024-08-04,2024-08-04,2024-08-04,2024-08-04
09-09-2024,Trasporto merci su rotaia,DINAZZANO PO,"Filt Cgil, Fit Cisl, Uiltrasporti, Faisa Cisal, Ugl Autoferrotramvieri",EMILIA ROMAGNA,dalle ore 09.00 alle ore 13.00,https://www.cgsse.it/calendario-scioperi/dettaglio-sciopero/357040,false,2024-09-09,2024-09-09,2024-09-09,2024-09-09
20-09-2024,Trasporto pubblico locale,GRUPPO ATM,Al Cobas,"MILANO , MONZA E DELLA BRIANZA","gruppo atm personale viaggiante di superficie, metropolitana, agenti di stazione, serv. poma 08.45 -15.00 e 18,00-fine servizio, net - urbano monza: 09.00 -11.50 e 14.50-fine servizio, extraurbano trezzo 08.45-15.00 e 18.00-fine servizio",https://www.cgsse.it/calendario-scioperi/dettaglio-sciopero/357034,true,2024-09-20,2024-09-20,2024-09-20,2024-09-20
Dal 19-09-2024 al 20-09-2024,Trasporto ferroviario,RFI,"Filt Cgil, Fit Cisl, Uiltrasporti, Orsa",BOLOGNA,dalle ore 21.59 del 19/09 alle ore 21.59 del 20/09,https://www.cgsse.it/calendario-scioperi/dettaglio-sciopero/357024,false,2024-09-19,2024-09-20,2024-09-19,
02-08-2024,Servizio sanitario nazionale,"AUTHENTICA, PORTERAGE",Fisascat Cisl,MILANO,intero turno di lavoro,https://www.cgsse.it/calendario-scioperi/dettaglio-sciopero/357012,true,2024-08-02,2024-08-02,2024-08-02,2024-08-02
29-07-2024,Servizio sanitario nazionale,NEW CITTA' DI CATANIA,Usb Lavoro Privato,CATANIA,intera giornata,https://www.cgsse.it/calendario-scioperi/dettaglio-sciopero/357010,false,2024-07-29,2024-07-29,2024-07-29,2024-07-29
09-09-2024,Trasporto pubblico locale,AZIENDE TRASPORTO PUBBLICO LOCALE,"Filt Cgil, Fit Cisl, Uiltrasporti, Faisa Cisal, Ugl Fna",NAZIONALE,"sciopero di 8 ore con articolazione oraria a livello territoriale. sono escluse dallo sciopero le aziende gtt di torino, amat di palermo e fnm milano]",https://www.cgsse.it/calendario-scioperi/dettaglio-sciopero/356974,false,2024-09-09,2024-09-09,2024-09-09,2024-09-09
07-09-2024,Trasporto aereo,AGS HANDLING,"Filt Cgil, Fit Cisl, Uiltrasporti, Ugl Ta",NAZIONALE,dalle ore 13.00 alle ore 17.00,https://www.cgsse.it/calendario-scioperi/dettaglio-sciopero/356968,true,2024-09-07,2024-09-07,2024-09-07,2024-09-07
07-09-2024,Trasporto aereo,ENAV,"Filt Cgil, Uiltrasporti",NAZIONALE,dalle ore 13:00 alle ore 17:00,https://www.cgsse.it/calendario-scioperi/dettaglio-sciopero/356960,true,2024-09-07,2024-09-07,2024-09-07,2024-09-07
09-09-2024,Trasporto pubblico locale,GEST,Cobas Lavoro Privato,FIRENZE,"da inizio servizio alle ore 06.30, dalle ore 09.30 alle ore 17.00 e, dalle ore 20.00 a fine servizio",https://www.cgsse.it/calendario-scioperi/dettaglio-sciopero/356954,false,2024-09-09,2024-09-09,2024-09-09,2024-09-09
Dal 05-09-2024 al 06-09-2024,Trasporto ferroviario,MERCITALIA RAIL,Assemblea Nazionale Pdm/pdb,NAZIONALE,dalle ore 21:00 del 05/09 alle ore 21:00 del 06/09,https://www.cgsse.it/calendario-scioperi/dettaglio-sciopero/356951,true,2024-09-05,2024-09-06,2024-09-05,
Dal 08-09-2024 al 09-09-2024,Trasporto ferroviario,"GRUPPO FSI, TRENITALIA, TRENITALIA TPER SCARL",Assemblea Nazionale Pdm/pdb,NAZIONALE,dalle ore 03:00 del 08/09 alle ore 02:00 del 09/09,https://www.cgsse.it/calendario-scioperi/dettaglio-sciopero/356949,true,2024-09-08,2024-09-09,2024-09-08,
07-09-2024,Trasporto aereo,"DUSSMANN SERVICE SRL, SPD",Adl,MILANO,dalle ore 12:00 alla ore 16.00,https://www.cgsse.it/calendario-scioperi/dettaglio-sciopero/356940,false,2024-09-07,2024-09-07,2024-09-07,2024-09-07
20-09-2024,Trasporto pubblico locale,AZIENDE TRASPORTO PUBBLICO LOCALE,Usb Lavoro Privato,NAZIONALE,"24 ore con articolazione oraria a livello territoriale è esclusa dallo sciopero l'azienda gtt di torino, i bacini dei territori delle provincie di ravenna, forlì-cesena e rimini e la provincia di ancona",https://www.cgsse.it/calendario-scioperi/dettaglio-sciopero/356936,false,2024-09-20,2024-09-20,2024-09-20,2024-09-20
06-09-2024,Trasporto ferroviario,RFI,"Cobas Lavoro Privato, Coordinamento Ferrovieri",NAZIONALE,intera prestazione di lavoro,https://www.cgsse.it/calendario-scioperi/dettaglio-sciopero/356932,false,2024-09-06,2024-09-06,2024-09-06,2024-09-06
06-09-2024,Trasporto ferroviario,RFI,Assemblea Nazionale Lavoratori Manutenzione Rfi,NAZIONALE,intera prestazione di lavoro,https://www.cgsse.it/calendario-scioperi/dettaglio-sciopero/356930,false,2024-09-06,2024-09-06,2024-09-06,2024-09-06
31-07-2024,Servizio sanitario nazionale,SICURITALIA IVRI,Uiltucs,EMPOLI,dalle ore 00.01 alle ore 23.59,https://www.cgsse.it/calendario-scioperi/dettaglio-sciopero/356925,false,2024-07-31,2024-07-31,2024-07-31,2024-07-31
31-07-2024,Servizio sanitario nazionale,"COMPASS GROUP, LADISA RISTORAZIONE, VIVENDA","Filcams Cgil, Uiltucs","POGGIARDO, CAMPI SALENTINA, COPERTINO, NARDO', GALATINA",intero turno di lavoro,https://www.cgsse.it/calendario-scioperi/dettaglio-sciopero/356918,false,2024-07-31,2024-07-31,2024-07-31,2024-07-31
25-07-2024,Servizio sanitario nazionale,"COMPASS GROUP, LADISA RISTORAZIONE, VIVENDA","Filcams Cgil, Uiltucs","POGGIARDO, CAMPI SALENTINA, COPERTINO, NARDO', GALATINA",intero turno dalle ore 00.00 alle ore 24.00,https://www.cgsse.it/calendario-scioperi/dettaglio-sciopero/356896,true,2024-07-25,2024-07-25,2024-07-25,2024-07-25
30-07-2024,Istituti di vigilanza,FOLGORPOL,Ugl,LECCE,intero turno dalle ore 00.00 alle ore 24.00,https://www.cgsse.it/calendario-scioperi/dettaglio-sciopero/356887,true,2024-07-30,2024-07-30,2024-07-30,2024-07-30
27-10-2024,Trasporto aereo,ENAV,Fast Confsal,OLBIA,dalle ore 13.00 alle ore 17.00,https://www.cgsse.it/calendario-scioperi/dettaglio-sciopero/356878,false,2024-10-27,2024-10-27,2024-10-27,2024-10-27
07-09-2024,Trasporto aereo,ITA AIRWAYS,"Fit Cisl, Ugl Ta",NAZIONALE,dalle ore 13.00 alle ore 17.00,https://www.cgsse.it/calendario-scioperi/dettaglio-sciopero/356873,false,2024-09-07,2024-09-07,2024-09-07,2024-09-07
25-10-2024,Trasporto pubblico locale,ATM TRAPANI,"Filt Cgil, Fit Cisl, Faisa Cisal, Ugl, Soggetto Giuridico",TRAPANI,dalle ore 12.00 alle ore 16.00,https://www.cgsse.it/calendario-scioperi/dettaglio-sciopero/356850,true,2024-10-25,2024-10-25,2024-10-25,2024-10-25
05-10-2024,Trasporto pubblico locale,AZIENDE TRASPORTO PUBBLICO LOCALE,Orsa Trasporti,NAZIONALE,sciopero nazionale di 24 ore con articolazione oraria a livello territoriale. con esclusione dell' atm di milano],https://www.cgsse.it/calendario-scioperi/dettaglio-sciopero/356838,false,2024-10-05,2024-10-05,2024-10-05,2024-10-05
16-07-2024,Istituti di vigilanza,PEGASO SECURITY,Ugl,LECCE,intero turno di lavoro dalle ore 00.00 alle ore 24.00,https://www.cgsse.it/calendario-scioperi/dettaglio-sciopero/356816,true,2024-07-16,2024-07-16,2024-07-16,2024-07-16
24-09-2024,Trasporto aereo,"ADB, AVIAPARTNERS, AVIATION SERVICES, FFM BOLOGNA, GH BOLOGNA, TAG","Filt Cgil, Fit Cisl, Uiltrasporti, Ugl Ta",BOLOGNA,dalle ore 00.01 alle ore 23.59,https://www.cgsse.it/calendario-scioperi/dettaglio-sciopero/356814,false,2024-09-24,2024-09-24,2024-09-24,2024-09-24
26-07-2024,Taxi,SERVIZIO TAXI,"Uiltrasporti, Ascom Taxi, Confartigianato Taxi, Cna Fita, Unica Taxi Cgil, Uritaxi",BOLOGNA,dalle ore 08:00 alle ore 20:00,https://www.cgsse.it/calendario-scioperi/dettaglio-sciopero/356809,false,2024-07-26,2024-07-26,2024-07-26,2024-07-26
16-07-2024,Appalti ferroviari,MERMECSTE,Fiom,GENOVA,dalle 14:15 alle 15:15 e blocco delle attività straordinarie,https://www.cgsse.it/calendario-scioperi/dettaglio-sciopero/356793,true,2024-07-16,2024-07-16,2024-07-16,2024-07-16
19-09-2024,Regioni e autonomie Locali,OSA COOPERATIVA SOCIALE,"Usb Lavoro Privato, Usb Lavoro Privato",LATINA,intera giornata,https://www.cgsse.it/calendario-scioperi/dettaglio-sciopero/356791,true,2024-09-19,2024-09-19,2024-09-19,2024-09-19
26-07-2024,Trasporto pubblico locale,ATM TRAPANI,"Filt Cgil, Fit Cisl, Faisa Cisal, Ugl",TRAPANI,dalle ore 12.00 alle ore 16.00,https://www.cgsse.it/calendario-scioperi/dettaglio-sciopero/356774,true,2024-07-26,2024-07-26,2024-07-26,2024-07-26
07-09-2024,Trasporto aereo,WIZZ AIR MALTA LTD,Filt Cgil,NAZIONALE,dalle ore 13.00 alle ore 17.00 del personale navigante per tutti i voli in partenza dal territorio nazionale,https://www.cgsse.it/calendario-scioperi/dettaglio-sciopero/356757,false,2024-09-07,2024-09-07,2024-09-07,2024-09-07
26-07-2024,Trasporto aereo,MODITECH,"Fiom Cgil, Uilm Uil",ROMA,dalle ore 10.00 alle ore 16.00,https://www.cgsse.it/calendario-scioperi/dettaglio-sciopero/356748,true,2024-07-26,2024-07-26,2024-07-26,2024-07-26
13-09-2024,Servizio sanitario nazionale,AZIENDA SANITARIA FRIULI OCCIDENTALE,"Uil Fpl, Nursind",FRIULI VENEZIA GIULIA,dalle ore 00.00 alle ore 24.00,https://www.cgsse.it/calendario-scioperi/dettaglio-sciopero/356741,true,2024-09-13,2024-09-13,2024-09-13,2024-09-13
23-09-2024,Sanità privata,AIOP-ARIS,"Fp Cgil, Fp Cisl, Uil Fpl",NAZIONALE,intera giornata per ogni turno di lavoro,https://www.cgsse.it/calendario-scioperi/dettaglio-sciopero/356731,false,2024-09-23,2024-09-23,2024-09-23,2024-09-23
23-07-2024,Sanità privata,AIAS,"Fp Cgil, Fp Cisl, Fpl Uil, Fials, Ugl","MELFI, POTENZA",intera giornata,https://www.cgsse.it/calendario-scioperi/dettaglio-sciopero/356727,true,2024-07-23,2024-07-23,2024-07-23,2024-07-23
23-07-2024,Funerario,TEA SERVIZI FUNERARI,Usb Lavoro Privato,MANTOVA,intera giornata lavorativa,https://www.cgsse.it/calendario-scioperi/dettaglio-sciopero/356709,false,2024-07-23,2024-07-23,2024-07-23,2024-07-23
30-07-2024,Trasporto merci su rotaia,GTS RAIL,Fit Cisl,NAZIONALE,dalle ore 16.01 alle ore 23.59,https://www.cgsse.it/calendario-scioperi/dettaglio-sciopero/356705,false,2024-07-30,2024-07-30,2024-07-30,2024-07-30
24-07-2024,Regioni e autonomie Locali,SISPI,"Fim Cisl, Fiom Cgil",PALERMO,,https://www.cgsse.it/calendario-scioperi/dettaglio-sciopero/356703,true,2024-07-24,2024-07-24,2024-07-24,2024-07-24
06-08-2024,Servizio sanitario nazionale,SICURITALIA IVRI,Uiltucs,EMPOLI,dalle ore 00.01 alle ore 23.59,https://www.cgsse.it/calendario-scioperi/dettaglio-sciopero/356697,true,2024-08-06,2024-08-06,2024-08-06,2024-08-06
Dal 30-09-2024 al 01-10-2024,Trasporto ferroviario,TRENORD,"Uiltrasporti, Orsa Ferrovie",LOMBARDIA,dalle ore 03:00 del 30/09 alle ore 02:00 del 01/10,https://www.cgsse.it/calendario-scioperi/dettaglio-sciopero/356693,false,2024-09-30,2024-10-01,2024-09-30,
16-09-2024,Sanità privata,UNEBA,"Fp Cgil, Cisl Fp, Fisascat Cisl, Uil Fpl, Uiltucs",NAZIONALE,intera giornata o turno di lavoro,https://www.cgsse.it/calendario-scioperi/dettaglio-sciopero/356668,false,2024-09-16,2024-09-16,2024-09-16,2024-09-16
24-09-2024,Trasporto aereo,GH VENEZIA,Flai Trasporti E Servizi,VENEZIA,intera giornata,https://www.cgsse.it/calendario-scioperi/dettaglio-sciopero/356655,false,2024-09-24,2024-09-24,2024-09-24,2024-09-24
24-09-2024,Trasporto aereo,SICURITALIA IVRI,Flai Trasporti E Servizi,VENEZIA,intera giornata,https://www.cgsse.it/calendario-scioperi/dettaglio-sciopero/356653,false,2024-09-24,2024-09-24,2024-09-24,2024-09-24
Dal 20-07-2024 al 21-07-2024,Regioni e autonomie Locali,"AMET SPA, COMUNE DI TRANI",Cse Fulscam,TRANI,otto ore per ogni turno di lavoro dei dipendenti della darsena comunale,https://www.cgsse.it/calendario-scioperi/dettaglio-sciopero/356650,false,2024-07-20,2024-07-21,2024-07-20,
14-07-2024,Regioni e autonomie Locali,"AMET SPA, COMUNE DI TRANI",Cse Fulscam,TRANI,otto ore per ogni turno di lavoro dei dipendenti della darsena comunale,https://www.cgsse.it/calendario-scioperi/dettaglio-sciopero/356648,false,2024-07-14,2024-07-14,2024-07-14,2024-07-14
Dal 05-09-2024 al 06-09-2024,Trasporto merci su rotaia,"CAPTRAIN ITALIA, COMPAGNIA FERROVIARIA ITALIANA, CROSSRAIL ITALIA, DB CARGO ITALIA, FUORIMURO SERVIZI, GENERAL TRANSPORT SERVICE, INRAIL, INTERPORTO SERVIZI CARGO, MERCITALIA, OCEANOGATE ITALIA, RAIL CARGO ITALIA, RAIL TRACTION COMPANY, SBB CARFO ITALY, SERFER - SERVIZI FERROVIARI SRL",Usb Lavoro Privato,NAZIONALE,dalle ore 21.00 del 05/09 alle ore 21.00 del 06/09.,https://www.cgsse.it/calendario-scioperi/dettaglio-sciopero/356646,false,2024-09-05,2024-09-06,2024-09-05,
Dal 08-09-2024 al 09-09-2024,Trasporto ferroviario,"FERSERVIZI, GRUPPO FSI, ITALCERTIFER, MERCITALIA, NTV, RFI, TRENITALIA, TRENITALIA TPER, TRENORD",Usb Lavoro Privato,NAZIONALE,dalle ore 03.00 del 08/09 alle ore 02.00 del 09/09,https://www.cgsse.it/calendario-scioperi/dettaglio-sciopero/356644,false,2024-09-08,2024-09-09,2024-09-08,
Dal 19-08-2024 al 21-08-2024,Trasporto merci su gomma,AZIENDE DEL SETTORE TRASPORTO MERCI,"Slai Prol Cobas, Fao Cobas",NAZIONALE,dalle ore 00.00 del 19/08 alle ore 24.00 del 21/08,https://www.cgsse.it/calendario-scioperi/dettaglio-sciopero/356642,false,2024-08-19,2024-08-21,2024-08-19,
21-07-2024,Trasporto marittimo,TOREMAR,"Uiltrasporti, Filt Cgil, Fit Cisl",LIVORNO,intera giornata,https://www.cgsse.it/calendario-scioperi/dettaglio-sciopero/356636,false,2024-07-21,2024-07-21,2024-07-21,2024-07-21
21-07-2024,Trasporto aereo,AGS HANDLING,Cub Trasporti,BERGAMO,dalle ore 13.00 alle ore 17.00,https://www.cgsse.it/calendario-scioperi/dettaglio-sciopero/356625,false,2024-07-21,2024-07-21,2024-07-21,2024-07-21
19-07-2024,Regioni e autonomie Locali,DIACONIA VALDESE,Clap,"LAZIO, PIEMONTE, LOMBARDIA, CAMPANIA, TOSCANA",dalle ore 11.00 alle ore 13.00,https://www.cgsse.it/calendario-scioperi/dettaglio-sciopero/356610,false,2024-07-19,2024-07-19,2024-07-19,2024-07-19
18-07-2024,Trasporto pubblico locale,IAS SCURA,"Faisa Cisal, Filt Cgil, Uiltrasporti",CORIGLIANO-ROSSANO,"dalle ore 10,57 alle ore 14,57",https://www.cgsse.it/calendario-scioperi/dettaglio-sciopero/356608,false,2024-07-18,2024-07-18,2024-07-18,2024-07-18
21-07-2024,Trasporto aereo,SOGAER,Ugl Ta,CAGLIARI,dalle ore 13.00 alle ore 17.00,https://www.cgsse.it/calendario-scioperi/dettaglio-sciopero/356604,false,2024-07-21,2024-07-21,2024-07-21,2024-07-21
24-07-2024,Trasporto ferroviario,MERCITALIA RAIL,"Fit Cisl, Uiltrasporti, Ugl Ferrovieri, Fast Confsal, Orsa Trasporti, Filt Cgil",CALABRIA,dalle ore 09.01 alle ore 17.00,https://www.cgsse.it/calendario-scioperi/dettaglio-sciopero/356602,false,2024-07-24,2024-07-24,2024-07-24,2024-07-24
Dal 23-07-2024 al 25-07-2024,Servizio sanitario nazionale,"AUTNO, USL TOSCANA NORD",Fsi Usae,"MASSA CARRARA , LUCCA , LIVORNO , PISA",dalle ore 21:00 del 23/07 alle ore 21:00 del 25/07,https://www.cgsse.it/calendario-scioperi/dettaglio-sciopero/356592,false,2024-07-23,2024-07-25,2024-07-23,
21-07-2024,Trasporto aereo,AVIAPARTNER,Orsa Trasporti,REGGIO DI CALABRIA,dalle ore 13.00 alle ore 17.00,https://www.cgsse.it/calendario-scioperi/dettaglio-sciopero/356585,true,2024-07-21,2024-07-21,2024-07-21,2024-07-21
11-10-2024,Trasporto aereo,"ENAV, TECHNO SKY","Rsu Techno Sky, Filt Cgil, Uiltrasporti",MILANO,dalle ore 13.00 alle ore 17.00,https://www.cgsse.it/calendario-scioperi/dettaglio-sciopero/356576,true,2024-10-11,2024-10-11,2024-10-11,2024-10-11
19-07-2024,Igiene ambientale,"ICOS, SEA SRL","Fp Cgil, Fit Cisl, Uiltrasporti",ARAGONA,intera giornata,https://www.cgsse.it/calendario-scioperi/dettaglio-sciopero/356571,true,2024-07-19,2024-07-19,2024-07-19,2024-07-19
23-07-2024,Circolazione e sicurezza stradale,GSA GRUPPO SERVIZI ASSOCIATI,Sgb,"BOLOGNA , FIRENZE",dalle ore 16.00 alle ore 20.00,https://www.cgsse.it/calendario-scioperi/dettaglio-sciopero/356567,false,2024-07-23,2024-07-23,2024-07-23,2024-07-23
15-07-2024,Pulizie e multiservizi,"BONI SPA, TORINO SANITÀ","Filcams Cgil, Fisascat Cisl, Uiltrasporti",TORINO,intera giornata,https://www.cgsse.it/calendario-scioperi/dettaglio-sciopero/356562,false,2024-07-15,2024-07-15,2024-07-15,2024-07-15
16-07-2024,Ministeri,LADISA SPA,Cub Trasporti,GENOVA,intera giornata,https://www.cgsse.it/calendario-scioperi/dettaglio-sciopero/356558,false,2024-07-16,2024-07-16,2024-07-16,2024-07-16
Dal 02-09-2024 al 03-09-2024,Igiene ambientale,GESAM,Usb Lavoro Privato,SANTA MARINELLA,intero turno di lavoro,https://www.cgsse.it/calendario-scioperi/dettaglio-sciopero/356553,true,2024-09-02,2024-09-03,2024-09-02,
18-07-2024,Appalti ferroviari,"CNS, IDEAL BUILDING MAINTENANCE , IL FARO","Filt Cgil, Fit Cisl, Uiltrasporti",MARCHE,seconda metà del turno,https://www.cgsse.it/calendario-scioperi/dettaglio-sciopero/356551,false,2024-07-18,2024-07-18,2024-07-18,2024-07-18
23-07-2024,Igiene ambientale,ESI,Filas,LIMATOLA,intera giornata,https://www.cgsse.it/calendario-scioperi/dettaglio-sciopero/356544,true,2024-07-23,2024-07-23,2024-07-23,2024-07-23
21-07-2024,Trasporto ferroviario,TRENITALIA,"Filt Cgil, Uilt Uil, Ugl Ferrovieri, Fast Mobilita, Orsa",CAMPANIA,dalle ore 09.01 alle ore 16.59,https://www.cgsse.it/calendario-scioperi/dettaglio-sciopero/356536,false,2024-07-21,2024-07-21,2024-07-21,2024-07-21
20-07-2024,Igiene ambientale,SOGECO ARO LE2 SCRL,"Slai Cobas, Fiadel, Ugl Ambiente","SAN PIETRO IN LAMA, VERNOLE, CAVALLINO, SAN DONATO DI LECCE, CAPRARICA DI LECCE, SAN CESARIO DI LECCE, LIZZANELLO, CASTRI DI LECCE",intera giornata,https://www.cgsse.it/calendario-scioperi/dettaglio-sciopero/356530,true,2024-07-20,2024-07-20,2024-07-20,2024-07-20
18-07-2024,Trasporto pubblico locale,START ROMAGNA,"Fit Cisl, Uiltrasporti, Ugl Autoferro",RAVENNA,dalle 17:30 alle 21:30,https://www.cgsse.it/calendario-scioperi/dettaglio-sciopero/356526,false,2024-07-18,2024-07-18,2024-07-18,2024-07-18
Dal 17-07-2024 al 18-07-2024,Trasporto ferroviario,RFI,Ugl Ferrovieri,ABRUZZO,dalle ore 21.59 del 17/7 alle ore 21.59 del 18/7,https://www.cgsse.it/calendario-scioperi/dettaglio-sciopero/356522,false,2024-07-17,2024-07-18,2024-07-17,
16-07-2024,Appalti ferroviari,VUOLO GROUP,Salpas Orsa,ROMA,,https://www.cgsse.it/calendario-scioperi/dettaglio-sciopero/356516,false,2024-07-16,2024-07-16,2024-07-16,2024-07-16
14-07-2024,Regioni e autonomie Locali,COOP CULTURE,"Usb Lavoro Privato, Usb Slang",MILANO,intera giornata,https://www.cgsse.it/calendario-scioperi/dettaglio-sciopero/356499,false,2024-07-14,2024-07-14,2024-07-14,2024-07-14
Dal 21-07-2024 al 23-07-2024,Servizio sanitario nazionale,"AUTNO, USL TOSCANA NORD",Fsi Usae,"MASSA CARRARA , LUCCA , LIVORNO , PISA",dalle ore 21:00 del 21/07 alle ore 21:00 del 23/07,https://www.cgsse.it/calendario-scioperi/dettaglio-sciopero/356496,true,2024-07-21,2024-07-23,2024-07-21,
18-07-2024,Trasporto pubblico locale,ATAC,Sul,ROMA,dalle ore 08.30 alle ore 12.30,https://www.cgsse.it/calendario-scioperi/dettaglio-sciopero/356494,false,2024-07-18,2024-07-18,2024-07-18,2024-07-18
21-07-2024,Trasporto aereo,"SACAL GH SPA, SACAL SPA",Orsa Trasporti,"LAMEZIA TERME, REGGIO DI CALABRIA, CROTONE",dalle ore 13.00 alle ore 17.00,https://www.cgsse.it/calendario-scioperi/dettaglio-sciopero/356490,true,2024-07-21,2024-07-21,2024-07-21,2024-07-21
18-07-2024,Trasporto pubblico locale,ARST,Fit Cisl,OLBIA,dalle ore 18.00 alle ore 22.00,https://www.cgsse.it/calendario-scioperi/dettaglio-sciopero/356488,false,2024-07-18,2024-07-18,2024-07-18,2024-07-18
16-07-2024,Regioni e autonomie Locali,L'ARCOLAIO,Fp Cgil,BOLOGNA,intera giornata lavorativa o turno di lavoro,https://www.cgsse.it/calendario-scioperi/dettaglio-sciopero/356478,false,2024-07-16,2024-07-16,2024-07-16,2024-07-16
04-07-2024,Trasporto pubblico locale,ATAC,"Filt Cgil, Fit Cisl, Uiltrasporti, Ugl Fna",ROMA,dalle ore 08:30 alle ore 16:30,https://www.cgsse.it/calendario-scioperi/dettaglio-sciopero/356469,false,2024-07-04,2024-07-04,2024-07-04,2024-07-04
18-07-2024,Trasporto pubblico locale,GEST,Cobas Lavoro Privato,FIRENZE,dalle ore 09.30 alle ore 13.30,https://www.cgsse.it/calendario-scioperi/dettaglio-sciopero/356457,false,2024-07-18,2024-07-18,2024-07-18,2024-07-18
04-07-2024,Trasporto pubblico locale,ATAC,"Usb Lavoro Privato, Orsa Tpl",ROMA,dalle ore 08:30 alle ore 16:30,https://www.cgsse.it/calendario-scioperi/dettaglio-sciopero/356455,false,2024-07-04,2024-07-04,2024-07-04,2024-07-04
Dal 12-07-2024 al 13-07-2024,Igiene ambientale,GESAM,Usb Lavoro Privato,SANTA MARINELLA,interno turno di lavoro,https://www.cgsse.it/calendario-scioperi/dettaglio-sciopero/356445,true,2024-07-12,2024-07-13,2024-07-12,
18-07-2024,Regioni e autonomie Locali,"ASSISTENZA 2000, CONSORZIO DI LIBERE IMPRESE, CSS SOCIETÀ COOPERATIVA ONLUS, SOLIDARIETA E LAVORO SCRL",Fisascat Cisl,BARI,dalle ore 10.00 alle ore 13.00,https://www.cgsse.it/calendario-scioperi/dettaglio-sciopero/356443,false,2024-07-18,2024-07-18,2024-07-18,2024-07-18
07-09-2024,Trasporto pubblico locale,AMAT,"Filt Cgil, Fit Cisl, Uiltrasporti, Faisa Cisal, Cobas Trasporti, Orsa Trasporti",PALERMO,dalle ore 10.00 alle ore 14.00,https://www.cgsse.it/calendario-scioperi/dettaglio-sciopero/356439,true,2024-09-07,2024-09-07,2024-09-07,2024-09-07
18-07-2024,Avvocati,SETTORE GIUSTIZIA,Camera Penale Di Bari,BARI,astensione dalle udienze e dalle attività giudiziarie,https://www.cgsse.it/calendario-scioperi/dettaglio-sciopero/356429,false,2024-07-18,2024-07-18,2024-07-18,2024-07-18
08-07-2024,Regioni e autonomie Locali,"ASSISTENZA 2000, CONSORZIO DI LIBERE IMPRESE, CSS SOCIETÀ COOPERATIVA ONLUS, SOLIDARIETA E LAVORO SCRL",Fisascat Cisl,BARI,dalle ore 10.00 alle ore 13.00,https://www.cgsse.it/calendario-scioperi/dettaglio-sciopero/356427,true,2024-07-08,2024-07-08,2024-07-08,2024-07-08
18-07-2024,Istituti di vigilanza,VIGILANZA SAN PAOLINO SRL,Fenali Fnl,NAPOLI,,https://www.cgsse.it/calendario-scioperi/dettaglio-sciopero/356425,false,2024-07-18,2024-07-18,2024-07-18,2024-07-18
Dal 12-07-2024 al 13-07-2024,Igiene ambientale,"BLU WORK, CONSORZIO AIRONE, DM TECHNOLOGY, L'IGIENE URBANA EVOLUTION",Fiadel,ARDEA,48 ore su tutti i turni di lavoro,https://www.cgsse.it/calendario-scioperi/dettaglio-sciopero/356423,false,2024-07-12,2024-07-13,2024-07-12,
Dal 11-07-2024 al 12-07-2024,Igiene ambientale,AVRPA,Cobas Lavoro Privato,GROTTAGLIE,intere giornate,https://www.cgsse.it/calendario-scioperi/dettaglio-sciopero/356413,false,2024-07-11,2024-07-12,2024-07-11,
Dal 19-07-2024 al 20-07-2024,Trasporto ferroviario,RFI,Filt Cgil,TRENTINO ALTO ADIGE,dalle ore 10:45 del 19/07 alle ore 10:30 del 20/07,https://www.cgsse.it/calendario-scioperi/dettaglio-sciopero/356409,false,2024-07-19,2024-07-20,2024-07-19,
12-07-2024,Igiene ambientale,RETI AMBIENTE SPA,"Fp Cgil, Fiadel",MASSA,dalle ore 5.30 alle ore 24.00,https://www.cgsse.it/calendario-scioperi/dettaglio-sciopero/356407,false,2024-07-12,2024-07-12,2024-07-12,2024-07-12
18-07-2024,Trasporto pubblico locale,FERROVIE DELLA CALABRIA,Sul,CALABRIA,4 ore,https://www.cgsse.it/calendario-scioperi/dettaglio-sciopero/356401,false,2024-07-18,2024-07-18,2024-07-18,2024-07-18
Dal 10-07-2024 al 11-07-2024,Servizio sanitario nazionale,CONSORZIO STABILE CMF,"Fim Cisl, Fiom Cgil, Uilm Uil",ROMA,dalle ore 6.30 del 10/07 alle ore 6.30 dell' 11/07,https://www.cgsse.it/calendario-scioperi/dettaglio-sciopero/356388,false,2024-07-10,2024-07-11,2024-07-10,
Dal 10-07-2024 al 11-07-2024,Pulizie e multiservizi,CONSORZIO STABILE CMF,"Fim Cisl, Fiom Cgil, Uilm Uil",ROMA,dalle ore 6.30 del 10/07 alle ore 6.30 dell' 11/07,https://www.cgsse.it/calendario-scioperi/dettaglio-sciopero/356384,false,2024-07-10,2024-07-11,2024-07-10,
05-07-2024,Trasporto aereo,AIRPORT HANDLING,Cub Trasporti,NAZIONALE,dalle ore 13.00 alle ore 17.00,https://www.cgsse.it/calendario-scioperi/dettaglio-sciopero/356244,false,2024-07-05,2024-07-05,2024-07-05,2024-07-05
15-07-2024,Regioni e autonomie Locali,DOMUS ASSISTENZA,Fp Cgil,MODENA,intero turno di lavoro,https://www.cgsse.it/calendario-scioperi/dettaglio-sciopero/356223,false,2024-07-15,2024-07-15,2024-07-15,2024-07-15
20-09-2024,Trasporto pubblico locale,AZIENDE TRASPORTO PUBBLICO LOCALE,"Cobas Lavoro Privato, Adl Cobas, Sgb, Cub Trasporti",NAZIONALE,"intera giornata con articolazione oraria a livello territoriale è esclusa dallo sciopero l'azienda gtt di torino e i bacini delle provincie di ravenna, forlì-cesena e rimini",https://www.cgsse.it/calendario-scioperi/dettaglio-sciopero/356221,false,2024-09-20,2024-09-20,2024-09-20,2024-09-20
08-07-2024,Pulizie e multiservizi,LAZZARI SERVIZI,Orsa Filsa,ACERRA,intera giornata,https://www.cgsse.it/calendario-scioperi/dettaglio-sciopero/356216,true,2024-07-08,2024-07-08,2024-07-08,2024-07-08
Dal 22-07-2024 al 24-07-2024,Avvocati,SETTORE GIUSTIZIA,Consiglio Dell'ordine Degli Avvocati Di nola,NOLA,astensione dalle udienze civili e penali e dall'attività giudiziaria,https://www.cgsse.it/calendario-scioperi/dettaglio-sciopero/356214,true,2024-07-22,2024-07-24,2024-07-22,
19-07-2024,Regioni e autonomie Locali,COMUNE DI MILANO,"Fp Cgil, Fp Cisl, Uilfpl, Csa, Rsu Comune Di Milano",MILANO,intera giornata],https://www.cgsse.it/calendario-scioperi/dettaglio-sciopero/356201,true,2024-07-19,2024-07-19,2024-07-19,2024-07-19
Dal 06-07-2024 al 07-07-2024,Trasporto merci su rotaia,"CAPTRAIN ITALIA, COMPAGNIA FERROVIARIA ITALIANA, CROSSRAIL ITALIA SRL, DB CARGO ITALIA SRL, FUORIMURO SERVZI PORTUALI E FERROVIARI, GENERAL TRANSPORT SERVICE, INRAIL SPA, INTERPORTO SERVIZI CARGO, MEDWAY ITALIA, OCEANOGATE ITALIA, RAIL CARGO CARRIER ITALY SRL, RAIL TRACTION COMPANY SPA, SBB CARGO ITALY SRL, SERFER - SERVIZI FERROVIARI SRL",Usb Lavoro Privato,NAZIONALE,dalle ore 21.00 del 06/07 alle ore 21.00 del 07/07,https://www.cgsse.it/calendario-scioperi/dettaglio-sciopero/356191,true,2024-07-06,2024-07-07,2024-07-06,
Dal 06-07-2024 al 07-07-2024,Trasporto ferroviario,"GRUPPO FSI, NTV, RFI, TRENITALIA, TRENITALIA TPER, TRENORD",Usb Lavoro Privato,NAZIONALE,dalle ore 21:00 del 06/07 alle ore 21:00 del 07/07,https://www.cgsse.it/calendario-scioperi/dettaglio-sciopero/356189,true,2024-07-06,2024-07-07,2024-07-06,
09-07-2024,Taxi,SERVIZIO TAXI,Cobas Lavoro Privato,ROMA,dalle ore 00.00 alle ore 24.00,https://www.cgsse.it/calendario-scioperi/dettaglio-sciopero/356186,true,2024-07-09,2024-07-09,2024-07-09,2024-07-09
05-07-2024,Trasporto aereo,"SACAL GH SPA, SACAL SPA",Orsa Trasporti,"LAMEZIA TERME, REGGIO DI CALABRIA, CROTONE",dalle ore 00.00 alle ore 24.00,https://www.cgsse.it/calendario-scioperi/dettaglio-sciopero/356181,true,2024-07-05,2024-07-05,2024-07-05,2024-07-05
05-07-2024,Vigili del fuoco,MINISTERO DELL'INTERNO,Usb Vvf,PIEMONTE,dalle ore 09.00 alle ore 13.00,https://www.cgsse.it/calendario-scioperi/dettaglio-sciopero/356145,false,2024-07-05,2024-07-05,2024-07-05,2024-07-05
12-07-2024,Regioni e autonomie Locali,COMUNE DI SESTO SAN GIOVANNI,Flc Cgil,SESTO SAN GIOVANNI,intera giornata,https://www.cgsse.it/calendario-scioperi/dettaglio-sciopero/356143,true,2024-07-12,2024-07-12,2024-07-12,2024-07-12
05-07-2024,Istituti di vigilanza,EUROPOLICE,"Uiltucs, Filcams Cgil",CATANIA,intera giornata,https://www.cgsse.it/calendario-scioperi/dettaglio-sciopero/356141,true,2024-07-05,2024-07-05,2024-07-05,2024-07-05
21-07-2024,Trasporto aereo,AVIAPARTNER HANDLING,Sgb,BOLOGNA,dalle ore 13.00 alle ore 17.00,https://www.cgsse.it/calendario-scioperi/dettaglio-sciopero/356138,false,2024-07-21,2024-07-21,2024-07-21,2024-07-21
05-07-2024,Servizio sanitario nazionale,ASL PESCARA,Ugl Sicurezza Civile,PESCARA,intero turno di lavoro del personale della vigilanza,https://www.cgsse.it/calendario-scioperi/dettaglio-sciopero/356134,false,2024-07-05,2024-07-05,2024-07-05,2024-07-05
11-10-2024,Trasporto aereo,ENAV,Fast Confsal Av Unica,PALERMO,dalle ore 13.00 alle ore 17.00,https://www.cgsse.it/calendario-scioperi/dettaglio-sciopero/356130,false,2024-10-11,2024-10-11,2024-10-11,2024-10-11
01-07-2024,Servizio sanitario nazionale,AURIGA,Filcams Cgil,CHIETI,intera giornata o turno di lavoro,https://www.cgsse.it/calendario-scioperi/dettaglio-sciopero/356116,false,2024-07-01,2024-07-01,2024-07-01,2024-07-01
02-07-2024,Radio e TV,RAI,Rsu,ROMA,intera giornata del personale rai e società del gruppo rai appartenente alla direzione radio di roma,https://www.cgsse.it/calendario-scioperi/dettaglio-sciopero/356112,false,2024-07-02,2024-07-02,2024-07-02,2024-07-02
18-07-2024,Trasporto pubblico locale,AZIENDE TRASPORTO PUBBLICO LOCALE,Ugl Fna,NAZIONALE,sciopero nazionale di 4 ore con articolazione oraria a livello territoriale.],https://www.cgsse.it/calendario-scioperi/dettaglio-sciopero/356106,false,2024-07-18,2024-07-18,2024-07-18,2024-07-18
18-07-2024,Trasporto pubblico locale,AZIENDE TRASPORTO PUBBLICO LOCALE,Filt Cgil,NAZIONALE,sciopero nazionale di 4 ore con articolazione oraria a livello territoriale.],https://www.cgsse.it/calendario-scioperi/dettaglio-sciopero/356104,false,2024-07-18,2024-07-18,2024-07-18,2024-07-18
18-07-2024,Trasporto pubblico locale,AZIENDE TRASPORTO PUBBLICO LOCALE,Fit Cisl,NAZIONALE,sciopero nazionale di 4 ore con articolazione oraria a livello territoriale.],https://www.cgsse.it/calendario-scioperi/dettaglio-sciopero/356102,false,2024-07-18,2024-07-18,2024-07-18,2024-07-18
18-07-2024,Trasporto pubblico locale,AZIENDE TRASPORTO PUBBLICO LOCALE,Faisa Cisal,NAZIONALE,sciopero nazionale di 4 ore con articolazione oraria a livello territoriale.],https://www.cgsse.it/calendario-scioperi/dettaglio-sciopero/356100,false,2024-07-18,2024-07-18,2024-07-18,2024-07-18
18-07-2024,Trasporto pubblico locale,AZIENDE TRASPORTO PUBBLICO LOCALE,Uiltrasporti,NAZIONALE,sciopero nazionale di 4 ore con articolazione oraria a livello territoriale.],https://www.cgsse.it/calendario-scioperi/dettaglio-sciopero/356098,false,2024-07-18,2024-07-18,2024-07-18,2024-07-18
05-07-2024,Trasporto aereo,ALHA AIRPORT,Cub Trasporti,FIUMICINO,dalle ore 13.00 alle ore 17.00,https://www.cgsse.it/calendario-scioperi/dettaglio-sciopero/356096,false,2024-07-05,2024-07-05,2024-07-05,2024-07-05
13-09-2024,Trasporto pubblico locale,GTT,Fast Confsal,TORINO,"sciopero di 24 ore con rispetto delle fasce di garanzia. personale viaggiante urbano ed extraurbano, personale ferrovie to/ceres e canavesana, metropolitana personale esercizio",https://www.cgsse.it/calendario-scioperi/dettaglio-sciopero/356090,false,2024-09-13,2024-09-13,2024-09-13,2024-09-13
09-07-2024,Igiene ambientale,SEA-S SRL,"Fp Cgil, Fit Cisl, Uiltrasporti, Fiadel",SAVONA,intera giornata o turno di lavoro,https://www.cgsse.it/calendario-scioperi/dettaglio-sciopero/356088,false,2024-07-09,2024-07-09,2024-07-09,2024-07-09
21-07-2024,Trasporto aereo,"ENAV, TECHNO SKY","Rsu Techno Sky, Filt Cgil, Uiltrasporti",MILANO,dalle ore 13.00 alle ore 17.00,https://www.cgsse.it/calendario-scioperi/dettaglio-sciopero/356079,true,2024-07-21,2024-07-21,2024-07-21,2024-07-21
Dal 03-07-2024 al 04-07-2024,Igiene ambientale,IGM RIFIUTI INDUSTRIALI SRL,Fiadel Csa,MODICA,intere giornate,https://www.cgsse.it/calendario-scioperi/dettaglio-sciopero/356074,false,2024-07-03,2024-07-04,2024-07-03,
28-09-2024,Trasporto pubblico locale,AMAT,Cub Trasporti,PALERMO,dalle ore 08.30 alle ore 17.30 e dalle ore 20.30 a fine servizio,https://www.cgsse.it/calendario-scioperi/dettaglio-sciopero/356060,true,2024-09-28,2024-09-28,2024-09-28,2024-09-28
07-07-2024,Trasporto pubblico locale,AZIENDE TRASPORTO PUBBLICO LOCALE,Orsa Trasporti,NAZIONALE,sciopero nazionale di 4 ore con articolazione oraria a livello territoriale.],https://www.cgsse.it/calendario-scioperi/dettaglio-sciopero/356055,false,2024-07-07,2024-07-07,2024-07-07,2024-07-07
02-07-2024,Trasporto pubblico locale,FERROVIE DELLA CALABRIA,Sul,CALABRIA,dalle ore 9.00 alle ore 17.00 e dalle ore 20.00 a fine servizio,https://www.cgsse.it/calendario-scioperi/dettaglio-sciopero/356053,true,2024-07-02,2024-07-02,2024-07-02,2024-07-02
Dal 04-07-2024 al 05-07-2024,Trasporto marittimo,"ANCIP, ASSITERMINAL, ASSOLOGISTICA, ASSOPORTI, FISE","Filt Cgil, Fit Cisl",NAZIONALE,intere giornate,https://www.cgsse.it/calendario-scioperi/dettaglio-sciopero/356041,false,2024-07-04,2024-07-05,2024-07-04,
01-07-2024,Pulizie e multiservizi,ISS ITALIA A.BARBATO,Filcams Cgil,VITERBO,intera giornata lavorativa,https://www.cgsse.it/calendario-scioperi/dettaglio-sciopero/356034,true,2024-07-01,2024-07-01,2024-07-01,2024-07-01
22-06-2024,Plurisettoriale provinciale,"AZIENDE DEI SETTORI TERZIARIO, TURISMO E SERVIZI",Filcams Cgil,LATINA,dalle ore 16.00 a fine turno di lavoro,https://www.cgsse.it/calendario-scioperi/dettaglio-sciopero/356032,false,2024-06-22,2024-06-22,2024-06-22,2024-06-22
09-07-2024,Ministeri,MINISTERO DELLA GIUSTIZIA,"Fp Cgil, Fp Cisl, Fpl, Usb Pubblico Impiego, Confitesa",BERGAMO,dalle ore 10.00 alle ore 12.00,https://www.cgsse.it/calendario-scioperi/dettaglio-sciopero/356027,false,2024-07-09,2024-07-09,2024-07-09,2024-07-09
Dal 01-07-2024 al 07-07-2024,Trasporto marittimo,AZIENDE PORTUALI,Uiltrasporti,NAZIONALE,"intera prestazione lavorativa per i gorni 2 e 3 luglio mentre per i giorni 1,4,5,6 e 7 luglio le modalità saranno articolate dalle strutture territoriali",https://www.cgsse.it/calendario-scioperi/dettaglio-sciopero/356017,false,2024-07-01,2024-07-07,2024-07-01,
05-07-2024,Trasporto aereo,SEA SPA,Cub Trasporti,NAZIONALE,dalle ore 13.00 alle ore 17.00,https://www.cgsse.it/calendario-scioperi/dettaglio-sciopero/356015,false,2024-07-05,2024-07-05,2024-07-05,2024-07-05
05-07-2024,Trasporto aereo,GH VENEZIA,Flai Trasporti E Servizi,VENEZIA,dalle ore 13.00 alle ore 17.00,https://www.cgsse.it/calendario-scioperi/dettaglio-sciopero/356013,false,2024-07-05,2024-07-05,2024-07-05,2024-07-05
05-07-2024,Trasporto aereo,SICURITALIA IVRI,Flai Trasporti E Servizi,VENEZIA,dalle ore 13.00 alle ore 17.00,https://www.cgsse.it/calendario-scioperi/dettaglio-sciopero/356011,false,2024-07-05,2024-07-05,2024-07-05,2024-07-05
Dal 30-06-2024 al 01-07-2024,Servizio sanitario nazionale,ASL PESCARA,Ugl Sicurezza Civile,PESCARA,intero turno di lavoro del personale della vigilanza,https://www.cgsse.it/calendario-scioperi/dettaglio-sciopero/356009,true,2024-06-30,2024-07-01,2024-06-30,
01-07-2024,Regioni e autonomie Locali,SCUOLE DELL’INFANZIA DELLA PROVINCIA DI TRENTO,"Cisl Scuola, Flc Cgil, Fgu Satos",TRENTO,intera giornata,https://www.cgsse.it/calendario-scioperi/dettaglio-sciopero/356007,false,2024-07-01,2024-07-01,2024-07-01,2024-07-01
04-07-2024,Igiene ambientale,CZETA,Fial Ambiente E Servizi,CASAPULLA,dalle ore 00:01 alle ore 23:59,https://www.cgsse.it/calendario-scioperi/dettaglio-sciopero/356001,true,2024-07-04,2024-07-04,2024-07-04,2024-07-04
03-07-2024,Istituti di vigilanza,GGS,"Filcams Cgil, Fisascat Cisl, Uiltucs",LECCE,dalle ore 00:00 alle ore 24:00 intero turno di lavoro,https://www.cgsse.it/calendario-scioperi/dettaglio-sciopero/355995,true,2024-07-03,2024-07-03,2024-07-03,2024-07-03
Dal 10-07-2024 al 12-07-2024,Avvocati,SETTORE GIUSTIZIA,Unione Camere Penali Italiane,NAZIONALE,"astensione dalle udienze e da ogni attività giudiziaria nel settore penale per i giorni 10, 11 e 12 luglio 2024 esclusi i circondari di bari, nocera e santa maria capua vetere",https://www.cgsse.it/calendario-scioperi/dettaglio-sciopero/355970,false,2024-07-10,2024-07-12,2024-07-10,
Dal 10-07-2023 al 12-07-2023,Avvocati,SETTORE GIUSTIZIA,Unioni Camere Penali Italiane,NAZIONALE,astensione dall’attività giudiziaria degli avvocati,https://www.cgsse.it/calendario-scioperi/dettaglio-sciopero/355949,false,2023-07-10,2023-07-12,2023-07-10,
Dal 01-07-2024 al 03-07-2024,Avvocati,SETTORE GIUSTIZIA,Camera Penale Di Santa Maria Capua Vetere,SANTA MARIA CAPUA VETERE,astensione dalle udienze e da ogni attività giudiziarie nel settore penale,https://www.cgsse.it/calendario-scioperi/dettaglio-sciopero/355945,false,2024-07-01,2024-07-03,2024-07-01,
07-07-2024,Trasporto ferroviario,RFI,Cobas Lavoro Privato,NAZIONALE,intera prestazione di lavoro,https://www.cgsse.it/calendario-scioperi/dettaglio-sciopero/355943,false,2024-07-07,2024-07-07,2024-07-07,2024-07-07
11-07-2024,Credito,CASSA COMPENSAZIONE E GARANZIA,First Cisl,MILANO,"dalle 11,30 sino alle 12,30",https://www.cgsse.it/calendario-scioperi/dettaglio-sciopero/355894,false,2024-07-11,2024-07-11,2024-07-11,2024-07-11
04-07-2024,Credito,CASSA COMPENSAZIONE E GARANZIA,First Cisl,MILANO,"dalle 11,30 sino alle 12,30",https://www.cgsse.it/calendario-scioperi/dettaglio-sciopero/355890,false,2024-07-04,2024-07-04,2024-07-04,2024-07-04
27-06-2024,Credito,"BORSA ITALIANA, CASSA COMPENSAZIONE E GARANZIA, MONTE TITOLI, MTS","Fabi, Fisac Cgil, First Cisl",MILANO,astensione dal lavoro nelle ultime due ore della giornata lavorativa,https://www.cgsse.it/calendario-scioperi/dettaglio-sciopero/355882,false,2024-06-27,2024-06-27,2024-06-27,2024-06-27
05-07-2024,Trasporto aereo,"ADB, AVIAPARTNERS, AVIATION SERVICES, FFM BOLOGNA, GH BOLOGNA, TAG","Filt Cgil, Fit Cisl, Uiltrasporti, Ugl Ta",BOLOGNA,dalle 13.00 alle 17.00,https://www.cgsse.it/calendario-scioperi/dettaglio-sciopero/355868,false,2024-07-05,2024-07-05,2024-07-05,2024-07-05
06-07-2024,Trasporto pubblico locale,GTT,Fast Confsal,TORINO,"sciopero di 24 ore con rispetto delle fasce di garanzia personale viaggiante urbano ed extraurbano, personale ferrovie to/ceres e canavesana, metropolitana personale esercizio",https://www.cgsse.it/calendario-scioperi/dettaglio-sciopero/355861,true,2024-07-06,2024-07-06,2024-07-06,2024-07-06
27-06-2024,Regioni e autonomie Locali,COMUNE DI SESTO SAN GIOVANNI,Flc Cgil,SESTO SAN GIOVANNI,intera giornata,https://www.cgsse.it/calendario-scioperi/dettaglio-sciopero/355832,true,2024-06-27,2024-06-27,2024-06-27,2024-06-27
Dal 25-06-2024 al 26-06-2024,Pulizie e multiservizi,CONSORZIO STABILE CMF,"Fim Cisl, Fiom Cgil, Uilm Uil",ROMA,dalle ore 6.30 del 25/6 alle ore 6.30 del 26/6,https://www.cgsse.it/calendario-scioperi/dettaglio-sciopero/355805,true,2024-06-25,2024-06-26,2024-06-25,
Dal 25-06-2024 al 26-06-2024,Servizio sanitario nazionale,CONSORZIO STABILE CMF,"Fim Cisl, Fiom Cgil, Uilm Uil",ROMA,dalle ore 6.30 del 25/6 alle ore 6.30 del 26/6,https://www.cgsse.it/calendario-scioperi/dettaglio-sciopero/355793,true,2024-06-25,2024-06-26,2024-06-25,
26-06-2024,Trasporto pubblico locale,EAV,Usb Lavoro Privato,NAPOLI,dalle ore 9.00alle ore 13.00,https://www.cgsse.it/calendario-scioperi/dettaglio-sciopero/355775,false,2024-06-26,2024-06-26,2024-06-26,2024-06-26
07-07-2024,Trasporto ferroviario,RFI,Usb Lavoro Privato,NAZIONALE,intera prestazione di lavoro,https://www.cgsse.it/calendario-scioperi/dettaglio-sciopero/355765,true,2024-07-07,2024-07-07,2024-07-07,2024-07-07
Dal 26-06-2024 al 27-06-2024,Igiene ambientale,AVRPA,Cobas Lavoro Privato,GROTTAGLIE,intere giornate,https://www.cgsse.it/calendario-scioperi/dettaglio-sciopero/355760,false,2024-06-26,2024-06-27,2024-06-26,
Dal 06-07-2024 al 07-07-2024,Trasporto pubblico locale,SAD,Uilt Sgk,BOLZANO,"da inizio servizio alle ore 6.00, dalle ore 9.00 alle ore 18.00 e dalle ore 21.00 a fine servzio",https://www.cgsse.it/calendario-scioperi/dettaglio-sciopero/355755,false,2024-07-06,2024-07-07,2024-07-06,
01-07-2024,Igiene ambientale,GESAM,Usb Lavoro Privato,SANTA MARINELLA,interno turno di lavoro,https://www.cgsse.it/calendario-scioperi/dettaglio-sciopero/355753,false,2024-07-01,2024-07-01,2024-07-01,2024-07-01
02-07-2024,Servizio sanitario nazionale,IRCCS BURLO GAROFOLO,"Uil Fpl, Nursind",TRIESTE,dalle ore 00:00 alle ore 24:00,https://www.cgsse.it/calendario-scioperi/dettaglio-sciopero/355751,false,2024-07-02,2024-07-02,2024-07-02,2024-07-02
05-07-2024,Circolazione e sicurezza stradale,GSA GRUPPO SERVIZI ASSOCIATI,Sgb,"LAZIO, EMILIA ROMAGNA, TOSCANA",dalle ore 16.00 alle ore 20.00,https://www.cgsse.it/calendario-scioperi/dettaglio-sciopero/355721,true,2024-07-05,2024-07-05,2024-07-05,2024-07-05
28-06-2024,Sanità privata,CLINICA VILLA NINA,"Fp Cgil, Fp Cisl, Uil Fpl",MARINO,intero turno di lavoro escluso il turno notturno,https://www.cgsse.it/calendario-scioperi/dettaglio-sciopero/355719,false,2024-06-28,2024-06-28,2024-06-28,2024-06-28
Dal 25-07-2024 al 26-07-2024,Servizio sanitario nazionale,ARNAS G.BROTZU,Nursing Up,CAGLIARI,dalle ore 00:00 del 25/07 alle ore 24:00 del 26/07,https://www.cgsse.it/calendario-scioperi/dettaglio-sciopero/355695,false,2024-07-25,2024-07-26,2024-07-25,
21-07-2024,Trasporto pubblico locale,EAV,Orsa Trasporti,NAPOLI,dalle ore 08:25 alle ore 14:25,https://www.cgsse.it/calendario-scioperi/dettaglio-sciopero/355693,false,2024-07-21,2024-07-21,2024-07-21,2024-07-21
Dal 25-06-2024 al 26-06-2024,Servizio sanitario nazionale,"AUTNO, USL TOSCANA NORD",Fsi Usae,"MASSA CARRARA , LUCCA , LIVORNO , PISA",dalle ore 21:00 del 25/06 alle ore 21:00 del 26/06,https://www.cgsse.it/calendario-scioperi/dettaglio-sciopero/355691,false,2024-06-25,2024-06-26,2024-06-25,
07-07-2024,Trasporto pubblico locale,MOM,"Filt Cgil, Faisa Cisal, Sgb",TREVISO,intera giornata con rispetto delle fasce di garanzia,https://www.cgsse.it/calendario-scioperi/dettaglio-sciopero/355683,false,2024-07-07,2024-07-07,2024-07-07,2024-07-07
24-06-2024,Pulizie e multiservizi,EURO&PROMOS FM,Usb Lavoro Privato,CREMONA,intera giornata per l'intero turno di lavoro,https://www.cgsse.it/calendario-scioperi/dettaglio-sciopero/355679,false,2024-06-24,2024-06-24,2024-06-24,2024-06-24
16-09-2024,Sanità privata,UNEBA,"Fp Cgil, Cisl Fp, Fisascat Cisl, Uil Fpl, Uiltucs",NAZIONALE,intera giornata o turno di lavoro,https://www.cgsse.it/calendario-scioperi/dettaglio-sciopero/355677,true,2024-09-16,2024-09-16,2024-09-16,2024-09-16
24-06-2024,Trasporto aereo,"ADB, AVIAPARTNERS, AVIATION SERVICES, FFM BOLOGNA, GH BOLOGNA, TAG","Filt Cgil, Fit Cisl, Uiltrasporti, Ugl Ta",BOLOGNA,dalle 11.00 alle 15.00,https://www.cgsse.it/calendario-scioperi/dettaglio-sciopero/355665,true,2024-06-24,2024-06-24,2024-06-24,2024-06-24
Dal 17-07-2024 al 18-07-2024,Trasporto ferroviario,RFI,"Filt Cgil, Fit Cisl, Uiltrasporti, Ugl, Fast Confsal","MARCHE, UMBRIA",dalle ore 21:59 del 17/7 alle ore 21:59 del 18/7,https://www.cgsse.it/calendario-scioperi/dettaglio-sciopero/355660,false,2024-07-17,2024-07-18,2024-07-17,
23-07-2024,Trasporto ferroviario,MERCITALIA RAIL,"Filt Cgil, Fit Cisl, Uiltrasporti, Orsa",EMILIA ROMAGNA,dalle ore 09.01 alle ore 16.59,https://www.cgsse.it/calendario-scioperi/dettaglio-sciopero/355646,false,2024-07-23,2024-07-23,2024-07-23,2024-07-23
21-06-2024,Servizio sanitario nazionale,CONSORZIO STABILE CMF,"Fim Cisl, Fiom Cgil, Uilm Uil",ROMA,,https://www.cgsse.it/calendario-scioperi/dettaglio-sciopero/355628,true,2024-06-21,2024-06-21,2024-06-21,2024-06-21
21-06-2024,Pulizie e multiservizi,CONSORZIO STABILE CMF,"Fim Cisl, Fiom Cgil, Uilm Uil",ROMA,,https://www.cgsse.it/calendario-scioperi/dettaglio-sciopero/355616,true,2024-06-21,2024-06-21,2024-06-21,2024-06-21
18-07-2024,Trasporto ferroviario,RFI,Ugl Ferrovieri,BOLOGNA,dalle ore 09.01 alle ore 17.00,https://www.cgsse.it/calendario-scioperi/dettaglio-sciopero/355606,false,2024-07-18,2024-07-18,2024-07-18,2024-07-18
24-06-2024,Pulizie e multiservizi,VIVALDI & CARDINO,Fismic,"POMIGLIANO D'ARCO, NOLA",intera giornata,https://www.cgsse.it/calendario-scioperi/dettaglio-sciopero/355604,true,2024-06-24,2024-06-24,2024-06-24,2024-06-24
18-07-2024,Trasporto merci su rotaia,CFI,"Filt Cgil, Fit Cisl, Uiltrasporti",NAZIONALE,dalle ore 00.01 alle ore 07.59,https://www.cgsse.it/calendario-scioperi/dettaglio-sciopero/355594,false,2024-07-18,2024-07-18,2024-07-18,2024-07-18
21-07-2024,Trasporto aereo,COOPSERVICE SCPA,Uiltucs,OLBIA,dalle ore 13.00 alle ore 17.00,https://www.cgsse.it/calendario-scioperi/dettaglio-sciopero/355586,true,2024-07-21,2024-07-21,2024-07-21,2024-07-21
Dal 17-07-2024 al 18-07-2024,Trasporto ferroviario,RFI,"Filt Cgil, Fit Cisl, Uiltrasporti, Ugl Ferrovieri, Orsa",FIRENZE,dalle ore 22.00 del 17/7 alle ore 21.59 del 18/7,https://www.cgsse.it/calendario-scioperi/dettaglio-sciopero/355579,false,2024-07-17,2024-07-18,2024-07-17,
03-07-2024,Trasporto ferroviario,MERCITALIA RAIL,"Filt Cgil, Fit Cisl, Uiltrasporti, Orsa",EMILIA ROMAGNA,dalle ore 9.01 alle ore 16.59,https://www.cgsse.it/calendario-scioperi/dettaglio-sciopero/355573,true,2024-07-03,2024-07-03,2024-07-03,2024-07-03
26-06-2024,Trasporto pubblico locale,EAV,Faisa Confail,NAPOLI,24 ore con il rispetto delle fascie di garanzia,https://www.cgsse.it/calendario-scioperi/dettaglio-sciopero/355568,false,2024-06-26,2024-06-26,2024-06-26,2024-06-26
Dal 18-06-2024 al 19-06-2024,Igiene ambientale,TEOREMA,Cobas Lavoro Privato,GROTTAGLIE,intere giornate,https://www.cgsse.it/calendario-scioperi/dettaglio-sciopero/355566,true,2024-06-18,2024-06-19,2024-06-18,
26-07-2024,Servizio sanitario nazionale,ASL VERCELLI,Fmt,VERCELLI,intera giornata o turno di lavoro,https://www.cgsse.it/calendario-scioperi/dettaglio-sciopero/355563,true,2024-07-26,2024-07-26,2024-07-26,2024-07-26
24-09-2024,Trasporto aereo,AIR DOLOMITI,Uiltrasporti,NAZIONALE,intera giornata,https://www.cgsse.it/calendario-scioperi/dettaglio-sciopero/355558,true,2024-09-24,2024-09-24,2024-09-24,2024-09-24
Dal 17-07-2024 al 18-07-2024,Trasporto ferroviario,RFI,"Filt Cgil, Fit Cisl, Uiltrasporti, Orsa",BOLOGNA,dalle ore 21:59 del 17/7 alle ore 21:59 del 18/7,https://www.cgsse.it/calendario-scioperi/dettaglio-sciopero/355527,false,2024-07-17,2024-07-18,2024-07-17,
17-06-2024,Circolazione e sicurezza stradale,TANGENZIALE DI NAPOLI,"Filt Cgil, Fit Cisl, Uiltrasporti, Sla Cisal, Ugl, Rsa",NAPOLI,"personale turnista prime 4 ore di servizio, impiegati e operai ultime 4 ore di servizio",https://www.cgsse.it/calendario-scioperi/dettaglio-sciopero/355522,true,2024-06-17,2024-06-17,2024-06-17,2024-06-17
Dal 21-06-2024 al 28-06-2024,Avvocati,SETTORE GIUSTIZIA,Camera Penale Di Nocera Inferiore,NOCERA INFERIORE,astensione dall'attività giudiziaria degli avvocati,https://www.cgsse.it/calendario-scioperi/dettaglio-sciopero/355515,false,2024-06-21,2024-06-28,2024-06-21,
20-06-2024,Sanità privata,FONDAZIONE CONTE BUSI,Usb Lavoro Privato,CASALMAGGIORE,intera giornata,https://www.cgsse.it/calendario-scioperi/dettaglio-sciopero/355513,false,2024-06-20,2024-06-20,2024-06-20,2024-06-20
07-07-2024,Trasporto ferroviario,RFI,Assemblea Nazionale Lavoratori Manutenzione Rfi,NAZIONALE,intera prestazione di lavoro,https://www.cgsse.it/calendario-scioperi/dettaglio-sciopero/355511,false,2024-07-07,2024-07-07,2024-07-07,2024-07-07
07-06-2024,Trasporto ferroviario,RFI,"Cobas Lavoro Privato, Coordinamento Ferrovieri",NAZIONALE,24 ore (intera prestazione lavorativa),https://www.cgsse.it/calendario-scioperi/dettaglio-sciopero/355509,false,2024-06-07,2024-06-07,2024-06-07,2024-06-07
30-06-2024,Regioni e autonomie Locali,COMUNE DI MILANO,"Sulpl, Usb Pubblico Impiego",MILANO,intera giornata del personale della polizia locale],https://www.cgsse.it/calendario-scioperi/dettaglio-sciopero/355501,false,2024-06-30,2024-06-30,2024-06-30,2024-06-30
Dal 19-07-2024 al 20-07-2024,Trasporto ferroviario,RFI,"Uiltrasporti, Orsa",TRENTINO ALTO ADIGE,dalle ore 10:45 del 19/07 alle ore 10:30 del 20/07,https://www.cgsse.it/calendario-scioperi/dettaglio-sciopero/355498,false,2024-07-19,2024-07-20,2024-07-19,
05-07-2024,Trasporto pubblico locale,SAD,Uilt Sgk,BOLZANO,"da inizio servizio alle ore 6.00, dalle ore 9.00 alle ore 18.00 e dalle ore 21.00 a fine servzio",https://www.cgsse.it/calendario-scioperi/dettaglio-sciopero/355451,true,2024-07-05,2024-07-05,2024-07-05,2024-07-05
05-07-2024,Trasporto pubblico locale,SIMOBIL,Uilt Sgk,BOLZANO,"da inizio servizio alle ore 6:00, dalle ore 9:00 alle ore 12:00 e dalle ore 15:00 a fine servizio",https://www.cgsse.it/calendario-scioperi/dettaglio-sciopero/355448,false,2024-07-05,2024-07-05,2024-07-05,2024-07-05
18-06-2024,Regioni e autonomie Locali,COMUNE DI COMO,"Fp Cgil, Fp Cisl, Uil Fpl",COMO,intera giornata o turno di lavoro,https://www.cgsse.it/calendario-scioperi/dettaglio-sciopero/355446,false,2024-06-18,2024-06-18,2024-06-18,2024-06-18
17-06-2024,Pulizie e multiservizi,SOCIETY MODERNE FACILITY MANAGEMENT,"Confail, Faisa Cisal",NAPOLI,intera giornata o turno di lavoro,https://www.cgsse.it/calendario-scioperi/dettaglio-sciopero/355442,true,2024-06-17,2024-06-17,2024-06-17,2024-06-17
17-06-2024,Regioni e autonomie Locali,SCUOLA DELL’INFANZIA E DI TUTTO IL PERSONALE DELLE SCUOLE EQUIPARATE DELLA PROVINCIA DI TRENTO,Cub,TRENTO,intera giornata,https://www.cgsse.it/calendario-scioperi/dettaglio-sciopero/355439,false,2024-06-17,2024-06-17,2024-06-17,2024-06-17
17-06-2024,Regioni e autonomie Locali,SABATO VIAGGI,Faisa Cisal,ROMA,dalle ore 12.30 alle ore 16.30,https://www.cgsse.it/calendario-scioperi/dettaglio-sciopero/355436,false,2024-06-17,2024-06-17,2024-06-17,2024-06-17
17-06-2024,Servizio sanitario nazionale,ASL RM 1,Faisa Cisal,ROMA,dalle ore 12.30 alle ore 16.30,https://www.cgsse.it/calendario-scioperi/dettaglio-sciopero/355434,false,2024-06-17,2024-06-17,2024-06-17,2024-06-17
17-06-2024,Regioni e autonomie Locali,PAOLO SCOPPIO AUTOLINEE,Faisa Cisal,ROMA,dalle ore 12.30 alle ore 16.30,https://www.cgsse.it/calendario-scioperi/dettaglio-sciopero/355432,false,2024-06-17,2024-06-17,2024-06-17,2024-06-17
17-06-2024,Pulizie e multiservizi,SOCIETY MODERNE FACILITY MANAGEMENT,"Filt Cgil, Filcams Cgil, Fisascat Cisl, Uiltrasporti, Ugl",NAPOLI,intera giornata o turno di lavoro,https://www.cgsse.it/calendario-scioperi/dettaglio-sciopero/355414,false,2024-06-17,2024-06-17,2024-06-17,2024-06-17
Dal 17-06-2024 al 18-06-2024,Servizio sanitario nazionale,"COOPERATIVE: GESCO, ERA, ICARO, PROODOS, SOL.CO","Fp Cgil, Cisl Fp, Uil Fpl",NAPOLI,dalle ore 08:00 del 17/06 alle ore 08:00 del 18/06,https://www.cgsse.it/calendario-scioperi/dettaglio-sciopero/355408,false,2024-06-17,2024-06-18,2024-06-17,
14-06-2024,Taxi,SERVIZIO TAXI,"Uiltrasporti, Ascom Taxi, Confartigianato Taxi, Cna Fita, Unica Filt Cgil, Uritaxi",BOLOGNA,dalle ore 08:00 alle ore 20:00,https://www.cgsse.it/calendario-scioperi/dettaglio-sciopero/355370,false,2024-06-14,2024-06-14,2024-06-14,2024-06-14
17-06-2024,Trasporto pubblico locale,MOVIBUS,Ugl Fna,MILANO,"da inizio servizio alle ore 05:30, dalle ore 08:30 alle ore 12:30 e dalle ore 15:30 a fine servizio.",https://www.cgsse.it/calendario-scioperi/dettaglio-sciopero/355363,false,2024-06-17,2024-06-17,2024-06-17,2024-06-17
26-06-2024,Trasporto pubblico locale,GRUPPO ATM,Al Cobas,"MILANO , MONZA E DELLA BRIANZA","gruppo atm personale viaggiante di superficie, metropolitana, agenti di stazione, serv. poma 08.45 -15.00 e 18,00-fine servizio, net - urbano monza: 09.00 -11.50 e 14.50-fine servizio, extraurbano trezzo 08.45-15.00 e 18.00-fine servizio",https://www.cgsse.it/calendario-scioperi/dettaglio-sciopero/355339,false,2024-06-26,2024-06-26,2024-06-26,2024-06-26
24-06-2024,Telecomunicazioni,ACANTHO,"Slc Cgil, Fistel Cisl, Uilcom Uil",EMILIA ROMAGNA,intera giornata,https://www.cgsse.it/calendario-scioperi/dettaglio-sciopero/355334,true,2024-06-24,2024-06-24,2024-06-24,2024-06-24
17-06-2024,Igiene ambientale,IGM RIFIUTI INDUSTRIALI SRL,Fiadel Csa,MODICA,intera giornata,https://www.cgsse.it/calendario-scioperi/dettaglio-sciopero/355330,false,2024-06-17,2024-06-17,2024-06-17,2024-06-17
13-06-2024,Sanità privata,ODA,Usb Lavoro Privato,CATANIA,intera giornata,https://www.cgsse.it/calendario-scioperi/dettaglio-sciopero/355328,false,2024-06-13,2024-06-13,2024-06-13,2024-06-13
10-06-2024,Regioni e autonomie Locali,SABATO VIAGGI,Faisa Cisal,ROMA,dalle ore 12.30 alle ore 16.30,https://www.cgsse.it/calendario-scioperi/dettaglio-sciopero/355320,true,2024-06-10,2024-06-10,2024-06-10,2024-06-10
10-06-2024,Servizio sanitario nazionale,ASL RM 1,Faisa Cisal,ROMA,dalle ore 12.30 alle ore 16.30,https://www.cgsse.it/calendario-scioperi/dettaglio-sciopero/355316,true,2024-06-10,2024-06-10,2024-06-10,2024-06-10
10-06-2024,Regioni e autonomie Locali,PAOLO SCOPPIO AUTOLINEE,Faisa Cisal,ROMA,dalle ore 12.30 alle ore 16.30,https://www.cgsse.it/calendario-scioperi/dettaglio-sciopero/355314,true,2024-06-10,2024-06-10,2024-06-10,2024-06-10
14-06-2024,Trasporto pubblico locale,AUTOLINEE TOSCANE,Filt Cgil,MASSA CARRARA,dalle ore 08.30 alle ore 12.29 e dalle ore 14.30 alle ore 18.30,https://www.cgsse.it/calendario-scioperi/dettaglio-sciopero/355312,false,2024-06-14,2024-06-14,2024-06-14,2024-06-14
05-07-2024,Trasporto aereo,AIRPORT HANDLING,Cub Trasporti,NAZIONALE,dalle ore 00.00 alle 23.59,https://www.cgsse.it/calendario-scioperi/dettaglio-sciopero/355310,true,2024-07-05,2024-07-05,2024-07-05,2024-07-05
18-06-2024,Pulizie e multiservizi,COLSER,Fiadel,SALERNO,intero turno di lavoro,https://www.cgsse.it/calendario-scioperi/dettaglio-sciopero/355308,false,2024-06-18,2024-06-18,2024-06-18,2024-06-18
15-06-2024,Trasporto aereo,GH VENEZIA,Flai Trasporti E Servizi,VENEZIA,dalle ore 13.00 alle ore 17.00,https://www.cgsse.it/calendario-scioperi/dettaglio-sciopero/355306,true,2024-06-15,2024-06-15,2024-06-15,2024-06-15
15-06-2024,Trasporto aereo,SICURITALIA IVRI,Flai Trasporti E Servizi,VENEZIA,dalle ore 13.00 alle ore 17.00,https://www.cgsse.it/calendario-scioperi/dettaglio-sciopero/355304,true,2024-06-15,2024-06-15,2024-06-15,2024-06-15
15-06-2024,Trasporto aereo,AIR DOLOMITI,Uiltrasporti,NAZIONALE,intera giornata,https://www.cgsse.it/calendario-scioperi/dettaglio-sciopero/355300,true,2024-06-15,2024-06-15,2024-06-15,2024-06-15
12-06-2024,Distribuzione farmaci e logistica farmaceutica,FARVIMA MEDICINALI,Fiadel Cisal,NOLA,8 ore per tutti i turni di lavoro,https://www.cgsse.it/calendario-scioperi/dettaglio-sciopero/355298,true,2024-06-12,2024-06-12,2024-06-12,2024-06-12
18-06-2024,Igiene ambientale,"BLU WORK, CONSORZIO AIRONE, L'IGIENE URBANA EVOLUTION",Fiadel,ARDEA,tutti i turni di lavoro,https://www.cgsse.it/calendario-scioperi/dettaglio-sciopero/355296,false,2024-06-18,2024-06-18,2024-06-18,2024-06-18
12-06-2024,Distribuzione farmaci e logistica farmaceutica,FARVIMA MEDICINALI,Uiltucs,NOLA,8 ore per tutti i turni di lavoro,https://www.cgsse.it/calendario-scioperi/dettaglio-sciopero/355286,true,2024-06-12,2024-06-12,2024-06-12,2024-06-12
13-06-2024,Igiene ambientale,GF SCAVI,Fp Cgil,"RUVO DEL MONTE, RAPONE, SAN FELE",,https://www.cgsse.it/calendario-scioperi/dettaglio-sciopero/355282,false,2024-06-13,2024-06-13,2024-06-13,2024-06-13
25-06-2024,Avvocati,SETTORE GIUSTIZIA,Camera Penale Di Bari,BARI,astensione dalle udienze e da ogni attività giudiziaria nel settore penale,https://www.cgsse.it/calendario-scioperi/dettaglio-sciopero/355271,false,2024-06-25,2024-06-25,2024-06-25,2024-06-25
18-06-2024,Avvocati,SETTORE GIUSTIZIA,Camera Penale Di Bari,BARI,astensione dalle udienze e da ogni attività giudiziaria nel settore penale,https://www.cgsse.it/calendario-scioperi/dettaglio-sciopero/355269,false,2024-06-18,2024-06-18,2024-06-18,2024-06-18
26-06-2024,Trasporto pubblico locale,SGM,Uiltrasporti,LECCE,dalle ore 09:30 alle ore 12:30,https://www.cgsse.it/calendario-scioperi/dettaglio-sciopero/355263,false,2024-06-26,2024-06-26,2024-06-26,2024-06-26
07-06-2024,Trasporto pubblico locale,AUTOLINEE TOSCANE,Filt Cgil,MASSA CARRARA,dalle ore 08:30 alle ore 12:29 e dalle ore 17:00 alle ore 21:00,https://www.cgsse.it/calendario-scioperi/dettaglio-sciopero/355261,true,2024-06-07,2024-06-07,2024-06-07,2024-06-07
13-06-2024,Metalmeccanici,SIRAM,"Fiom Cgil, Fim Cisl, Uilm",CASERTA,sciopero di 8 ore,https://www.cgsse.it/calendario-scioperi/dettaglio-sciopero/355247,false,2024-06-13,2024-06-13,2024-06-13,2024-06-13
13-06-2024,Servizio sanitario nazionale,VANVITELLI FACILITY MANAGEMENT ( VFM ),"Fiom Cgil, Fim Cisl, Uilm",CASERTA,sciopero di 8 ore,https://www.cgsse.it/calendario-scioperi/dettaglio-sciopero/355243,false,2024-06-13,2024-06-13,2024-06-13,2024-06-13
28-06-2024,Regioni e autonomie Locali,"ASILI NIDO, SCUOLE COMUNALI",Csle,NAZIONALE,intera giornata personale docente e ata e tutto il personale educativo asili nido comunali a tempo determinato e indeterminato delle scuole comunali,https://www.cgsse.it/calendario-scioperi/dettaglio-sciopero/355229,false,2024-06-28,2024-06-28,2024-06-28,2024-06-28
13-06-2024,Metalmeccanici,CLANIUS,"Fiom Cgil, Uilm, Fim Cisl","VILLA LITERNO, SUCCIVO",sciopero di 8 ore,https://www.cgsse.it/calendario-scioperi/dettaglio-sciopero/355219,false,2024-06-13,2024-06-13,2024-06-13,2024-06-13
13-06-2024,Metalmeccanici,CODEMAR,"Fiom Cgil, Fim Cisl, Uilm",MARCIANISE,sciopero di 8 ore,https://www.cgsse.it/calendario-scioperi/dettaglio-sciopero/355214,false,2024-06-13,2024-06-13,2024-06-13,2024-06-13
13-06-2024,Metalmeccanici,NAPOLI NORD ORTA DI ATELLA,"Fiom Cgil, Fim Cisl, Uilm",ORTA DI ATELLA,sciopero di 8 ore,https://www.cgsse.it/calendario-scioperi/dettaglio-sciopero/355209,false,2024-06-13,2024-06-13,2024-06-13,2024-06-13
Dal 16-06-2024 al 17-06-2024,Trasporto ferroviario,"GRUPPO FSI, MERCITALIA RAIL, TRENITALIA, TRENITALIA TPER SCARL",Assemblea Nazionale Pdm/pdb,NAZIONALE,"dalle ore 03:00 del16/06 alle 02:00 del 17/06 per il personale trasporto viaggiatori operante per trenitalia, trenitalia tper scarl, gruppo fsi.",https://www.cgsse.it/calendario-scioperi/dettaglio-sciopero/355205,false,2024-06-16,2024-06-17,2024-06-16,
06-06-2024,Igiene ambientale,TEOREMA,Cobas Lavoro Privato,GROTTAGLIE,intera giornata,https://www.cgsse.it/calendario-scioperi/dettaglio-sciopero/355199,false,2024-06-06,2024-06-06,2024-06-06,2024-06-06
Dal 05-06-2024 al 06-06-2024,Taxi,SERVIZIO TAXI,"Fast Confsal, Satam, Tam, Usb Taxi, Unica Filt Cgil, Claai, Uritaxi, Uti, Unimpresa, Orsa Taxi, Ugl Taxi, Federtaxi Cisal, Sitan Atn, Unione Artigiani",NAZIONALE,dalle ore 08.00 alle ore 22.00 per le giornate del 5 e 6 giugno escluso il bacino della regione abruzzo,https://www.cgsse.it/calendario-scioperi/dettaglio-sciopero/355174,true,2024-06-05,2024-06-06,2024-06-05,
03-06-2024,Regioni e autonomie Locali,AMICO BUS,Usb Lavoro Privato,"CASCINA, CALCI",intera giornata,https://www.cgsse.it/calendario-scioperi/dettaglio-sciopero/355140,true,2024-06-03,2024-06-03,2024-06-03,2024-06-03
Dal 04-06-2024 al 05-06-2024,Regioni e autonomie Locali,AMICO BUS,Usb Lavoro Privato,PISA,intere giornate,https://www.cgsse.it/calendario-scioperi/dettaglio-sciopero/355097,true,2024-06-04,2024-06-05,2024-06-04,
04-06-2024,Servizio sanitario nazionale,MEDIACENTER CONFCOOPERATIVE AT SERVIZI,"Fisascat Cisl, Uiltucs, Filcams Cigl",MILANO,intera giornata,https://www.cgsse.it/calendario-scioperi/dettaglio-sciopero/355095,false,2024-06-04,2024-06-04,2024-06-04,2024-06-04
04-06-2024,Igiene ambientale,CONSORZIO GEMA,"Si Cobas, Fesica Confsal",ARZANO,dalle ore 00:01 alle ore 23:59,https://www.cgsse.it/calendario-scioperi/dettaglio-sciopero/355092,false,2024-06-04,2024-06-04,2024-06-04,2024-06-04
Dal 05-06-2024 al 06-06-2024,Taxi,SERVIZIO TAXI,Uiltrasporti,NAZIONALE,dalle ore 08:00 alle ore 22:00 per le giornate del 5 e 6 giugno escluso il bacino della regione abruzzo,https://www.cgsse.it/calendario-scioperi/dettaglio-sciopero/355074,true,2024-06-05,2024-06-06,2024-06-05,
21-06-2024,Trasporto pubblico locale,AST,Faisa Cisal,"RAGUSA , SIRACUSA , TRAPANI , PALERMO , MESSINA , CATANIA","da inizio servizio fino alle ore 06:30, dalle ore 09:30 alle ore 12:30 e dalle ore 15:30 a fine servizio",https://www.cgsse.it/calendario-scioperi/dettaglio-sciopero/355062,true,2024-06-21,2024-06-21,2024-06-21,2024-06-21
17-06-2024,Regioni e autonomie Locali,COMUNE DI BOLOGNA,Idi,BOLOGNA,intera giornata del personale di asili nido e scuole dell’infanzia comunali,https://www.cgsse.it/calendario-scioperi/dettaglio-sciopero/355060,false,2024-06-17,2024-06-17,2024-06-17,2024-06-17
03-06-2024,Trasporto ferroviario,RFI,"Filt Cgil, Fit Cisl, Uiltrasporti, Orsa Ferrovie, Slm Fast Confsal",PESCARA,dalle ore 09:01 alle ore 17:00,https://www.cgsse.it/calendario-scioperi/dettaglio-sciopero/355043,false,2024-06-03,2024-06-03,2024-06-03,2024-06-03
04-06-2024,Plurisettoriale nazionale,AZIENDE ADERENTI ALLE ASSOCIAZIONI DATORIALI ANIR E ANGEM,"Filcams Cgil, Fisascat Cisl, Uiltucs",NAZIONALE,intera giornata/intero turno,https://www.cgsse.it/calendario-scioperi/dettaglio-sciopero/355037,false,2024-06-04,2024-06-04,2024-06-04,2024-06-04
Dal 08-06-2024 al 10-06-2024,Servizio sanitario nazionale,USL ROMAGNA,Fials,"PIACENZA , PARMA , REGGIO NELL'EMILIA, MODENA , BOLOGNA , FERRARA",dalle ore 07:00 del 08/06 alle ore 07:00 del 10/06,https://www.cgsse.it/calendario-scioperi/dettaglio-sciopero/355033,false,2024-06-08,2024-06-10,2024-06-08,
03-06-2024,Trasporto pubblico locale,SEGESTA AUTOLINEE,Faisa Cisal,PALERMO,dalle ore 09:30 alle ore 13:30,https://www.cgsse.it/calendario-scioperi/dettaglio-sciopero/355031,false,2024-06-03,2024-06-03,2024-06-03,2024-06-03
Dal 03-06-2024 al 04-06-2024,Igiene ambientale,ROMA COSTRUZIONI,"Fp Cgil, Fit Cisl, Uiltrasporti",NOTO,intere giornate per tutti i turni di lavoro,https://www.cgsse.it/calendario-scioperi/dettaglio-sciopero/355024,false,2024-06-03,2024-06-04,2024-06-03,
14-06-2024,Trasporto pubblico locale,AIR,"Filt Cgil, Uiltrasporti, Ugl Fna, Faisa Cisal",AVELLINO,dalle ore 9.00 alle ore 13.00,https://www.cgsse.it/calendario-scioperi/dettaglio-sciopero/355014,true,2024-06-14,2024-06-14,2024-06-14,2024-06-14
03-06-2024,Trasporto ferroviario,RFI,Cub Trasporti,NAZIONALE,"intera prestazione, per le doit friuli venezia giulia, bologna, firenze, ancona marche,umbria e abruzzo l’astensione è ristretta a 8h per la doit nord trentino è ristretta a 23h30",https://www.cgsse.it/calendario-scioperi/dettaglio-sciopero/355009,false,2024-06-03,2024-06-03,2024-06-03,2024-06-03
10-06-2024,Servizio sanitario nazionale,ASL BRINDISI,Uil Fpl,BRINDISI,dalle ore 09:00 alle ore 12:00,https://www.cgsse.it/calendario-scioperi/dettaglio-sciopero/354992,false,2024-06-10,2024-06-10,2024-06-10,2024-06-10
14-06-2024,Trasporto pubblico locale,CSC MOBILITÀ,Ugl Fna,LATINA,"da inizio servizio alle ore 06:30, dalle ore 09.30 alle ore 13.30 e dalle ore 16:30 fino a fine servizio",https://www.cgsse.it/calendario-scioperi/dettaglio-sciopero/354990,false,2024-06-14,2024-06-14,2024-06-14,2024-06-14
Dal 08-07-2024 al 12-07-2024,Avvocati,SETTORE GIUSTIZIA,Consiglio Dell'ordine Degli Avvocati Di avellino,AVELLINO,astensione degli avvocati da tutte le attività giudiziarie civili dinanzi al giudice di pace di avellino,https://www.cgsse.it/calendario-scioperi/dettaglio-sciopero/354988,false,2024-07-08,2024-07-12,2024-07-08,
Dal 28-05-2024 al 29-05-2024,Trasporto marittimo,GSA,Filt Cgil,ANCONA,dalle ore 06:00 del 28/05 alle ore 06:00 del 29/05,https://www.cgsse.it/calendario-scioperi/dettaglio-sciopero/354985,false,2024-05-28,2024-05-29,2024-05-28,
03-06-2024,Trasporto pubblico locale,SETA,Orsa,"MODENA, PIACENZA, REGGIO NELL'EMILIA",dalle ore 16:01 alle ore 20:00,https://www.cgsse.it/calendario-scioperi/dettaglio-sciopero/354957,false,2024-06-03,2024-06-03,2024-06-03,2024-06-03
28-06-2024,Trasporto merci su rotaia,CFI,"Filt Cgil, Fit Cisl, Uiltrasporti",NAZIONALE,dalle ore 00.01 alle 7.59,https://www.cgsse.it/calendario-scioperi/dettaglio-sciopero/354955,true,2024-06-28,2024-06-28,2024-06-28,2024-06-28
04-06-2024,Trasporto pubblico locale,TUA,"Filt Cgil, Uiltrasporti, Faisa Cisal",TERAMO,dalle ore 09.00 alle ore 13.00,https://www.cgsse.it/calendario-scioperi/dettaglio-sciopero/354951,false,2024-06-04,2024-06-04,2024-06-04,2024-06-04
04-06-2024,Trasporto pubblico locale,TUA,"Filt Cgil, Fit Cisl, Uiltrasporti, Faisa Cisal",ABRUZZO,"dalle ore 09.00 alle ore 13.00 trasporto urbano ed extraurbano su gomma, ferroviario e biglietterie",https://www.cgsse.it/calendario-scioperi/dettaglio-sciopero/354938,false,2024-06-04,2024-06-04,2024-06-04,2024-06-04
Dal 06-07-2024 al 07-07-2024,Plurisettoriale nazionale,AZIENDE CHE SVOLGONO ATTIVITA FERROVIARIA,"Proclamante:Cub Trasporti, Sgb
Aderente:Assemblea Nazionale Pdm/pdb, Usb Lavoro Privato",NAZIONALE,dalle ore 21:00 del 6/07 alle ore 21:00 del 7/07 ad esclusione dei dipendenti di trenitalia con sede di lavoro nell’officina di santa maria la bruna (na),https://www.cgsse.it/calendario-scioperi/dettaglio-sciopero/354925,false,2024-07-06,2024-07-07,2024-07-06,
01-07-2024,Regioni e autonomie Locali,SCUOLE DELL’INFANZIA DELLA PROVINCIA DI TRENTO,"Cisl Scuola, Flc Cgil, Fgu Satos",TRENTO,intera giornata,https://www.cgsse.it/calendario-scioperi/dettaglio-sciopero/354922,true,2024-07-01,2024-07-01,2024-07-01,2024-07-01
Dal 03-06-2024 al 04-06-2024,Trasporto ferroviario,RFI,Orsa Ferrovie,VERONA,dalle ore 21:00 del 3/6 alle ore 20:59 del 4/6,https://www.cgsse.it/calendario-scioperi/dettaglio-sciopero/354889,false,2024-06-03,2024-06-04,2024-06-03,
23-09-2024,Servizio sanitario nazionale,AIOP,Ugl,NAZIONALE,intera giornata per ogni turno di lavoro,https://www.cgsse.it/calendario-scioperi/dettaglio-sciopero/354884,true,2024-09-23,2024-09-23,2024-09-23,2024-09-23
Dal 03-06-2024 al 04-06-2024,Trasporto ferroviario,RFI,Filt Cgil,TRENTINO ALTO ADIGE,dalle ore 21:01 del 03/06 alle ore 04:59 del 04/06,https://www.cgsse.it/calendario-scioperi/dettaglio-sciopero/354882,false,2024-06-03,2024-06-04,2024-06-03,
24-06-2024,Elettricità,GRUPPO HERA,"Filctem Cgil, Femca Cisl, Flaei Cisl, Uiltec Uil",NAZIONALE,intera giornata,https://www.cgsse.it/calendario-scioperi/dettaglio-sciopero/354875,true,2024-06-24,2024-06-24,2024-06-24,2024-06-24
23-06-2024,Trasporto pubblico locale,BUSITALIA SITA NORD,Faisa Cisal,UMBRIA,24 ore nel rispetto delle fasce di garanzia,https://www.cgsse.it/calendario-scioperi/dettaglio-sciopero/354867,true,2024-06-23,2024-06-23,2024-06-23,2024-06-23
06-06-2024,Scuola,ISTITUTO BENINI,"Flc Cgil, Uil Scuola Rua, Cisl Scuola, Snals Confsal",MELEGNANO,intera giornata,https://www.cgsse.it/calendario-scioperi/dettaglio-sciopero/354864,false,2024-06-06,2024-06-06,2024-06-06,2024-06-06
30-05-2024,Scuola,IIS GIOVANNI VALLE,Rsu,PADOVA,intera giornata,https://www.cgsse.it/calendario-scioperi/dettaglio-sciopero/354859,false,2024-05-30,2024-05-30,2024-05-30,2024-05-30
07-06-2024,Servizio sanitario nazionale,COOPSERVICE,Sgb,NAPOLI,intera giornata,https://www.cgsse.it/calendario-scioperi/dettaglio-sciopero/354857,false,2024-06-07,2024-06-07,2024-06-07,2024-06-07
24-06-2024,Igiene ambientale,GRUPPO HERA,"Fp Cgil, Fit Cisl, Uiltrasporti, Fiadel",NAZIONALE,intera giornata,https://www.cgsse.it/calendario-scioperi/dettaglio-sciopero/354855,true,2024-06-24,2024-06-24,2024-06-24,2024-06-24
31-05-2024,Vigili del fuoco,MINISTERO DELL'INTERNO,Usb Vvf,MASSA CARRARA,dalle ore 09.00 alle ore 13.00,https://www.cgsse.it/calendario-scioperi/dettaglio-sciopero/354850,false,2024-05-31,2024-05-31,2024-05-31,2024-05-31
Dal 16-06-2024 al 17-06-2024,Trasporto ferroviario,TRENORD,"Uiltrasporti, Orsa Ferrovie",LOMBARDIA,dalle ore 03:00 del 16/06 alle ore 02:00 del 17/06,https://www.cgsse.it/calendario-scioperi/dettaglio-sciopero/354848,false,2024-06-16,2024-06-17,2024-06-16,
31-05-2024,Trasporto pubblico locale,GRUPPO ATM,Al Cobas,"MILANO , MONZA E DELLA BRIANZA","gruppo atm personale viaggiante di superficie, metropolitana, agenti di stazione, serv. poma 08.45 -15.00 e 18,00-fine servizio, net - urbano monza: 09.00 -11.50 e 14.50-fine servizio, extraurbano trezzo 08.45-15.00 e 18.00-fine servizio",https://www.cgsse.it/calendario-scioperi/dettaglio-sciopero/354845,false,2024-05-31,2024-05-31,2024-05-31,2024-05-31
17-06-2024,Regioni e autonomie Locali,COMUNE DI BOLOGNA,Sgb,BOLOGNA,intera giornata escluso il personale della polizia locale,https://www.cgsse.it/calendario-scioperi/dettaglio-sciopero/354843,false,2024-06-17,2024-06-17,2024-06-17,2024-06-17
Dal 03-06-2024 al 05-06-2024,Avvocati,SETTORE GIUSTIZIA,Camera Penale Di Santa Maria Capua Vetere,SANTA MARIA CAPUA VETERE,astensione dalle udienze e da ogni attività giudiziarie nel settore penale,https://www.cgsse.it/calendario-scioperi/dettaglio-sciopero/354841,false,2024-06-03,2024-06-05,2024-06-03,
05-06-2024,Trasporto pubblico locale,TUA,"Filt Cgil, Fit Cisl, Uiltrasporti, Faisa Cisal",ABRUZZO,"dalle ore 09.00 alle ore 13.00 trasporto urbano ed extraurbano su gomma, ferroviario e biglietterie",https://www.cgsse.it/calendario-scioperi/dettaglio-sciopero/354839,true,2024-06-05,2024-06-05,2024-06-05,2024-06-05
Dal 26-05-2024 al 27-05-2024,Trasporto ferroviario,"GRUPPO FSI, TRENITALIA, TRENITALIA TPER SCARL",Assemblea Nazionale Pdm/pdb,NAZIONALE,dalle ore 3:00 del 26/05 alle ore 2:00 del 27/05,https://www.cgsse.it/calendario-scioperi/dettaglio-sciopero/354831,true,2024-05-26,2024-05-27,2024-05-26,
30-05-2024,Servizio sanitario nazionale,COOPERATIVA MORELLI,Cub Sanità,ROMA,intera giornata per l'intero turno di lavoro,https://www.cgsse.it/calendario-scioperi/dettaglio-sciopero/354811,false,2024-05-30,2024-05-30,2024-05-30,2024-05-30
23-09-2024,Sanità privata,AIOP-ARIS,"Fp Cgil, Fp Cisl, Uil Fpl",NAZIONALE,intera giornata per ogni turno di lavoro,https://www.cgsse.it/calendario-scioperi/dettaglio-sciopero/354804,true,2024-09-23,2024-09-23,2024-09-23,2024-09-23
31-05-2024,Servizio sanitario nazionale,SPECIALISTICA AMBULATORIALE,Uil Fpl,LOMBARDIA,intera giornata e/o turno di lavoro,https://www.cgsse.it/calendario-scioperi/dettaglio-sciopero/354796,false,2024-05-31,2024-05-31,2024-05-31,2024-05-31
28-05-2024,Trasporto aereo,WIZZ AIR MALTA LTD,Fit Cisl,NAZIONALE,dalle ore 13.00 alle ore 17.00 del personale navigante per tutti i voli in partenza dal territorio nazionale,https://www.cgsse.it/calendario-scioperi/dettaglio-sciopero/354792,false,2024-05-28,2024-05-28,2024-05-28,2024-05-28
28-05-2024,Pulizie e multiservizi,"CNS, DIEMME, GOSER, IBM, PULIM 2000",Cesil,NAPOLI,intera giornata,https://www.cgsse.it/calendario-scioperi/dettaglio-sciopero/354790,false,2024-05-28,2024-05-28,2024-05-28,2024-05-28
31-05-2024,Regioni e autonomie Locali,COMUNITA MONTANE,"Fai Cisl, Flai Cgil, Uila Uil",TOSCANA,intera giornata,https://www.cgsse.it/calendario-scioperi/dettaglio-sciopero/354788,false,2024-05-31,2024-05-31,2024-05-31,2024-05-31
21-06-2024,Regioni e autonomie Locali,COMUNE DI ERCOLANO,"Fp Cgil, Uil Fpl, Cisl Fp",ERCOLANO,dalle ore 10:00 alle ore 12:00,https://www.cgsse.it/calendario-scioperi/dettaglio-sciopero/354775,true,2024-06-21,2024-06-21,2024-06-21,2024-06-21
28-05-2024,Trasporto aereo,GH VERONA,Fit Cisl,VERONA,dalle ore 00.00 alle ore 23.59,https://www.cgsse.it/calendario-scioperi/dettaglio-sciopero/354755,false,2024-05-28,2024-05-28,2024-05-28,2024-05-28
03-06-2024,Trasporto pubblico locale,AST,Faisa Cisal,"RAGUSA , SIRACUSA , TRAPANI , PALERMO , MESSINA , CATANIA","da inizio servizio fino alle ore 06:30, dalle ore 09:30 alle ore 12:30 e dalle ore 15:30 a fine servizio",https://www.cgsse.it/calendario-scioperi/dettaglio-sciopero/354752,true,2024-06-03,2024-06-03,2024-06-03,2024-06-03
29-05-2024,Trasporto marittimo,ADRIAFER,"Ugl, Fit Cisl, Filt Cgil",TRIESTE,intera giornata,https://www.cgsse.it/calendario-scioperi/dettaglio-sciopero/354750,true,2024-05-29,2024-05-29,2024-05-29,2024-05-29
01-06-2024,Trasporto pubblico locale,MOM,"Filt Cgil, Faisa Cisal, Sgb",TREVISO,sono garantite le corse che iniziano il servizio dalle ore 05:00 alle 08:29 e dalle 12:30 alle 14:59 per il servizio urbano di treviso sono garantite le corse che iniziano dalle ore 05:00 alle 08:09 e dalle 12:10 alle 14:39,https://www.cgsse.it/calendario-scioperi/dettaglio-sciopero/354734,false,2024-06-01,2024-06-01,2024-06-01,2024-06-01
28-05-2024,Pulizie e multiservizi,"CNS, DIEMME, IBM GOSER PULIM",Usb Lavoro Privato,NAPOLI,intera giornata,https://www.cgsse.it/calendario-scioperi/dettaglio-sciopero/354730,false,2024-05-28,2024-05-28,2024-05-28,2024-05-28
28-05-2024,Pulizie e multiservizi,"CNS, IBM GOSER PULIM",Filcams Cgil,NAPOLI,intera giornata,https://www.cgsse.it/calendario-scioperi/dettaglio-sciopero/354727,false,2024-05-28,2024-05-28,2024-05-28,2024-05-28
30-05-2024,Trasporto pubblico locale,FERROVIE DELLA CALABRIA,Sul,CALABRIA,dalle ore 9.00 alle ore 17.00 e dalle ore 20.00 a fine servizio,https://www.cgsse.it/calendario-scioperi/dettaglio-sciopero/354716,false,2024-05-30,2024-05-30,2024-05-30,2024-05-30
31-05-2024,Avvocati,SETTORE GIUSTIZIA,Associazione Forense Isola D'ischia,ISCHIA,astensione da tutte le udienze civili e penali,https://www.cgsse.it/calendario-scioperi/dettaglio-sciopero/354713,false,2024-05-31,2024-05-31,2024-05-31,2024-05-31
Dal 27-05-2024 al 28-05-2024,Trasporto aereo,COOPSERVICE SCPA,Adl Cobas,VENEZIA,dalle ore 22:00 del 27/5 alle ore 22:00 del 28/5,https://www.cgsse.it/calendario-scioperi/dettaglio-sciopero/354709,true,2024-05-27,2024-05-28,2024-05-27,
03-06-2024,Trasporto ferroviario,RFI,Orsa Trasporti,TORINO,alle ore 9.01 alle ore 17.00,https://www.cgsse.it/calendario-scioperi/dettaglio-sciopero/354707,false,2024-06-03,2024-06-03,2024-06-03,2024-06-03
28-05-2024,Trasporto aereo,GH VERONA,Fit Cisl,VERONA,dalle ore 00.00 alle ore 23.59,https://www.cgsse.it/calendario-scioperi/dettaglio-sciopero/354700,true,2024-05-28,2024-05-28,2024-05-28,2024-05-28
Dal 24-05-2024 al 31-05-2024,Avvocati,SETTORE GIUSTIZIA,Camera Penale Di Nocera Inferiore,NOCERA INFERIORE,astensione dall'attività giudiziaria degli avvocati,https://www.cgsse.it/calendario-scioperi/dettaglio-sciopero/354698,false,2024-05-24,2024-05-31,2024-05-24,
28-05-2024,Trasporto aereo,SWISSPORT ITALIA,Cub Trasporti,MILANO,dalle ore 00.00 alle 23.59,https://www.cgsse.it/calendario-scioperi/dettaglio-sciopero/354695,false,2024-05-28,2024-05-28,2024-05-28,2024-05-28
28-05-2024,Trasporto aereo,AVIAPARTNER HANDLING,Cub Trasporti,"MILANO, VARESE",dalle ore 00.00 alle 23.59,https://www.cgsse.it/calendario-scioperi/dettaglio-sciopero/354693,false,2024-05-28,2024-05-28,2024-05-28,2024-05-28
28-05-2024,Trasporto aereo,AIRPORT HANDLING,Cub Trasporti,NAZIONALE,dalle ore 00.00 alle 23.59,https://www.cgsse.it/calendario-scioperi/dettaglio-sciopero/354691,false,2024-05-28,2024-05-28,2024-05-28,2024-05-28
12-07-2024,Trasporto ferroviario,TRENITALIA,"Filt Cgil, Fit Cisl, Uiltrasporti, Ugl Ferrovieri, Fast, Orsa",TORRE DEL GRECO,dalle ore 9.01 alle ore 16:59,https://www.cgsse.it/calendario-scioperi/dettaglio-sciopero/354660,false,2024-07-12,2024-07-12,2024-07-12,2024-07-12
03-06-2024,Trasporto ferroviario,RFI,Ugl Ferrovieri,TRIESTE,alle ore 9.01 alle ore 17.00,https://www.cgsse.it/calendario-scioperi/dettaglio-sciopero/354650,false,2024-06-03,2024-06-03,2024-06-03,2024-06-03
07-09-2024,Trasporto aereo,ENAV,Fast Confsal,NAZIONALE,dalle ore 13.00 alle ore 17.00,https://www.cgsse.it/calendario-scioperi/dettaglio-sciopero/354647,true,2024-09-07,2024-09-07,2024-09-07,2024-09-07
24-05-2024,Igiene ambientale,SEA SRL,"Fp Cgil, Fit Cisl, Uiltrasporti",ARAGONA,intera giornata,https://www.cgsse.it/calendario-scioperi/dettaglio-sciopero/354645,false,2024-05-24,2024-05-24,2024-05-24,2024-05-24
31-05-2024,Trasporto pubblico locale,TRENTINO TRASPORTI,Orsa Trasporti,TRENTO,dalle ore 11.00 alle ore 15.00,https://www.cgsse.it/calendario-scioperi/dettaglio-sciopero/354638,false,2024-05-31,2024-05-31,2024-05-31,2024-05-31
30-05-2024,Trasporto pubblico locale,EAV,Orsa Trasporti,NAPOLI,dalle 9.00 alle 13.00,https://www.cgsse.it/calendario-scioperi/dettaglio-sciopero/354636,false,2024-05-30,2024-05-30,2024-05-30,2024-05-30
22-05-2024,Servizio sanitario nazionale,DUSSMANN,Usb Lavoro Privato,LATINA,intera giornata lavorativa,https://www.cgsse.it/calendario-scioperi/dettaglio-sciopero/354633,false,2024-05-22,2024-05-22,2024-05-22,2024-05-22
03-06-2024,Trasporto pubblico locale,SETA,Usb Lavoro Privato,"MODENA, PIACENZA, REGGIO NELL'EMILIA",sciopero di 24 ore nel rispetto delle fasce di garanzia con modalità diversa per ogni bacino in merito agli accordi aziendali,https://www.cgsse.it/calendario-scioperi/dettaglio-sciopero/354630,false,2024-06-03,2024-06-03,2024-06-03,2024-06-03
27-05-2024,Trasporto pubblico locale,TPL LINEA,"Sial Cobas, Rsu",SAVONA,"da inizio turno alle ore 05:00, dalle ore 08:30 alle ore 17:30 e dalle ore 20:00 a fine turno.",https://www.cgsse.it/calendario-scioperi/dettaglio-sciopero/354627,true,2024-05-27,2024-05-27,2024-05-27,2024-05-27
27-05-2024,Trasporto pubblico locale,TPL LINEA,"Filt Cgil, Fit Cisl, Uiltrasporti, Faisa Cisal, Ugl Fna, Rsu",SAVONA,"da inizio turno alle ore 05:00, dalle ore 08:30 alle ore 17:30 e dalle ore 20:00 a fine turno.",https://www.cgsse.it/calendario-scioperi/dettaglio-sciopero/354624,true,2024-05-27,2024-05-27,2024-05-27,2024-05-27
03-06-2024,Trasporto ferroviario,RFI,"Proclamante:Cobas Lavoro Privato
Aderente:Fisi, Usb Lavoro Privato",NAZIONALE,"24 ore escluso doit di bologna, ancona, foligno, ancona, friuli venezia giulia che scioperano dalle 9.01 alle 17.00, unità territoriale nord – bolzano del trentino alto adige dalle 10.45 del 3/6 alle 10.15 del 4/6",https://www.cgsse.it/calendario-scioperi/dettaglio-sciopero/354617,false,2024-06-03,2024-06-03,2024-06-03,2024-06-03
03-06-2024,Trasporto ferroviario,RFI,"Proclamante:Assemblea Nazionale Lavoratori Manutenzione Rfi
Aderente:Fisi",NAZIONALE,"24 ore escluso doit di bologna, ancona, foligno, ancona, friuli venezia giulia che scioperano dalle 9.01 alle 17.00, unità territoriale nord – bolzano del trentino alto adige dalle 10.45 del 3/6 alle 10.15 del 4/6",https://www.cgsse.it/calendario-scioperi/dettaglio-sciopero/354615,false,2024-06-03,2024-06-03,2024-06-03,2024-06-03
20-05-2024,Regioni e autonomie Locali,LUPIAE SERVIZI,"Ugl Terziario, Slai Cobas",LECCE,intera giornata,https://www.cgsse.it/calendario-scioperi/dettaglio-sciopero/354613,false,2024-05-20,2024-05-20,2024-05-20,2024-05-20
03-06-2024,Trasporto ferroviario,RFI,"Filt Cgil, Fit Cisl, Uiltrasporti, Orsa",FRIULI VENEZIA GIULIA,dalle ore 09.01 alle ore 16.59,https://www.cgsse.it/calendario-scioperi/dettaglio-sciopero/354593,false,2024-06-03,2024-06-03,2024-06-03,2024-06-03
20-05-2024,Pulizie e multiservizi,ROMEO GESTIONI,Orsa Filsa,NAPOLI,intera giornata a partire dalle ore 06:00,https://www.cgsse.it/calendario-scioperi/dettaglio-sciopero/354583,false,2024-05-20,2024-05-20,2024-05-20,2024-05-20
20-05-2024,Igiene ambientale,TEKRA,Fp Cgil,TAORMINA,intera giornata,https://www.cgsse.it/calendario-scioperi/dettaglio-sciopero/354580,true,2024-05-20,2024-05-20,2024-05-20,2024-05-20
21-05-2024,Taxi,SERVIZIO TAXI,Uiltrasporti,NAZIONALE,dalle ore 08:00 alle ore 22:00 escluso il bacino della provincia di massa e carrara,https://www.cgsse.it/calendario-scioperi/dettaglio-sciopero/354577,false,2024-05-21,2024-05-21,2024-05-21,2024-05-21
11-06-2024,Regioni e autonomie Locali,COMUNE DI ERCOLANO,"Fp Cgil, Uil Fpl, Cisl Fp",ERCOLANO,dalle ore 10:00 alle ore 12:00,https://www.cgsse.it/calendario-scioperi/dettaglio-sciopero/354575,true,2024-06-11,2024-06-11,2024-06-11,2024-06-11
Dal 18-06-2024 al 19-06-2024,Trasporto ferroviario,MERCITALIA RAIL,"Ugl, Orsa",LIGURIA,dalle ore 21:01 del 18/06 alle ore 21:00 del 19/06,https://www.cgsse.it/calendario-scioperi/dettaglio-sciopero/354559,false,2024-06-18,2024-06-19,2024-06-18,
15-06-2024,Trasporto aereo,AVIAPARTNER HANDLING,Sgb,BOLOGNA,dalle ore 13.00 alle ore 17.00,https://www.cgsse.it/calendario-scioperi/dettaglio-sciopero/354546,false,2024-06-15,2024-06-15,2024-06-15,2024-06-15
23-05-2024,Ministeri,"COOPERATIVA NUOVI ORIZZONTI, RICINA, VERBATIM",Cobas Lavoro Privato,NAZIONALE,intero turno di lavoro,https://www.cgsse.it/calendario-scioperi/dettaglio-sciopero/354516,false,2024-05-23,2024-05-23,2024-05-23,2024-05-23
Dal 03-06-2024 al 04-06-2024,Trasporto ferroviario,RFI,"Uiltrasporti, Orsa",TRENTINO ALTO ADIGE,dalle ore 10:45 del 03/06 alle ore 10:15 del 04/06,https://www.cgsse.it/calendario-scioperi/dettaglio-sciopero/354514,false,2024-06-03,2024-06-04,2024-06-03,
28-05-2024,Trasporto aereo,AIR DOLOMITI,Uiltrasporti,NAZIONALE,intera giornata,https://www.cgsse.it/calendario-scioperi/dettaglio-sciopero/354511,false,2024-05-28,2024-05-28,2024-05-28,2024-05-28
17-05-2024,Radio e TV,RAI,Cisal Comunicazione,ROMA,dalle ore 18.40 alle ore 20.40,https://www.cgsse.it/calendario-scioperi/dettaglio-sciopero/354509,true,2024-05-17,2024-05-17,2024-05-17,2024-05-17
28-05-2024,Servizio sanitario nazionale,"GIMEDICAL, LGR MEDICAL SERVICES",Sgb,BOLOGNA,intera giornata lavorativa,https://www.cgsse.it/calendario-scioperi/dettaglio-sciopero/354506,false,2024-05-28,2024-05-28,2024-05-28,2024-05-28
17-05-2024,Pulizie e multiservizi,EBIT,Ugl,NAPOLI,intera giornata,https://www.cgsse.it/calendario-scioperi/dettaglio-sciopero/354504,false,2024-05-17,2024-05-17,2024-05-17,2024-05-17
07-05-2024,Plurisettoriale provinciale,SETTORI PRIVATI,"Cgil, Cisl, Uil",PALERMO,4 ore ad inizio di ogni turno di lavoro,https://www.cgsse.it/calendario-scioperi/dettaglio-sciopero/354501,false,2024-05-07,2024-05-07,2024-05-07,2024-05-07
Dal 18-05-2024 al 19-05-2024,Regioni e autonomie Locali,COMUNE DI VERONA,Csa,VERONA,"personale della polizia locale il 18 maggio prime 3 ore per ogni turno di lavoro, il 19 maggio ultime tre ore per ogni turno di lavoro",https://www.cgsse.it/calendario-scioperi/dettaglio-sciopero/354497,true,2024-05-18,2024-05-19,2024-05-18,
07-05-2024,Generale territoriale,CATEGORIE PUBBLICHE E PRIVATE,Usb,PALERMO,dalle ore 10.00 alle ore 14.00 escluso il corpo dei vigili del fuoco e del personale della protezione civile provinciale,https://www.cgsse.it/calendario-scioperi/dettaglio-sciopero/354492,false,2024-05-07,2024-05-07,2024-05-07,2024-05-07
07-05-2024,Plurisettoriale provinciale,SETTORI PRIVATI,Cisal,PALERMO,4 ore ad inizio di ogni turno di lavoro,https://www.cgsse.it/calendario-scioperi/dettaglio-sciopero/354490,false,2024-05-07,2024-05-07,2024-05-07,2024-05-07
17-05-2024,Regioni e autonomie Locali,AMICO BUS,Usb Lavoro Privato,PISA,intera giornata nel rispetto delle fasce di garanzia,https://www.cgsse.it/calendario-scioperi/dettaglio-sciopero/354488,false,2024-05-17,2024-05-17,2024-05-17,2024-05-17
21-05-2024,Regioni e autonomie Locali,COMUNE DI LEPORANO,Usb Pubblico Impiego,LEPORANO,dalle ore 12.00 alle ore 14.00 del personale non dirigente e della polizia locale,https://www.cgsse.it/calendario-scioperi/dettaglio-sciopero/354486,false,2024-05-21,2024-05-21,2024-05-21,2024-05-21
23-05-2024,Regioni e autonomie Locali,COMUNE DI PONTE SAN NICOLÒ,Cse Flpl,PONTE SAN NICOLO',intera giornata del personale della polizia locale,https://www.cgsse.it/calendario-scioperi/dettaglio-sciopero/354484,false,2024-05-23,2024-05-23,2024-05-23,2024-05-23
03-06-2024,Trasporto ferroviario,RFI,Ugl Ferrovieri,ABRUZZO,dalle ore 09.01 alle ore 17.00,https://www.cgsse.it/calendario-scioperi/dettaglio-sciopero/354481,false,2024-06-03,2024-06-03,2024-06-03,2024-06-03
17-05-2024,Trasporto ferroviario,RFI,Ugl Ferrovieri,TRIESTE,alle ore 9.01 alle ore 17.00,https://www.cgsse.it/calendario-scioperi/dettaglio-sciopero/354479,true,2024-05-17,2024-05-17,2024-05-17,2024-05-17
Dal 16-06-2024 al 17-06-2024,Trasporto ferroviario,TRENITALIA,"Filt Cgil, Fit Cisl, Uiltrasporti, Ugl Ferrovieri, Fast, Orsa",CAMPANIA,dalle ore 3:00 del 16/6 alle ore 2:00 del 17/6,https://www.cgsse.it/calendario-scioperi/dettaglio-sciopero/354470,false,2024-06-16,2024-06-17,2024-06-16,
21-07-2024,Trasporto aereo,ENAV,"Filt Cgil, Fit Cisl, Fast Confsal",BERGAMO,dalle ore 13.00 alle ore 17.00,https://www.cgsse.it/calendario-scioperi/dettaglio-sciopero/354463,false,2024-07-21,2024-07-21,2024-07-21,2024-07-21
17-05-2024,Trasporto pubblico locale,CSC MOBILITÀ,Faisa Cisal,LATINA,intera giornata,https://www.cgsse.it/calendario-scioperi/dettaglio-sciopero/354439,true,2024-05-17,2024-05-17,2024-05-17,2024-05-17
19-05-2024,Trasporto marittimo,PORTO LIVORNO 2000,"Filcams Cgil, Uiltucs Uil",LIVORNO,intera giornata,https://www.cgsse.it/calendario-scioperi/dettaglio-sciopero/354435,true,2024-05-19,2024-05-19,2024-05-19,2024-05-19
Dal 10-06-2024 al 11-06-2024,Radio e TV,RAI,"Proclamante:Slc Cgil, Uilcom Uil
Aderente:Fistel Cisl",SARDEGNA,intere giornate,https://www.cgsse.it/calendario-scioperi/dettaglio-sciopero/354424,false,2024-06-10,2024-06-11,2024-06-10,
21-05-2024,Taxi,SERVIZIO TAXI,"Fast Confsal, Satam, Tam, Usb Taxi, Unica Filt Cgil, Claai, Uritaxi, Uti, Unimpresa, Orsa Taxi, Ugl Taxi, Federtaxi Cisal, Sitan Atn, Unione Artigiani",NAZIONALE,dalle 00.00 alle 24.00 escluso il bacino della provincia di massa e carrara,https://www.cgsse.it/calendario-scioperi/dettaglio-sciopero/354418,false,2024-05-21,2024-05-21,2024-05-21,2024-05-21
28-05-2024,Trasporto aereo,"SACAL GH SPA, SACAL SPA",Orsa Trasporti,"LAMEZIA TERME, REGGIO DI CALABRIA, CROTONE",dalle ore 10.00 alle ore 12.00,https://www.cgsse.it/calendario-scioperi/dettaglio-sciopero/354393,false,2024-05-28,2024-05-28,2024-05-28,2024-05-28
15-05-2024,Servizio sanitario nazionale,ASUGI,"Fials, Fp Cgil",TRIESTE,interi turni di lavoro,https://www.cgsse.it/calendario-scioperi/dettaglio-sciopero/354385,false,2024-05-15,2024-05-15,2024-05-15,2024-05-15
20-05-2024,Regioni e autonomie Locali,"COOP. VE : RAGGIO DI SOLE, ABÙ, ASCOM, BABY GARDEN",Cisl Fp,NAPOLI,intera giornata,https://www.cgsse.it/calendario-scioperi/dettaglio-sciopero/354382,true,2024-05-20,2024-05-20,2024-05-20,2024-05-20
03-06-2024,Trasporto ferroviario,RFI,Orsa,"MARCHE, UMBRIA",dalle ore 09:01 alle ore 16:59,https://www.cgsse.it/calendario-scioperi/dettaglio-sciopero/354377,false,2024-06-03,2024-06-03,2024-06-03,2024-06-03
17-05-2024,Trasporto pubblico locale,TRENTINO TRASPORTI,Orsa Trasporti,TRENTO,dalle ore 11.00 alle ore 15.00,https://www.cgsse.it/calendario-scioperi/dettaglio-sciopero/354368,true,2024-05-17,2024-05-17,2024-05-17,2024-05-17
30-05-2024,Trasporto pubblico locale,EAV,Faisa Confail,NAPOLI,dalle 9.00 alle 13.00,https://www.cgsse.it/calendario-scioperi/dettaglio-sciopero/354366,false,2024-05-30,2024-05-30,2024-05-30,2024-05-30
21-05-2024,Trasporto pubblico locale,AUTOLINEE TOSCANE,Filt Cgil,MASSA CARRARA,dalle ore 08.30 alle ore 12.29,https://www.cgsse.it/calendario-scioperi/dettaglio-sciopero/354363,false,2024-05-21,2024-05-21,2024-05-21,2024-05-21
11-05-2024,Igiene ambientale,TEKRA,Usb Lavoro Privato,AVERSA,intera giornata,https://www.cgsse.it/calendario-scioperi/dettaglio-sciopero/354360,false,2024-05-11,2024-05-11,2024-05-11,2024-05-11
03-06-2024,Trasporto ferroviario,RFI,"Filt Cgil, Fit Cisl, Uiltrasporti, Ugl Ferrovieri, Orsa",FIRENZE,dalle ore 09.01 alle ore 17.00,https://www.cgsse.it/calendario-scioperi/dettaglio-sciopero/354352,false,2024-06-03,2024-06-03,2024-06-03,2024-06-03
27-05-2024,Trasporto pubblico locale,ARRIVA UDINE,Associazione Sindacale Indipendente,UDINE,dalle ore 17.15 alle ore 21.15,https://www.cgsse.it/calendario-scioperi/dettaglio-sciopero/354346,false,2024-05-27,2024-05-27,2024-05-27,2024-05-27
17-05-2024,Trasporto pubblico locale,MOVIBUS,Ugl Fna,MILANO,dalle ore 16:00 alle ore 20:00,https://www.cgsse.it/calendario-scioperi/dettaglio-sciopero/354344,false,2024-05-17,2024-05-17,2024-05-17,2024-05-17
31-05-2024,Appalti ferroviari,DUSSMANN SERVICE,"Filt Cgil, Fit Cisl, Uiltrasporti, Ugl Ferrovieri, Slm Fast, Orsa Salpas",CAMPANIA,intero turno di lavoro,https://www.cgsse.it/calendario-scioperi/dettaglio-sciopero/354342,false,2024-05-31,2024-05-31,2024-05-31,2024-05-31
03-06-2024,Trasporto ferroviario,RFI,"Filt Cgil, Fit Cisl, Uiltrasporti, Ugl, Fast Confsal","MARCHE, UMBRIA",dalle ore 09:01 alle ore 17:00,https://www.cgsse.it/calendario-scioperi/dettaglio-sciopero/354325,false,2024-06-03,2024-06-03,2024-06-03,2024-06-03
08-05-2024,Trasporto pubblico locale,AZIENDE DEL SETTORE,"Filt Cgil, Fit Cisl, Uiltrasporti, Ugl, Faisa Cisal",CAMPANIA,dalle ore 09:00 alle ore 13:00,https://www.cgsse.it/calendario-scioperi/dettaglio-sciopero/354317,true,2024-05-08,2024-05-08,2024-05-08,2024-05-08
30-05-2024,Regioni e autonomie Locali,COMUNITÀ RIVIERA FRIULANA,Cisal,"MUZZANA DEL TURGNANO, POCENIA, PRECENICCO, CARLINO, PALAZZOLO DELLO STELLA, MARANO LAGUNARE, SAN GIORGIO DI NOGARO, PORPETTO",intera giornata,https://www.cgsse.it/calendario-scioperi/dettaglio-sciopero/354306,false,2024-05-30,2024-05-30,2024-05-30,2024-05-30
Dal 08-05-2024 al 09-05-2024,Radio e TV,RAI,"Slc Cgil, Uilcom Uil, Fistel Cisl",SARDEGNA,intere giornate e/o turni di lavoro,https://www.cgsse.it/calendario-scioperi/dettaglio-sciopero/354288,true,2024-05-08,2024-05-09,2024-05-08,
03-06-2024,Trasporto ferroviario,RFI,"Filt Cgil, Fit Cisl, Uiltrasporti, Orsa",BOLOGNA,dalle ore 09:01 alle ore 17:00,https://www.cgsse.it/calendario-scioperi/dettaglio-sciopero/354278,false,2024-06-03,2024-06-03,2024-06-03,2024-06-03
12-05-2024,Regioni e autonomie Locali,COMUNE DI BOLOGNA,Snater,BOLOGNA,intera giornata,https://www.cgsse.it/calendario-scioperi/dettaglio-sciopero/354272,false,2024-05-12,2024-05-12,2024-05-12,2024-05-12
06-05-2024,Telecomunicazioni,ACANTHO,"Slc Cgil, Fistel Cisl, Uilcom Uil",EMILIA ROMAGNA,intera giornata,https://www.cgsse.it/calendario-scioperi/dettaglio-sciopero/354263,false,2024-05-06,2024-05-06,2024-05-06,2024-05-06
23-05-2024,Regioni e autonomie Locali,"NIDI DI INFANZIA COMUNALI ""FANTASIA DEI BIMBI"" E ""SACHEBURACHE""","Fp Cgil, Fp Cisl, Uil Fpl, Cisal, Eell Fvg",UDINE,dalle ore 11:00 alle ore 14:00,https://www.cgsse.it/calendario-scioperi/dettaglio-sciopero/354259,true,2024-05-23,2024-05-23,2024-05-23,2024-05-23
10-05-2024,Regioni e autonomie Locali,"NIDI DI INFANZIA COMUNALI ""FANTASIA DEI BIMBI"" E ""SACHEBURACHE""","Fp Cgil, Fp Cisl, Uil Fpl, Cisal, Eell Fvg",UDINE,intera giornata,https://www.cgsse.it/calendario-scioperi/dettaglio-sciopero/354248,false,2024-05-10,2024-05-10,2024-05-10,2024-05-10
06-05-2024,Regioni e autonomie Locali,COMUNE DI NOVARA,Cse Flpl,NOVARA,intera giornata lavorativa,https://www.cgsse.it/calendario-scioperi/dettaglio-sciopero/354234,false,2024-05-06,2024-05-06,2024-05-06,2024-05-06
Dal 06-05-2024 al 07-05-2024,Radio e TV,RAI,Usigrai,NAZIONALE,dalle ore 05.30 del 06/05 alle ore 05.30 del 07/05,https://www.cgsse.it/calendario-scioperi/dettaglio-sciopero/354232,false,2024-05-06,2024-05-07,2024-05-06,
31-05-2024,Trasporto pubblico locale,SIMOBIL,Uilt Sgk,BOLZANO,"da inizio servizio alle ore 6:00, dalle ore 9:00 alle ore 12:00 e dalle ore 15:00 a fine servizio",https://www.cgsse.it/calendario-scioperi/dettaglio-sciopero/354202,false,2024-05-31,2024-05-31,2024-05-31,2024-05-31
31-05-2024,Trasporto pubblico locale,SAD,Uilt Sgk,BOLZANO,"da inizio servizio alle ore 6.00, dalle ore 9.00 alle ore 18.00 e dalle ore 21.00 a fine servzio",https://www.cgsse.it/calendario-scioperi/dettaglio-sciopero/354195,false,2024-05-31,2024-05-31,2024-05-31,2024-05-31
28-05-2024,Trasporto aereo,ITALPOL,Usb Lavoro Privato,MILANO,dalle ore 00:00 alle ore 24:00,https://www.cgsse.it/calendario-scioperi/dettaglio-sciopero/354187,false,2024-05-28,2024-05-28,2024-05-28,2024-05-28
03-05-2024,Trasporto ferroviario,RFI,Usb Lavoro Privato,NAZIONALE,intera giornata,https://www.cgsse.it/calendario-scioperi/dettaglio-sciopero/354185,false,2024-05-03,2024-05-03,2024-05-03,2024-05-03
Dal 23-05-2024 al 24-05-2024,Servizio sanitario nazionale,ARNAS G.BROTZU,Nursing Up,CAGLIARI,dalle ore 00:00 del 23/05 alle ore 24:00 del 24/05,https://www.cgsse.it/calendario-scioperi/dettaglio-sciopero/354180,false,2024-05-23,2024-05-24,2024-05-23,
Dal 20-05-2024 al 27-05-2024,Avvocati,SETTORE GIUSTIZIA,Ordine Degli Avvocati Di Nuoro,NUORO,astensione dal lavoro del personale unep del tribunale di nuoro e del servizio di poste italiane riguardante la notifica degli atti giudiziari,https://www.cgsse.it/calendario-scioperi/dettaglio-sciopero/354172,false,2024-05-20,2024-05-27,2024-05-20,
Dal 27-05-2024 al 28-05-2024,Trasporto ferroviario,MERCITALIA RAIL,"Ugl, Orsa",LIGURIA,dalle ore 21:01 del 27/05 alle ore 21:00 del 28/05,https://www.cgsse.it/calendario-scioperi/dettaglio-sciopero/354167,true,2024-05-27,2024-05-28,2024-05-27,
08-05-2024,Igiene ambientale,CONSORZIO AQUARNO,"Filctem Cgil, Uiltrasporti, Usb Lavoro Privato",SANTA CROCE SULL'ARNO,sciopero di 4 ore a fine turno per ogni turno di lavoro,https://www.cgsse.it/calendario-scioperi/dettaglio-sciopero/354142,false,2024-05-08,2024-05-08,2024-05-08,2024-05-08
10-06-2024,Trasporto aereo,AVIAPARTNER HANDLING,Sgb,BOLOGNA,dalle ore 14.00 alle ore 18.00,https://www.cgsse.it/calendario-scioperi/dettaglio-sciopero/354126,true,2024-06-10,2024-06-10,2024-06-10,2024-06-10
13-05-2024,Regioni e autonomie Locali,COMUNE DI SAN GIUSEPPE VESUVIANO,"Fp Cgil, Uil Fpl",SAN GIUSEPPE VESUVIANO,dalle ore 09:00 alle ore 12:00,https://www.cgsse.it/calendario-scioperi/dettaglio-sciopero/354120,false,2024-05-13,2024-05-13,2024-05-13,2024-05-13
03-05-2024,Regioni e autonomie Locali,CIDAS COOPERATIVA SOCIALE,Usb Lavoro Privato,BOLOGNA,intera giornata,https://www.cgsse.it/calendario-scioperi/dettaglio-sciopero/354095,false,2024-05-03,2024-05-03,2024-05-03,2024-05-03
06-05-2024,Trasporto pubblico locale,SETA,Usb Lavoro Privato,"MODENA, PIACENZA, REGGIO NELL'EMILIA",sciopero di 4 ore nel rispetto delle fasce di garanzia per il personale viaggiante urbano ed extraurbano,https://www.cgsse.it/calendario-scioperi/dettaglio-sciopero/354082,false,2024-05-06,2024-05-06,2024-05-06,2024-05-06
17-05-2024,Trasporto ferroviario,RFI,"Filt Cgil, Fit Cisl, Uiltrasporti, Orsa",FRIULI VENEZIA GIULIA,dalle ore 09.01 alle ore 16.59,https://www.cgsse.it/calendario-scioperi/dettaglio-sciopero/354065,true,2024-05-17,2024-05-17,2024-05-17,2024-05-17
24-05-2024,Trasporto ferroviario,TRENITALIA,"Filt Cgil, Fit Cisl, Uiltrasporti, Ugl Ferrovieri, Fast, Orsa",TORRE DEL GRECO,dalle ore 9.01 alle ore 16:59,https://www.cgsse.it/calendario-scioperi/dettaglio-sciopero/354060,true,2024-05-24,2024-05-24,2024-05-24,2024-05-24
03-05-2024,Trasporto ferroviario,RFI,Cub Trasporti,NAZIONALE,intera prestazione della mattina dei lavoratori della manutenzione infrastruttura,https://www.cgsse.it/calendario-scioperi/dettaglio-sciopero/354053,false,2024-05-03,2024-05-03,2024-05-03,2024-05-03
17-05-2024,Trasporto pubblico locale,CSC MOBILITÀ,Ugl Fna,LATINA,"da inizio servizio alle ore 6.30, dalle ore 09.30 alle ore 13.30 e dalle ore 16.30 a fine servizio",https://www.cgsse.it/calendario-scioperi/dettaglio-sciopero/354047,false,2024-05-17,2024-05-17,2024-05-17,2024-05-17
Dal 06-05-2024 al 10-05-2024,Avvocati,SETTORE GIUSTIZIA,Camera Penale Irpina,AVELLINO,"astensione dalle attività giudiziarie, ivi comprese le udienze penali",https://www.cgsse.it/calendario-scioperi/dettaglio-sciopero/354027,false,2024-05-06,2024-05-10,2024-05-06,
Dal 13-05-2024 al 14-05-2024,Metalmeccanici,CONSORZIO NAPOLI NORD SCARL,Rsu,ORTA DI ATELLA,intera giornata per ogni turno di lavoro,https://www.cgsse.it/calendario-scioperi/dettaglio-sciopero/354025,true,2024-05-13,2024-05-14,2024-05-13,
06-05-2024,Igiene ambientale,GRUPPO HERA,"Fp Cgil, Fit Cisl, Uiltrasporti, Fiadel",NAZIONALE,intera giornata,https://www.cgsse.it/calendario-scioperi/dettaglio-sciopero/354016,false,2024-05-06,2024-05-06,2024-05-06,2024-05-06
03-05-2024,Trasporto ferroviario,RFI,Orsa Ferrovie,VERONA,dalle ore 09:00 alle ore 17:00,https://www.cgsse.it/calendario-scioperi/dettaglio-sciopero/354011,false,2024-05-03,2024-05-03,2024-05-03,2024-05-03
12-05-2024,Trasporto aereo,"ENAV, TECHNO SKY",Rsu,MILANO,dalle ore 13.00 alle ore 17.00,https://www.cgsse.it/calendario-scioperi/dettaglio-sciopero/353985,false,2024-05-12,2024-05-12,2024-05-12,2024-05-12
03-05-2024,Trasporto ferroviario,RFI,"Uiltrasporti, Orsa",TRENTINO ALTO ADIGE,dalle ore 09:01 alle ore 17:00,https://www.cgsse.it/calendario-scioperi/dettaglio-sciopero/353974,false,2024-05-03,2024-05-03,2024-05-03,2024-05-03
06-05-2024,Trasporto pubblico locale,CSC MOBILITÀ,Faisa Cisal,LATINA,intera giornata,https://www.cgsse.it/calendario-scioperi/dettaglio-sciopero/353971,true,2024-05-06,2024-05-06,2024-05-06,2024-05-06
01-06-2024,Trasporto pubblico locale,BUSITALIA SITA NORD,Faisa Cisal,UMBRIA,24 ore con il rispetto delle fasce di garanzia,https://www.cgsse.it/calendario-scioperi/dettaglio-sciopero/353966,true,2024-06-01,2024-06-01,2024-06-01,2024-06-01
11-05-2024,Trasporto pubblico locale,MOBILITÀ DI MARCA,"Filt Cgil, Faisa Cisal, Sgb",TREVISO,dalle ore 17.30 alle ore 21.30,https://www.cgsse.it/calendario-scioperi/dettaglio-sciopero/353964,false,2024-05-11,2024-05-11,2024-05-11,2024-05-11
Dal 29-04-2024 al 30-04-2024,Pulizie e multiservizi,PULITORI E AFFINI,Cub,"ISTRANA, TREVISO",dalle ore 23.59 del 29/4 alle ore 23.59 del 30/4,https://www.cgsse.it/calendario-scioperi/dettaglio-sciopero/353960,false,2024-04-29,2024-04-30,2024-04-29,
Dal 18-04-2024 al 25-04-2024,Igiene ambientale,CONSORZIO AQUARNO,"Filctem Cgil, Uiltrasporti, Usb Lavoro Privato",SANTA CROCE SULL'ARNO,stato di agitazione sindacale immediato con il blocco degli straordinari e dei tempi aggiuntivi di lavoro richiesti,https://www.cgsse.it/calendario-scioperi/dettaglio-sciopero/353958,false,2024-04-18,2024-04-25,2024-04-18,
30-04-2024,Igiene ambientale,CONSORZIO AQUARNO,"Filctem Cgil, Uiltrasporti, Usb Lavoro Privato",SANTA CROCE SULL'ARNO,sciopero di 4 ore a fine turno per ogni turno di lavoro,https://www.cgsse.it/calendario-scioperi/dettaglio-sciopero/353947,true,2024-04-30,2024-04-30,2024-04-30,2024-04-30
28-04-2024,Regioni e autonomie Locali,COMUNE DI VERONA,Csa,VERONA,intera giornata,https://www.cgsse.it/calendario-scioperi/dettaglio-sciopero/353941,false,2024-04-28,2024-04-28,2024-04-28,2024-04-28
06-05-2024,Poste,POSTE ITALIANE,"Cobas Poste Lavoro Privato, Slg Cub Poste, Cub Poste",NAZIONALE,ultime tre ore del turno lavorativo],https://www.cgsse.it/calendario-scioperi/dettaglio-sciopero/353939,false,2024-05-06,2024-05-06,2024-05-06,2024-05-06
Dal 17-04-2024 al 24-04-2024,Metalmeccanici,SEMAT ENGINEERING-ACCIAIERIE D'ITALIA,"Ugl Metalmeccanici, Rsu Rls",TARANTO,sciopero ad oltranza a partire dalle ore 23:00 del 17/04,https://www.cgsse.it/calendario-scioperi/dettaglio-sciopero/353929,true,2024-04-17,2024-04-24,2024-04-17,
29-04-2024,Sanità privata,ISTITUTO CLINICO HUMANITAS,"Fp Cgil, Uil Fpl",ROZZANO,intero turno di lavoro,https://www.cgsse.it/calendario-scioperi/dettaglio-sciopero/353918,false,2024-04-29,2024-04-29,2024-04-29,2024-04-29
17-06-2024,Regioni e autonomie Locali,COMUNE DI BOLOGNA,Sgb,BOLOGNA,intera giornata per tutto il personale dei servizi 0-6,https://www.cgsse.it/calendario-scioperi/dettaglio-sciopero/353844,false,2024-06-17,2024-06-17,2024-06-17,2024-06-17
02-05-2024,Pulizie e multiservizi,"CNS, DIEMME, GOSER, IBM, PULIM 2000",Cesil,NAPOLI,4 ore ad inizio turno,https://www.cgsse.it/calendario-scioperi/dettaglio-sciopero/353842,false,2024-05-02,2024-05-02,2024-05-02,2024-05-02
04-05-2024,Igiene ambientale,GREEN LINE,"Fp Cgil, Fit Cisl, Fiadel",CAIVANO,intera giornata,https://www.cgsse.it/calendario-scioperi/dettaglio-sciopero/353840,true,2024-05-04,2024-05-04,2024-05-04,2024-05-04
06-05-2024,Trasporto pubblico locale,AZIENDE TRASPORTO PUBBLICO LOCALE,Al Cobas,NAZIONALE,"intera giornata con articolazione a livello locale, escluse le aziende tpl linea di savona; sun di novara; mobilità di marca di treviso]",https://www.cgsse.it/calendario-scioperi/dettaglio-sciopero/353836,false,2024-05-06,2024-05-06,2024-05-06,2024-05-06
06-05-2024,Trasporto pubblico locale,FERROVIE DELLA CALABRIA,Sul,CALABRIA,dalle ore 11.30 alle ore 15.30,https://www.cgsse.it/calendario-scioperi/dettaglio-sciopero/353779,false,2024-05-06,2024-05-06,2024-05-06,2024-05-06
13-05-2024,Trasporto aereo,AVIAPARTNER HANDLING,Sgb,BOLOGNA,dalle ore 14.00 alle ore 18.00,https://www.cgsse.it/calendario-scioperi/dettaglio-sciopero/353775,true,2024-05-13,2024-05-13,2024-05-13,2024-05-13
06-05-2024,Trasporto pubblico locale,AST,"Proclamante:Faisa Cisal
Aderente:Fast Confsal","RAGUSA , SIRACUSA , TRAPANI , PALERMO , MESSINA , CATANIA",dalle ore 05:30 alle ore 06:30 e dalle ore 09:30 alle ore 12:30,https://www.cgsse.it/calendario-scioperi/dettaglio-sciopero/353773,false,2024-05-06,2024-05-06,2024-05-06,2024-05-06
Dal 29-04-2024 al 03-05-2024,Trasporto merci su gomma,IMPRESE VETTORI OPERANTI PER CONTO DEL GRUPPO BRT,Assotir,NAZIONALE,"dalle ore 00.00 del 29 aprile alle ore 24,00 del 3 maggio",https://www.cgsse.it/calendario-scioperi/dettaglio-sciopero/353771,true,2024-04-29,2024-05-03,2024-04-29,
26-04-2024,Radio e TV,RAI,Cisal Comunicazione,ROMA,dalle ore 18.40 alle ore 20.40,https://www.cgsse.it/calendario-scioperi/dettaglio-sciopero/353768,false,2024-04-26,2024-04-26,2024-04-26,2024-04-26
10-05-2024,Trasporto pubblico locale,SIMOBIL,Uilt Sgk,BOLZANO,"da inizio servizio alle ore 6:00, dalle ore 9:00 alle ore 12:00 e dalle ore 15:00 a fine servizio",https://www.cgsse.it/calendario-scioperi/dettaglio-sciopero/353766,true,2024-05-10,2024-05-10,2024-05-10,2024-05-10
15-05-2024,Igiene ambientale,ROMA COSTRUZIONI SRL,"Fp Cgil, Fit Cisl, Uiltrasporti",NOTO,intera giornata per tutti i turni di lavoro,https://www.cgsse.it/calendario-scioperi/dettaglio-sciopero/353764,false,2024-05-15,2024-05-15,2024-05-15,2024-05-15
22-04-2024,Pulizie e multiservizi,ISS ITALIA,"Fisascat Cisl, Uiltrasporti",CASERTA,intera giornata o turno di lavoro,https://www.cgsse.it/calendario-scioperi/dettaglio-sciopero/353760,false,2024-04-22,2024-04-22,2024-04-22,2024-04-22
30-04-2024,Servizio sanitario nazionale,"GIMEDICAL, LGR MEDICAL SERVICES",Sgb,BOLOGNA,intera giornata,https://www.cgsse.it/calendario-scioperi/dettaglio-sciopero/353754,false,2024-04-30,2024-04-30,2024-04-30,2024-04-30
03-05-2024,Trasporto ferroviario,RFI,Usb Lavoro Privato,NAZIONALE,intera giornata,https://www.cgsse.it/calendario-scioperi/dettaglio-sciopero/353748,true,2024-05-03,2024-05-03,2024-05-03,2024-05-03
10-05-2024,Trasporto pubblico locale,SAD,Uilt Sgk,BOLZANO,"da inizio servizio alle ore 6.00, dalle ore 9.00 alle ore 18.00 e dalle ore 21.00 a fine servzio",https://www.cgsse.it/calendario-scioperi/dettaglio-sciopero/353739,true,2024-05-10,2024-05-10,2024-05-10,2024-05-10
Dal 30-05-2024 al 31-05-2024,Servizio sanitario nazionale,SERVIZIO SANITARIO NAZIONALE,"Proclamante:Fmt
Aderente:Uil Fpl",PIEMONTE,intere giornate o turni di lavoro dei medici della medicina generale,https://www.cgsse.it/calendario-scioperi/dettaglio-sciopero/353737,false,2024-05-30,2024-05-31,2024-05-30,
09-05-2024,Scuola,MIM,Cobas Scuola,NAZIONALE,intera giornata,https://www.cgsse.it/calendario-scioperi/dettaglio-sciopero/353730,false,2024-05-09,2024-05-09,2024-05-09,2024-05-09
06-05-2024,Trasporto pubblico locale,AZIENDE TRASPORTO PUBBLICO LOCALE,"Proclamante:Cobas Lavoro Privato, Adl Cobas, Sgb, Cub Trasporti
Aderente:Usb",NAZIONALE,"intera giornata, escluso dallo sciopero tpl linea (savona), sun novara, mobilità di marca (treviso)",https://www.cgsse.it/calendario-scioperi/dettaglio-sciopero/353721,false,2024-05-06,2024-05-06,2024-05-06,2024-05-06
15-05-2024,Plurisettoriale territoriale,COOPERATIVE SOCIALI,Sgb,BOLOGNA,intera giornata,https://www.cgsse.it/calendario-scioperi/dettaglio-sciopero/353711,false,2024-05-15,2024-05-15,2024-05-15,2024-05-15
06-05-2024,Trasporto pubblico locale,AUTOFFICINA POMPONI,Usb Lavoro Privato,ROMA,alle ore 00.00 alle ore 23.59,https://www.cgsse.it/calendario-scioperi/dettaglio-sciopero/353709,false,2024-05-06,2024-05-06,2024-05-06,2024-05-06
01-06-2024,Trasporto pubblico locale,AMAT,"Filt Cgil, Fit Cisl, Uiltrasporti, Faisa Cisal, Cobas Trasporti, Orsa Trasporti",PALERMO,dalle ore 08:30 alle ore 17:30],https://www.cgsse.it/calendario-scioperi/dettaglio-sciopero/353702,true,2024-06-01,2024-06-01,2024-06-01,2024-06-01
09-05-2024,Scuola,MIM,Usb Pubblico Impiego Scuola,NAZIONALE,intera giornata,https://www.cgsse.it/calendario-scioperi/dettaglio-sciopero/353695,false,2024-05-09,2024-05-09,2024-05-09,2024-05-09
14-05-2024,Ministeri,LADISA SPA,Cub Trasporti,GENOVA,intera giornata,https://www.cgsse.it/calendario-scioperi/dettaglio-sciopero/353690,false,2024-05-14,2024-05-14,2024-05-14,2024-05-14
22-04-2024,Trasporto ferroviario,TRENITALIA,Orsa Trasporti,PIEMONTE,dalle ore 9.00 alle ore 17.00 del personale dbr addetti alla manutenzione e pulizia,https://www.cgsse.it/calendario-scioperi/dettaglio-sciopero/353688,false,2024-04-22,2024-04-22,2024-04-22,2024-04-22
24-04-2024,Avvocati,SETTORE GIUSTIZIA,Camera Penale Di Santa Maria Capua Vetere,SANTA MARIA CAPUA VETERE,astensione dalle udienze e da ogni attività giudiziarie nel settore penale,https://www.cgsse.it/calendario-scioperi/dettaglio-sciopero/353675,false,2024-04-24,2024-04-24,2024-04-24,2024-04-24
30-04-2024,Trasporto merci su gomma,DISTRIBUZIONE MODERNA ORGANIZZATA-FEDERDISTRIBUZIONE,"Filcams Cgil, Fisascat Cisl, Uiltucs",MOLISE,sciopero di 8 ore,https://www.cgsse.it/calendario-scioperi/dettaglio-sciopero/353673,true,2024-04-30,2024-04-30,2024-04-30,2024-04-30
05-07-2024,Trasporto aereo,ENAV,"Fit Cisl, Ugl Ta, Fast Confsal Av Unica",NAZIONALE,dalle ore 13:00 alle ore 17:00,https://www.cgsse.it/calendario-scioperi/dettaglio-sciopero/353668,false,2024-07-05,2024-07-05,2024-07-05,2024-07-05
11-04-2024,Generale regionale,SETTORI PUBBLICI E PRIVATI,Cobas,EMILIA ROMAGNA,intera giornata,https://www.cgsse.it/calendario-scioperi/dettaglio-sciopero/353664,false,2024-04-11,2024-04-11,2024-04-11,2024-04-11
23-05-2024,Plurisettoriale territoriale,"COMPARTI SEI SERVIZI PUBBLICI E PRIVATI AFFERENTI AI COMPARTI SANITÀ, FUNZIONI CENTRALI, FUNZIONI LOCALI, IGIENE AMBIENTALE , 3* SETTORE (SERVIZI SOCIO ASSISTENZIALI EDUCATIVI PRIVATI)","Proclamante:Fp Cgil
Aderente:Fit Cisl, Fiadel, Uiltrasporti",BOLOGNA,intera giornata e/o turno di lavoro,https://www.cgsse.it/calendario-scioperi/dettaglio-sciopero/353659,false,2024-05-23,2024-05-23,2024-05-23,2024-05-23
21-04-2024,Regioni e autonomie Locali,"COOP CULTURE, DUSSMANN SERVICE SRL","Usb Lavoro Privato, Usb Slang",MILANO,intera giornata operatori di sala musei civici di milano,https://www.cgsse.it/calendario-scioperi/dettaglio-sciopero/353654,false,2024-04-21,2024-04-21,2024-04-21,2024-04-21
11-04-2024,Generale regionale,SETTORI PUBBLICI E PRIVATI,Usb,EMILIA ROMAGNA,ad esclusione dei vigili del fuoco e del personale della protezione civile.per il tpl e ferrovie lo sciopero sarà di 4 ore nelle modalità previste nei propri bacini.],https://www.cgsse.it/calendario-scioperi/dettaglio-sciopero/353583,false,2024-04-11,2024-04-11,2024-04-11,2024-04-11
24-05-2024,Ministeri,MINISTERO DELL'INTERNO,Fp Cgil,NAZIONALE,intera giornata,https://www.cgsse.it/calendario-scioperi/dettaglio-sciopero/353581,false,2024-05-24,2024-05-24,2024-05-24,2024-05-24
11-04-2024,Elettricità,ENEL,"Filctem Cgil, Uiltec",NAZIONALE,tutti i lavoratori del gruppo enel,https://www.cgsse.it/calendario-scioperi/dettaglio-sciopero/353579,false,2024-04-11,2024-04-11,2024-04-11,2024-04-11
11-04-2024,Generale regionale,SETTORI PUBBLICI E PRIVATI,Sgb,EMILIA ROMAGNA,intera giornata,https://www.cgsse.it/calendario-scioperi/dettaglio-sciopero/353537,false,2024-04-11,2024-04-11,2024-04-11,2024-04-11
11-04-2024,Generale regionale,SETTORI PUBBLICI E PRIVATI,"Proclamante:Cgil, Uil
Aderente:Sic, Uilcom, Flc Cgil, Uil Scuola Rua, Flai Cgil, Uila, Filt Cgil, Filcams Cgil, Uiltrasporti, Nidil Cgil, Uiltemp",EMILIA ROMAGNA,intero turno di lavoro,https://www.cgsse.it/calendario-scioperi/dettaglio-sciopero/353534,false,2024-04-11,2024-04-11,2024-04-11,2024-04-11
06-05-2024,Igiene ambientale,REA,Usb,"CASTELLINA MARITTIMA, MONTEVERDI MARITTIMO, MONTESCUDAIO, ORCIANO PISANO, SANTA LUCE, CASTELNUOVO DI VAL DI CECINA, RIPARBELLA, CECINA, CASALE MARITTIMO, ROSIGNANO MARITTIMO, VOLTERRA, CAPRAIA ISOLA, MONTECATINI VAL DI CECINA, POMARANCE, COLLESALVETTI, GUARDISTALLO, BIBBONA",,https://www.cgsse.it/calendario-scioperi/dettaglio-sciopero/353531,false,2024-05-06,2024-05-06,2024-05-06,2024-05-06
22-04-2024,Trasporto ferroviario,TRENITALIA,"Filt Cgil, Fit Cisl, Uiltrasporti, Ugl Ferrovieri, Fast Confsal",PIEMONTE,dalle ore 9.00 alle ore 17.00 del personale dbr manutenzione e pulizia regionale,https://www.cgsse.it/calendario-scioperi/dettaglio-sciopero/353528,false,2024-04-22,2024-04-22,2024-04-22,2024-04-22
10-04-2024,Elettricità,GRUPPO ENEL,Flaei Cisl,NAZIONALE,ultime 4 ore lavorative,https://www.cgsse.it/calendario-scioperi/dettaglio-sciopero/353520,false,2024-04-10,2024-04-10,2024-04-10,2024-04-10
Dal 06-05-2024 al 08-05-2024,Avvocati,SETTORE GIUSTIZIA,Camera Penale Di Firenze,FIRENZE,astensione dalle udienze e e dalle attività giudiziarie nel settore penale,https://www.cgsse.it/calendario-scioperi/dettaglio-sciopero/353518,false,2024-05-06,2024-05-08,2024-05-06,
09-05-2024,Servizio sanitario nazionale,ASUGI,"Fials, Fp Cgil",TRIESTE,dalle ore 08:00 alle ore 10:00,https://www.cgsse.it/calendario-scioperi/dettaglio-sciopero/353507,false,2024-05-09,2024-05-09,2024-05-09,2024-05-09
28-05-2024,Trasporto aereo,SICURITALIA IVRI,Flai Trasporti E Servizi,VENEZIA,intera giornata,https://www.cgsse.it/calendario-scioperi/dettaglio-sciopero/353494,false,2024-05-28,2024-05-28,2024-05-28,2024-05-28
26-04-2024,Trasporto aereo,SICURITALIA IVRI,Flai Trasporti E Servizi,VENEZIA,intera giornata,https://www.cgsse.it/calendario-scioperi/dettaglio-sciopero/353489,true,2024-04-26,2024-04-26,2024-04-26,2024-04-26
28-05-2024,Trasporto aereo,GH VENEZIA,Flai Trasporti E Servizi,VENEZIA,intera giornata,https://www.cgsse.it/calendario-scioperi/dettaglio-sciopero/353485,false,2024-05-28,2024-05-28,2024-05-28,2024-05-28
26-04-2024,Trasporto aereo,GH VENEZIA,Flai Trasporti E Servizi,VENEZIA,intera giornata,https://www.cgsse.it/calendario-scioperi/dettaglio-sciopero/353480,true,2024-04-26,2024-04-26,2024-04-26,2024-04-26
22-04-2024,Regioni e autonomie Locali,COMUNE DI MILANO,"Uil Fpl, Sulpl, Usb Pubblico Impiego",MILANO,intera giornata del personale della polizia locale],https://www.cgsse.it/calendario-scioperi/dettaglio-sciopero/353471,true,2024-04-22,2024-04-22,2024-04-22,2024-04-22
03-05-2024,Trasporto ferroviario,RFI,"Cobas Lavoro Privato, Coordinamento Ferrovieri",NAZIONALE,24 ore (intera prestazione lavorativa),https://www.cgsse.it/calendario-scioperi/dettaglio-sciopero/353467,false,2024-05-03,2024-05-03,2024-05-03,2024-05-03
03-05-2024,Trasporto ferroviario,RFI,Assemblea Nazionale Lavoratori Manutenzione Rfi,NAZIONALE,24 ore (intera prestazione lavorativa),https://www.cgsse.it/calendario-scioperi/dettaglio-sciopero/353463,false,2024-05-03,2024-05-03,2024-05-03,2024-05-03
Dal 16-05-2024 al 17-05-2024,Trasporto ferroviario,MERCITALIA RAIL,Assemblea Nazionale Pdm/pdb,NAZIONALE,dalle ore 21:00 del 16/05 alle ore 20:59 del 17/05 del personale di macchina,https://www.cgsse.it/calendario-scioperi/dettaglio-sciopero/353460,false,2024-05-16,2024-05-17,2024-05-16,
Dal 19-05-2024 al 20-05-2024,Trasporto ferroviario,"GRUPPO FSI, TRENITALIA, TRENITALIA TPER SCARL",Assemblea Nazionale Pdm/pdb,NAZIONALE,dalle ore 3:00 del 19/05 alle ore 2:00 del 20/05,https://www.cgsse.it/calendario-scioperi/dettaglio-sciopero/353458,true,2024-05-19,2024-05-20,2024-05-19,
26-04-2024,Trasporto pubblico locale,AUTOFFICINA POMPONI,Usb Lavoro Privato,ROMA,alle ore 00.00 alle ore 23.59,https://www.cgsse.it/calendario-scioperi/dettaglio-sciopero/353452,true,2024-04-26,2024-04-26,2024-04-26,2024-04-26
22-04-2024,Servizio sanitario nazionale,COOPERATIVA MORELLI,"Filcams Cgil, Fisascat Cisl",VERONA,intera giornata,https://www.cgsse.it/calendario-scioperi/dettaglio-sciopero/353445,false,2024-04-22,2024-04-22,2024-04-22,2024-04-22
06-05-2024,Trasporto pubblico locale,FAL,Usb Lavoro Privato,"MATERA, BARI, GRAVINA IN PUGLIA",dalle ore 15:40 alle ore 19:40,https://www.cgsse.it/calendario-scioperi/dettaglio-sciopero/353439,false,2024-05-06,2024-05-06,2024-05-06,2024-05-06
30-06-2024,Regioni e autonomie Locali,COMUNE DI BOLOGNA,Sgb,BOLOGNA,intera giornata del personale della polizia locale,https://www.cgsse.it/calendario-scioperi/dettaglio-sciopero/353437,false,2024-06-30,2024-06-30,2024-06-30,2024-06-30
16-05-2024,Trasporto pubblico locale,"ETNA TRASPORTI, INTERBUS, SEGESTA AUTOLINEE, SICILBUS",Fit Cisl,"PALERMO , ENNA , CATANIA",dalle ore 00.00 alle ore 24.00 nel rispetto delle fasce di garanzia con modalità diversa per ogni bacino di utenza in merito agli accordi aziendali,https://www.cgsse.it/calendario-scioperi/dettaglio-sciopero/353435,false,2024-05-16,2024-05-16,2024-05-16,2024-05-16
06-05-2024,Trasporto pubblico locale,AZIENDE TRASPORTO PUBBLICO LOCALE,Usb Lavoro Privato,NAZIONALE,"24 ore con articolazione aziendale escluso le aziende tpl linea di savona, sun di novara e mobilità di marca di treviso",https://www.cgsse.it/calendario-scioperi/dettaglio-sciopero/353433,false,2024-05-06,2024-05-06,2024-05-06,2024-05-06
01-05-2024,Generale nazionale,PERSONALE DIPENDENTE PUBBLICO E PRIVATO,Usi Cit,NAZIONALE,"intera giornata. sono esclusi dallo sciopero i settori: trasporto aereo; trasporto ferroviario; appalti ferroviari; trasporto marittimo società liberty lines; circolazione e sicurezza stradale, carburanti.",https://www.cgsse.it/calendario-scioperi/dettaglio-sciopero/353427,false,2024-05-01,2024-05-01,2024-05-01,2024-05-01
09-04-2024,Pulizie e multiservizi,EURO & PROMOS,Usb Lavoro Privato,CREMONA,intera giornata,https://www.cgsse.it/calendario-scioperi/dettaglio-sciopero/353422,false,2024-04-09,2024-04-09,2024-04-09,2024-04-09
11-04-2024,Pulizie e multiservizi,EURO & PROMOS,Usb Lavoro Privato,CREMONA,intera giornata,https://www.cgsse.it/calendario-scioperi/dettaglio-sciopero/353418,true,2024-04-11,2024-04-11,2024-04-11,2024-04-11
04-04-2024,Pulizie e multiservizi,EURO & PROMOS,Usb Lavoro Privato,CREMONA,intera giornata,https://www.cgsse.it/calendario-scioperi/dettaglio-sciopero/353416,true,2024-04-04,2024-04-04,2024-04-04,2024-04-04
23-04-2024,Elettricità,A2A ENERGIETURESPA,"Filctem Cgil, Flaei Cisl, Uiltec",SAN FILIPPO DEL MELA,prime 4 ore del turno,https://www.cgsse.it/calendario-scioperi/dettaglio-sciopero/353414,false,2024-04-23,2024-04-23,2024-04-23,2024-04-23
Dal 27-04-2024 al 28-04-2024,Radio e TV,RAI,Usigrai,ROMA,dalle ore 00:30 del 27/04 alle ore 00:30 del 28/04 dei giornalisti della testata giornale radio rai,https://www.cgsse.it/calendario-scioperi/dettaglio-sciopero/353245,false,2024-04-27,2024-04-28,2024-04-27,
24-05-2024,"Scuola, Regioni e autonomie Locali","AMMINISTRAZIONI COMUNALI, MIM",Csle,NAZIONALE,intera giornata per tutto il personale docente e ata a tempo determinato e indeterminato delle scuole pubbliche comunali e private,https://www.cgsse.it/calendario-scioperi/dettaglio-sciopero/353226,false,2024-05-24,2024-05-24,2024-05-24,2024-05-24
08-04-2024,Igiene ambientale,ATI SOC. COOP,Usb Lavoro Privato,PISA,intera giornata,https://www.cgsse.it/calendario-scioperi/dettaglio-sciopero/353211,true,2024-04-08,2024-04-08,2024-04-08,2024-04-08
22-04-2024,Avvocati,SETTORE GIUSTIZIA,Associazione Forense Isola D'ischia,ISCHIA,astensione da tutte le udienze civili e penali,https://www.cgsse.it/calendario-scioperi/dettaglio-sciopero/353209,false,2024-04-22,2024-04-22,2024-04-22,2024-04-22
10-05-2024,Trasporto pubblico locale,SUN,Ugl Autoferro,NOVARA,dalle ore 17.30 alle ore 21.30,https://www.cgsse.it/calendario-scioperi/dettaglio-sciopero/353207,false,2024-05-10,2024-05-10,2024-05-10,2024-05-10
Dal 22-04-2024 al 23-04-2024,Servizio sanitario nazionale,INNOTEC,Cse Fulscam,BARI,intera giornata o turno di lavoro,https://www.cgsse.it/calendario-scioperi/dettaglio-sciopero/353187,true,2024-04-22,2024-04-23,2024-04-22,
18-04-2024,Vigili del fuoco,MINISTERO DELL'INTERNO,Conapo,TRIESTE,dalle ore 16.00 alle ore 20.00,https://www.cgsse.it/calendario-scioperi/dettaglio-sciopero/353185,false,2024-04-18,2024-04-18,2024-04-18,2024-04-18
22-05-2024,Plurisettoriale territoriale,COMPARTO PUBBLICO E PRIVATO,Fp Cgil,BOLOGNA,intera giornata o turno di lavoro,https://www.cgsse.it/calendario-scioperi/dettaglio-sciopero/353176,true,2024-05-22,2024-05-22,2024-05-22,2024-05-22
04-04-2024,Trasporto merci su gomma,SIRIO SERVICE (MI),Filt Cgil,ASSAGO,dalle ore 00:00 alle ore 18:00,https://www.cgsse.it/calendario-scioperi/dettaglio-sciopero/353174,false,2024-04-04,2024-04-04,2024-04-04,2024-04-04
Dal 23-04-2024 al 24-04-2024,Igiene ambientale,SEA,Usb,"PRATO , PISTOIA , PISA",intere giornate,https://www.cgsse.it/calendario-scioperi/dettaglio-sciopero/353172,false,2024-04-23,2024-04-24,2024-04-23,
23-04-2024,Igiene ambientale,ECO-CE,"Ugl Ia, Fial, Fiadel, Cil",OTTAVIANO,intera giornata,https://www.cgsse.it/calendario-scioperi/dettaglio-sciopero/353161,true,2024-04-23,2024-04-23,2024-04-23,2024-04-23
Dal 23-05-2024 al 24-05-2024,Servizio sanitario nazionale,USL ROMAGNA,Fials,"PIACENZA , PARMA , REGGIO NELL'EMILIA, MODENA , BOLOGNA , FERRARA",dalle ore 07:00 del 23/05 alle ore 07:00 del 24/05,https://www.cgsse.it/calendario-scioperi/dettaglio-sciopero/353131,false,2024-05-23,2024-05-24,2024-05-23,
11-04-2024,Trasporto pubblico locale,MOBILITÀ DI MARCA,"Filt Cgil, Faisa Cisal, Sgb",TREVISO,dalle ore 17.30 alle ore 21.30,https://www.cgsse.it/calendario-scioperi/dettaglio-sciopero/352996,false,2024-04-11,2024-04-11,2024-04-11,2024-04-11
25-04-2024,Regioni e autonomie Locali,COMUNE DI COLLEGNO,Cse Flpl,COLLEGNO,intera giornata,https://www.cgsse.it/calendario-scioperi/dettaglio-sciopero/352990,false,2024-04-25,2024-04-25,2024-04-25,2024-04-25
22-04-2024,Igiene ambientale,ATI SOC. COOP,Usb Lavoro Privato,PISA,intera giornata,https://www.cgsse.it/calendario-scioperi/dettaglio-sciopero/352988,false,2024-04-22,2024-04-22,2024-04-22,2024-04-22
22-04-2024,Igiene ambientale,GEOFOR,Usb Lavoro Privato,PISA,intera giornata,https://www.cgsse.it/calendario-scioperi/dettaglio-sciopero/352986,false,2024-04-22,2024-04-22,2024-04-22,2024-04-22
06-05-2024,Trasporto pubblico locale,TPL LINEA,"Sial Cobas, Rsu",SAVONA,dalle ore 10.15 alle ore 14.15,https://www.cgsse.it/calendario-scioperi/dettaglio-sciopero/352984,false,2024-05-06,2024-05-06,2024-05-06,2024-05-06
06-05-2024,Trasporto pubblico locale,TPL LINEA,"Filt Cgil, Fit Cisl, Uiltrasporti, Faisa Cisal, Ugl Fna, Rsu",SAVONA,dalle ore 10.15 alle ore 14.15,https://www.cgsse.it/calendario-scioperi/dettaglio-sciopero/352981,false,2024-05-06,2024-05-06,2024-05-06,2024-05-06
15-04-2024,Trasporto pubblico locale,AUTOFFICINA POMPONI,Usb Lavoro Privato,ROMA,alle ore 00.00 alle ore 23.59,https://www.cgsse.it/calendario-scioperi/dettaglio-sciopero/352971,true,2024-04-15,2024-04-15,2024-04-15,2024-04-15
09-04-2024,Ricerca,CONSIGLIO NAZIONALE RICERCHE,Usb Lavoro Privato,NAZIONALE,intera giornata,https://www.cgsse.it/calendario-scioperi/dettaglio-sciopero/352969,false,2024-04-09,2024-04-09,2024-04-09,2024-04-09
17-04-2024,Trasporto pubblico locale,SEAL,Fit Cisl,LA SPEZIA,dalle ore 11:00 alle ore 15:00,https://www.cgsse.it/calendario-scioperi/dettaglio-sciopero/352960,true,2024-04-17,2024-04-17,2024-04-17,2024-04-17
11-04-2024,Trasporto pubblico locale,FAL,Usb Lavoro Privato,"MATERA, BARI, GRAVINA IN PUGLIA",dalle ore 15:40 alle ore 19:40,https://www.cgsse.it/calendario-scioperi/dettaglio-sciopero/352946,true,2024-04-11,2024-04-11,2024-04-11,2024-04-11
Dal 16-05-2024 al 20-05-2024,Plurisettoriale nazionale,AZIENDE CHE SVOLGONO ATTIVITA FERROVIARIA,"Cub Trasporti, Sgb, Usb Lavoro Privato",NAZIONALE,"trasporto ferroviario dalle ore 3.00 del 19/5 alle ore 2.00 del 20/5 revocato a seguito di ordinanza di precettazione con nota del 17/5, trasporto ferroviario merci: dalle ore 21.00 del 16/5 alle 20.59 del 17/5",https://www.cgsse.it/calendario-scioperi/dettaglio-sciopero/352944,false,2024-05-16,2024-05-20,2024-05-16,
15-04-2024,Regioni e autonomie Locali,COMUNE DI VERONA,Csa,VERONA,intera giornata,https://www.cgsse.it/calendario-scioperi/dettaglio-sciopero/352940,true,2024-04-15,2024-04-15,2024-04-15,2024-04-15
Dal 03-05-2024 al 04-05-2024,Trasporto merci su rotaia,"CAPTRAIN ITALIA, COMPAGNIA FERROVIARIA ITALIANA, CROSSRAIL ITALIA SRL, DB CARGO ITALIA SRL, FUORIMURO SERVZI PORTUALI E FERROVIARI, GENERAL TRANSPORT SERVICE, GRUPPO FSI, INRAIL SPA, MEDWAY ITALIA, OBB RAIL CARGO CARRIER ITALY, OBB RAIL CARGO CARRIER ITALY, OCEANOGATE ITALIA, RAIL TRACTION COMPANY SPA, SBB CARGO ITALY SRL",Cat,NAZIONALE,dalle ore 21:00 del 03/05 alle ore 20:59 del 04/05,https://www.cgsse.it/calendario-scioperi/dettaglio-sciopero/352938,false,2024-05-03,2024-05-04,2024-05-03,
Dal 04-05-2024 al 05-05-2024,Trasporto ferroviario,"GRUPPO FSI, NUOVO TRASPORTO VIAGGIATORI (NTV), OBB RAIL CARGO CARRIER ITALY, OBB RAIL CARGO CARRIER ITALY, TRENITALIA TPER SCARL, TRENORD",Cat,NAZIONALE,dalle ore 21:00 del 04/05 alle ore 20:59 del 05/05,https://www.cgsse.it/calendario-scioperi/dettaglio-sciopero/352936,false,2024-05-04,2024-05-05,2024-05-04,
16-04-2024,Ministeri,LADISA SPA,Cub Trasporti,GENOVA,intera giornata,https://www.cgsse.it/calendario-scioperi/dettaglio-sciopero/352927,true,2024-04-16,2024-04-16,2024-04-16,2024-04-16
08-04-2024,Servizio sanitario nazionale,COOPERATIVA MORELLI,"Filcams Cgil, Fisascat Cisl",VERONA,intera giornata,https://www.cgsse.it/calendario-scioperi/dettaglio-sciopero/352904,true,2024-04-08,2024-04-08,2024-04-08,2024-04-08
26-04-2024,Trasporto pubblico locale,AZIENDE TRASPORTO PUBBLICO LOCALE,"Filt Cgil, Fit Cisl, Uiltrasporti, Faisa Cisal, Ugl Fna",EMILIA ROMAGNA,4 ore con modalità aziendali,https://www.cgsse.it/calendario-scioperi/dettaglio-sciopero/352901,false,2024-04-26,2024-04-26,2024-04-26,2024-04-26
Dal 11-04-2024 al 12-04-2024,Servizio sanitario nazionale,INNOTEC,Csa,BARI,intera giornata o turno di lavoro,https://www.cgsse.it/calendario-scioperi/dettaglio-sciopero/352890,true,2024-04-11,2024-04-12,2024-04-11,
09-04-2024,Università,MUR,Usb Pubblico Impiego,NAZIONALE,"dalle ore 12.00 a fine turno del personale tecnico, amministrativo, bibliotecario, cel e del personale docente, solo per le università di roma lo sciopero è per l’intera giornata",https://www.cgsse.it/calendario-scioperi/dettaglio-sciopero/352881,false,2024-04-09,2024-04-09,2024-04-09,2024-04-09
Dal 18-04-2024 al 19-04-2024,Trasporto merci su rotaia,"CAPTRAIN ITALIA, COMPAGNIA FERROVIARIA ITALIANA, CROSSRAIL ITALIA SRL, DB CARGO ITALIA SRL, FUORIMURO SERVZI PORTUALI E FERROVIARI, GENERAL TRANSPORT SERVICE, GRUPPO FSI, INRAIL SPA, MEDWAY ITALIA, OBB RAIL CARGO CARRIER ITALY, OBB RAIL CARGO CARRIER ITALY, OCEANOGATE ITALIA, RAIL TRACTION COMPANY SPA, SBB CARGO ITALY SRL",Cat,NAZIONALE,dalle ore 21:00 del 18/04 alle ore 21:00 del 19/04,https://www.cgsse.it/calendario-scioperi/dettaglio-sciopero/352844,true,2024-04-18,2024-04-19,2024-04-18,
Dal 20-04-2024 al 21-04-2024,Trasporto ferroviario,"GRUPPO FSI, NUOVO TRASPORTO VIAGGIATORI (NTV), OBB RAIL CARGO CARRIER ITALY, OBB RAIL CARGO CARRIER ITALY, TRENITALIA TPER SCARL, TRENORD",Cat,NAZIONALE,dalle ore 21:00 del 20/04 alle ore 20:59 del 21/04,https://www.cgsse.it/calendario-scioperi/dettaglio-sciopero/352841,true,2024-04-20,2024-04-21,2024-04-20,
08-04-2024,Trasporto aereo,AGS HANDLING,Cub Trasporti,BERGAMO,dalle ore 00:01 alle ore 23:59,https://www.cgsse.it/calendario-scioperi/dettaglio-sciopero/352839,false,2024-04-08,2024-04-08,2024-04-08,2024-04-08
03-05-2024,Trasporto ferroviario,TERMINALI ITALIA,"Filt Cgil, Fit Cisl, Uiltrasporti, Ugl, Slm Fast, Orsa Ferrovie",LOMBARDIA,dalle ore 09.00 alle ore 16.59,https://www.cgsse.it/calendario-scioperi/dettaglio-sciopero/352837,true,2024-05-03,2024-05-03,2024-05-03,2024-05-03
22-04-2024,Trasporto aereo,GH VENEZIA,Flai Trasporti E Servizi,VENEZIA,intera giornata,https://www.cgsse.it/calendario-scioperi/dettaglio-sciopero/352830,true,2024-04-22,2024-04-22,2024-04-22,2024-04-22
22-04-2024,Trasporto aereo,SICURITALIA IVRI,Flai Trasporti E Servizi,VENEZIA,intera giornata,https://www.cgsse.it/calendario-scioperi/dettaglio-sciopero/352828,true,2024-04-22,2024-04-22,2024-04-22,2024-04-22
02-05-2024,Elettricità,ENEL,"Filctem Cgil, Flaei Cisl, Uiltec Uil",NAZIONALE,intera giornata,https://www.cgsse.it/calendario-scioperi/dettaglio-sciopero/352820,true,2024-05-02,2024-05-02,2024-05-02,2024-05-02
30-04-2024,Elettricità,ENEL,"Filctem Cgil, Flaei Cisl, Uiltec Uil",NAZIONALE,intera giornata,https://www.cgsse.it/calendario-scioperi/dettaglio-sciopero/352816,true,2024-04-30,2024-04-30,2024-04-30,2024-04-30
10-04-2024,Plurisettoriale nazionale,"COOPERATIVE SOCIALI, SOCIETÀ E ASSOCIAZIONI OPERANTI NEI SETTORI SOCIO-SANITARI-ASSISTENZIALI-EDUCATIVI",Clap,NAZIONALE,intera giornata,https://www.cgsse.it/calendario-scioperi/dettaglio-sciopero/352804,false,2024-04-10,2024-04-10,2024-04-10,2024-04-10
10-04-2024,Plurisettoriale nazionale,"COOPERATIVE SOCIALI, SOCIETÀ E ASSOCIAZIONI OPERANTI NEI SETTORI SOCIO-SANITARI-ASSISTENZIALI-EDUCATIVI",Cub,NAZIONALE,intera giornata,https://www.cgsse.it/calendario-scioperi/dettaglio-sciopero/352766,false,2024-04-10,2024-04-10,2024-04-10,2024-04-10
10-04-2024,Plurisettoriale nazionale,"COOPERATIVE SOCIALI, SOCIETÀ E ASSOCIAZIONI OPERANTI NEI SETTORI SOCIO-SANITARI-ASSISTENZIALI-EDUCATIVI","Sgb, Adl Cobas, Sial Cobas",NAZIONALE,intera giornata,https://www.cgsse.it/calendario-scioperi/dettaglio-sciopero/352758,false,2024-04-10,2024-04-10,2024-04-10,2024-04-10
08-04-2024,Igiene ambientale,GEOFOR,Usb Lavoro Privato,PISA,intera giornata,https://www.cgsse.it/calendario-scioperi/dettaglio-sciopero/352753,true,2024-04-08,2024-04-08,2024-04-08,2024-04-08
19-04-2024,Scuola,MIM,Sisa,NAZIONALE,intera giornata,https://www.cgsse.it/calendario-scioperi/dettaglio-sciopero/352747,false,2024-04-19,2024-04-19,2024-04-19,2024-04-19
12-04-2024,Trasporto pubblico locale,CSC MOBILITÀ,Faisa Cisal,LATINA,dalle ore 09:30 alle ore 13:30,https://www.cgsse.it/calendario-scioperi/dettaglio-sciopero/352745,false,2024-04-12,2024-04-12,2024-04-12,2024-04-12
08-04-2024,Trasporto aereo,AGS HANDLING,Cub Trasporti,BERGAMO,dalle ore 00:01 alle ore 23:59,https://www.cgsse.it/calendario-scioperi/dettaglio-sciopero/352724,true,2024-04-08,2024-04-08,2024-04-08,2024-04-08
22-04-2024,Radio e TV,RAI,"Slc Cgil, Uilcom Uil",SARDEGNA,intero turno di lavoro,https://www.cgsse.it/calendario-scioperi/dettaglio-sciopero/352679,false,2024-04-22,2024-04-22,2024-04-22,2024-04-22
05-04-2024,Trasporto marittimo,"ANCIP, ASSITERMINAL, ASSOLOGISTICA, ASSOPORTI, FISE",Si Cobas,NAZIONALE,intera giornata,https://www.cgsse.it/calendario-scioperi/dettaglio-sciopero/352676,false,2024-04-05,2024-04-05,2024-04-05,2024-04-05
Dal 08-04-2024 al 09-04-2024,Igiene ambientale,ISVEC,Sngg,CASERTA,dalle ore 06:00 dell' 8/04 alle ore 06:00 del 9/04,https://www.cgsse.it/calendario-scioperi/dettaglio-sciopero/352674,true,2024-04-08,2024-04-09,2024-04-08,
17-04-2024,Regioni e autonomie Locali,COMUNE DI TRIESTE,"Ugl, Uil Fp",TRIESTE,intera giornata,https://www.cgsse.it/calendario-scioperi/dettaglio-sciopero/352669,false,2024-04-17,2024-04-17,2024-04-17,2024-04-17
11-04-2024,Generale regionale,AZIENDE PUBBLICHE E PRIVATE,"Cgil, Uil",SICILIA,4 ore,https://www.cgsse.it/calendario-scioperi/dettaglio-sciopero/352667,false,2024-04-11,2024-04-11,2024-04-11,2024-04-11
Dal 22-04-2024 al 23-04-2024,Trasporto ferroviario,TRENORD,"Uiltrasporti, Orsa Ferrovie",LOMBARDIA,dalle ore 03:00 del 22/04 alle ore 02:00 del 23/04,https://www.cgsse.it/calendario-scioperi/dettaglio-sciopero/352639,false,2024-04-22,2024-04-23,2024-04-22,
10-05-2024,Trasporto ferroviario,FS SECURITY,"Filt Cgil, Ugl Ferrovieri, Fast Mobilita, Orsa",NAPOLI,dalle ore 10.00 alle ore 17.59,https://www.cgsse.it/calendario-scioperi/dettaglio-sciopero/352636,false,2024-05-10,2024-05-10,2024-05-10,2024-05-10
11-04-2024,Vigili del fuoco,MINISTERO DELL'INTERNO,Usb Vvf,LIGURIA,dalle ore 9.00 alle ore 13.00,https://www.cgsse.it/calendario-scioperi/dettaglio-sciopero/352614,false,2024-04-11,2024-04-11,2024-04-11,2024-04-11
28-03-2024,Regioni e autonomie Locali,SISPI,"Fiom Cgil, Fim Cisl, Rsu",PALERMO,intera giornata,https://www.cgsse.it/calendario-scioperi/dettaglio-sciopero/352608,true,2024-03-28,2024-03-28,2024-03-28,2024-03-28
05-04-2024,Trasporto pubblico locale,SIMOBIL,Uilt Sgk,BOLZANO,"da inizio servizio alle ore 6:00, dalle ore 9:00 alle ore 12:00 e dalle ore 15:00 a fine servizio",https://www.cgsse.it/calendario-scioperi/dettaglio-sciopero/352592,true,2024-04-05,2024-04-05,2024-04-05,2024-04-05
05-04-2024,Trasporto pubblico locale,SAD,Uilt Sgk,BOLZANO,"da inizio servizio alle ore 6.00, dalle ore 9.00 alle ore 18.00 e dalle ore 21.00 a fine servzio",https://www.cgsse.it/calendario-scioperi/dettaglio-sciopero/352590,true,2024-04-05,2024-04-05,2024-04-05,2024-04-05
07-04-2024,Regioni e autonomie Locali,COMUNE DI MILANO,"Uil Fpl, Sulpl, Usb Pubblico Impiego",MILANO,intera giornata del personale della polizia locale],https://www.cgsse.it/calendario-scioperi/dettaglio-sciopero/352588,true,2024-04-07,2024-04-07,2024-04-07,2024-04-07
09-04-2024,Igiene ambientale,ECO-CE,"Ugl Ia, Fial, Fiadel, Cil",OTTAVIANO,intera giornata,https://www.cgsse.it/calendario-scioperi/dettaglio-sciopero/352572,true,2024-04-09,2024-04-09,2024-04-09,2024-04-09
15-04-2024,Appalti ferroviari,DUSSMANN SERVICE,"Filt Cgil, Fit Cisl, Uiltrasporti, Ugl Ferrovieri, Orsa",BARI,astensione di mezzo turno per ogni prestazione di lavoro programmato,https://www.cgsse.it/calendario-scioperi/dettaglio-sciopero/352567,false,2024-04-15,2024-04-15,2024-04-15,2024-04-15
22-04-2024,Trasporto ferroviario,TRENITALIA,"Filt Cgil, Fit Cisl, Uiltrasporti, Ugl Ferrovieri, Slm Fast Confsal, Orsa Ferrovie",VENETO,dalle ore 9.01 alle 17.00,https://www.cgsse.it/calendario-scioperi/dettaglio-sciopero/352557,false,2024-04-22,2024-04-22,2024-04-22,2024-04-22
23-04-2024,Servizio sanitario nazionale,AZIENDE APPALTATRICI DEI SERVIZI CUP-RECUP,"Proclamante:Cobas Lavoro Privato
Aderente:Cub Sanità Italiana",LAZIO,intero turno di lavoro,https://www.cgsse.it/calendario-scioperi/dettaglio-sciopero/352550,false,2024-04-23,2024-04-23,2024-04-23,2024-04-23
06-05-2024,Elettricità,GRUPPO HERA,"Filctem Cgil, Femca Cisl, Flaei Cisl, Uiltec Uil",NAZIONALE,intera giornata,https://www.cgsse.it/calendario-scioperi/dettaglio-sciopero/352538,false,2024-05-06,2024-05-06,2024-05-06,2024-05-06
09-04-2024,Trasporto pubblico locale,CSC MOBILITÀ,Faisa Cisal,LATINA,dalle ore 09:30 alle ore 13:30,https://www.cgsse.it/calendario-scioperi/dettaglio-sciopero/352513,true,2024-04-09,2024-04-09,2024-04-09,2024-04-09
06-05-2024,Trasporto pubblico locale,SASA 2,"Filt Cgil, Fit Cisl, Ugl",MACERATA,fasce garantite: dalle ore 05:30 alle ore 08:30 e dalle ore 17:30 alle ore 20:30,https://www.cgsse.it/calendario-scioperi/dettaglio-sciopero/352498,false,2024-05-06,2024-05-06,2024-05-06,2024-05-06
15-04-2024,Servizio sanitario nazionale,COT,"Filcams Cgil, Fisascat Cisl, Uiltucs","SIRACUSA , PALERMO , AGRIGENTO , CATANIA",intero turno di lavoro,https://www.cgsse.it/calendario-scioperi/dettaglio-sciopero/352494,true,2024-04-15,2024-04-15,2024-04-15,2024-04-15
15-04-2024,Regioni e autonomie Locali,COT,"Filcams Cgil, Fisascat Cisl, Uiltucs","SIRACUSA , PALERMO , AGRIGENTO , CATANIA",intero turno di lavoro,https://www.cgsse.it/calendario-scioperi/dettaglio-sciopero/352490,true,2024-04-15,2024-04-15,2024-04-15,2024-04-15
15-06-2024,Trasporto aereo,ENAV,"Ugl Ta, Fast Confsal",NAPOLI,dalle ore 13:00 alle ore 17:00,https://www.cgsse.it/calendario-scioperi/dettaglio-sciopero/352486,true,2024-06-15,2024-06-15,2024-06-15,2024-06-15
Dal 04-04-2024 al 05-04-2024,Credito,ACCENTURE SERVICES AND TECHNOLOGY,"Fabi, First Cisl, Fisac Cgil, Uilca, Unisin",NAZIONALE,intere giornate di lavoro,https://www.cgsse.it/calendario-scioperi/dettaglio-sciopero/352480,false,2024-04-04,2024-04-05,2024-04-04,
12-05-2024,Trasporto aereo,GH VERONA,Fit Cisl,VERONA,dalle ore 13.00 alle ore 17.00,https://www.cgsse.it/calendario-scioperi/dettaglio-sciopero/352430,false,2024-05-12,2024-05-12,2024-05-12,2024-05-12
29-03-2024,Radio e TV,RAI,Cisal Comunicazione,ROMA,dalle ore 18.40 alle ore 20.40,https://www.cgsse.it/calendario-scioperi/dettaglio-sciopero/352390,false,2024-03-29,2024-03-29,2024-03-29,2024-03-29
26-04-2024,Trasporto pubblico locale,AZIENDE TRASPORTO PUBBLICO LOCALE,Confail Faisa,NAZIONALE,sciopero di 4 ore con modalità articolate a livello territoriale,https://www.cgsse.it/calendario-scioperi/dettaglio-sciopero/352376,false,2024-04-26,2024-04-26,2024-04-26,2024-04-26
11-04-2024,Energia e petrolio,TOTALENERGIES EP ITALIA,Filctem Cgil,BASILICATA,intera giornata per i lavoratori giornalieri e intero turno per i lavoratori turnisti,https://www.cgsse.it/calendario-scioperi/dettaglio-sciopero/352348,true,2024-04-11,2024-04-11,2024-04-11,2024-04-11
10-04-2024,Ricerca,ISTITUTO SUPERIORE DI SANITÀ,Usb Pubblico Impiego,NAZIONALE,sciopero di 4 ore,https://www.cgsse.it/calendario-scioperi/dettaglio-sciopero/352345,false,2024-04-10,2024-04-10,2024-04-10,2024-04-10
03-04-2024,Servizio sanitario nazionale,AZIENDE APPALTATRICI DEI SERVIZI CUP-RECUP,Cobas Lavoro Privato,LAZIO,intero turno di lavoro,https://www.cgsse.it/calendario-scioperi/dettaglio-sciopero/352341,true,2024-04-03,2024-04-03,2024-04-03,2024-04-03
02-04-2024,Servizio sanitario nazionale,AZIENDE APPALTATRICI DEI SERVIZI CUP-RECUP,Cobas Lavoro Privato,LAZIO,intero turno di lavoro,https://www.cgsse.it/calendario-scioperi/dettaglio-sciopero/352337,true,2024-04-02,2024-04-02,2024-04-02,2024-04-02
11-04-2024,Plurisettoriale nazionale,TUTTE LE CATEGORIE DEL SETTORE PRIVATO,"Cgil, Uil",NAZIONALE,l’astensione avrà una durata pari a 4 ore per tutti i settori privati anche in appalto e strumentali,https://www.cgsse.it/calendario-scioperi/dettaglio-sciopero/352331,false,2024-04-11,2024-04-11,2024-04-11,2024-04-11
26-03-2024,Pulizie e multiservizi,"CNCP, CONSORZIO STABILE EURO GLOBAL SERVICE, CPP, PULITORI E AFFINI","Filcams Cgil, Fisascat Cisl, Uiltrasporti, Cub Trasporti",NAPOLI,intera giornata,https://www.cgsse.it/calendario-scioperi/dettaglio-sciopero/352328,true,2024-03-26,2024-03-26,2024-03-26,2024-03-26
09-05-2024,Istruzione e ricerca,"MIM, MUR","Proclamante:Unicobas Scuola & Università
Aderente:Fisi",NAZIONALE,intera giornata,https://www.cgsse.it/calendario-scioperi/dettaglio-sciopero/352323,false,2024-05-09,2024-05-09,2024-05-09,2024-05-09
18-03-2024,Igiene ambientale,SMEDA,Uiltrasporti,TURSI,"dalle ore 07,00 alle ore 13,00",https://www.cgsse.it/calendario-scioperi/dettaglio-sciopero/352320,true,2024-03-18,2024-03-18,2024-03-18,2024-03-18
23-04-2024,Appalti ferroviari,DUSSMANN SERVICE,"Filt Cgil, Fit Cisl, Uiltrasporti, Ugl Ferrovieri, Slm Fast, Orsa Salpas",CAMPANIA,astensione di mezzo turno per ogni turno di lavoro,https://www.cgsse.it/calendario-scioperi/dettaglio-sciopero/352306,false,2024-04-23,2024-04-23,2024-04-23,2024-04-23
23-04-2024,Telecomunicazioni,GRUPPO TIM,Cobas Lavoro Privato,NAZIONALE,intero turno di lavoro con eslusione della sola regione basilicata,https://www.cgsse.it/calendario-scioperi/dettaglio-sciopero/352299,false,2024-04-23,2024-04-23,2024-04-23,2024-04-23
27-03-2024,Regioni e autonomie Locali,CASA DI RIPOSO D. CARDO,"Fp Cgil, Cisl Fp, Csa Ral",COLOGNA VENETA,due ore ad inizio di ciascun turno lavorativo,https://www.cgsse.it/calendario-scioperi/dettaglio-sciopero/352292,false,2024-03-27,2024-03-27,2024-03-27,2024-03-27
Dal 26-03-2024 al 27-03-2024,Igiene ambientale,VELIA AMBIENTE,Filas,MADDALONI,da inizio turno del 26/03 ad inizio turno del 27/03,https://www.cgsse.it/calendario-scioperi/dettaglio-sciopero/352288,true,2024-03-26,2024-03-27,2024-03-26,
Dal 25-03-2024 al 29-03-2024,Radio e TV,RAI,Cisal Comunicazione,ROMA,dalle ore 18.40 alle ore 20.40,https://www.cgsse.it/calendario-scioperi/dettaglio-sciopero/352278,true,2024-03-25,2024-03-29,2024-03-25,
26-03-2024,Pulizie e multiservizi,ROMEO GESTIONI,"Filcams Cgil, Cub Trasporti",NAPOLI,intera giornata,https://www.cgsse.it/calendario-scioperi/dettaglio-sciopero/352243,true,2024-03-26,2024-03-26,2024-03-26,2024-03-26
08-04-2024,Igiene ambientale,ALIA SERVIZI AMBIENTALI,Cobas Lavoro Privato,"FIRENZE, EMPOLI, PISTOIA, PRATO",intero turno,https://www.cgsse.it/calendario-scioperi/dettaglio-sciopero/352233,false,2024-04-08,2024-04-08,2024-04-08,2024-04-08
Dal 25-03-2024 al 26-03-2024,Radio e TV,RAI,Usigrai,ROMA,dalle ore 6.00 del 25/3 alle ore 6.00 del 26/3 dei giornalisti della testata giornale rai radio,https://www.cgsse.it/calendario-scioperi/dettaglio-sciopero/352218,false,2024-03-25,2024-03-26,2024-03-25,
12-04-2024,Trasporto ferroviario,TRENITALIA,"Filt Cgil, Fit Cisl, Uiltrasporti, Ugl Ferrovieri, Fast, Orsa",CAMPANIA,dalle ore 09:00 alle ore 17:00,https://www.cgsse.it/calendario-scioperi/dettaglio-sciopero/352193,false,2024-04-12,2024-04-12,2024-04-12,2024-04-12
25-03-2024,Pulizie e multiservizi,ROMEO GESTIONI,Ugl,POZZUOLI,intera giornata,https://www.cgsse.it/calendario-scioperi/dettaglio-sciopero/352186,true,2024-03-25,2024-03-25,2024-03-25,2024-03-25
08-04-2024,Trasporto aereo,ENAV,"Fit Cisl, Uiltrasporti, Ugl Ta, Fast Confsal Av Unica",BARI,dalle ore 13:00 alle ore 17:00,https://www.cgsse.it/calendario-scioperi/dettaglio-sciopero/352179,false,2024-04-08,2024-04-08,2024-04-08,2024-04-08
24-03-2024,Plurisettoriale nazionale,AZIENDE CHE SVOLGONO ATTIVITA FERROVIARIA,Cat,NAZIONALE,dalle ore 09:00 alle ore 16:59,https://www.cgsse.it/calendario-scioperi/dettaglio-sciopero/352173,false,2024-03-24,2024-03-24,2024-03-24,2024-03-24
25-03-2024,Taxi,SERVIZIO TAXI,Cobas Lavoro Privato,NAZIONALE,dalle ore 08:00 alle ore 22:00,https://www.cgsse.it/calendario-scioperi/dettaglio-sciopero/352165,false,2024-03-25,2024-03-25,2024-03-25,2024-03-25
12-04-2024,Trasporto pubblico locale,CSC MOBILITÀ,Ugl Fna,LATINA,dalle ore 09.30 alle ore 13.30,https://www.cgsse.it/calendario-scioperi/dettaglio-sciopero/352163,false,2024-04-12,2024-04-12,2024-04-12,2024-04-12
24-03-2024,Regioni e autonomie Locali,COMUNE DI COLLEGNO,Cse Flpl,COLLEGNO,intera giornata,https://www.cgsse.it/calendario-scioperi/dettaglio-sciopero/352160,false,2024-03-24,2024-03-24,2024-03-24,2024-03-24
22-03-2024,Trasporto pubblico locale,TPL FVG SCARL,Ugl,FRIULI VENEZIA GIULIA,dalle ore 09.00 alle ore 13.00,https://www.cgsse.it/calendario-scioperi/dettaglio-sciopero/352152,true,2024-03-22,2024-03-22,2024-03-22,2024-03-22
Dal 18-03-2024 al 22-03-2024,Enti pubblici non economici,AUTORITÀ DI SISTEMA PORTUALE DEL MAR TIRRENO SETTENTRIONALE,"Filt Cgil, Fit Cisl, Uiltrasporti, Ugl Mare E porti","CIVITAVECCHIA, FIUMICINO, GAETA",intere giornate e blocco di tutte le flessibilità,https://www.cgsse.it/calendario-scioperi/dettaglio-sciopero/352144,false,2024-03-18,2024-03-22,2024-03-18,
26-03-2024,Scuola,IIS ALBERTI-DANTE,"Flc Cgil, Cisl Scuola, Snals Confsal, Gilda Unams",FIRENZE,intera giornata,https://www.cgsse.it/calendario-scioperi/dettaglio-sciopero/352137,false,2024-03-26,2024-03-26,2024-03-26,2024-03-26
25-03-2024,Regioni e autonomie Locali,ASILI NIDO,"Fp Cgil, Cisl Fp, Uil Fpl",TARANTO,intera giornata,https://www.cgsse.it/calendario-scioperi/dettaglio-sciopero/352132,true,2024-03-25,2024-03-25,2024-03-25,2024-03-25
25-03-2024,Servizio sanitario nazionale,APSS,Cub,TRENTO,dalle ore 00:00 alle ore 23:59,https://www.cgsse.it/calendario-scioperi/dettaglio-sciopero/352128,false,2024-03-25,2024-03-25,2024-03-25,2024-03-25
25-03-2024,Istituti di vigilanza,AZIENDE DI VIGILANZA PRIVATA,Fesica Confsal,VICENZA,intero turno di lavoro per l'intera giornata,https://www.cgsse.it/calendario-scioperi/dettaglio-sciopero/352117,false,2024-03-25,2024-03-25,2024-03-25,2024-03-25
23-04-2024,Telecomunicazioni,ASSTEL,Usb Lavoro Privato,NAZIONALE,intero turno di lavoro con esclusione della sola regione basilicata,https://www.cgsse.it/calendario-scioperi/dettaglio-sciopero/352100,false,2024-04-23,2024-04-23,2024-04-23,2024-04-23
18-03-2024,Trasporto pubblico locale,AUTOFFICINA POMPONI,Usb Lavoro Privato,ROMA,dalle 12:00 alle 16:00,https://www.cgsse.it/calendario-scioperi/dettaglio-sciopero/352090,false,2024-03-18,2024-03-18,2024-03-18,2024-03-18
23-03-2024,Trasporto aereo,AGS HANDLING,Cub Trasporti,BERGAMO,dalle ore 10.00 alle 18.00,https://www.cgsse.it/calendario-scioperi/dettaglio-sciopero/352088,false,2024-03-23,2024-03-23,2024-03-23,2024-03-23
Dal 08-04-2024 al 16-04-2024,Avvocati,SETTORE GIUSTIZIA,Camera Penale Di Napoli Nord In Aversa,AVERSA,astensione dalle udienze e dalle attività giudiziarie nel settore penale,https://www.cgsse.it/calendario-scioperi/dettaglio-sciopero/352086,false,2024-04-08,2024-04-16,2024-04-08,
22-03-2024,Elettricità,ENEL,"Filctem Cgil, Flaei Cisl, Uiltec Uil",SARDEGNA,intera giornata o turno di lavoro,https://www.cgsse.it/calendario-scioperi/dettaglio-sciopero/352079,false,2024-03-22,2024-03-22,2024-03-22,2024-03-22
18-03-2024,Taxi,SERVIZIO TAXI,Cobas Lavoro Privato,NAZIONALE,dalle ore 08:00 alle ore 22:00,https://www.cgsse.it/calendario-scioperi/dettaglio-sciopero/352059,true,2024-03-18,2024-03-18,2024-03-18,2024-03-18
18-03-2024,Trasporto pubblico locale,ATC CAPRI,"Uiltrasporti, Ugl Fna",CAPRI,dalle ore 11.00 alle ore 15.00,https://www.cgsse.it/calendario-scioperi/dettaglio-sciopero/352052,false,2024-03-18,2024-03-18,2024-03-18,2024-03-18
09-04-2024,Trasporto pubblico locale,ARRIVA ITALIA,"Filt Cgil, Fit Cisl, Uiltrasporti, Faisa Cisal, Ugl",CREMONA,dalle ore 17.00 alle ore 21.00,https://www.cgsse.it/calendario-scioperi/dettaglio-sciopero/352041,false,2024-04-09,2024-04-09,2024-04-09,2024-04-09
23-04-2024,Generale territoriale,TUTTI I SETTORI PUBBLICI E PRIVATI,"Sindacato Generale Di Classe, Lavoratori Metalmeccanici Organizzati",TARANTO,dalle ore 00:01 alle ore 23:59 con esclusione del comparto trasporti e vigili del fuoco,https://www.cgsse.it/calendario-scioperi/dettaglio-sciopero/352035,false,2024-04-23,2024-04-23,2024-04-23,2024-04-23
29-03-2024,Appalti ferroviari,DUSSMANN SERVICE,"Filt Cgil, Fit Cisl, Uiltrasporti, Ugl Ferrovieri, Orsa",BARI,sciopero di mezzo turno dalle ore 00:01 alle ore 03:59,https://www.cgsse.it/calendario-scioperi/dettaglio-sciopero/352000,true,2024-03-29,2024-03-29,2024-03-29,2024-03-29
06-05-2024,Scuola,MIM,"Proclamante:Sgb, Cub
Aderente:Adl Cobas",NAZIONALE,sciopero breve delle attività funzionali all'insegnamento relative alle prove invalsi comprese le attività di correzione dei test nella scuola primaria,https://www.cgsse.it/calendario-scioperi/dettaglio-sciopero/351994,false,2024-05-06,2024-05-06,2024-05-06,2024-05-06
18-03-2024,Trasporto pubblico locale,ATC CAPRI,Usb Lavoro Privato,CAPRI,dalle ore 11:00 alle ore 15:00,https://www.cgsse.it/calendario-scioperi/dettaglio-sciopero/351981,false,2024-03-18,2024-03-18,2024-03-18,2024-03-18
19-03-2024,Ministeri,LADISA SPA,Cub Trasporti,GENOVA,24 ore per tutti i turni di lavoro,https://www.cgsse.it/calendario-scioperi/dettaglio-sciopero/351979,false,2024-03-19,2024-03-19,2024-03-19,2024-03-19
20-03-2024,Regioni e autonomie Locali,SISPI,"Fiom Cgil, Fim Cisl, Rsu",PALERMO,8 ore,https://www.cgsse.it/calendario-scioperi/dettaglio-sciopero/351936,false,2024-03-20,2024-03-20,2024-03-20,2024-03-20
18-03-2024,Telecomunicazioni,"ABRAMO C.C., CALLMAT, ENNOVA, GRUPPO DISTRIBUZIONE, KONECTA, YOUTILITY","Slc Cgil, Fistel Cisl, Uilcom Uil",NAZIONALE,intera giornata delle attività di customer care di tim,https://www.cgsse.it/calendario-scioperi/dettaglio-sciopero/351932,false,2024-03-18,2024-03-18,2024-03-18,2024-03-18
28-03-2024,Credito,V-TSERVICES,"Fabi, Fisac Cgil",NAZIONALE,intera giornata,https://www.cgsse.it/calendario-scioperi/dettaglio-sciopero/351923,false,2024-03-28,2024-03-28,2024-03-28,2024-03-28
18-03-2024,Trasporto pubblico locale,START ROMAGNA,Fit Cisl,RAVENNA,dalle ore 17:30 alle ore 21:30,https://www.cgsse.it/calendario-scioperi/dettaglio-sciopero/351920,false,2024-03-18,2024-03-18,2024-03-18,2024-03-18
16-03-2024,Igiene ambientale,LTS AMBIENTE,"Fp Cgil, Fit Cisl",MESSINA,dalle ore 06:00 alle ore 12:20,https://www.cgsse.it/calendario-scioperi/dettaglio-sciopero/351916,true,2024-03-16,2024-03-16,2024-03-16,2024-03-16
22-03-2024,Elettricità,ENEL,Ugl Chimici,ABRUZZO,intera giornata o turno di lavoro,https://www.cgsse.it/calendario-scioperi/dettaglio-sciopero/351849,false,2024-03-22,2024-03-22,2024-03-22,2024-03-22
15-03-2024,Servizio sanitario nazionale,APSS,Cub,TRENTO,dalle ore 00:00 alle ore 23:59,https://www.cgsse.it/calendario-scioperi/dettaglio-sciopero/351823,true,2024-03-15,2024-03-15,2024-03-15,2024-03-15
10-04-2024,Plurisettoriale nazionale,"COOPERATIVE SOCIALI, SOCIETÀ E ASSOCIAZIONI OPERANTI NEI SETTORI SOCIO-SANITARI-ASSISTENZIALI-EDUCATIVI",Usb Lavoro Privato,NAZIONALE,intera giornata,https://www.cgsse.it/calendario-scioperi/dettaglio-sciopero/351821,false,2024-04-10,2024-04-10,2024-04-10,2024-04-10
20-03-2024,Regioni e autonomie Locali,INNOVA,Sgb,SAN CATALDO,intera giornata,https://www.cgsse.it/calendario-scioperi/dettaglio-sciopero/351772,true,2024-03-20,2024-03-20,2024-03-20,2024-03-20
23-03-2024,Trasporto aereo,SICURITALIA IVRI,Flai Trasporti E Servizi,VENEZIA,dalle ore 10.00 alle ore 14.00,https://www.cgsse.it/calendario-scioperi/dettaglio-sciopero/351770,false,2024-03-23,2024-03-23,2024-03-23,2024-03-23
23-03-2024,Trasporto aereo,GH VENEZIA,Flai Trasporti E Servizi,VENEZIA,dalle ore 10.00 alle ore 14.00,https://www.cgsse.it/calendario-scioperi/dettaglio-sciopero/351764,false,2024-03-23,2024-03-23,2024-03-23,2024-03-23
24-03-2024,Regioni e autonomie Locali,COMUNE DI MILANO,"Uil Fpl, Sulpl, Usb Pubblico Impiego",MILANO,intera giornata del personale della polizia locale,https://www.cgsse.it/calendario-scioperi/dettaglio-sciopero/351749,true,2024-03-24,2024-03-24,2024-03-24,2024-03-24
Dal 14-03-2024 al 22-03-2024,Avvocati,SETTORE GIUSTIZIA,Camera Penale Di Nocera Inferiore,NOCERA INFERIORE,astensione dall'attività giudiziaria degli avvocati,https://www.cgsse.it/calendario-scioperi/dettaglio-sciopero/351745,false,2024-03-14,2024-03-22,2024-03-14,
Dal 14-03-2024 al 22-03-2024,Avvocati,SETTORE GIUSTIZIA,Camera Penale Di Vallo Della Lucania,VALLO DELLA LUCANIA,astensione dall'attività giudiziaria degli avvocati,https://www.cgsse.it/calendario-scioperi/dettaglio-sciopero/351743,false,2024-03-14,2024-03-22,2024-03-14,
22-03-2024,Elettricità,ENEL,"Filctem Cgil, Flaei Cisl, Uiltec Uil",ABRUZZO,intera giornata o turno di lavoro,https://www.cgsse.it/calendario-scioperi/dettaglio-sciopero/351734,false,2024-03-22,2024-03-22,2024-03-22,2024-03-22
19-03-2024,Elettricità,ENEL,Ugl Chimici,"PIACENZA, MONTALTO DI CASTRO",intera giornata o turno di lavoro,https://www.cgsse.it/calendario-scioperi/dettaglio-sciopero/351712,false,2024-03-19,2024-03-19,2024-03-19,2024-03-19
20-03-2024,Elettricità,ENEL,Ugl Chimici,"PIETRAFITTA, TERMINI IMERESE",intera giornata o turno di lavoro,https://www.cgsse.it/calendario-scioperi/dettaglio-sciopero/351710,false,2024-03-20,2024-03-20,2024-03-20,2024-03-20
21-03-2024,Elettricità,ENEL,Ugl Chimici,"RAVENNA, CIVITAVECCHIA",intera giornata o turno di lavoro,https://www.cgsse.it/calendario-scioperi/dettaglio-sciopero/351708,false,2024-03-21,2024-03-21,2024-03-21,2024-03-21
22-03-2024,Elettricità,ENEL,Ugl Chimici,"PORTO EMPEDOCLE, CAVRIGLIA",intera giornata o turno di lavoro,https://www.cgsse.it/calendario-scioperi/dettaglio-sciopero/351706,false,2024-03-22,2024-03-22,2024-03-22,2024-03-22
08-03-2024,Elettricità,ENEL,Ugl Chimici,NAZIONALE,sciopero di tutti i dipendenti di tutte le società del gruppo enel esclusa la regione abruzzo per elezioni regionali e impianto sulcis,https://www.cgsse.it/calendario-scioperi/dettaglio-sciopero/351690,false,2024-03-08,2024-03-08,2024-03-08,2024-03-08
20-03-2024,Avvocati,SETTORE GIUSTIZIA,Unione Camere Penali Italiane,NAZIONALE,"astensione dalle udienze e da ogni attività giudiziaria escluso il circondario di ischia, salerno, vallo della lucania e nocera inferiore",https://www.cgsse.it/calendario-scioperi/dettaglio-sciopero/351684,false,2024-03-20,2024-03-20,2024-03-20,2024-03-20
28-03-2024,Credito,V-TSERVICES,"Rsa Fabi, Rsa Fisac",NAZIONALE,intera giornata,https://www.cgsse.it/calendario-scioperi/dettaglio-sciopero/351594,true,2024-03-28,2024-03-28,2024-03-28,2024-03-28
Dal 14-03-2024 al 22-03-2024,Avvocati,SETTORE GIUSTIZIA,Camera Penale Salernitana,SALERNO,astensione dall'attività giudiziaria degli avvocati,https://www.cgsse.it/calendario-scioperi/dettaglio-sciopero/351583,false,2024-03-14,2024-03-22,2024-03-14,
19-03-2024,Ministeri,"CICLAT, COOPERATIVA NUOVI ORIZZONTI, RICINA, VERBATIM","Filcams Cgil, Fisascat Cisl, Uiltrasporti",NAZIONALE,intera giornata o turno di lavoro,https://www.cgsse.it/calendario-scioperi/dettaglio-sciopero/351574,false,2024-03-19,2024-03-19,2024-03-19,2024-03-19
15-03-2024,Trasporto pubblico locale,ATC CAPRI,Usb Lavoro Privato,CAPRI,dalle ore 13:00 alle ore 17:00,https://www.cgsse.it/calendario-scioperi/dettaglio-sciopero/351570,true,2024-03-15,2024-03-15,2024-03-15,2024-03-15
23-03-2024,Trasporto aereo,ITALPOL,Usb Lavoro Privato,MILANO,dalle ore 10:00 alle ore 18:00,https://www.cgsse.it/calendario-scioperi/dettaglio-sciopero/351567,false,2024-03-23,2024-03-23,2024-03-23,2024-03-23
15-03-2024,Trasporto pubblico locale,ATC CAPRI,"Uiltrasporti, Ugl Fna",CAPRI,dalle ore 11.00 alle ore 15.00,https://www.cgsse.it/calendario-scioperi/dettaglio-sciopero/351563,true,2024-03-15,2024-03-15,2024-03-15,2024-03-15
08-04-2024,Trasporto pubblico locale,SICILBUS,Uiltrasporti,PALERMO,"da inizio servizio alle ore 06:00, dalle ore 09:00 alle ore 13:30 e dalle ore 16:30 a fine servizio",https://www.cgsse.it/calendario-scioperi/dettaglio-sciopero/351530,false,2024-04-08,2024-04-08,2024-04-08,2024-04-08
23-03-2024,Trasporto pubblico locale,BUSITALIA SITA NORD,Usb Lavoro Privato,UMBRIA,"perugia, spoleto fasce garantite dalle ore 06:00 alle 09:00 e dalle 12:00 alle 15:00. terni dalle ore 06:30 alle 09:30 e dalle 12:30 alle 15:30.",https://www.cgsse.it/calendario-scioperi/dettaglio-sciopero/351517,false,2024-03-23,2024-03-23,2024-03-23,2024-03-23
12-05-2024,Trasporto aereo,ENAV,Fast Confsal,NAZIONALE,dalle ore 13.00 alle ore 17.00,https://www.cgsse.it/calendario-scioperi/dettaglio-sciopero/351515,true,2024-05-12,2024-05-12,2024-05-12,2024-05-12
08-03-2024,Plurisettoriale regionale,SETTORI PRIVATI E PUBBLICI AFFERENTE AI COMPARTI DEI SERVIZI PUBBLICI (PUBBLICA AMMINISTRAZIONE SANITÀ IGIENE AMBIENTALE TERZO SETTORE) ISTRUZIONE E RICERCA,Filcams Cgil,TOSCANA,intera giornata,https://www.cgsse.it/calendario-scioperi/dettaglio-sciopero/351495,false,2024-03-08,2024-03-08,2024-03-08,2024-03-08
13-03-2024,Trasporto ferroviario,RFI,"Cobas Lavoro Privato, Usb Lavoro Privato",NAZIONALE,sciopero di 8 ore per l'intera prestazione di lavoro,https://www.cgsse.it/calendario-scioperi/dettaglio-sciopero/351484,false,2024-03-13,2024-03-13,2024-03-13,2024-03-13
08-04-2024,Trasporto pubblico locale,AMAT,"Filt Cgil, Fit Cisl, Uiltrasporti, Faisa Cisal, Ugl Trasporti, Cobas Trasporti, Orsa Trasporti",PALERMO,"dalle ore 8,30 alle ore 17,30",https://www.cgsse.it/calendario-scioperi/dettaglio-sciopero/351477,false,2024-04-08,2024-04-08,2024-04-08,2024-04-08
18-03-2024,Avvocati,SETTORE GIUSTIZIA,Associazione Forense Isola D'ischia,ISCHIA,astensione da tutte le udienze civili e penali,https://www.cgsse.it/calendario-scioperi/dettaglio-sciopero/351458,false,2024-03-18,2024-03-18,2024-03-18,2024-03-18
06-03-2024,Regioni e autonomie Locali,INNOVA,Sgb,SAN CATALDO,intera giornata,https://www.cgsse.it/calendario-scioperi/dettaglio-sciopero/351438,true,2024-03-06,2024-03-06,2024-03-06,2024-03-06
22-03-2024,Servizio sanitario nazionale,AST ASCOLI PICENO,"Nursind, Usb",ASCOLI PICENO,"dalle ore 00:01 alle 23:59, compreso primo e ultimo turno montante",https://www.cgsse.it/calendario-scioperi/dettaglio-sciopero/351436,false,2024-03-22,2024-03-22,2024-03-22,2024-03-22
08-03-2024,Istruzione e ricerca,"MIM, MUR",Flc Cgil,NAZIONALE,"sciopero per l’intera giornata di tutto il personale del comparto istruzione e ricerca e dell’area dirigenziale, dei docenti universitari e di tutto il personale della formazione professionale e delle scuole non statali",https://www.cgsse.it/calendario-scioperi/dettaglio-sciopero/351427,false,2024-03-08,2024-03-08,2024-03-08,2024-03-08
08-03-2024,Credito,AZIENDE DEL SETTORE,Fisac Cgil,LAZIO,intera giornata.per i part time e per i turnisti la giornata di astensione dal lavoro è a valere per l'intero turno,https://www.cgsse.it/calendario-scioperi/dettaglio-sciopero/351425,false,2024-03-08,2024-03-08,2024-03-08,2024-03-08
19-03-2024,Trasporto pubblico locale,SASA,Rsu,BOLZANO,"sciopero di 24 ore con la salvaguardia delle seguenti fasce orarie: dalle ore 06.00 alle 9.00, dalle ore 12.00 alle 15.00, fine turno di servizio per tutto il personale viaggiante",https://www.cgsse.it/calendario-scioperi/dettaglio-sciopero/351418,false,2024-03-19,2024-03-19,2024-03-19,2024-03-19
08-03-2024,Sanità privata,AZIENDE DEL SETTORE,Cobas Sanita Universita Ricerca,NAZIONALE,intera giornata,https://www.cgsse.it/calendario-scioperi/dettaglio-sciopero/351416,false,2024-03-08,2024-03-08,2024-03-08,2024-03-08
08-03-2024,Servizio sanitario nazionale,AZIENDE DEL SETTORE,Cobas Sanita Universita Ricerca,NAZIONALE,intera giornata,https://www.cgsse.it/calendario-scioperi/dettaglio-sciopero/351414,false,2024-03-08,2024-03-08,2024-03-08,2024-03-08
06-04-2024,Trasporto pubblico locale,BUSITALIA SITA NORD,Faisa Cisal,UMBRIA,24 ore con il rispetto delle fasce di garanzia,https://www.cgsse.it/calendario-scioperi/dettaglio-sciopero/351408,false,2024-04-06,2024-04-06,2024-04-06,2024-04-06
09-04-2024,Trasporto pubblico locale,MOVIBUS,"Filt Cgil, Fit Cisl, Uilt Uil, Faisa Cisal",MILANO,dalle ore 18:00 alle ore 22:00,https://www.cgsse.it/calendario-scioperi/dettaglio-sciopero/351392,false,2024-04-09,2024-04-09,2024-04-09,2024-04-09
19-03-2024,Servizio sanitario nazionale,OSPEDALE GRADENIGO,Associazione Nazionale Medici Istituti Religiosi spedalieri,TORINO,dalle ore 8.00 alle ore 13.00,https://www.cgsse.it/calendario-scioperi/dettaglio-sciopero/351387,false,2024-03-19,2024-03-19,2024-03-19,2024-03-19
23-02-2024,Poste,POSTE ITALIANE,Slc Cgil,BRESCIA,sciopero di 1 ora a fine turno (per tutti i turni) per il personale del settore pcl mp e dto di poste italiane della provincia di brescia.,https://www.cgsse.it/calendario-scioperi/dettaglio-sciopero/351383,false,2024-02-23,2024-02-23,2024-02-23,2024-02-23
28-02-2024,Istituti di vigilanza,PEGASO SECURITY,"Filcams Cgil, Fisascat Cisl, Uiltucs",GENOVA,intero turno di servizio,https://www.cgsse.it/calendario-scioperi/dettaglio-sciopero/351376,true,2024-02-28,2024-02-28,2024-02-28,2024-02-28
08-03-2024,Generale regionale,SETTORE PUBBLICO E PRIVATO,Fp Cgil,TOSCANA,intera giornata lavorativa,https://www.cgsse.it/calendario-scioperi/dettaglio-sciopero/351365,false,2024-03-08,2024-03-08,2024-03-08,2024-03-08
23-03-2024,Regioni e autonomie Locali,COMUNE DI BOLOGNA,Sgb,BOLOGNA,intera giornata,https://www.cgsse.it/calendario-scioperi/dettaglio-sciopero/351357,false,2024-03-23,2024-03-23,2024-03-23,2024-03-23
22-03-2024,Trasporto pubblico locale,ATM MILANO,Al Cobas,"MILANO, MONZA, TREZZO SULL'ADDA","milano dalle ore 08,45 alle 15,00 e dalle 18,00 al termine del servizio.monza dalle 09,00 alle 11,50 e dalle 14,50 al termine del servizio.extraurbano trezzo dalle 8,45 alle 15,00 e dalle 18,00 al termine del servizio.",https://www.cgsse.it/calendario-scioperi/dettaglio-sciopero/351355,false,2024-03-22,2024-03-22,2024-03-22,2024-03-22
20-03-2024,Trasporto pubblico locale,MOVIBUS,Usb Lavoro Privato,MILANO,"da inizio servizio alle ore 05:30, dalle ore 08:30 alle ore 12:30 e dalle ore 15:30 a fine servizio.",https://www.cgsse.it/calendario-scioperi/dettaglio-sciopero/351345,false,2024-03-20,2024-03-20,2024-03-20,2024-03-20
Dal 19-03-2024 al 20-03-2024,Servizio sanitario nazionale,AUSL DI IMOLA,Fials,IMOLA,dalle ore 07:00 del 19/03 alle ore 07:00 del 20/03,https://www.cgsse.it/calendario-scioperi/dettaglio-sciopero/351337,false,2024-03-19,2024-03-20,2024-03-19,
13-03-2024,Regioni e autonomie Locali,SISPI,"Fiom Cgil, Fim Cisl, Rsu",PALERMO,intera giornata,https://www.cgsse.it/calendario-scioperi/dettaglio-sciopero/351322,true,2024-03-13,2024-03-13,2024-03-13,2024-03-13
22-03-2024,Elettricità,ENEL,"Filctem Cgil, Flaei Cisl, Uiltec Uil","PORTO EMPEDOCLE, CAVRIGLIA",intera giornata o turno di lavoro,https://www.cgsse.it/calendario-scioperi/dettaglio-sciopero/351309,false,2024-03-22,2024-03-22,2024-03-22,2024-03-22
21-03-2024,Elettricità,ENEL,"Filctem Cgil, Flaei Cisl, Uiltec Uil","RAVENNA, CIVITAVECCHIA",intera giornata o turno di lavoro,https://www.cgsse.it/calendario-scioperi/dettaglio-sciopero/351305,false,2024-03-21,2024-03-21,2024-03-21,2024-03-21
20-03-2024,Elettricità,ENEL,"Filctem Cgil, Flaei Cisl, Uiltec Uil","PIETRAFITTA, TERMINI IMERESE",intera giornata o turno di lavoro,https://www.cgsse.it/calendario-scioperi/dettaglio-sciopero/351301,false,2024-03-20,2024-03-20,2024-03-20,2024-03-20
19-03-2024,Elettricità,ENEL,"Filctem Cgil, Flaei Cisl, Uiltec Uil","PIACENZA, MONTALTO DI CASTRO",intera giornata o turno di lavoro,https://www.cgsse.it/calendario-scioperi/dettaglio-sciopero/351297,false,2024-03-19,2024-03-19,2024-03-19,2024-03-19
08-03-2024,Elettricità,ENEL,"Filctem Cgil, Flaei Cisl, Uiltec Uil",NAZIONALE,intera giornata e/o turno di lavoro esclusa la regione abruzzo e l'impianto della centrale termoelettrica enel sulcis grazia deledda,https://www.cgsse.it/calendario-scioperi/dettaglio-sciopero/351286,false,2024-03-08,2024-03-08,2024-03-08,2024-03-08
18-03-2024,Trasporto pubblico locale,AST,Faisa Cisal,MESSINA,dalle ore 05:30 alle ore 06:30 e dalle ore 09:30 alle ore 12:30,https://www.cgsse.it/calendario-scioperi/dettaglio-sciopero/351279,false,2024-03-18,2024-03-18,2024-03-18,2024-03-18
08-03-2024,Generale nazionale,TUTTE LE CATEGORIE PUBBLICHE E PRIVATE,"Proclamante:Cub
Aderente:Fmluniti-Cub",NAZIONALE,intera giornata escluso i settori dei trasporti.e i settori regione abruzzo,https://www.cgsse.it/calendario-scioperi/dettaglio-sciopero/351186,false,2024-03-08,2024-03-08,2024-03-08,2024-03-08
01-03-2024,Servizio sanitario nazionale,"AUXILIUM , CISS, MEDIHOSPES",Cobas Lavoro Privato,LECCE,ultime due ore per ogni turno di lavoro,https://www.cgsse.it/calendario-scioperi/dettaglio-sciopero/351179,true,2024-03-01,2024-03-01,2024-03-01,2024-03-01
Dal 23-03-2024 al 24-03-2024,Trasporto ferroviario,"GRUPPO FSI, MERCITALIA RAIL, TRENITALIA, TRENITALIA TPER SCARL",Assemblea Nazionale Pdm/pdb,NAZIONALE,dalle ore 21:00 del 23/03 alle ore 21:00 del 24/03,https://www.cgsse.it/calendario-scioperi/dettaglio-sciopero/351176,false,2024-03-23,2024-03-24,2024-03-23,
13-04-2024,Trasporto pubblico locale,ARRIVA UDINE,Associazione Sindacale Indipendente,UDINE,dalle ore 00:00 alle ore 24:00,https://www.cgsse.it/calendario-scioperi/dettaglio-sciopero/351174,true,2024-04-13,2024-04-13,2024-04-13,2024-04-13
23-03-2024,Trasporto aereo,"CFT LOGISTICA COOPERATIVA FACCHINAGGIO, REKEEP","Fit Cisl, Ugl Ta",FIRENZE,dalle ore 10:00 alle ore 18:00,https://www.cgsse.it/calendario-scioperi/dettaglio-sciopero/351156,false,2024-03-23,2024-03-23,2024-03-23,2024-03-23
13-03-2024,Trasporto ferroviario,RFI,Assemblea Nazionale Lavoratori Manutenzione Rfi,NAZIONALE,sciopero di otto ore per l' intera prestazione di lavoro,https://www.cgsse.it/calendario-scioperi/dettaglio-sciopero/351153,false,2024-03-13,2024-03-13,2024-03-13,2024-03-13
08-03-2024,Plurisettoriale regionale,SETTORI PRIVATI E PUBBLICI AFFERENTE AI COMPARTI DEI SERVIZI PUBBLICI (PUBBLICA AMMINISTRAZIONE SANITÀ IGIENE AMBIENTALE TERZO SETTORE) ISTRUZIONE E RICERCA,Fp Cgil,LAZIO,intera giornata lavorativa,https://www.cgsse.it/calendario-scioperi/dettaglio-sciopero/351136,false,2024-03-08,2024-03-08,2024-03-08,2024-03-08
Dal 23-03-2024 al 24-03-2024,Plurisettoriale nazionale,AZIENDE CHE SVOLGONO ATTIVITA FERROVIARIA,"Proclamante:Cub Trasporti, Sgb
Aderente:Usb Lavoro Privato",NAZIONALE,dalle ore 21:00 del 23/03 alle ore 21:00 del 24/03,https://www.cgsse.it/calendario-scioperi/dettaglio-sciopero/351127,false,2024-03-23,2024-03-24,2024-03-23,
29-02-2024,Servizio sanitario nazionale,COOP. IL POZZO,Cub Sanità,VOLPIANO,dalle ore 9.00 a fine turno,https://www.cgsse.it/calendario-scioperi/dettaglio-sciopero/351124,false,2024-02-29,2024-02-29,2024-02-29,2024-02-29
04-03-2024,Trasporto pubblico locale,MOVIBUS,Usb Lavoro Privato,MILANO,"da inizio servizio alle ore 05:30, dalle ore 08:30 alle ore 12:30 e dalle ore 15:30 a fine servizio.",https://www.cgsse.it/calendario-scioperi/dettaglio-sciopero/351113,true,2024-03-04,2024-03-04,2024-03-04,2024-03-04
08-03-2024,Pulizie e multiservizi,"CONSORZIO SERVIZI INTEGRATI, EPM, GESAP",Usb Lavoro Privato,NAPOLI,intera giornata,https://www.cgsse.it/calendario-scioperi/dettaglio-sciopero/351111,true,2024-03-08,2024-03-08,2024-03-08,2024-03-08
08-03-2024,Trasporto pubblico locale,AST,Faisa Cisal,MESSINA,dalle ore 05:30 alle ore 06:30 e dalle ore 09:30 alle ore 12:30,https://www.cgsse.it/calendario-scioperi/dettaglio-sciopero/351109,true,2024-03-08,2024-03-08,2024-03-08,2024-03-08
23-03-2024,Trasporto aereo,AIR DOLOMITI,Anpac,NAZIONALE,dalle ore 10:00 alle ore 18:00,https://www.cgsse.it/calendario-scioperi/dettaglio-sciopero/351106,false,2024-03-23,2024-03-23,2024-03-23,2024-03-23
28-02-2024,Scuola,ISTITUTO COMPRENSIVO VIA PIROTTA,Rsu,ROMA,intera giornata,https://www.cgsse.it/calendario-scioperi/dettaglio-sciopero/351098,true,2024-02-28,2024-02-28,2024-02-28,2024-02-28
22-03-2024,Trasporto pubblico locale,AMTAB,Uitrasporti,BARI,dalle ore 08:30 alle ore 12:30,https://www.cgsse.it/calendario-scioperi/dettaglio-sciopero/351084,true,2024-03-22,2024-03-22,2024-03-22,2024-03-22
23-03-2024,Vigili del fuoco,MINISTERO DELL'INTERNO,"Conapo, Uil Pa, Fp Cgil, Confsal, Usb, Fns Cisl",TORINO,dalle ore 08:00 alle ore 12:00,https://www.cgsse.it/calendario-scioperi/dettaglio-sciopero/351067,false,2024-03-23,2024-03-23,2024-03-23,2024-03-23
26-02-2024,Regioni e autonomie Locali,COOP ORSA,"Fp Cgil, Uiltucs",LECCE,intera giornata,https://www.cgsse.it/calendario-scioperi/dettaglio-sciopero/351051,true,2024-02-26,2024-02-26,2024-02-26,2024-02-26
08-04-2024,Trasporto aereo,AIR DOLOMITI,Uiltrasporti,NAZIONALE,intera giornata,https://www.cgsse.it/calendario-scioperi/dettaglio-sciopero/351045,false,2024-04-08,2024-04-08,2024-04-08,2024-04-08
15-03-2024,Trasporto pubblico locale,MOVIBUS,"Filt Cgil, Fit Cisl, Uilt Uil, Faisa Cisal",MILANO,dalle ore 16.30 alle ore 20.30,https://www.cgsse.it/calendario-scioperi/dettaglio-sciopero/351043,true,2024-03-15,2024-03-15,2024-03-15,2024-03-15
18-03-2024,Trasporto pubblico locale,"AMAT, AMTS CATANIA, ASM TAORMINA, AST, ATM MESSINA, ATM TRAPANI, GESTIONE GOVERNATIVA FERROVIA CIRCUMETNEA, TUA AGRIGENTO",Faisa Cisal,SICILIA,sciopero di 4 ore nel rispetto delle fasce orarie previste in ciascuna azienda,https://www.cgsse.it/calendario-scioperi/dettaglio-sciopero/351034,true,2024-03-18,2024-03-18,2024-03-18,2024-03-18
04-03-2024,Elettricità,ENEL,Ugl Chimici,NAZIONALE,sciopero di tutti i dipendenti di tutte le società del gruppo enel spa con sede di lavoro in tutto il territorio nazionale.,https://www.cgsse.it/calendario-scioperi/dettaglio-sciopero/351025,true,2024-03-04,2024-03-04,2024-03-04,2024-03-04
08-03-2024,Generale nazionale,TUTTE LE CATEGORIE PUBBLICHE E PRIVATE,"Proclamante:Adl Cobas
Aderente:Clap, Si Cobas",NAZIONALE,"dalle ore 00:01 alle ore 23:59, esclusi i settori dei trasporti (aereo, ferroviario, pubblico locale e marittimo), i lavoratori delle autostrade lo sciopero avrà inizio dalle ore 22:00 del 7/03 alle ore 22:00 dell'8/03 esclusa la regione abruzzo",https://www.cgsse.it/calendario-scioperi/dettaglio-sciopero/351020,false,2024-03-08,2024-03-08,2024-03-08,2024-03-08
22-03-2024,Trasporto pubblico locale,FERROVIE DEL SUD EST E SERVIZI AUTOMOBILISTICI,"Filt Cgil, Fit Cisl, Uiltrasporti, Faisa Cisal",BARI,"da inizio servizio alle ore 5.00, dalle ore 8.00 alle ore 12.30 e dalle ore 15.30 a fine servizio",https://www.cgsse.it/calendario-scioperi/dettaglio-sciopero/351014,false,2024-03-22,2024-03-22,2024-03-22,2024-03-22
04-03-2024,Elettricità,ENEL,"Filctem Cgil, Flaei Cisl, Uiltec Uil",NAZIONALE,intera giornata e/o turno di lavoro,https://www.cgsse.it/calendario-scioperi/dettaglio-sciopero/351002,true,2024-03-04,2024-03-04,2024-03-04,2024-03-04
23-02-2024,Università,GSA,"Filcams Cgil, Fisascat Cisl, Uiltucs Uil",NAPOLI,intera giornata appalto,https://www.cgsse.it/calendario-scioperi/dettaglio-sciopero/350995,false,2024-02-23,2024-02-23,2024-02-23,2024-02-23
23-02-2024,Trasporto pubblico locale,START ROMAGNA,Fit Cisl,RAVENNA,personale urbano e extraurbano dalle 17:30 alle 21:30 personale traghetto: dalle 17:30 alle 21:30,https://www.cgsse.it/calendario-scioperi/dettaglio-sciopero/350980,true,2024-02-23,2024-02-23,2024-02-23,2024-02-23
23-02-2024,Pulizie e multiservizi,ROMEO GESTIONI,Fisascat Cisl,NOCERA INFERIORE,intero turno,https://www.cgsse.it/calendario-scioperi/dettaglio-sciopero/350973,true,2024-02-23,2024-02-23,2024-02-23,2024-02-23
Dal 28-02-2024 al 29-02-2024,Servizio sanitario nazionale,AUSL DI IMOLA,Fials,IMOLA,"dalle ore 07,00 del 28 febbraio alle ore 07,00 del 29 febbraio",https://www.cgsse.it/calendario-scioperi/dettaglio-sciopero/350963,true,2024-02-28,2024-02-29,2024-02-28,
01-03-2024,Servizio sanitario nazionale,ENGIE ITALIA,Fiom Cgil,NAZIONALE,8 ore per ogni turno di lavoro,https://www.cgsse.it/calendario-scioperi/dettaglio-sciopero/350961,true,2024-03-01,2024-03-01,2024-03-01,2024-03-01
19-03-2024,Appalti ferroviari,DUSSMANN SERVICE,"Filt Cgil, Fit Cisl, Uiltrasporti, Ugl Ferrovieri, Slm Fast, Orsa Salpas",CAMPANIA,astensione di mezzo turno per ogni turno di lavoro.,https://www.cgsse.it/calendario-scioperi/dettaglio-sciopero/350956,true,2024-03-19,2024-03-19,2024-03-19,2024-03-19
08-04-2024,Trasporto aereo,ENAV,"Filt Cgil, Fit Cisl, Uiltrasporti, Ugl Ta, Fast Confsal Av Unica",BRINDISI,dalle ore 00:01 alle ore 24:00,https://www.cgsse.it/calendario-scioperi/dettaglio-sciopero/350944,false,2024-04-08,2024-04-08,2024-04-08,2024-04-08
04-03-2024,Avvocati,SETTORE GIUSTIZIA,Camera Penale Di Milano,MILANO,astensione dall’attività giudiziaria e da ogni altra attività penale nel circondario del tribunale di milano,https://www.cgsse.it/calendario-scioperi/dettaglio-sciopero/350938,false,2024-03-04,2024-03-04,2024-03-04,2024-03-04
22-02-2024,Pulizie e multiservizi,ROMEO GESTIONI,Fisascat Cisl,NOCERA INFERIORE,intero turno di lavoro,https://www.cgsse.it/calendario-scioperi/dettaglio-sciopero/350926,true,2024-02-22,2024-02-22,2024-02-22,2024-02-22
08-03-2024,Trasporto pubblico locale,BUSITALIA SITA NORD,Faisa Cisal,UMBRIA,intera giornata nel rispetto delle fasce di garanzia,https://www.cgsse.it/calendario-scioperi/dettaglio-sciopero/350922,true,2024-03-08,2024-03-08,2024-03-08,2024-03-08
23-03-2024,Trasporto aereo,ENAV,"Fit Cisl, Ugl Ta, Fast Confsal Av Unica, Rsa",VERONA,dalle ore 10:00 alle ore 18:00,https://www.cgsse.it/calendario-scioperi/dettaglio-sciopero/350893,true,2024-03-23,2024-03-23,2024-03-23,2024-03-23
08-03-2024,Generale nazionale,TUTTE LE CATEGORIE PUBBLICHE E PRIVATE,Usi 1912,NAZIONALE,"intera giornata con esclusione di tutto il settore dei trasporti (trasporto aereo, ferroviario, pubblico locale e marittimo) per il settore dei vigili del fuoco dalle ore 08:00 alle ore 14:00.",https://www.cgsse.it/calendario-scioperi/dettaglio-sciopero/350875,false,2024-03-08,2024-03-08,2024-03-08,2024-03-08
29-02-2024,Servizio sanitario nazionale,SANITASERVICE ASL BAT,"Fp Cgil, Fp Cisl, Uil Fpl",BARLETTA-ANDRIA-TRANI,dalle ore 8.00 alle ore 12.00,https://www.cgsse.it/calendario-scioperi/dettaglio-sciopero/350873,true,2024-02-29,2024-02-29,2024-02-29,2024-02-29
13-04-2024,Trasporto pubblico locale,BUSITALIA SITA NORD,Faisa Cisal,UMBRIA,24 ore con il rispetto delle fasce di garanzia,https://www.cgsse.it/calendario-scioperi/dettaglio-sciopero/350868,true,2024-04-13,2024-04-13,2024-04-13,2024-04-13
23-02-2024,Trasporto pubblico locale,MOVIBUS,Usb Lavoro Privato,MILANO,"da inizio servizio alle ore 05:30, dalle ore 08:30 alle ore 12:30 e dalle ore 15:30 a fine servizio.",https://www.cgsse.it/calendario-scioperi/dettaglio-sciopero/350863,true,2024-02-23,2024-02-23,2024-02-23,2024-02-23
20-02-2024,Igiene ambientale,"ECOIN, ICOS, ISEDA, LICATA AMBIENTE, SEA, SEAP, TRAINA",Fp Cgil,LICATA,intera giornata,https://www.cgsse.it/calendario-scioperi/dettaglio-sciopero/350860,true,2024-02-20,2024-02-20,2024-02-20,2024-02-20
20-02-2024,Igiene ambientale,DUSTY,Fp Cgil,SAN GIOVANNI LA PUNTA,intera giornata,https://www.cgsse.it/calendario-scioperi/dettaglio-sciopero/350855,true,2024-02-20,2024-02-20,2024-02-20,2024-02-20
16-03-2024,Vigili del fuoco,MINISTERO DELL'INTERNO,"Conapo, Uil Pa, Fp Cgil, Confsal, Usb, Fns Cisl",TORINO,dalle ore 08:00 alle ore 12:00,https://www.cgsse.it/calendario-scioperi/dettaglio-sciopero/350843,true,2024-03-16,2024-03-16,2024-03-16,2024-03-16
20-02-2024,Regioni e autonomie Locali,ATER,"Fp Cgil, Fp Cisl, Uil Fpl",FRIULI VENEZIA GIULIA,intera giornata lavorativa,https://www.cgsse.it/calendario-scioperi/dettaglio-sciopero/350836,false,2024-02-20,2024-02-20,2024-02-20,2024-02-20
Dal 20-02-2024 al 21-02-2024,Igiene ambientale,MULTI SERVCES COOP.,Fial,CASAMARCIANO,dalle ore 00:01 del giorno 20 febbraio alle ore 24:00 del giorno 21 febbraio,https://www.cgsse.it/calendario-scioperi/dettaglio-sciopero/350832,true,2024-02-20,2024-02-21,2024-02-20,
08-03-2024,Generale nazionale,TUTTE LE CATEGORIE PUBBLICHE E PRIVATE,Usi Cit,NAZIONALE,"intera giornata con esclusione di tutto il settore dei trasporti (trasporto aereo, ferroviario, pubblico locale e marittimo) esclusa la regione abruzzo per consultazioni elettorali. per il settore dei vigili del fuoco dalle ore 9:00 alle ore 13:00.",https://www.cgsse.it/calendario-scioperi/dettaglio-sciopero/350830,false,2024-03-08,2024-03-08,2024-03-08,2024-03-08
Dal 19-03-2024 al 21-03-2024,Pulizie e multiservizi,PULITORI E AFFINI,Cub,TREVISO,dalle ore 09:00 del 19/03 alle ore 09:00 del 21/03,https://www.cgsse.it/calendario-scioperi/dettaglio-sciopero/350821,false,2024-03-19,2024-03-21,2024-03-19,
03-03-2024,Regioni e autonomie Locali,COMUNE DI BOLOGNA,Sgb,BOLOGNA,intera giornata,https://www.cgsse.it/calendario-scioperi/dettaglio-sciopero/350819,true,2024-03-03,2024-03-03,2024-03-03,2024-03-03
Dal 28-02-2024 al 29-02-2024,Trasporto ferroviario,MERCITALIA RAIL,"Ugl, Orsa",LIGURIA,dalle ore 21:01 del 28/02/2024 alle ore 21:00 del 29/02/2024,https://www.cgsse.it/calendario-scioperi/dettaglio-sciopero/350815,true,2024-02-28,2024-02-29,2024-02-28,
Dal 19-02-2024 al 26-02-2024,Igiene ambientale,DUSTY,Confali Sifus,"MISTERBIANCO, GRAVINA DI CATANIA",sciopero ad oltranza,https://www.cgsse.it/calendario-scioperi/dettaglio-sciopero/350807,true,2024-02-19,2024-02-26,2024-02-19,
20-02-2024,Igiene ambientale,DUSTY,Fp Cgil,SANTA MARIA DI LICODIA,intera giornata,https://www.cgsse.it/calendario-scioperi/dettaglio-sciopero/350805,true,2024-02-20,2024-02-20,2024-02-20,2024-02-20
18-03-2024,Trasporto pubblico locale,TEP,"Rsu, Filt Cgil, Fit Cisl, Uiltrasporti, Faisa Cisal, Orsa",PARMA,fasce garantite servizio urbano dalle 05:30 alle 08:30 e dalle 12:10 alle 14:40 servizio extraurbano dalle 05:30 alle 08:45 e dalle 12:10 alle 14:55.,https://www.cgsse.it/calendario-scioperi/dettaglio-sciopero/350793,true,2024-03-18,2024-03-18,2024-03-18,2024-03-18
18-03-2024,Trasporto pubblico locale,CIALONE TOUR,Usb Lavoro Privato,FROSINONE,dalle ore 08:30 alle ore 17:00 e dalle ore 20:00 fino a fine servizio,https://www.cgsse.it/calendario-scioperi/dettaglio-sciopero/350771,false,2024-03-18,2024-03-18,2024-03-18,2024-03-18
17-02-2024,Igiene ambientale,NEW SYSTEM SERVICE,Fp Cgil,"SAN CIPIRELLO, SAN GIUSEPPE JATO",intero turno lavorativo e lavoro straordinario ad oltranza,https://www.cgsse.it/calendario-scioperi/dettaglio-sciopero/350769,true,2024-02-17,2024-02-17,2024-02-17,2024-02-17
08-03-2024,Pulizie e multiservizi,"ATI MERANESE SERVIZI, ISS ITALIA, M.S. SERVIZI",Usb Lavoro Privato,CASTELLAMMARE DI STABIA,intera giornata lavorativa,https://www.cgsse.it/calendario-scioperi/dettaglio-sciopero/350765,true,2024-03-08,2024-03-08,2024-03-08,2024-03-08
21-03-2024,Poste,POSTE ITALIANE,"Cobas Poste Lavoro Privato, Slg Cub Poste, Cub Poste",NAZIONALE,intera giornata dal primo turno montante notturno,https://www.cgsse.it/calendario-scioperi/dettaglio-sciopero/350749,false,2024-03-21,2024-03-21,2024-03-21,2024-03-21
09-05-2024,Scuola,MIM,Cobas Scuola Sardegna,NAZIONALE,intera giornata,https://www.cgsse.it/calendario-scioperi/dettaglio-sciopero/350700,false,2024-05-09,2024-05-09,2024-05-09,2024-05-09
Dal 22-02-2024 al 24-02-2024,Igiene ambientale,E-KORU,"Fp Cgil, Fit Cisl, Uiltrasporti, Fiadel",VILLA SAN GIOVANNI,dalle ore 06:01 del 22/02 alle ore 05:59 del 24/02 intero turno di lavoro.,https://www.cgsse.it/calendario-scioperi/dettaglio-sciopero/350672,false,2024-02-22,2024-02-24,2024-02-22,
18-03-2024,Trasporto pubblico locale,"ETNA TRASPORTI, INTERBUS, SEGESTA AUTOLINEE, SICILBUS",Fit Cisl,"PALERMO , ENNA , CATANIA",dalle 9.30 alle 13.30,https://www.cgsse.it/calendario-scioperi/dettaglio-sciopero/350623,false,2024-03-18,2024-03-18,2024-03-18,2024-03-18
23-02-2024,Pulizie e multiservizi,MAXIMA,"Filcams Cgil, Fisascat Cisl",NAPOLI,intera giornata,https://www.cgsse.it/calendario-scioperi/dettaglio-sciopero/350615,false,2024-02-23,2024-02-23,2024-02-23,2024-02-23
16-02-2024,Pulizie e multiservizi,"ATI MERANESE SERVIZI, ISS ITALIA, M.S. SERVIZI",Usb Lavoro Privato,CASTELLAMMARE DI STABIA,intera giornata lavorativa,https://www.cgsse.it/calendario-scioperi/dettaglio-sciopero/350602,true,2024-02-16,2024-02-16,2024-02-16,2024-02-16
19-02-2024,Servizio sanitario nazionale,SLEM,Filcams Cgil,VENOSA,intera giornata,https://www.cgsse.it/calendario-scioperi/dettaglio-sciopero/350600,false,2024-02-19,2024-02-19,2024-02-19,2024-02-19
19-02-2024,Servizio sanitario nazionale,CISA COOP. SOC.,Filcams Cgil,PESCARA,intera giornata,https://www.cgsse.it/calendario-scioperi/dettaglio-sciopero/350597,true,2024-02-19,2024-02-19,2024-02-19,2024-02-19
12-04-2024,Servizio sanitario nazionale,AZIENDE E STRUTTURE DEL SERVIZIO SANITARIO REGIONALE,Uil Fpl,PIEMONTE,intera giornata o turno di lavoro,https://www.cgsse.it/calendario-scioperi/dettaglio-sciopero/350593,true,2024-04-12,2024-04-12,2024-04-12,2024-04-12
25-02-2024,Regioni e autonomie Locali,COMUNE DI COLLEGNO,Cse Flpl,COLLEGNO,intera giornata lavorativa,https://www.cgsse.it/calendario-scioperi/dettaglio-sciopero/350587,false,2024-02-25,2024-02-25,2024-02-25,2024-02-25
Dal 19-03-2024 al 20-03-2024,Ministeri,"COOPERATIVA NUOVI ORIZZONTI, RICINA, VERBATIM",Cobas Lavoro Privato,NAZIONALE,dalle ore 00:01 del 19/03 alle ore 23:59 del 20/03,https://www.cgsse.it/calendario-scioperi/dettaglio-sciopero/350582,false,2024-03-19,2024-03-20,2024-03-19,
08-03-2024,Trasporto pubblico locale,AMTAB,Uitrasporti,BARI,dalle ore 08:30 alle ore 12:30,https://www.cgsse.it/calendario-scioperi/dettaglio-sciopero/350574,true,2024-03-08,2024-03-08,2024-03-08,2024-03-08
Dal 14-02-2024 al 15-02-2024,Ministeri,"COOPERATIVA NUOVI ORIZZONTI, RICINA, VERBATIM",Cobas Lavoro Privato,NAZIONALE,dalle ore 00:01 del 14/02 alle ore 23:59 del 15/02.,https://www.cgsse.it/calendario-scioperi/dettaglio-sciopero/350567,true,2024-02-14,2024-02-15,2024-02-14,
21-02-2024,Trasporto pubblico locale,TEP,"Filt Cgil, Rsu, Fit Cisl, Faisa Cisal, Uiltrasporti, Orsa",PARMA,fasce garantite servizio urbano dalle 05:30 alle 08:30 e dalle 12:10 alle 14:40 servizio extraurbano dalle 05:30 alle 08:45 e dalle 12:10 alle 14:55.,https://www.cgsse.it/calendario-scioperi/dettaglio-sciopero/350522,true,2024-02-21,2024-02-21,2024-02-21,2024-02-21
12-02-2024,Igiene ambientale,"COLOMBO BIAGIO, GIAL PLAST",Cobas Lavoro Privato,GALLIPOLI,dalle ore 00:00 alle ore 24:00,https://www.cgsse.it/calendario-scioperi/dettaglio-sciopero/350509,true,2024-02-12,2024-02-12,2024-02-12,2024-02-12
16-02-2024,Igiene ambientale,RIECO,Usb Lavoro Privato,TOLFA,intero turno,https://www.cgsse.it/calendario-scioperi/dettaglio-sciopero/350507,true,2024-02-16,2024-02-16,2024-02-16,2024-02-16
15-02-2024,Energia e petrolio,AMG ENERGIA,Ugl,PALERMO,ultime 4 ore lavorative,https://www.cgsse.it/calendario-scioperi/dettaglio-sciopero/350499,true,2024-02-15,2024-02-15,2024-02-15,2024-02-15
17-02-2024,Trasporto pubblico locale,ARRIVA UDINE,Associazione Sindacale Indipendente,UDINE,dalle ore 00:00 alle ore 24:00,https://www.cgsse.it/calendario-scioperi/dettaglio-sciopero/350489,true,2024-02-17,2024-02-17,2024-02-17,2024-02-17
23-02-2024,Generale nazionale,TUTTI I SETTORI PUBBLICI E PRIVATI,"Al Cobas, Lavoratori Metalmeccanici Organizzati, Sindacato Generale Di Classe, Slai Prol Cobas, Sindacato Operai Autorganizzati, Fao Cobas",NAZIONALE,"dalle ore 00:01 alle ore 23:59, con esclusione: trasporti,vv.ff.,polizia loc. milano,strutture con ccnl federcasa.per la sardegna:regioni autonomie locali,ig. amb.,telecomunic.,elettrictà,gas-acqua,funerario,ministeri,elicotteri e carburanti",https://www.cgsse.it/calendario-scioperi/dettaglio-sciopero/350487,false,2024-02-23,2024-02-23,2024-02-23,2024-02-23
21-02-2024,Trasporto pubblico locale,MOVIBUS,Usb Lavoro Privato,MILANO,"da inizio servizio alle ore 05:30, dalle ore 08:30 alle ore 12:30 e dalle ore 15:30 a fine servizio.",https://www.cgsse.it/calendario-scioperi/dettaglio-sciopero/350476,true,2024-02-21,2024-02-21,2024-02-21,2024-02-21
13-02-2024,Servizio sanitario nazionale,GPI,Fiom Cgil,TRENTO,intera giornta,https://www.cgsse.it/calendario-scioperi/dettaglio-sciopero/350474,true,2024-02-13,2024-02-13,2024-02-13,2024-02-13
13-02-2024,Igiene ambientale,SEA,Fp Cgil,ARAGONA,intera giornata o turno di lavoro,https://www.cgsse.it/calendario-scioperi/dettaglio-sciopero/350472,false,2024-02-13,2024-02-13,2024-02-13,2024-02-13
08-03-2024,Generale nazionale,TUTTE LE CATEGORIE PUBBLICHE E PRIVATE,"Proclamante:Usb
Aderente:Usb Lavoro Privato",NAZIONALE,"intera giornata con esclusione di tutto il settore dei trasporti (trasporto aereo, ferroviario, pubblico locale e marittimo) per il settore dei vigili del fuoco dalle ore 9:00 alle ore 13:00.e la regione abruzzo",https://www.cgsse.it/calendario-scioperi/dettaglio-sciopero/350466,false,2024-03-08,2024-03-08,2024-03-08,2024-03-08
23-02-2024,Generale nazionale,TUTTI I SETTORI PUBBLICI E PRIVATI,Si Cobas,NAZIONALE,dalle ore 00:00 alle ore 23:59,https://www.cgsse.it/calendario-scioperi/dettaglio-sciopero/350464,false,2024-02-23,2024-02-23,2024-02-23,2024-02-23
17-02-2024,Vigili del fuoco,MINISTERO DELL'INTERNO,Conapo,NAZIONALE,dalle ore 09:00 alle ore 13:00,https://www.cgsse.it/calendario-scioperi/dettaglio-sciopero/350462,false,2024-02-17,2024-02-17,2024-02-17,2024-02-17
16-02-2024,Trasporto pubblico locale,CIALONE TOUR,Usb Lavoro Privato,FROSINONE,dalle ore 8:30 alle ore 17:00 e dalle ore 20:00 fino a fine servizio,https://www.cgsse.it/calendario-scioperi/dettaglio-sciopero/350458,true,2024-02-16,2024-02-16,2024-02-16,2024-02-16
21-02-2024,Trasporto pubblico locale,"AMAT, AMTS CATANIA, ASM TAORMINA, AST, ATM MESSINA, ATM TRAPANI, GESTIONE GOVERNATIVA FERROVIA CIRCUMETNEA, TUA AGRIGENTO",Faisa Cisal,SICILIA,sciopero di 4 ore su scala regionale nel rispetto delle fasce orarie previste in ciascuna azienda del settore,https://www.cgsse.it/calendario-scioperi/dettaglio-sciopero/350450,true,2024-02-21,2024-02-21,2024-02-21,2024-02-21
21-02-2024,Trasporto pubblico locale,AUTOLINEE TOSCANE,Fast Confsal,PISA,"da inizio servizio alle ore 4:15, dalle ore 8:14 alle ore 12:14 e dalle ore 14:29 a fine servizio",https://www.cgsse.it/calendario-scioperi/dettaglio-sciopero/350445,false,2024-02-21,2024-02-21,2024-02-21,2024-02-21
08-03-2024,Plurisettoriale territoriale,"COMPARTI DEI SERVIZI PUBBLICI (PUBBLICA AMMINISTRAZIONE, SANITÀ, IGIENE AMBIENTALE, TERZO SETTORE)",Fp Cgil,BOLOGNA,intera giornata lavorativa,https://www.cgsse.it/calendario-scioperi/dettaglio-sciopero/350435,false,2024-03-08,2024-03-08,2024-03-08,2024-03-08
09-02-2024,Appalti ferroviari,DUSSMANN SERVICE,"Filt Cgil, Fit Cisl, Uiltrasporti, Ugl Ferrovieri, Slm Fast Confsal",LAZIO,secondo mezzo turno per ogni turno di lavoro,https://www.cgsse.it/calendario-scioperi/dettaglio-sciopero/350423,false,2024-02-09,2024-02-09,2024-02-09,2024-02-09
09-02-2024,Appalti ferroviari,CONSORZIO STABILE CMF,"Filt Cgil, Fit Cisl, Uiltrasporti, Ugl Ferrovieri, Slm Fast Confsal",LAZIO,intero turno di lavoro per ogni turno di lavoro,https://www.cgsse.it/calendario-scioperi/dettaglio-sciopero/350414,false,2024-02-09,2024-02-09,2024-02-09,2024-02-09
Dal 12-02-2024 al 13-02-2024,Sanità privata,INNOTEC,Cse,BARI,intere giornate o turni di lavoro,https://www.cgsse.it/calendario-scioperi/dettaglio-sciopero/350408,true,2024-02-12,2024-02-13,2024-02-12,
09-02-2024,Trasporto aereo,"COMPARTO AEREO, AEROPORTUALE E INDOTTO DEGLI AEROPORTI","Proclamante:Cub, Cub Trasporti
Aderente:Adl, Flai Trasporti E Servizi",NAZIONALE,dalle ore 00:01 alle ore 23:59. con eslusione del personale dipendente di enav.,https://www.cgsse.it/calendario-scioperi/dettaglio-sciopero/350361,false,2024-02-09,2024-02-09,2024-02-09,2024-02-09
05-02-2024,Igiene ambientale,SEA SOLUZIONI ECOAMBIENTALI,Usb Lavoro Privato,FIRENZE,intera giornata,https://www.cgsse.it/calendario-scioperi/dettaglio-sciopero/350351,false,2024-02-05,2024-02-05,2024-02-05,2024-02-05
12-02-2024,Trasporto ferroviario,"CARGO, GRUPPO FSI, PAX",Usb Lavoro Privato,NAZIONALE,dalle ore 9:00 alle ore 16:59,https://www.cgsse.it/calendario-scioperi/dettaglio-sciopero/350349,false,2024-02-12,2024-02-12,2024-02-12,2024-02-12
05-02-2024,Trasporto pubblico locale,AUTOLINEE TOSCANE,Fast Confsal,PISA,"da inizio servizio alle ore 4:15, dalle ore 8:14 alle ore 12:14 e dalle ore 14:29 a fine servizio",https://www.cgsse.it/calendario-scioperi/dettaglio-sciopero/349783,true,2024-02-05,2024-02-05,2024-02-05,2024-02-05
Dal 05-02-2024 al 06-02-2024,Igiene ambientale,TEOREMA,Cobas Lavoro Privato,GROTTAGLIE,intere giornate,https://www.cgsse.it/calendario-scioperi/dettaglio-sciopero/349732,true,2024-02-05,2024-02-06,2024-02-05,
Dal 07-02-2024 al 09-02-2024,Avvocati,SETTORE GIUSTIZIA,Unione Camere Penali Italiane,NAZIONALE,astensione dalle udienze e da ogni attività giudiziaria nel settore penale ad esclusione del circondario di termini imerese.,https://www.cgsse.it/calendario-scioperi/dettaglio-sciopero/349730,false,2024-02-07,2024-02-09,2024-02-07,
12-02-2024,Trasporto ferroviario,"GRUPPO FSI, RFI",Usb Lavoro Privato,NAZIONALE,intera prestazione di lavoro del personale degli impianti manutenzione infrastrutture di rfi,https://www.cgsse.it/calendario-scioperi/dettaglio-sciopero/349727,false,2024-02-12,2024-02-12,2024-02-12,2024-02-12
09-02-2024,Trasporto aereo,AIR DOLOMITI,Anpac,NAZIONALE,dalle ore 12:30 alle ore 16:30,https://www.cgsse.it/calendario-scioperi/dettaglio-sciopero/349204,false,2024-02-09,2024-02-09,2024-02-09,2024-02-09
08-02-2024,Istituti di vigilanza,COSMOPOL,Uiltucs,BRINDISI,intera giornata e/o intero turno di lavoro,https://www.cgsse.it/calendario-scioperi/dettaglio-sciopero/349201,true,2024-02-08,2024-02-08,2024-02-08,2024-02-08
29-01-2024,Servizio sanitario nazionale,SECURPOL PUGLIA,Sgb,NAPOLI,dalle ore 11:00 alle ore 15:00,https://www.cgsse.it/calendario-scioperi/dettaglio-sciopero/349188,true,2024-01-29,2024-01-29,2024-01-29,2024-01-29
13-02-2024,Trasporto pubblico locale,BUSITALIA SITA NORD,Usb Lavoro Privato,UMBRIA,"perugia e spoleto fasce garantite dalle 06.00 alle 09.00 e dalle 12.00 alle 15.00, terni fasce garantite dalle 06.30 alle 09.30 e dalle 12.30 alle 15.30, servizi ferroviari fasce garantite dalle 5.45 alle 8.45 e dalle 11,45 alle ore 14.45",https://www.cgsse.it/calendario-scioperi/dettaglio-sciopero/349185,false,2024-02-13,2024-02-13,2024-02-13,2024-02-13
08-02-2024,Servizio sanitario nazionale,NEW CITTA' DI CATANIA,Usb Lavoro Privato,CATANIA,intero turno di lavoro,https://www.cgsse.it/calendario-scioperi/dettaglio-sciopero/349181,false,2024-02-08,2024-02-08,2024-02-08,2024-02-08
09-02-2024,Trasporto aereo,AIR DOLOMITI,Uiltrasporti,NAZIONALE,dalle ore 12:30 alle ore 16:30,https://www.cgsse.it/calendario-scioperi/dettaglio-sciopero/349179,false,2024-02-09,2024-02-09,2024-02-09,2024-02-09
05-02-2024,Pulizie e multiservizi,MAXIMA,"Filcams Cgil, Fisascat Cisl",NAPOLI,intera giornata,https://www.cgsse.it/calendario-scioperi/dettaglio-sciopero/349174,true,2024-02-05,2024-02-05,2024-02-05,2024-02-05
29-01-2024,Servizio sanitario nazionale,NTA,"Filcams Cgil, Fisascat Cisl, Uiltrasporti","ANDRIA, BARLETTA, TRANI",intera giornata lavorativa,https://www.cgsse.it/calendario-scioperi/dettaglio-sciopero/349165,false,2024-01-29,2024-01-29,2024-01-29,2024-01-29
24-01-2024,Trasporto pubblico locale,ANM,Usb Lavoro Privato,NAPOLI,,https://www.cgsse.it/calendario-scioperi/dettaglio-sciopero/349161,true,2024-01-24,2024-01-24,2024-01-24,2024-01-24
29-01-2024,Pulizie e multiservizi,MAXIMA,"Filcams Cgil, Fisascat Cisl",NAPOLI,intera giornata,https://www.cgsse.it/calendario-scioperi/dettaglio-sciopero/349155,true,2024-01-29,2024-01-29,2024-01-29,2024-01-29
11-02-2024,Regioni e autonomie Locali,"DUSSMANN, SOCIETÀ COOPERATIVA CULTURE",Filcams Cgil,MILANO,intero turno di lavoro,https://www.cgsse.it/calendario-scioperi/dettaglio-sciopero/349148,false,2024-02-11,2024-02-11,2024-02-11,2024-02-11
04-02-2024,Regioni e autonomie Locali,COMUNE DI COLLEGNO,Cse Flpl,COLLEGNO,intera giornata lavorativa,https://www.cgsse.it/calendario-scioperi/dettaglio-sciopero/349145,false,2024-02-04,2024-02-04,2024-02-04,2024-02-04
