data,settore,azienda,sindacato,ambito_geografico,modalita,dettagli_link,revocato,data_iso,data_sort,data_al_iso,data_dal_iso
18-03-2026,Trasporto aereo,MH24,Usb Lavoro Privato,BRESCIA,dalle ore 00.00 alle ore 23.59,https://www.cgsse.it/calendario-scioperi/dettaglio-sciopero/376085,false,2026-03-18,2026-03-18,2026-03-18,2026-03-18
18-03-2026,Trasporto aereo,GDA HANDLING,Usb Lavoro Privato,BRESCIA,dalle ore 00.00 alle ore 23.59,https://www.cgsse.it/calendario-scioperi/dettaglio-sciopero/376083,false,2026-03-18,2026-03-18,2026-03-18,2026-03-18
09-03-2026,Generale nazionale,TUTTI I SETTORI PUBBLICI E PRIVATI,Clap,NAZIONALE,intera giornata,https://www.cgsse.it/calendario-scioperi/dettaglio-sciopero/376081,false,2026-03-09,2026-03-09,2026-03-09,2026-03-09
09-03-2026,Pulizie e multiservizi,EBATRADE,Uiltrasporti,MONTELIBRETTI,intera giornata,https://www.cgsse.it/calendario-scioperi/dettaglio-sciopero/376076,false,2026-03-09,2026-03-09,2026-03-09,2026-03-09
19-03-2026,Servizio sanitario nazionale,"COOPERATIVA OCCUPAZIONE E SOLIDARIETÀ, COOPERATIVA SIRIO, COOPERATIVA SOCIALE SAN BERNARDO, THCS",Uil Fpl,BRINDISI,dalle ore 8.00 alle ore 20.00,https://www.cgsse.it/calendario-scioperi/dettaglio-sciopero/376062,false,2026-03-19,2026-03-19,2026-03-19,2026-03-19
09-03-2026,Scuola,IISS GIULIO CESARE - ROMANAZZI,Flc Cgil,BARI,intera giornata,https://www.cgsse.it/calendario-scioperi/dettaglio-sciopero/376060,false,2026-03-09,2026-03-09,2026-03-09,2026-03-09
20-03-2026,Sanità privata,AKTIS CLINIQUE,Uiltucs,CASORIA,8 ore per tutti i turni di lavoro,https://www.cgsse.it/calendario-scioperi/dettaglio-sciopero/376058,false,2026-03-20,2026-03-20,2026-03-20,2026-03-20
09-03-2026,Generale nazionale,AZIENDE DEL SETTORE PRIVATO,Cobas Lavoro Privato,NAZIONALE,intera giornata,https://www.cgsse.it/calendario-scioperi/dettaglio-sciopero/376053,false,2026-03-09,2026-03-09,2026-03-09,2026-03-09
Dal 17-03-2026 al 20-03-2026,Avvocati,SETTORE GIUSTIZIA,Camera Penale Irpina,AVELLINO,astensione dalle attività giudiziarie,https://www.cgsse.it/calendario-scioperi/dettaglio-sciopero/376028,false,,2026-03-17,2026-03-20,2026-03-17
24-03-2026,Pulizie e multiservizi,FACILITY MANAGEMENT,"Filcams Cgil, Uiltucs",PUGLIA,dalle ore 00.01 alle ore 24.00,https://www.cgsse.it/calendario-scioperi/dettaglio-sciopero/376021,false,2026-03-24,2026-03-24,2026-03-24,2026-03-24
09-03-2026,Plurisettoriale nazionale,"AZIENDE DEI SETTORI TERZIARIO, TURISMO E SERVIZI",Filcams Cgil,NAZIONALE,intera giornata / turno di lavoro,https://www.cgsse.it/calendario-scioperi/dettaglio-sciopero/376006,false,2026-03-09,2026-03-09,2026-03-09,2026-03-09
05-03-2026,Pulizie e multiservizi,EBATRADE,Uiltrasporti,MONTELIBRETTI,intera giornata,https://www.cgsse.it/calendario-scioperi/dettaglio-sciopero/375999,false,2026-03-05,2026-03-05,2026-03-05,2026-03-05
09-03-2026,Plurisettoriale nazionale,ALES SPA,Filcams Cgil,NAZIONALE,intera giornata / turno di lavoro,https://www.cgsse.it/calendario-scioperi/dettaglio-sciopero/375975,false,2026-03-09,2026-03-09,2026-03-09,2026-03-09
25-02-2026,Trasporto marittimo,AZIENDE PORTUALI,Usb Lavoro Privato,LIVORNO,intera giornata,https://www.cgsse.it/calendario-scioperi/dettaglio-sciopero/375929,false,2026-02-25,2026-02-25,2026-02-25,2026-02-25
16-03-2026,Pulizie e multiservizi,CLEAN SERVICE,Sgb,NAPOLI,intera giornata,https://www.cgsse.it/calendario-scioperi/dettaglio-sciopero/375920,false,2026-03-16,2026-03-16,2026-03-16,2026-03-16
09-03-2026,Istruzione e ricerca,"MIM, MUR",Flc Cgil,NAZIONALE,intera giornata,https://www.cgsse.it/calendario-scioperi/dettaglio-sciopero/375917,false,2026-03-09,2026-03-09,2026-03-09,2026-03-09
09-03-2026,Generale nazionale,TUTTE LE CATEGORIE PUBBLICHE E PRIVATE,Usb,NAZIONALE,intera giornata,https://www.cgsse.it/calendario-scioperi/dettaglio-sciopero/375878,false,2026-03-09,2026-03-09,2026-03-09,2026-03-09
27-03-2026,Trasporto pubblico locale,EAV,"Filt Cgil, Fit Cisl, Uiltrasporti, Ugl, Faisa Cisal",NAPOLI,dalle ore 19.00 alle ore 23.00,https://www.cgsse.it/calendario-scioperi/dettaglio-sciopero/375865,false,2026-03-27,2026-03-27,2026-03-27,2026-03-27
09-03-2026,Generale provinciale,SETTORE PUBBLICO E PRIVATO,Cobas,BOLOGNA,intera giornata esclusi i settori dei trasporti e vigili del fuoco,https://www.cgsse.it/calendario-scioperi/dettaglio-sciopero/375857,false,2026-03-09,2026-03-09,2026-03-09,2026-03-09
09-03-2026,Generale provinciale,SETTORE PUBBLICO E PRIVATO,Cobas,BOLOGNA,"intera giornata esclusi i settori dei trasporti, vigili del fuoco e del personale di polizia municipale del comune di bologna",https://www.cgsse.it/calendario-scioperi/dettaglio-sciopero/375857,false,2026-03-09,2026-03-09,2026-03-09,2026-03-09
06-03-2026,Trasporto pubblico locale,EAV,Orsa Trasporti,NAPOLI,dalle ore 11:00 alle ore 15:00,https://www.cgsse.it/calendario-scioperi/dettaglio-sciopero/375855,false,2026-03-06,2026-03-06,2026-03-06,2026-03-06
09-03-2026,Credito,AZIENDE E ISTITUTI DEL SETTORE,Fisac Cgil,LAZIO,intera giornata lavorativa o turno di lavoro,https://www.cgsse.it/calendario-scioperi/dettaglio-sciopero/375819,false,2026-03-09,2026-03-09,2026-03-09,2026-03-09
09-03-2026,Plurisettoriale regionale,"AZIENDE DEL CREDITO, CREDITO COOPERATIVO, BANCA D’ITALIA, AGENZIA ENTRATE / RISCOSSIONE, ASSICURAZIONI, AUTHORITY, INVITALIA, SVILUPPO LAVORO ITALIA",Fisac Cgil,LAZIO,intera giornata lavorativa o turno di lavoro,https://www.cgsse.it/calendario-scioperi/dettaglio-sciopero/375819,false,2026-03-09,2026-03-09,2026-03-09,2026-03-09
16-03-2026,Trasporto pubblico locale,TUA,Orsa Trasporti,ABRUZZO,intera giornata nel rispetto delle fasce orarie di garanzia,https://www.cgsse.it/calendario-scioperi/dettaglio-sciopero/375801,false,2026-03-16,2026-03-16,2026-03-16,2026-03-16
06-03-2026,Servizio sanitario nazionale,"COOPERATIVA OCCUPAZIONE E SOLIDARIETÀ, COOPERATIVA SIRIO, COOPERATIVA SOCIALE SAN BERNARDO, THCS",Uil Fpl,BRINDISI,dalle ore 8.00 alle ore 20.00,https://www.cgsse.it/calendario-scioperi/dettaglio-sciopero/375799,false,2026-03-06,2026-03-06,2026-03-06,2026-03-06
16-03-2026,Trasporto pubblico locale,INTERBUS,Faisa Cisal,ENNA,"dalle ore 00.00 alle ore 5.59, dalle ore 9.00 alle ore 13.29 e dalle ore 16.30 alle 23.59",https://www.cgsse.it/calendario-scioperi/dettaglio-sciopero/375792,false,2026-03-16,2026-03-16,2026-03-16,2026-03-16
16-03-2026,Trasporto pubblico locale,AUTOSERVIZI RUSSO,Faisa Cisal,PALERMO,"dalle ore 00.00 alle ore 5.59, dalle ore 9.00 alle ore 13.29 e dalle ore 16.30 alle 23.59",https://www.cgsse.it/calendario-scioperi/dettaglio-sciopero/375790,false,2026-03-16,2026-03-16,2026-03-16,2026-03-16
16-03-2026,Trasporto pubblico locale,ETNA TRASPORTI,Faisa Cisal,CATANIA,"dalle ore 00.00 alle ore 5.59, dalle ore 9.00 alle ore 13.29 e dalle ore 16.30 alle 23.59",https://www.cgsse.it/calendario-scioperi/dettaglio-sciopero/375788,false,2026-03-16,2026-03-16,2026-03-16,2026-03-16
16-03-2026,Trasporto pubblico locale,SEGESTA AUTOLINEE,Faisa Cisal,PALERMO,"dalle ore 00.00 alle ore 5.59, dalle ore 9.00 alle ore 13.29 e dalle ore 16.30 alle 23.59",https://www.cgsse.it/calendario-scioperi/dettaglio-sciopero/375786,false,2026-03-16,2026-03-16,2026-03-16,2026-03-16
Dal 24-02-2026 al 25-02-2026,Energia e petrolio,RINA,"Cgil, Uiltrasporti",POTENZA,"dalle ore 8:00 alle ore 12:00 primo turno e centrale, dalle 14:00 alle 18:00 secondo turno, terzo turno dalle 2:00 alle 6:00 ( notte 25 febbraio)",https://www.cgsse.it/calendario-scioperi/dettaglio-sciopero/375779,false,,2026-02-24,2026-02-25,2026-02-24
Dal 24-02-2026 al 25-02-2026,Energia e petrolio,RINA,"Cgil, Uiltrasporti",POTENZA,"dalle ore 8:00 alle ore 12:00 primo turno e centrale, dalle 14:00 alle 18:00 secondo turno, terzo turno dalle 2:00 alle 6:00 ( notte 25 febbraio)",https://www.cgsse.it/calendario-scioperi/dettaglio-sciopero/375779,true,,2026-02-24,2026-02-25,2026-02-24
18-03-2026,Trasporto aereo,EASYJET AIRLINE LIMITED,Usb Lavoro Privato,NAZIONALE,dalle ore 13.00 alle ore 17.00,https://www.cgsse.it/calendario-scioperi/dettaglio-sciopero/375769,false,2026-03-18,2026-03-18,2026-03-18,2026-03-18
18-03-2026,Trasporto aereo,ITA AIRWAYS,Usb Lavoro Privato,NAZIONALE,dalle ore 13.00 alle ore 17.00,https://www.cgsse.it/calendario-scioperi/dettaglio-sciopero/375764,false,2026-03-18,2026-03-18,2026-03-18,2026-03-18
02-03-2026,Regioni e autonomie Locali,SLEM,Filcams Cgil,RAPOLLA,intera giornata,https://www.cgsse.it/calendario-scioperi/dettaglio-sciopero/375760,false,2026-03-02,2026-03-02,2026-03-02,2026-03-02
03-03-2026,Generale provinciale,CATEGORIE PUBBLICHE E PRIVATE,Usb,NAPOLI,"dalle ore 00,00 alle ore 23,59",https://www.cgsse.it/calendario-scioperi/dettaglio-sciopero/375752,false,2026-03-03,2026-03-03,2026-03-03,2026-03-03
27-03-2026,Trasporto pubblico locale,GRUPPO ATM,Al Cobas,"MILANO , MONZA E DELLA BRIANZA","gruppo atm personale viaggiante di superficie, metropolitana, agenti di stazione, serv. poma 8.45 -15.00 e 18,00-fine servizio, net - urbano monza: 9.00 -11.50 e 14.50-fine servizio, extraurbano trezzo 8.45-15.00 e 18.00-fine servizio",https://www.cgsse.it/calendario-scioperi/dettaglio-sciopero/375740,false,2026-03-27,2026-03-27,2026-03-27,2026-03-27
28-03-2026,Trasporto pubblico locale,MTM,"Fit Cisl, Uilt Uil",MOLFETTA,dalle ore 8.30 alle ore 12.30,https://www.cgsse.it/calendario-scioperi/dettaglio-sciopero/375737,false,2026-03-28,2026-03-28,2026-03-28,2026-03-28
03-03-2026,Pulizie e multiservizi,EBATRADE,Uiltrasporti,MONTELIBRETTI,intera giornata,https://www.cgsse.it/calendario-scioperi/dettaglio-sciopero/375687,false,2026-03-03,2026-03-03,2026-03-03,2026-03-03
03-03-2026,Pulizie e multiservizi,EBATRADE,Uiltrasporti,MONTELIBRETTI,intera giornata,https://www.cgsse.it/calendario-scioperi/dettaglio-sciopero/375687,true,2026-03-03,2026-03-03,2026-03-03,2026-03-03
04-03-2026,Sanità privata,AKTIS CLINIQUE,Uiltucs,CASORIA,8 ore su tutti i turni di lavoro,https://www.cgsse.it/calendario-scioperi/dettaglio-sciopero/375683,false,2026-03-04,2026-03-04,2026-03-04,2026-03-04
04-03-2026,Sanità privata,AKTIS CLINIQUE,Uiltucs,CASORIA,8 ore su tutti i turni di lavoro,https://www.cgsse.it/calendario-scioperi/dettaglio-sciopero/375683,true,2026-03-04,2026-03-04,2026-03-04,2026-03-04
18-03-2026,Trasporto aereo,MH24,Proclamante:Usb Lavoro Privato|Aderente:Filt Cgil,BRESCIA,dalle ore 00.00 alle ore 23.59,https://www.cgsse.it/calendario-scioperi/dettaglio-sciopero/375672,false,2026-03-18,2026-03-18,2026-03-18,2026-03-18
18-03-2026,Trasporto aereo,MH24,Proclamante:Usb Lavoro Privato|Aderente:Filt Cgil,BRESCIA,dalle ore 00.00 alle ore 23.59,https://www.cgsse.it/calendario-scioperi/dettaglio-sciopero/375672,true,2026-03-18,2026-03-18,2026-03-18,2026-03-18
18-03-2026,Trasporto aereo,GDA HANDLING,Usb Lavoro Privato,BRESCIA,dalle ore 00.00 alle ore 23.59,https://www.cgsse.it/calendario-scioperi/dettaglio-sciopero/375670,false,2026-03-18,2026-03-18,2026-03-18,2026-03-18
18-03-2026,Trasporto aereo,GDA HANDLING,Usb Lavoro Privato,BRESCIA,dalle ore 00.00 alle ore 23.59,https://www.cgsse.it/calendario-scioperi/dettaglio-sciopero/375670,true,2026-03-18,2026-03-18,2026-03-18,2026-03-18
02-03-2026,Igiene ambientale,SEMA SCARL,"Usb Lavoro Privato, Sol Cobas, Sll",SANT'EGIDIO DEL MONTE ALBINO,dalle ore 7.20 alle ore 15.40 per il primo turno e dalle ore 7.50 alle ore 16.10 per il secondo turno,https://www.cgsse.it/calendario-scioperi/dettaglio-sciopero/375663,false,2026-03-02,2026-03-02,2026-03-02,2026-03-02
02-03-2026,Igiene ambientale,SEMA SCARL,"Usb Lavoro Privato, Sol Cobas, Sll",SANT'EGIDIO DEL MONTE ALBINO,dalle ore 7.20 alle ore 15.40 per il primo turno e dalle ore 7.50 alle ore 16.10 per il secondo turno,https://www.cgsse.it/calendario-scioperi/dettaglio-sciopero/375663,true,2026-03-02,2026-03-02,2026-03-02,2026-03-02
03-03-2026,Generale provinciale,CATEGORIE PUBBLICHE E PRIVATE,Si Cobas,NAPOLI,"dalle ore 00,00 alle ore 23,59",https://www.cgsse.it/calendario-scioperi/dettaglio-sciopero/375659,false,2026-03-03,2026-03-03,2026-03-03,2026-03-03
03-03-2026,Generale provinciale,CATEGORIE PUBBLICHE E PRIVATE,Si Cobas,NAPOLI,"dalle ore 00,00 alle ore 23,59",https://www.cgsse.it/calendario-scioperi/dettaglio-sciopero/375659,true,2026-03-03,2026-03-03,2026-03-03,2026-03-03
01-03-2026,Ministeri,COOPCULTURE,"Usb Lavoro Privato, Sudd Cobas",FIRENZE,intera giornata,https://www.cgsse.it/calendario-scioperi/dettaglio-sciopero/375657,false,2026-03-01,2026-03-01,2026-03-01,2026-03-01
01-03-2026,Ministeri,COOPCULTURE,"Usb Lavoro Privato, Sudd Cobas",FIRENZE,intera giornata,https://www.cgsse.it/calendario-scioperi/dettaglio-sciopero/375657,true,2026-03-01,2026-03-01,2026-03-01,2026-03-01
04-03-2026,Pulizie e multiservizi,FACILITY MANAGEMENT,"Filcams Cgil, Uiltucs",PUGLIA,dalle ore 00.01 alle ore 24.00,https://www.cgsse.it/calendario-scioperi/dettaglio-sciopero/375646,false,2026-03-04,2026-03-04,2026-03-04,2026-03-04
04-03-2026,Pulizie e multiservizi,FACILITY MANAGEMENT,"Filcams Cgil, Uiltucs",PUGLIA,dalle ore 00.01 alle ore 24.00,https://www.cgsse.it/calendario-scioperi/dettaglio-sciopero/375646,true,2026-03-04,2026-03-04,2026-03-04,2026-03-04
13-03-2026,Trasporto pubblico locale,ARRIVA UDINE,Associazione Sindacale Indipendente,UDINE,dalle ore 9.00 alle ore 12.00 e dalle ore 15.00 a fine servizio,https://www.cgsse.it/calendario-scioperi/dettaglio-sciopero/375631,false,2026-03-13,2026-03-13,2026-03-13,2026-03-13
02-03-2026,Trasporto pubblico locale,SASA,"Orsa Trasporti, Usb Lavoro Privato, Ugl",BOLZANO,dalle ore 9.00 alle ore 12.00 e dalle 15.00 a fine servizio,https://www.cgsse.it/calendario-scioperi/dettaglio-sciopero/375629,false,2026-03-02,2026-03-02,2026-03-02,2026-03-02
26-02-2026,Pulizie e multiservizi,"COLSER, DUSSMAN SERVICE, L'OPEROSA, TEAM SERVICE","Ugl, Ulssa",SALERNO,intera giornata,https://www.cgsse.it/calendario-scioperi/dettaglio-sciopero/375625,false,2026-02-26,2026-02-26,2026-02-26,2026-02-26
26-02-2026,"Servizio sanitario nazionale, Pulizie e multiservizi","COLSER, DUSSMANN, L'OPEROSA, TEAM SERVICE","Ugl, Ulssa",SALERNO,intera giornata,https://www.cgsse.it/calendario-scioperi/dettaglio-sciopero/375625,false,2026-02-26,2026-02-26,2026-02-26,2026-02-26
26-02-2026,Servizio sanitario nazionale,"COLSER, DUSSMANN SERVICE, L'OPEROSA, TEAM SERVICE","Ugl, Ulssa",SALERNO,intera giornata,https://www.cgsse.it/calendario-scioperi/dettaglio-sciopero/375625,true,2026-02-26,2026-02-26,2026-02-26,2026-02-26
28-02-2026,Trasporto pubblico locale,SVT,Usb Lavoro Privato,VICENZA,dalle ore 17.30 alle ore 21.30,https://www.cgsse.it/calendario-scioperi/dettaglio-sciopero/375622,false,2026-02-28,2026-02-28,2026-02-28,2026-02-28
19-03-2026,Vigili del fuoco,MINISTERO DELL'INTERNO,Fisi,NAZIONALE,dalle ore 9.00 alle ore 13.00,https://www.cgsse.it/calendario-scioperi/dettaglio-sciopero/375616,false,2026-03-19,2026-03-19,2026-03-19,2026-03-19
19-03-2026,Vigili del fuoco,MINISTERO DELL'INTERNO,Fisi,NAZIONALE,dalle ore 9.00 alle ore 13.00,https://www.cgsse.it/calendario-scioperi/dettaglio-sciopero/375616,true,2026-03-19,2026-03-19,2026-03-19,2026-03-19
Dal 27-02-2026 al 28-02-2026,"Trasporto merci su rotaia, Trasporto ferroviario",AZIENDE CHE SVOLGONO ATTIVITA FERROVIARIA,Usb Lavoro Privato,NAZIONALE,dalle ore 22.00 del 27/02 alle ore 5.59 del 28/02,https://www.cgsse.it/calendario-scioperi/dettaglio-sciopero/375581,false,,2026-02-27,2026-02-28,2026-02-27
Dal 27-02-2026 al 28-02-2026,Trasporto ferroviario,AZIENDE CHE SVOLGONO ATTIVITA FERROVIARIA,Usb Lavoro Privato,NAZIONALE,dalle ore 22.00 del 27/02 alle ore 5.59 del 28/02,https://www.cgsse.it/calendario-scioperi/dettaglio-sciopero/375581,false,,2026-02-27,2026-02-28,2026-02-27
16-03-2026,Regioni e autonomie Locali,COMUNE DI COLLEGNO,Cse Flpl,COLLEGNO,intera giornata lavorativa del personale del corpo di polizia locale,https://www.cgsse.it/calendario-scioperi/dettaglio-sciopero/375579,false,2026-03-16,2026-03-16,2026-03-16,2026-03-16
15-03-2026,Regioni e autonomie Locali,COMUNE DI COLLEGNO,Cse Flpl,COLLEGNO,intera giornata lavorativa del personale del corpo di polizia locale,https://www.cgsse.it/calendario-scioperi/dettaglio-sciopero/375579,false,2026-03-15,2026-03-15,2026-03-15,2026-03-15
15-03-2026,Regioni e autonomie Locali,COMUNE DI COLLEGNO,Cse Flpl,COLLEGNO,intera giornata del personale del corpo di polizia locale,https://www.cgsse.it/calendario-scioperi/dettaglio-sciopero/375579,false,2026-03-15,2026-03-15,2026-03-15,2026-03-15
15-03-2026,Regioni e autonomie Locali,COMUNE DI COLLEGNO,"Cse Flpl, Cse Flpl",COLLEGNO,intera giornata del personale del corpo di polizia locale,https://www.cgsse.it/calendario-scioperi/dettaglio-sciopero/375579,true,2026-03-15,2026-03-15,2026-03-15,2026-03-15
28-03-2026,Trasporto pubblico locale,AMTAB,"Uitrasporti, Filt Cgil, Fit Cisl, Ugl",BARI,dalle ore 20.00 alle ore 23.59,https://www.cgsse.it/calendario-scioperi/dettaglio-sciopero/375570,false,2026-03-28,2026-03-28,2026-03-28,2026-03-28
28-02-2026,Regioni e autonomie Locali,COMUNE DI VILLAFRANCA DI VERONA,Diccap,VILLAFRANCA DI VERONA,intera giornata del personale del corpo di polizia locale,https://www.cgsse.it/calendario-scioperi/dettaglio-sciopero/375565,false,2026-02-28,2026-02-28,2026-02-28,2026-02-28
28-02-2026,Regioni e autonomie Locali,COMUNE DI VILLAFRANCA DI VERONA,Diccap,VILLAFRANCA DI VERONA,intera giornata del personale del corpo di polizia locale,https://www.cgsse.it/calendario-scioperi/dettaglio-sciopero/375565,true,2026-02-28,2026-02-28,2026-02-28,2026-02-28
27-02-2026,Regioni e autonomie Locali,PAOLO SCOPPIO AUTOLINEE,Usb Lavoro Privato,ROMA,intera giornata,https://www.cgsse.it/calendario-scioperi/dettaglio-sciopero/375560,false,2026-02-27,2026-02-27,2026-02-27,2026-02-27
27-02-2026,Regioni e autonomie Locali,PAOLO SCOPPIO AUTOLINEE,Usb Lavoro Privato,ROMA,intera giornata,https://www.cgsse.it/calendario-scioperi/dettaglio-sciopero/375560,true,2026-02-27,2026-02-27,2026-02-27,2026-02-27
Dal 27-02-2026 al 28-02-2026,"Trasporto merci su rotaia, Trasporto ferroviario",AZIENDE CHE SVOLGONO ATTIVITA FERROVIARIA,"Sgb, Cub Trasporti",NAZIONALE,dalle ore 21.00 del 27/02 alle ore 20.59 del 28/02,https://www.cgsse.it/calendario-scioperi/dettaglio-sciopero/375558,false,,2026-02-27,2026-02-28,2026-02-27
26-02-2026,Servizio sanitario nazionale,DUSSMANN,"Filcams Cgil, Fisascat Cisl",SALERNO,intera giornata,https://www.cgsse.it/calendario-scioperi/dettaglio-sciopero/375555,false,2026-02-26,2026-02-26,2026-02-26,2026-02-26
26-02-2026,Servizio sanitario nazionale,DUSSMANN,"Filcams Cgil, Fisascat Cisl",SALERNO,intera giornata,https://www.cgsse.it/calendario-scioperi/dettaglio-sciopero/375555,true,2026-02-26,2026-02-26,2026-02-26,2026-02-26
25-02-2026,Pulizie e multiservizi,EBATRADE,Uiltrasporti,MONTELIBRETTI,intera giornata,https://www.cgsse.it/calendario-scioperi/dettaglio-sciopero/375542,false,2026-02-25,2026-02-25,2026-02-25,2026-02-25
25-02-2026,Pulizie e multiservizi,EBATRADE,Uiltrasporti,MONTELIBRETTI,intera giornata,https://www.cgsse.it/calendario-scioperi/dettaglio-sciopero/375542,true,2026-02-25,2026-02-25,2026-02-25,2026-02-25
Dal 02-03-2026 al 03-03-2026,Sanità privata,RESIDENZA SAN BIAGIO,Fp Cgil,MUGNANO DI NAPOLI,dalle ore 8.00 del 2/03 alle ore 8.00 del 3/03,https://www.cgsse.it/calendario-scioperi/dettaglio-sciopero/375534,false,,2026-03-02,2026-03-03,2026-03-02
27-02-2026,Trasporto pubblico locale,ARRIVA ITALIA,"Faisa Cisal, Filt Cgil, Uiltrasporti, Fit Cisl",TORINO,dalle ore 16.00 alle ore 20.00,https://www.cgsse.it/calendario-scioperi/dettaglio-sciopero/375524,false,2026-02-27,2026-02-27,2026-02-27,2026-02-27
Dal 27-02-2026 al 28-02-2026,Sanità privata,RESIDENZA SAN BIAGIO,Fp Cgil,MUGNANO DI NAPOLI,dalle ore 8.00 del 27/02 alle ore 8.00 del 28/02,https://www.cgsse.it/calendario-scioperi/dettaglio-sciopero/375507,true,,2026-02-27,2026-02-28,2026-02-27
24-02-2026,Pulizie e multiservizi,ROMEO GESTIONI,Fisascat Cisl,POZZUOLI,intero turno di lavoro,https://www.cgsse.it/calendario-scioperi/dettaglio-sciopero/375505,false,2026-02-24,2026-02-24,2026-02-24,2026-02-24
24-02-2026,Pulizie e multiservizi,ROMEO GESTIONI,Fisascat Cisl,POZZUOLI,intero turno di lavoro,https://www.cgsse.it/calendario-scioperi/dettaglio-sciopero/375505,true,2026-02-24,2026-02-24,2026-02-24,2026-02-24
26-02-2026,Trasporto aereo,"COMPARTO AEREO, AEROPORTUALE E INDOTTO DEGLI AEROPORTI",Cub Trasporti,NAZIONALE,"dalle ore 00,00 alle ore 23,59 escluso il personale enav e la società airest retail operante nei punti vendita e ristorazione presso gli aeroporti di venezia e treviso",https://www.cgsse.it/calendario-scioperi/dettaglio-sciopero/375495,false,2026-02-26,2026-02-26,2026-02-26,2026-02-26
26-02-2026,Trasporto aereo,ITA AIRWAYS,"Filt Cgil, Fit Cisl, Uiltrasporti, Ugl Ta, Anpac, Anp",NAZIONALE,dalle ore 00.00 alle ore 23.59,https://www.cgsse.it/calendario-scioperi/dettaglio-sciopero/375475,false,2026-02-26,2026-02-26,2026-02-26,2026-02-26
26-02-2026,Trasporto aereo,ITA AIRWAYS,Usb Lavoro Privato,NAZIONALE,dalle ore 13.00 alle ore 17.00,https://www.cgsse.it/calendario-scioperi/dettaglio-sciopero/375466,false,2026-02-26,2026-02-26,2026-02-26,2026-02-26
26-02-2026,Trasporto aereo,ITA AIRWAYS,Usb Lavoro Privato,NAZIONALE,dalle ore 13.00 alle ore 17.00,https://www.cgsse.it/calendario-scioperi/dettaglio-sciopero/375466,true,2026-02-26,2026-02-26,2026-02-26,2026-02-26
26-02-2026,Trasporto aereo,VUELING AIRLINES,Usb Lavoro Privato,NAZIONALE,dalle ore 13.00 alle ore 17.00,https://www.cgsse.it/calendario-scioperi/dettaglio-sciopero/375462,false,2026-02-26,2026-02-26,2026-02-26,2026-02-26
26-02-2026,Trasporto aereo,VUELING AIRLINES,Usb Lavoro Privato,NAZIONALE,dalle ore 13.00 alle ore 17.00,https://www.cgsse.it/calendario-scioperi/dettaglio-sciopero/375462,true,2026-02-26,2026-02-26,2026-02-26,2026-02-26
26-02-2026,Trasporto aereo,EASYJET AIRLINE LIMITED,Usb Lavoro Privato,NAZIONALE,dalle ore 13.00 alle ore 17.00,https://www.cgsse.it/calendario-scioperi/dettaglio-sciopero/375457,false,2026-02-26,2026-02-26,2026-02-26,2026-02-26
26-02-2026,Trasporto aereo,EASYJET AIRLINE LIMITED,Usb Lavoro Privato,NAZIONALE,dalle ore 13.00 alle ore 17.00,https://www.cgsse.it/calendario-scioperi/dettaglio-sciopero/375457,true,2026-02-26,2026-02-26,2026-02-26,2026-02-26
26-02-2026,Trasporto aereo,EASYJET AIRLINE LIMITED,"Filt Cgil, Fit Cisl, Uiltrasporti, Ugl Ta, Anpac",NAZIONALE,dalle ore 00.00 alle ore 23.59,https://www.cgsse.it/calendario-scioperi/dettaglio-sciopero/375440,false,2026-02-26,2026-02-26,2026-02-26,2026-02-26
02-03-2026,Vigili del fuoco,MINISTERO DELL'INTERNO,Fisi,NAZIONALE,dalle ore 9.00 alle ore 13.00,https://www.cgsse.it/calendario-scioperi/dettaglio-sciopero/375431,false,2026-03-02,2026-03-02,2026-03-02,2026-03-02
02-03-2026,Vigili del fuoco,MINISTERO DELL'INTERNO,Fisi,NAZIONALE,dalle ore 9.00 alle ore 13.00,https://www.cgsse.it/calendario-scioperi/dettaglio-sciopero/375431,true,2026-03-02,2026-03-02,2026-03-02,2026-03-02
18-03-2026,Trasporto aereo,AIRPORT HANDLING/DNATA,Cub Trasporti,"MILANO, VARESE",dalle ore 00.00 alle ore 23.59,https://www.cgsse.it/calendario-scioperi/dettaglio-sciopero/375426,false,2026-03-18,2026-03-18,2026-03-18,2026-03-18
18-03-2026,Trasporto aereo,ALHA,Cub Trasporti,"MILANO, VARESE",dalle ore 00.00 alle ore 23.59,https://www.cgsse.it/calendario-scioperi/dettaglio-sciopero/375422,false,2026-03-18,2026-03-18,2026-03-18,2026-03-18
02-03-2026,Istituti di vigilanza,VEDETTA 2 MONDIALPOL,"Filcams Cgil, Fisascat Cisl, Uiltucs",MILANO,dalle ore 00.01 alle ore 24.00,https://www.cgsse.it/calendario-scioperi/dettaglio-sciopero/375411,false,2026-03-02,2026-03-02,2026-03-02,2026-03-02
02-03-2026,Istituti di vigilanza,VEDETTA 2 MONDIALPOL,"Filcams Cgil, Fisascat Cisl, Uiltucs",MILANO,dalle ore 00.01 alle ore 24.00,https://www.cgsse.it/calendario-scioperi/dettaglio-sciopero/375411,true,2026-03-02,2026-03-02,2026-03-02,2026-03-02
25-02-2026,Avvocati,SETTORE GIUSTIZIA,Camera Penale Di Santa Maria Capua Vetere,SANTA MARIA CAPUA VETERE,astensione dalle udienze e da ogni attività giudiziaria nel settore penale,https://www.cgsse.it/calendario-scioperi/dettaglio-sciopero/375405,false,2026-02-25,2026-02-25,2026-02-25,2026-02-25
26-02-2026,Igiene ambientale,ECO-CE,"Ugl Ia, Fial, Fiadel, Cil",OTTAVIANO,dalle ore 00.00 alle ore 24.00,https://www.cgsse.it/calendario-scioperi/dettaglio-sciopero/375403,false,2026-02-26,2026-02-26,2026-02-26,2026-02-26
26-02-2026,Igiene ambientale,ECO-CE,"Ugl Ia, Fial, Fiadel, Cil",OTTAVIANO,dalle ore 00.00 alle ore 24.00,https://www.cgsse.it/calendario-scioperi/dettaglio-sciopero/375403,true,2026-02-26,2026-02-26,2026-02-26,2026-02-26
24-02-2026,Pulizie e multiservizi,ROMEO GESTIONI,Ugl Ia,POZZUOLI,dalle ore 00:00 alle ore 24:00,https://www.cgsse.it/calendario-scioperi/dettaglio-sciopero/375398,false,2026-02-24,2026-02-24,2026-02-24,2026-02-24
24-02-2026,Pulizie e multiservizi,ROMEO GESTIONI,Ugl Ia,POZZUOLI,dalle ore 00:00 alle ore 24:00,https://www.cgsse.it/calendario-scioperi/dettaglio-sciopero/375398,true,2026-02-24,2026-02-24,2026-02-24,2026-02-24
09-03-2026,Generale nazionale,"TUTTI I COMPARTI, AREE PUBBLICHE E LE CATEGORIE DEL LAVORO PRIVATO E COOPERATIVO,",Slai Cobas Per Il Sindacato Di classe,NAZIONALE,intera giornata,https://www.cgsse.it/calendario-scioperi/dettaglio-sciopero/375396,false,2026-03-09,2026-03-09,2026-03-09,2026-03-09
09-03-2026,Generale nazionale,"TUTTI I COMPARTI, AREE PUBBLICHE E LE CATEGORIE DEL LAVORO PRIVATO E COOPERATIVO",Slai Cobas Per Il Sindacato Di classe,NAZIONALE,intera giornata,https://www.cgsse.it/calendario-scioperi/dettaglio-sciopero/375396,false,2026-03-09,2026-03-09,2026-03-09,2026-03-09
09-03-2026,Generale nazionale,"TUTTI I COMPARTI, AREE PUBBLICHE E LE CATEGORIE DEL LAVORO PRIVATO E COOPERATIVO",Slai Cobas Per Il Sindacato Di classe,NAZIONALE,"intera giornata, escluso l'intero comparto dei trasporti, per i vigili del fuoco dalle ore 9.00 alle ore 13.00",https://www.cgsse.it/calendario-scioperi/dettaglio-sciopero/375396,false,2026-03-09,2026-03-09,2026-03-09,2026-03-09
24-02-2026,Vigili del fuoco,MINISTERO DELL'INTERNO,Fp Cgil,REGGIO NELL'EMILIA,dalle ore 16.00 alle ore 20.00,https://www.cgsse.it/calendario-scioperi/dettaglio-sciopero/375374,false,2026-02-24,2026-02-24,2026-02-24,2026-02-24
21-02-2026,Taxi,TAXI,Cooperativa Tassisti Lucchesi,LUCCA,dalle ore 8.00 alle ore 22.00,https://www.cgsse.it/calendario-scioperi/dettaglio-sciopero/375332,false,2026-02-21,2026-02-21,2026-02-21,2026-02-21
25-02-2026,Elicotteri,AVINCIS RW,"Uiltrasporti, Fit Cisl, Ugl Ta, Anpac",NAZIONALE,dalle ore 00:00 alle ore 23:59 per tutte le basi (hj + h24),https://www.cgsse.it/calendario-scioperi/dettaglio-sciopero/375325,false,2026-02-25,2026-02-25,2026-02-25,2026-02-25
19-02-2026,Agenzie fiscali,AGENZIA DELLE ENTRATE,"Uil Pa, Fp Cgil, Confsal Unsa, Flp, Usb",MILANO,intera giornata,https://www.cgsse.it/calendario-scioperi/dettaglio-sciopero/375320,false,2026-02-19,2026-02-19,2026-02-19,2026-02-19
Dal 21-02-2026 al 23-02-2026,Istituti di vigilanza,ISTITUTI DI VIGILANZA PRIVATA E SERVIZI SICUREZZA,Cisal Sinalv,LOMBARDIA,dalle ore 15.00 del 21/02 alle ore 15.00 del 23/02,https://www.cgsse.it/calendario-scioperi/dettaglio-sciopero/375306,false,,2026-02-21,2026-02-23,2026-02-21
20-02-2026,Igiene ambientale,IMPREGICO SRL,Fp Cgil,LENTINI,intera giornata,https://www.cgsse.it/calendario-scioperi/dettaglio-sciopero/375294,false,2026-02-20,2026-02-20,2026-02-20,2026-02-20
13-02-2026,Funerario,BARBARA B,Fp Cgil,ROMA,intero turno di lavoro,https://www.cgsse.it/calendario-scioperi/dettaglio-sciopero/375287,false,2026-02-13,2026-02-13,2026-02-13,2026-02-13
27-02-2026,Pulizie e multiservizi,GRUPPO SIASS,Sgb,CASERTA,intera giornata,https://www.cgsse.it/calendario-scioperi/dettaglio-sciopero/375285,false,2026-02-27,2026-02-27,2026-02-27,2026-02-27
23-02-2026,Poste,POSTE ITALIANE,Slc Cgil,"CREMONA, BRESCIA",prime 2 ore di ogni turno per tutti i turni,https://www.cgsse.it/calendario-scioperi/dettaglio-sciopero/375283,false,2026-02-23,2026-02-23,2026-02-23,2026-02-23
01-03-2026,Pulizie e multiservizi,CLEAN SERVICE,Sgb,NAPOLI,intera giornata,https://www.cgsse.it/calendario-scioperi/dettaglio-sciopero/375281,false,2026-03-01,2026-03-01,2026-03-01,2026-03-01
01-03-2026,Pulizie e multiservizi,CLEAN SERVICE,Sgb,NAPOLI,intera giornata,https://www.cgsse.it/calendario-scioperi/dettaglio-sciopero/375281,true,2026-03-01,2026-03-01,2026-03-01,2026-03-01
25-02-2026,Servizio sanitario nazionale,CONSORZIO UNISAN,Cub Sanità,ROMA,dalle ore 13.00 alle ore 14.00 per il primo turno e dalle ore 14.00 alle ore 15.00 per il secondo turno,https://www.cgsse.it/calendario-scioperi/dettaglio-sciopero/375271,false,2026-02-25,2026-02-25,2026-02-25,2026-02-25
24-02-2026,Igiene ambientale,LOVERAL SRL,Fp Cgil,"LETOJANNI, CASTELMOLA, GAGGI, GALLODORO, MONGIUFFI MELIA",intera giornata,https://www.cgsse.it/calendario-scioperi/dettaglio-sciopero/375269,false,2026-02-24,2026-02-24,2026-02-24,2026-02-24
24-02-2026,Igiene ambientale,LOVERAL SRL,Fp Cgil,"LETOJANNI, CASTELMOLA, GAGGI, GALLODORO, MONGIUFFI MELIA",intera giornata,https://www.cgsse.it/calendario-scioperi/dettaglio-sciopero/375269,true,2026-02-24,2026-02-24,2026-02-24,2026-02-24
09-03-2026,Generale nazionale,TUTTE LE CATEGORIE PUBBLICHE E PRIVATE,Usi 1912,NAZIONALE,intera giornata,https://www.cgsse.it/calendario-scioperi/dettaglio-sciopero/375262,false,2026-03-09,2026-03-09,2026-03-09,2026-03-09
09-03-2026,Generale nazionale,TUTTE LE CATEGORIE PUBBLICHE E PRIVATE,"Proclamante:Usi 1912|Aderente:Cub Sur, Adl Cobas",NAZIONALE,intera giornata,https://www.cgsse.it/calendario-scioperi/dettaglio-sciopero/375262,false,2026-03-09,2026-03-09,2026-03-09,2026-03-09
27-02-2026,Pulizie e multiservizi,"GRUPPO SIASS, ISS ITALIA",Sgb,CASERTA,intera giornata,https://www.cgsse.it/calendario-scioperi/dettaglio-sciopero/375260,false,2026-02-27,2026-02-27,2026-02-27,2026-02-27
27-02-2026,Pulizie e multiservizi,"GRUPPO SIASS, ISS ITALIA",Sgb,CASERTA,intera giornata,https://www.cgsse.it/calendario-scioperi/dettaglio-sciopero/375260,true,2026-02-27,2026-02-27,2026-02-27,2026-02-27
10-02-2026,Funerario,BARBARA B,Fp Cgil,ROMA,intero turno di lavoro,https://www.cgsse.it/calendario-scioperi/dettaglio-sciopero/375254,false,2026-02-10,2026-02-10,2026-02-10,2026-02-10
10-02-2026,Funerario,BARBARA B,Fp Cgil,ROMA,intero turno di lavoro,https://www.cgsse.it/calendario-scioperi/dettaglio-sciopero/375254,true,2026-02-10,2026-02-10,2026-02-10,2026-02-10
18-02-2026,Pulizie e multiservizi,FACILITY MANAGEMENT,"Filcams Cgil, Uiltucs",PUGLIA,dalle ore 00.01 alle ore 23.59,https://www.cgsse.it/calendario-scioperi/dettaglio-sciopero/375250,false,2026-02-18,2026-02-18,2026-02-18,2026-02-18
18-02-2026,Pulizie e multiservizi,FACILITY MANAGEMENT,"Filcams Cgil, Uiltucs",PUGLIA,dalle ore 00.01 alle ore 23.59,https://www.cgsse.it/calendario-scioperi/dettaglio-sciopero/375250,true,2026-02-18,2026-02-18,2026-02-18,2026-02-18
17-02-2026,Igiene ambientale,AT VITTORIA,Fials,MARIGLIANELLA,24 ore,https://www.cgsse.it/calendario-scioperi/dettaglio-sciopero/375247,false,2026-02-17,2026-02-17,2026-02-17,2026-02-17
17-02-2026,Igiene ambientale,VITTORIA,Fials,MARIGLIANELLA,24 ore,https://www.cgsse.it/calendario-scioperi/dettaglio-sciopero/375247,false,2026-02-17,2026-02-17,2026-02-17,2026-02-17
17-02-2026,Igiene ambientale,VITTORIA,Fials,MARIGLIANELLA,24 ore,https://www.cgsse.it/calendario-scioperi/dettaglio-sciopero/375247,true,2026-02-17,2026-02-17,2026-02-17,2026-02-17
27-02-2026,Servizio sanitario nazionale,AZIENDA OSPEDALIERA DI PADOVA,"Fp Cgil, Uil Fpl",PADOVA,intera giornata,https://www.cgsse.it/calendario-scioperi/dettaglio-sciopero/375240,false,2026-02-27,2026-02-27,2026-02-27,2026-02-27
27-03-2026,Scuola,MIM,Sisa,NAZIONALE,intera giornata,https://www.cgsse.it/calendario-scioperi/dettaglio-sciopero/375235,false,2026-03-27,2026-03-27,2026-03-27,2026-03-27
17-02-2026,Taxi,TAXI,Cooperativa Tassisti Lucchesi,LUCCA,dalle ore 8.00 alle ore 20.00,https://www.cgsse.it/calendario-scioperi/dettaglio-sciopero/375233,false,2026-02-17,2026-02-17,2026-02-17,2026-02-17
17-02-2026,Taxi,TAXI,Cooperativa Tassisti Lucchesi,LUCCA,dalle ore 8.00 alle ore 22.00,https://www.cgsse.it/calendario-scioperi/dettaglio-sciopero/375233,true,2026-02-17,2026-02-17,2026-02-17,2026-02-17
27-02-2026,Servizio sanitario nazionale,SERVIZIO SANITARIO NAZIONALE,Uil Fpl,PADOVA,intera giornata,https://www.cgsse.it/calendario-scioperi/dettaglio-sciopero/375231,false,2026-02-27,2026-02-27,2026-02-27,2026-02-27
27-02-2026,Servizio sanitario nazionale,SERVIZIO SANITARIO NAZIONALE,"Uil Fpl, Fp Cgil",PADOVA,intera giornata,https://www.cgsse.it/calendario-scioperi/dettaglio-sciopero/375231,false,2026-02-27,2026-02-27,2026-02-27,2026-02-27
16-02-2026,Trasporto aereo,EASYJET AIRLINE LIMITED,Usb Lavoro Privato,NAZIONALE,dalle ore 13.00 alle ore 17.00,https://www.cgsse.it/calendario-scioperi/dettaglio-sciopero/375223,false,2026-02-16,2026-02-16,2026-02-16,2026-02-16
16-02-2026,Trasporto aereo,EASYJET AIRLINE LIMITED,Usb Lavoro Privato,NAZIONALE,dalle ore 13.00 alle ore 17.00,https://www.cgsse.it/calendario-scioperi/dettaglio-sciopero/375223,true,2026-02-16,2026-02-16,2026-02-16,2026-02-16
16-02-2026,Trasporto aereo,EASYJET AIRLINE LIMITED,"Filt Cgil, Fit Cisl, Uiltrasporti, Ugl Ta, Anpac",NAZIONALE,dalle ore 00.01 alle ore 24.00,https://www.cgsse.it/calendario-scioperi/dettaglio-sciopero/375212,false,2026-02-16,2026-02-16,2026-02-16,2026-02-16
16-02-2026,Trasporto aereo,EASYJET AIRLINE LIMITED,"Filt Cgil, Fit Cisl, Uiltrasporti, Ugl Ta, Anpac",NAZIONALE,dalle ore 00.01 alle ore 24.00,https://www.cgsse.it/calendario-scioperi/dettaglio-sciopero/375212,true,2026-02-16,2026-02-16,2026-02-16,2026-02-16
16-02-2026,Trasporto aereo,MH24,Usb Lavoro Privato,BRESCIA,dalle ore 00.00 alle ore 24.00,https://www.cgsse.it/calendario-scioperi/dettaglio-sciopero/375200,false,2026-02-16,2026-02-16,2026-02-16,2026-02-16
16-02-2026,Trasporto aereo,MH24,Proclamante:Usb Lavoro Privato|Aderente:Filt Cgil,BRESCIA,dalle ore 00.00 alle ore 24.00,https://www.cgsse.it/calendario-scioperi/dettaglio-sciopero/375200,false,2026-02-16,2026-02-16,2026-02-16,2026-02-16
16-02-2026,Trasporto aereo,GDA HANDLING,Usb Lavoro Privato,BRESCIA,dalle ore 00.00 alle ore 23.59,https://www.cgsse.it/calendario-scioperi/dettaglio-sciopero/375198,false,2026-02-16,2026-02-16,2026-02-16,2026-02-16
17-02-2026,Igiene ambientale,CCS,Fial Ambiente E Servizi,CALVANICO,intera giornata,https://www.cgsse.it/calendario-scioperi/dettaglio-sciopero/375188,false,2026-02-17,2026-02-17,2026-02-17,2026-02-17
17-02-2026,Igiene ambientale,CCS,Fial Ambiente E Servizi,CALVANICO,intera giornata,https://www.cgsse.it/calendario-scioperi/dettaglio-sciopero/375188,true,2026-02-17,2026-02-17,2026-02-17,2026-02-17
13-02-2026,Non partecipanti,null,Fp Cgil,ROMA,intero turno di lavoro,https://www.cgsse.it/calendario-scioperi/dettaglio-sciopero/375175,false,2026-02-13,2026-02-13,2026-02-13,2026-02-13
Dal 27-10-2025 al 28-10-2025,Servizio sanitario nazionale,"AOU, USL",Fials,BOLOGNA,dalle ore 7:00 del 27/10 alle ore 7:00 del 28/10,https://www.cgsse.it/calendario-scioperi/dettaglio-sciopero/375161,true,,2025-10-27,2025-10-28,2025-10-27
28-11-2025,Igiene ambientale,ECO-CE,Flaica Unita Cub,OTTAVIANO,,https://www.cgsse.it/calendario-scioperi/dettaglio-sciopero/375127,true,2025-11-28,2025-11-28,2025-11-28,2025-11-28
16-02-2026,Trasporto aereo,VUELING AIRLINES,Uiltrasporti,NAZIONALE,dalle ore 13.01 alle ore 17.00,https://www.cgsse.it/calendario-scioperi/dettaglio-sciopero/375122,false,2026-02-16,2026-02-16,2026-02-16,2026-02-16
16-02-2026,Trasporto aereo,VUELING AIRLINES,Uiltrasporti,NAZIONALE,dalle ore 13.01 alle ore 17.00,https://www.cgsse.it/calendario-scioperi/dettaglio-sciopero/375122,true,2026-02-16,2026-02-16,2026-02-16,2026-02-16
18-02-2026,Trasporto merci su rotaia,EVM RAIL,Filt Cgil,VERONA,dalle ore 09.01 alle ore 17.00,https://www.cgsse.it/calendario-scioperi/dettaglio-sciopero/375117,false,2026-02-18,2026-02-18,2026-02-18,2026-02-18
13-02-2026,Servizio sanitario nazionale,"L'OPEROSA, REKEEP",Adl Cobas,BOLOGNA,dalle ore 00.00 alle ore 23.59,https://www.cgsse.it/calendario-scioperi/dettaglio-sciopero/375115,false,2026-02-13,2026-02-13,2026-02-13,2026-02-13
14-02-2026,Regioni e autonomie Locali,COMUNE DI VILLAFRANCA DI VERONA,Diccap,VILLAFRANCA DI VERONA,intera giornata,https://www.cgsse.it/calendario-scioperi/dettaglio-sciopero/375113,false,2026-02-14,2026-02-14,2026-02-14,2026-02-14
12-02-2026,Trasporto pubblico locale,AMTS CATANIA,Cub Trasporti,CATANIA,dalle ore 14.00 alle ore 18.00,https://www.cgsse.it/calendario-scioperi/dettaglio-sciopero/375107,false,2026-02-12,2026-02-12,2026-02-12,2026-02-12
16-02-2026,Trasporto aereo,VUELING AIRLINES,Usb Lavoro Privato,NAZIONALE,dalle ore 13.00 alle ore 17.00,https://www.cgsse.it/calendario-scioperi/dettaglio-sciopero/375096,false,2026-02-16,2026-02-16,2026-02-16,2026-02-16
16-02-2026,Trasporto aereo,VUELING AIRLINES,Usb Lavoro Privato,NAZIONALE,dalle ore 13.00 alle ore 17.00,https://www.cgsse.it/calendario-scioperi/dettaglio-sciopero/375096,true,2026-02-16,2026-02-16,2026-02-16,2026-02-16
11-02-2026,Sanità privata,CASA DI CURA L'IMMACOLATA,Cisal Terziario,"CELANO, FONTECCHIO",intero turno di lavoro,https://www.cgsse.it/calendario-scioperi/dettaglio-sciopero/375088,false,2026-02-11,2026-02-11,2026-02-11,2026-02-11
16-02-2026,Trasporto pubblico locale,AMT,Cub Trasporti,GENOVA,servizio urbano ed extraurbano dalle ore 11.30 alle ore 15.30,https://www.cgsse.it/calendario-scioperi/dettaglio-sciopero/375086,false,2026-02-16,2026-02-16,2026-02-16,2026-02-16
13-02-2026,Acqua,SORICAL,"Fillea Cgil, Fiom Cgil",CATANZARO,intero turno,https://www.cgsse.it/calendario-scioperi/dettaglio-sciopero/375084,false,2026-02-13,2026-02-13,2026-02-13,2026-02-13
13-02-2026,"Metalmeccanici, Acqua",SORICAL,"Fillea Cgil, Fiom Cgil",CATANZARO,intero turno,https://www.cgsse.it/calendario-scioperi/dettaglio-sciopero/375084,false,2026-02-13,2026-02-13,2026-02-13,2026-02-13
13-02-2026,"Metalmeccanici, Acqua",SORICAL,"Fillea Cgil, Fiom Cgil",CATANZARO,intero turno,https://www.cgsse.it/calendario-scioperi/dettaglio-sciopero/375084,true,2026-02-13,2026-02-13,2026-02-13,2026-02-13
13-02-2026,"Metalmeccanici, Acqua",SORICAL,"Fillea Cgil, Fiom Cgil",CATANZARO,intero turno di lavoro,https://www.cgsse.it/calendario-scioperi/dettaglio-sciopero/375084,true,2026-02-13,2026-02-13,2026-02-13,2026-02-13
16-02-2026,Trasporto aereo,"COMPARTO AEREO, AEROPORTUALE E INDOTTO DEGLI AEROPORTI",Cub Trasporti,NAZIONALE,"dalle ore 00,00 alle ore 23,59 escluso la società airest retail operante nei punti vendita e ristorazione presso gli aeroporti di venezia e treviso",https://www.cgsse.it/calendario-scioperi/dettaglio-sciopero/375080,false,2026-02-16,2026-02-16,2026-02-16,2026-02-16
16-02-2026,Trasporto aereo,"COMPARTO AEREO, AEROPORTUALE E INDOTTO DEGLI AEROPORTI",Cub Trasporti,NAZIONALE,"dalle ore 00,00 alle ore 23,59 escluso il personale enav e la società airest retail operante nei punti vendita e ristorazione presso gli aeroporti di venezia e treviso",https://www.cgsse.it/calendario-scioperi/dettaglio-sciopero/375080,false,2026-02-16,2026-02-16,2026-02-16,2026-02-16
16-02-2026,Trasporto aereo,"COMPARTO AEREO, AEROPORTUALE E INDOTTO DEGLI AEROPORTI",Cub Trasporti,NAZIONALE,"dalle ore 00,00 alle ore 23,59 escluso il personale enav e la società airest retail operante nei punti vendita e ristorazione presso gli aeroporti di venezia e treviso",https://www.cgsse.it/calendario-scioperi/dettaglio-sciopero/375080,true,2026-02-16,2026-02-16,2026-02-16,2026-02-16
12-02-2026,Scuola,MIM,Cobas Scuola,SARDEGNA,intera giornata,https://www.cgsse.it/calendario-scioperi/dettaglio-sciopero/375076,false,2026-02-12,2026-02-12,2026-02-12,2026-02-12
12-02-2026,Scuola,MIM,Cobas Scuola Sardegna,SARDEGNA,intera giornata,https://www.cgsse.it/calendario-scioperi/dettaglio-sciopero/375076,false,2026-02-12,2026-02-12,2026-02-12,2026-02-12
15-02-2026,Trasporto aereo,AIREST RETAIL,Usb Lavoro Privato,"TREVISO, VENEZIA",intera giornata,https://www.cgsse.it/calendario-scioperi/dettaglio-sciopero/375074,false,2026-02-15,2026-02-15,2026-02-15,2026-02-15
15-02-2026,Trasporto aereo,AIREST RETAIL,Usb Lavoro Privato,"TREVISO, VENEZIA",intera giornata,https://www.cgsse.it/calendario-scioperi/dettaglio-sciopero/375074,true,2026-02-15,2026-02-15,2026-02-15,2026-02-15
12-02-2026,Trasporto pubblico locale,AMTS CATANIA,Cub Trasporti,CATANIA,dalle ore 14.00 alle ore 18.00,https://www.cgsse.it/calendario-scioperi/dettaglio-sciopero/375071,true,2026-02-12,2026-02-12,2026-02-12,2026-02-12
25-02-2026,Trasporto pubblico locale,SASA,"Orsa Trasporti, Usb Lavoro Privato, Ugl",BOLZANO,dalle ore 9.00 alle ore 12.00 e dalle ore 15.00 a fine servizio,https://www.cgsse.it/calendario-scioperi/dettaglio-sciopero/375067,false,2026-02-25,2026-02-25,2026-02-25,2026-02-25
09-02-2026,Igiene ambientale,ROMA COSTRUZIONI,"Fp Cgil, Fit Cisl, Uiltrasporti",NOTO,intero turno lavorativo,https://www.cgsse.it/calendario-scioperi/dettaglio-sciopero/375045,false,2026-02-09,2026-02-09,2026-02-09,2026-02-09
09-02-2026,Igiene ambientale,ROMA COSTRUZIONI,"Fp Cgil, Fit Cisl, Uiltrasporti",NOTO,intero turno lavorativo,https://www.cgsse.it/calendario-scioperi/dettaglio-sciopero/375045,true,2026-02-09,2026-02-09,2026-02-09,2026-02-09
09-02-2026,Igiene ambientale,ROMA COSTRUZIONI,"Fp Cgil, Fit Cisl, Uiltrasporti",NOTO,intero turno di lavoro,https://www.cgsse.it/calendario-scioperi/dettaglio-sciopero/375045,true,2026-02-09,2026-02-09,2026-02-09,2026-02-09
11-02-2026,Sanità privata,LA CUPOLINA,Uil Fpl,FIRENZE,intero turno del mattino e del pomeriggio,https://www.cgsse.it/calendario-scioperi/dettaglio-sciopero/375036,false,2026-02-11,2026-02-11,2026-02-11,2026-02-11
15-02-2026,Regioni e autonomie Locali,COMUNE DI COMACCHIO,"Csa Ral, Cisl Fp",COMACCHIO,intera giornata del personale della polizia locale,https://www.cgsse.it/calendario-scioperi/dettaglio-sciopero/375034,false,2026-02-15,2026-02-15,2026-02-15,2026-02-15
10-02-2026,Non partecipanti,null,Fp Cgil,ROMA,intero turno di lavoro,https://www.cgsse.it/calendario-scioperi/dettaglio-sciopero/375031,false,2026-02-10,2026-02-10,2026-02-10,2026-02-10
12-02-2026,Igiene ambientale,ECO-CE,"Ugl Ia, Fial, Fiadel, Cil",OTTAVIANO,intera giornata,https://www.cgsse.it/calendario-scioperi/dettaglio-sciopero/375029,false,2026-02-12,2026-02-12,2026-02-12,2026-02-12
12-02-2026,Igiene ambientale,ECO-CE,"Ugl Ia, Fial, Fiadel, Cil",OTTAVIANO,intera giornata,https://www.cgsse.it/calendario-scioperi/dettaglio-sciopero/375029,true,2026-02-12,2026-02-12,2026-02-12,2026-02-12
23-02-2026,Servizio sanitario nazionale,ASL VCO,Uil Fpl,VERBANO-CUSIO-OSSOLA,intera giornata e/o turno di lavoro,https://www.cgsse.it/calendario-scioperi/dettaglio-sciopero/375002,false,2026-02-23,2026-02-23,2026-02-23,2026-02-23
23-02-2026,Servizio sanitario nazionale,ASL VCO,Uil Fpl,VERBANO-CUSIO-OSSOLA,intera giornata e/o turno di lavoro],https://www.cgsse.it/calendario-scioperi/dettaglio-sciopero/375002,false,2026-02-23,2026-02-23,2026-02-23,2026-02-23
06-02-2026,Trasporto pubblico locale,TUA,"Filt Cgil, Fit Cisl, Uiltrasporti, Faisa Cisal",ABRUZZO,dalle ore 9.00 alle ore 13.00,https://www.cgsse.it/calendario-scioperi/dettaglio-sciopero/375000,false,2026-02-06,2026-02-06,2026-02-06,2026-02-06
06-02-2026,Trasporto pubblico locale,TUA,"Filt Cgil, Fit Cisl, Uiltrasporti, Faisa Cisal",LANCIANO,intera giornata con garanzia del servizio previsto nelle fasce 5:30/8:30 e 13:00/16:00,https://www.cgsse.it/calendario-scioperi/dettaglio-sciopero/374995,false,2026-02-06,2026-02-06,2026-02-06,2026-02-06
11-02-2026,Regioni e autonomie Locali,COMUNE DI COMO,"Fp Cgil, Fp Cisl, Uil Fpl, Cobas Pi, Cse Flpl",COMO,intera giornata o turno di lavoro,https://www.cgsse.it/calendario-scioperi/dettaglio-sciopero/374944,false,2026-02-11,2026-02-11,2026-02-11,2026-02-11
06-02-2026,Igiene ambientale,DM TECHNOLOGY,Uiltrasporti,VITULAZIO,dalle ore 00:01 alle ore 23:59,https://www.cgsse.it/calendario-scioperi/dettaglio-sciopero/374936,false,2026-02-06,2026-02-06,2026-02-06,2026-02-06
04-02-2026,Sanità privata,CASA DI CURA LA MODONNINA,Uil Fpl,NAPOLI,dalle ore 8.00 alle ore 20.00,https://www.cgsse.it/calendario-scioperi/dettaglio-sciopero/374934,false,2026-02-04,2026-02-04,2026-02-04,2026-02-04
04-02-2026,"Sanità privata, Servizio sanitario nazionale",CASA DI CURA LA MODONNINA,Uil Fpl,NAPOLI,dalle ore 8.00 alle ore 20.00,https://www.cgsse.it/calendario-scioperi/dettaglio-sciopero/374934,false,2026-02-04,2026-02-04,2026-02-04,2026-02-04
04-02-2026,"Sanità privata, Servizio sanitario nazionale",CASA DI CURA LA MODONNINA,Uil Fpl,NAPOLI,dalle ore 8.00 alle ore 20.00,https://www.cgsse.it/calendario-scioperi/dettaglio-sciopero/374934,true,2026-02-04,2026-02-04,2026-02-04,2026-02-04
06-02-2026,Trasporto pubblico locale,TUA,Orsa Trasporti,ABRUZZO,intera giornata nel rispetto delle fasce di garanzia,https://www.cgsse.it/calendario-scioperi/dettaglio-sciopero/374920,false,2026-02-06,2026-02-06,2026-02-06,2026-02-06
13-02-2026,Trasporto pubblico locale,ARRIVA UDINE,Associazione Sindacale Indipendente,UDINE,dalle ore 15.00 alle ore 24.00 nel rispetto delle fasce di garanzia,https://www.cgsse.it/calendario-scioperi/dettaglio-sciopero/374909,false,2026-02-13,2026-02-13,2026-02-13,2026-02-13
13-02-2026,Trasporto pubblico locale,SASA,"Filt Cgil, Orsa Trasporti, Usb Lavoro Privato, Ugl",BOLZANO,dalle ore 9.00 alle ore 12.00 e dalle ore 15.00 a fine servizio,https://www.cgsse.it/calendario-scioperi/dettaglio-sciopero/374902,false,2026-02-13,2026-02-13,2026-02-13,2026-02-13
04-02-2026,Pulizie e multiservizi,"ATI MERANESE SERVIZI, ISS ITALIA, M.S. SERVIZI",Usb Lavoro Privato,"NAPOLI, CASTELLAMMARE DI STABIA",intera giornata,https://www.cgsse.it/calendario-scioperi/dettaglio-sciopero/374896,false,2026-02-04,2026-02-04,2026-02-04,2026-02-04
22-01-2026,Trasporto pubblico locale,ATAC,"Proclamante:Filt Cgil, Fit Cisl, Uiltrasporti, Ugl Fna|Aderente:Fast Confsal",ROMA,dalle ore 20:00 alle ore 24:00,https://www.cgsse.it/calendario-scioperi/dettaglio-sciopero/374879,false,2026-01-22,2026-01-22,2026-01-22,2026-01-22
22-01-2026,Trasporto pubblico locale,ATAC,"Usb Lavoro Privato, Orsa Tpl",ROMA,dalle ore 20:00 alle ore 24:00,https://www.cgsse.it/calendario-scioperi/dettaglio-sciopero/374876,false,2026-01-22,2026-01-22,2026-01-22,2026-01-22
22-01-2026,Trasporto pubblico locale,ATAC,"Filt Cgil, Fit Cisl, Uiltrasporti, Ugl Fna",ROMA,dalle ore 20.00 alle ore 24.00 del personale in servizio sulla linea 46/b,https://www.cgsse.it/calendario-scioperi/dettaglio-sciopero/374866,false,2026-01-22,2026-01-22,2026-01-22,2026-01-22
06-02-2026,Circolazione e sicurezza stradale,AUTOSTRADE PER L'ITALIA,Uiltrasporti,"PIACENZA , PARMA , VARESE , COMO , MILANO , BERGAMO , BRESCIA , LODI","1° turno dalle 22.00 del 5/02 alle ore 6.00 del 6/02. 2° turno 6.00-14.00, 3° turno 14.00-22.00 personale tecnico e amministrativo intera prestazione lavorativa 6.00 -20.00",https://www.cgsse.it/calendario-scioperi/dettaglio-sciopero/374861,false,2026-02-06,2026-02-06,2026-02-06,2026-02-06
Dal 02-02-2026 al 03-02-2026,Istituti di vigilanza,"COSMOPOL, SICURITALIA SPA",Cisal Terziario,TORINO,intere giornate,https://www.cgsse.it/calendario-scioperi/dettaglio-sciopero/374852,false,,2026-02-02,2026-02-03,2026-02-02
Dal 02-02-2026 al 03-02-2026,Istituti di vigilanza,"COSMOPOL, SICURITALIA SPA",Cisal Terziario,TORINO,intere giornate,https://www.cgsse.it/calendario-scioperi/dettaglio-sciopero/374852,true,,2026-02-02,2026-02-03,2026-02-02
04-02-2026,Pulizie e multiservizi,COLSER,Fiadel,SALERNO,intero turno di lavoro,https://www.cgsse.it/calendario-scioperi/dettaglio-sciopero/374835,false,2026-02-04,2026-02-04,2026-02-04,2026-02-04
06-03-2026,Trasporto pubblico locale,EAV,Confail Faisa,NAPOLI,"24 ore nel rispetto delle fasce orarie di garanzia per tutto il personale viaggiante, divisione ferro – linee vesuviane",https://www.cgsse.it/calendario-scioperi/dettaglio-sciopero/374833,false,2026-03-06,2026-03-06,2026-03-06,2026-03-06
07-03-2026,Trasporto aereo,ENAV,Astra,ROMA,dalle ore 10.00 alle ore 18.00 esclusi i voli da e per l’aeroporto di pescara,https://www.cgsse.it/calendario-scioperi/dettaglio-sciopero/374831,false,2026-03-07,2026-03-07,2026-03-07,2026-03-07
07-03-2026,Trasporto aereo,ENAV,Astra,ROMA,dalle ore 10.00 alle ore 18.00 esclusi i voli da e per l’aeroporto di pescara,https://www.cgsse.it/calendario-scioperi/dettaglio-sciopero/374831,true,2026-03-07,2026-03-07,2026-03-07,2026-03-07
09-02-2026,Regioni e autonomie Locali,RISORSE PER ROMA,"Filcams Cgil, Fisascat Cisl, Uiltrasporti",ROMA,intera giornata,https://www.cgsse.it/calendario-scioperi/dettaglio-sciopero/374829,false,2026-02-09,2026-02-09,2026-02-09,2026-02-09
04-02-2026,Sanità privata,CASA DI CURA LA MODONNINA,Fp Cisl,NAPOLI,dalle ore 8.00 alle ore 20.00,https://www.cgsse.it/calendario-scioperi/dettaglio-sciopero/374823,false,2026-02-04,2026-02-04,2026-02-04,2026-02-04
04-02-2026,Sanità privata,CASA DI CURA LA MODONNINA,Fp Cisl,NAPOLI,dalle ore 8.00 alle ore 20.00,https://www.cgsse.it/calendario-scioperi/dettaglio-sciopero/374823,true,2026-02-04,2026-02-04,2026-02-04,2026-02-04
04-02-2026,Igiene ambientale,ECOCE SRL- ECOLOGY IN PROGRESS,Uiltrasporti,SAN MARCELLINO,dalle ore 00:01 alle ore 23:59,https://www.cgsse.it/calendario-scioperi/dettaglio-sciopero/374814,false,2026-02-04,2026-02-04,2026-02-04,2026-02-04
04-02-2026,Igiene ambientale,ECOCE SRL- ECOLOGY IN PROGRESS,Uiltrasporti,SAN MARCELLINO,dalle ore 00:01 alle ore 23:59,https://www.cgsse.it/calendario-scioperi/dettaglio-sciopero/374814,true,2026-02-04,2026-02-04,2026-02-04,2026-02-04
06-02-2026,Trasporto marittimo,AZIENDE SETTORE PORTUALE,Usb Lavoro Privato,NAZIONALE,intera giornata,https://www.cgsse.it/calendario-scioperi/dettaglio-sciopero/374812,false,2026-02-06,2026-02-06,2026-02-06,2026-02-06
05-02-2026,Trasporto ferroviario,TRENITALIA,"Filt Cgil, Fit Cisl, Uiltrasporti, Orsa",RIMINI,dalle ore 9.01 alle ore 16.59,https://www.cgsse.it/calendario-scioperi/dettaglio-sciopero/374788,false,2026-02-05,2026-02-05,2026-02-05,2026-02-05
27-02-2026,Trasporto pubblico locale,FERROVIE DEL SUD EST E SERVIZI AUTOMOBILISTICI,"Filt Cgil, Fit Cisl, Faisa Cisal, Uiltrasporti",BARI,dalle ore 19.30 alle ore 23.30,https://www.cgsse.it/calendario-scioperi/dettaglio-sciopero/374783,false,2026-02-27,2026-02-27,2026-02-27,2026-02-27
06-02-2026,Scuola,MIM,Cobas Scuola,SAN SALVO,ultimi 30 minuti del turno,https://www.cgsse.it/calendario-scioperi/dettaglio-sciopero/374778,false,2026-02-06,2026-02-06,2026-02-06,2026-02-06
05-02-2026,Scuola,MIM,Cobas Scuola,SAN SALVO,ultimi 30 minuti del turno,https://www.cgsse.it/calendario-scioperi/dettaglio-sciopero/374776,false,2026-02-05,2026-02-05,2026-02-05,2026-02-05
30-01-2026,Trasporto pubblico locale,SASA,Rsu,BOLZANO,dalle ore 15.00 alle ore 19.00,https://www.cgsse.it/calendario-scioperi/dettaglio-sciopero/374774,false,2026-01-30,2026-01-30,2026-01-30,2026-01-30
07-03-2026,Trasporto aereo,ENAV,Uiltrasporti,ROMA,"dalle ore 13.00 alle ore 17.00, esclusi i voli da e per l'aeroporto di pescara",https://www.cgsse.it/calendario-scioperi/dettaglio-sciopero/374770,false,2026-03-07,2026-03-07,2026-03-07,2026-03-07
07-03-2026,Trasporto aereo,ENAV,Uiltrasporti,ROMA,"dalle ore 13.00 alle ore 17.00, esclusi i voli da e per l'aeroporto di pescara",https://www.cgsse.it/calendario-scioperi/dettaglio-sciopero/374770,true,2026-03-07,2026-03-07,2026-03-07,2026-03-07
30-01-2026,"Trasporto merci su rotaia, Trasporto ferroviario",RAIL CARGO CARRIER ITALY,Usb,NAZIONALE,dalle ore 10.00 alle ore 18.00,https://www.cgsse.it/calendario-scioperi/dettaglio-sciopero/374763,false,2026-01-30,2026-01-30,2026-01-30,2026-01-30
02-02-2026,Appalti ferroviari,COOPSERVICE SCDPA,"Uiltrasporti, Ugl Ferrovieri, Salpas Orsa, Slm Fast Confsal",LAZIO,intero turno lavorativo,https://www.cgsse.it/calendario-scioperi/dettaglio-sciopero/374752,false,2026-02-02,2026-02-02,2026-02-02,2026-02-02
02-02-2026,Appalti ferroviari,COOPSERVICE SCDPA,"Uiltrasporti, Ugl Ferrovieri, Salpas Orsa, Slm Fast Confsal",LAZIO,intero turno di lavoro,https://www.cgsse.it/calendario-scioperi/dettaglio-sciopero/374752,false,2026-02-02,2026-02-02,2026-02-02,2026-02-02
02-02-2026,Appalti ferroviari,COOPSERVICE SCDPA,"Uiltrasporti, Ugl Ferrovieri, Salpas Orsa, Slm Fast Confsal",LAZIO,intero turno di lavoro,https://www.cgsse.it/calendario-scioperi/dettaglio-sciopero/374752,true,2026-02-02,2026-02-02,2026-02-02,2026-02-02
28-01-2026,Pulizie e multiservizi,DUSSMANN SERVICE,Flaica Cub,TERNI,intera giornata,https://www.cgsse.it/calendario-scioperi/dettaglio-sciopero/374738,false,2026-01-28,2026-01-28,2026-01-28,2026-01-28
28-01-2026,Pulizie e multiservizi,DUSSMANN SERVICE,Flaica Cub,TERNI,intera giornata,https://www.cgsse.it/calendario-scioperi/dettaglio-sciopero/374738,true,2026-01-28,2026-01-28,2026-01-28,2026-01-28
28-01-2026,Pulizie e multiservizi,DUSSMANN SERVICE,Flaica Cub,PERUGIA,intera giornata,https://www.cgsse.it/calendario-scioperi/dettaglio-sciopero/374736,false,2026-01-28,2026-01-28,2026-01-28,2026-01-28
06-02-2026,Trasporto pubblico locale,TUA,"Filt Cgil, Fit Cisl, Uiltrasporti, Faisa Cisal","PESCARA , CHIETI",intera giornata con garanzia del servizio previsto nelle fasce 5:30/8:30 e 13:00/16:00,https://www.cgsse.it/calendario-scioperi/dettaglio-sciopero/374729,false,2026-02-06,2026-02-06,2026-02-06,2026-02-06
26-01-2026,Elicotteri,AVINCIS RW,"Uiltrasporti, Fit Cisl, Ugl Ta, Anpac",NAZIONALE,8 ore dalle ore 8.00 alle ore 16.00 per le basi diurne (hj) e 12 ore dalle ore 8.00 alle ore 20.00 per le basi h24,https://www.cgsse.it/calendario-scioperi/dettaglio-sciopero/374715,false,2026-01-26,2026-01-26,2026-01-26,2026-01-26
29-01-2026,Elicotteri,AVINCIS RW,"Uiltrasporti, Fit Cisl, Ugl Ta, Anpac",NAZIONALE,8 ore dalle ore 8.00 alle ore 16.00 per le basi diurne (hj) e 12 ore dalle ore 8.00 alle ore 20.00 per le basi h24,https://www.cgsse.it/calendario-scioperi/dettaglio-sciopero/374715,false,2026-01-29,2026-01-29,2026-01-29,2026-01-29
Dal 27-01-2026 al 28-01-2026,Igiene ambientale,GENERAL ENTERPRISE,Filas,POLLA,sciopero di 24 ore da inizio turno del 27/01 fino ad inizio turno del 28/01,https://www.cgsse.it/calendario-scioperi/dettaglio-sciopero/374710,false,,2026-01-27,2026-01-28,2026-01-27
Dal 27-01-2026 al 28-01-2026,Igiene ambientale,GENERAL ENTERPRISE,Filas,POLLA,sciopero di 24 ore da inizio turno del 27/01 a inizio turno del 28/01,https://www.cgsse.it/calendario-scioperi/dettaglio-sciopero/374710,false,,2026-01-27,2026-01-28,2026-01-27
Dal 27-01-2026 al 28-01-2026,Igiene ambientale,GENERAL ENTERPRISE,Filas,POLLA,sciopero di 24 ore da inizio turno del 27/01 a inizio turno del 28/01,https://www.cgsse.it/calendario-scioperi/dettaglio-sciopero/374710,true,,2026-01-27,2026-01-28,2026-01-27
Dal 27-01-2026 al 28-01-2026,Igiene ambientale,GENERAL ENTERPRISE,Filas,POLLA,"sciopero di 24 ore da inizio turno del 27/01 a inizio turno del 28/01, null]",https://www.cgsse.it/calendario-scioperi/dettaglio-sciopero/374710,true,,2026-01-27,2026-01-28,2026-01-27
16-02-2026,Trasporto aereo,VUELING AIRLINES,"Filt Cgil, Anpac",NAZIONALE,dalle ore 00.00 alle ore 23.59,https://www.cgsse.it/calendario-scioperi/dettaglio-sciopero/374708,false,2026-02-16,2026-02-16,2026-02-16,2026-02-16
16-02-2026,Trasporto aereo,VUELING AIRLINES,"Filt Cgil, Anpac",NAZIONALE,dalle ore 00.00 alle ore 23.59,https://www.cgsse.it/calendario-scioperi/dettaglio-sciopero/374708,true,2026-02-16,2026-02-16,2026-02-16,2026-02-16
06-02-2026,Trasporto pubblico locale,TUA,"Filt Cgil, Fit Cisl, Uiltrasporti, Faisa Cisal",TERAMO,intera giornata con garanzia del servizio previsto nelle fasce 5:30/8:30 e 13:00/16:00,https://www.cgsse.it/calendario-scioperi/dettaglio-sciopero/374705,false,2026-02-06,2026-02-06,2026-02-06,2026-02-06
31-01-2026,Trasporto aereo,MH24,Usb Lavoro Privato,BRESCIA,dalle ore 13:00 alle ore 17:00,https://www.cgsse.it/calendario-scioperi/dettaglio-sciopero/374700,false,2026-01-31,2026-01-31,2026-01-31,2026-01-31
31-01-2026,Trasporto aereo,MH24,Proclamante:Usb Lavoro Privato|Aderente:Filt Cgil,BRESCIA,dalle ore 13:00 alle ore 17:00,https://www.cgsse.it/calendario-scioperi/dettaglio-sciopero/374700,false,2026-01-31,2026-01-31,2026-01-31,2026-01-31
31-01-2026,Trasporto aereo,GDA HANDLING,Usb Lavoro Privato,BRESCIA,dalle ore 13:00 alle ore 17:00,https://www.cgsse.it/calendario-scioperi/dettaglio-sciopero/374698,false,2026-01-31,2026-01-31,2026-01-31,2026-01-31
01-03-2026,Regioni e autonomie Locali,COMUNE DI BOLOGNA,Sgb,BOLOGNA,intera giornata del personale del corpo di polizia locale,https://www.cgsse.it/calendario-scioperi/dettaglio-sciopero/374696,false,2026-03-01,2026-03-01,2026-03-01,2026-03-01
30-01-2026,Igiene ambientale,VITTORIA,Fp Cgil,SANTA MARIA A VICO,intera giornata,https://www.cgsse.it/calendario-scioperi/dettaglio-sciopero/374681,false,2026-01-30,2026-01-30,2026-01-30,2026-01-30
Dal 02-02-2026 al 03-02-2026,Trasporto ferroviario,TRENORD,Orsa Trasporti,LOMBARDIA,dalle ore 3.00 del 2/02 alle ore 2.00 del 3/02,https://www.cgsse.it/calendario-scioperi/dettaglio-sciopero/374678,false,,2026-02-02,2026-02-03,2026-02-02
26-01-2026,Servizio sanitario nazionale,COOPERATIVA SOCIALE NUOVA SAIR,"Fp Cgil, Fisascat Cisl, Uiltucs","CIVITAVECCHIA, BRACCIANO",intero turno di lavoro,https://www.cgsse.it/calendario-scioperi/dettaglio-sciopero/374675,false,2026-01-26,2026-01-26,2026-01-26,2026-01-26
07-03-2026,Trasporto aereo,ENAV,Ugl Ta,ROMA,dalle ore 13.00 alle ore 17.00,https://www.cgsse.it/calendario-scioperi/dettaglio-sciopero/374671,false,2026-03-07,2026-03-07,2026-03-07,2026-03-07
07-03-2026,Trasporto aereo,ENAV,Ugl Ta,ROMA,"dalle ore 13.00 alle ore 17.00, escluso i voli da e per l’aeroporto di pescara",https://www.cgsse.it/calendario-scioperi/dettaglio-sciopero/374671,false,2026-03-07,2026-03-07,2026-03-07,2026-03-07
07-03-2026,Trasporto aereo,ENAV,Ugl Ta,ROMA,"dalle ore 13.00 alle ore 17.00, esclusi i voli da e per l’aeroporto di pescara",https://www.cgsse.it/calendario-scioperi/dettaglio-sciopero/374671,false,2026-03-07,2026-03-07,2026-03-07,2026-03-07
07-03-2026,Trasporto aereo,ENAV,Ugl Ta,ROMA,"dalle ore 13.00 alle ore 17.00, esclusi i voli da e per l’aeroporto di pescara",https://www.cgsse.it/calendario-scioperi/dettaglio-sciopero/374671,true,2026-03-07,2026-03-07,2026-03-07,2026-03-07
06-02-2026,Trasporto pubblico locale,AMTAB,Uitrasporti,BARI,dalle ore 08:30 alle ore 12:30,https://www.cgsse.it/calendario-scioperi/dettaglio-sciopero/374669,false,2026-02-06,2026-02-06,2026-02-06,2026-02-06
31-01-2026,Trasporto aereo,EASYJET AIRLINE LIMITED,"Filt Cgil, Fit Cisl, Uiltrasporti, Ugl Ta, Anpac",NAZIONALE,dalle ore 13.00 alle ore 17.00,https://www.cgsse.it/calendario-scioperi/dettaglio-sciopero/374667,false,2026-01-31,2026-01-31,2026-01-31,2026-01-31
28-01-2026,Ministeri,MINISTERO DELL'INTERNO,"Rsu, Fp Cgil, Uil Pa, Confsal Unsa",MILANO,dalle ore 9.00 alle ore 11.00,https://www.cgsse.it/calendario-scioperi/dettaglio-sciopero/374656,false,2026-01-28,2026-01-28,2026-01-28,2026-01-28
28-01-2026,Ministeri,MINISTERO DELL'INTERNO,"Rsu, Fp Cgil, Uil Pa, Confsal Unsa",MILANO,dalle ore 9.00 alle ore 11.00,https://www.cgsse.it/calendario-scioperi/dettaglio-sciopero/374656,true,2026-01-28,2026-01-28,2026-01-28,2026-01-28
27-01-2026,Trasporto pubblico locale,AMT,Cub Trasporti,GENOVA,servizio urbano ed extraurbano dalle ore 11.30 alle ore 15.30,https://www.cgsse.it/calendario-scioperi/dettaglio-sciopero/374650,false,2026-01-27,2026-01-27,2026-01-27,2026-01-27
26-01-2026,Elicotteri,AVINCIS RW,"Uiltrasporti, Fit Cisl, Ugl Ta, Anpac",NAZIONALE,8 ore dalle ore 8.00 alle ore 16.00 per le basi diurne (hj) e 12 ore dalle ore 8.00 alle ore 20.00 per le basi h24,https://www.cgsse.it/calendario-scioperi/dettaglio-sciopero/374636,false,2026-01-26,2026-01-26,2026-01-26,2026-01-26
26-01-2026,Elicotteri,AVINCIS RW,"Uiltrasporti, Fit Cisl, Ugl Ta, Anpac",NAZIONALE,8 ore dalle ore 8.00 alle ore 16.00 per le basi diurne (hj) e 12 ore dalle ore 8.00 alle ore 20.00 per le basi h24,https://www.cgsse.it/calendario-scioperi/dettaglio-sciopero/374636,true,2026-01-26,2026-01-26,2026-01-26,2026-01-26
16-02-2026,Trasporto aereo,ALHA,Cub Trasporti,"MILANO, VARESE",dalle ore 00.00 alle ore 23.59,https://www.cgsse.it/calendario-scioperi/dettaglio-sciopero/374619,false,2026-02-16,2026-02-16,2026-02-16,2026-02-16
16-02-2026,Trasporto aereo,ALHA,Cub Trasporti,"MILANO, VARESE",dalle ore 00.00 alle ore 23.59,https://www.cgsse.it/calendario-scioperi/dettaglio-sciopero/374619,true,2026-02-16,2026-02-16,2026-02-16,2026-02-16
16-02-2026,Trasporto aereo,AIRPORT HANDLING,Cub Trasporti,"MILANO, VARESE",dalle ore 00.00 alle ore 23.59,https://www.cgsse.it/calendario-scioperi/dettaglio-sciopero/374602,false,2026-02-16,2026-02-16,2026-02-16,2026-02-16
16-02-2026,Trasporto aereo,AIRPORT HANDLING/DNATA,Cub Trasporti,"MILANO, VARESE",dalle ore 00.00 alle ore 23.59,https://www.cgsse.it/calendario-scioperi/dettaglio-sciopero/374602,true,2026-02-16,2026-02-16,2026-02-16,2026-02-16
23-01-2026,"Pulizie e multiservizi, Regioni e autonomie Locali",ECOPARKING,"Filcams Cgil, Fisascat Cisl",AGRIGENTO,intero turno di lavoro,https://www.cgsse.it/calendario-scioperi/dettaglio-sciopero/374600,false,2026-01-23,2026-01-23,2026-01-23,2026-01-23
23-01-2026,"Pulizie e multiservizi, Regioni e autonomie Locali",ECOPARKING,"Filcams Cgil, Fisascat Cisl",AGRIGENTO,intero turno di lavoro,https://www.cgsse.it/calendario-scioperi/dettaglio-sciopero/374600,true,2026-01-23,2026-01-23,2026-01-23,2026-01-23
13-02-2026,Trasporto pubblico locale,GTM,Uiltrasporti,TERMOLI,dalle ore 8.17 alle ore 13.00 e dalle ore 16.00 a fine servizio,https://www.cgsse.it/calendario-scioperi/dettaglio-sciopero/374585,false,2026-02-13,2026-02-13,2026-02-13,2026-02-13
02-02-2026,Istituti di vigilanza,COSMOPOL,Uiltucs,BRINDISI,intera giornata/turno di lavoro,https://www.cgsse.it/calendario-scioperi/dettaglio-sciopero/374583,false,2026-02-02,2026-02-02,2026-02-02,2026-02-02
02-02-2026,"Trasporto aereo, Istituti di vigilanza",COSMOPOL,Uiltucs,BRINDISI,intera giornata/turno di lavoro,https://www.cgsse.it/calendario-scioperi/dettaglio-sciopero/374583,false,2026-02-02,2026-02-02,2026-02-02,2026-02-02
02-02-2026,"Trasporto aereo, Istituti di vigilanza",COSMOPOL,Uiltucs,BRINDISI,intera giornata / turno di lavoro,https://www.cgsse.it/calendario-scioperi/dettaglio-sciopero/374583,false,2026-02-02,2026-02-02,2026-02-02,2026-02-02
22-01-2026,Ministeri,SLEM,Ugl,CAMPANIA,intero turno di lavoro,https://www.cgsse.it/calendario-scioperi/dettaglio-sciopero/374573,false,2026-01-22,2026-01-22,2026-01-22,2026-01-22
12-01-2026,Metalmeccanici,ACCIAIERIE D'ITALIA,"Ugl Metalmeccanici, Ugl Chimici",TARANTO,intera giornata,https://www.cgsse.it/calendario-scioperi/dettaglio-sciopero/374569,false,2026-01-12,2026-01-12,2026-01-12,2026-01-12
Dal 27-02-2026 al 28-02-2026,Trasporto ferroviario,"GRUPPO FSI, MERCITALIA RAIL, TRENITALIA, TRENITALIA TPER SCARL",Assemblea Nazionale Pdm/pdb,NAZIONALE,dalle ore 21.00 del 27/02 alle ore 20.59 del 28/02,https://www.cgsse.it/calendario-scioperi/dettaglio-sciopero/374562,false,,2026-02-27,2026-02-28,2026-02-27
Dal 27-02-2026 al 28-02-2026,Trasporto ferroviario,"GRUPPO FSI, MERCITALIA RAIL, TRENITALIA, TRENITALIA TPER SCARL",Assemblea Nazionale Pdm/pdb,NAZIONALE,dalle ore 21.00 del 27/02 alle ore 20.59 del 28/02,https://www.cgsse.it/calendario-scioperi/dettaglio-sciopero/374562,true,,2026-02-27,2026-02-28,2026-02-27
26-01-2026,Regioni e autonomie Locali,PAOLO SCOPPIO AUTOLINEE,Faisa Cisal,ROMA,,https://www.cgsse.it/calendario-scioperi/dettaglio-sciopero/374546,false,2026-01-26,2026-01-26,2026-01-26,2026-01-26
26-01-2026,Regioni e autonomie Locali,PAOLO SCOPPIO AUTOLINEE,Usb Lavoro Privato,ROMA,intera giornata,https://www.cgsse.it/calendario-scioperi/dettaglio-sciopero/374546,false,2026-01-26,2026-01-26,2026-01-26,2026-01-26
26-01-2026,Regioni e autonomie Locali,PAOLO SCOPPIO AUTOLINEE,Usb Lavoro Privato,ROMA,intera giornata,https://www.cgsse.it/calendario-scioperi/dettaglio-sciopero/374546,true,2026-01-26,2026-01-26,2026-01-26,2026-01-26
26-01-2026,Regioni e autonomie Locali,PAOLO SCOPPIO AUTOLINEE,Faisa Cisal,ROMA,dalle ore 12:30 alle ore 16:30,https://www.cgsse.it/calendario-scioperi/dettaglio-sciopero/374542,false,2026-01-26,2026-01-26,2026-01-26,2026-01-26
26-01-2026,Regioni e autonomie Locali,PAOLO SCOPPIO AUTOLINEE,Faisa Cisal,ROMA,dalle ore 12:30 alle ore 16:30,https://www.cgsse.it/calendario-scioperi/dettaglio-sciopero/374542,true,2026-01-26,2026-01-26,2026-01-26,2026-01-26
30-01-2026,Trasporto pubblico locale,SASA,"Orsa Trasporti, Usb Lavoro Privato, Ugl",BOLZANO,dalle ore 00.00 alle 24.00 con esclusione delle previste fasce di garanzia dalle ore 06:00 alle ore 09:00 e dalle ore 12:00 alle ore 15:00,https://www.cgsse.it/calendario-scioperi/dettaglio-sciopero/374527,false,2026-01-30,2026-01-30,2026-01-30,2026-01-30
30-01-2026,Trasporto pubblico locale,SASA,"Orsa Trasporti, Usb Lavoro Privato, Ugl",BOLZANO,dalle ore 00.00 alle 24.00 fasce garantite 6:00-9:00 e 12:00-15:00,https://www.cgsse.it/calendario-scioperi/dettaglio-sciopero/374527,false,2026-01-30,2026-01-30,2026-01-30,2026-01-30
Dal 12-01-2026 al 13-01-2026,"Trasporto merci su rotaia, Trasporto ferroviario",AZIENDE DEL COMPARTO FERROVIARIO MERCI E VIAGGIATORI,Orsa Trasporti,LOMBARDIA,dalle ore 3.00 del 12/01 alle ore 2.00 del 13/01,https://www.cgsse.it/calendario-scioperi/dettaglio-sciopero/374523,false,,2026-01-12,2026-01-13,2026-01-12
19-01-2026,Trasporto pubblico locale,ARRIVA UDINE,Associazione Sindacale Indipendente,UDINE,servizio urbano dalle ore 17.30 alle ore 21.30 extraurbano dalle 17.15 alle 21.15,https://www.cgsse.it/calendario-scioperi/dettaglio-sciopero/374520,false,2026-01-19,2026-01-19,2026-01-19,2026-01-19
19-01-2026,Trasporto pubblico locale,ARRIVA UDINE,Associazione Sindacale Indipendente,UDINE,servizio urbano dalle ore 17.30 alle ore 21.29 extraurbano dalle 17.15 alle 21.14,https://www.cgsse.it/calendario-scioperi/dettaglio-sciopero/374520,false,2026-01-19,2026-01-19,2026-01-19,2026-01-19
28-01-2026,Ministeri,MINISTERO DELL'INTERNO,"Rsu, Fp Cgil, Uil Pa, Confsal Unsa",MILANO,dalle ore 9.00 alle ore 11.00,https://www.cgsse.it/calendario-scioperi/dettaglio-sciopero/374514,false,2026-01-28,2026-01-28,2026-01-28,2026-01-28
28-01-2026,Ministeri,MINISTERO DELL'INTERNO,"Rsu, Fp Cgil, Uil Pa, Confsal Unsa",MILANO,dalle ore 9.00 alle ore 11.00,https://www.cgsse.it/calendario-scioperi/dettaglio-sciopero/374514,true,2026-01-28,2026-01-28,2026-01-28,2026-01-28
19-01-2026,Ministeri,COMPASS GROUP ITALIA SPA,"Fisascat Cisl, Uiltucs Uil",NAPOLI,intera giornata,https://www.cgsse.it/calendario-scioperi/dettaglio-sciopero/374503,false,2026-01-19,2026-01-19,2026-01-19,2026-01-19
16-02-2026,Trasporto aereo,ITA AIRWAYS,Usb Lavoro Privato,NAZIONALE,dalle ore 13.00 alle ore 17.00,https://www.cgsse.it/calendario-scioperi/dettaglio-sciopero/374500,false,2026-02-16,2026-02-16,2026-02-16,2026-02-16
16-02-2026,Trasporto aereo,ITA AIRWAYS,Usb Lavoro Privato,NAZIONALE,dalle ore 13.00 alle ore 17.00,https://www.cgsse.it/calendario-scioperi/dettaglio-sciopero/374500,true,2026-02-16,2026-02-16,2026-02-16,2026-02-16
02-02-2026,Appalti ferroviari,ELIOR RISTORAZIONE SPA,"Uiltrasporti, Ugl Ferrovieri, Salpas Orsa, Slm Fast Confsal",ROMA,4 ore,https://www.cgsse.it/calendario-scioperi/dettaglio-sciopero/374498,false,2026-02-02,2026-02-02,2026-02-02,2026-02-02
02-02-2026,Appalti ferroviari,DUSSMANN SERVICE SRL,"Uiltrasporti, Ugl Ferrovieri, Salpas Orsa, Slm Fast Confsal",ROMA,4 ore,https://www.cgsse.it/calendario-scioperi/dettaglio-sciopero/374493,false,2026-02-02,2026-02-02,2026-02-02,2026-02-02
02-02-2026,Appalti ferroviari,DUSSMANN SERVICE SRL,"Uiltrasporti, Ugl Ferrovieri, Salpas Orsa, Slm Fast Confsal",ROMA,4 ore,https://www.cgsse.it/calendario-scioperi/dettaglio-sciopero/374493,true,2026-02-02,2026-02-02,2026-02-02,2026-02-02
08-01-2026,Trasporto ferroviario,TRENITALIA,"Filt Cgil, Fit Cisl, Uiltrasporti, Orsa, Fast Confsal, Ugl Ferrovieri",LIGURIA,dalle ore 9.01 alle ore 17.00,https://www.cgsse.it/calendario-scioperi/dettaglio-sciopero/374476,false,2026-01-08,2026-01-08,2026-01-08,2026-01-08
16-02-2026,Trasporto aereo,VUELING AIRLINES,Uiltrasporti,NAZIONALE,dalle ore 00.01 alle ore 24.00,https://www.cgsse.it/calendario-scioperi/dettaglio-sciopero/374460,true,2026-02-16,2026-02-16,2026-02-16,2026-02-16
07-01-2026,"Trasporto merci su rotaia, Trasporto ferroviario",AZIENDE DEL COMPARTO FERROVIARIO MERCI E VIAGGIATORI,Cat,EMILIA ROMAGNA,dalle ore 9.01 alle ore 17.00,https://www.cgsse.it/calendario-scioperi/dettaglio-sciopero/374458,false,2026-01-07,2026-01-07,2026-01-07,2026-01-07
Dal 09-01-2026 al 10-01-2026,"Trasporto merci su rotaia, Trasporto pubblico locale, Trasporto ferroviario",AZIENDE DEL SETTORE,"Sgb, Cub Trasporti",NAZIONALE,dalle ore 21.00 del 9/01 alle ore 21.00 del 10/01,https://www.cgsse.it/calendario-scioperi/dettaglio-sciopero/374452,false,,2026-01-09,2026-01-10,2026-01-09
07-01-2026,"Trasporto merci su rotaia, Trasporto ferroviario, Appalti ferroviari",AZIENDE DEL COMPARTO FERROVIARIO,"Filt Cgil, Fit Cisl, Uiltrasporti, Orsa, Fast Confsal, Ugl Ferrovieri",EMILIA ROMAGNA,dalle ore 9.01 alle ore 17.00,https://www.cgsse.it/calendario-scioperi/dettaglio-sciopero/374443,false,2026-01-07,2026-01-07,2026-01-07,2026-01-07
16-01-2026,Poste,POSTE ITALIANE,Slc Cgil,BRESCIA,2 ore a inizio turno (per tutti i turni),https://www.cgsse.it/calendario-scioperi/dettaglio-sciopero/374436,false,2026-01-16,2026-01-16,2026-01-16,2026-01-16
16-01-2026,Poste,POSTE ITALIANE,Slc Cgil,BRESCIA,2 ore a inizio turno (per tutti i turni),https://www.cgsse.it/calendario-scioperi/dettaglio-sciopero/374436,true,2026-01-16,2026-01-16,2026-01-16,2026-01-16
12-01-2026,Istituti di vigilanza,SECURITY.IT,"Fisascat Cisl, Uiltucs, Filcams Cgil",NAZIONALE,intero turno di lavoro,https://www.cgsse.it/calendario-scioperi/dettaglio-sciopero/374434,false,2026-01-12,2026-01-12,2026-01-12,2026-01-12
12-01-2026,Istituti di vigilanza,SECURITY.IT,"Fisascat Cisl, Uiltucs, Filcams Cgil",ROMA,intero turno di lavoro,https://www.cgsse.it/calendario-scioperi/dettaglio-sciopero/374434,false,2026-01-12,2026-01-12,2026-01-12,2026-01-12
12-01-2026,Istituti di vigilanza,SECURITY.IT,"Fisascat Cisl, Uiltucs, Filcams Cgil",ROMA,intero turno di lavoro,https://www.cgsse.it/calendario-scioperi/dettaglio-sciopero/374434,true,2026-01-12,2026-01-12,2026-01-12,2026-01-12
Dal 12-01-2026 al 13-01-2026,"Scuola, Regioni e autonomie Locali",MIM,Csle,NAZIONALE,intere giornate,https://www.cgsse.it/calendario-scioperi/dettaglio-sciopero/374410,false,,2026-01-12,2026-01-13,2026-01-12
07-03-2026,Trasporto aereo,ENAV,"Filt Cgil, Fast Confsal Av Unica",ROMA,dalle ore 10.00 alle ore 18.00 esclusi i voli da e per l’aeroporto di pescara,https://www.cgsse.it/calendario-scioperi/dettaglio-sciopero/374404,false,2026-03-07,2026-03-07,2026-03-07,2026-03-07
07-03-2026,Trasporto aereo,ENAV,"Filt Cgil, Fast Confsal Av Unica",ROMA,dalle ore 10.00 alle ore 18.00.esclusi i voli da e per l’aeroporto di pescara,https://www.cgsse.it/calendario-scioperi/dettaglio-sciopero/374404,false,2026-03-07,2026-03-07,2026-03-07,2026-03-07
07-03-2026,Trasporto aereo,ENAV,Filt Cgil,ROMA,dalle ore 10.00 alle ore 18.00.esclusi i voli da e per l’aeroporto di pescara,https://www.cgsse.it/calendario-scioperi/dettaglio-sciopero/374404,false,2026-03-07,2026-03-07,2026-03-07,2026-03-07
07-03-2026,Trasporto aereo,ENAV,Filt Cgil,ROMA,"dalle ore 10.00 alle ore 18.00, esclusi i voli da e per l’aeroporto di pescara",https://www.cgsse.it/calendario-scioperi/dettaglio-sciopero/374404,true,2026-03-07,2026-03-07,2026-03-07,2026-03-07
19-01-2026,Sanità privata,AIAS,Fials,POTENZA,dalle ore 8.00 alle ore 14.00,https://www.cgsse.it/calendario-scioperi/dettaglio-sciopero/374388,false,2026-01-19,2026-01-19,2026-01-19,2026-01-19
19-01-2026,Sanità privata,AIAS,Fials,POTENZA,dalle ore 8.00 alle ore 14.00,https://www.cgsse.it/calendario-scioperi/dettaglio-sciopero/374388,true,2026-01-19,2026-01-19,2026-01-19,2026-01-19
19-01-2026,Trasporto pubblico locale,EAV,Confail Faisa,NAPOLI,"24 ore nel rispetto delle fasce orarie di garanzia per tutto il personale viaggiante eav, divisione ferro – linee vesuviane",https://www.cgsse.it/calendario-scioperi/dettaglio-sciopero/374383,false,2026-01-19,2026-01-19,2026-01-19,2026-01-19
19-01-2026,Trasporto pubblico locale,SASA,"Filt Cgil, Orsa Trasporti, Usb Lavoro Privato, Ugl",BOLZANO,dalle ore 16.00 alle ore 20.00,https://www.cgsse.it/calendario-scioperi/dettaglio-sciopero/374375,false,2026-01-19,2026-01-19,2026-01-19,2026-01-19
Dal 14-01-2026 al 22-01-2026,Avvocati,SETTORE GIUSTIZIA,Camera Penale Di Nocera Inferiore,NOCERA INFERIORE,astensione dall'attività giudiziaria,https://www.cgsse.it/calendario-scioperi/dettaglio-sciopero/374370,false,,2026-01-14,2026-01-22,2026-01-14
30-01-2026,Trasporto pubblico locale,"AUTOLINEE GALLO, AUTOLINEE GIAMPORCARO, SAIS AUTOLINEE","Filt Cgil, Uiltrasporti, Faisa Cisal",PALERMO,4 ore,https://www.cgsse.it/calendario-scioperi/dettaglio-sciopero/374362,false,2026-01-30,2026-01-30,2026-01-30,2026-01-30
30-01-2026,Trasporto pubblico locale,"AUTOLINEE GALLO, AUTOLINEE GIAMPORCARO, SAIS AUTOLINEE","Filt Cgil, Uiltrasporti, Faisa Cisal",PALERMO,4 ore,https://www.cgsse.it/calendario-scioperi/dettaglio-sciopero/374362,true,2026-01-30,2026-01-30,2026-01-30,2026-01-30
Dal 10-01-2026 al 11-01-2026,Servizio sanitario nazionale,ISTITUTI DI VIGILANZA PRIVATA E SERVIZI SICUREZZA,Cisal Sinalv,LOMBARDIA,dalle ore 15.00 del 10/01 alle ore 15.00 del 11/01,https://www.cgsse.it/calendario-scioperi/dettaglio-sciopero/374333,false,,2026-01-10,2026-01-11,2026-01-10
08-01-2026,Trasporto pubblico locale,TUA,"Filt Cgil, Fit Cisl, Uiltrasporti, Faisa Cisal",LANCIANO,dalle ore 9.00 alle ore 13.00,https://www.cgsse.it/calendario-scioperi/dettaglio-sciopero/374331,false,2026-01-08,2026-01-08,2026-01-08,2026-01-08
08-01-2026,Trasporto pubblico locale,AZIENDE DEL SETTORE,"Filt Cgil, Fit Cisl, Uiltrasporti, Faisa Cisal",ABRUZZO,sciopero di 4 ore con articolazione oraria concordata a livello aziendale nel rispetto delle fasce di garanzia,https://www.cgsse.it/calendario-scioperi/dettaglio-sciopero/374326,false,2026-01-08,2026-01-08,2026-01-08,2026-01-08
Dal 10-01-2026 al 11-01-2026,"Trasporto aereo, Istituti di vigilanza, Servizio sanitario nazionale",ISTITUTI DI VIGILANZA PRIVATA E SERVIZI SICUREZZA,Cisal Sinalv,LOMBARDIA,dalle ore 15.00 del 10/01 alle ore 15.00 del 11/01,https://www.cgsse.it/calendario-scioperi/dettaglio-sciopero/374306,false,,2026-01-10,2026-01-11,2026-01-10
Dal 10-01-2026 al 11-01-2026,Trasporto aereo,ISTITUTI DI VIGILANZA PRIVATA E SERVIZI SICUREZZA,Cisal Sinalv,LOMBARDIA,dalle ore 15.00 del 10/01 alle ore 15.00 del 11/01,https://www.cgsse.it/calendario-scioperi/dettaglio-sciopero/374306,true,,2026-01-10,2026-01-11,2026-01-10
Dal 14-01-2026 al 22-01-2026,Avvocati,SETTORE GIUSTIZIA,Camera Penale Salernitana,SALERNO,astensione dall'attività giudiziaria,https://www.cgsse.it/calendario-scioperi/dettaglio-sciopero/374281,false,,2026-01-14,2026-01-22,2026-01-14
09-01-2026,Trasporto aereo,VUELING AIRLINES,Uiltrasporti,NAZIONALE,dalle ore 10.01 alle ore 18.00,https://www.cgsse.it/calendario-scioperi/dettaglio-sciopero/374279,false,2026-01-09,2026-01-09,2026-01-09,2026-01-09
09-01-2026,Trasporto aereo,VUELING AIRLINES,Uiltrasporti,NAZIONALE,dalle ore 10.01 alle ore 18.00,https://www.cgsse.it/calendario-scioperi/dettaglio-sciopero/374279,true,2026-01-09,2026-01-09,2026-01-09,2026-01-09
10-01-2026,Trasporto ferroviario,"GRUPPO FSI, RFI",Cobas Lavoro Privato,NAZIONALE,sciopero di 8 ore,https://www.cgsse.it/calendario-scioperi/dettaglio-sciopero/374277,false,2026-01-10,2026-01-10,2026-01-10,2026-01-10
10-01-2026,Trasporto ferroviario,"GRUPPO FSI, RFI",Cobas Lavoro Privato,NAZIONALE,dalle ore 9.01 alle ore 10.00 verranno esclusi dallo sciopero i tratti di competenza di trenord,https://www.cgsse.it/calendario-scioperi/dettaglio-sciopero/374277,false,2026-01-10,2026-01-10,2026-01-10,2026-01-10
10-01-2026,Trasporto ferroviario,"GRUPPO FSI, RFI",Assemblea Nazionale Pdm/pdb,NAZIONALE,sciopero di 8 ore,https://www.cgsse.it/calendario-scioperi/dettaglio-sciopero/374275,false,2026-01-10,2026-01-10,2026-01-10,2026-01-10
10-01-2026,Trasporto ferroviario,"GRUPPO FSI, RFI",Assemblea Nazionale Pdm/pdb,NAZIONALE,dalle ore 9.01 alle ore 10.00 verranno esclusi dallo sciopero i tratti di competenza di trenord,https://www.cgsse.it/calendario-scioperi/dettaglio-sciopero/374275,false,2026-01-10,2026-01-10,2026-01-10,2026-01-10
01-10-2025,Pulizie e multiservizi,SOCIETÀ ECO COOP MULTISERVICE FACILITY MANAGMENT SOCIETÀ IL GRAPPOLO,Ugl,NAPOLI,intera giornata,https://www.cgsse.it/calendario-scioperi/dettaglio-sciopero/374271,false,2025-10-01,2025-10-01,2025-10-01,2025-10-01
09-01-2026,Sanità privata,.CASA SOLLIEVO DELLA SOFFERENZA,"Fp Cgil, Cisl Fp, Uilfpl, Fials, Nursind, Anmirs, Anaao",SAN GIOVANNI ROTONDO,intera giornata personale comparto e dirigenza medica,https://www.cgsse.it/calendario-scioperi/dettaglio-sciopero/374269,false,2026-01-09,2026-01-09,2026-01-09,2026-01-09
09-01-2026,Sanità privata,.CASA SOLLIEVO DELLA SOFFERENZA,"Fp Cgil, Cisl Fp, Uilfpl, Fials, Nursind, Anmirs, Anaao, Nursing Up",SAN GIOVANNI ROTONDO,intera giornata personale comparto e dirigenza medica,https://www.cgsse.it/calendario-scioperi/dettaglio-sciopero/374269,true,2026-01-09,2026-01-09,2026-01-09,2026-01-09
09-01-2026,Sanità privata,.CASA SOLLIEVO DELLA SOFFERENZA,Nursing Up,SAN GIOVANNI ROTONDO,intera giornata personale comparto e dirigenza medica,https://www.cgsse.it/calendario-scioperi/dettaglio-sciopero/374261,false,2026-01-09,2026-01-09,2026-01-09,2026-01-09
10-10-2025,Servizio sanitario nazionale,SDS SRL COOP CRESCERE CON,Fp Cgil,ROMA,intero turno di lavoro,https://www.cgsse.it/calendario-scioperi/dettaglio-sciopero/374258,false,2025-10-10,2025-10-10,2025-10-10,2025-10-10
10-10-2025,Servizio sanitario nazionale,SDS SRL COOP CRESCERE CON,Fp Cgil,ROMA,intero turno di lavoro,https://www.cgsse.it/calendario-scioperi/dettaglio-sciopero/374258,true,2025-10-10,2025-10-10,2025-10-10,2025-10-10
13-01-2026,Telecomunicazioni,KONECTA,"Slc Cgil, Uilcom Uil, Fistel Cisl","TORINO , ASTI",intera giornata,https://www.cgsse.it/calendario-scioperi/dettaglio-sciopero/374255,false,2026-01-13,2026-01-13,2026-01-13,2026-01-13
08-01-2026,Regioni e autonomie Locali,AMES,Fp Cgil,VENEZIA,intera giornata,https://www.cgsse.it/calendario-scioperi/dettaglio-sciopero/374248,false,2026-01-08,2026-01-08,2026-01-08,2026-01-08
20-01-2026,"Trasporto merci su rotaia, Trasporto ferroviario",AZIENDE CHE SVOLGONO ATTIVITA FERROVIARIA,"Sgb, Cub Trasporti",NAZIONALE,dalle ore 00.01 alle ore 23.00,https://www.cgsse.it/calendario-scioperi/dettaglio-sciopero/374245,false,2026-01-20,2026-01-20,2026-01-20,2026-01-20
20-01-2026,"Trasporto merci su rotaia, Trasporto ferroviario",AZIENDE CHE SVOLGONO ATTIVITA FERROVIARIA,"Sgb, Cub Trasporti",NAZIONALE,dalle ore 00.01 alle ore 23.00,https://www.cgsse.it/calendario-scioperi/dettaglio-sciopero/374245,true,2026-01-20,2026-01-20,2026-01-20,2026-01-20
Dal 31-12-2025 al 01-01-2026,Istituti di vigilanza,ISTITUTI DI VIGILANZA PRIVATA E SERVIZI SICUREZZA,Cisal Sinalv,LOMBARDIA,dalle ore 15.00 del 31/01/2025 alle ore 15.00 del 1/01/2026,https://www.cgsse.it/calendario-scioperi/dettaglio-sciopero/374237,false,,2025-12-31,2026-01-01,2025-12-31
Dal 31-12-2025 al 01-01-2026,Istituti di vigilanza,ISTITUTI DI VIGILANZA PRIVATA E SERVIZI SICUREZZA,Cisal Sinalv,LOMBARDIA,dalle ore 15.00 del 31/12/2025 alle ore 15.00 del 1/01/2026,https://www.cgsse.it/calendario-scioperi/dettaglio-sciopero/374237,false,,2025-12-31,2026-01-01,2025-12-31
Dal 14-01-2026 al 22-01-2026,Avvocati,SETTORE GIUSTIZIA,Camera Penale Di Vallo Della Lucania,VALLO DELLA LUCANIA,astensione dall'attività giudiziaria,https://www.cgsse.it/calendario-scioperi/dettaglio-sciopero/374205,false,,2026-01-14,2026-01-22,2026-01-14
29-01-2026,Trasporto pubblico locale,CONEROBUS,"Filt Cgil, Fit Cisl, Uiltrasporti, Faisa Cisal",ANCONA,dalle ore 8.30 alle ore 17.30 e dalle 20.30 a fine servizio,https://www.cgsse.it/calendario-scioperi/dettaglio-sciopero/374203,false,2026-01-29,2026-01-29,2026-01-29,2026-01-29
29-01-2026,Trasporto pubblico locale,CONEROBUS,"Filt Cgil, Fit Cisl, Uiltrasporti, Faisa Cisal",ANCONA,dalle ore 8.30 alle ore 17.30 e dalle 20.30 a fine servizio,https://www.cgsse.it/calendario-scioperi/dettaglio-sciopero/374203,true,2026-01-29,2026-01-29,2026-01-29,2026-01-29
08-01-2026,Istituti di vigilanza,URBE VIGILANZA,Uiltucs,BOLOGNA,intera giornata,https://www.cgsse.it/calendario-scioperi/dettaglio-sciopero/374198,false,2026-01-08,2026-01-08,2026-01-08,2026-01-08
Dal 01-01-2026 al 06-01-2026,"Trasporto aereo, Istituti di vigilanza, Servizio sanitario nazionale",URBE VIGILANZA,Uiltucs,BOLOGNA,intere giornate,https://www.cgsse.it/calendario-scioperi/dettaglio-sciopero/374192,true,,2026-01-01,2026-01-06,2026-01-01
08-01-2026,Istituti di vigilanza,URBE VIGILANZA,Uiltucs,BOLOGNA,intera giornata,https://www.cgsse.it/calendario-scioperi/dettaglio-sciopero/374189,false,2026-01-08,2026-01-08,2026-01-08,2026-01-08
09-01-2026,Sanità privata,RSA AL CASTELLO,"Fisascat Cisl, Uil Fpl",ALPIGNANO,intera giornata,https://www.cgsse.it/calendario-scioperi/dettaglio-sciopero/374187,false,2026-01-09,2026-01-09,2026-01-09,2026-01-09
16-02-2026,Trasporto aereo,ITA AIRWAYS,"Filt Cgil, Fit Cisl, Uiltrasporti, Ugl Ta, Anpac, Anp",NAZIONALE,dalle ore 00.01 alle ore 24.00,https://www.cgsse.it/calendario-scioperi/dettaglio-sciopero/374184,false,2026-02-16,2026-02-16,2026-02-16,2026-02-16
16-02-2026,Trasporto aereo,ITA AIRWAYS,"Filt Cgil, Fit Cisl, Uiltrasporti, Ugl Ta, Anpac, Anp",NAZIONALE,dalle ore 00.01 alle ore 24.00,https://www.cgsse.it/calendario-scioperi/dettaglio-sciopero/374184,true,2026-02-16,2026-02-16,2026-02-16,2026-02-16
09-01-2026,Trasporto aereo,VUELING AIRLINES,"Filt Cgil, Anpac",NAZIONALE,dalle ore 10.00 alle ore 18.00,https://www.cgsse.it/calendario-scioperi/dettaglio-sciopero/374177,false,2026-01-09,2026-01-09,2026-01-09,2026-01-09
19-01-2026,Istituti di vigilanza,"COSMOPOL, SICURITALIA SPA",Cisal Terziario,TORINO,intera giornata,https://www.cgsse.it/calendario-scioperi/dettaglio-sciopero/374170,false,2026-01-19,2026-01-19,2026-01-19,2026-01-19
16-01-2026,Vigili del fuoco,MINISTERO DELL'INTERNO,Fp Cgil,REGGIO NELL'EMILIA,dalle ore 16.00 alle ore 20.00,https://www.cgsse.it/calendario-scioperi/dettaglio-sciopero/374167,false,2026-01-16,2026-01-16,2026-01-16,2026-01-16
Dal 30-01-2026 al 31-01-2026,Servizio sanitario nazionale,USL,Fials,BOLOGNA,dalle ore 7:00 del 30/01 alle ore 7:00 del 31/01,https://www.cgsse.it/calendario-scioperi/dettaglio-sciopero/374165,false,,2026-01-30,2026-01-31,2026-01-30
20-01-2026,Trasporto ferroviario,"GRUPPO FSI, MERCITALIA RAIL, TRENITALIA, TRENITALIA TPER SCARL",Assemblea Nazionale Pdm/pdb,NAZIONALE,dalle ore 00.01 alle ore 23.00,https://www.cgsse.it/calendario-scioperi/dettaglio-sciopero/374152,false,2026-01-20,2026-01-20,2026-01-20,2026-01-20
20-01-2026,Trasporto ferroviario,"GRUPPO FSI, MERCITALIA RAIL, TRENITALIA, TRENITALIA TPER SCARL",Assemblea Nazionale Pdm/pdb,NAZIONALE,dalle ore 00.01 alle ore 23.00,https://www.cgsse.it/calendario-scioperi/dettaglio-sciopero/374152,true,2026-01-20,2026-01-20,2026-01-20,2026-01-20
09-01-2026,Trasporto aereo,EASYJET AIRLINE LIMITED,Usb Lavoro Privato,NAZIONALE,dalle ore 00.00 alle ore 23.59,https://www.cgsse.it/calendario-scioperi/dettaglio-sciopero/374150,false,2026-01-09,2026-01-09,2026-01-09,2026-01-09
15-01-2026,Istituti di vigilanza,"COSMOPOL, SICURITALIA SPA",Cisal Terziario,TORINO,intera giornata,https://www.cgsse.it/calendario-scioperi/dettaglio-sciopero/374148,true,2026-01-15,2026-01-15,2026-01-15,2026-01-15
16-01-2026,Trasporto pubblico locale,AUTOSERVIZI RUSSO,Faisa Cisal,PALERMO,"dalle ore 00.00 alle ore 5.59, dalle ore 9.00 alle ore 13.29 e dalle ore 16.30 alle 23.59",https://www.cgsse.it/calendario-scioperi/dettaglio-sciopero/374114,false,2026-01-16,2026-01-16,2026-01-16,2026-01-16
16-01-2026,Trasporto pubblico locale,INTERBUS,Faisa Cisal,ENNA,"dalle ore 00.00 alle ore 5.59, dalle ore 9.00 alle ore 13.29 e dalle ore 16.30 alle 23.59",https://www.cgsse.it/calendario-scioperi/dettaglio-sciopero/374112,false,2026-01-16,2026-01-16,2026-01-16,2026-01-16
16-01-2026,Trasporto pubblico locale,ETNA TRASPORTI,Faisa Cisal,CATANIA,"dalle ore 00.00 alle ore 5.59, dalle ore 9.00 alle ore 13.29 e dalle ore 16.30 alle 23.59",https://www.cgsse.it/calendario-scioperi/dettaglio-sciopero/374110,false,2026-01-16,2026-01-16,2026-01-16,2026-01-16
16-01-2026,Trasporto pubblico locale,SEGESTA AUTOLINEE,Faisa Cisal,PALERMO,"dalle ore 00.00 alle ore 5.59, dalle ore 9.00 alle ore 13.29 e dalle ore 16.30 alle 23.59",https://www.cgsse.it/calendario-scioperi/dettaglio-sciopero/374108,false,2026-01-16,2026-01-16,2026-01-16,2026-01-16
16-01-2026,Trasporto pubblico locale,ETNA TRASPORTI,Faisa Cisal,CATANIA,"dalle ore 00.00 alle ore 5.59, dalle ore 9.00 alle ore 13.29 e dalle ore 16.30 alle 23.59",https://www.cgsse.it/calendario-scioperi/dettaglio-sciopero/374106,false,2026-01-16,2026-01-16,2026-01-16,2026-01-16
Dal 09-01-2026 al 10-01-2026,"Scuola, Regioni e autonomie Locali",MIM,"Csle, Conalpe, Confsai",NAZIONALE,intere giornate,https://www.cgsse.it/calendario-scioperi/dettaglio-sciopero/374104,false,,2026-01-09,2026-01-10,2026-01-09
Dal 09-01-2026 al 10-01-2026,"Scuola, Regioni e autonomie Locali",MIM,Csle,NAZIONALE,intere giornate,https://www.cgsse.it/calendario-scioperi/dettaglio-sciopero/374104,false,,2026-01-09,2026-01-10,2026-01-09
Dal 09-01-2026 al 10-01-2026,"Scuola, Regioni e autonomie Locali",MIM,Csle,NAZIONALE,intere giornate,https://www.cgsse.it/calendario-scioperi/dettaglio-sciopero/374104,true,,2026-01-09,2026-01-10,2026-01-09
29-12-2025,Istituti di vigilanza,LA PATRIA,Filcams Cgil,BUSTO ARSIZIO,dalle ore 00.00 alle ore 23.59,https://www.cgsse.it/calendario-scioperi/dettaglio-sciopero/374097,false,2025-12-29,2025-12-29,2025-12-29,2025-12-29
29-12-2025,Istituti di vigilanza,LA PATRIA,Filcams Cgil,BUSTO ARSIZIO,dalle ore 00.00 alle ore 23.59,https://www.cgsse.it/calendario-scioperi/dettaglio-sciopero/374097,true,2025-12-29,2025-12-29,2025-12-29,2025-12-29
15-01-2026,Trasporto pubblico locale,GRUPPO ATM,Al Cobas,"MILANO , MONZA E DELLA BRIANZA","gruppo atm personale viaggiante di superficie, metropolitana, agenti di stazione, serv. poma 8.45 -15.00 e 18,00-fine servizio, net - urbano monza: 9.00 -11.50 e 14.50-fine servizio, extraurbano trezzo 8.45-15.00 e 18.00-fine servizio",https://www.cgsse.it/calendario-scioperi/dettaglio-sciopero/374072,false,2026-01-15,2026-01-15,2026-01-15,2026-01-15
Dal 31-12-2025 al 01-01-2026,"Trasporto aereo, Istituti di vigilanza, Servizio sanitario nazionale",ISTITUTI DI VIGILANZA PRIVATA E SERVIZI SICUREZZA,Cisal Sinalv,LOMBARDIA,dalle ore 15.00 del 31/1/2025 alle ore 15.00 del 1/1/2026,https://www.cgsse.it/calendario-scioperi/dettaglio-sciopero/374070,false,,2025-12-31,2026-01-01,2025-12-31
Dal 31-12-2025 al 01-01-2026,"Trasporto aereo, Istituti di vigilanza, Servizio sanitario nazionale",ISTITUTI DI VIGILANZA PRIVATA E SERVIZI SICUREZZA,Cisal Sinalv,LOMBARDIA,dalle ore 15.00 del 31/1/2025 alle ore 15.00 del 1/1/2026,https://www.cgsse.it/calendario-scioperi/dettaglio-sciopero/374070,true,,2025-12-31,2026-01-01,2025-12-31
Dal 31-12-2025 al 01-01-2026,"Trasporto aereo, Istituti di vigilanza, Servizio sanitario nazionale",ISTITUTI DI VIGILANZA PRIVATA E SERVIZI SICUREZZA,Cisal Sinalv,LOMBARDIA,dalle ore 15.00 del 31/12/2025 alle ore 15.00 del 1/01/2026,https://www.cgsse.it/calendario-scioperi/dettaglio-sciopero/374070,true,,2025-12-31,2026-01-01,2025-12-31
Dal 28-12-2025 al 27-01-2026,Istituti di vigilanza,FIDELITAS,"Filcams Cgil, Fisascat Cisl, Uiltucs Uil","ROMA, POMEZIA",blocco delle prestazioni straordinarie,https://www.cgsse.it/calendario-scioperi/dettaglio-sciopero/374017,false,,2025-12-28,2026-01-27,2025-12-28
29-12-2025,Istituti di vigilanza,FIDELITAS,"Filcams Cgil, Fisascat Cisl, Uiltucs Uil","ROMA, POMEZIA",interoturno,https://www.cgsse.it/calendario-scioperi/dettaglio-sciopero/374013,false,2025-12-29,2025-12-29,2025-12-29,2025-12-29
29-12-2025,Istituti di vigilanza,FIDELITAS,"Filcams Cgil, Fisascat Cisl, Uiltucs Uil","ROMA, POMEZIA",intero turno,https://www.cgsse.it/calendario-scioperi/dettaglio-sciopero/374013,false,2025-12-29,2025-12-29,2025-12-29,2025-12-29
Dal 14-01-2026 al 23-01-2026,Avvocati,SETTORE GIUSTIZIA,Camera Penale Salernitana,SALERNO,astensione dall'attività giudiziaria,https://www.cgsse.it/calendario-scioperi/dettaglio-sciopero/374009,false,,2026-01-14,2026-01-23,2026-01-14
Dal 14-01-2026 al 23-01-2026,Avvocati,SETTORE GIUSTIZIA,Camera Penale Salernitana,SALERNO,astensione dall'attività giudiziaria,https://www.cgsse.it/calendario-scioperi/dettaglio-sciopero/374009,true,,2026-01-14,2026-01-23,2026-01-14
13-01-2026,Taxi,SERVIZIO TAXI,"Fast Confsal, Satam, Tam, Usb Taxi, Unica Filt Cgil, Claai, Uritaxi, Uti, Unimpresa, Orsa Taxi, Ugl Taxi, Federtaxi Cisal, Sitan Atn, Unione Artigiani, Uiltrasporti, Sul, Ati Taxi, Atlt, Consultaxi",NAZIONALE,dalle 00:00 alle 24:00,https://www.cgsse.it/calendario-scioperi/dettaglio-sciopero/374007,false,2026-01-13,2026-01-13,2026-01-13,2026-01-13
13-01-2026,Taxi,SERVIZIO TAXI,"Fast Confsal, Satam, Tam, Usb Taxi, Unica Filt Cgil, Claai, Uritaxi, Uti, Unimpresa, Orsa Taxi, Ugl Taxi, Federtaxi Cisal, Sitan, Unione Artigiani, Uiltrasporti, Sul Taxi, Ati Taxi, Atlt, Consultaxi",NAZIONALE,dalle 00:00 alle 24:00,https://www.cgsse.it/calendario-scioperi/dettaglio-sciopero/374007,false,2026-01-13,2026-01-13,2026-01-13,2026-01-13
13-01-2026,Taxi,SERVIZIO TAXI,"Fast Confsal, Satam, Tam, Usb Taxi, Unica Filt Cgil, Claai, Uritaxi, Uti, Unimpresa, Orsa Taxi, Ugl Taxi, Federtaxi Cisal, Sitan, Unione Artigiani, Uiltrasporti, Sul Taxi, Ati Taxi, Atlt, Consultaxi",NAZIONALE,dalle 00:00 alle 24:00 con esclusione del bacino della regione umbria,https://www.cgsse.it/calendario-scioperi/dettaglio-sciopero/374007,false,2026-01-13,2026-01-13,2026-01-13,2026-01-13
16-01-2026,Regioni e autonomie Locali,PAOLO SCOPPIO AUTOLINEE,Faisa Cisal,ROMA,dalle ore 12:30 alle ore 16:30,https://www.cgsse.it/calendario-scioperi/dettaglio-sciopero/373987,false,2026-01-16,2026-01-16,2026-01-16,2026-01-16
16-01-2026,Regioni e autonomie Locali,PAOLO SCOPPIO AUTOLINEE,Faisa Cisal,ROMA,dalle ore 12:30 alle ore 16:30,https://www.cgsse.it/calendario-scioperi/dettaglio-sciopero/373987,true,2026-01-16,2026-01-16,2026-01-16,2026-01-16
19-12-2025,Trasporto pubblico locale,ATAC,"Usb Lavoro Privato, Orsa Tpl",ROMA,dalle ore 09:00 alle ore 13:00,https://www.cgsse.it/calendario-scioperi/dettaglio-sciopero/373985,false,2025-12-19,2025-12-19,2025-12-19,2025-12-19
12-01-2026,Scuola,MIM,Cobas Scuola,SAN SALVO,ultimi 30 minuti del turno,https://www.cgsse.it/calendario-scioperi/dettaglio-sciopero/373977,false,2026-01-12,2026-01-12,2026-01-12,2026-01-12
07-01-2026,Servizio sanitario nazionale,SANITASERVICE ASL BR,Uil Fpl,BRINDISI,,https://www.cgsse.it/calendario-scioperi/dettaglio-sciopero/373975,false,2026-01-07,2026-01-07,2026-01-07,2026-01-07
07-01-2026,Servizio sanitario nazionale,SANITASERVICE ASL BR,Uil Fpl,BRINDISI,,https://www.cgsse.it/calendario-scioperi/dettaglio-sciopero/373975,true,2026-01-07,2026-01-07,2026-01-07,2026-01-07
12-01-2026,Servizio sanitario nazionale,CONSORZIO UNISAN,Cub Sanità,ROMA,"dalle ore 13.00 alle ore 14.00 per il primo turno, dalle ore 14.00 alle ore 15.00 per il secondo turno",https://www.cgsse.it/calendario-scioperi/dettaglio-sciopero/373969,false,2026-01-12,2026-01-12,2026-01-12,2026-01-12
08-01-2026,Regioni e autonomie Locali,AMES,Fp Cgil,VENEZIA,intera giornata,https://www.cgsse.it/calendario-scioperi/dettaglio-sciopero/373964,false,2026-01-08,2026-01-08,2026-01-08,2026-01-08
08-01-2026,Regioni e autonomie Locali,AMES,Fp Cgil,VENEZIA,intera giornata,https://www.cgsse.it/calendario-scioperi/dettaglio-sciopero/373964,true,2026-01-08,2026-01-08,2026-01-08,2026-01-08
17-12-2025,Trasporto aereo,GDA HANDLING,Usb Lavoro Privato,BRESCIA,dalle ore 10:00 alle ore 22:00,https://www.cgsse.it/calendario-scioperi/dettaglio-sciopero/373962,false,2025-12-17,2025-12-17,2025-12-17,2025-12-17
08-01-2026,Trasporto pubblico locale,TUA,Orsa Trasporti,ABRUZZO,dalle ore 09:00 alle ore 13:00,https://www.cgsse.it/calendario-scioperi/dettaglio-sciopero/373958,false,2026-01-08,2026-01-08,2026-01-08,2026-01-08
09-01-2026,Trasporto aereo,SEA PRIME,Usb Lavoro Privato,MILANO,dalle ore 12.00 alle ore 16.00,https://www.cgsse.it/calendario-scioperi/dettaglio-sciopero/373956,false,2026-01-09,2026-01-09,2026-01-09,2026-01-09
Dal 09-01-2026 al 10-01-2026,Trasporto ferroviario,RFI,Cub Trasporti,NAZIONALE,dalle ore 21.00 del 9/1 alle ore 21.00 del 10/1,https://www.cgsse.it/calendario-scioperi/dettaglio-sciopero/373954,false,,2026-01-09,2026-01-10,2026-01-09
Dal 09-01-2026 al 10-01-2026,Trasporto ferroviario,RFI,Cub Trasporti,NAZIONALE,dalle ore 21.00 del 9/01 alle ore 21.00 del 10/01,https://www.cgsse.it/calendario-scioperi/dettaglio-sciopero/373954,false,,2026-01-09,2026-01-10,2026-01-09
29-12-2025,Istituti di vigilanza,AZIENDE DEL SETTORE,"Filcams Cgil, Uiltucs",TOSCANA,dalle ore 00.00 alle ore 23.59 escluso gli addetti ai servizi di controllo in ambito aeroportuale,https://www.cgsse.it/calendario-scioperi/dettaglio-sciopero/373952,false,2025-12-29,2025-12-29,2025-12-29,2025-12-29
29-12-2025,"Trasporto aereo, Istituti di vigilanza, Servizio sanitario nazionale",AZIENDE DEL SETTORE,"Filcams Cgil, Uiltucs",TOSCANA,dalle ore 00.00 alle ore 23.59 escluso gli addetti ai servizi di controllo in ambito aeroportuale,https://www.cgsse.it/calendario-scioperi/dettaglio-sciopero/373952,false,2025-12-29,2025-12-29,2025-12-29,2025-12-29
29-12-2025,"Trasporto aereo, Istituti di vigilanza, Servizio sanitario nazionale",AZIENDE DEL SETTORE,"Filcams Cgil, Uiltucs",TOSCANA,dalle ore 00.00 alle ore 23.59 escluso gli addetti ai servizi di controllo in ambito aeroportuale e sanitario,https://www.cgsse.it/calendario-scioperi/dettaglio-sciopero/373952,false,2025-12-29,2025-12-29,2025-12-29,2025-12-29
16-01-2026,Trasporto pubblico locale,AZIENDE DEL TRASPORTO PUBBLICO LOCALE,"Filt Cgil, Fit Cisl, Faisa Cisal",MOLISE,dalle ore 18.00 alle ore 23.00,https://www.cgsse.it/calendario-scioperi/dettaglio-sciopero/373949,false,2026-01-16,2026-01-16,2026-01-16,2026-01-16
24-12-2025,Istituti di vigilanza,SECURITY.IT,"Fisascat Cisl, Uiltucs",BARI,,https://www.cgsse.it/calendario-scioperi/dettaglio-sciopero/373922,false,2025-12-24,2025-12-24,2025-12-24,2025-12-24
24-12-2025,Istituti di vigilanza,SECURITY.IT,"Fisascat Cisl, Uiltucs",BARI,,https://www.cgsse.it/calendario-scioperi/dettaglio-sciopero/373922,true,2025-12-24,2025-12-24,2025-12-24,2025-12-24
24-12-2025,Istituti di vigilanza,SECURITY.IT,"Fisascat Cisl, Uiltucs",BARI,intera giornata,https://www.cgsse.it/calendario-scioperi/dettaglio-sciopero/373922,true,2025-12-24,2025-12-24,2025-12-24,2025-12-24
30-01-2026,Trasporto ferroviario,AZIENDE DEL SETTORE,"Filt Cgil, Fit Cisl, Uiltrasporti, Orsa",BOLOGNA,dalle ore 9.01 alle ore 16.59,https://www.cgsse.it/calendario-scioperi/dettaglio-sciopero/373902,false,2026-01-30,2026-01-30,2026-01-30,2026-01-30
30-01-2026,Trasporto ferroviario,AZIENDE DEL SETTORE,"Filt Cgil, Fit Cisl, Uiltrasporti, Orsa",BOLOGNA,dalle ore 9.01 alle ore 16.59,https://www.cgsse.it/calendario-scioperi/dettaglio-sciopero/373902,true,2026-01-30,2026-01-30,2026-01-30,2026-01-30
31-01-2026,Trasporto aereo,ENAV,"Fit Cisl, Ugl, Fast Confsal Av Unica, Uiltrasporti",VERONA,dalle ore 13:00 alle ore 17:00,https://www.cgsse.it/calendario-scioperi/dettaglio-sciopero/373891,false,2026-01-31,2026-01-31,2026-01-31,2026-01-31
08-01-2026,Trasporto pubblico locale,TUA,"Filt Cgil, Fit Cisl, Uiltrasporti, Faisa Cisal",TERAMO,dalle ore 9.00 alle ore 13.00,https://www.cgsse.it/calendario-scioperi/dettaglio-sciopero/373886,false,2026-01-08,2026-01-08,2026-01-08,2026-01-08
12-12-2025,Regioni e autonomie Locali,"COOPERATIVA SOCIALE ESSEQUADRO, OPUS SERVIZI SOC. COOP SOCIALE",Uiltucs,CAPRESE MICHELANGELO,intera giornata,https://www.cgsse.it/calendario-scioperi/dettaglio-sciopero/373880,false,2025-12-12,2025-12-12,2025-12-12,2025-12-12
23-01-2026,Trasporto ferroviario,TRENITALIA,Fit Cisl,TORRE DEL GRECO,dalle ore 9.00 alle ore 17.00,https://www.cgsse.it/calendario-scioperi/dettaglio-sciopero/373873,false,2026-01-23,2026-01-23,2026-01-23,2026-01-23
23-01-2026,Trasporto ferroviario,TRENITALIA,Fit Cisl,TORRE DEL GRECO,dalle ore 9.00 alle ore 17.00,https://www.cgsse.it/calendario-scioperi/dettaglio-sciopero/373873,true,2026-01-23,2026-01-23,2026-01-23,2026-01-23
Dal 14-01-2026 al 15-01-2026,Trasporto merci su rotaia,CAPTRAIN ITALIA,"Filt Cgil, Fit Cisl, Uiltrasporti",NAZIONALE,dalle ore 16.01 del 14/01 alle ore 16.00 del 15/01,https://www.cgsse.it/calendario-scioperi/dettaglio-sciopero/373834,false,,2026-01-14,2026-01-15,2026-01-14
09-12-2025,Trasporto pubblico locale,SASA,"Filt Cgil, Orsa Trasporti, Usb Lavoro Privato, Ugl",BOLZANO,dalle ore 16.00 alle ore 20.00,https://www.cgsse.it/calendario-scioperi/dettaglio-sciopero/373826,false,2025-12-09,2025-12-09,2025-12-09,2025-12-09
09-01-2026,Trasporto aereo,ASSOHANDLERS,Cub Trasporti,NAZIONALE,dalle ore 13.00 alle ore 17.00,https://www.cgsse.it/calendario-scioperi/dettaglio-sciopero/373821,false,2026-01-09,2026-01-09,2026-01-09,2026-01-09
12-01-2025,Igiene ambientale,RIECO,Usb Lavoro Privato,TOLFA,intero turno di lavoro,https://www.cgsse.it/calendario-scioperi/dettaglio-sciopero/373819,false,2025-01-12,2025-01-12,2025-01-12,2025-01-12
08-01-2026,Trasporto pubblico locale,SASA,"Filt Cgil, Orsa Trasporti, Usb Lavoro Privato",BOLZANO,dalle ore 16.00 alle ore 20.00,https://www.cgsse.it/calendario-scioperi/dettaglio-sciopero/373810,false,2026-01-08,2026-01-08,2026-01-08,2026-01-08
17-12-2025,Regioni e autonomie Locali,ER-GO,Sgb,BOLOGNA,intera giornata,https://www.cgsse.it/calendario-scioperi/dettaglio-sciopero/373806,false,2025-12-17,2025-12-17,2025-12-17,2025-12-17
17-12-2025,Regioni e autonomie Locali,ER-GO,Sgb,BOLOGNA,intera giornata,https://www.cgsse.it/calendario-scioperi/dettaglio-sciopero/373806,true,2025-12-17,2025-12-17,2025-12-17,2025-12-17
13-01-2026,Trasporto pubblico locale,BUSITALIA SITA NORD,Usb Lavoro Privato,UMBRIA,"perugia e spoleto fasce garantite dalle 6.00 alle 9.00 e dalle 12.00 alle 15.00, terni fasce garantite dalle 6.30 alle 9.30 e dalle 12.30 alle 15.30, servizi ferroviari fasce garantite dalle 5.45 alle 8.45 e dalle 11,45 alle ore 14.45",https://www.cgsse.it/calendario-scioperi/dettaglio-sciopero/373803,false,2026-01-13,2026-01-13,2026-01-13,2026-01-13
01-03-2026,Regioni e autonomie Locali,COMUNE DI BOLOGNA,Sgb,BOLOGNA,intera giornata del personale del corpo di polizia locale,https://www.cgsse.it/calendario-scioperi/dettaglio-sciopero/373801,true,2026-03-01,2026-03-01,2026-03-01,2026-03-01
09-01-2026,Trasporto aereo,AIRPORT HANDLING,Cub Trasporti,"MILANO, VARESE",dalle ore 00.00 alle ore 23.59,https://www.cgsse.it/calendario-scioperi/dettaglio-sciopero/373799,false,2026-01-09,2026-01-09,2026-01-09,2026-01-09
08-01-2026,Trasporto aereo,AIREST RETAIL,Usb Lavoro Privato,"TREVISO, VENEZIA",dalle ore 11.30 alle ore 15.30,https://www.cgsse.it/calendario-scioperi/dettaglio-sciopero/373787,false,2026-01-08,2026-01-08,2026-01-08,2026-01-08
Dal 03-12-2025 al 10-12-2025,Metalmeccanici,ACCIAIERIE D'ITALIA,Ugl Metalmeccanici,TARANTO,sciopero ad oltranza,https://www.cgsse.it/calendario-scioperi/dettaglio-sciopero/373783,false,,2025-12-03,2025-12-10,2025-12-03
Dal 03-12-2025 al 10-12-2025,Metalmeccanici,ACCIAIERIE D'ITALIA,Ugl Metalmeccanici,TARANTO,sciopero ad oltranza,https://www.cgsse.it/calendario-scioperi/dettaglio-sciopero/373783,true,,2025-12-03,2025-12-10,2025-12-03
17-12-2025,Trasporto aereo,EASYJET AIRLINE LIMITED,Usb Lavoro Privato,NAZIONALE,dalle ore 13:00 alle ore 17:00,https://www.cgsse.it/calendario-scioperi/dettaglio-sciopero/373775,false,2025-12-17,2025-12-17,2025-12-17,2025-12-17
