stato,inizio,fine,sindacati,settore,categoria,modalita,rilevanza,note,data_proclamazione,regione,provincia,data_ricezione,inizio_iso,fine_iso
Effettuato,17/12/2022,17/12/2022,OSP FILT-CGIL/FIT-CISL/UILT-UIL,Marittimo,PERSONALE MARITTIMO DELLA SOC. SDT (SINTERMAR DARSENA TOSCANA) DI LIVORNO,2 ORE PER TURNO,Locale,SCIOPERO DELLO STRAORDINARIO DALL'8/12,07/12/2022,Toscana,Livorno,07/12/2022 18:32,2022-12-17,2022-12-17
Effettuato,16/12/2022,16/12/2022,"FINO A 24 ORE: TPL 4 ORE VARIE MODALITA' - FERROVIARIO 8 ORE: DALLE 09.01 ALLE 17.00; MARITTIMO ISOLE MAGG. MEZZ'ORA PRIMA DELLE PARTENZE, NAVI TRAGHETTO 4 ORE; ANAS PRIME 4 ORE",Generale,SCIOPERO GENERALE SETTORI PUBBLICI E PRIVATI REGIONE LIGURIA,OSR CGIL/UIL,Regionale,null,02/12/2022,Liguria,Tutte,02/12/2022 17:24,2022-12-16,2022-12-16
Effettuato,16/12/2022,16/12/2022,OSP CGIL-AGB,Generale,SCIOPERO GENERALE SETTORI PUBBLICI E PRIVATI DELLA PROVINCIA DI BOLZANO,"INTERA GIORNATA: FERROVIARIO 8 ORE: DALLE 09.01 ALLE 16.59 - TPL: 4 ORE VARIE MODALITA' - TRASPORTO MERCI E LOGISTICA, TAXI, FUNIVIARIO: 24 ORE - AUTOSTRADE E TRAFORI: ULTIME 4 ORE TURNO",Provinciale,null,02/12/2022,Trentino-Alto Adige,Bolzano,02/12/2022 15:02,2022-12-16,2022-12-16
Effettuato,16/12/2022,16/12/2022,OSP FILT-CGIL/FIT-CISL/UILT-UIL/FAISA-CISAL,Trasporto pubblico locale,PERSONALE SOC. ARRIVA UDINE DI UDINE,4 ORE: DALLE 17.00 ALLE 21.00,Territoriale,null,01/12/2022,Friuli-Venezia Giulia,Udine,01/12/2022 13:18,2022-12-16,2022-12-16
Effettuato,16/12/2022,16/12/2022,OSR CGIL,Generale,SCIOPERO GENERALE SETTORI PUBBLICI E PRIVATI DELLA REGIONE FRIULI VENEZIA GIULIA,"FINO A 24 ORE: MARITTIMO: DALLE 08.00 ALLE 12.00 - APPALTI FERROVIARI, PORTI: ULTIME 4 ORE TURNO",Regionale,"ESCLUSO PERSONALE SETTORE TRASPORTO AEREO E SOCC. TRENITALIA, MERCITALIA RAIL, RFI, NTV-ITALO, FERROVIE UDINE CIVIDALE",02/12/2022,Friuli-Venezia Giulia,Tutte,02/12/2022 12:44,2022-12-16,2022-12-16
Effettuato,16/12/2022,16/12/2022,OSR CGIL,Generale,SCIOPERO GENERALE SETTORI PUBBLICI E PRIVATI  DELLA REGIONE CAMPANIA,INTERA GIORNATA; AZIENDE IMPRESE FERROVIARIE ED APPALTI ULTIME 4 ORE PER TURNO;TRASP. MERCI E LOGISTICA 4 ORE PER TURNO; TPL 4 ORE,Regionale,null,02/12/2022,Campania,Tutte,02/12/2022 15:39,2022-12-16,2022-12-16
Effettuato,16/12/2022,16/12/2022,OSR CGIL,Generale,SCIOPERO GENERALE SETTORI PUBBLICI E PRIVATI REGIONE MOLISE,"INTERA GIORNATA - TPL 4 ORE: 19.30-23.30; TAXI 24 ORE; MERCI E LOGISTICA 24 ORE; CIRC. E SICUREZZA STRADALE ULTME 4 ORE TURNO; ESCLUSI SETTORI FERROVIARIO, APPALTI FERROVIARI E TRASP. MERCI SU ROTAIA",Regionale,null,05/12/2022,Molise,Tutte,05/12/2022 12:55,2022-12-16,2022-12-16
Effettuato,16/12/2022,16/12/2022,OSR CGIL,Generale,SCIOPERO GENERALE SETTORI PUBBLICI E PRIVATI REGIONE SARDEGNA,INTERA GIORNATA; AEREO - SOGAER 4 ORE: 10-14,Regionale,ESCLUSIONE DELLA SOC. EASYJET,05/12/2022,Sardegna,Tutte,05/12/2022 18:47,2022-12-16,2022-12-16
Effettuato,16/12/2022,16/12/2022,OSR CGIL/UIL,Generale,SCIOPERO GENERALE SETTORI PUBBLICI E PRIVATI REGIONE EMILIA ROMAGNA,24 ORE; TPL 4 ORE VARIE MODALITA'; SETTORE FERROVIARIO 8 ORE: 9.01-16.59-APPALTI FS E ATTIVITA DI SUPPORTO SECONDA META' DEL TURNO; AUTOSTRADE PER L'ITALIA- D3 BOLOGNA ULTIME 4 ORE PER TURNO,Regionale,ESCLUSO SETTORE TRASPORTO AEREO,02/12/2022,Emilia-Romagna,Tutte,02/12/2022 15:10,2022-12-16,2022-12-16
Effettuato,16/12/2022,16/12/2022,OSR CGIL/UIL,Generale,SCIOPERO GENERALE SETTORI PUBBLICI E PRIVATI REGIONE TOSCANA,FINO A 24 ORE: TPL 4 ORE VARIE MODALITA' - TRASPORTO MERCI E LOGISTICA E CIRCOLAZIONE E SICUREZZA STRADALE: 8 ORE; APPALTI FERROVIARI 24 ORE; MARITTIMO 0-24 TRAGHETTI MERCI E DA CARICO RITARDI DI 24 ORE,Regionale,ESCLUSO SETTORE TRASPORTO AEREO,02/12/2022,Toscana,Tutte,02/12/2022 17:55,2022-12-16,2022-12-16
Effettuato,16/12/2022,16/12/2022,OSR CGIL/UIL,Generale,SCIOPERO GENERALE SETTORI PUBBLICI E PRIVATI REGIONE BASILICATA,INTERA GIORNATA - TPL: 4 ORE VARIE MODALITA'; TRASP. MERCI E LOGISTICA 4 ORE FINE TURNO,Regionale,null,02/12/2022,Basilicata,Tutte,03/12/2022 09:31,2022-12-16,2022-12-16
Effettuato,16/12/2022,16/12/2022,OSR CGIL/UIL,Generale,SCIOPERO GENERALE SETTORI PUBBLICI E PRIVATI REGIONE LOMBARDIA,"24 ORE: FERROVIARIO 9-13; TPL 4 ORE CON MODALITA' TERRITORIALI; NCC 9-13; TAXI 9-13; TRASP. MERCI SU ROTAIA 9-13; TRASP. MERCI E LOGISTICA 8 ORE; CIRC., SICUREZZA STRADALE, CONC. AUTOSTRADALI E ANAS ULTIME 4 ORE TURNO",Regionale,ESCUSE AZIENDE FERROVIARIE INTERREGIONALI ED IMPRESE SETTORE TRASPORTO AEREO,02/12/2022,Lombardia,Tutte,02/12/2022 22:54,2022-12-16,2022-12-16
Effettuato,16/12/2022,16/12/2022,OSR CGIL/UIL,Generale,SCIOPERO GENERALE SETTORI PUBBLICI E PRIVATI REGIONE LAZIO,"INTERA GIORNATA - TPL 4 ORE: 20.00-24.00; FERROVIARIO E TRASP. MERCI ROTAIA 8 ORE: 9.01-16.59; APP. FERROVIARI 24 ORE; TRASP MERCI E LOG.CA INTERO TURNO; CIRC. E SIC. STRADALE 24 ORE; MARITTIMO: IS. MAGG. RITARDO 30 MIN. PARTENZA, IS. MIN. INTERO PREST.",Regionale,ESCLUSO PERSONALE TRASPORTO AEREO E ACI INFOMOBILITY,05/12/2022,Lazio,Tutte,05/12/2022 12:39,2022-12-16,2022-12-16
Effettuato,16/12/2022,16/12/2022,OSR FILT-CGIL,Ferroviario,PERSONALE SOC. TRENITALIA DISTRIBUZIONI ED EQUIPAGGI MOBILI DIVISIONE REGIONALE LIGURIA,8 ORE: DALLE 9.01 ALLE 17.00,Regionale,null,30/11/2022,Liguria,Tutte,30/11/2022 15:13,2022-12-16,2022-12-16
Effettuato,16/12/2022,16/12/2022,OSR FILT-CGIL/FIT-CISL/UILT-UIL/UGL FERROVIE/FAST MOBILITA'/ORSA,Ferroviario,PERSONALE SOC. MERCITALIA RAIL REGIONE CAMPANIA,8 ORE: DALLE 9.01 ALLE 16.59,Regionale,null,22/11/2022,Campania,Tutte,22/11/2022 15:58,2022-12-16,2022-12-16
"Revocato (include le azioni di revoca, sospensione e differimento)",16/12/2022,16/12/2022,OSR FILT-CGIL/FIT-CISL/UILT-UIL/UGL FERROVIERI/SMA-FAST-CONFSAL/ORSA FERROVIE,Ferroviario,PERSONALE SOC. RFI DOIT ROMA,8 ORE: DALLE 9.01 ALLE 16.59,Regionale,null,21/11/2022,Lazio,Tutte,25/11/2022 12:44,2022-12-16,2022-12-16
Effettuato,16/12/2022,16/12/2022,OSR FILT-CGIL/UILT-UIL/UGL FERROVIERI/ORSA,Ferroviario,PERSONALE SOC. TRENITALIA DT E OMC OSMANNORO DELLA REGIONE TOSCANA,8 ORE: DALLE 9.01 ALLE 16.59,Regionale,null,02/11/2022,Toscana,Tutte,02/11/2022 14:02,2022-12-16,2022-12-16
"Revocato (include le azioni di revoca, sospensione e differimento)",16/12/2022,16/12/2022,OSR FIT-CISL,Ferroviario,"PERSONALE SOC. TRENITALIA UFFICI DIREZIONE TECNICA  LAVAGNINI DI FIRENZE, OMC E IMC DI OSMANNORO ( FI )",8 ORE: DALLE 9.01 ALLE 16.59,Regionale,null,02/11/2022,Toscana,Tutte,03/11/2022 10:29,2022-12-16,2022-12-16
"Revocato (include le azioni di revoca, sospensione e differimento)",16/12/2022,16/12/2022,OSR SLM FAST-CONFSAL,Ferroviario,"PERSONALE SOC. TRENITALIA UFFICI DIREZIONE TECNICA PLESSO LAVAGNINI DI FIRENZE, OMC E IMC DI OSMANNORO ( FI )",8 ORE: DALLE 9.01 ALLE 16.59,Regionale,null,02/11/2022,Toscana,Tutte,02/11/2022 16:14,2022-12-16,2022-12-16
Effettuato,16/12/2022,16/12/2022,OSR UILT-UIL,Ferroviario,PERSONALE SOC. TRENITALIA DISTRIBUZIONI ED EQUIPAGGI MOBILI DIVISIONE REGIONALE LIGURIA,8 ORE: DALLE 9.01 ALLE 17.00,Regionale,null,02/12/2022,Liguria,Tutte,02/12/2022 14:11,2022-12-16,2022-12-16
Effettuato,16/12/2022,16/12/2022,OSR UILT-UIL,Ferroviario,PERSONALE MOBILE SOC. ITALO-NTV DISTRETTO DI MILANO,8 ORE: DALLE 9.01 ALLE 16.59,Nazionale,null,03/12/2022,Italia,Tutte,03/12/2022 09:07,2022-12-16,2022-12-16
Effettuato,16/12/2022,16/12/2022,OSR USB LAVORO PRIVATO + RSU,Ferroviario,PERSONALE MANUTENZIONE INFRASTRUTTURE SOC. RFI DOIT ROMA,INTERA PRESTAZIONE,Regionale,null,25/11/2022,Lazio,Tutte,25/11/2022 14:19,2022-12-16,2022-12-16
Effettuato,16/12/2022,16/12/2022,USB LAVORO PRIVATO,Circolazione e sicurezza stradale,PERSONALE SOC. ACI INFOMOBILITY,INTERO TURNO,Nazionale,null,02/12/2022,Italia,Tutte,02/12/2022 16:49,2022-12-16,2022-12-16
Effettuato,16/12/2022,16/12/2022,USB LAVORO PRIVATO,Marittimo,SCIOPERO NAZIONALE SETTORE PORTUALE,24 ORE,Nazionale,null,15/12/2022,Italia,Tutte,15/12/2022 15:32,2022-12-16,2022-12-16
Effettuato,15/12/2022,15/12/2022,OSR CGIL,Generale,SCIOPERO GENERALE SETTORI PUBBLICI E PRIVATI REGIONE ABRUZZO,"INTERA GIORNATA - TPL 4 ORE: 19.30-23.30; TAXI 24 ORE; MERCI E LOGISTICA 24 ORE; CIRC. E SICUREZZA STRADALE ULTME 4 ORE TURNO; ESCLUSI SETTORI AEREO, FERROVIARIO, APPALTI FERROVIARI E TRASP. MERCI SU ROTAIA",Regionale,null,03/12/2022,Abruzzo,Tutte,03/12/2022 12:18,2022-12-15,2022-12-15
Effettuato,15/12/2022,15/12/2022,OSR CGIL/UIL,Generale,SCIOPERO GENERALE SETTORI PUBBLICI E PRIVATI DELLA REGIONE MARCHE,FINO A 24 ORE: TPL 4 ORE: DALLE 11.30 ALLE 15.30 - MARITTIMO E PORTI 4 ORE,Regionale,ESCLUSO PERSONALE SOC. TRENITALIA,02/12/2022,Marche,Tutte,02/12/2022 15:59,2022-12-15,2022-12-15
Effettuato,15/12/2022,15/12/2022,OSR CGIL/UIL,Generale,SCIOPERO GENERALE SETTORI PUBBLICI E PRIVATI REGIONE PIEMONTE,"FINO A 24 ORE: TPL, ANAS, AUTOSTRADE, TRASPORTO MERCI: 4 ORE;  FERROVIARIO: APPALTI 9.01-13.01, GRUPPO FSI 14.00-17.59",Regionale,null,02/12/2022,Piemonte,Tutte,02/12/2022 18:33,2022-12-15,2022-12-15
"Revocato (include le azioni di revoca, sospensione e differimento)",15/12/2022,16/12/2022,OSR FILT-CGIL/FIT-CISL/UGL FERROVIERI/ORSA TRASPORTI,Ferroviario,"PERSONALE SOC. TRENITALIA SETTORI DBR, DIREZIONE BUSINESS AV, DB-IC DELLA CALABRIA",24 ORE: DALLE 21.01 DEL 15/12 ALLE 21.00 DEL 16/12,Regionale,null,16/11/2022,Calabria,Tutte,16/11/2022 09:05,2022-12-15,2022-12-16
Effettuato,15/12/2022,16/12/2022,OSR FIT-CISL/UILT-UIL/UGL/FAST/ORSA TRASPORTI,Ferroviario,PERSONALE SOC. MERCITALIA RAIL REGIONE CALABRIA,24 ORE: DALLE 21.01 DEL 15/12 ALLE 21.00 DEL  16/12,Regionale,null,21/11/2022,Calabria,Tutte,21/11/2022 11:05,2022-12-15,2022-12-16
"Revocato (include le azioni di revoca, sospensione e differimento)",15/12/2022,15/12/2022,USB LAVORO PRIVATO,Circolazione e sicurezza stradale,PERSONALE SOC. ACI INFOMOBILITY,INTERO TURNO,Nazionale,null,30/11/2022,Italia,Tutte,30/11/2022 14:38,2022-12-15,2022-12-15
Effettuato,14/12/2022,14/12/2022,OSP CGIL,Generale,SCIOPERO GENERALE SETTORI PUBBLICI E PRIVATI DELLA PROVINCIA DI TRENTO,INTERA GIORNATA - FERROVIARIO 4 ORE: 9.01-12.59,Provinciale,null,02/12/2022,Trentino-Alto Adige,Trento,02/12/2022 09:36,2022-12-14,2022-12-14
Effettuato,14/12/2022,14/12/2022,OSR CGIL,Generale,SCIOPERO GENERALE SETTORI PUBBLICI E PRIVATI DELLA REGIONE VENETO,INTERA GIORNATA - TRASP. MERCI 4 ORE FINE TURNO,Regionale,null,02/12/2022,Veneto,Tutte,02/12/2022 15:42,2022-12-14,2022-12-14
Effettuato,14/12/2022,14/12/2022,OSR CGIL,Generale,SCIOPERO GENERALE SETTORI PUBBLICI E PRIVATI REGIONE PUGLIA,"FINO A 24 ORE: FERROVIARIO: DALLE 09.01 ALLE 16.59 - TPL 4 ORE VARIE MODALITA' - APPALTI FERROVIARI,TRASPORTO MERCI, MARITTIMO, PORTI: INTERO TURNO",Regionale,"ESCLUSO PERSONALE SOCC. EASYJET, ENAV",02/12/2022,Puglia,Tutte,02/12/2022 18:05,2022-12-14,2022-12-14
Effettuato,14/12/2022,14/12/2022,OSR CGIL/UIL,Generale,SCIOPERO GENERALE SETTORI PUBBLICI E PRIVATI DELLA REGIONE VALLE D'AOSTA,INTERA GIORNATA: AUTOSTRADE INTERO TURNO,Regionale,ADESIONE DELLE OO.SS. FILT CGIL E UILT-UIL,02/12/2022,Valle d'Aosta,Tutte,02/12/2022 10:11,2022-12-14,2022-12-14
Effettuato,14/12/2022,14/12/2022,OSR FILT-CGIL/FIT-CISL,Trasporto pubblico locale,PERSONALE SOC. AUTOLINEE ROCCO DI LAGONEGRO (PZ),4 ORE: DALLE 08.29 ALLE 12.29,Regionale,null,23/11/2022,Basilicata,Tutte,25/11/2022 15:21,2022-12-14,2022-12-14
"Revocato (include le azioni di revoca, sospensione e differimento)",13/12/2022,13/12/2022,FILT-CGIL/FIT-CISL/UILT-UIL,Aereo,PERSONALE SOC. ENAV,24 ORE,Nazionale,null,03/11/2022,Italia,Tutte,03/11/2022 15:37,2022-12-13,2022-12-13
Effettuato,13/12/2022,13/12/2022,OSP CUB TRASPORTI,Aereo,"PERSONALE SOCC. AGS, GH VERONA PRESSO AEROPORTO VALERIO CATULLO DI VERONA VILLAFRANCA",4 ORE: DALLE 14.00 ALLE 18.00,Locale,null,15/11/2022,Veneto,Verona,16/11/2022 09:39,2022-12-13,2022-12-13
Effettuato,13/12/2022,13/12/2022,OSR CGIL/UIL,Generale,SCIOPERO GENERALE SETTORI PUBBLICI E PRIVATI REGIONE UMBRIA,FINO A 24 ORE: FERROVIARIO 8 ORE: DALLE 09.01 ALLE 16.59 - SETTORE TRASPORTI ULTIME 4 ORE DEL TURNO,Regionale,null,01/12/2022,Umbria,Tutte,01/12/2022 17:15,2022-12-13,2022-12-13
Effettuato,13/12/2022,13/12/2022,OSR CGIL/UIL,Generale,SCIOPERO GENERALE SETTORI PUBBLICI E PRIVATI REGIONE SICILIA,"4 ORE: FERROVIARIO, MARITTIMO: DALLE 09.00 ALLE 13.00 - TPL 4 ORE VARIE MODALITA'",Regionale,null,02/12/2022,Sicilia,Tutte,02/12/2022 15:15,2022-12-13,2022-12-13
"Revocato (include le azioni di revoca, sospensione e differimento)",13/12/2022,13/12/2022,OSR FILT-CGIL/FIT-CISL/UILT-UIL,Ferroviario,PERSONALE EQUIPAGGI SOC. TRENITALIA DBR PASSEGGERI REGIONALE FRIULI VENEZIA GIULIA,8 ORE: DALLE 9.01 ALLE 17.00,Regionale,null,28/11/2022,Friuli-Venezia Giulia,Tutte,28/11/2022 15:53,2022-12-13,2022-12-13
"Revocato (include le azioni di revoca, sospensione e differimento)",13/12/2022,13/12/2022,OSR FILT-CGIL/FIT-CISL/UILT-UIL/FAST,Ferroviario,PERSONALE SOC. TRENITALIA DBR PASSEGGERI REGIONALE SETTORE MANUTENZIONE/PULIZIE FRIULI VENEZIA GIULIA,8 ORE: DALLE 9.01 ALLE 17.00,Regionale,null,16/11/2022,Friuli-Venezia Giulia,Tutte,16/11/2022 11:40,2022-12-13,2022-12-13
Effettuato,13/12/2022,13/12/2022,OSR ORSA TRASPORTI,Ferroviario,PERSONALE MOBILE SOC. TRENITALIA DBR REGIONE MARCHE,1 ORA: DALLE 01.00 ALLE 02.00,Regionale,null,12/11/2022,Marche,Tutte,12/11/2022 19:10,2022-12-13,2022-12-13
"Revocato (include le azioni di revoca, sospensione e differimento)",13/12/2022,13/12/2022,OST FILT-CGIL/UILT-UIL/FAISA-CISAL/UGL TPL/ORSA,Trasporto pubblico locale,PERSONALE SOC. ATM DI MESSINA,4 ORE: DALLE 15.31 ALLE 19.30,Locale,null,23/11/2022,Sicilia,Messina,23/11/2022 12:05,2022-12-13,2022-12-13
Effettuato,13/12/2022,13/12/2022,UILT-UIL,Aereo,PERSONALE SOC. EASYJET,4 ORE: DALLE 12.00 ALLE 16.00,Nazionale,null,28/11/2022,Italia,Tutte,28/11/2022 10:32,2022-12-13,2022-12-13
Effettuato,12/12/2022,12/12/2022,CGIL/UIL,Generale,SCIOPERO GENERALE CATEGORIE PUBBLICHE E PRIVATE DELLA REGIONE CALABRIA,INTERA GIORNATA - TPL 4 ORE: DALLE 9.00 ALLE 13.00,Regionale,null,01/12/2022,Calabria,Tutte,01/12/2022 21:16,2022-12-12,2022-12-12
"Revocato (include le azioni di revoca, sospensione e differimento)",12/12/2022,12/12/2022,OSP FILT-CGIL/FIT-CISL/UILT-UIL/UGL AUTOFERRO,Trasporto pubblico locale,PERSONALE SOC. TROTTA BUS SERVICE DI BENEVENTO,4 ORE: DALLE 9.00 ALLE 13.00,Locale,null,29/10/2022,Campania,Benevento,29/10/2022 13:51,2022-12-12,2022-12-12
"Revocato (include le azioni di revoca, sospensione e differimento)",12/12/2022,13/12/2022,OSR FILT-CGIL/FIT-CISL/UILT-UIL/ORSA/FAST,Ferroviario,PERSONALE SOC. MERCITALIA RAIL REGIONE FRIULI VENEZIA GIULIA,24 ORE: DALLE 21.00 DEL 12/12 ALLE 21.00 DEL 13/12,Regionale,null,28/11/2022,Friuli-Venezia Giulia,Tutte,29/11/2022 10:06,2022-12-12,2022-12-13
"Revocato (include le azioni di revoca, sospensione e differimento)",11/12/2022,12/12/2022,OSR SLM-FAST-CONFSAL,Ferroviario,PERSONALE MOBILE SOC. TRENITALIA TPER REGIONE EMILIA ROMAGNA,23 ORE: DALLE 3.31 DEL 11/12 ALLE 2.30 DEL 12/12,Regionale,null,04/11/2022,Emilia-Romagna,Tutte,04/11/2022 15:25,2022-12-11,2022-12-12
"Revocato (include le azioni di revoca, sospensione e differimento)",11/12/2022,12/12/2022,RSA FAISA-CISAL,Ferroviario,PERSONALE MOBILE SOC. TRENITALIA TPER REGIONE EMILIA ROMAGNA,23 ORE: DALLE 3.31 DELL'11/12 ALLE 2.30 DEL 12/12,Regionale,null,11/11/2022,Emilia-Romagna,Tutte,11/11/2022 15:55,2022-12-11,2022-12-12
"Revocato (include le azioni di revoca, sospensione e differimento)",10/12/2022,10/12/2022,USB LAVORO PRIVATO,Circolazione e sicurezza stradale,PERSONALE SOC. ACI INFOMOBILITY,INTERO TURNO,Nazionale,null,29/11/2022,Italia,Tutte,29/11/2022 11:44,2022-12-10,2022-12-10
"Revocato (include le azioni di revoca, sospensione e differimento)",09/12/2022,09/12/2022,OSP COBAS LAVORO PRIVATO,Trasporto pubblico locale,PERSONALE SOC. ATC ESERCIZIO DI LA SPEZIA,24 ORE,Provinciale,null,15/11/2022,Liguria,La Spezia,16/11/2022 14:06,2022-12-09,2022-12-09
Effettuato,09/12/2022,09/12/2022,OSR FILT-CGIL/FAISA-CISAL,Trasporto pubblico locale,PERSONALE AZIENDE TPL DELLA REGIONE UMBRIA,24 ORE,Regionale,null,10/11/2022,Umbria,Tutte,10/11/2022 08:52,2022-12-09,2022-12-09
"Revocato (include le azioni di revoca, sospensione e differimento)",09/12/2022,09/12/2022,OSR FILT-CGIL/FIT-CISL/UILT-UIL/UGL FERROVIE/FAST MOBILITA'/ORS,Ferroviario,PERSONALE SOC. MERCITALIA RAIL REGIONE CAMPANIA,8 ORE: DALLE 9.01 ALLE 16.59,Regionale,null,15/11/2022,Campania,Tutte,15/11/2022 15:46,2022-12-09,2022-12-09
"Revocato (include le azioni di revoca, sospensione e differimento)",08/12/2022,08/12/2022,FILT-CGIL/UILT-UIL,Aereo,PERSONALE SOC. VUELING,24 ORE,Nazionale,null,16/11/2022,Italia,Tutte,16/11/2022 12:43,2022-12-08,2022-12-08
"Revocato (include le azioni di revoca, sospensione e differimento)",06/12/2022,06/12/2022,OSP FAISA-CISAL,Trasporto pubblico locale,"PERSONALE SOC. STAR MOBILITY AREE DI LODI, CREMONA, PAVIA",4 ORE: VARIE MODALITA',Territoriale,null,21/11/2022,Lombardia,Lodi,21/11/2022 10:50,2022-12-06,2022-12-06
Effettuato,03/12/2022,02/12/2022,OSP FAISA-CISAL,Aereo,PERSONALE SOC. CSC MOBILITA' DI LATINA,24 ORE,Locale,null,28/10/2022,Lazio,Latina,28/10/2022 14:32,2022-12-03,2022-12-02
Effettuato,02/12/2022,02/12/2022,ADL VARESE/CIB-UNICOBAS/COBAS SARDEGNA/CONF. COBAS/CUB/SGB/SI-COBAS/USB/USI-CIT,Generale,SCIOPERO GENERALE DEI SETTORI PRIVATI E PUBBLICI,"INTERA GIORNATA: AEREO 00.01-24.00; FERROV. DA 21.00 DEL 1/12 A 21.00 DEL 2/12; TPL 24 ORE CON MODALITA' TERRITORIALI; MARITTIMO ISOLE MAGGIORI 24 ORE DA 1 ORA PRIMA PARTENZA, ISOLE MINORI 00.01-24.00; AUTOSTRADE DA 22.00 DEL 1/12 A 22.00 DEL 2/12; TAXI 2",Nazionale,"ADESIONE OO.SS. ORSA, CUB TRASPORTI, SGB, SBM, COBAS LAVORO PRIVATO, USB LAVORO PRIVATO, SLS, SIAL COBAS",24/09/2022,Italia,Tutte,24/09/2022 07:37,2022-12-02,2022-12-02
Effettuato,02/12/2022,02/12/2022,CMC,Ferroviario,PERSONALE DI MACCHINA SOC. MERCITALIA RAIL,8 ORE: DALLE 09.01 ALLE 17.00,Nazionale,null,21/11/2022,Italia,Tutte,21/11/2022 17:57,2022-12-02,2022-12-02
Effettuato,02/12/2022,02/12/2022,CUB TRASPORTI,Ferroviario,PERSONALE AZIENDE COMPARTO FERROVIARIO,8 ORE: DALLE 09.00 ALLE 17.00,Nazionale,null,21/11/2022,Italia,Tutte,21/11/2022 16:54,2022-12-02,2022-12-02
Effettuato,02/12/2022,02/12/2022,FILT-CGIL/UILT-UIL,Aereo,PERSONALE SOC. VUELING,24 ORE,Nazionale,null,16/11/2022,Italia,Tutte,16/11/2022 14:17,2022-12-02,2022-12-02
Effettuato,02/12/2022,02/12/2022,FLAI TRASPORTI E SERVIZI,Aereo,LAVORATORI IMPRESE SERVIZI AEROPORTUALI DI HANDLING,24 ORE: DALLE 00.01 ALLE 23.59,Nazionale,null,31/10/2022,Italia,Tutte,02/11/2022 07:25,2022-12-02,2022-12-02
Effettuato,02/12/2022,02/12/2022,OSP COBAS LAVORO PRIVATO,Trasporto pubblico locale,PERSONALE SOC. ATC ESERCIZIO DI LA SPEZIA,24 ORE,Provinciale,null,22/11/2022,Liguria,La Spezia,22/11/2022 10:54,2022-12-02,2022-12-02
"Revocato (include le azioni di revoca, sospensione e differimento)",02/12/2022,02/12/2022,OSP FAISA-CISAL,Trasporto pubblico locale,PERSONALE SOC. COTRAL REGIONE LAZIO,24 ORE,Regionale,null,22/11/2022,Lazio,Tutte,22/11/2022 11:58,2022-12-02,2022-12-02
"Revocato (include le azioni di revoca, sospensione e differimento)",02/12/2022,02/12/2022,OSP FAISA-CISAL,Trasporto pubblico locale,PERSONALE GRUPPO ARRIVA OPERANTE PRESSO LA PROVINCIA DI TORINO,8 ORE: DALLE 08.01 ALLE 12.00 E DALLE 15.01 A FINE SERVIZIO,Locale,null,20/10/2022,Piemonte,Torino,20/10/2022 15:50,2022-12-02,2022-12-02
Effettuato,02/12/2022,02/12/2022,OSP FILT-CGIL/FIT-CISL/FAISA-CISAL/UGL-FNA,Trasporto pubblico locale,PERSONALE SOC. ATAP DI PORDENONE,4 ORE: DALLE 16.30 ALLE 20.30,Locale,null,17/11/2022,Friuli-Venezia Giulia,Pordenone,17/11/2022 18:41,2022-12-02,2022-12-02
Effettuato,02/12/2022,02/12/2022,OSP FILT-CGIL/FIT-CISL/UILT-UIL/FAISA-CISAL/SIAL-COBAS/UGL-FNA + RSU,Trasporto pubblico locale,PERSONALE SOC. TPL LINEA DI SAVONA,24 ORE,Locale,null,14/11/2022,Liguria,Savona,14/11/2022 14:54,2022-12-02,2022-12-02
"Revocato (include le azioni di revoca, sospensione e differimento)",02/12/2022,02/12/2022,OSP FILT-CGIL/FIT-CISL/UILT-UIL/UGL/CONFAIL,Trasporto pubblico locale,PERSONALE SOC. ATAF DI FOGGIA,4 ORE: DALLE 08.30 ALLE 12.30,Locale,null,11/11/2022,Puglia,Foggia,11/11/2022 12:50,2022-12-02,2022-12-02
Effettuato,02/12/2022,02/12/2022,OSP FILT-CGIL/UILT-UIL/UGL/FAISA-CISAL/USB LAVORO PRIVATO,Trasporto pubblico locale,PERSONALE SOC. TRIESTE TRASPORTI DI TRIESTE,4 ORE: DALLE 09.00 ALLE 13.00,Locale,null,21/11/2022,Friuli-Venezia Giulia,Trieste,21/11/2022 12:51,2022-12-02,2022-12-02
"Revocato (include le azioni di revoca, sospensione e differimento)",02/12/2022,02/12/2022,OSP ORSA AUTOFERRO TPL,Trasporto pubblico locale,PERSONALE SOC. AUTOGUIDOVIE DEPOSITO DI PAVIA,24 ORE,Locale,null,21/10/2022,Lombardia,Pavia,07/11/2022 12:39,2022-12-02,2022-12-02
Effettuato,02/12/2022,02/12/2022,OSP UGL AUTOFERRO,Trasporto pubblico locale,PERSONALE SOC. ARRIVA UDINE DI UDINE,24 ORE,Territoriale,null,31/10/2022,Friuli-Venezia Giulia,Udine,31/10/2022 11:44,2022-12-02,2022-12-02
Effettuato,02/12/2022,02/12/2022,OSR ALAS-FAST-CONFSAL,Trasporto pubblico locale,PERSONALE APPALTI PULIZIE E RIFORNIMENTO MEZZI DELLA SOC. CPS PRESSO LA SOC. AST DI SIRACUSA E MODICA,4 ORE: DALLE 8.00 ALLE 12.00,Locale,null,22/11/2022,Sicilia,Siracusa,22/11/2022 14:42,2022-12-02,2022-12-02
"Revocato (include le azioni di revoca, sospensione e differimento)",02/12/2022,02/12/2022,OSR FAISA-CONFAIL,Trasporto pubblico locale,PERSONALE SOC. EAV DI NAPOLI,24 ORE,Locale,null,15/11/2022,Campania,Napoli,15/11/2022 12:24,2022-12-02,2022-12-02
Effettuato,02/12/2022,02/12/2022,OSR ORSA AUTOFERRO TPL,Trasporto pubblico locale,"PERSONALE SOC. SETA BACINI DI MODENA, REGGIO EMILIA E PIACENZA",4 ORE: VARIE MODALITA',Provinciale,ASTENSIONE DAL LAVORO STRAORDINARIO DALL'1/12 AL 3/12,27/10/2022,Emilia-Romagna,Modena,27/10/2022 10:41,2022-12-02,2022-12-02
Effettuato,02/12/2022,02/12/2022,OSR UGL AUTOFERROTRANVIERI,Trasporto pubblico locale,PERSONALE SOC. CSC MOBILITA' DI LATINA,24 ORE,Locale,null,27/10/2022,Lazio,Latina,27/10/2022 11:50,2022-12-02,2022-12-02
Effettuato,02/12/2022,02/12/2022,OSR UILT-UIL,Trasporto pubblico locale,PERSONALE SOC. ANM DI NAPOLI LINEA 1 ( ESCLUSO PERSONALE MACCHINISTA ),8 ORE: DALLE 09.00 ALLE 17.00,Locale,null,08/11/2022,Campania,Napoli,08/11/2022 14:52,2022-12-02,2022-12-02
Effettuato,02/12/2022,02/12/2022,OSR UILT-UIL,Trasporto pubblico locale,PERSONALE SOC. EAV DI NAPOLI,24 ORE,Locale,ESCLUSO PERSONALE DI ISCHIA,17/11/2022,Campania,Napoli,17/11/2022 16:32,2022-12-02,2022-12-02
Effettuato,02/12/2022,02/12/2022,OSR USB LAVORO PRIVATO,Trasporto pubblico locale,PERSONALE SOC. BUSITALIA SITA NORD REGIONE UMBRIA,24 ORE,Regionale,null,11/11/2022,Umbria,Tutte,11/11/2022 15:35,2022-12-02,2022-12-02
Effettuato,02/12/2022,02/12/2022,OSR USB LAVORO PRIVATO,Trasporto pubblico locale,PERSONALE SOC. EAV DI NAPOLI,24 ORE,Locale,ESCLUSO PERSONALE DI ISCHIA,15/11/2022,Campania,Napoli,15/11/2022 11:10,2022-12-02,2022-12-02
Effettuato,02/12/2022,02/12/2022,OSR USB LAVORO PRIVATO,Trasporto pubblico locale,PERSONALE SOC. EAV DI NAPOLI,24 ORE,Locale,ESCLUSO PERSONALE DI ISCHIA,15/11/2022,Campania,Napoli,15/11/2022 11:27,2022-12-02,2022-12-02
Effettuato,02/12/2022,02/12/2022,OSR/OSP FAISA-CISAL,Trasporto pubblico locale,PERSONALE SOC. IAS SCURA DI CORIGLIANO-ROSSANO (CS),24 ORE,Locale,null,21/11/2022,Calabria,Cosenza,22/11/2022 09:28,2022-12-02,2022-12-02
Effettuato,02/12/2022,02/12/2022,OST FILT-CGIL/FIT-CISL,Aereo,PERSONALE HANDLING DELLA SOC. SWISSPORT ITALIA DI MILANO LINATE,24 ORE,Nazionale,null,14/11/2022,Italia,Tutte,14/11/2022 10:24,2022-12-02,2022-12-02
Effettuato,02/12/2022,02/12/2022,OST FILT-CGIL/FIT-CISL/UILT-UIL/FAISA-CISAL/UGL-AUTOFERRO,Trasporto pubblico locale,PERSONALE SOC. STP DI BARI,4 ORE: DALLE 8.30 ALLE 12.30,Locale,null,17/11/2022,Puglia,Bari,17/11/2022 17:10,2022-12-02,2022-12-02
"Revocato (include le azioni di revoca, sospensione e differimento)",02/12/2022,02/12/2022,OST FILT-CGIL/UILT-UIL/UGL AUTOFERRO/FAISA-CISAL/CISAS/CONFAIL/CILDI,Trasporto pubblico locale,PERSONALE SOC. AMTAB DI BARI,4 ORE: DALLE 8.30 ALLE 12.30,Locale,null,27/10/2022,Puglia,Bari,28/10/2022 02:57,2022-12-02,2022-12-02
"Revocato (include le azioni di revoca, sospensione e differimento)",02/12/2022,02/12/2022,RSU,Trasporto pubblico locale,PERSONALE SOC. GTT DI TORINO SETTORE VIAGGIANTE URBANO DEPOSITO NIZZA,4 ORE: DALLE 18.00 ALLE 22.00,Locale,null,14/10/2022,Piemonte,Torino,14/10/2022 15:45,2022-12-02,2022-12-02
Effettuato,02/12/2022,02/12/2022,SGC/AL-COBAS/LMO/SOA,Generale,SCIOPERO GENERALE DEI SETTORI PUBBLICI E PRIVATI,"INTERA GIORNATA: AEREOPORTULAE 00.01-23.59; FERROV. DA 21.00 DEL 1/12 A 21.00 DEL 2/12; TPL 24 ORE CON MODALITA' TERRITORIALI; MARITTIMO ISOLE MAGGIORI 24 ORE DA 1 ORA PRIMA PARTENZA, ISOLE MINORI 00.01-24.00; AUTOSTRADE DA 22.00 DEL 1/12 A 22.00 DEL 2/12",Nazionale,null,17/11/2022,Italia,Tutte,17/11/2022 18:17,2022-12-02,2022-12-02
Effettuato,02/12/2022,02/12/2022,USB LAVORO PRIVATO,Aereo,PERSONALE NAVIGANTE DI CABINA SOC. VUELING AIRLINES,24 ORE: DALLE 00.01 ALLE 23.59,Nazionale,null,17/11/2022,Italia,Tutte,17/11/2022 12:41,2022-12-02,2022-12-02
Effettuato,02/12/2022,02/12/2022,USI UNIONE SINDACALE ITALIANA,Generale,SCIOPERO GENERALE PERSONALE A TEMPO DETERMINATO  E INDETERMINATO CON CONTRATTI PRECARI E ATIPICI PER TUTTI I COMPARTI,INTERA GIORNATA,Nazionale,null,18/10/2022,Italia,Tutte,18/10/2022 12:20,2022-12-02,2022-12-02
"Revocato (include le azioni di revoca, sospensione e differimento)",26/11/2022,26/11/2022,OSP FAISA-CISAL,Trasporto pubblico locale,PERSONALE SOC. BUSITALIA VENETO DI PADOVA,24 ORE,Locale,null,07/11/2022,Veneto,Padova,08/11/2022 11:05,2022-11-26,2022-11-26
"Revocato (include le azioni di revoca, sospensione e differimento)",25/11/2022,25/11/2022,OSP FILT-CGIL/FIT-CISL/UILT-UIL/UGL/CONFAIL,Trasporto pubblico locale,PERSONALE SOC. ATAF DI FOGGIA,4 ORE: DALLE 08.30 ALLE 12.30,Locale,null,04/11/2022,Puglia,Foggia,04/11/2022 13:06,2022-11-25,2022-11-25
"Revocato (include le azioni di revoca, sospensione e differimento)",25/11/2022,25/11/2022,OSR CNAL TRASPORTI,Aereo,PERSONALE SOC. GESAC AEROPORTO NAPOLI CAPODICHINO,24 ORE: DALLE 00.01 ALLE 23.59,Interregionale,null,07/10/2022,Campania,Tutte,07/10/2022 15:42,2022-11-25,2022-11-25
"Revocato (include le azioni di revoca, sospensione e differimento)",22/11/2022,22/11/2022,CMC,Ferroviario,PERSONALE DI MACCHINA SOC. MERCITALIA RAIL,8 ORE: DALLE 09.01 ALLE 17.00,Nazionale,null,09/11/2022,Italia,Tutte,09/11/2022 10:07,2022-11-22,2022-11-22
"Revocato (include le azioni di revoca, sospensione e differimento)",22/11/2022,22/11/2022,OSP FAISA-CISAL,Trasporto pubblico locale,PERSONALE GRUPPO ARRIVA OPERANTE PRESSO LA PROVINCIA DI TORINO,8 ORE: DALLE 08.01 ALLE 12.00 E DALLE 15.01 ALLE 19.00,Locale,null,19/10/2022,Piemonte,Torino,19/10/2022 16:44,2022-11-22,2022-11-22
Effettuato,18/11/2022,18/11/2022,OSP ADL,Aereo,"PERSONALE SOCC. DUSSMANN SERVICE, SPD ADDETTO A PULIZIE AEROPORTO MILANO MALPENSA",5 ORE: DALLE 11.00 ALLE 16.00,Nazionale,null,03/11/2022,Italia,Tutte,03/11/2022 14:22,2022-11-18,2022-11-18
"Revocato (include le azioni di revoca, sospensione e differimento)",18/11/2022,18/11/2022,OSR FILT-CGIL/FIT-CISL/UILT-UIL/FAST,Ferroviario,PERSONALE SOC. TRENITALIA DBR PASSEGGERI REGIONALE SETTORE MANUTENZIONE/PULIZIE FRIULI VENEZIA GIULIA,8 ORE: DALLE 9.01 ALLE 17.00,Regionale,null,07/11/2022,Friuli-Venezia Giulia,Tutte,07/11/2022 17:19,2022-11-18,2022-11-18
"Revocato (include le azioni di revoca, sospensione e differimento)",17/11/2022,18/11/2022,CMC,Ferroviario,PERSONALE DI MACCHINA SOC. MERCITALIA RAIL,24 ORE: DALLE 21.00 DEL 17/11 ALLE 21.00 DEL 18/11,Nazionale,null,17/10/2022,Italia,Tutte,17/10/2022 08:18,2022-11-17,2022-11-18
"Revocato (include le azioni di revoca, sospensione e differimento)",17/11/2022,18/11/2022,CUB TRASPORTI/SGB FERROVIE,Ferroviario,PERSONALE SOC. MERCITALIA RAIL,24 ORE: DALLE 21.00 DEL 17/11 ALLE 21.00 DEL 18/11,Nazionale,null,05/11/2022,Italia,Tutte,05/11/2022 22:54,2022-11-17,2022-11-18
Effettuato,15/11/2022,16/11/2022,OSR FILT-CGIL/FIT-CISL/UILT-UIL/UGL/FAST-CONFSAL/ORSA FERROVIE,Ferroviario,PERSONALE SOC. TRENITALIA IMPIANTO MANUTENTIVO OMC ETR VICENZA,23 ORE: DALLE 02.00 DEL 15/11 ALLE 01.00 DEL 16/11,Locale,null,02/11/2022,Veneto,Vicenza,02/11/2022 21:10,2022-11-15,2022-11-16
"Revocato (include le azioni di revoca, sospensione e differimento)",13/11/2022,13/11/2022,OSR FILT-CGIL/FIT-CISL/UILT-UIL/ORSA FERROVIE,Ferroviario,PERSONALE SOC. TRENITALIA CSVD DB AV E DB IC EMILIA ROMAGNA,8 ORE: DALLE 9.01 ALLE 16.59,Regionale,null,10/10/2022,Emilia-Romagna,Tutte,10/10/2022 09:35,2022-11-13,2022-11-13
"Revocato (include le azioni di revoca, sospensione e differimento)",11/11/2022,11/11/2022,CIB-UNICOBAS/COBAS SARDEGNA,Generale,SCIOPERO GENERALE DEI SETTORI PRIVATI E PUBBLICI,INTERA GIORNATA; FERROVIARIO 24 ORE: DALLE 21.00 DEL 10/11 ALLE 21.00 DEL 11/11; AUTOSTRADE 24 ORE: DALLE 22.00 DEL 10/11 ALLE 22.00 DEL 11/11,Nazionale,null,15/07/2022,Italia,Tutte,15/07/2022 19:25,2022-11-11,2022-11-11
Effettuato,11/11/2022,11/11/2022,FILT-CGIL/UILT-UIL,Aereo,PERSONALE SOC. VUELING,24 ORE,Nazionale,ESCLUSI I VOLI DA E PER AEROPORTI DI BERGAMO ORIO AL SERIO E MILANO LINATE,27/10/2022,Italia,Tutte,27/10/2022 10:03,2022-11-11,2022-11-11
Effettuato,11/11/2022,11/11/2022,FLAI TRASPORTI E SERVIZI,Trasporto pubblico locale,PERSONALE SOC. AUTOLINEE VARESINE DI VARESE,4 ORE: DALLE 15.30 ALLE 19.30,Territoriale,null,26/10/2022,Lombardia,Varese,27/10/2022 09:11,2022-11-11,2022-11-11
Effettuato,11/11/2022,11/11/2022,OSP COBAS LAVORO PRIVATO,Trasporto pubblico locale,PERSONALE SOC. ATC ESERCIZIO DI LA SPEZIA,4 ORE: DALLE 11.00 ALLE 15.00,Provinciale,null,25/10/2022,Liguria,La Spezia,25/10/2022 12:58,2022-11-11,2022-11-11
Effettuato,11/11/2022,11/11/2022,OSR FAISA-CONFAIL,Trasporto pubblico locale,PERSONALE MANUTENZIONE E INFRASTRUTTURE SOC. EAV DI NAPOLI,4 ORE: DALLE 09.00 ALLE 13.00,Locale,null,15/10/2022,Campania,Napoli,15/10/2022 10:50,2022-11-11,2022-11-11
Effettuato,11/11/2022,11/11/2022,OSR FILT-CGIL/FIT-CISL/UILT-UIL/FAISA-CISAL,Trasporto pubblico locale,PERSONALE OPERATORE DI ESERCIZIO SOC.  FSE - FERROVIE SUD EST E S.A. PUGLIA,4 ORE: DALLE 17.00 ALLE 21.00,Locale,null,24/10/2022,Puglia,Bari,24/10/2022 20:31,2022-11-11,2022-11-11
Effettuato,11/11/2022,11/11/2022,OSR FILT-CGIL/FIT-CISL/UILT-UIL/ORSA/FAST,Ferroviario,PERSONALE SOC. MERCITALIA RAIL REGIONE FRIULI VENEZIA GIULIA,8 ORE: DALLE 9.01 ALLE 17.00,Regionale,null,24/10/2022,Friuli-Venezia Giulia,Tutte,24/10/2022 15:34,2022-11-11,2022-11-11
Effettuato,11/11/2022,11/11/2022,OSR FILT-CGIL/UILT-UIL,Trasporto pubblico locale,PERSONALE SOC. ATAC DI ROMA,4 ORE: DALLE 8.30 ALLE 12..30,Locale,null,13/10/2022,Lazio,Roma,13/10/2022 11:31,2022-11-11,2022-11-11
Effettuato,11/11/2022,11/11/2022,OSR ORSA TPL/USB LAVORO PRIVATO,Trasporto pubblico locale,PERSONALE SOC. EAV DI NAPOLI,4 ORE: DALLE 9.00 ALLE 13.00,Locale,null,25/10/2022,Campania,Napoli,25/10/2022 16:12,2022-11-11,2022-11-11
Effettuato,11/11/2022,11/11/2022,OSR UILT-UIL,Trasporto pubblico locale,PERSONALE SOC. EAV DI NAPOLI,4 ORE: DALLE 09.00 ALLE 13.00,Locale,null,28/10/2022,Campania,Napoli,28/10/2022 11:46,2022-11-11,2022-11-11
Effettuato,11/11/2022,11/11/2022,OSR USB LAVORO PRIVATO,Trasporto pubblico locale,PERSONALE SOC. EAV DI NAPOLI,4 ORE: DALLE 9.00 ALLE 13.00,Locale,null,28/10/2022,Campania,Napoli,28/10/2022 17:01,2022-11-11,2022-11-11
Effettuato,11/11/2022,11/11/2022,OST FILT-CGIL/FIT-CISL/FAISA-CISAL,Trasporto pubblico locale,PERSONALE SOC. AUTOGUIDOVIE BACINO DI PAVIA,24 ORE,Territoriale,null,21/09/2022,Lombardia,Pavia,21/09/2022 09:37,2022-11-11,2022-11-11
Effettuato,11/11/2022,11/11/2022,USB LAVORO PRIVATO,Trasporto pubblico locale,PERSONALE AZIENDE ADDETTO AL TRASPORTO PUBBLICO LOCALE,4 ORE VARIE MODALITA',Nazionale,ESCLUSE SOCC. TPL REG. UMBRIA E SOC. BUSITALIA VENETO DI PADOVA,12/10/2022,Italia,Tutte,12/10/2022 14:25,2022-11-11,2022-11-11
Effettuato,11/11/2022,11/11/2022,USB LAVORO PRIVATO,Aereo,PERSONALE NAVIGANTE DI CABINA SOC. VUELING AIRLINES,4 ORE: DALLE 14.00 ALLE 18.00,Nazionale,null,28/10/2022,Italia,Tutte,28/10/2022 14:58,2022-11-11,2022-11-11
Effettuato,10/11/2022,10/11/2022,OSP FILT-CGIL/FIT-CISL/UILT-UIL/FAISA-CISAL/SIAL-COBAS/UGL-FNA + RSU,Trasporto pubblico locale,PERSONALE SOC. TPL LINEA DI SAVONA,4 ORE: DALLE 10.15 ALLE 14.15,Locale,null,27/10/2022,Liguria,Savona,27/10/2022 12:57,2022-11-10,2022-11-10
"Revocato (include le azioni di revoca, sospensione e differimento)",10/11/2022,10/11/2022,OSP FILT-CGIL/FIT-CISL/UILT-UIL/UGL AUTOFERRO,Trasporto pubblico locale,PERSONALE SOC. TROTTA BUS SERVICE DI BENEVENTO,4 ORE: DALLE 9.00 ALLE 13.00,Locale,null,26/10/2022,Campania,Benevento,26/10/2022 14:03,2022-11-10,2022-11-10
Effettuato,10/11/2022,11/11/2022,OSR FILT-CGIL/FIT-CISL/UILT-UIL/ORSA,Ferroviario,"PERSONALE SOC. TRENITALIA DIVISIONE BUSINESS REGIONALE FRIULI VENEZIA GIULIA OPERANTE NEI SETTORI COMMERCIALE, STAFF, BIGLIETTERIE E COSTUMER CARE",24 ORE: DALLE 21.00 DEL 10/11 ALLE 21.00 DELL'11/11,Regionale,null,28/10/2022,Friuli-Venezia Giulia,Tutte,28/10/2022 16:24,2022-11-10,2022-11-11
"Revocato (include le azioni di revoca, sospensione e differimento)",08/11/2022,08/11/2022,FLAI TRASPORTI E SERVIZI,Trasporto pubblico locale,PERSONALE SOC. AUTOLINEE VARESINE DI VARESE,4 ORE: DALLE 15.30 ALLE 19.30,Territoriale,null,25/10/2022,Lombardia,Varese,25/10/2022 12:48,2022-11-08,2022-11-08
Effettuato,08/11/2022,08/11/2022,OST FILT-CGIL/FIT-CISL,Aereo,PERSONALE HANDLING DELLA SOC. SWISSPORT ITALIA DI MILANO LINATE,4 ORE: DALLE 10.30 ALLE 14.30,Nazionale,null,21/10/2022,Italia,Tutte,21/10/2022 14:55,2022-11-08,2022-11-08
"Revocato (include le azioni di revoca, sospensione e differimento)",07/11/2022,07/11/2022,OSP FAISA-CISAL,Trasporto pubblico locale,PERSONALE GRUPPO ARRIVA OPERANTE PRESSO LA PROVINCIA DI TORINO,8 ORE: DALLE 08.01 ALLE 12.00 E DALLE 15.01 ALLE 19.00,Locale,null,14/10/2022,Piemonte,Torino,14/10/2022 14:55,2022-11-07,2022-11-07
Effettuato,07/11/2022,08/11/2022,OSR FILT-CGIL/FIT-CISL/UGL FERROVIERI/ORSA TRASPORTI,Ferroviario,"PERSONALE SOC. TRENITALIA SETTORI DBR, DIREZIONE BUSINESS AV, DB-IC DELLA CALABRIA",24 ORE: DALLE 21.01 DEL 7/11 ALLE 21.00 DELL' 8/11,Regionale,null,22/09/2022,Calabria,Tutte,22/09/2022 15:12,2022-11-07,2022-11-08
Effettuato,07/11/2022,08/11/2022,OSR FILT-CGIL/FIT-CISL/UILT-UIL/UGL/FAST/ORSA FERROVIE,Ferroviario,PERSONALE SOC. MERCITALIA RAIL REGIONE CALABRIA,24 ORE: DALLE 21.01 DEL 7/11 ALLE 21.00 DELL' 8/11,Regionale,null,06/10/2022,Calabria,Tutte,06/10/2022 09:25,2022-11-07,2022-11-08
"Revocato (include le azioni di revoca, sospensione e differimento)",07/11/2022,08/11/2022,OSR UILT-UIL/SLM-FAST-CONFSAL,Ferroviario,"PERSONALE SOC. TRENITALIA SETTORI DBR, DIREZIONE BUSINESS AV, DB-IC DELLA CALABRIA",24 ORE: DALLE 21.01 DEL 7/11 ALLE 21.00 DELL' 8/11,Regionale,null,31/10/2022,Calabria,Tutte,03/11/2022 17:14,2022-11-07,2022-11-08
Effettuato,07/11/2022,07/11/2022,OST FILT-CGIL/FIT-CISL/UILT-UIL/UGL-TA + RSU,Aereo,PERSONALE SOC. BGY INTENATIONAL SERVICES AEROPORTO BERGAMO ORIO AL SERIO,24 ORE,Locale,null,05/10/2022,Lombardia,Bergamo,05/10/2022 11:21,2022-11-07,2022-11-07
Effettuato,29/10/2022,29/10/2022,OSP FAISA-CISAL,Trasporto pubblico locale,PERSONALE SOC. BUSITALIA VENETO DI PADOVA,24 ORE,Locale,null,11/10/2022,Veneto,Padova,11/10/2022 09:02,2022-10-29,2022-10-29
Effettuato,29/10/2022,29/10/2022,OSR FILT-CGIL/FAISA-CISAL,Trasporto pubblico locale,PERSONALE AZIENDE TPL DELLA REGIONE UMBRIA,24 ORE,Regionale,null,03/10/2022,Umbria,Tutte,04/10/2022 08:01,2022-10-29,2022-10-29
"Revocato (include le azioni di revoca, sospensione e differimento)",28/10/2022,28/10/2022,OSR FILT-CGIL/FIT-CISL/UILT-UIL,Appalti ferroviari,"PERSONALE SOC. DUSSMANN SERVICE LOTTI TRENITALIA AV, IC, DBR REGIONE MARCHE",8 ORE: DALLE 09.01 ALLE 17.00,Regionale,null,07/10/2022,Marche,Tutte,07/10/2022 19:38,2022-10-28,2022-10-28
Effettuato,21/10/2022,21/10/2022,ANPAC,Aereo,PILOTI DELLA COMPAGNIA AEREA SOC. EASYJET ITALIAN BRANCH,4 ORE: DALLE 11.00 ALLE 15.00,Nazionale,null,07/10/2022,Italia,Tutte,07/10/2022 17:09,2022-10-21,2022-10-21
"Revocato (include le azioni di revoca, sospensione e differimento)",21/10/2022,21/10/2022,CUB/SI-COBAS/USI-CIT/USB/ADL VARESE,Generale,SCIOPERO GENERALE DEI SETTORI PRIVATI E PUBBLICI,"INTERA GIORNATA: AEREO 00.01-24.00; FERROV. DA 21.00 DEL 20/10 A 21.00 DEL 21/10; TPL 24 ORE CON MODALITA' TERRITORIALI; MARITTIMO ISOLE MAGGIORI 24 ORE DA 1 ORA PRIMA PARTENZA, ISOLE MINORI 00.01-24.00; AUTOSTRADE DA 22.00 DEL 20/10 A 22.00 DEL 21/10",Nazionale,ADESIONE OS CUB TRASPORTI,15/07/2022,Italia,Tutte,15/07/2022 17:20,2022-10-21,2022-10-21
Effettuato,21/10/2022,21/10/2022,FILT-CGIL/FIT-CISL/UILT-UIL,Aereo,PERSONALE SOC. ENAV,24 ORE,Nazionale,null,31/08/2022,Italia,Tutte,31/08/2022 09:28,2022-10-21,2022-10-21
Effettuato,21/10/2022,21/10/2022,FILT-CGIL/UILT-UIL,Aereo,PERSONALE SOC. VUELING,24 ORE,Nazionale,null,07/10/2022,Italia,Tutte,07/10/2022 10:07,2022-10-21,2022-10-21
Effettuato,21/10/2022,21/10/2022,FLAI TRASPORTI E SERVIZI,Aereo,LAVORATORI IMPRESE SERVIZI AEROPORTUALI DI HANDLING,24 ORE: DALLE 00.01 ALLE 23.59,Nazionale,null,21/09/2022,Italia,Tutte,21/09/2022 10:26,2022-10-21,2022-10-21
Effettuato,21/10/2022,21/10/2022,OSP ADL,Aereo,"PERSONALE SOCC. DUSSMANN SERVICE, SPD ADDETTO A PULIZIE AEROPORTO MILANO MALPENSA",5 ORE: DALLE 11.00 ALLE 16.00,Nazionale,null,03/10/2022,Italia,Tutte,03/10/2022 10:09,2022-10-21,2022-10-21
Effettuato,21/10/2022,21/10/2022,OSP FAISA-CISAL,Trasporto pubblico locale,PERSONALE SOC. COTRAL REGIONE LAZIO,24 ORE,Regionale,null,20/09/2022,Lazio,Tutte,20/09/2022 13:48,2022-10-21,2022-10-21
Effettuato,21/10/2022,21/10/2022,OSP FAISA-CISAL,Trasporto pubblico locale,PERSONALE SOC. CSC MOBILITA' DI LATINA,4 ORE: DALLE 9.30 ALLE 13.30,Locale,null,10/10/2022,Lazio,Latina,10/10/2022 14:15,2022-10-21,2022-10-21
Effettuato,21/10/2022,21/10/2022,OSP USB LAVORO PRIVATO,Trasporto pubblico locale,"PERSONALE SOCC. COTRI, ROMA TPL E CONSORZIATE DI ROMA",4 ORE: DALLE 8.30 ALLE 12.30,Locale,null,11/10/2022,Lazio,Roma,11/10/2022 09:59,2022-10-21,2022-10-21
Effettuato,21/10/2022,21/10/2022,OSR FILT-CGIL/FIT-CISL/UILT-UIL/ORSA,Trasporto pubblico locale,"PERSONALE SOC. TRENITALIA DIVISIONE BUSINESS REGIONALE FRIULI VENEZIA GIULIA OPERANTE NEI SETTORI COMMERCIALE, STAFF, BIGLIETTERIE E COSTUMER CARE",8 ORE: DALLE 9.01 ALLE 17.00,Regionale,null,05/10/2022,Friuli-Venezia Giulia,Tutte,05/10/2022 11:14,2022-10-21,2022-10-21
"Revocato (include le azioni di revoca, sospensione e differimento)",21/10/2022,21/10/2022,OSR FILT-CGIL/FIT-CISL/UILT-UIL/UGL/FAST/ORSA FERROVIE,Ferroviario,"PERSONALE SOCC. TRENITALIA, RFI, FERSERVIZI, MERCITALIA RAIL REGIONE VENETO",8 ORE: DALLE 9.01 ALLE 16.59,Regionale,null,10/10/2022,Veneto,Tutte,10/10/2022 16:35,2022-10-21,2022-10-21
Effettuato,21/10/2022,21/10/2022,OSR FIT-CISL,Aereo,PERSONALE DI TERRA SERVIZI AEROPORTUALI DELLA SOC. SAVE DI VENEZIA,4 ORE: DALLE 14.00 ALLE 18.00,Interregionale,null,05/10/2022,Veneto,Venezia,05/10/2022 09:46,2022-10-21,2022-10-21
Effettuato,21/10/2022,21/10/2022,OSR UGL AUTOFERROTRANVIERI,Trasporto pubblico locale,PERSONALE SOC. CSC MOBILITA' DI LATINA,4 ORE: DALLE 09.30 ALLE 13.30,Locale,null,26/09/2022,Lazio,Latina,26/09/2022 11:11,2022-10-21,2022-10-21
Effettuato,21/10/2022,21/10/2022,OST UGL-TA,Aereo,PERSONALE SOC. ENAV APT BOLOGNA,12 ORE: DALLE 08.00 ALLE 20.00,Interregionale,null,25/08/2022,Emilia-Romagna,Tutte,25/08/2022 19:26,2022-10-21,2022-10-21
Effettuato,21/10/2022,21/10/2022,RSA FILT-CGIL/FIT-CISL,Aereo,PERSONALE SOC. ENAV ACC BRINDISI,8 ORE: DALLE 10.00 ALLE 18.00,Nazionale,null,29/08/2022,Italia,Tutte,29/08/2022 20:39,2022-10-21,2022-10-21
Effettuato,21/10/2022,21/10/2022,RSA FIT-CISL,Aereo,PERSONALE SOC. ENAV APT VENEZIA TESSERA,4 ORE: DALLE 13.00 ALLE 17.00,Interregionale,null,20/09/2022,Veneto,Venezia,20/09/2022 11:13,2022-10-21,2022-10-21
Effettuato,21/10/2022,21/10/2022,RSA FIT-CISL,Aereo,PERSONALE SOC. ENAV APT BRINDISI,4 ORE: DALLE 13.00 ALLE 17.00,Nazionale,null,20/09/2022,Italia,Tutte,20/09/2022 11:13,2022-10-21,2022-10-21
Effettuato,21/10/2022,21/10/2022,RSA UGL-TA,Aereo,PERSONALE SOC. ENAV APT PERUGIA,12 ORE: DALLE 08.00 ALLE 20.00,Locale,ESCLUSIONE DEI VOLI DA E PER AEROPORTO DI PESCARA,26/08/2022,Umbria,Perugia,26/08/2022 09:33,2022-10-21,2022-10-21
Effettuato,21/10/2022,21/10/2022,RSA UGL-TA,Aereo,"PERSONALE SOC. ENAV COMPARTO FPDIM SALE OPERATIVE ARO CBO ROMA, MILANO E NOF ITALIA",12 ORE: DALLE 08.00 ALLE 20.00,Nazionale,null,27/08/2022,Italia,Tutte,27/08/2022 10:48,2022-10-21,2022-10-21
Effettuato,21/10/2022,21/10/2022,RSA UGL-TA,Aereo,PERSONALE SOC. ENAV APT NAPOLI CAPODICHINO,12 ORE: DALLE 08.00 ALLE 20.00,Interregionale,null,29/08/2022,Italia,Tutte,29/08/2022 14:01,2022-10-21,2022-10-21
Effettuato,21/10/2022,21/10/2022,RSA UGL-TA,Aereo,PERSONALE SOC. ENAV APT BRINDISI,4 ORE: DALLE 13.00 ALLE 17.00,Nazionale,null,28/09/2022,Italia,Tutte,28/09/2022 09:25,2022-10-21,2022-10-21
Effettuato,21/10/2022,21/10/2022,RSA UGL-TA/UNICA,Aereo,PERSONALE SOC. ENAV APT VENEZIA TESSERA,4 ORE: DALLE 13.00 ALLE 17.00,Interregionale,null,29/08/2022,Veneto,Venezia,29/08/2022 16:43,2022-10-21,2022-10-21
Effettuato,21/10/2022,21/10/2022,RSA UGL-TA/UNICA,Aereo,PERSONALE SOC. ENAV APT MALPENSA,4 ORE: DALLE 13.00 ALLE 17.00,Nazionale,null,07/09/2022,Italia,Tutte,07/09/2022 20:39,2022-10-21,2022-10-21
Effettuato,21/10/2022,21/10/2022,RSA UGL-TA/UNICA,Aereo,PERSONALE SOC. ENAV APT DI ROMA CIAMPINO,12 ORE: DALLE 08.00 ALLE 20.00,Interregionale,null,13/09/2022,Lazio,Roma,13/09/2022 12:07,2022-10-21,2022-10-21
Effettuato,21/10/2022,21/10/2022,RSA UGL-TA/UNICA,Aereo,PERSONALE SOC. ENAV ACC BRINDISI,12 ORE: DALLE 08.00 ALLE 20.00,Nazionale,null,15/09/2022,Italia,Tutte,15/09/2022 11:02,2022-10-21,2022-10-21
Effettuato,21/10/2022,21/10/2022,RSA UGL-TA/UNICA,Aereo,PERSONALE SOC. ENAV APT BRESCIA,4 ORE: DALLE 13.00 ALLE 17.00,Locale,null,28/09/2022,Lombardia,Brescia,28/09/2022 18:09,2022-10-21,2022-10-21
Effettuato,21/10/2022,21/10/2022,RSA UILT-UIL,Aereo,PERSONALE SOC. ENAV ACC BRINDISI,24 ORE,Nazionale,null,30/08/2022,Italia,Tutte,30/08/2022 09:54,2022-10-21,2022-10-21
Effettuato,21/10/2022,21/10/2022,RSA UILT-UIL,Aereo,PERSONALE SOC. ENAV ACC BRINDISI,4 ORE: DALLE 13.00 ALLE 17.00,Nazionale,null,04/10/2022,Italia,Tutte,04/10/2022 14:26,2022-10-21,2022-10-21
Effettuato,21/10/2022,21/10/2022,RSA UILT-UIL/UGL-TA/UNICA,Aereo,PERSONALE SOC. ENAV APT DI TORINO CASELLE,12 ORE: DALLE 08.00 ALLE 20.00,Interregionale,ESCLUSIONE DEI VOLI DA E PER AEROPORTO DI PESCARA,25/08/2022,Piemonte,Tutte,25/08/2022 19:28,2022-10-21,2022-10-21
Effettuato,21/10/2022,21/10/2022,RSA UNICA,Aereo,PERSONALE SOC. ENAV C.A. DI PESCARA,12 ORE: DALLE 8.00 ALLE 20.00,Locale,null,10/08/2022,Abruzzo,Pescara,10/08/2022 10:55,2022-10-21,2022-10-21
Effettuato,21/10/2022,21/10/2022,RSA UNICA,Aereo,PERSONALE SOC. ENAV DEL C.A. DI BOLOGNA,12 ORE: DALLE 08.00 ALLE 20.00,Interregionale,null,15/09/2022,Italia,Tutte,15/09/2022 09:24,2022-10-21,2022-10-21
Effettuato,21/10/2022,21/10/2022,RSA UNICA,Aereo,PERSONALE SOC. ENAV ACC ROMA,12 ORE: DALLE 8.00 ALLE 20.00,Nazionale,SCIOPERO PRESTAZIONI STRAORDINARIE DALLE 00.01 DELL' 1/10 ALLE 24.00 DEL 29/10,15/09/2022,Italia,Tutte,15/09/2022 11:33,2022-10-21,2022-10-21
Effettuato,21/10/2022,21/10/2022,RSA UNICA,Aereo,PERSONALE SOC. ENAV C.A. DI BRINDISI,12 ORE: DALLE 08.00 ALLE 20.00,Nazionale,null,15/09/2022,Italia,Tutte,15/09/2022 18:08,2022-10-21,2022-10-21
Effettuato,21/10/2022,21/10/2022,RSA UNICA,Aereo,PERSONALE SOC. ENAV ACC PADOVA,12 ORE: DALLE 08.00 ALLE 20.00,Nazionale,null,15/09/2022,Italia,Tutte,15/09/2022 21:21,2022-10-21,2022-10-21
"Revocato (include le azioni di revoca, sospensione e differimento)",21/10/2022,21/10/2022,RSU,Aereo,"PERSONALE SOC. TECHNO SKY CA MILANO LINATE, ACC MILANO,  MONTE SETTEPANI",14 ORE: DALLE 07.00 ALLE 21.00,Nazionale,ASTENSIONE LAVORO STRAORDINARIO E REPERIBILITA' DAL 1/10 AL 30/10,30/08/2022,Italia,Tutte,30/08/2022 15:44,2022-10-21,2022-10-21
Effettuato,21/10/2022,21/10/2022,UGL-TA,Aereo,PERSONALE SOC. ENAV,12 ORE: DALLE 08.00 ALLE 20.00,Nazionale,null,06/09/2022,Italia,Tutte,06/09/2022 16:40,2022-10-21,2022-10-21
Effettuato,21/10/2022,21/10/2022,UILT-UIL,Aereo,PERSONALE SOC. EASYJET,24 ORE,Nazionale,null,06/10/2022,Italia,Tutte,06/10/2022 16:21,2022-10-21,2022-10-21
Effettuato,21/10/2022,21/10/2022,UNICA,Aereo,PERSONALE SOC. ENAV,12 ORE: DALLE 8.00 ALLE 20.00,Nazionale,null,08/08/2022,Italia,Tutte,08/08/2022 11:38,2022-10-21,2022-10-21
Effettuato,21/10/2022,21/10/2022,USB LAVORO PRIVATO,Aereo,PERSONALE DIPENDENTE AZIENDE TRASPORTO AEREO E INDOTTO,24 ORE: DALLE 00.00 ALLE 23.59,Nazionale,null,07/10/2022,Italia,Tutte,08/10/2022 18:00,2022-10-21,2022-10-21
Effettuato,20/10/2022,20/10/2022,OSP CGIL/CISL/UIL,Generale,SCIOPERO GENERALE CATEGORIE PUBBLICHE E PRIVATE CITTA' METROPOLITANA DI TORINO,4 ORE,Provinciale,ESCLUSO TRASPORTO PUBBLICO LOCALE,10/10/2022,Piemonte,Torino,10/10/2022 20:41,2022-10-20,2022-10-20
"Revocato (include le azioni di revoca, sospensione e differimento)",17/10/2022,17/10/2022,OSP FAISA-CISAL,Trasporto pubblico locale,PERSONALE SOC. COTRAL REGIONE LAZIO,24 ORE,Regionale,null,19/09/2022,Lazio,Tutte,19/09/2022 14:44,2022-10-17,2022-10-17
"Revocato (include le azioni di revoca, sospensione e differimento)",17/10/2022,17/10/2022,OST FILT-CGIL/FIT-CISL/UILT-UIL/UGL/FAISA-CISAL,Trasporto pubblico locale,"PERSONALE SOCC. ARRIVA ITALIA, BRESCIA TRASPORTI, METRO BRESCIA, BRESCIA MOBILITA'",8 ORE: DALLE 17.00 A FINE TURNO,Territoriale,null,12/10/2022,Lombardia,Brescia,12/10/2022 15:52,2022-10-17,2022-10-17
Effettuato,16/10/2022,17/10/2022,OSR SLM-FAST-CONFSAL,Ferroviario,PERSONALE MOBILE SOC. TRENITALIA TPER REGIONE EMILIA ROMAGNA,23 ORE: DALLE 3.31 DEL 16/10 ALLE 2.30 DEL 17/10,Regionale,null,30/09/2022,Emilia-Romagna,Tutte,30/09/2022 17:17,2022-10-16,2022-10-17
Effettuato,16/10/2022,17/10/2022,RSA FAISA-CISAL,Ferroviario,PERSONALE MOBILE SOC. TRENITALIA TPER REGIONE EMILIA ROMAGNA,23 ORE: DALLE 3.31 DEL 16/10 ALLE 2.30 DEL 17/10,Regionale,null,30/09/2022,Emilia-Romagna,Tutte,30/09/2022 18:36,2022-10-16,2022-10-17
"Revocato (include le azioni di revoca, sospensione e differimento)",12/10/2022,12/10/2022,OSR FILT-CGIL/UGL FERROVIERI,Appalti ferroviari,"PERSONALE APPALTI FERROVIARI DELLA SOC. COOPSERVICE DEI LOTTI GRANDI STAZIONI RAIL E RETAIL, RFI, MAGAZZINI, PRM E TRENITALIA DELLA REGIONE LIGURIA",SECONDA META' DI OGNI TURNO,Regionale,null,23/09/2022,Liguria,Tutte,23/09/2022 11:16,2022-10-12,2022-10-12
Effettuato,11/10/2022,11/10/2022,OSR UILT-UIL,Ferroviario,PERSONALE SOC. RFI OFFICINA NAZIONALE ARMAMENTO E FONDERIA ONAF DI BARI,8 ORE: DALLE 9.01 ALLE 17.00,Locale,null,23/09/2022,Puglia,Bari,30/09/2022 11:50,2022-10-11,2022-10-11
Effettuato,11/10/2022,11/10/2022,OST FILT-CGIL/FIT-CISL/UILT-UIL/UGL AUTOFERRO/FAISA-CISAL/ORSA TPL,Trasporto pubblico locale,PERSONALE GRUPPO ATM DI MILANO,INTERA GIORNATA,Locale,null,09/10/2022,Lombardia,Milano,09/10/2022 19:51,2022-10-11,2022-10-11
Effettuato,10/10/2022,10/10/2022,OSP COBAS LAVORO PRIVATO,Trasporto pubblico locale,PERSONALE SOC. AUTOLINEE TOSCANE,24 ORE VARIE MODALITA',Provinciale,null,03/08/2022,Toscana,Tutte,03/08/2022 10:36,2022-10-10,2022-10-10
Effettuato,10/10/2022,10/10/2022,OSP FILT-CGIL/FIT-CISL/UILT-UIL/UGL AUTOFERRO/FAISA-CISAL,Trasporto pubblico locale,PERSONALE SOC. AMTS DI CATANIA,24 ORE,Locale,ADESIONE DELLA O.S. ORSA,22/09/2022,Sicilia,Catania,22/09/2022 09:00,2022-10-10,2022-10-10
Effettuato,10/10/2022,10/10/2022,OSP ORSA AUTOFERRO TPL,Trasporto pubblico locale,PERSONALE SOC. EAV DI NAPOLI,4 ORE: DALLE 9.00 ALLE 13.00,Locale,null,29/09/2022,Campania,Napoli,29/09/2022 20:16,2022-10-10,2022-10-10
Effettuato,10/10/2022,10/10/2022,OSP ORSA AUTOFERRO TPL,Trasporto pubblico locale,PERSONALE SETTORE CIRCOLAZIONE DELLA SOC. EAV DI NAPOLI,4 ORE: DALLE 9.00 ALLE 13.00,Locale,null,29/09/2022,Campania,Napoli,29/09/2022 21:04,2022-10-10,2022-10-10
Effettuato,10/10/2022,10/10/2022,OSP ORSA TRASPORTI,Trasporto pubblico locale,PERSONALE SOC. EAV DI NAPOLI,4 ORE: DALLE 09.00 ALLE 13.00,Locale,null,28/09/2022,Campania,Napoli,28/09/2022 19:39,2022-10-10,2022-10-10
Effettuato,10/10/2022,10/10/2022,OSP SLM-FAST-CONFSAL,Trasporto pubblico locale,PERSONALE SOC. AUTOLINEE TOSCANE,24 ORE VARIE MODALITA',Provinciale,null,27/09/2022,Toscana,Firenze,27/09/2022 11:36,2022-10-10,2022-10-10
Effettuato,10/10/2022,10/10/2022,OSR FAISA-CONFAIL,Trasporto pubblico locale,PERSONALE MANUTENZIONE E INFRASTRUTTURE SOC. EAV DI NAPOLI,4 ORE: DALLE 09.00 ALLE 13.00,Locale,null,29/09/2022,Campania,Napoli,29/09/2022 12:45,2022-10-10,2022-10-10
Effettuato,10/10/2022,10/10/2022,OSR FILT-CGIL/FIT-CISL/UILT-UIL/UGL AUTOFERRO/FAISA-CISAL,Trasporto pubblico locale,PERSONALE MANUTENZIONE INFRASTRUTTURA SOC. EAV DI NAPOLI,4 ORE: DALLE 09.00 ALLE 13.00,Locale,null,29/09/2022,Campania,Napoli,29/09/2022 10:25,2022-10-10,2022-10-10
Effettuato,09/10/2022,09/10/2022,OSR ORSA FERROVIE,Ferroviario,PERSONALE SOC. TRENORD REGIONE LOMBARDIA,8 ORE: DALLE 9.00 ALLE 16.59,Regionale,null,27/09/2022,Lombardia,Tutte,27/09/2022 17:43,2022-10-09,2022-10-09
"Revocato (include le azioni di revoca, sospensione e differimento)",08/10/2022,08/10/2022,OSP UGL AUTOFERRO,Trasporto pubblico locale,PERSONALE SOC. AMT DI GENOVA,24 ORE,Locale,null,02/08/2022,Liguria,Genova,02/08/2022 22:42,2022-10-08,2022-10-08
Effettuato,08/10/2022,09/10/2022,OSR ORSA FERROVIE,Ferroviario,PERSONALE SOC. RFI CIRCOLAZIONE AREA MILANO,24 ORE: DALLE 21.01 DELL'8/10 ALLE 21.00 DEL 9/10,Locale,null,16/09/2022,Lombardia,Milano,16/09/2022 10:44,2022-10-08,2022-10-09
Effettuato,08/10/2022,08/10/2022,OSR USB LAVORO PRIVATO,Trasporto pubblico locale,PERSONALE SOC. BUSITALIA SITA NORD REGIONE UMBRIA,24 ORE,Regionale,null,21/08/2022,Umbria,Tutte,21/08/2022 12:22,2022-10-08,2022-10-08
Effettuato,08/10/2022,09/10/2022,RSU 1A PDM/RSU 1B PDB,Ferroviario,PERSONALE MOBILE SOC. TRENORD REGIONE LOMBARDIA,24 ORE: DALLE 21.00 DELL'8/10 ALLE 21.00 DEL 9/10,Regionale,null,15/09/2022,Lombardia,Tutte,15/09/2022 14:50,2022-10-08,2022-10-09
Effettuato,07/10/2022,07/10/2022,CUB TRASPORTI/SGB FERROVIE,Ferroviario,PERSONALE SOC. MERCITALIA RAIL,21 ORE: DALLE 00.00 ALLE 21.00,Nazionale,null,27/09/2022,Italia,Tutte,27/09/2022 11:39,2022-10-07,2022-10-07
Effettuato,07/10/2022,07/10/2022,OSP FAISA-CISAL,Trasporto pubblico locale,PERSONALE DEL GRUPPO ARRIVA OPERANTE PRESSO LA PROVINCIA DI TORINO,4 ORE: DALLE 16.00 ALLE 20.00,Locale,null,20/09/2022,Piemonte,Torino,20/09/2022 15:03,2022-10-07,2022-10-07
Effettuato,07/10/2022,07/10/2022,OSR CGIL/CISL/UIL,Generale,SCIOPERO GENERALE CATEGORIE SERVIZI PUBBLICI ESSENZIALI REGIONE VENETO,1 ORA A FINE DI OGNI TURNO DI LAVORO,Regionale,null,22/09/2022,Veneto,Tutte,23/09/2022 14:04,2022-10-07,2022-10-07
Effettuato,07/10/2022,07/10/2022,OSR FILT-CGIL/FIT-CISL/UILT-UIL/UGL AUTOFERRO,Trasporto pubblico locale,"PERSONALE SOC. AUTOGUIDOVIE DEI BACINI DI MILANO, PAVIA, CREMONA, MONZA BRIANZA",24 ORE,Regionale,ADESIONE OSR FAISA-CISAL,25/07/2022,Lombardia,Tutte,25/07/2022 10:15,2022-10-07,2022-10-07
"Revocato (include le azioni di revoca, sospensione e differimento)",07/10/2022,08/10/2022,OSR ORSA FERROVIE,Ferroviario,PERSONALE SOC. RFI CIRCOLAZIONE AREA MILANO,24 ORE: DALLE 21.01 DEL 7/10 ALLE 21.00 DELL'8/10,Locale,null,05/08/2022,Lombardia,Milano,05/08/2022 10:00,2022-10-07,2022-10-08
Effettuato,07/10/2022,07/10/2022,OSR USB LAVORO PRIVATO,Trasporto pubblico locale,"PERSONALE SOC. AUTOGUIDOVIE DEI BACINI DI MILANO, PAVIA, CREMONA, MONZA BRIANZA",24 ORE,Regionale,null,16/08/2022,Lombardia,Tutte,16/08/2022 17:48,2022-10-07,2022-10-07
Effettuato,06/10/2022,07/10/2022,CMC,Ferroviario,PERSONALE DI MACCHINA SOC. MERCITALIA RAIL,24 ORE: DALLE 21.00 DEL 6/10 ALLE 21.00 DEL 7/10,Nazionale,null,04/08/2022,Italia,Tutte,04/08/2022 10:41,2022-10-06,2022-10-07
Effettuato,06/10/2022,06/10/2022,OSR FAISA-CISAL,Trasporto pubblico locale,PERSONALE SOC. IAS TOURING DI CORIGLIANO-ROSSANO  (CS),24 ORE,Locale,null,22/09/2022,Calabria,Cosenza,23/09/2022 08:54,2022-10-06,2022-10-06
Effettuato,04/10/2022,04/10/2022,OSR FILT-CGIL/FIT-CISL/UILT-UIL/UGL FERROVIERI/FAST-CONFSAL/ORSA FERROVIE,Ferroviario,PERSONALE SOC. TRENITALIA OGR VICENZA,8 ORE,Locale,null,23/09/2022,Veneto,Vicenza,23/09/2022 22:48,2022-10-04,2022-10-04
Effettuato,04/10/2022,04/10/2022,OSR FILT-CGIL/FIT-CISL/UILT-UIL/UGL/FAST-CONFSAL/ORSA FERROVIE,Ferroviario,PERSONALE SOC. TRENITALIA IMPIANTO MANUTENTIVO OMC VICENZA,8 ORE: DALLE 09.43 ALLE 17.41,Locale,null,28/09/2022,Veneto,Vicenza,28/09/2022 19:49,2022-10-04,2022-10-04
"Revocato (include le azioni di revoca, sospensione e differimento)",03/10/2022,03/10/2022,FAO-COBAS ADERENTE SLAI-PROL-COBAS,Trasporto merci,"PERSONALE VIAGGIANTE SU MEZZI PESANTI DELLE AZIENDE DEL SETTORE TRASPORTO MERCI, LOGISTICA E SPEDIZIONE",24 ORE: DALLE 00.00 ALLE 24.00,Nazionale,null,05/09/2022,Italia,Tutte,05/09/2022 11:33,2022-10-03,2022-10-03
Effettuato,03/10/2022,31/10/2022,OSR FAISA-CISAL,Trasporto pubblico locale,PERSONALE SOC. VINCENZO CUFFARO DI AGRIGENTO,AD OLTRANZA,Aziendale,null,30/09/2022,Sicilia,Agrigento,30/09/2022 07:18,2022-10-03,2022-10-31
"Revocato (include le azioni di revoca, sospensione e differimento)",02/10/2022,03/10/2022,OSR FILT-CGIL/FIT-CISL/UGL FERROVIERI/ORSA TRASPORTI,Ferroviario,"PERSONALE SOC. TRENITALIA SETTORI DBR, DIREZIONE BUSINESS AV, DB-IC DELLA CALABRIA",24 ORE: DALLE 21.01 DEL 2/10 ALLE 21.00 DEL 3/10,Regionale,null,26/07/2022,Calabria,Tutte,26/07/2022 11:02,2022-10-02,2022-10-03
Effettuato,01/10/2022,01/10/2022,CUB,Aereo,"LAVORATORI COMPARTO AEREO, AEROPORTUALE E INDOTTO AEROPORTI",24 ORE: DALLE 00.01 ALLE 23.59,Nazionale,ADESIONE O.S. CUB TRASPORTI - ESCLUSIONE DELLA SOC. ENAV E DEI VOLI DA E PER L'AEROPORTO DI BERGAMO,19/09/2022,Italia,Tutte,20/09/2022 09:28,2022-10-01,2022-10-01
"Revocato (include le azioni di revoca, sospensione e differimento)",01/10/2022,01/10/2022,FILT-CGIL/FIT-CISL/UILT-UIL,Aereo,PERSONALE SOC. ENAV,24 ORE,Nazionale,null,03/08/2022,Italia,Tutte,26/08/2022 12:39,2022-10-01,2022-10-01
Effettuato,01/10/2022,01/10/2022,FILT-CGIL/UILT-UIL,Aereo,"PERSONALE DELLE COMPAGNIE AEREE RYANAIR LIMITED, MALTA AIR E SOC. CREWLINK",24 ORE,Nazionale,null,03/08/2022,Italia,Tutte,03/08/2022 11:45,2022-10-01,2022-10-01
Effettuato,01/10/2022,01/10/2022,FILT-CGIL/UILT-UIL,Aereo,PERSONALE SOC. VUELING,4 ORE: DALLE 13.01 ALLE 17.00,Nazionale,ESCLUSIONE DEI VOLI DA E PER L'AEROPORTO DI BERGAMO ORIO AL SERIO,13/09/2022,Italia,Tutte,14/09/2022 15:10,2022-10-01,2022-10-01
"Revocato (include le azioni di revoca, sospensione e differimento)",01/10/2022,01/10/2022,FLAI TRASPORTI E SERVIZI,Aereo,LAVORATORI IMPRESE SERVIZI AEROPORTUALI DI HANDLING,24 ORE: DALLE 00.01 ALLE 23.59,Nazionale,null,20/09/2022,Italia,Tutte,20/09/2022 10:04,2022-10-01,2022-10-01
Effettuato,01/10/2022,01/10/2022,OSR CNAL TRASPORTI,Aereo,PERSONALE SOC. GESAC AEROPORTO NAPOLI CAPODICHINO,24 ORE: DALLE 00.01 ALLE 23.59,Interregionale,null,04/07/2022,Italia,Tutte,04/07/2022 10:11,2022-10-01,2022-10-01
Effettuato,01/10/2022,01/10/2022,OST FILT-CGIL/UILT-UIL,Aereo,PERSONALE AEROPORTUALE SOC. AVIATION SERVICES DI VENEZIA,4 ORE: DALLE 13.00 ALLE 17.00,Interregionale,null,05/08/2022,Veneto,Tutte,05/08/2022 16:05,2022-10-01,2022-10-01
Effettuato,01/10/2022,01/10/2022,UILT-UIL,Aereo,PERSONALE SOC. EASYJET,24 ORE,Nazionale,null,03/08/2022,Italia,Tutte,03/08/2022 11:50,2022-10-01,2022-10-01
Effettuato,01/10/2022,01/10/2022,UILT-UIL,Aereo,PERSONALE SOC. VOLOTEA,24 ORE,Nazionale,ESCLUSIONE DEI VOLI DA E PER L'AEROPORTO DI BERGAMO ORIO AL SERIO,03/08/2022,Italia,Tutte,03/08/2022 11:54,2022-10-01,2022-10-01
Effettuato,01/10/2022,01/10/2022,USB LAVORO PRIVATO,Aereo,PERSONALE NAVIGANTE SOC. EASYJET,24 ORE: DALLE 00.00 ALLE 23.59,Nazionale,ESCLUSI I VOLI DA/PER AEROPORTO DI BERGAMO ORIO AL SERIO,19/09/2022,Italia,Tutte,19/09/2022 10:00,2022-10-01,2022-10-01
Effettuato,29/09/2022,29/09/2022,OST FILT-CGIL/FIT-CISL/UILT-UIL/UGL-TA + RSU,Aereo,PERSONALE SOC. BGY INTENATIONAL SERVICES AEROPORTO BERGAMO ORIO AL SERIO,4 ORE: DALLE 10.00 ALLE 14.00,Locale,null,28/07/2022,Lombardia,Bergamo,28/07/2022 20:35,2022-09-29,2022-09-29
"Revocato (include le azioni di revoca, sospensione e differimento)",27/09/2022,28/09/2022,RSU 1A PDM/RSU 1B PDB,Ferroviario,PERSONALE MOBILE SOC. TRENORD REGIONE LOMBARDIA,23 ORE: DALLE 03.00 DEL 27/9 ALLE 02.00 DEL 28/9,Regionale,null,26/07/2022,Lombardia,Tutte,26/07/2022 14:42,2022-09-27,2022-09-28
Effettuato,26/09/2022,26/09/2022,OSR ORSA TPL/USB LAVORO PRIVATO,Trasporto pubblico locale,PERSONALE SOC. EAV DI NAPOLI,4 ORE: DALLE 9.00 ALLE 13.00,Locale,null,15/09/2022,Campania,Napoli,15/09/2022 13:00,2022-09-26,2022-09-26
"Revocato (include le azioni di revoca, sospensione e differimento)",26/09/2022,26/09/2022,OSR UILT-UIL,Trasporto pubblico locale,PERSONALE SOC. ROMANO AUTOLINEE REGIONALI DI CROTONE,24 ORE,Locale,null,12/08/2022,Calabria,Crotone,12/08/2022 11:45,2022-09-26,2022-09-26
Effettuato,19/09/2022,19/09/2022,OSR FILT-CGIL/FIT-CISL/UILT-UIL/UGL/FAST/ORSA FERROVIE,Ferroviario,PERSONALE SOC. MERCITALIA RAIL REGIONE CALABRIA,8 ORE: DALLE 09.01 ALLE 17.00,Regionale,null,05/08/2022,Calabria,Tutte,05/08/2022 10:35,2022-09-19,2022-09-19
Effettuato,18/09/2022,19/09/2022,OSR SLM-FAST-CONFSAL,Ferroviario,PERSONALE MOBILE SOC. TRENITALIA TPER REGIONE EMILIA ROMAGNA,23 ORE: DALLE 3.31 DEL 18/9 ALLE 2.30 DEL 19/9,Regionale,null,18/07/2022,Emilia-Romagna,Tutte,18/07/2022 05:46,2022-09-18,2022-09-19
Effettuato,18/09/2022,19/09/2022,RSA FAISA-CISAL,Ferroviario,PERSONALE MOBILE SOC. TRENITALIA TPER REGIONE EMILIA ROMAGNA,23 ORE: DALLE 3.31 DEL 18/9 ALLE 2.30 DEL 19/9,Regionale,null,18/07/2022,Emilia-Romagna,Tutte,18/07/2022 12:33,2022-09-18,2022-09-19
"Revocato (include le azioni di revoca, sospensione e differimento)",16/09/2022,16/09/2022,FAISA-CONFAIL,Trasporto pubblico locale,PERSONALE ADDETTO AL TRASPORTO PUBBLICO LOCALE,4 ORE CON MODALITA' TERRITORIALI,Nazionale,null,21/06/2022,Italia,Tutte,21/06/2022 14:49,2022-09-16,2022-09-16
Effettuato,16/09/2022,16/09/2022,FILT-CGIL/FIT-CISL/UILT-UIL/FAISA-CISAL/UGL-FNA,Trasporto pubblico locale,PERSONALE ADDETTO AL TRASPORTO PUBBLICO LOCALE,8 ORE CON MODALITA' TERRITORIALI,Nazionale,null,12/09/2022,Italia,Tutte,12/09/2022 19:48,2022-09-16,2022-09-16
Effettuato,16/09/2022,16/09/2022,ORSA AUTOFERRO TPL,Trasporto pubblico locale,PERSONALE ADDETTO AL TRASPORTO PUBBLICO LOCALE,8 ORE CON MODALITA' TERRITORIALI,Nazionale,null,13/09/2022,Italia,Tutte,13/09/2022 11:04,2022-09-16,2022-09-16
"Revocato (include le azioni di revoca, sospensione e differimento)",16/09/2022,16/09/2022,OSP FAISA-CISAL,Trasporto pubblico locale,PERSONALE DEL GRUPPO ARRIVA OPERANTE PRESSO LA PROVINCIA DI TORINO,4 ORE: DALLE 16.00 ALLE 20.00,Locale,null,29/08/2022,Piemonte,Torino,29/08/2022 07:28,2022-09-16,2022-09-16
Effettuato,16/09/2022,16/09/2022,OSP FAISA-CISAL,Trasporto pubblico locale,PERSONALE SOC. COTRAL REGIONE LAZIO,4 ORE: DALLE 12.30 ALLE 16.30,Regionale,null,29/08/2022,Lazio,Tutte,29/08/2022 14:16,2022-09-16,2022-09-16
Effettuato,16/09/2022,16/09/2022,OSP FILT-CGIL/FIT-CISL/UILT-UIL/UGL AUTOFERRO/FAISA-CISAL,Trasporto pubblico locale,PERSONALE SOC. AMTS DI CATANIA,4 ORE: DALLE 12.00 ALLE 16.00,Locale,ADESIONE DELLA OSP ORSA TPL,24/08/2022,Sicilia,Catania,24/08/2022 20:02,2022-09-16,2022-09-16
"Revocato (include le azioni di revoca, sospensione e differimento)",16/09/2022,16/09/2022,OSP FILT-CGIL/FIT-CISL/UILT-UIL/UGL/FAISA-CISAL,Trasporto pubblico locale,PERSONALE SOC. AMTS DI CATANIA,24 ORE,Territoriale,null,07/07/2022,Sicilia,Catania,07/07/2022 10:59,2022-09-16,2022-09-16
Effettuato,16/09/2022,16/09/2022,OSP FIT-CISL + RSA,Trasporto pubblico locale,PERSONALE GRUPPO ROMANO (F.LLI ROMANO E ROMANO AUTOLINEE REGIONALI) DI CROTONE,4 ORE: DALLE 10.55 ALLE 14.55,Locale,null,24/08/2022,Calabria,Crotone,24/08/2022 12:41,2022-09-16,2022-09-16
Effettuato,16/09/2022,16/09/2022,OSP ORSA AUTOFERRO TPL,Trasporto pubblico locale,PERSONALE SOC. AUTOGUIDOVIE DI PAVIA,4 ORE: DALLE 11.00 ALLE 15.00,Locale,null,27/07/2022,Lombardia,Pavia,09/09/2022 07:36,2022-09-16,2022-09-16
Effettuato,16/09/2022,16/09/2022,OSP SLM-FAST-CONFSAL,Trasporto pubblico locale,PERSONALE SOC. AUTOLINEE TOSCANE,4 ORE: VARIE MODALITA',Provinciale,null,29/08/2022,Toscana,Tutte,29/08/2022 11:27,2022-09-16,2022-09-16
Effettuato,16/09/2022,16/09/2022,OSP UGL AUTOFERRO,Trasporto pubblico locale,PERSONALE SOC. ARRIVA UDINE DI UDINE,24 ORE,Locale,null,05/09/2022,Friuli-Venezia Giulia,Udine,11/09/2022 16:02,2022-09-16,2022-09-16
Effettuato,16/09/2022,16/09/2022,OSP USB LAVORO PRIVATO,Trasporto pubblico locale,PERSONALE SOC. TROTTA BUS SERVICES COMUNE DI FIUMICINO (RM),24 ORE,Locale,null,03/08/2022,Lazio,Roma,03/08/2022 18:56,2022-09-16,2022-09-16
Effettuato,16/09/2022,16/09/2022,OSR FAISA-CISAL,Trasporto pubblico locale,PERSONALE SOC. LIROSI AUTOSERVIZI DI GIOIA TAURO (RC),4 ORE: DALLE 11.57 ALLE 15.57,Locale,null,26/08/2022,Calabria,Reggio Calabria,26/08/2022 14:32,2022-09-16,2022-09-16
Effettuato,16/09/2022,16/09/2022,OSR FAISA-CISAL,Trasporto pubblico locale,PERSONALE SOC. IAS TOURING DI CORIGLIANO-ROSSANO  (CS),3 ORE: DALLE 21.00 ALLE 24.00,Locale,null,03/09/2022,Calabria,Cosenza,05/09/2022 09:25,2022-09-16,2022-09-16
Effettuato,16/09/2022,16/09/2022,OSR FILT-CGIL,Ncc,PERSONALE SOC. TROTTA BUS SERVICES COMUNE DI FIUMICINO (RM),4 ORE: DALLE 8.30 ALLE 12.30,Locale,INCLUSO PERSONALE SERVIZIO NAVETTA AEROPORTO ROMA FIUMICINO,04/08/2022,Lazio,Roma,04/08/2022 15:29,2022-09-16,2022-09-16
Effettuato,16/09/2022,16/09/2022,OSR FILT-CGIL/FAISA-CISAL,Trasporto pubblico locale,PERSONALE AZIENDE TPL DELLA REGIONE UMBRIA,24 ORE,Regionale,null,16/08/2022,Umbria,Tutte,16/08/2022 20:36,2022-09-16,2022-09-16
"Revocato (include le azioni di revoca, sospensione e differimento)",16/09/2022,16/09/2022,OSR FILT-CGIL/FIT-CISL/UILT-UIL/UGL/FAST/ORSA FERROVIE,Ferroviario,PERSONALE SOC. MERCITALIA RAIL REGIONE SICILIA,8 ORE: DALLE 09.01 ALLE 16.59,Regionale,null,26/07/2022,Sicilia,Tutte,26/07/2022 15:44,2022-09-16,2022-09-16
Effettuato,16/09/2022,16/09/2022,OSR UILT-UIL,Trasporto pubblico locale,PERSONALE SOC. ANM DI NAPOLI LINEA 1 ( ESCLUSO PERSONALE MACCHINISTA ),4 ORE: DALLE 11.30 ALLE 15.30,Locale,null,05/09/2022,Campania,Napoli,05/09/2022 16:12,2022-09-16,2022-09-16
Effettuato,16/09/2022,16/09/2022,OSR/OSP FAISA-CISAL,Trasporto pubblico locale,PERSONALE SOC. IAS SCURA DI CORIGLIANO-ROSSANO (CS),4 ORE: DALLE 12.10 ALLE 16.10,Locale,null,10/08/2022,Calabria,Cosenza,10/08/2022 17:03,2022-09-16,2022-09-16
Effettuato,16/09/2022,16/09/2022,OSR/OSP FAISA-CISAL + RSA,Trasporto pubblico locale,PERSONALE SOC. AMACO DI COSENZA,4 ORE: DALLE 10.00 ALLE 14.00,Locale,null,10/08/2022,Calabria,Cosenza,10/08/2022 19:01,2022-09-16,2022-09-16
Effettuato,16/09/2022,16/09/2022,OSR/OSP FAISA-CISAL + RSA,Trasporto pubblico locale,PERSONALE SOC. AUTOLINEE ROMANO REGIONALI DI CROTONE,4 ORE: DALLE 10.55 ALLE 14.55,Locale,null,10/08/2022,Calabria,Crotone,11/08/2022 09:29,2022-09-16,2022-09-16
Effettuato,16/09/2022,16/09/2022,OST FILT-CGIL/UILT-UIL/UGL AUTOFERRO/FAISA-CISAL/CISAS/CONFAIL/CILDI,Trasporto pubblico locale,PERSONALE SOC. AMTAB DI BARI,4 ORE: DALLE 8.30 ALLE 12.30,Locale,ADESIONE OST FIT-CISL,27/07/2022,Puglia,Bari,27/07/2022 07:40,2022-09-16,2022-09-16
"Revocato (include le azioni di revoca, sospensione e differimento)",16/09/2022,16/09/2022,RSU,Trasporto pubblico locale,PERSONALE SOC. GTT DI TORINO SETTORE VIAGGIANTE URBANO,24 ORE,Locale,null,08/08/2022,Piemonte,Torino,08/08/2022 14:40,2022-09-16,2022-09-16
"Revocato (include le azioni di revoca, sospensione e differimento)",16/09/2022,16/09/2022,RSU,Trasporto pubblico locale,PERSONALE SOC. GTT DI TORINO SETTORE VIAGGIANTE URBANO E SUB URBANO,4 ORE: DALLE 18.00 ALLE 22.00,Locale,null,01/09/2022,Piemonte,Torino,01/09/2022 12:18,2022-09-16,2022-09-16
Effettuato,16/09/2022,16/09/2022,SLM-FAST-CONFSAL,Trasporto pubblico locale,PERSONALE ADDETTO AL TRASPORTO PUBBLICO LOCALE,8 ORE CON MODALITA' TERRITORIALI,Nazionale,null,13/09/2022,Italia,Tutte,13/09/2022 16:58,2022-09-16,2022-09-16
Effettuato,15/09/2022,15/09/2022,OSP FILT-CGIL/FIT-CISL/UILT-UIL/UGL/FAISA-CISAL,Trasporto pubblico locale,PERSONALE SOC. TPER PROVINCE DI BOLOGNA E FERRARA,4 ORE: DALLE 11.30 ALLE 15.30,Territoriale,null,02/09/2022,Emilia-Romagna,Bologna,05/09/2022 11:09,2022-09-15,2022-09-15
"Revocato (include le azioni di revoca, sospensione e differimento)",14/09/2022,14/09/2022,OSP ORSA AUTOFERRO TPL,Trasporto pubblico locale,PERSONALE SOC. AUTOGUIDOVIE DI PAVIA,4 ORE: DALLE 11.00 ALLE 15.00,Locale,null,06/07/2022,Lombardia,Pavia,09/09/2022 11:48,2022-09-14,2022-09-14
"Revocato (include le azioni di revoca, sospensione e differimento)",14/09/2022,14/09/2022,OSR USB LAVORO PRIVATO,Trasporto pubblico locale,PERSONALE SOC. BUSITALIA SITA NORD REGIONE UMBRIA,24 ORE,Regionale,null,12/08/2022,Umbria,Tutte,12/08/2022 14:39,2022-09-14,2022-09-14
Effettuato,13/09/2022,13/09/2022,OSR USB LAVORO PRIVATO,Trasporto pubblico locale,PERSONALE AZIENDE TPL DELLA REGIONE TRENTINO ALTO ADIGE,4 ORE VARIE MODALITA',Regionale,null,01/09/2022,Trentino-Alto Adige,Tutte,01/09/2022 15:41,2022-09-13,2022-09-13
Effettuato,12/09/2022,12/09/2022,CUB,Aereo,"LAVORATORI COMPARTO AEREO, AEROPORTUALE E INDOTTO AEROPORTI",24 ORE: DALLE 00.01 ALLE 23.59,Nazionale,ADESIONE O.S. CUB TRASPORTI - ESCLUSIONE DELLA SOC. ENAV E DUSSMANN SERVICE E SPD DELL'AEROPORTO DI MALPENSA,21/07/2022,Italia,Tutte,21/07/2022 13:26,2022-09-12,2022-09-12
Effettuato,12/09/2022,12/09/2022,FLAI TRASPORTI E SERVIZI,Aereo,LAVORATORI IMPRESE SERVIZI AEROPORTUALI DI HANDLING,24 ORE: DALLE 00.01 ALLE 23.59,Nazionale,null,26/07/2022,Italia,Tutte,27/07/2022 09:12,2022-09-12,2022-09-12
Effettuato,12/09/2022,12/09/2022,OSP FAISA-CISAL,Trasporto pubblico locale,PERSONALE SOC. BUSITALIA VENETO DI PADOVA,24 ORE,Locale,null,01/09/2022,Veneto,Padova,01/09/2022 22:44,2022-09-12,2022-09-12
Effettuato,12/09/2022,22/09/2022,OSP FILT-CGIL/FIT-CISL/UILT-UIL,Marittimo,PERSONALE AUTORITA' DI SISTEMA PORTUALE DEL MAR TIRRENO SETTENTRIONALE,2 ORE PER OGNI TURNO PREVISTO DALLE 00.00 DEL 12/9 ALLE 24.00 DEL 20/9; SETT. AMM.VO DALLE 00.00 DEL 21/9 ALLE 24.00 DEL 22/9,Provinciale,null,02/09/2022,Toscana,Livorno,02/09/2022 07:56,2022-09-12,2022-09-22
Effettuato,12/09/2022,12/09/2022,OSR FIT-CISL,Aereo,PERSONALE AEROPORTUALE SOC. AVIATION SERVICES DI VENEZIA,24 ORE: DALLE 00.01 ALLE 23.59,Interregionale,null,06/07/2022,Italia,Tutte,06/07/2022 09:17,2022-09-12,2022-09-12
Effettuato,12/09/2022,12/09/2022,OST CUB TRASPORTI,Aereo,PERSONALE DELLA SOC. MLE-BCUBE AEROPORTO DI MILANO LINATE,4 ORE: DALLE 12.00 ALLE 16.00,Nazionale,null,23/08/2022,Italia,Tutte,23/08/2022 12:42,2022-09-12,2022-09-12
"Revocato (include le azioni di revoca, sospensione e differimento)",12/09/2022,12/09/2022,OST UGL-TA,Aereo,PERSONALE SOC. ENAV APT BOLOGNA,24 ORE,Interregionale,null,22/08/2022,Emilia-Romagna,Tutte,22/08/2022 13:39,2022-09-12,2022-09-12
"Revocato (include le azioni di revoca, sospensione e differimento)",12/09/2022,12/09/2022,RSA UGL-TA,Aereo,"PERSONALE SOC. ENAV COMPARTO FPDIM SALE OPERATIVE ARO CBO ROMA, MILANO E NOF ITALIA",24 ORE: DALLE 00.01 ALLE 23.59,Nazionale,null,02/08/2022,Italia,Tutte,02/08/2022 20:39,2022-09-12,2022-09-12
"Revocato (include le azioni di revoca, sospensione e differimento)",12/09/2022,12/09/2022,RSA UGL-TA,Aereo,PERSONALE SOC. ENAV APT PERUGIA,24 ORE: DALLE 00.01 ALLE 23.59,Locale,null,10/08/2022,Umbria,Perugia,10/08/2022 19:41,2022-09-12,2022-09-12
"Revocato (include le azioni di revoca, sospensione e differimento)",12/09/2022,12/09/2022,RSA UILT-UIL/UGL-TA/UNICA,Aereo,PERSONALE SOC. ENAV APT DI TORINO CASELLE,24 ORE: DALLE 00.00 ALLE 23.59,Interregionale,null,03/08/2022,Italia,Tutte,03/08/2022 10:17,2022-09-12,2022-09-12
Effettuato,12/09/2022,12/09/2022,USB LAVORO PRIVATO,Aereo,PERSONALE DIPENDENTE AZIENDE TRASPORTO AEREO E INDOTTO,24 ORE: DALLE 00.00 ALLE 23.59,Nazionale,"ESCLUSO PERSONALE SOCC. ENAV, DUSSMANN, SPD",31/08/2022,Italia,Tutte,31/08/2022 12:43,2022-09-12,2022-09-12
"Revocato (include le azioni di revoca, sospensione e differimento)",11/09/2022,11/09/2022,RSA FILT-CGIL/FIT-CISL,Aereo,PERSONALE SOC. ENAV ACC BRINDISI,8 ORE: DALLE 10.00 ALLE 18.00,Nazionale,null,03/08/2022,Italia,Tutte,03/08/2022 18:38,2022-09-11,2022-09-11
"Revocato (include le azioni di revoca, sospensione e differimento)",11/09/2022,11/09/2022,RSA UILT-UIL,Aereo,PERSONALE SOC. ENAV ACC BRINDISI,24 ORE,Nazionale,null,29/07/2022,Italia,Tutte,29/07/2022 12:41,2022-09-11,2022-09-11
Effettuato,09/09/2022,09/09/2022,FAISA-CISAL,Ferroviario,"PERSONALE MOBILE SOCC. TRENITALIA, ITALO NTV, TRENORD E TRENITALIA TPER",8 ORE: DALLE 09.01 ALLE 16.59,Nazionale,null,03/09/2022,Italia,Tutte,03/09/2022 20:03,2022-09-09,2022-09-09
Effettuato,09/09/2022,09/09/2022,FILT-CGIL/FIT-CISL/UILT-UIL/UGL FERROVIERI/SLM-FAST-CONFSAL/ORSA TRASPORTI,Ferroviario,"PERSONALE MOBILE SOCC. TRENITALIA, ITALO NTV, TRENORD E TRENITALIA TPER",8 ORE: DALLE 9.01 ALLE 16.59,Nazionale,null,03/09/2022,Italia,Tutte,03/09/2022 14:54,2022-09-09,2022-09-09
Effettuato,09/09/2022,09/09/2022,FILT-CGIL/FIT-CISL/UILT-UIL/UGL FERROVIERI/SLM-FAST-CONFSAL/ORSA TRASPORTI,Ferroviario,PERSONALE MOBILE SOC. SNCF VOYAGES ITALIA,8 ORE: DALLE 9.01 ALLE 16.59,Nazionale,null,05/09/2022,Italia,Tutte,05/09/2022 10:53,2022-09-09,2022-09-09
Effettuato,09/09/2022,10/09/2022,FISI,Plurisettoriale,"SCIOPERO GENERALE PER TUTTI I SETTORI DELLA PUBBLICA AMMINISTRAZIONE, PUBBLICI E PRIVATI DELLA SANITA' E DELLA SCUOLA",48 ORE: DALLE 23.59 DELL'8/9 ALLE 23.59 DEL 10/9,Nazionale,null,26/07/2022,Italia,Tutte,26/07/2022 16:10,2022-09-09,2022-09-10
Effettuato,06/09/2022,06/09/2022,OSP ADL,Aereo,"PERSONALE SOCC. DUSMANN SERVICE, SPD ADDETTO A PULIZIE AEROPORTO MILANO MALPENSA",24 ORE: DALLE 00.00 ALLE 24.00,Nazionale,null,14/07/2022,Italia,Tutte,14/07/2022 09:52,2022-09-06,2022-09-06
Effettuato,05/09/2022,05/09/2022,OSP FILT-CGIL/FIT-CISL/UILT-UIL/FAISA-CISAL/SIAL-COBAS/UGL-FNA + RSU,Trasporto pubblico locale,PERSONALE SOC. TPL LINEA DI SAVONA,4 ORE: DALLE 10.15 ALLE 14.15,Locale,null,29/07/2022,Liguria,Savona,03/08/2022 00:00,2022-09-05,2022-09-05
Effettuato,05/09/2022,05/09/2022,OSR UGL AUTOFERRO/FAISA-CISAL,Trasporto pubblico locale,PERSONALE SOC. ATM REGIONE MOLISE,4 ORE: DALLE 19.00 ALLE 23.00,Regionale,null,01/08/2022,Molise,Tutte,01/08/2022 09:15,2022-09-05,2022-09-05
Effettuato,04/09/2022,04/09/2022,OSR ORSA TRASPORTI,Ferroviario,PERSONALE SOC. TRENITALIA DIV. BUSINESS AV REGIONE MARCHE,23 ORE: DALLE 01.00 ALLE 23.59,Regionale,null,17/08/2022,Marche,Tutte,17/08/2022 09:25,2022-09-04,2022-09-04
"Revocato (include le azioni di revoca, sospensione e differimento)",04/09/2022,04/09/2022,OSR UGL AUTOFERRO/FAISA-CISAL,Trasporto pubblico locale,PERSONALE SOC. ATM REGIONE MOLISE,4 ORE: DALLE 19.00 ALLE 23.00,Regionale,null,30/07/2022,Molise,Tutte,30/07/2022 15:47,2022-09-04,2022-09-04
Effettuato,27/08/2022,27/08/2022,OST CUB TRASPORTI,Marittimo,PERSONALE DELLA SOC. LSCT PORTO DI LA SPEZIA,24 ORE PER TUTTI I TURNI DI LAVORO,Aziendale,null,11/08/2022,Liguria,La Spezia,11/08/2022 11:05,2022-08-27,2022-08-27
Effettuato,05/08/2022,05/08/2022,OSR FILT-CGIL/FIT-CISL/SLM-FAST/ORSA TRASPORTI,Trasporto merci,PERSONALE DI ESERCIZIO SOC. INTEROPORTO SERVIZI CARGO DI NAPOLI,8 ORE: DALLE 15.00 ALLE 22.59,Locale,null,22/07/2022,Campania,Napoli,22/07/2022 15:46,2022-08-05,2022-08-05
Effettuato,27/07/2022,27/07/2022,OSP UGL AUTOFERRO,Trasporto pubblico locale,PERSONALE SOC. AMT DI GENOVA,3 ORE E 30': DALLE 20.30 ALLE 24.00,Locale,null,17/07/2022,Liguria,Genova,17/07/2022 11:11,2022-07-27,2022-07-27
Effettuato,27/07/2022,27/07/2022,OSR FAISA-CISAL,Trasporto pubblico locale,PERSONALE SOC. IAS TOURING DI CORIGLIANO-ROSSANO  (CS),3 ORE: DALLE 21.00 ALLE 24.00,Locale,null,16/07/2022,Calabria,Cosenza,18/07/2022 06:11,2022-07-27,2022-07-27
Effettuato,27/07/2022,27/07/2022,OST UILT-UIL/FAISA-CISAL/CSS + RSA,Trasporto pubblico locale,PERSONALE SOC. CTM DI CAGLIARI,3 ORE E 28': DALLE 20.31 ALLE 23.59,Locale,null,15/07/2022,Sardegna,Cagliari,16/07/2022 09:05,2022-07-27,2022-07-27
"Revocato (include le azioni di revoca, sospensione e differimento)",25/07/2022,25/07/2022,FILT-CGIL,Circolazione e sicurezza stradale,PERSONALE SOC. GSA SERVIZI PRIMO INTERVENTO E ANTINCENDIO PRESSO CONCESSIONARIE AUTOSTRADALI,4 ORE: DALLE 11.00 ALLE 15.00,Nazionale,null,13/07/2022,Italia,Tutte,13/07/2022 12:22,2022-07-25,2022-07-25
Effettuato,25/07/2022,25/07/2022,OSR FILT-CGIL/FIT-CISL/UILT-UIL/FAISA-CISAL,Trasporto pubblico locale,PERSONALE AZIENDE TPL DELLA REGIONE UMBRIA,4 ORE: DALLE 17.30 ALLE 21.30,Regionale,null,14/07/2022,Umbria,Tutte,14/07/2022 18:43,2022-07-25,2022-07-25
Effettuato,24/07/2022,24/07/2022,OSR FILT-CGIL/FIT-CISL/UILT-UIL/UGL-AF/FAST/ORSA,Appalti ferroviari,PERSONALE SOC. DUSSMANN LOTTI REGIONE LIGURIA,PRIMA META' DI CIASCUN TURNO,Regionale,null,12/07/2022,Liguria,Tutte,12/07/2022 16:54,2022-07-24,2022-07-24
Effettuato,24/07/2022,25/07/2022,OSR FILT-CGIL/FIT-CISL/UILT-UIL/UGL/SLM-FAST/ORSA FERROVIE/ASGB + RSU 42,Ferroviario,PERSONALE MOBILE SOC. TRENITALIA DBR TRENTINO ALTO ADIGE,23 ORE: DALLE 02.00 DEL 24/7 ALLE 01.00 DEL 25/7,Regionale,null,14/06/2022,Trentino-Alto Adige,Tutte,14/06/2022 17:50,2022-07-24,2022-07-25
"Revocato (include le azioni di revoca, sospensione e differimento)",24/07/2022,25/07/2022,OSR FILT-CGIL/FIT-CISL/UILT-UIL/UGL/SLM-FAST/ORSA FERROVIE/ASGB + RSU 42,Ferroviario,PERSONALE MOBILE SOC. TRENITALIA DBR TRENTINO ALTO ADIGE,23 ORE: DALLE 02.00 DEL 24/7 ALLE 01.00 DEL 25/7,Regionale,null,08/06/2022,Trentino-Alto Adige,Tutte,08/06/2022 10:00,2022-07-24,2022-07-25
Effettuato,24/07/2022,24/07/2022,OSR ORSA FERROVIE,Ferroviario,PERSONALE CSVD (CUSTOMER SERVICE E VENDITA DIRETTA) DELLA SOC. TRENITALIA REGIONE LOMBARDIA,24 ORE: DALLE 00.01 ALLE 23.59,Regionale,null,13/07/2022,Lombardia,Tutte,13/07/2022 17:08,2022-07-24,2022-07-24
"Revocato (include le azioni di revoca, sospensione e differimento)",24/07/2022,24/07/2022,OSR ORSA TRASPORTI,Trasporto pubblico locale,PERSONALE SOC. EAV DI NAPOLI,24 ORE,Locale,null,09/07/2022,Campania,Napoli,09/07/2022 19:09,2022-07-24,2022-07-24
Effettuato,23/07/2022,23/07/2022,OSP FAISA-CISAL,Trasporto pubblico locale,PERSONALE SOC. BUSITALIA VENETO DI PADOVA,24 ORE,Locale,null,12/07/2022,Veneto,Padova,12/07/2022 11:20,2022-07-23,2022-07-23
Effettuato,23/07/2022,23/07/2022,OST SGB AUTOFERROTRANVIERI,Trasporto pubblico locale,"PERSONALE SOCC. ACTV, VELA E AVM DI VENEZIA",3 ORE: DALLE 19.31 ALLE 22.31,Locale,null,07/07/2022,Veneto,Venezia,07/07/2022 15:37,2022-07-23,2022-07-23
Effettuato,22/07/2022,22/07/2022,OSP SLM-FAST-CONFSAL/FAISA-CISAL,Trasporto pubblico locale,PERSONALE DELLA SOC. FERROVIE DELLA CALABRIA DEL DEPOSITO DI ROTA GRECA DEL CENTRO AUTOMOBILISTICO DI COSENZA,4 ORE: DALLE 11.30 ALLE 15.30,Locale,null,14/06/2022,Calabria,Cosenza,14/06/2022 20:27,2022-07-22,2022-07-22
Effettuato,22/07/2022,22/07/2022,OSR FILT-CGIL/FIT-CISL/UGL FERROVIERI/ORSA TRASPORTI,Ferroviario,"PERSONALE SOC. TRENITALIA SETTORI DBR, DIREZIONE BUSINESS AV, DB-IC DELLA CALABRIA",8 ORE: DALLE 9.01 ALLE 17.00,Regionale,null,28/06/2022,Calabria,Tutte,28/06/2022 09:17,2022-07-22,2022-07-22
Effettuato,22/07/2022,22/07/2022,OSR ORSA TRASPORTI,Ferroviario,PERSONALE SOC. TRENITALIA DIV. BUSINESS AV REGIONE MARCHE,8 ORE: DALLE 09.01 ALLE 17.00,Regionale,null,08/07/2022,Marche,Tutte,08/07/2022 09:17,2022-07-22,2022-07-22
"Revocato (include le azioni di revoca, sospensione e differimento)",22/07/2022,22/07/2022,OSR UILT-UIL,Circolazione e sicurezza stradale,"PERSONALE SOC. GSA SERVIZI PRIMO INTERVENTO E ANTINCENDIO PRESSO TRATTE AUTOSTRADALI A6, A7, A10, A12, A26 REGIONE LIGURIA",4 ORE: DALLE 08.00 ALLE 12.00,Regionale,null,15/07/2022,Liguria,Tutte,22/07/2022 11:00,2022-07-22,2022-07-22
Effettuato,22/07/2022,22/07/2022,OSR UILT-UIL/SLM-FAST-CONFSAL,Ferroviario,PERSONALE EQUIPAGGI SOC. TRENITALIA DIREZIONE BUSINESS REGIONALE CALABRIA,8 ORE: DALLE 9.01 ALLE 17.00,Regionale,null,06/07/2022,Calabria,Tutte,18/07/2022 12:45,2022-07-22,2022-07-22
"Revocato (include le azioni di revoca, sospensione e differimento)",22/07/2022,22/07/2022,OST FILT-CGIL/UILT-UIL/UGL-FNA,Trasporto pubblico locale,PERSONALE SOC. SGM DI LECCE,24 ORE,Locale,null,06/07/2022,Puglia,Lecce,06/07/2022 23:54,2022-07-22,2022-07-22
Effettuato,21/07/2022,21/07/2022,OST A.L. COBAS,Trasporto pubblico locale,PERSONALE GRUPPO ATM DI MILANO,4 ORE VARIE MODALITA',Territoriale,null,21/06/2022,Lombardia,Tutte,21/06/2022 13:12,2022-07-21,2022-07-21
"Revocato (include le azioni di revoca, sospensione e differimento)",20/07/2022,21/07/2022,FEDERTAXI CISAL/SILT,Taxi,FERMO NAZIONALE SERVIZIO TAXI,48 ORE: DALLE 00.00 DEL 20/7 ALLE 24.00 DEL 21/7,Nazionale,null,10/07/2022,Italia,Tutte,10/07/2022 10:41,2022-07-20,2022-07-21
Effettuato,19/07/2022,19/07/2022,OSR FILT-CGIL/FIT-CISL/UILT-UIL/UGL-AF/FAST/ORSA,Ferroviario,PERSONALE SOC. RFI DIREZIONE FABBRICATI VIAGGIATORI MILANO,8 ORE: DALLE 9.01 ALLE 16.59,Territoriale,null,21/06/2022,Lombardia,Milano,21/06/2022 13:06,2022-07-19,2022-07-19
Effettuato,18/07/2022,22/07/2022,TRASPORTOUNITO FIAP/PMIA AUTOTRASPORTO/CEPI F.T./UNILAVORO PMI/CONFIMEA F.T./ANAP/ASS. 3 ASSI/SATI,Trasporto merci,FERMO NAZIONALE SERVIZI AUTOTRASPORTO MERCI,120 ORE: DALLE 00.00 DEL 18/7 ALLE 24.00 DEL 22/7,Nazionale,null,22/06/2022,Italia,Tutte,23/06/2022 13:29,2022-07-18,2022-07-22
Effettuato,17/07/2022,17/07/2022,CUB,Aereo,"LAVORATORI COMPARTO AEREO, AEROPORTUALE E INDOTTO AEROPORTI",4 ORE: DALLE 14.00 ALLE 18.00,Nazionale,SCIOPERO STRAORDINARIO DALLE 00.01 DEL 5/7 ALLE 23.59 DEL 26/7 - ADESIONE O.S. CUB TRASPORTI,16/06/2022,Italia,Tutte,16/06/2022 08:46,2022-07-17,2022-07-17
Effettuato,17/07/2022,17/07/2022,FILCAMS-CGIL/FISASCAT-CISL/UILTUCS-UIL,Aereo,PERSONALE DEGLI ISTITUTI ED IMPRESE DELLA VIGILANZA PRIVATA OPERANTE NEI SEDIMI AEROPORTUALI,4 ORE: DALLE 14.00 ALLE 18.00,Nazionale,null,21/06/2022,Italia,Tutte,21/06/2022 22:08,2022-07-17,2022-07-17
Effettuato,17/07/2022,17/07/2022,FILT-CGIL/FIT-CISL/UILT-UIL,Aereo,PERSONALE SOC. ENAV,4 ORE: DALLE 14.00 ALLE 18.00,Nazionale,null,25/06/2022,Italia,Tutte,25/06/2022 11:27,2022-07-17,2022-07-17
Effettuato,17/07/2022,17/07/2022,FILT-CGIL/UILT-UIL,Aereo,"PERSONALE DELLE COMPAGNIE AEREE RYANAIR LIMITED, MALTA AIR E CREWLINK",4 ORE: DALLE 14.00 ALLE 18.00,Nazionale,null,30/06/2022,Italia,Tutte,30/06/2022 16:11,2022-07-17,2022-07-17
Effettuato,17/07/2022,17/07/2022,FLAI TRASPORTI E SERVIZI,Aereo,LAVORATORI IMPRESE SERVIZI AEROPORTUALI DI HANDLING,4 ORE: DALLE 14.00 ALLE 18.00,Nazionale,null,03/07/2022,Italia,Tutte,04/07/2022 09:57,2022-07-17,2022-07-17
Effettuato,17/07/2022,17/07/2022,OSR FILT-CGIL/UILT-UIL/UGL TA/USB LAVORO PRIVATO,Aereo,PERSONALE SOCC. TOSCANA AEROPORTI E TOSCANA AEROPORTI HANDLING SCALI DI FIRENZE E PISA,4 ORE: DALLE 14.00 ALLE 18.00,Locale,SCIOPERO DELLO STRAORDINARIO DAL 5/7 AL 26/7,01/07/2022,Toscana,Tutte,02/07/2022 09:18,2022-07-17,2022-07-17
Effettuato,17/07/2022,17/07/2022,OSR FIT-CISL,Aereo,PERSONALE SOCC. TOSCANA AEROPORTI E TOSCANA AEROPORTI HANDLING SCALI DI FIRENZE E PISA,4 ORE: DALLE 14.00 ALLE 18.00,Locale,null,05/07/2022,Toscana,Tutte,05/07/2022 13:12,2022-07-17,2022-07-17
Effettuato,17/07/2022,17/07/2022,OST FIT-CISL,Aereo,PERSONALE SOC. ENAV APT BOLOGNA,4 ORE: DALLE 14.00 ALLE 18.00,Interregionale,null,27/06/2022,Emilia-Romagna,Tutte,27/06/2022 12:46,2022-07-17,2022-07-17
Effettuato,17/07/2022,17/07/2022,RSA FILT-CGIL/FIT-CISL,Aereo,PERSONALE SOC. ENAV ACC BRINDISI,4 ORE: DALLE 14.00 ALLE 18.00,Nazionale,null,17/06/2022,Italia,Tutte,17/06/2022 12:35,2022-07-17,2022-07-17
Effettuato,17/07/2022,17/07/2022,RSA UGL-TA,Aereo,PERSONALE SOC. ENAV ACC ROMA,4 ORE: DALLE 14.00 ALLE 18.00,Nazionale,null,18/06/2022,Italia,Tutte,18/06/2022 10:09,2022-07-17,2022-07-17
Effettuato,17/07/2022,17/07/2022,RSA UGL-TA,Aereo,"PERSONALE SOC. ENAV COMPARTO FPDIM DELLE SALE OPERATIVE ARO CBO ROMA E MILANO, E NOF ITALIA",4 ORE: DALLE 14.00 ALLE 18.00,Nazionale,null,04/07/2022,Italia,Tutte,04/07/2022 09:13,2022-07-17,2022-07-17
Effettuato,17/07/2022,17/07/2022,RSA UGL-TA,Aereo,PERSONALE SOC. ENAV APT NAPOLI CAPODICHINO,4 ORE: DALLE 14.00 ALLE 18.00,Interregionale,null,22/06/2022,Italia,Tutte,22/06/2022 19:22,2022-07-17,2022-07-17
Effettuato,17/07/2022,17/07/2022,RSA UGL-TA,Aereo,PERSONALE SOC. ENAV APT PERUGIA,4 ORE: DALLE 14.00 ALLE 18.00,Locale,null,30/05/2022,Umbria,Perugia,30/05/2022 13:00,2022-07-17,2022-07-17
"Revocato (include le azioni di revoca, sospensione e differimento)",17/07/2022,17/07/2022,RSA UGL-TA/UNICA,Aereo,PERSONALE SOC. ENAV ACC DI BRINDISI,4 ORE: DALLE 14.00 ALLE 18.00,Nazionale,SCIOPERO PRESTAZIONI STRAORDINARIE DALLE 00.01 DEL 5/7 ALLE 24.00 DEL 26/7,15/06/2022,Italia,Tutte,15/06/2022 21:14,2022-07-17,2022-07-17
Effettuato,17/07/2022,17/07/2022,RSA UGL-TA/UNICA,Aereo,PERSONALE SOC. ENAV ACC BRINDISI,4 ORE: DALLE 14.00 ALLE 18.00,Nazionale,null,21/06/2022,Italia,Tutte,21/06/2022 11:17,2022-07-17,2022-07-17
Effettuato,17/07/2022,17/07/2022,RSA UGL-TA/UNICA,Aereo,PERSONALE SOC. ENAV APT DI LAMEZIA TERME (CZ),4 ORE: DALLE 14.00 ALLE 18.00,Regionale,null,24/06/2022,Calabria,Tutte,24/06/2022 10:14,2022-07-17,2022-07-17
Effettuato,17/07/2022,17/07/2022,RSA UGL-TA/UNICA,Aereo,PERSONALE SOC. ENAV ACC MILANO,4 ORE: DALLE 14.00 ALLE 18.00,Nazionale,null,27/06/2022,Italia,Tutte,27/06/2022 18:16,2022-07-17,2022-07-17
Effettuato,17/07/2022,17/07/2022,RSA UGL-TA/UNICA,Aereo,PERSONALE SOC. ENAV APT DI ROMA CIAMPINO,4 ORE: DALLE 14.00 ALLE 18.00,Interregionale,null,30/06/2022,Italia,Tutte,30/06/2022 18:51,2022-07-17,2022-07-17
"Revocato (include le azioni di revoca, sospensione e differimento)",17/07/2022,17/07/2022,RSA UGL-TA/UNICA,Aereo,PERSONALE SOC. ENAV APT DI ROMA CIAMPINO,4 ORE: DALLE 14.00 ALLE 18.00,Interregionale,null,04/07/2022,Italia,Tutte,04/07/2022 09:30,2022-07-17,2022-07-17
Effettuato,17/07/2022,17/07/2022,RSA UILT-UIL,Aereo,PERSONALE SOC. ENAV ACC BRINDISI,4 ORE: DALLE 14.00 ALLE 18.00,Nazionale,null,27/05/2022,Italia,Tutte,27/05/2022 13:41,2022-07-17,2022-07-17
Effettuato,17/07/2022,17/07/2022,RSA UILT-UIL/UGL-TA/UNICA,Aereo,PERSONALE SOC. ENAV APT DI TORINO CASELLE,4 ORE: DALLE 14.00 ALLE 18.00,Interregionale,null,04/07/2022,Italia,Tutte,04/07/2022 09:19,2022-07-17,2022-07-17
Effettuato,17/07/2022,17/07/2022,RSA UNICA,Aereo,PERSONALE SOC. ENAV DEL C.A. DI BOLOGNA,4 ORE: DALLE 14.00 ALLE 18.00,Interregionale,null,15/06/2022,Emilia-Romagna,Tutte,15/06/2022 11:07,2022-07-17,2022-07-17
Effettuato,17/07/2022,17/07/2022,RSA UNICA,Aereo,PERSONALE SOC. ENAV ACC ROMA,4 ORE: DALLE 14.00 ALLE 18.00,Nazionale,null,20/06/2022,Italia,Tutte,20/06/2022 10:31,2022-07-17,2022-07-17
Effettuato,17/07/2022,17/07/2022,RSA UNICA,Aereo,PERSONALE SOC. ENAV ACC PADOVA,4 ORE: DALLE 14.00 ALLE 18.00,Nazionale,null,27/06/2022,Italia,Tutte,27/06/2022 09:14,2022-07-17,2022-07-17
Effettuato,17/07/2022,17/07/2022,RSA UNICA,Aereo,PERSONALE SOC. ENAV C.A. DI BRINDISI,4 ORE: DALLE 14.00 ALLE 18.00,Nazionale,null,05/07/2022,Italia,Tutte,05/07/2022 09:29,2022-07-17,2022-07-17
Effettuato,17/07/2022,17/07/2022,RSA UNICA,Aereo,PERSONALE SOC. ENAV C.A. DI PESCARA,4 ORE: DALLE 14.00 ALLE 18.00,Locale,null,31/05/2022,Abruzzo,Pescara,31/05/2022 10:52,2022-07-17,2022-07-17
Effettuato,17/07/2022,17/07/2022,RSU,Aereo,"PERSONALE SOC. TECHNO SKY CA MILANO LINATE, ACC MILANO,  MONTE SETTEPANI",14 ORE: DALLE 07.00 ALLE 21.00,Nazionale,ASTENSIONE LAVORO STRAORDINARIO E REPERIBILITA' DAL 5/7 AL 26/7,20/06/2022,Italia,Tutte,20/06/2022 10:58,2022-07-17,2022-07-17
Effettuato,17/07/2022,17/07/2022,UGL-TA,Aereo,PERSONALE SOC. ENAV,4 ORE: DALLE 14.00 ALLE 18.00,Nazionale,null,26/05/2022,Italia,Tutte,26/05/2022 11:59,2022-07-17,2022-07-17
Effettuato,17/07/2022,17/07/2022,UGL-TA,Aereo,PERSONALE SOC. ENAV APT BOLOGNA,4 ORE: DALLE 14.00 ALLE 18.00,Interregionale,null,30/05/2022,Italia,Tutte,30/05/2022 10:34,2022-07-17,2022-07-17
Effettuato,17/07/2022,17/07/2022,UILT-UIL,Aereo,PERSONALE SOC. EASYJET,4 ORE: DALLE 14.00 ALLE 18.00,Nazionale,null,30/06/2022,Italia,Tutte,30/06/2022 16:28,2022-07-17,2022-07-17
Effettuato,17/07/2022,17/07/2022,UILT-UIL,Aereo,PERSONALE SOC. VOLOTEA,4 ORE: DALLE 14.00 ALLE 18.00,Nazionale,null,30/06/2022,Italia,Tutte,30/06/2022 16:35,2022-07-17,2022-07-17
Effettuato,17/07/2022,17/07/2022,UNICA,Aereo,PERSONALE SOC. ENAV,4 ORE: DALLE 14.00 ALLE 18.00,Nazionale,SCIOPERO PRESTAZIONI STRAORDINARIE DALLE 00.01 DEL 5/7 ALLE 24.00 DEL 26/7,15/06/2022,Italia,Tutte,15/06/2022 10:48,2022-07-17,2022-07-17
Effettuato,17/07/2022,17/07/2022,USB LAVORO PRIVATO,Aereo,PERSONALE NAVIGANTE SOC. EASYJET,4 ORE: DALLE 14.00 ALLE 18.00,Nazionale,null,17/06/2022,Italia,Tutte,17/06/2022 14:59,2022-07-17,2022-07-17
Effettuato,17/07/2022,17/07/2022,USB LAVORO PRIVATO,Aereo,PERSONALE DIPENDENTE AZIENDE TRASPORTO AEREO E INDOTTO,4 ORE: DALLE 14.00 ALLE 18.00,Nazionale,ADESIONE O.S. ADL VARESE,04/07/2022,Italia,Tutte,04/07/2022 08:50,2022-07-17,2022-07-17
Effettuato,16/07/2022,17/07/2022,OSR FILT-CGIL/UGL FERROVIERI/ORSA FERROVIE,Ferroviario,PERSONALE DI MANOVRA SOC. TRENITALIA DIV. PASSEGGERI REGIONALE LIGURIA,24 ORE: DALLE 21.00 DEL 16/7 ALLE 20.59 DEL 17/7,Regionale,null,28/06/2022,Liguria,Tutte,30/06/2022 09:35,2022-07-16,2022-07-17
Effettuato,15/07/2022,16/07/2022,CMC,Ferroviario,PERSONALE DI MACCHINA SOC. MERCITALIA RAIL,24 ORE: DALLE 21.00 DEL 15/7 ALLE 21.00 DEL 16/7,Nazionale,null,16/06/2022,Italia,Tutte,16/06/2022 13:36,2022-07-15,2022-07-16
"Revocato (include le azioni di revoca, sospensione e differimento)",15/07/2022,16/07/2022,CMC,Ferroviario,PERSONALE DI MACCHINA SOC. MERCITALIA RAIL,24 ORE: DALLE 21.00 DEL 15/7 ALLE 21.00 DEL 16/7,Nazionale,null,10/05/2022,Italia,Tutte,10/05/2022 08:32,2022-07-15,2022-07-16
Effettuato,15/07/2022,16/07/2022,CUB TRASPORTI/SGB FERROVIE,Ferroviario,PERSONALE SOC. MERCITALIA RAIL,24 ORE: DALLE 21.00 DEL 15/7 ALLE 21.00 DEL 16/7,Nazionale,null,04/07/2022,Italia,Tutte,04/07/2022 20:43,2022-07-15,2022-07-16
Effettuato,15/07/2022,15/07/2022,RSA FILT-CGIL,Circolazione e sicurezza stradale,PERSONALE SOC. GSA SERVIZI PRIMO INTERVENTO E ANTINCENDIO PRESSO GALLERIE IV TRONCO AUTOSTRADALE A1,4 ORE: DALLE 11.00 ALLE 15.00,Territoriale,null,30/06/2022,Toscana,Firenze,30/06/2022 14:39,2022-07-15,2022-07-15
Effettuato,13/07/2022,13/07/2022,OSR FILT-CGIL/FIT-CISL/UILT-UIL/UGL AUTOFERRO,Trasporto pubblico locale,"PERSONALE SOC. AUTOGUIDOVIE DEI BACINI DI MILANO, PAVIA, CREMONA, MONZA BRIANZA",4 ORE: DALLE 18.00 ALLE 22.00,Regionale,ADESIONE OSR FAISA-CISAL,31/05/2022,Lombardia,Tutte,31/05/2022 14:40,2022-07-13,2022-07-13
Effettuato,13/07/2022,13/07/2022,OSR USB LAVORO PRIVATO,Trasporto pubblico locale,"PERSONALE SOC. AUTOGUIDOVIE DEI BACINI DI MILANO, PAVIA, CREMONA, MONZA BRIANZA",4 ORE: DALLE 18.00 ALLE 22.00,Regionale,null,02/07/2022,Lombardia,Tutte,02/07/2022 14:10,2022-07-13,2022-07-13
Effettuato,12/07/2022,12/07/2022,OSP COBAS LAVORO PRIVATO,Trasporto pubblico locale,PERSONALE SOC. AUTOLINEE TOSCANE,24 ORE VARIE MODALITA',Provinciale,null,28/06/2022,Toscana,Tutte,28/06/2022 14:30,2022-07-12,2022-07-12
Effettuato,12/07/2022,12/07/2022,OSR FILT-CGIL/FIT-CISL/UILT-UIL/UGL AUTOFERRO,Trasporto pubblico locale,PERSONALE SOC. ATM REGIONE MOLISE,4 ORE: DALLE 19.00 ALLE 23.00,Regionale,null,16/06/2022,Molise,Tutte,17/06/2022 09:40,2022-07-12,2022-07-12
Effettuato,12/07/2022,12/07/2022,OSR UGL AUTOFERRO/FAISA-CISAL,Trasporto pubblico locale,PERSONALE SOC. ATM REGIONE MOLISE,4 ORE: DALLE 19.00 ALLE 23.00,Regionale,null,14/06/2022,Molise,Tutte,14/06/2022 15:55,2022-07-12,2022-07-12
Effettuato,12/07/2022,12/07/2022,OSR USB LAVORO PRIVATO,Trasporto pubblico locale,PERSONALE SOC. SASA DI BOLZANO,24 ORE,Locale,null,20/06/2022,Trentino-Alto Adige,Bolzano,20/06/2022 11:46,2022-07-12,2022-07-12
Effettuato,11/07/2022,11/07/2022,OSR/OSP FAISA-CISAL,Trasporto pubblico locale,PERSONALE SOC. IAS SCURA DI CORIGLIANO-ROSSANO (CS),24 ORE,Locale,null,04/06/2022,Calabria,Cosenza,06/06/2022 09:50,2022-07-11,2022-07-11
Effettuato,11/07/2022,11/07/2022,OSR/OSP FAISA-CISAL + RSA,Trasporto pubblico locale,PERSONALE SOC. AMACO DI COSENZA,24 ORE,Locale,null,03/06/2022,Calabria,Cosenza,06/06/2022 09:49,2022-07-11,2022-07-11
"Revocato (include le azioni di revoca, sospensione e differimento)",10/07/2022,11/07/2022,OSR FILT-CGIL/FIT-CISL/UILT-UIL/ORSA FERROVIE + RSU/RSA 46,Ferroviario,PERSONALE MOBILE SOC. TRENITALIA TPER REGIONE EMILIA ROMAGNA,23 ORE: DALLE 3.31 DEL 10/7 ALLE 2.30 DELL'11/7,Regionale,null,11/06/2022,Emilia-Romagna,Tutte,11/06/2022 09:01,2022-07-10,2022-07-11
Effettuato,10/07/2022,11/07/2022,OSR FILT-CGIL/FIT-CISL/UILT-UIL/UGL/FAST/ORSA,Ferroviario,PERSONALE SOC. TRENITALIA SETTORE PRODUZIONE EQUIPAGGI DBR TOSCANA,23 ORE: DALLE 03.31 DEL 10/7 ALLE 02.30 DELL' 11/7,Regionale,null,20/05/2022,Toscana,Tutte,20/05/2022 18:43,2022-07-10,2022-07-11
Effettuato,10/07/2022,11/07/2022,OSR SLM-FAST-CONFSAL,Ferroviario,PERSONALE MOBILE SOC. TRENITALIA TPER REGIONE EMILIA ROMAGNA,23 ORE: DALLE 3.31 DEL 10/7 ALLE 2.30 DELL'11/7,Regionale,null,11/06/2022,Emilia-Romagna,Tutte,11/06/2022 19:38,2022-07-10,2022-07-11
Effettuato,10/07/2022,11/07/2022,RSA FAISA-CISAL,Ferroviario,PERSONALE MOBILE SOC. TRENITALIA TPER REGIONE EMILIA ROMAGNA,23 ORE: DALLE 3.31 DEL 10/7 ALLE 2.30 DELL'11/7,Regionale,null,11/06/2022,Emilia-Romagna,Tutte,11/06/2022 20:01,2022-07-10,2022-07-11
Effettuato,10/07/2022,11/07/2022,RSU 1A PDM/RSU 1B PDB,Ferroviario,PERSONALE MOBILE SOC. TRENORD REGIONE LOMBARDIA,23 ORE: DALLE 03.00 DEL 10/7 ALLE 02.00 DELL' 11/7,Regionale,ESCLUSO SERVIZIO LUNGA PERCORRENZA,30/05/2022,Lombardia,Tutte,30/05/2022 13:01,2022-07-10,2022-07-11
"Revocato (include le azioni di revoca, sospensione e differimento)",10/07/2022,10/07/2022,UGL-TA,Aereo,PERSONALE SOC. ENAV,4 ORE: DALLE 14.00 ALLE 18.00,Nazionale,null,26/05/2022,Italia,Tutte,26/05/2022 11:12,2022-07-10,2022-07-10
"Revocato (include le azioni di revoca, sospensione e differimento)",09/07/2022,09/07/2022,OSP FILT-CGIL/FIT-CISL/UILT-UIL/USB LAVORO PRIVATO + RSA,Trasporto pubblico locale,PERSONALE SOC. START ROMAGNA BACINO DI RAVENNA,24 ORE,Locale,null,27/05/2022,Emilia-Romagna,Ravenna,27/05/2022 00:41,2022-07-09,2022-07-09
Effettuato,09/07/2022,09/07/2022,OSR UGL AUTOFERRO,Trasporto pubblico locale,"PERSONALE DELLA SOC. START ROMAGNA DELLE PROVINCIE DI RIMINI, FORLI'-CESENA E RAVENNA",24 ORE,Territoriale,null,08/06/2022,Emilia-Romagna,Tutte,08/06/2022 11:06,2022-07-09,2022-07-09
"Revocato (include le azioni di revoca, sospensione e differimento)",08/07/2022,08/07/2022,FAISA-CONFAIL,Trasporto pubblico locale,PERSONALE ADDETTO AL TRASPORTO PUBBLICO LOCALE,4 ORE CON MODALITA' TERRITORIALI,Nazionale,null,21/06/2022,Italia,Tutte,21/06/2022 12:26,2022-07-08,2022-07-08
"Revocato (include le azioni di revoca, sospensione e differimento)",08/07/2022,09/07/2022,FIT-CISL,Elicotteri,SCIOPERO VIRTUALE PERSONALE SOC. BABCOCK MCS ITALIA DIV. ALA ROTANTE,24 ORE: DALLE 08.00 DELL' 8/7 ALLE 08.00 DEL 9/7,Nazionale,SCIOPERO VIRTUALE ART. 12 DEL. 12/461,20/06/2022,Italia,Tutte,20/06/2022 18:15,2022-07-08,2022-07-09
Effettuato,08/07/2022,08/07/2022,OSR FILT-CGIL,Ncc,PERSONALE SOC. AIRPULLMAN NOLEGGI DI SOMMA LOMBARDO (VA),4 ORE: DALLE 9.01 ALLE 13.00,Locale,null,16/06/2022,Lombardia,Varese,16/06/2022 09:30,2022-07-08,2022-07-08
Effettuato,08/07/2022,08/07/2022,OSR ORSA FERROVIE,Ferroviario,PERSONALE CSVD (CUSTOMER SERVICE E VENDITA DIRETTA) DELLA SOC. TRENITALIA REGIONE LOMBARDIA,1 ORA: DALLE 21.00 ALLE 22.00,Regionale,null,27/06/2022,Lombardia,Tutte,27/06/2022 17:38,2022-07-08,2022-07-08
Effettuato,05/07/2022,06/07/2022,FAST-CONFSAL/CONFARTIGIANATO TAXI/SATAM/TAM/USB-TAXI/UNICA FILT CGIL/UILTRASPORTI/CNA FITA TAXI/CLAAI/LEGACOOP PRODUZIONE E SERVIZI/URITAXI/UTI/UNIMPRESA/ORSA TRASPORTI/CASARTIGIANI/FIT-CISL/UGL,Taxi,FERMO NAZIONALE SERVIZIO TAXI,48 ORE: DALLE 00.00 DEL 5/7 ALLE 24.00 DEL 6/7,Nazionale,null,23/06/2022,Italia,Tutte,23/06/2022 10:22,2022-07-05,2022-07-06
Effettuato,05/07/2022,05/07/2022,OSP ADL,Aereo,"PERSONALE SOCC. DUSMANN SERVICE, SPD ADDETTO A PULIZIE AEROPORTO MILANO MALPENSA",24 ORE: DALLE 00.00 ALLE 24.00,Nazionale,null,21/06/2022,Italia,Tutte,21/06/2022 15:46,2022-07-05,2022-07-05
Effettuato,05/07/2022,05/07/2022,OSP FILT-CGIL/FIT-CISL/UILT-UIL/UGL/FAISA-CISAL,Trasporto pubblico locale,PERSONALE SOC. AMTS DI CATANIA,4 ORE: DALLE 12.00 ALLE 16.00,Locale,ADESIONE DELLA OSP ORSA TPL,06/06/2022,Sicilia,Catania,06/06/2022 20:46,2022-07-05,2022-07-05
Effettuato,05/07/2022,05/07/2022,RSU,Trasporto pubblico locale,PERSONALE SOC. GTT DI TORINO SETTORE VIAGGIANTE URBANO,4 ORE: DALLE 18.00 ALLE 22.00,Locale,null,17/06/2022,Piemonte,Torino,17/06/2022 16:36,2022-07-05,2022-07-05
Effettuato,05/07/2022,06/07/2022,SILT,Taxi,FERMO NAZIONALE SERVIZIO TAXI,48 ORE: DALLE 00.00 DEL 5/7 ALLE 24.00 DEL 6/7,Nazionale,null,24/06/2022,Italia,Tutte,27/06/2022 08:34,2022-07-05,2022-07-06
"Revocato (include le azioni di revoca, sospensione e differimento)",03/07/2022,04/07/2022,RSU 1A PDM/RSU 1B PDB,Ferroviario,PERSONALE MOBILE SOC. TRENORD REGIONE LOMBARDIA,23 ORE: DALLE 03.00 DEL 3/7 ALLE 02.00 DEL 4/7,Regionale,ESCLUSO SERVIZIO LUNGA PERCORRENZA,24/05/2022,Lombardia,Tutte,24/05/2022 14:14,2022-07-03,2022-07-04
"Revocato (include le azioni di revoca, sospensione e differimento)",30/06/2022,30/06/2022,RSU,Trasporto pubblico locale,PERSONALE SOC. GTT DI TORINO SETTORE VIAGGIANTE URBANO,4 ORE: DALLE 18.00 ALLE 22.00,Locale,null,16/06/2022,Piemonte,Torino,16/06/2022 16:19,2022-06-30,2022-06-30
"Revocato (include le azioni di revoca, sospensione e differimento)",27/06/2022,27/06/2022,CUB TRASPORTI,Aereo,PERSONALE SOCC. ALITALIA SAI IN A.S. E ITA AIRWAYS,24 ORE: DALLE 00.01 ALLE 23.59,Nazionale,null,14/06/2022,Italia,Tutte,14/06/2022 23:25,2022-06-27,2022-06-27
Effettuato,25/06/2022,25/06/2022,FILT-CGIL/UILT-UIL,Aereo,"PERSONALE DELLE COMPAGNIE AEREE RYANAIR LIMITED, MALTA AIR E CREWLINK",24 ORE,Nazionale,null,13/06/2022,Italia,Tutte,13/06/2022 14:57,2022-06-25,2022-06-25
Effettuato,25/06/2022,25/06/2022,OSP FAISA-CISAL,Trasporto pubblico locale,PERSONALE SOC. BUSITALIA VENETO DI PADOVA,24 ORE,Locale,null,13/06/2022,Veneto,Padova,14/06/2022 22:46,2022-06-25,2022-06-25
Effettuato,25/06/2022,25/06/2022,OSR FILT-CGIL/UILT-UIL/UGL TA/USB LAVORO PRIVATO,Aereo,PERSONALE SOCC. TOSCANA AEROPORTI E TOSCANA AEROPORTI HANDLING SCALI DI FIRENZE E PISA,4 ORE: DALLE 11.00 ALLE 15.00,Locale,null,01/06/2022,Toscana,Tutte,01/06/2022 12:26,2022-06-25,2022-06-25
Effettuato,25/06/2022,25/06/2022,OSR FIT-CISL,Aereo,PERSONALE SOCC. TOSCANA AEROPORTI E TOSCANA AEROPORTI HANDLING SCALI DI FIRENZE E PISA,4 ORE: DALLE 11.00 ALLE 15.00,Locale,null,01/06/2022,Toscana,Firenze,01/06/2022 14:50,2022-06-25,2022-06-25
Effettuato,25/06/2022,25/06/2022,OSR FIT-CISL,Aereo,PERSONALE AEROPORTUALE SOC. AVIATION SERVICES DI VENEZIA,4 ORE: DALLE 10.00 ALLE 14.00,Interregionale,null,07/06/2022,Italia,Tutte,07/06/2022 08:50,2022-06-25,2022-06-25
Effettuato,25/06/2022,25/06/2022,UILT-UIL,Aereo,PERSONALE SOC. EASYJET,24 ORE,Nazionale,null,13/06/2022,Italia,Tutte,13/06/2022 14:49,2022-06-25,2022-06-25
Effettuato,25/06/2022,25/06/2022,UILT-UIL,Aereo,PERSONALE SOC. VOLOTEA,24 ORE,Nazionale,null,13/06/2022,Italia,Tutte,13/06/2022 14:53,2022-06-25,2022-06-25
"Revocato (include le azioni di revoca, sospensione e differimento)",25/06/2022,25/06/2022,USB LAVORO PRIVATO,Aereo,PERSONALE  SOC. EASYJET,24 ORE: DALLE 00.00 ALLE 23.59,Nazionale,null,13/06/2022,Italia,Tutte,14/06/2022 21:31,2022-06-25,2022-06-25
Effettuato,24/06/2022,24/06/2022,OSR CNAL TRASPORTI,Aereo,PERSONALE SOC. GESAC AEROPORTO NAPOLI CAPODICHINO,4 ORE: DALLE 12.00 ALLE 16.00,Interregionale,null,05/05/2022,Italia,Tutte,05/05/2022 10:10,2022-06-24,2022-06-24
"Revocato (include le azioni di revoca, sospensione e differimento)",24/06/2022,24/06/2022,RSU,Trasporto pubblico locale,PERSONALE SOC. GTT DI TORINO SETTORE VIAGGIANTE URBANO,4 ORE: DALLE 18.00 ALLE 22.00,Locale,null,13/06/2022,Piemonte,Torino,13/06/2022 20:25,2022-06-24,2022-06-24
Effettuato,23/06/2022,23/06/2022,OSR FILT-CGIL/FIT-CISL/UILT-UIL/UGL/FAST/FAISA-CISAL/ORSA FERROVIE,Ferroviario,PERSONALE SOC. TRENORD REGIONE LOMBARDIA,2 ORE: DALLE 10.00 ALLE 12.00,Regionale,null,22/06/2022,Lombardia,Tutte,22/06/2022 13:07,2022-06-23,2022-06-23
"Revocato (include le azioni di revoca, sospensione e differimento)",22/06/2022,22/06/2022,OSP FILT-CGIL/FIT-CISL/FAISA-CISAL,Trasporto pubblico locale,PERSONALE SOC. AUTOGUIDOVIE BACINO DI PAVIA,24 ORE,Territoriale,null,20/04/2022,Lombardia,Pavia,20/04/2022 11:14,2022-06-22,2022-06-22
"Revocato (include le azioni di revoca, sospensione e differimento)",22/06/2022,22/06/2022,OST FILT-CGIL/FIT-CISL,Trasporto pubblico locale,PERSONALE SOC. STP DI BARI,4 ORE: DALLE 8.30 ALLE 12.30,Locale,null,20/05/2022,Puglia,Bari,20/05/2022 12:24,2022-06-22,2022-06-22
Effettuato,22/06/2022,22/06/2022,OST FILT-CGIL/FIT-CISL/FAISA-CISAL,Trasporto pubblico locale,PERSONALE SOC. AUTOGUIDOVIE BACINO DI PAVIA,24 ORE,Territoriale,null,10/05/2022,Lombardia,Pavia,10/05/2022 18:43,2022-06-22,2022-06-22
Effettuato,22/06/2022,22/06/2022,OST UILT-UIL,Aereo,PERSONALE DI TERRA DEL TRASPORTO AEREO E DELLE ATTIVITA' AEROPORTUALI DELL'AEROPORTO DI COMISO (RG),INTERA GIORNATA,Provinciale,null,10/06/2022,Sicilia,Ragusa,10/06/2022 08:48,2022-06-22,2022-06-22
"Revocato (include le azioni di revoca, sospensione e differimento)",20/06/2022,20/06/2022,OSP FILT-CGIL/FIT-CISL/UILT-UIL/UGL-FNA/CONFAIL,Trasporto pubblico locale,PERSONALE SOC. AMACO DI COSENZA,4 ORE: DALLE 10.00 ALLE 14.00,Locale,null,05/05/2022,Calabria,Cosenza,05/05/2022 15:07,2022-06-20,2022-06-20
"Revocato (include le azioni di revoca, sospensione e differimento)",20/06/2022,20/06/2022,OSR FILT-CGIL/FILT-CGIL/UILT-UIL,Ferroviario,PERSONALE SOC. TRENITALIA OMC DELL'EMILIA ROMAGNA (EX OGR COMPONENTI DI BOLOGNA),8 ORE: DALLE 9.01 ALLE 16.59,Provinciale,null,28/03/2022,Emilia-Romagna,Modena,28/03/2022 13:33,2022-06-20,2022-06-20
"Revocato (include le azioni di revoca, sospensione e differimento)",20/06/2022,20/06/2022,OSR USB LAVORO PRIVATO,Trasporto pubblico locale,PERSONALE SOC. BUSITALIA SITA NORD REGIONE UMBRIA,24 ORE,Regionale,null,25/05/2022,Umbria,Tutte,25/05/2022 17:23,2022-06-20,2022-06-20
"Revocato (include le azioni di revoca, sospensione e differimento)",20/06/2022,20/06/2022,OSR/OSP USB LAVORO PRIVATO/ORSA TPL,Trasporto pubblico locale,PERSONALE SOC. ATAC DI ROMA,4 ORE: DALLE 20.30 ALLE 00.30,Locale,null,23/05/2022,Lazio,Roma,23/05/2022 21:58,2022-06-20,2022-06-20
Effettuato,20/06/2022,20/06/2022,OST FILT-CGIL/FIT-CISL/UILT-UIL/UGL/FAISA-CISAL,Trasporto pubblico locale,PERSONALE SOC. MOVIBUS DI S. VITTORE OLONA (MI),4 ORE: DALLE 16.30 ALLE 20.30,Territoriale,null,29/04/2022,Lombardia,Milano,29/04/2022 13:01,2022-06-20,2022-06-20
"Revocato (include le azioni di revoca, sospensione e differimento)",18/06/2022,18/06/2022,OST COBAS LAVORO PRIVATO,Trasporto pubblico locale,PERSONALE DELLA SOC. BRESCIA TRASPORTI DI BRESCIA,4 ORE: DALLE 17.40 ALLE 21.40,Locale,null,24/05/2022,Lombardia,Brescia,24/05/2022 07:30,2022-06-18,2022-06-18
Effettuato,17/06/2022,17/06/2022,AL-COBAS/CUB-PI/FAO/LMO/SGC/SLAIPROLCOBAS/SOA,Plurisettoriale,SCIOPERO GENERALE DEI SETTORI DEI TRASPORTI,"24 ORE: FERROV. DA 21.00 DEL 16/6 A 21.00 DEL 17/6; TPL 24 ORE CON MODALITA' TERRITORIALI; MARITTIMO ISOLE MAGGIORI 24 ORE DA 1 ORA PRIMA PARTENZA, ISOLE MINORI 00.01-24.00; AUTOSTRADE DA 22.00 DEL 16/6 A 22.00 DEL 17/6",Nazionale,ESCLUSO SETTORE TRASPORTO AEREO - ADESIONE DELLA O.S. CAT TRIESTE,13/05/2022,Italia,Tutte,13/05/2022 14:46,2022-06-17,2022-06-17
Effettuato,17/06/2022,17/06/2022,OSP ADL,Aereo,"PERSONALE SOCC. DUSMANN SERVICE, SPD ADDETTO A PULIZIE AEROPORTO MILANO MALPENSA",4 ORE: DALLE 12.00 ALLE 16.00,Nazionale,null,31/05/2022,Italia,Tutte,31/05/2022 09:58,2022-06-17,2022-06-17
Effettuato,17/06/2022,17/06/2022,OSR ORSA FERROVIE,Ferroviario,PERSONALE SOC. RFI CIRCOLAZIONE AREA MILANO,8 ORE: DALLE 9.01 ALLE 17.00,Locale,null,29/04/2022,Lombardia,Milano,29/04/2022 14:17,2022-06-17,2022-06-17
Effettuato,17/06/2022,17/06/2022,OSR ORSA TRASPORTI,Trasporto pubblico locale,PERSONALE SOC. EAV DI NAPOLI,4 ORE: DALLE 9.00 ALLE 13.00,Locale,null,05/06/2022,Campania,Napoli,05/06/2022 19:03,2022-06-17,2022-06-17
