stato,inizio,fine,sindacati,settore,categoria,modalita,rilevanza,note,data_proclamazione,regione,provincia,data_ricezione,inizio_iso,fine_iso
"Revocato (include le azioni di revoca, sospensione e differimento)",15/12/2025,16/12/2025,FEDERMAR-CISAL/UGL MARE/USB,Marittimo,PERSONALE IMPRESE SETTORE MARITTIMO E PORTUALE ASSOCIATE AD ASSARMATORI E CONFITARMA,24 ORE: DALLE 17.00 DEL 15/12 ALLE 16.59 DEL 16/12,Nazionale,null,19/09/2025,Italia,Tutte,19/09/2025 13:34,2025-12-15,2025-12-16
In Programma,01/12/2025,01/12/2025,OSP UGL-TA,Aereo,PERSONALE SOC. ASC HANDLING AEROPORTO DI CATANIA FONTANAROSSA,4 ORE: DALLE 10.30 ALLE 14.30,Interregionale,null,29/09/2025,Italia,Tutte,29/09/2025 18:34,2025-12-01,2025-12-01
In Programma,15/11/2025,15/11/2025,CONFIAL-TRASPORTI,Trasporto pubblico locale,PERSONALE SOC. AUTOGUIDOVIE REGIONE LOMBARDIA CON INTERESSAMENTO DELL'AREA DI BOLOGNA,4 ORE: DALLE 18.00 ALLE 22.00,Regionale,null,01/10/2025,Lombardia,Tutte,01/10/2025 14:10,2025-11-15,2025-11-15
In Programma,14/11/2025,14/11/2025,ASTRA,Aereo,PERSONALE SOC. ENAV,4 ORE: DALLE 13.00 ALLE 17.00,Nazionale,null,09/09/2025,Italia,Tutte,09/09/2025 19:42,2025-11-14,2025-11-14
In Programma,14/11/2025,14/11/2025,FLAI TRASPORTI E SERVIZI,Aereo,PERSONALE AZIENDE HANDLING ASSOCIATE ASSOHANDLERS OPERANTI NEI SEDIMI AEROPORTUALI ITALIANI,24 ORE,Nazionale,null,01/10/2025,Italia,Tutte,01/10/2025 19:47,2025-11-14,2025-11-14
"Revocato (include le azioni di revoca, sospensione e differimento)",14/11/2025,14/11/2025,OSR FILT-CGIL/FIT-CISL/UILT-UIL/UGL T.A.,Aereo,PERSONALE SOC. GESAP AEROPORTO DI PALERMO,24 ORE: DALLE 00.00 ALLE 23.59,Interregionale,null,05/09/2025,Sicilia,Tutte,05/09/2025 13:49,2025-11-14,2025-11-14
In Programma,07/11/2025,07/11/2025,OSP CUB TRASPORTI,Trasporto pubblico locale,PERSONALE SOC. AMAT DI PALERMO,24 ORE,Locale,null,03/10/2025,Sicilia,Palermo,03/10/2025 15:36,2025-11-07,2025-11-07
"Revocato (include le azioni di revoca, sospensione e differimento)",31/10/2025,31/10/2025,OSP CUB TRASPORTI,Trasporto pubblico locale,PERSONALE SOC. AMAT DI PALERMO,24 ORE,Locale,null,01/10/2025,Sicilia,Palermo,01/10/2025 14:49,2025-10-31,2025-10-31
In Programma,29/10/2025,29/10/2025,FLAI TRASPORTI E SERVIZI,Aereo,PERSONALE SOC. AIRPORT HANDLING AEROPORTI DI MILANO LINATE E MALPENSA,24 ORE,Nazionale,null,01/10/2025,Italia,Tutte,02/10/2025 09:07,2025-10-29,2025-10-29
In Programma,29/10/2025,29/10/2025,OSP FILT-CGIL,Aereo,PERSONALE SOC. SWISSPORT ITALIA AEROPORTO DI MILANO LINATE,24 ORE,Nazionale,null,03/09/2025,Italia,Tutte,03/09/2025 10:22,2025-10-29,2025-10-29
In Programma,29/10/2025,29/10/2025,OSR CUB TRASPORTI,Aereo,PERSONALE SOC. CONSULTA OPERANTE PRESSO GLI AEROPORTI DI PISA E FIRENZE,24 ORE: DALLE 00.00 ALLE 23.59,Regionale,null,25/09/2025,Toscana,Tutte,26/09/2025 15:14,2025-10-29,2025-10-29
"Revocato (include le azioni di revoca, sospensione e differimento)",29/10/2025,29/10/2025,OSR FILT-CGIL/FIT-CISL/UILT-UIL/UGL-TA,Aereo,PERSONALE SOC. AIRPORT HANDLING AEROPORTI DI MILANO LINATE E MALPENSA,24 ORE,Nazionale,null,29/09/2025,Italia,Tutte,29/09/2025 14:27,2025-10-29,2025-10-29
In Programma,29/10/2025,29/10/2025,OSR FILT-CGIL/FIT-CISL/UILT-UIL/UGL-TA,Aereo,PERSONALE SOC. AIRPORT HANDLING AEROPORTI DI MILANO LINATE E MALPENSA,24 ORE,Nazionale,null,30/09/2025,Italia,Tutte,30/09/2025 10:09,2025-10-29,2025-10-29
In Programma,29/10/2025,29/10/2025,OSR FILT-CGIL/FIT-CISL/UILT-UIL/UGL-TA/USB,Aereo,PERSONALE SOC. CONSULTA OPERANTE PRESSO GLI AEROPORTI DI PISA E FIRENZE,24 ORE: DALLE 00.00 ALLE 23.59,Regionale,null,25/09/2025,Toscana,Tutte,25/09/2025 12:59,2025-10-29,2025-10-29
In Programma,29/10/2025,29/10/2025,OST CUB TRASPORTI,Aereo,PERSONALE SOC. AIRPORT HANDLING AEROPORTI DI MILANO LINATE E MALPENSA,24 ORE: DALLE 00.00 ALLE 23.59,Nazionale,null,30/09/2025,Italia,Tutte,30/09/2025 11:53,2025-10-29,2025-10-29
In Programma,29/10/2025,29/10/2025,OST CUB TRASPORTI,Aereo,PERSONALE SOC. ALHA AEROPORTO DI MILANO MALPENSA,24 ORE: DALLE 00.00 ALLE 23.59,Nazionale,null,30/09/2025,Italia,Tutte,30/09/2025 11:56,2025-10-29,2025-10-29
In Programma,29/10/2025,29/10/2025,OST CUB TRASPORTI,Aereo,PERSONALE SOC. MLE AEROPORTO DI MILANO MALPENSA,24 ORE: DALLE 00.00 ALLE 23.59,Nazionale,null,30/09/2025,Italia,Tutte,30/09/2025 11:56,2025-10-29,2025-10-29
In Programma,29/10/2025,29/10/2025,OST FIT-CISL,Aereo,PERSONALE SOC. SWISSPORT ITALIA AEROPORTO DI MILANO LINATE,24 ORE,Nazionale,null,12/09/2025,Italia,Tutte,12/09/2025 14:58,2025-10-29,2025-10-29
In Programma,29/10/2025,29/10/2025,UILT-UIL,Aereo,PERSONALE SOC. SWISSPORT ITALIA AEROPORTO DI MILANO LINATE,24 ORE,Nazionale,null,02/09/2025,Italia,Tutte,02/09/2025 17:41,2025-10-29,2025-10-29
In Programma,29/10/2025,29/10/2025,UILT-UIL,Aereo,PERSONALE SOC. VOLOTEA,24  ORE,Nazionale,null,01/10/2025,Italia,Tutte,01/10/2025 09:54,2025-10-29,2025-10-29
In Programma,24/10/2025,25/10/2025,FEDERMAR-CISAL/UGL MARE/USB,Marittimo,PERSONALE MARITTIMO ED AMMINISTRATIVO SOCIETA' DI NAVIGAZIONE TIRRENIA CIN E MOBY,24 ORE: DALLE 15.30 DEL 24/10 ALLE 15.29 DEL 25/10,Nazionale,null,02/10/2025,Italia,Tutte,02/10/2025 22:17,2025-10-24,2025-10-25
In Programma,21/10/2025,21/10/2025,ASSEMBLEA NAZIONALE  LAVORATORI MANUTENZIONE INFRASTRUTTURA RFI,Ferroviario,PERSONALE SOC. RFI IMPIANTI MANUTENZIONE INFRASTRUTTURE,24 ORE,Nazionale,ASTENSIONE DAL LAVORO STRAORDINARIO DAL 29/9 AL 28/10/2025,08/09/2025,Italia,Tutte,08/09/2025 00:01,2025-10-21,2025-10-21
In Programma,21/10/2025,21/10/2025,COBAS LAVORO PRIVATO/COORDINAMENTO FERROVIERI,Ferroviario,PERSONALE SOC. RFI IMPIANTI MANUTENZIONE INFRASTRUTTURE,24 ORE,Nazionale,ASTENSIONE DAL LAVORO STRAORDINARIO DAL 29/9 AL 28/10/2025,08/09/2025,Italia,Tutte,08/09/2025 17:02,2025-10-21,2025-10-21
In Programma,20/10/2025,20/10/2025,OST UILT-UIL/UGL-FNA,Trasporto pubblico locale,PERSONALE SOC. PAOLO SCOPPIO E FIGLIO AUTOLINEE DI BARI,24 ORE,Locale,null,25/09/2025,Puglia,Bari,25/09/2025 13:50,2025-10-20,2025-10-20
In Programma,18/10/2025,18/10/2025,OSP CUB TRASPORTI,Trasporto pubblico locale,PERSONALE SOC. AMTS DI CATANIA,24 ORE,Locale,"ASTENSIONE DAL LAVORO STRAORDINARIO DAL 13 AL 17/10/2025, DAL 19 AL 29/10/2025 E DAL 6 AL 18/11/2025",01/10/2025,Sicilia,Catania,01/10/2025 22:29,2025-10-18,2025-10-18
In Programma,17/10/2025,17/10/2025,A.L. COBAS,Trasporto pubblico locale,PERSONALE SOC. NET (NORD EST TRASPORTI) DI MONZA  E TREZZO SULL'ADDA,24 ORE,Locale,null,24/09/2025,Lombardia,Monza e Brianza,24/09/2025 15:23,2025-10-17,2025-10-17
In Programma,17/10/2025,18/10/2025,FILT-CGIL/FIT-CISL/UILT-UIL/UGL/FAST/ORSA TRASPORTI,Appalti ferroviari,PERSONALE SOC. ELIOR DIV. POLARIS ADDETTO A SERVIZI ACCOGLIENZA E ACCOMPAGNAMENTO TRENI NOTTE INTERCITY DELLA SOC. TRENITALIA,INTERO TURNO DI LAVORO ( TRA LE 16.00 DEL 17/10 E LE 15.59 DEL 18/10 ),Nazionale,null,02/10/2025,Italia,Tutte,02/10/2025 13:51,2025-10-17,2025-10-18
In Programma,17/10/2025,17/10/2025,OSR CUB TRASPORTI,Trasporto pubblico locale,PERSONALE SOC. AMT DI GENOVA,4 ORE: DALLE 11.30 ALLE 15.30,Territoriale,null,20/09/2025,Liguria,Genova,22/09/2025 12:59,2025-10-17,2025-10-17
In Programma,16/10/2025,16/10/2025,RSA UILT-UIL,Trasporto pubblico locale,"PERSONALE SOCC. ATI FIDENTE, MIORELLI, B & B APPALTO PULIZIA E MANOVRA PRESSO SOC. AMT DI GENOVA",4 ORE: DALLE 11.00 ALLE 15.00,Locale,null,24/09/2025,Liguria,Genova,03/10/2025 10:00,2025-10-16,2025-10-16
In Programma,15/10/2025,15/10/2025,OST CUB TRASPORTI,Trasporto pubblico locale,PERSONALE SOC. ATC DI LA SPEZIA,24 ORE,Locale,null,20/09/2025,Liguria,La Spezia,22/09/2025 12:47,2025-10-15,2025-10-15
In Programma,14/10/2025,14/10/2025,FEDERTAXI-CISAL/FAST-CONFSAL-TAXI/SITAN-ATN/ORSA-TAXI/TASSISTI DI BASE/CONFAIL/UGL-TAXI/UNIMPRESA MOBILITA'/URITAXI/UTI,Taxi,ADDETTI AL SERVIZIO TAXI TERRITORIO COMUNALE DI NAPOLI,13 ORE E 30': DALLE 08.30 ALLE 22.00,Locale,null,29/09/2025,Campania,Napoli,29/09/2025 13:57,2025-10-14,2025-10-14
In Programma,14/10/2025,15/10/2025,OSR ORSA FERROVIE,Trasporto merci,PERSONALE SOC. SBB CARGO ITALIA REGIONE LOMBARDIA,8 ORE: DALLE 21.00 DEL 14/10 ALLE 04.59 DEL 15/10,Regionale,null,03/10/2025,Lombardia,Tutte,03/10/2025 14:17,2025-10-14,2025-10-15
In Programma,13/10/2025,13/10/2025,FAST-CONFSAL,Aereo,PERSONALE SOC. ADR - AEROPORTI DI ROMA (FIUMICINO E CIAMPINO),4 ORE: DALLE 12.00 ALLE 16.00,Nazionale,GARANTITI I VOLI DA E PER GLI AEROPORTI DELLA REGIONE TOSCANA,08/08/2025,Italia,Tutte,08/08/2025 13:24,2025-10-13,2025-10-13
In Programma,13/10/2025,13/10/2025,OSP FAISA-CONFAIL,Trasporto pubblico locale,"PERSONALE DIVISIONE FERRO, PERSONALE VIAGGIANTE, LINEE VESUVIANE SOC. EAV DI NAPOLI",4 ORE: DALLE 08.30 ALLE 12.30,Locale,null,30/09/2025,Campania,Napoli,30/09/2025 10:10,2025-10-13,2025-10-13
"Revocato (include le azioni di revoca, sospensione e differimento)",13/10/2025,13/10/2025,OSR CUB TRASPORTI,Aereo,PERSONALE SOC. CONSULTA OPERANTE PRESSO GLI AEROPORTI DI PISA E FIRENZE,24 ORE: DALLE 00.00 ALLE 23.59,Regionale,null,16/09/2025,Toscana,Tutte,17/09/2025 21:03,2025-10-13,2025-10-13
"Revocato (include le azioni di revoca, sospensione e differimento)",13/10/2025,13/10/2025,OSR FILT-CGIL/FIT-CISL/UILT-UIL/UGL-TA/USB,Aereo,PERSONALE SOC. CONSULTA OPERANTE PRESSO GLI AEROPORTI DI PISA E FIRENZE,24 ORE: DALLE 00.00 ALLE 23.59,Regionale,null,16/09/2025,Toscana,Tutte,17/09/2025 12:48,2025-10-13,2025-10-13
"Revocato (include le azioni di revoca, sospensione e differimento)",11/10/2025,11/10/2025,CONFIAL-TRASPORTI,Trasporto pubblico locale,PERSONALE SOC. AUTOGUIDOVIE REGIONE LOMBARDIA CON INTERESSAMENTO DELL'AREA DI BOLOGNA,4 ORE: DALLE 18.00 ALLE 22.00,Regionale,null,30/09/2025,Lombardia,Tutte,30/09/2025 13:33,2025-10-11,2025-10-11
"Revocato (include le azioni di revoca, sospensione e differimento)",10/10/2025,10/10/2025,ASSEMBLEA NAZIONALE  LAVORATORI MANUTENZIONE INFRASTRUTTURA RFI,Ferroviario,PERSONALE SOC. RFI IMPIANTI MANUTENZIONE INFRASTRUTTURE,24 ORE,Nazionale,ASTENSIONE DAL LAVORO STRAORDINARIO DAL 29/9 AL 28/10/2025,06/09/2025,Italia,Tutte,06/09/2025 00:01,2025-10-10,2025-10-10
"Revocato (include le azioni di revoca, sospensione e differimento)",10/10/2025,10/10/2025,COBAS LAVORO PRIVATO/COORDINAMENTO FERROVIERI,Ferroviario,PERSONALE SOC. RFI IMPIANTI MANUTENZIONE INFRASTRUTTURE,24 ORE,Nazionale,ASTENSIONE DAL LAVORO STRAORDINARIO DAL 29/9 AL 28/10/2025,06/09/2025,Italia,Tutte,06/09/2025 00:10,2025-10-10,2025-10-10
"Revocato (include le azioni di revoca, sospensione e differimento)",10/10/2025,10/10/2025,OSP FAISA-CONFAIL,Trasporto pubblico locale,"PERSONALE DIVISIONE FERRO, PERSONALE VIAGGIANTE, LINEE VESUVIANE SOC. EAV DI NAPOLI",4 ORE: DALLE 08.30 ALLE 12.30,Locale,null,29/09/2025,Campania,Napoli,29/09/2025 14:10,2025-10-10,2025-10-10
In Programma,10/10/2025,10/10/2025,OSR SUL,Trasporto pubblico locale,PERSONALE SOC. ATAC DI ROMA,24 ORE,Locale,null,09/09/2025,Lazio,Roma,09/09/2025 16:30,2025-10-10,2025-10-10
In Programma,10/10/2025,10/10/2025,OSR USB LAVORO PRIVATO/ORSA TPL,Trasporto pubblico locale,PERSONALE SOC. ATAC DI ROMA,4 ORE: DALLE 8.30 ALLE 12.30,Locale,null,12/09/2025,Lazio,Roma,12/09/2025 09:58,2025-10-10,2025-10-10
In Programma,08/10/2025,08/10/2025,OSR UILT-UIL/UGL FERROVIERI/SALPAS-ORSA FERROVIE/FAST-CONFSAL,Appalti ferroviari,PERSONALE APPALTI FERROVIARI DELLA SOC. COOPSERVICE SCDP C/O SOC. TRENITALIA REGIONE LAZIO,4 ORE: PRIMA META' DEL TURNO,Regionale,null,16/09/2025,Lazio,Tutte,16/09/2025 20:29,2025-10-08,2025-10-08
In Programma,07/10/2025,07/10/2025,OSR USB LAVORO PRIVATO,Trasporto pubblico locale,PERSONALE SOC. BUSITALIA SITA NORD REGIONE UMBRIA,24 ORE: VARIE MODALITA',Regionale,null,31/07/2025,Umbria,Tutte,31/07/2025 14:33,2025-10-07,2025-10-07
In Programma,06/10/2025,06/10/2025,OSP FILT-CGIL/UILT-UIL/UGL-FNA,Trasporto pubblico locale,PERSONALE SOC. CSC MOBILITA' DI LATINA,24 ORE,Locale,null,12/09/2025,Lazio,Latina,12/09/2025 10:28,2025-10-06,2025-10-06
In Programma,06/10/2025,06/10/2025,RSA UGL AUTOFERRO,Trasporto pubblico locale,"PERSONALE SOCC. ATI FIDENTE, MIORELLI, B & B SERVICE APPALTO PULIZIA E MANOVRA PRESSO SOC. AMT DI GENOVA",4 ORE: DALLE 11.30 ALLE 15.30,Locale,null,12/09/2025,Liguria,Genova,12/09/2025 16:18,2025-10-06,2025-10-06
"Revocato (include le azioni di revoca, sospensione e differimento)",04/10/2025,04/10/2025,OSR ORSA TRASPORTI AUTOFERRO TPL,Trasporto pubblico locale,PERSONALE SOC. EAV DI NAPOLI,4 ORE: DALLE 19.40 ALLE 23.40,Locale,null,17/08/2025,Campania,Napoli,17/08/2025 12:24,2025-10-04,2025-10-04
Effettuato,03/10/2025,03/10/2025,CGIL,Generale,SCIOPERO GENERALE SETTORI PUBBLICI E PRIVATI,"INTERA GIORNATA - AEREO: DALLE 00.01 ALLE 24.00; FERROVIARIO: DALLE 21.00 DEL 2/10 ALLE 20.59 DEL 3/10; TPL, TAXI, MARITTIMO, CIRCOLAZIONE E SICUREZZA STRADALE: VARIE MODALITA'",Nazionale,"ART. 2, CO. 7 L. 146/90 E S.M.I. - ADESIONE O.S. CSS",01/10/2025,Italia,Tutte,02/10/2025 09:45,2025-10-03,2025-10-03
Effettuato,03/10/2025,03/10/2025,CIB UNICOBAS,Generale,SCIOPERO GENERALE SETTORI PUBBLICI E PRIVATI,"INTERA GIORNATA - ESCLUSI TUTTI I TIPI DI TRASPORTI, DI TERRA, CIELO E MARE, PUBBLICI E PRIVATI",Nazionale,"ART. 2, CO. 7 L. 146/90 E S.M.I. - ESCLUSI TUTTI I TIPI DI TRASPORTI, DI TERRA, CIELO E MARE, PUBBLICI E PRIVATI",01/10/2025,Italia,Tutte,02/10/2025 11:58,2025-10-03,2025-10-03
Effettuato,03/10/2025,03/10/2025,CUB/SGB,Generale,SCIOPERO GENERALE SETTORI PUBBLICI E PRIVATI,24 ORE: DALLE 00.00 ALLE 23.59 - ATTIVITA' FERROVIARIE: DALLE 21.00 DEL 2/10 ALLE 21.00 DEL 3/10; TPL 24 ORE VARIE MODALITA' DEL 3/10; AUTOSTRADE: DALLE 22.00 DEL 2/10 ALLE 22.00 DEL 3/10; PORTUALI: INTERA GIORNATA; AEREO: 24 ORE,Nazionale,"ART. 2, CO. 7 L. 146/90 E S.M.I.",01/10/2025,Italia,Tutte,02/10/2025 14:11,2025-10-03,2025-10-03
Effettuato,03/10/2025,03/10/2025,OSP FAISA-CISAL,Trasporto pubblico locale,PERSONALE SOC. SCHIAFFINI TRAVEL DI PONZA (LT),4 ORE: DALLE 11.00 ALLE 15.00,Locale,null,09/09/2025,Lazio,Latina,09/09/2025 16:35,2025-10-03,2025-10-03
Effettuato,03/10/2025,03/10/2025,OSR FAISA-CISAL,Trasporto pubblico locale,PERSONALE SOC. AUTOLINEE RUSSO DI PALERMO,24 ORE,Locale,null,17/09/2025,Sicilia,Palermo,17/09/2025 13:36,2025-10-03,2025-10-03
Effettuato,03/10/2025,03/10/2025,OSR FAISA-CISAL,Trasporto pubblico locale,PERSONALE SOC. ETNA TRASPORTI DI CATANIA,24 ORE,Locale,null,17/09/2025,Sicilia,Catania,17/09/2025 13:36,2025-10-03,2025-10-03
Effettuato,03/10/2025,03/10/2025,OSR FAISA-CISAL,Trasporto pubblico locale,PERSONALE SOC. INTERBUS DI ENNA,24 ORE,Locale,null,17/09/2025,Sicilia,Enna,17/09/2025 13:36,2025-10-03,2025-10-03
Effettuato,03/10/2025,03/10/2025,OSR FAISA-CISAL,Trasporto pubblico locale,PERSONALE SOC. SEGESTA AUTOLINEE DI PALERMO,24 ORE,Locale,null,17/09/2025,Sicilia,Palermo,17/09/2025 13:36,2025-10-03,2025-10-03
"Revocato (include le azioni di revoca, sospensione e differimento)",03/10/2025,03/10/2025,OST FILT-CGIL/FIT-CISL/UILT-UIL/UGL/FAISA-CISAL + RSU,Trasporto pubblico locale,PERSONALE SOC. ARRIVA ITALIA DI BERGAMO,4 ORE: DALLE 08.30 ALLE 12.30,Locale,null,16/09/2025,Lombardia,Bergamo,16/09/2025 14:42,2025-10-03,2025-10-03
Effettuato,03/10/2025,03/10/2025,SI-COBAS,Generale,SCIOPERO GENERALE CATEGORIE PUBBLICHE E PRIVATE,INTERA GIORNATA - FERROVIARIO: DALLE 00.01 ALLE 20.59,Nazionale,"ESCLUSI I SETTORI INTERESSATI DA ASTENSIONI PRECEDENTEMENTE PROCLAMATE E DALLE CONSULTAZIONI ELETTORALI DELLE REGIONI V. D'AOSTA, MARCHE E CALABRIA",18/09/2025,Italia,Tutte,18/09/2025 17:26,2025-10-03,2025-10-03
Effettuato,03/10/2025,03/10/2025,USB,Generale,SCIOPERO GENERALE SETTORI PUBBLICI E PRIVATI,"INTERA GIORNATA - AEREO: DALLE 00.00 ALLE 23.59; FERROVIARIO: DALLE 21.00 DEL 2/10 ALLE 20.59 DEL 3/10; TPL, MARITTIMO: 24 ORE VARIE MODALITA'; TAXI: DALLE 00.00 ALLE 23.59",Nazionale,"ART. 2, CO. 7 L. 146/90 E S.M.I. - ADESIONE O.S. CSS",01/10/2025,Italia,Tutte,01/10/2025 20:58,2025-10-03,2025-10-03
Effettuato,02/10/2025,02/10/2025,OSR FILT-CGIL/UILT-UIL,Appalti ferroviari,PERSONALE SOC. CONSORZIO STABILE CMF PRESSO APPALTO ROMA PARCO PRENESTINO LOTTO I.C. NOTTE,MEZZO TURNO PER OGNI TURNO,Locale,null,18/09/2025,Lazio,Roma,18/09/2025 13:53,2025-10-02,2025-10-02
"Revocato (include le azioni di revoca, sospensione e differimento)",02/10/2025,02/10/2025,RSA UILT-UIL,Trasporto pubblico locale,"PERSONALE SOCC. ATI FIDENTE, MIORELLI, B & B APPALTO PULIZIA E MANOVRA PRESSO SOC. AMT DI GENOVA",4 ORE: DALLE 11.00 ALLE 15.00,Locale,null,17/09/2025,Liguria,Genova,17/09/2025 15:00,2025-10-02,2025-10-02
"Revocato (include le azioni di revoca, sospensione e differimento)",29/09/2025,29/09/2025,OSR FAISA-CISAL,Trasporto pubblico locale,PERSONALE SOC. AUTOLINEE RUSSO DI PALERMO,24 ORE,Locale,null,15/09/2025,Sicilia,Palermo,15/09/2025 13:35,2025-09-29,2025-09-29
"Revocato (include le azioni di revoca, sospensione e differimento)",29/09/2025,29/09/2025,OSR FAISA-CISAL,Trasporto pubblico locale,PERSONALE SOC. SEGESTA AUTOLINEE DI PALERMO,24 ORE,Locale,null,15/09/2025,Sicilia,Palermo,15/09/2025 13:35,2025-09-29,2025-09-29
"Revocato (include le azioni di revoca, sospensione e differimento)",29/09/2025,29/09/2025,OSR FAISA-CISAL,Trasporto pubblico locale,PERSONALE SOC. INTERBUS DI ENNA,24 ORE,Locale,null,15/09/2025,Sicilia,Enna,15/09/2025 13:35,2025-09-29,2025-09-29
"Revocato (include le azioni di revoca, sospensione e differimento)",29/09/2025,29/09/2025,OSR FAISA-CISAL,Trasporto pubblico locale,PERSONALE SOC. ETNA TRASPORTI DI CATANIA,24 ORE,Locale,null,15/09/2025,Sicilia,Catania,15/09/2025 13:35,2025-09-29,2025-09-29
"Revocato (include le azioni di revoca, sospensione e differimento)",29/09/2025,29/09/2025,OST FILT-CGIL/UILT-UIL,Trasporto pubblico locale,PERSONALE SOC. GLOSER ITALIA IN APPALTO PRESSO SOC. AMT DI GENOVA,PRIME 4 ORE DI OGNI TURNO,Locale,null,18/09/2025,Liguria,Genova,19/09/2025 12:52,2025-09-29,2025-09-29
Effettuato,26/09/2025,26/09/2025,ADL VARESE,Aereo,PERSONALE SOC. DUSSMANN SERVICE ADDETTO A PULIZIE AEROPORTO DI MILANO MALPENSA,24 ORE: DALLE 00.00 ALLE 24.00,Nazionale,null,13/09/2025,Italia,Tutte,13/09/2025 14:44,2025-09-26,2025-09-26
"Revocato (include le azioni di revoca, sospensione e differimento)",26/09/2025,26/09/2025,CUB TRASPORTI,Aereo,PERSONALE AZIENDE DI HANDLING AEROPORTUALE E SOCIETA' ASSOCIATE ASSOHANDLERS,24 ORE: DALLE 00.00 ALLE 23.59,Nazionale,null,31/07/2025,Italia,Tutte,31/07/2025 16:46,2025-09-26,2025-09-26
Effettuato,26/09/2025,26/09/2025,CUB TRASPORTI,Aereo,"LAVORATORI COMPARTO AEREO, AEROPORTUALE E INDOTTO AEROPORTI",24 ORE: DALLE 00.00 ALLE 23.59,Nazionale,ADESIONE OS USB LAVORO PRIVATO,01/08/2025,Italia,Tutte,01/08/2025 08:21,2025-09-26,2025-09-26
Effettuato,26/09/2025,26/09/2025,FILT-CGIL,Aereo,PERSONALE NAVIGANTE SOC. WIZZ AIR MALTA LIMITED,24 ORE: DALLE 00.00 ALLE 24.00,Nazionale,null,12/09/2025,Italia,Tutte,12/09/2025 13:36,2025-09-26,2025-09-26
"Revocato (include le azioni di revoca, sospensione e differimento)",26/09/2025,26/09/2025,FLAI TRASPORTI E SERVIZI,Aereo,PERSONALE AZIENDE HANDLING ASSOCIATE ASSOHANDLERS OPERANTI NEI SEDIMI AEROPORTUALI ITALIANI,24 ORE,Nazionale,null,30/07/2025,Italia,Tutte,30/07/2025 00:08,2025-09-26,2025-09-26
Effettuato,26/09/2025,26/09/2025,FLAI TRASPORTI E SERVIZI,Aereo,PERSONALE SOC. AIRPORT HANDLING AEROPORTI DI MILANO LINATE E MALPENSA,4 ORE: DALLE 10.00 ALLE 14.00,Nazionale,null,26/08/2025,Italia,Tutte,26/08/2025 09:38,2025-09-26,2025-09-26
Effettuato,26/09/2025,26/09/2025,FLAI TRASPORTI E SERVIZI,Aereo,PERSONALE AZIENDE HANDLING ASSOCIATE ASSOHANDLERS OPERANTI NEI SEDIMI AEROPORTUALI ITALIANI,4 ORE: DALLE 10.00 ALLE 14.00,Nazionale,null,28/08/2025,Italia,Tutte,28/08/2025 11:10,2025-09-26,2025-09-26
Effettuato,26/09/2025,26/09/2025,OSR FILT-CGIL/FIT-CISL/UILT-UIL/UGL-TA,Aereo,PERSONALE SOC. AIRPORT HANDLING AEROPORTI DI MILANO LINATE E MALPENSA,4 ORE: DALLE 10.00 ALLE 14.00,Nazionale,null,26/08/2025,Italia,Tutte,26/08/2025 09:36,2025-09-26,2025-09-26
Effettuato,26/09/2025,26/09/2025,OSR UGL-TA,Aereo,PERSONALE SOC. SOGAERSECURITY AEROPORTO DI CAGLIARI,24 ORE: DALLE 00.00 ALLE 23.59,Interregionale,null,01/09/2025,Sardegna,Cagliari,01/09/2025 14:23,2025-09-26,2025-09-26
Effettuato,26/09/2025,26/09/2025,OSR USB LAVORO PRIVATO,Aereo,PERSONALE SOC. AIRPORT HANDLING AEROPORTI DI MILANO LINATE E MALPENSA,4 ORE: DALLE 10.00 ALLE 14.00,Nazionale,null,12/09/2025,Italia,Tutte,12/09/2025 14:42,2025-09-26,2025-09-26
Effettuato,26/09/2025,26/09/2025,OST CUB TRASPORTI,Aereo,PERSONALE SOC. AIRPORT HANDLING AEROPORTI DI MILANO LINATE E MALPENSA,4 ORE: DALLE 10.00 ALLE 14.00,Nazionale,null,02/09/2025,Italia,Tutte,02/09/2025 16:32,2025-09-26,2025-09-26
Effettuato,26/09/2025,26/09/2025,OST CUB TRASPORTI,Aereo,PERSONALE SOC. ALHA AEROPORTO DI MILANO MALPENSA,4 ORE: DALLE 10.00 ALLE 14.00,Nazionale,null,02/09/2025,Italia,Tutte,02/09/2025 16:33,2025-09-26,2025-09-26
Effettuato,26/09/2025,26/09/2025,OST CUB TRASPORTI,Aereo,PERSONALE SOC. MLE AEROPORTO DI MILANO MALPENSA,4 ORE: DALLE 10.00 ALLE 14.00,Nazionale,null,09/09/2025,Italia,Tutte,09/09/2025 12:04,2025-09-26,2025-09-26
Effettuato,26/09/2025,26/09/2025,OST CUB TRASPORTI,Aereo,PERSONALE AUTISTI SOC. SEA AEROPORTI DI MILANO LINATE E MALPENSA,24 ORE: DALLE 00.00 ALLE 23.59,Nazionale,null,11/09/2025,Italia,Tutte,11/09/2025 11:59,2025-09-26,2025-09-26
Effettuato,26/09/2025,26/09/2025,UILT-UIL,Aereo,PERSONALE SOC. VOLOTEA,24 ORE,Nazionale,null,04/08/2025,Italia,Tutte,04/08/2025 14:06,2025-09-26,2025-09-26
Effettuato,25/09/2025,25/09/2025,OSR SGB,Trasporto pubblico locale,PERSONALE SOC. MOM DI TREVISO,24 ORE,Locale,null,04/09/2025,Veneto,Treviso,04/09/2025 15:13,2025-09-25,2025-09-25
"Revocato (include le azioni di revoca, sospensione e differimento)",25/09/2025,25/09/2025,OSR UILT-UIL/UGL FERROVIERI/SALPAS-ORSA FERROVIE/FAST-CONFSAL,Appalti ferroviari,PERSONALE APPALTI FERROVIARI DELLA SOC. COOPSERVICE SCDP C/O SOC. TRENITALIA REGIONE LAZIO,4 ORE: PRIMA META' DEL TURNO,Regionale,null,11/09/2025,Lazio,Tutte,12/09/2025 09:07,2025-09-25,2025-09-25
Effettuato,24/09/2025,24/09/2025,OSR FILT-CGIL/FIT-CISL/UILT-UIL/FAISA-CISAL,Trasporto pubblico locale,PERSONALE SOC. CONEROBUS DI ANCONA,4 ORE: DALLE 11.30 ALLE 15.30,Locale,null,08/09/2025,Marche,Ancona,08/09/2025 11:38,2025-09-24,2025-09-24
"Revocato (include le azioni di revoca, sospensione e differimento)",23/09/2025,23/09/2025,OSR SGB,Trasporto pubblico locale,PERSONALE SOC. MOM DI TREVISO,24 ORE,Locale,null,04/09/2025,Veneto,Treviso,04/09/2025 13:09,2025-09-23,2025-09-23
Effettuato,22/09/2025,22/09/2025,CUB/SGB/ADL VARESE/USI-CIT,Generale,SCIOPERO GENERALE CATEGORIE PUBBLICHE E PRIVATE,INTERA GIORNATA - TRASP. MERCI SU ROTAIA: DALLE 21.00 DEL 21/9 ALLE 21.00 DEL 22/9; AUTOSTRADE: DALLE 22.00 DEL 21/9 ALLE 22.00 DEL 22/9; PORTI: INTERA GIORNATA,Nazionale,"ESCLUSO IL TRASPORTO AEREO E TRASPORTO PASSEGGERI - ADESIONE OOSS USI, USI-CIT, FISI",11/09/2025,Italia,Tutte,11/09/2025 15:44,2025-09-22,2025-09-22
Effettuato,22/09/2025,22/09/2025,OSR ORSA AUTOFERRO TPL,Trasporto pubblico locale,"PERSONALE SOC. SETA BACINI DI MODENA, REGGIO EMILIA E PIACENZA",4 ORE: DALLE 16.01 ALLE ORE 20.00,Locale,null,25/08/2025,Emilia-Romagna,Tutte,25/08/2025 14:16,2025-09-22,2025-09-22
Effettuato,22/09/2025,22/09/2025,OSR USB LAVORO PRIVATO,Trasporto pubblico locale,"PERSONALE SOC. SETA BACINI DI MODENA, REGGIO EMILIA E PIACENZA",24 ORE: VARIE MODALITA',Locale,null,04/08/2025,Emilia-Romagna,Tutte,04/08/2025 18:08,2025-09-22,2025-09-22
Effettuato,22/09/2025,22/09/2025,USB,Generale,SCIOPERO GENERALE CATEGORIE PUBBLICHE E PRIVATE,"INTERA GIORNATA - FERROVIARIO: DALLE 00.00 ALLE 23.00 DEL 22/9; TPL, MARITTIMO, MERCI E LOGISTICA: 24 ORE VARIE MODALITA'; TAXI: DALLE 00.00 ALLE 23.59",Nazionale,"ESCLUSO IL TRASPORTO AEREO E BACINI DI UTENZA INTERESSATI DA SCIOPERI LOCALI PRECEDENTEMENTE INDETTI IN ALTRI SETTORI TRASPORTI - ADESIONE OOSS USI, ORSA TPL LAZIO, FISI, CSS - CONF. SINDACALE SARDA",11/09/2025,Italia,Tutte,11/09/2025 09:29,2025-09-22,2025-09-22
Effettuato,19/09/2025,19/09/2025,A.L. COBAS,Trasporto pubblico locale,PERSONALE SOC. NET (NORD EST TRASPORTI) DI MONZA  E TREZZO SULL'ADDA,24 ORE,Locale,null,05/09/2025,Lombardia,Monza e Brianza,05/09/2025 17:52,2025-09-19,2025-09-19
Effettuato,19/09/2025,19/09/2025,OSP CUB TRASPORTI,Trasporto pubblico locale,PERSONALE SOC. AMAT DI PALERMO,4 ORE: DALLE 11.00 ALLE 15.00,Locale,null,21/08/2025,Sicilia,Palermo,21/08/2025 15:38,2025-09-19,2025-09-19
"Revocato (include le azioni di revoca, sospensione e differimento)",18/09/2025,18/09/2025,OSR USB LAVORO PRIVATO/ORSA TPL,Trasporto pubblico locale,PERSONALE SOC. ATAC DI ROMA,4 ORE: DALLE 20.30 ALLE 00.30,Locale,null,25/08/2025,Lazio,Roma,25/08/2025 16:40,2025-09-18,2025-09-18
Effettuato,18/09/2025,18/09/2025,OSR/OSP ORSA AUTOFERRO TPL,Trasporto pubblico locale,"PERSONALE SOC. ARST PROVINCE DI CAGLIARI, SASSARI, NUORO E ORISTANO",INTERA GIORNATA LAVORATIVA DEL 18/9 DA INIZIO A FINE SERVIZIO,Territoriale,null,03/08/2025,Sardegna,Tutte,03/08/2025 08:17,2025-09-18,2025-09-18
Effettuato,16/09/2025,17/09/2025,FILT-CGIL/FIT-CISL/UILT-UIL,Trasporto merci,PERSONALE SOC. CAPTRAIN ITALIA,24 ORE: DALLE 16.01 DEL 16/9 ALLE 16.00 DEL 17/9,Nazionale,null,30/07/2025,Italia,Tutte,31/07/2025 11:02,2025-09-16,2025-09-17
Effettuato,16/09/2025,17/09/2025,FILT-CGIL/FIT-CISL/UILT-UIL/UGL FERROVIERI/FAST-CONFSAL,Trasporto merci,PERSONALE VIAGGIANTE TRASPORTO MERCI SU FERRO SOC. GTS RAIL,24 ORE: DALLE 16.01 DEL 16/9 ALLE 16.00 DEL 17/9,Nazionale,null,04/08/2025,Italia,Tutte,04/08/2025 11:28,2025-09-16,2025-09-17
Effettuato,16/09/2025,16/09/2025,OST UILT-UIL/UGL-FNA,Trasporto pubblico locale,PERSONALE SOC. PAOLO SCOPPIO E FIGLIO AUTOLINEE DI BARI,4 ORE: DALLE 15.30 ALLE 19.30,Locale,null,04/08/2025,Puglia,Bari,04/08/2025 21:51,2025-09-16,2025-09-16
Effettuato,15/09/2025,15/09/2025,OSP COBAS LAVORO PRIVATO,Trasporto pubblico locale,"PERSONALE SOC. AUTOLINEE TOSCANE DIPARTIMENTO CENTRO - PROVINCE DI FIRENZE, PRATO E PISTOIA",24 ORE,Territoriale,null,25/08/2025,Toscana,Tutte,28/08/2025 15:54,2025-09-15,2025-09-15
Effettuato,15/09/2025,15/09/2025,OSP COBAS LAVORO PRIVATO,Trasporto pubblico locale,PERSONALE SOC. GEST FIRENZE,24 ORE,Territoriale,null,27/08/2025,Toscana,Firenze,28/08/2025 16:01,2025-09-15,2025-09-15
"Revocato (include le azioni di revoca, sospensione e differimento)",15/09/2025,15/09/2025,OSP FAISA-CISAL/UGL-AUTOFERRO,Trasporto pubblico locale,PERSONALE SOC. START ROMAGNA BACINO DI RAVENNA,4 ORE: DALLE 8.30 ALLE 12.30,Locale,null,19/08/2025,Emilia-Romagna,Ravenna,19/08/2025 14:07,2025-09-15,2025-09-15
Effettuato,15/09/2025,15/09/2025,OSP FAST-CONFSAL,Trasporto pubblico locale,PERSONALE SOC. AUTOLINEE TOSCANE PROVINCIA DI PISA,24 ORE,Provinciale,null,22/07/2025,Toscana,Pisa,22/07/2025 11:06,2025-09-15,2025-09-15
Effettuato,15/09/2025,15/09/2025,OSR FILT-CGIL/FAISA-CISAL,Trasporto pubblico locale,"PERSONALE SOCC. TPL REGIONE UMBRIA BUSITALIA SITA NORD, SULGA AUTOLINEE, ACAP, AUTOSERVIZI TROIANI, CMT TERNI, AUTOSERVIZI FONTI, EREDI FORTUNI",24 ORE,Regionale,null,30/07/2025,Umbria,Tutte,30/07/2025 01:18,2025-09-15,2025-09-15
Effettuato,15/09/2025,15/09/2025,OSR UGL FERROVIERI,Ferroviario,"PERSONALE SOC. TRENITALIA PRODUZIONE REGIONALE, PRODUZIONE IC, IMC CARROZZE SERVIZIO INTERCITY REGIONE CALABRIA",8 ORE: DALLE 09.01 ALLE 17.00,Regionale,null,01/08/2025,Calabria,Tutte,01/08/2025 10:11,2025-09-15,2025-09-15
Effettuato,15/09/2025,15/09/2025,OST FILT-CGIL/UILT-UIL/UGL-FNA/COBAS L.P.,Trasporto pubblico locale,"PERSONALE SOCC. ATC ESERCIZIO, TROTTA BUS SERVICES, AUTOSERVIZI RICCITELLI DI LA SPEZIA",24 ORE,Territoriale,null,21/07/2025,Liguria,La Spezia,22/07/2025 08:24,2025-09-15,2025-09-15
"Revocato (include le azioni di revoca, sospensione e differimento)",14/09/2025,14/09/2025,OSR USB LAVORO PRIVATO,Aereo,PERSONALE SOC. AIRPORT HANDLING AEROPORTI DI MILANO LINATE E MALPENSA,24 ORE: DALLE 00.00 ALLE 23.59,Nazionale,null,29/07/2025,Italia,Tutte,30/07/2025 10:56,2025-09-14,2025-09-14
"Revocato (include le azioni di revoca, sospensione e differimento)",12/09/2025,12/09/2025,CUB TRASPORTI,Aereo,"LAVORATORI COMPARTO AEREO, AEROPORTUALE E INDOTTO AEROPORTI",24 ORE: DALLE 00.00 ALLE 23.59,Nazionale,null,30/07/2025,Italia,Tutte,30/07/2025 11:01,2025-09-12,2025-09-12
"Revocato (include le azioni di revoca, sospensione e differimento)",10/09/2025,10/09/2025,OSP FILT-CGIL/ FIT-CISL/UILT-UIL,Trasporto pubblico locale,PERSONALE SOC. AMAG MOBILITA' DI ALESSANDRIA,4 ORE: DALLE 10.30 ALLE 14.30,Locale,null,08/08/2025,Piemonte,Alessandria,08/08/2025 12:17,2025-09-10,2025-09-10
Effettuato,08/09/2025,08/09/2025,OSP FILT-CGIL/FIT-CISL/UILT-UIL/UGL/FAISA-CISAL/SIAL COBAS + RSU,Trasporto pubblico locale,PERSONALE SOC. TPL LINEA DI SAVONA,24 ORE,Locale,null,18/08/2025,Liguria,Savona,18/08/2025 17:28,2025-09-08,2025-09-08
Effettuato,08/09/2025,08/09/2025,OSR FAISA-CISAL,Trasporto pubblico locale,PERSONALE SOC. AUTOLINEE RUSSO DI PALERMO,24 ORE,Locale,null,26/07/2025,Sicilia,Palermo,26/07/2025 11:07,2025-09-08,2025-09-08
Effettuato,08/09/2025,08/09/2025,OSR FAISA-CISAL,Trasporto pubblico locale,PERSONALE SOC. SEGESTA AUTOLINEE DI PALERMO,24 ORE,Locale,null,26/07/2025,Sicilia,Palermo,26/07/2025 11:07,2025-09-08,2025-09-08
Effettuato,08/09/2025,08/09/2025,OSR FAISA-CISAL,Trasporto pubblico locale,PERSONALE SOC. INTERBUS DI ENNA,24 ORE,Locale,null,26/07/2025,Sicilia,Enna,26/07/2025 11:07,2025-09-08,2025-09-08
Effettuato,08/09/2025,08/09/2025,OSR FAISA-CISAL,Trasporto pubblico locale,PERSONALE SOC. ETNA TRASPORTI DI CATANIA,24 ORE,Locale,null,26/07/2025,Sicilia,Catania,26/07/2025 11:07,2025-09-08,2025-09-08
Effettuato,06/09/2025,06/09/2025,ADL VARESE,Aereo,PERSONALE SOC. DUSSMANN SERVICE ADDETTO A PULIZIE AEROPORTO DI MILANO MALPENSA,4 ORE: DALLE 12.00 ALLE 16.00,Nazionale,null,09/08/2025,Italia,Tutte,09/08/2025 16:25,2025-09-06,2025-09-06
Effettuato,06/09/2025,06/09/2025,FAST-CONFSAL,Aereo,PERSONALE DIPENDENTE DALLE AZIENDE DEL SETTORE DEL TRASPORTO AEREO,4 ORE: DALLE 12.00 ALLE 16.00,Nazionale,null,16/07/2025,Italia,Tutte,16/07/2025 15:42,2025-09-06,2025-09-06
Effettuato,06/09/2025,06/09/2025,FILT-CGIL,Aereo,PERSONALE NAVIGANTE SOC. WIZZ AIR MALTA LIMITED,4 ORE: DALLE 12.00 ALLE 16.00,Nazionale,null,22/08/2025,Italia,Tutte,02/09/2025 11:47,2025-09-06,2025-09-06
Effettuato,06/09/2025,06/09/2025,OSP UGL-TA,Aereo,PERSONALE SOC. AVIATION SERVICES PRESSO AEROPORTO DI CATANIA FONTANAROSSA,4 ORE: DALLE 12.00 ALLE 16.00,Interregionale,null,04/07/2025,Italia,Tutte,04/07/2025 17:21,2025-09-06,2025-09-06
Effettuato,06/09/2025,06/09/2025,OSR CUB TRASPORTI,Aereo,PERSONALE SOC. CONSULTA OPERANTE PRESSO GLI AEROPORTI DI PISA E FIRENZE,4 ORE: DALLE 12.00 ALLE 16.00,Regionale,null,08/08/2025,Toscana,Tutte,08/08/2025 18:03,2025-09-06,2025-09-06
Effettuato,06/09/2025,06/09/2025,OSR FILT-CGIL/FIT-CISL/UILT-UIL/UGL-TA/USB,Aereo,PERSONALE SOC. CONSULTA OPERANTE PRESSO GLI AEROPORTI DI PISA E FIRENZE,4 ORE: DALLE 12.00 ALLE 16.00,Regionale,null,08/08/2025,Toscana,Tutte,11/08/2025 10:05,2025-09-06,2025-09-06
Effettuato,06/09/2025,06/09/2025,OSR UGL-TA,Aereo,PERSONALE SOC. AVIATION SERVICES AEROPORTI DI ROMA FIUMICINO E CIAMPINO,4 ORE: DALLE 12.00 ALLE 16.00,Nazionale,null,31/07/2025,Italia,Tutte,31/07/2025 16:13,2025-09-06,2025-09-06
"Revocato (include le azioni di revoca, sospensione e differimento)",06/09/2025,06/09/2025,OSR UGL-TA,Aereo,"PERSONALE SOC. SACAL AEROPORTI DI LAMEZIA TERME (CZ), CROTONE E REGGIO CALABRIA",4 ORE: DALLE 12.00 ALLE 16.00,Regionale,null,18/08/2025,Calabria,Tutte,18/08/2025 19:05,2025-09-06,2025-09-06
"Revocato (include le azioni di revoca, sospensione e differimento)",06/09/2025,06/09/2025,OSR UGL-TA,Aereo,PERSONALE SOC. SACAL GH AEROPORTO DI LAMEZIA TERME (CZ),4 ORE: DALLE 12.00 ALLE 16.00,Regionale,null,18/08/2025,Calabria,Tutte,18/08/2025 19:42,2025-09-06,2025-09-06
Effettuato,06/09/2025,06/09/2025,OST FILCAMS-CGIL,Aereo,PERSONALE SOC. DUSSMANN SERVICE ADDETTO A PULIZIE AEROPORTO DI MILANO MALPENSA,4 ORE: DALLE 12.00 ALLE 16.00,Nazionale,null,14/08/2025,Italia,Tutte,14/08/2025 10:59,2025-09-06,2025-09-06
"Revocato (include le azioni di revoca, sospensione e differimento)",06/09/2025,06/09/2025,UILT-UIL,Aereo,PERSONALE SOC. SWISSPORT ITALIA AEROPORTO DI MILANO LINATE,24 ORE - LIMITATAMENTE AI VOLI DA E PER L'AEROPORTO DI CATANIA 4 ORE: DALLE 12.00 ALLE 16.00,Nazionale,null,30/07/2025,Italia,Tutte,30/07/2025 12:21,2025-09-06,2025-09-06
"Revocato (include le azioni di revoca, sospensione e differimento)",06/09/2025,06/09/2025,UILT-UIL,Aereo,PERSONALE SOC. VOLOTEA,24 ORE,Nazionale,null,30/07/2025,Italia,Tutte,30/07/2025 16:35,2025-09-06,2025-09-06
Effettuato,06/09/2025,06/09/2025,USB LAVORO PRIVATO,Aereo,PERSONALE NAVIGANTE SOC. EASYJET AIRLINES,24 ORE: DALLE 00.00 ALLE 23.59 - LIMITATAMENTE AI VOLI DA E PER L'AEROPORTO DI CATANIA 4 ORE: DALLE 12.00 ALLE 16.00,Nazionale,null,16/07/2025,Italia,Tutte,16/07/2025 12:13,2025-09-06,2025-09-06
Effettuato,05/09/2025,05/09/2025,OSR UILT-UIL/SLM FAST-CONFSAL/ORSA,Ferroviario,PERSONALE SOC. TRENITALIA APPARTENENTE ALLA DOR ( DIREZIONE OPERAZIONI E RETE ) TRENTINO ALTO ADIGE,8 ORE: DALLE 09.01 ALLE 16.59,Regionale,null,24/07/2025,Trentino-Alto Adige,Tutte,24/07/2025 09:11,2025-09-05,2025-09-05
Effettuato,05/09/2025,05/09/2025,USB LAVORO PRIVATO,Plurisettoriale,PERSONALE AZIENDE DELLA SOCIETÀ DEL GRUPPO FSI E TUTTE LE IMPRESE FERROVIARIE PRIVATE,8 ORE: DALLE 10.00 ALLE 18.00,Nazionale,ESCLUSI SETTORI MANUT. E INFRASTRUTTURE E ALTRI SETTORI SENZA NESSO STRUMENTALITA' ALLA CIRCOLAZIONE,25/08/2025,Italia,Tutte,25/08/2025 17:04,2025-09-05,2025-09-05
Effettuato,04/09/2025,05/09/2025,ASSEMBLEA NAZIONALE PDM/PDB GRUPPO FSI,Ferroviario,PERSONALE DI MACCHINA E DI BORDO DEL GRUPPO FERROVIE DELLO STATO ITALIANE,21 ORE: DALLE 21.00 DEL 4/9 ALLE 18.00 DEL 5/9,Nazionale,null,23/07/2025,Italia,Tutte,23/07/2025 11:40,2025-09-04,2025-09-05
Effettuato,04/09/2025,05/09/2025,ASSEMBLEA NAZIONALE PDM/PDB GRUPPO FSI,Ferroviario,PERSONALE DI MACCHINA E DI BORDO DEL GRUPPO FERROVIE DELLO STATO ITALIANE,21 ORE: DALLE 21.00 DEL 4/9 ALLE 18.00 DEL 5/9,Nazionale,null,23/07/2025,Italia,Tutte,23/07/2025 11:40,2025-09-04,2025-09-05
Effettuato,04/09/2025,04/09/2025,OSR SUL,Trasporto pubblico locale,PERSONALE SOC. ATAC DI ROMA,4 ORE: DALLE 8.30 ALLE 12.30,Locale,null,29/07/2025,Lazio,Roma,29/07/2025 22:27,2025-09-04,2025-09-04
Effettuato,04/09/2025,05/09/2025,SGB,Plurisettoriale,PERSONALE IMPRESE CHE SVOLGONO ATTIVITA' FERROVIARIA,SETTORE FERROVIARIO E TRASPORTO MERCI SU ROTAIA: 21 ORE DALLE 21.00 DEL 4/9 ALLE 18.00 DEL 5/9; *TPL: INTERA PRESTAZIONE DEL 5/9,Nazionale,null,10/07/2025,Italia,Tutte,10/07/2025 12:00,2025-09-04,2025-09-05
Effettuato,04/09/2025,05/09/2025,USB LAVORO PRIVATO,Trasporto merci,PERSONALE SOC. MEDWAY ITALIA,21 ORE: DALLE 21.00 DEL 4/9 ALLE 18.00 DEL 5/9,Nazionale,null,15/07/2025,Italia,Tutte,15/07/2025 17:30,2025-09-04,2025-09-05
"Revocato (include le azioni di revoca, sospensione e differimento)",25/08/2025,25/08/2025,OSR SUL,Trasporto pubblico locale,PERSONALE SOC. ATAC DI ROMA,4 ORE: DALLE 8.30 ALLE 12.30,Locale,null,28/07/2025,Lazio,Roma,28/07/2025 23:00,2025-08-25,2025-08-25
Effettuato,22/08/2025,22/08/2025,OSP UGL ATUOFERRO,Trasporto pubblico locale,PERSONALE SOC. AMT DI GENOVA,2 ORE: DALLE 11.30 ALLE 13.30,Territoriale,ART.2 COMMA 7 L. 146/90 E S.M.I. -,20/08/2025,Liguria,Genova,20/08/2025 22:27,2025-08-22,2025-08-22
"Revocato (include le azioni di revoca, sospensione e differimento)",26/07/2025,26/07/2025,CUB TRASPORTI,Aereo,"LAVORATORI COMPARTO AEREO, AEROPORTUALE E INDOTTO AEROPORTI",4 ORE: DALLE 13.00 ALLE 17.00,Nazionale,null,27/05/2025,Italia,Tutte,27/05/2025 15:56,2025-07-26,2025-07-26
Effettuato,26/07/2025,26/07/2025,CUB TRASPORTI,Aereo,"LAVORATORI COMPARTO AEREO, AEROPORTUALE E INDOTTO AEROPORTI",4 ORE: DALLE 13.00 ALLE 17.00,Nazionale,ESCLUSI I VOLI DA E PER L'AEROPORTO DI PALERMO,30/05/2025,Italia,Tutte,30/05/2025 16:16,2025-07-26,2025-07-26
Effettuato,26/07/2025,26/07/2025,FLAI TRASPORTI E SERVIZI,Aereo,PERSONALE AZIENDE HANDLING ASSOCIATE ASSOHANDLERS OPERANTI NEI SEDIMI AEROPORTUALI ITALIANI,4 ORE: DALLE 13.00 ALLE 17.00,Nazionale,null,14/07/2025,Italia,Tutte,14/07/2025 19:10,2025-07-26,2025-07-26
Effettuato,26/07/2025,26/07/2025,OSP COBAS LAVORO PRIVATO,Trasporto pubblico locale,PERSONALE SOC. GEST DI FIRENZE,4 ORE: DALLE 22.30 A TERMINE TURNO,Territoriale,null,10/07/2025,Toscana,Firenze,10/07/2025 21:42,2025-07-26,2025-07-26
"Revocato (include le azioni di revoca, sospensione e differimento)",26/07/2025,26/07/2025,OSP CUB TRASPORTI,Trasporto pubblico locale,PERSONALE SOC. AMTS DI CATANIA,4 ORE: 17.00-18.00 E 21.00-24.00,Locale,ASTENSIONE DAL LAVORO STRAORDINARIO 25 E 27/07/2025 E DAL 04/09/2025 AL 30/09/2025,14/07/2025,Sicilia,Catania,14/07/2025 23:30,2025-07-26,2025-07-26
Effettuato,26/07/2025,26/07/2025,OSP CUB TRASPORTI,Trasporto pubblico locale,PERSONALE SOC. AMTS DI CATANIA,3 ORE: DALLE 21.00 ALLE 24.00,Locale,ASTENSIONE DAL LAVORO STRAORDINARIO 25 E 27/07/2025 E DAL 04/09/2025 AL 30/09/2025,16/07/2025,Sicilia,Catania,16/07/2025 23:58,2025-07-26,2025-07-26
Effettuato,26/07/2025,26/07/2025,OSP FILT-CGIL,Aereo,PERSONALE SOC. SWISSPORT ITALIA AEROPORTO DI MILANO LINATE,4 ORE: DALLE 13.00 ALLE 17.00,Nazionale,ESCLUSI I VOLI DA E PER L'AEROPORTO DI PALERMO,14/07/2025,Italia,Tutte,14/07/2025 11:30,2025-07-26,2025-07-26
Effettuato,26/07/2025,26/07/2025,OSP FILT-CGIL/UILT-UIL/UGL-FNA,Trasporto pubblico locale,PERSONALE SOC. CSC MOBILITA' DI LATINA,4 ORE: DALLE 09.30 ALLE 13.30,Locale,null,14/07/2025,Lazio,Latina,14/07/2025 13:52,2025-07-26,2025-07-26
"Revocato (include le azioni di revoca, sospensione e differimento)",26/07/2025,26/07/2025,OSR FILT-CGIL/FAISA-CISAL,Trasporto pubblico locale,"PERSONALE SOCC. TPL REGIONE UMBRIA BUSITALIA SITA NORD, SULGA AUTOLINEE, ACAP, AUTOSERVIZI TROIANI, CMT TERNI, AUTOSERVIZI FONTI, EREDI FORTUNI",4 ORE: DALLE 20.00 ALLE 24.00,Regionale,null,03/07/2025,Umbria,Tutte,03/07/2025 21:09,2025-07-26,2025-07-26
Effettuato,26/07/2025,26/07/2025,OSR FILT-CGIL/FAISA-CISAL,Trasporto pubblico locale,"PERSONALE SOCC. TPL REGIONE UMBRIA BUSITALIA SITA NORD, SULGA AUTOLINEE, ACAP, AUTOSERVIZI TROIANI, CMT TERNI, AUTOSERVIZI FONTI, EREDI FORTUNI",4 ORE: DALLE 20.00 ALLE 24.00,Regionale,null,15/07/2025,Umbria,Tutte,15/07/2025 19:32,2025-07-26,2025-07-26
"Revocato (include le azioni di revoca, sospensione e differimento)",26/07/2025,26/07/2025,OSR ORSA TRASPORTI AUTOFERRO TPL,Trasporto pubblico locale,"PERSONALE TURNISTA (OPERATORI ESERCIZIO, COLLABORATORI ESERCIZIO E AUSILIARI) DELLA SOC. EAV SEDE DI ISCHIA E PROCIDA (NA)",4 ORE: DALLE 19.55 ALLE 23.55,Locale,null,18/06/2025,Campania,Napoli,18/06/2025 12:20,2025-07-26,2025-07-26
Effettuato,26/07/2025,26/07/2025,OSR USB LAVORO PRIVATO,Trasporto pubblico locale,PERSONALE SOC. BUSITALIA SITA NORD REGIONE UMBRIA,24 ORE: VARIE MODALITA',Regionale,null,15/07/2025,Umbria,Tutte,15/07/2025 18:51,2025-07-26,2025-07-26
Effettuato,26/07/2025,26/07/2025,OSR/OSP ORSA AUTOFERRO TPL,Trasporto pubblico locale,"PERSONALE SOC. ARST PROVINCE DI CAGLIARI, SASSARI, NUORO E ORISTANO",INTERA GIORNATA LAVORATIVA DEL 26/7 DA INIZIO A FINE SERVIZIO,Territoriale,null,10/07/2025,Sardegna,Tutte,10/07/2025 06:16,2025-07-26,2025-07-26
Effettuato,26/07/2025,26/07/2025,OST FIT-CISL,Aereo,PERSONALE SOC. SWISSPORT ITALIA AEROPORTO DI MILANO LINATE,4 ORE: DALLE 13.00 ALLE 17.00,Nazionale,null,14/07/2025,Italia,Tutte,14/07/2025 11:18,2025-07-26,2025-07-26
Effettuato,26/07/2025,26/07/2025,UILT-UIL,Aereo,PERSONALE SOC. VOLOTEA,4 ORE: DALLE 13.00 ALLE 17.00,Nazionale,ESCLUSI I VOLI PIANIFICATI DA E PER L'AEROPORTO DI PALERMO,19/06/2025,Italia,Tutte,19/06/2025 14:38,2025-07-26,2025-07-26
Effettuato,26/07/2025,26/07/2025,UILT-UIL,Aereo,PERSONALE SOC. SWISSPORT ITALIA AEROPORTO DI MILANO LINATE,4 ORE: DALLE 13.00 ALLE 17.00,Nazionale,ESCLUSI I VOLI DA E PER L'AEROPORTO DI PALERMO,14/07/2025,Italia,Tutte,14/07/2025 10:05,2025-07-26,2025-07-26
"Revocato (include le azioni di revoca, sospensione e differimento)",26/07/2025,26/07/2025,USB LAVORO PRIVATO,Aereo,PERSONALE NAVIGANTE SOC. EASYJET AIRLINES,24 ORE: DALLE 00.00 ALLE 23.59,Nazionale,null,14/07/2025,Italia,Tutte,14/07/2025 14:25,2025-07-26,2025-07-26
Effettuato,26/07/2025,26/07/2025,USB LAVORO PRIVATO,Aereo,"PERSONALE AZIENDE ASSOCIATE AD ASSAEROPORTI, AEROPORTI 2030, ASSOHANDLERS, FEDERCATERING E PERSONALE DI TERRA DEI VETTORI DELL'AEROPORTO DI FIUMICINO",4 ORE: DALLE 13.00 ALLE 17.00,Nazionale,ART.2 COMMA 7 L. 146/90 E S.M.I. -ESCLUSI I VOLI DA E PER L'AEROPORTO DI PALERMO,23/07/2025,Italia,Tutte,23/07/2025 14:25,2025-07-26,2025-07-26
Effettuato,25/07/2025,26/07/2025,FILT-CGIL/FIT-CISL/UILT-UIL/UGL/FAST/ORSA TRASPORTI,Appalti ferroviari,PERSONALE SOC. ELIOR DIV. POLARIS ADDETTO A SERVIZI ACCOGLIENZA E ACCOMPAGNAMENTO TRENI NOTTE INTERCITY DELLA SOC. TRENITALIA,PRIMA META' DEL TURNO DI LAVORO ( TRA LE 16.00 DEL 25/7 E LE 15.59 DEL 26/7 ),Nazionale,null,07/07/2025,Italia,Tutte,07/07/2025 11:41,2025-07-25,2025-07-26
Effettuato,25/07/2025,25/07/2025,RSA USB LAVORO PRIVATO,Trasporto pubblico locale,PERSONALE SOC. STP DI TERRA D'OTRANTO BACINO DI LECCE,4 ORE: DALLE 16.30 ALLE 20.30,Territoriale,null,05/07/2025,Puglia,Lecce,05/07/2025 16:58,2025-07-25,2025-07-25
Effettuato,23/07/2025,23/07/2025,OSR FAISA-CONFAIL,Trasporto pubblico locale,PERSONALE FRONT-LINE DELLA SOC. EAV DI NAPOLI,2 ORE:  DALLE 09.00 ALLE 11.00,Locale,ART.2 COMMA 7 L. 146/90 E S.M.I.,21/07/2025,Campania,Napoli,21/07/2025 19:39,2025-07-23,2025-07-23
Effettuato,22/07/2025,23/07/2025,FILT-CGIL/FIT-CISL/UILT-UIL,Trasporto merci,PERSONALE SOC. CAPTRAIN ITALIA,24 ORE: DALLE 16.00 DEL 22/7 ALLE 16.00 DEL 23/7,Nazionale,null,11/07/2025,Italia,Tutte,11/07/2025 10:26,2025-07-22,2025-07-23
Effettuato,22/07/2025,23/07/2025,FILT-CGIL/FIT-CISL/UILT-UIL/UGL FERROVIERI/FAST-CONFSAL,Trasporto merci,PERSONALE VIAGGIANTE TRASPORTO MERCI SU FERRO SOC. GTS RAIL,24 ORE: DALLE 16.01 DEL 22/7 ALLE 16.00 DEL 23/7,Nazionale,null,26/06/2025,Italia,Tutte,26/06/2025 14:54,2025-07-22,2025-07-23
Effettuato,21/07/2025,22/07/2025,OSR FILT-CGIL/FIT-CISL/UILT-UIL,Marittimo,PERSONALE SOC. CARONTE & TOURIST ISOLE MINORI REGIONE SICILIA,24 ORE: DALLE 6.00 DEL 21/7 ALLE 05.59 DEL 22/7,Regionale,null,11/07/2025,Sicilia,Tutte,11/07/2025 15:58,2025-07-21,2025-07-22
"Revocato (include le azioni di revoca, sospensione e differimento)",20/07/2025,21/07/2025,OSR ORSA FERROVIE,Ferroviario,"PERSONALE SOC. TRENITALIA ADDETTO A VENDITA, ASSISTENZA DIREZIONE BUSINESS REGIONALE PIEMONTE E VALLE D'AOSTA",23 ORE: DALLE 03.00 DEL20/7 ALLE 02.00 DEL 21/7,Regionale,null,05/06/2025,Piemonte,Tutte,05/06/2025 15:04,2025-07-20,2025-07-21
"Revocato (include le azioni di revoca, sospensione e differimento)",20/07/2025,21/07/2025,OSR ORSA FERROVIE,Ferroviario,PERSONALE MOBILE SOC. TRENITALIA DIREZIONE BUSINESS REGIONALE PIEMONTE E VALLE D'AOSTA,23 ORE: DALLE 03.00 DEL 20/7 ALLE 02.00 DEL 21/7,Regionale,null,05/06/2025,Piemonte,Tutte,05/06/2025 15:04,2025-07-20,2025-07-21
Effettuato,20/07/2025,20/07/2025,OSR ORSA FERROVIE,Ferroviario,PERSONALE SOC. RFI DELLA SALA BLU - COAMI DI MILANO,8 ORE: DALLE 9.00 ALLE 16.59,Locale,null,09/06/2025,Lombardia,Milano,09/06/2025 13:51,2025-07-20,2025-07-20
"Revocato (include le azioni di revoca, sospensione e differimento)",20/07/2025,21/07/2025,USB LAVORO PRIVATO,Trasporto merci,PERSONALE SOC. MEDWAY ITALIA,23 ORE: DALLE 03.00 DEL 20/7 ALLE 02.00 DEL 21/7,Nazionale,null,07/07/2025,Italia,Tutte,07/07/2025 11:48,2025-07-20,2025-07-21
Effettuato,19/07/2025,19/07/2025,OSR FILT-CGIL/FAISA-CISAL/UGL-AUTOFERRO,Trasporto pubblico locale,PERSONALE SOC. SATI DI CAMPOBASSO,4 ORE: DALLE 8.30 ALLE 12.30,Locale,null,18/06/2025,Molise,Campobasso,18/06/2025 15:12,2025-07-19,2025-07-19
Effettuato,18/07/2025,18/07/2025,A.L. COBAS,Trasporto pubblico locale,PERSONALE SOC. NET (NORD EST TRASPORTI) DI MONZA  E TREZZO SULL'ADDA,4 ORE: DALLE 18.00 ALLE 22.00,Locale,null,04/06/2025,Lombardia,Monza e Brianza,04/06/2025 13:48,2025-07-18,2025-07-18
"Revocato (include le azioni di revoca, sospensione e differimento)",18/07/2025,18/07/2025,OSR FILT-CGIL/FAISA-CISAL,Trasporto pubblico locale,"PERSONALE SOCC. TPL REGIONE UMBRIA BUSITALIA SITA NORD, SULGA AUTOLINEE, ACAP, AUTOSERVIZI TROIANI, CMT TERNI, AUTOSERVIZI FONTI, EREDI FORTUNI",4 ORE: DALLE 20.00 ALLE 24.00,Regionale,null,07/07/2025,Umbria,Tutte,07/07/2025 23:02,2025-07-18,2025-07-18
"Revocato (include le azioni di revoca, sospensione e differimento)",18/07/2025,18/07/2025,OSR USB LAVORO PRIVATO,Trasporto pubblico locale,PERSONALE SOC. BUSITALIA SITA NORD REGIONE UMBRIA,24 ORE,Regionale,null,03/07/2025,Umbria,Tutte,03/07/2025 10:20,2025-07-18,2025-07-18
Effettuato,18/07/2025,18/07/2025,OST FILT-CGIL/UILT-UIL/UGL-FNA/COBAS,Trasporto pubblico locale,"PERSONALE SOCC. ATC ESERCIZIO, TROTTA BUS SERVICE, AUTOSERVIZI RICCITELLI DI LA SPEZIA",4 ORE: DALLE 11.00 ALLE 15.00,Territoriale,null,16/06/2025,Liguria,La Spezia,16/06/2025 16:54,2025-07-18,2025-07-18
"Revocato (include le azioni di revoca, sospensione e differimento)",17/07/2025,17/07/2025,OST FILT-CGIL/FIT-CISL/UILT-UIL/FEDERMAR-CISAL/USCLAC-UNCDIM-SMACD/CONFINTESA MARE E PORTI + RSU,Marittimo,PERSONALE SOC. CARONTE E TOURIST AREA STRETTO DI MESSINA,8 ORE: DALLE 9.00 ALLE 17.00,Territoriale,null,24/05/2025,Sicilia,Messina,24/05/2025 11:37,2025-07-17,2025-07-17
Effettuato,16/07/2025,16/07/2025,OSP UNICA TAXI CGIL/URITAXI/CONFARTIGIANATO TAXI/SITAFI FEDERTAXI CISAL/UGL TAXI,Taxi,ADDETTI AL SERVIZIO TAXI  TERRITORIO COMUNALE DI FIRENZE,24 ORE,Territoriale,null,04/07/2025,Toscana,Firenze,04/07/2025 15:54,2025-07-16,2025-07-16
Effettuato,15/07/2025,15/07/2025,OSP FAST-CONFSAL,Trasporto pubblico locale,PERSONALE SOC. AUTOLINEE TOSCANE DI PISA,4 ORE: DALLE 17.30 ALLE 21.30,Provinciale,null,24/06/2025,Toscana,Pisa,24/06/2025 21:43,2025-07-15,2025-07-15
Effettuato,15/07/2025,15/07/2025,OSR FILT-CGIL/FIT-CISL/UILT-UIL/UGL-FNA,Trasporto pubblico locale,"PERSONALE SOC. AUTOGUIDOVIE PROVINCE DI MILANO, PAVIA, CREMONA, MONZA E DELLA BRIANZA, BOLOGNA, MANTOVA, LODI",4 ORE: DALLE 08.30 ALLE 12.30,Territoriale,null,13/06/2025,Lombardia,Tutte,09/07/2025 07:25,2025-07-15,2025-07-15
Effettuato,14/07/2025,14/07/2025,OSR FAISA-CISAL,Trasporto pubblico locale,PERSONALE SOC. AUTOLINEE RUSSO DI PALERMO,4 ORE: DALLE 9.30 ALLE 13.30,Locale,null,17/06/2025,Sicilia,Palermo,17/06/2025 18:00,2025-07-14,2025-07-14
Effettuato,14/07/2025,14/07/2025,OSR FAISA-CISAL,Trasporto pubblico locale,PERSONALE SOC. SEGESTA AUTOLINEE DI PALERMO,4 ORE: DALLE 9.30 ALLE 13.30,Locale,null,17/06/2025,Sicilia,Palermo,17/06/2025 18:00,2025-07-14,2025-07-14
Effettuato,14/07/2025,14/07/2025,OSR FAISA-CISAL,Trasporto pubblico locale,PERSONALE SOC. ETNA TRASPORTI DI CATANIA,4 ORE: DALLE 9.30 ALLE 13.30,Locale,null,17/06/2025,Sicilia,Catania,17/06/2025 18:00,2025-07-14,2025-07-14
Effettuato,14/07/2025,14/07/2025,OSR FAISA-CISAL,Trasporto pubblico locale,PERSONALE SOC.INTERBUS DI ENNA,4 ORE: DALLE 9.30 ALLE 13.30,Locale,null,17/06/2025,Sicilia,Enna,17/06/2025 18:00,2025-07-14,2025-07-14
"Revocato (include le azioni di revoca, sospensione e differimento)",14/07/2025,14/07/2025,OSR FILT-CGIL + RSA,Circolazione e sicurezza stradale,PERSONALE SOC. GSA ADDETTO A PRONTO INTERVENTO ANTINCENDIO E PRIMO SOCCORSO CANTIERE AUTOSTRADALE TRATTO APPENNINICO TOSCO-EMILIANO E ASPI IV TRONCO,4 ORE: DALLE 10.00 ALLE 14.00,Territoriale,REGIONI EMILIA ROMAGNA E TOSCANA,01/07/2025,Toscana,Tutte,01/07/2025 14:15,2025-07-14,2025-07-14
Effettuato,14/07/2025,14/07/2025,OSR FILT-CGIL + RSA,Circolazione e sicurezza stradale,PERSONALE SOC. GSA ADDETTO A PRONTO INTERVENTO ANTINCENDIO E PRIMO SOCCORSO CANTIERE AUTOSTRADALE TRATTO APPENNINICO TOSCO-EMILIANO E ASPI IV TRONCO,4 ORE: DALLE 16.00 ALLE 20.00,Territoriale,REGIONI EMILIA ROMAGNA E TOSCANA,01/07/2025,Toscana,Tutte,02/07/2025 12:33,2025-07-14,2025-07-14
Effettuato,13/07/2025,13/07/2025,OSP FILT-CGIL/FIT-CISL/UILT-UIL/UGL-FNA/FAISA-CISAL/SIAL COBAS + RSU,Trasporto pubblico locale,PERSONALE SOC. TPL LINEA DI SAVONA,24 ORE,Locale,null,12/06/2025,Liguria,Savona,12/06/2025 12:54,2025-07-13,2025-07-13
"Revocato (include le azioni di revoca, sospensione e differimento)",11/07/2025,11/07/2025,OSR FILT-CGIL/FIT-CISL/UILT-UIL/UGL T.A.,Aereo,PERSONALE SOC. GESAP AEROPORTO DI PALERMO,24 ORE: DALLE 00.00 ALLE 23.59,Interregionale,null,07/05/2025,Sicilia,Palermo,07/05/2025 19:01,2025-07-11,2025-07-11
Effettuato,10/07/2025,10/07/2025,FLAI TRASPORTI E SERVIZI,Aereo,PERSONALE AZIENDE HANDLING ASSOCIATE ASSOHANDLERS OPERANTI NEI SEDIMI AEROPORTUALI ITALIANI,24 ORE,Nazionale,ESCLUSI I VOLI DA E PER L'AEROPORTO DI PALERMO,30/05/2025,Italia,Tutte,30/05/2025 13:07,2025-07-10,2025-07-10
Effettuato,10/07/2025,10/07/2025,FLAI TRASPORTI E SERVIZI,Aereo,PERSONALE SOC. AVIATION SERVICES AEROPORTO DI VENEZIA,24 ORE,Interregionale,ESCLUSI I VOLI DA E PER L'AEROPORTO DI PALERMO,30/05/2025,Italia,Tutte,30/05/2025 13:23,2025-07-10,2025-07-10
Effettuato,10/07/2025,10/07/2025,OSP FILT-CGIL,Aereo,PERSONALE SOC. SWISSPORT ITALIA AEROPORTO DI MILANO LINATE,24 ORE,Nazionale,ESCLUSI I VOLI DA E PER L'AEROPORTO DI PALERMO,09/06/2025,Italia,Tutte,09/06/2025 15:37,2025-07-10,2025-07-10
Effettuato,10/07/2025,10/07/2025,OSR UGL-TA,Aereo,PERSONALE SOC. ROMEO GESTIONI - APPALTO GESAC PRESSO AEROPORTO NAPOLI CAPODICHINO,4 ORE: DALLE 11.00 ALLE 15.00,Interregionale,null,05/06/2025,Italia,Tutte,05/06/2025 22:03,2025-07-10,2025-07-10
Effettuato,10/07/2025,10/07/2025,OSR UGL-TA,Aereo,PERSONALE SOC. SOGAERSECURITY AEROPORTO DI CAGLIARI,4 ORE: DALLE 13.00 ALLE 17.00,Locale,ESCLUSI I VOLI DA E PER L'AEROPORTO DI PALERMO,18/06/2025,Sardegna,Cagliari,18/06/2025 00:00,2025-07-10,2025-07-10
Effettuato,10/07/2025,10/07/2025,OSR USB LAVORO PRIVATO,Aereo,PERSONALE SOC. AIRPORT HANDLING AEROPORTI DI MILANO LINATE E MALPENSA,24 ORE: DALLE 00.00 ALLE 23.59,Nazionale,ESCLUSI I VOLI DA E PER L'AEROPORTO DI PALERMO,24/06/2025,Italia,Tutte,24/06/2025 19:39,2025-07-10,2025-07-10
"Revocato (include le azioni di revoca, sospensione e differimento)",10/07/2025,10/07/2025,OST CUB TRASPORTI,Aereo,PERSONALE AUTISTI SOC. SEA AEROPORTI DI MILANO LINATE E MALPENSA,24 ORE: DALLE 00.00 ALLE 23.59,Nazionale,null,27/05/2025,Italia,Tutte,28/05/2025 09:56,2025-07-10,2025-07-10
Effettuato,10/07/2025,10/07/2025,OST CUB TRASPORTI,Aereo,PERSONALE AUTISTI SOC. SEA AEROPORTI DI MILANO LINATE E MALPENSA,24 ORE: DALLE 00.01 ALLE 23.59,Nazionale,null,30/05/2025,Italia,Tutte,30/05/2025 14:58,2025-07-10,2025-07-10
Effettuato,10/07/2025,10/07/2025,OST CUB TRASPORTI,Aereo,PERSONALE SOC. SWISSPORT ITALIA AEROPORTO DI MILANO LINATE,24 ORE: DALLE 00.00 ALLE 23.59,Nazionale,ESCLUSI I VOLI DA E PER L'AEROPORTO DI PALERMO,01/06/2025,Italia,Tutte,03/06/2025 09:52,2025-07-10,2025-07-10
Effettuato,10/07/2025,10/07/2025,OST FIT-CISL,Aereo,PERSONALE SOC. SWISSPORT ITALIA AEROPORTO DI MILANO LINATE,24 ORE,Nazionale,ESCLUSI I VOLI DA E PER L'AEROPORTO DI PALERMO,09/06/2025,Italia,Tutte,09/06/2025 15:48,2025-07-10,2025-07-10
Effettuato,10/07/2025,10/07/2025,UILT-UIL,Aereo,PERSONALE SOC. SWISSPORT ITALIA AEROPORTO DI MILANO LINATE,24 ORE,Nazionale,null,06/06/2025,Italia,Tutte,06/06/2025 14:53,2025-07-10,2025-07-10
Effettuato,10/07/2025,10/07/2025,USB LAVORO PRIVATO,Aereo,PERSONALE NAVIGANTE SOC. EASYJET AIRLINES,24 ORE: DALLE 00.00 ALLE 23.59,Nazionale,ESCLUSI I VOLI DA E PER L'AEROPORTO DI PALERMO,25/06/2025,Italia,Tutte,25/06/2025 14:39,2025-07-10,2025-07-10
"Revocato (include le azioni di revoca, sospensione e differimento)",08/07/2025,08/07/2025,USB LAVORO PRIVATO,Plurisettoriale,PERSONALE IMPRESE COMPARTO FERROVIARIO,"SETTORE FERROVIARIO, TRASPORTO MERCI SU ROTAIA E *TPL: DALLE 10.00 ALLE 18.00",Nazionale,"*PER TPL SOCC. GTT, FERR. UDINE CIVIDALE, SIST. TERRITORIALI, TRASP. FERR.TOSCANO, F.A.S. - TUA, EAV, FERROTRAMVIARIA, FERR. GARGANO, FERR. CALABRIA, FERR. SUD EST, SAD, TRENTINO TRASPORTI",27/06/2025,Italia,Tutte,27/06/2025 12:18,2025-07-08,2025-07-08
Effettuato,08/07/2025,08/07/2025,USB LAVORO PRIVATO,Ferroviario,PERSONALE AZIENDE GRUPPO FERROVIE DELLO STATO ITALIANE,8 ORE: INTERA PRESTAZIONE/TURNO DELL'8/7,Nazionale,null,27/06/2025,Italia,Tutte,27/06/2025 12:18,2025-07-08,2025-07-08
"Revocato (include le azioni di revoca, sospensione e differimento)",07/07/2025,08/07/2025,ASSEMBLEA NAZIONALE PDM/PDB GRUPPO FSI,Ferroviario,PERSONALE DI MACCHINA E DI BORDO DEL GRUPPO FERROVIE DELLO STATO ITALIANE,21 ORE: DALLE 21.00 DEL 7/7 ALLE 18.00 DELL'8/7,Nazionale,null,04/06/2025,Italia,Tutte,04/06/2025 16:18,2025-07-07,2025-07-08
Effettuato,07/07/2025,08/07/2025,ASSEMBLEA NAZIONALE PDM/PDB GRUPPO FSI,Ferroviario,PERSONALE DI MACCHINA E DI BORDO DEL GRUPPO FERROVIE DELLO STATO ITALIANE,21 ORE: DALLE 21.00 DEL 7/7 ALLE 18.00 DELL' 8/7,Nazionale,null,26/06/2025,Italia,Tutte,26/06/2025 16:33,2025-07-07,2025-07-08
"Revocato (include le azioni di revoca, sospensione e differimento)",07/07/2025,08/07/2025,CUB TRASPORTI,Plurisettoriale,PERSONALE IMPRESE CHE SVOLGONO ATTIVITA' FERROVIARIA,SETTORE FERROVIARIO E TRASPORTO MERCI SU ROTAIA: 21 ORE DALLE 21.00 DEL 7/7 ALLE 18.00 DELL'8/7; *TPL: INTERA PRESTAZIONE DELL'8/7,Nazionale,"*PER TPL SOCC. FER. SUD EST, GTT, SAD, TRENTINO TRASP.,  FER. UDINE C., SIST. TERRITORIALI, TFT, FERROTRAMVIARIA, FER.ADR. SANGRITANA-TUA, EAV, FER. GARGANO, FER. CALABRIA",24/05/2025,Italia,Tutte,24/05/2025 00:01,2025-07-07,2025-07-08
"Revocato (include le azioni di revoca, sospensione e differimento)",07/07/2025,08/07/2025,CUB TRASPORTI,Plurisettoriale,PERSONALE IMPRESE CHE SVOLGONO ATTIVITA' FERROVIARIA,SETTORE FERROVIARIO E TRASPORTO MERCI SU ROTAIA: 21 ORE DALLE 21.00 DEL 7/7 ALLE 18.00 DELL'8/7; *TPL: INTERA PRESTAZIONE DELL'8/7,Nazionale,"ESCLUSO SETTORE MAN. INFRASTRUTTURE SOC. RFI - *PER TPL SOCC. FER. SUD EST, GTT, SAD, TRENTINO TRASP.,  FER. UDINE C., SIST. TERRITORIALI, TFT, FERROTRAMVIARIA, FER.ADR. SANGRITANA-TUA, EAV, FER. GARGANO, FER. CALABRIA",04/06/2025,Italia,Tutte,04/06/2025 00:01,2025-07-07,2025-07-08
Effettuato,07/07/2025,08/07/2025,CUB TRASPORTI,Plurisettoriale,PERSONALE IMPRESE CHE SVOLGONO ATTIVITA' FERROVIARIA,SETTORE FERROVIARIO E TRASPORTO MERCI SU ROTAIA: 21 ORE DALLE 21.00 DEL 7/7 ALLE 18.00 DELL'8/7; *TPL: INTERA PRESTAZIONE DELL'8/7,Nazionale,"ESCLUSO SETTORE MAN. INFRASTRUTTURE SOC. RFI - *PER TPL SOCC. FER. SUD EST, GTT, SAD, TRENTINO TRASP.,  FER. UDINE C., SIST. TERRITORIALI, TFT, FERROTRAMVIARIA, FER.ADR. SANGRITANA-TUA, EAV, FER. GARGANO, FER. CALABRIA",12/06/2025,Italia,Tutte,12/06/2025 19:35,2025-07-07,2025-07-08
Effettuato,07/07/2025,08/07/2025,FILT-CGIL/FIT-CISL/UILT-UIL,Trasporto merci,PERSONALE SOC. CAPTRAIN ITALIA,21 ORE: DALLE 21.00 DEL 7/7 ALLE 18.00 DELL' 8/7,Nazionale,null,24/06/2025,Italia,Tutte,24/06/2025 09:38,2025-07-07,2025-07-08
Effettuato,07/07/2025,07/07/2025,OST CUB TRASPORTI,Trasporto pubblico locale,PERSONALE SOC. ATC DI LA SPEZIA,4 ORE: DALLE 11.00 ALLE 15.00,Locale,null,30/05/2025,Liguria,La Spezia,30/05/2025 15:44,2025-07-07,2025-07-07
"Revocato (include le azioni di revoca, sospensione e differimento)",07/07/2025,08/07/2025,SGB,Plurisettoriale,PERSONALE IMPRESE CHE SVOLGONO ATTIVITA' FERROVIARIA,21 ORE: DALLE 21.00 DEL 7/7 ALLE 18.00 DELL' 8/7,Nazionale,null,24/06/2025,Italia,Tutte,24/06/2025 19:36,2025-07-07,2025-07-08
"Revocato (include le azioni di revoca, sospensione e differimento)",07/07/2025,08/07/2025,SGB,Plurisettoriale,PERSONALE IMPRESE CHE SVOLGONO ATTIVITA' FERROVIARIA,SETTORE FERROVIARIO E TRASPORTO MERCI SU ROTAIA: 21 ORE DALLE 21.00 DEL 7/7 ALLE 18.00 DELL'8/7; *TPL: INTERA PRESTAZIONE DELL'8/7,Nazionale,"*PER TPL SOCC. GTT, TRENTINO TRASP., FERR. UDINE CIVIDALE, FERR. SUD EST, SIST. TERRITORIALI, TRASP. FERR.TOSCANO, F.A.S. - TUA, EAV, FERROTRAMVIARIA, FERR. GARGANO, FERR. CALABRIA",25/06/2025,Italia,Tutte,25/06/2025 14:02,2025-07-07,2025-07-08
Effettuato,05/07/2025,05/07/2025,OSR/OSP ORSA AUTOFERRO TPL,Trasporto pubblico locale,"PERSONALE SOC. ARST PROVINCE DI CAGLIARI, SASSARI, NUORO E ORISTANO",24 ORE,Territoriale,null,10/06/2025,Sardegna,Tutte,10/06/2025 19:50,2025-07-05,2025-07-05
"Revocato (include le azioni di revoca, sospensione e differimento)",05/07/2025,07/07/2025,UGL MARE E PORTI,Marittimo,PERSONALE MARITTIMO SOC. GNV - GRANDI NAVI VELOCI,48 ORE: DALLE 14.00 DEL 5/7 ALLE 13.59 DEL 7/7,Nazionale,null,07/05/2025,Italia,Tutte,07/05/2025 17:09,2025-07-05,2025-07-07
"Revocato (include le azioni di revoca, sospensione e differimento)",01/07/2025,01/07/2025,UILT-UIL,Elicotteri,PERSONALE ELICOTTERISTICO (PILOTI E TECNICI) SOC. ELILOMBARDA,8 ORE: DALLE 10.00 ALLE 18.00,Nazionale,null,05/06/2025,Italia,Tutte,05/06/2025 15:27,2025-07-01,2025-07-01
"Revocato (include le azioni di revoca, sospensione e differimento)",25/06/2025,25/06/2025,OSR FILT-CGIL/FAISA-CISAL/UGL-AUTOFERRO,Trasporto pubblico locale,PERSONALE SOC. SATI DI CAMPOBASSO,4 ORE: DALLE 8.30 ALLE 12.30,Locale,null,13/06/2025,Molise,Campobasso,16/06/2025 11:10,2025-06-25,2025-06-25
"Revocato (include le azioni di revoca, sospensione e differimento)",25/06/2025,25/06/2025,USB LAVORO PRIVATO,Aereo,PERSONALE ADDETTO ALLO SCARICO E CARICO MERCI SOC. GDA HANDLING AEROPORTO DI BRESCIA MONTICHIARI,12 ORE: DALLE 7.00 ALLE 19.00,Locale,ART.2 COMMA 7 L. 146/90 E S.M.I,24/06/2025,Lombardia,Brescia,24/06/2025 17:23,2025-06-25,2025-06-25
"Revocato (include le azioni di revoca, sospensione e differimento)",24/06/2025,24/06/2025,UILT-UIL,Elicotteri,PERSONALE ELICOTTERISTICO (PILOTI E TECNICI) SOC. ELILOMBARDA,8 ORE: DALLE 10.00 ALLE 18.00,Nazionale,null,05/06/2025,Italia,Tutte,05/06/2025 09:52,2025-06-24,2025-06-24
"Revocato (include le azioni di revoca, sospensione e differimento)",20/06/2025,20/06/2025,CUB,Generale,SCIOPERO GENERALE CATEGORIE PUBBLICHE E PRIVATE,INTERA GIORNATA - FERROVIARIO E AUTOSTRADE: 0 ORE,Nazionale,ADESIONE DELLA OS FISI,21/05/2025,Italia,Tutte,21/05/2025 10:00,2025-06-20,2025-06-20
"Revocato (include le azioni di revoca, sospensione e differimento)",20/06/2025,20/06/2025,CUB,Generale,SCIOPERO GENERALE CATEGORIE PUBBLICHE E PRIVATE,INTERA GIORNATA - FERROVIARIO: DALLE 21.00 DEL 19/6 ALLE 21.00 DEL 20/6; AUTOSTRADE: DALLE 22.00 DEL 19/6 ALLE 22.00 DEL 20/6,Nazionale,ADESIONE DELLA OS FISI,21/05/2025,Italia,Tutte,22/05/2025 10:37,2025-06-20,2025-06-20
Effettuato,20/06/2025,20/06/2025,CUB/SGB/USB,Generale,SCIOPERO GENERALE CATEGORIE PUBBLICHE E PRIVATE,"INTERA GIORNATA - AEREO: DALLE 00.00 ALLE 23.59; FERROVIARIO: DALLE 21.00 DEL 19/6 ALLE 20.59 DEL 20/6; AUTOSTRADE: DALLE 22.00 DEL 19/6 ALLE 21.59 DEL 20/6;TPL, MARITTIMO E PORTI: 24 ORE VARIE MODALITA'",Nazionale,"ADESIONE DELLE OOSS SBM, FISI E FLAI - ESCLUSO PERSONALE SOCC. TRENORD, BUSITALIA RAIL SERVICE E FNM ED ALTRE CATEGORIE SCIOPERI PRECEDENTEMENTE PROCLAMATI",30/05/2025,Italia,Tutte,30/05/2025 16:32,2025-06-20,2025-06-20
Effettuato,20/06/2025,20/06/2025,FILT-CGIL/FIT-CISL/UILT-UIL,Trasporto merci,PERSONALE SOC. CAPTRAIN ITALIA,8 ORE: DALLE 13.00 ALLE 21.00,Nazionale,null,05/06/2025,Italia,Tutte,05/06/2025 17:22,2025-06-20,2025-06-20
"Revocato (include le azioni di revoca, sospensione e differimento)",20/06/2025,20/06/2025,FLAI,Generale,SCIOPERO GENERALE CATEGORIE PUBBLICHE E PRIVATE,INTERA GIORNATA,Nazionale,ESCLUSO SERVIZIO TRASPORTO PASSEGGERI,01/06/2025,Italia,Tutte,01/06/2025 10:29,2025-06-20,2025-06-20
"Revocato (include le azioni di revoca, sospensione e differimento)",20/06/2025,20/06/2025,FLAI TRASPORTI E SERVIZI,Aereo,PERSONALE SOC. AVIATION SERVICES AEROPORTO DI VENEZIA,24 ORE,Interregionale,null,29/05/2025,Italia,Tutte,29/05/2025 15:06,2025-06-20,2025-06-20
"Revocato (include le azioni di revoca, sospensione e differimento)",20/06/2025,20/06/2025,FLAI TRASPORTI E SERVIZI,Aereo,PERSONALE AZIENDE HANDLING ASSOCIATE ASSOHANDLERS OPERANTI NEI SEDIMI AEROPORTUALI ITALIANI,24 ORE,Nazionale,null,29/05/2025,Italia,Tutte,29/05/2025 14:32,2025-06-20,2025-06-20
"Revocato (include le azioni di revoca, sospensione e differimento)",20/06/2025,20/06/2025,OSR FILT-CGIL/FIT-CISL/UGL-TA/USB LAVORO PRIVATO,Aereo,PERSONALE SOC. ROMEO GESTIONI - APPALTO GESAC PRESSO AEROPORTO NAPOLI CAPODICHINO,4 ORE: DALLE 11.00 ALLE 15.00,Interregionale,null,02/06/2025,Italia,Tutte,02/06/2025 20:17,2025-06-20,2025-06-20
"Revocato (include le azioni di revoca, sospensione e differimento)",20/06/2025,20/06/2025,OSR/OSP ORSA AUTOFERRO TPL,Trasporto pubblico locale,"PERSONALE SOC. ARST PROVINCE DI CAGLIARI, SASSARI, NUORO E ORISTANO",24 ORE,Territoriale,null,07/06/2025,Sardegna,Tutte,07/06/2025 16:17,2025-06-20,2025-06-20
"Revocato (include le azioni di revoca, sospensione e differimento)",20/06/2025,20/06/2025,SBM,Generale,SCIOPERO GENERALE CATEGORIE PUBBLICHE E PRIVATE,INTERA GIORNATA - FERROVIARIO: DALLE 21.00 DEL 19/6 ALLE 21.00 DEL 20/6; AUTOSTRADE: DALLE 22.00 DEL 19/6 ALLE 22.00 DEL 20/6,Nazionale,null,28/05/2025,Italia,Tutte,28/05/2025 19:24,2025-06-20,2025-06-20
"Revocato (include le azioni di revoca, sospensione e differimento)",20/06/2025,20/06/2025,SGB,Generale,SCIOPERO GENERALE CATEGORIE PUBBLICHE E PRIVATE,INTERA GIORNATA - FERROVIARIO: DALLE 21.00 DEL 19/6 ALLE 21.00 DEL 20/6; AUTOSTRADE: DALLE 22.00 DEL 19/6 ALLE 22.00 DEL 20/6,Nazionale,null,22/05/2025,Italia,Tutte,22/05/2025 10:45,2025-06-20,2025-06-20
Effettuato,20/06/2025,20/06/2025,SI-COBAS,Generale,SCIOPERO GENERALE CATEGORIE PUBBLICHE E PRIVATE,INTERA GIORNATA - FERROVIARIO: DALLE 21.00 DEL 19/6 ALLE 21.00 DEL 20/6,Nazionale,null,04/06/2025,Italia,Tutte,04/06/2025 11:49,2025-06-20,2025-06-20
"Revocato (include le azioni di revoca, sospensione e differimento)",20/06/2025,20/06/2025,USB,Generale,SCIOPERO GENERALE CATEGORIE PUBBLICHE E PRIVATE,INTERA GIORNATA,Nazionale,ADESIONE DELLA OS FISI,14/05/2025,Italia,Tutte,14/05/2025 12:19,2025-06-20,2025-06-20
Effettuato,16/06/2025,17/06/2025,OSR ORSA FERROVIE,Ferroviario,PERSONALE SOC. TRENORD,23 ORE: DALLE 03.00 DEL 16/6 ALLE 02.00 DEL 17/6,Regionale,null,02/05/2025,Lombardia,Tutte,02/05/2025 12:07,2025-06-16,2025-06-17
Effettuato,15/06/2025,15/06/2025,OSR FISI,Trasporto pubblico locale,PERSONALE AREA FERRO SOC. ANM DI NAPOLI,4 ORE: DALLE 12.45 ALLE 16.45,Locale,null,08/05/2025,Campania,Napoli,09/05/2025 08:48,2025-06-15,2025-06-15
"Revocato (include le azioni di revoca, sospensione e differimento)",15/06/2025,16/06/2025,OSR ORSA FERROVIE,Ferroviario,PERSONALE MOBILE SOC. TRENITALIA DIREZIONE BUSINESS REGIONALE PIEMONTE E VALLE D'AOSTA,23 ORE: DALLE 03.00 DEL 15/6 ALLE 02.00 DEL 16/6,Regionale,null,12/05/2025,Piemonte,Tutte,12/05/2025 22:50,2025-06-15,2025-06-16
"Revocato (include le azioni di revoca, sospensione e differimento)",15/06/2025,16/06/2025,OSR ORSA FERROVIE,Ferroviario,"PERSONALE SOC. TRENITALIA ADDETTO A VENDITA, ASSISTENZA DIREZIONE BUSINESS REGIONALE PIEMONTE E VALLE D'AOSTA",23 ORE: DALLE 03.00 DEL 15/6 ALLE 02.00 DEL 16/6,Regionale,null,12/05/2025,Piemonte,Tutte,12/05/2025 22:50,2025-06-15,2025-06-16
"Revocato (include le azioni di revoca, sospensione e differimento)",14/06/2025,15/06/2025,OSR UILT-UIL,Ferroviario,PERSONALE SOC. RFI SALA CIRCOLAZIONE E ORARIO DI CAGLIARI E UNITA' CIRCOLAZIONE SARDEGNA,24 ORE: DALLE 21.00 DEL 14/6 ALLE 20.59 DEL 15/6,Regionale,null,01/05/2025,Sardegna,Tutte,01/05/2025 10:02,2025-06-14,2025-06-15
"Revocato (include le azioni di revoca, sospensione e differimento)",13/06/2025,13/06/2025,CUB TRASPORTI,Aereo,"LAVORATORI COMPARTO AEREO, AEROPORTUALE E INDOTTO AEROPORTI",4 ORE: DALLE 13.00 ALLE 17.00,Nazionale,ESCLUSO PERSONALE SOC. ENAV,11/05/2025,Italia,Tutte,11/05/2025 07:34,2025-06-13,2025-06-13
"Revocato (include le azioni di revoca, sospensione e differimento)",13/06/2025,13/06/2025,FLAI TRASPORTI E SERVIZI,Aereo,PERSONALE AZIENDE HANDLING ASSOCIATE ASSOHANDLERS OPERANTI NEI SEDIMI AEROPORTUALI ITALIANI,24 ORE,Nazionale,null,15/05/2025,Italia,Tutte,15/05/2025 12:16,2025-06-13,2025-06-13
"Revocato (include le azioni di revoca, sospensione e differimento)",13/06/2025,13/06/2025,FLAI TRASPORTI E SERVIZI,Aereo,PERSONALE SOC. AVIATION SERVICES AEROPORTO DI VENEZIA,24 ORE,Interregionale,null,15/05/2025,Italia,Tutte,15/05/2025 13:13,2025-06-13,2025-06-13
"Revocato (include le azioni di revoca, sospensione e differimento)",13/06/2025,13/06/2025,OST CUB TRASPORTI,Aereo,PERSONALE AUTISTI SOC. SEA AEROPORTI DI MILANO LINATE E MALPENSA,24 ORE: DALLE 00.00 ALLE 23.59,Nazionale,null,30/04/2025,Italia,Tutte,30/04/2025 15:54,2025-06-13,2025-06-13
"Revocato (include le azioni di revoca, sospensione e differimento)",09/06/2025,09/06/2025,FILT-CGIL/FIT-CISL/UILT-UIL,Trasporto merci,PERSONALE SOC. CAPTRAIN ITALIA,8 ORE: DALLE 16.00 ALLE 23.59,Nazionale,null,28/05/2025,Italia,Tutte,28/05/2025 10:19,2025-06-09,2025-06-09
"Revocato (include le azioni di revoca, sospensione e differimento)",09/06/2025,09/06/2025,OST CUB TRASPORTI,Trasporto pubblico locale,PERSONALE SOC. ATC DI LA SPEZIA,4 ORE: DALLE 11.00 ALLE 15.00,Locale,null,27/05/2025,Liguria,La Spezia,27/05/2025 15:54,2025-06-09,2025-06-09
Effettuato,09/06/2025,09/06/2025,USB LAVORO PRIVATO,Trasporto merci,PERSONALE SOC. MEDWAY ITALIA,8 ORE: DALLE 16.00 ALLE 23.59,Nazionale,null,29/05/2025,Italia,Tutte,29/05/2025 14:19,2025-06-09,2025-06-09
"Revocato (include le azioni di revoca, sospensione e differimento)",08/06/2025,09/06/2025,FILT-CGIL/FIT-CISL/UILT-UIL/UGL FERROVIERI/FAST-CONFSAL,Trasporto merci,PERSONALE VIAGGIANTE TRASPORTO MERCI SU FERRO SOC. GTS RAIL,24 ORE: DALLE 16.01 DELL' 8/6 ALLE 16.00 DEL 9/6,Nazionale,null,15/05/2025,Italia,Tutte,15/05/2025 13:41,2025-06-08,2025-06-09
Effettuato,06/06/2025,06/06/2025,OSR UILT-SGK,Trasporto pubblico locale,PERSONALE SOC. SAD DI BOLZANO,24 ORE,Locale,null,18/05/2025,Trentino-Alto Adige,Bolzano,22/05/2025 11:00,2025-06-06,2025-06-06
"Revocato (include le azioni di revoca, sospensione e differimento)",04/06/2025,04/06/2025,FILT-CGIL/FIT-CISL/UILT-UIL,Trasporto merci,PERSONALE SOC. CAPTRAIN ITALIA,8 ORE: DALLE 16.00 ALLE 23.59,Nazionale,null,24/05/2025,Italia,Tutte,24/05/2025 00:23,2025-06-04,2025-06-04
Effettuato,04/06/2025,05/06/2025,FILT-CGIL/FIT-CISL/UILT-UIL/UGL FERROVIERI/FAST-CONFSAL,Trasporto merci,PERSONALE VIAGGIANTE TRASPORTO MERCI SU FERRO SOC. GTS RAIL,24 ORE: DALLE 16.01 DEL 4/6 ALLE 16.00 DEL 5/6,Nazionale,null,15/05/2025,Italia,Tutte,15/05/2025 19:55,2025-06-04,2025-06-05
Effettuato,04/06/2025,04/06/2025,OSP COBAS LAVORO PRIVATO,Trasporto pubblico locale,"PERSONALE SOC. AUTOLINEE TOSCANE DIPARTIMENTO CENTRO PROVINCE DI FIRENZE, PISTOIA E PRATO",4 ORE: DALLE 17.30 ALLE 21.30,Territoriale,ASTENSIONE DAL LAVORO STRAORDINARIO DAL 03 AL 04 06 2025,22/05/2025,Toscana,Tutte,22/05/2025 22:22,2025-06-04,2025-06-04
Effettuato,03/06/2025,03/06/2025,ASSEMBLEA NAZIONALE  LAVORATORI MANUTENZIONE INFRASTRUTTURA RFI,Ferroviario,PERSONALE SOC. RFI IMPIANTI MANUTENZIONE INFRASTRUTTURE,23 ORE: DALLE 00.01 ALLE 23.00,Nazionale,null,20/04/2025,Italia,Tutte,20/04/2025 12:35,2025-06-03,2025-06-03
Effettuato,03/06/2025,03/06/2025,COBAS LAVORO PRIVATO/COORDINAMENTO FERROVIERI,Ferroviario,PERSONALE SOC. RFI IMPIANTI MANUTENZIONE INFRASTRUTTURE,23 ORE: DALLE 00.01 ALLE 23.00,Nazionale,null,20/04/2025,Italia,Tutte,20/04/2025 12:43,2025-06-03,2025-06-03
Effettuato,03/06/2025,03/06/2025,OSR/OSP ORSA AUTOFERRO TPL,Trasporto pubblico locale,"PERSONALE SOC. ARST PROVINCE DI CAGLIARI, SASSARI, NUORO E ORISTANO",4 ORE: VARIE MODALITA',Territoriale,null,22/05/2025,Sardegna,Tutte,22/05/2025 22:37,2025-06-03,2025-06-03
Effettuato,01/06/2025,01/06/2025,OSP CUB TRASPORTI,Trasporto pubblico locale,PERSONALE SOC. AMT DI GENOVA,24 ORE VARIE MODALITA',Territoriale,null,06/05/2025,Liguria,Genova,06/05/2025 15:16,2025-06-01,2025-06-01
Effettuato,31/05/2025,31/05/2025,OSR UGL AUTOFERRO,Trasporto pubblico locale,PERSONALE SOC. APT BACINO DI GORIZIA,4 ORE: DALLE 19.00 ALLE 23.00,Locale,null,14/05/2025,Friuli-Venezia Giulia,Gorizia,14/05/2025 08:38,2025-05-31,2025-05-31
Effettuato,30/05/2025,30/05/2025,OSP CUB/SBM,Generale,SCIOPERO GENERALE CATEGORIE PUBBLICHE E PRIVATE PROVINCIA DI TRENTO,INTERA GIORNATA - ESCLUSI SETTORE FERROVIARIO E TPL,Provinciale,null,14/05/2025,Trentino-Alto Adige,Trento,21/05/2025 17:10,2025-05-30,2025-05-30
Effettuato,30/05/2025,30/05/2025,OSP FAISA-CISAL,Trasporto pubblico locale,PERSONALE SOC. ATAF DI FOGGIA,24 ORE,Locale,null,15/04/2025,Puglia,Foggia,15/04/2025 09:50,2025-05-30,2025-05-30
Effettuato,30/05/2025,30/05/2025,OSP FAISA-CISAL,Trasporto pubblico locale,PERSONALE SOC. ATC BACINO DI CASERTA,4 ORE: DALLE 9.00 ALLE 13.00,Locale,null,13/05/2025,Campania,Caserta,13/05/2025 16:15,2025-05-30,2025-05-30
"Revocato (include le azioni di revoca, sospensione e differimento)",30/05/2025,30/05/2025,OSR FILT-CGIL/FIT-CISL/UILT-UIL/FAISA-CISAL,Trasporto pubblico locale,PERSONALE SOC. TUA REGIONE ABRUZZO,24 ORE,Regionale,null,19/05/2025,Abruzzo,Tutte,19/05/2025 19:46,2025-05-30,2025-05-30
Effettuato,30/05/2025,30/05/2025,OSR USB LAVORO PRIVATO,Trasporto pubblico locale,"PERSONALE SOC. SETA BACINI DI MODENA, REGGIO EMILIA E PIACENZA",4 ORE: VARIE MODALITA',Locale,null,13/05/2025,Emilia-Romagna,Tutte,13/05/2025 11:00,2025-05-30,2025-05-30
"Revocato (include le azioni di revoca, sospensione e differimento)",30/05/2025,30/05/2025,OST CUB TRASPORTI,Aereo,PERSONALE AUTISTI SOC. SEA AEROPORTI DI MILANO LINATE E MALPENSA,24 ORE: DALLE 00.00 ALLE 23.59,Nazionale,null,18/04/2025,Italia,Tutte,18/04/2025 12:07,2025-05-30,2025-05-30
"Revocato (include le azioni di revoca, sospensione e differimento)",30/05/2025,30/05/2025,OST FILT-CGIL/FIT-CISL/UILT-UIL/FEDERMAR-CISAL/USCLAC-UNCDIM-SMACD/CONFINTESA MARE E PORTI + RSU,Marittimo,PERSONALE SOC. CARONTE E TOURIST AREA STRETTO,8 ORE: DALLE 9.00 ALLE 17.00,Territoriale,null,20/05/2025,Sicilia,Messina,20/05/2025 16:39,2025-05-30,2025-05-30
Effettuato,28/05/2025,28/05/2025,OSP COBAS LAVORO PRIVATO,Trasporto pubblico locale,PERSONALE SOC. BRESCIA TRASPORTI DI BRESCIA,24 ORE,Locale,null,17/05/2025,Lombardia,Brescia,17/05/2025 10:25,2025-05-28,2025-05-28
Effettuato,28/05/2025,28/05/2025,OSP FILT-CGIL,Aereo,PERSONALE SOC. SWISSPORT ITALIA AEROPORTO DI MILANO LINATE,4 ORE: DALLE 13.00 ALLE 17.00,Nazionale,null,12/05/2025,Italia,Tutte,12/05/2025 14:15,2025-05-28,2025-05-28
Effettuato,28/05/2025,28/05/2025,OSR USB LAVORO PRIVATO,Trasporto pubblico locale,"PERSONALE SOC. AUTOGUIDOVIE PROVINCE DI MILANO, PAVIA, CREMONA, MONZA E DELLA BRIANZA",24 ORE,Territoriale,null,12/05/2025,Lombardia,Milano,12/05/2025 19:14,2025-05-28,2025-05-28
Effettuato,28/05/2025,28/05/2025,OSR USB LAVORO PRIVATO,Aereo,PERSONALE SOC. AIRPORT HANDLING AEROPORTI DI MILANO LINATE E MALPENSA,4 ORE: DALLE 13.00 ALLE 17.00,Nazionale,null,15/05/2025,Italia,Tutte,15/05/2025 17:25,2025-05-28,2025-05-28
Effettuato,28/05/2025,28/05/2025,OST FIT-CISL,Aereo,PERSONALE SOC. SWISSPORT ITALIA AEROPORTO DI MILANO LINATE,4 ORE: DALLE 13.00 ALLE 17.00,Nazionale,null,13/05/2025,Italia,Tutte,13/05/2025 11:55,2025-05-28,2025-05-28
Effettuato,28/05/2025,28/05/2025,TAXI BARI/INTAXI,Taxi,ADDETTI AL SERVIZIO TAXI  TERRITORIO COMUNALE DI BARI,12 ORE: DALLE 9.00 ALLE 21.00,Locale,null,16/05/2025,Puglia,Bari,16/05/2025 16:54,2025-05-28,2025-05-28
Effettuato,28/05/2025,28/05/2025,UILT-UIL,Aereo,PERSONALE SOC. SWISSPORT ITALIA AEROPORTO DI MILANO LINATE,4 ORE: DALLE 13.00 ALLE 17.00,Nazionale,null,12/05/2025,Italia,Tutte,12/05/2025 16:59,2025-05-28,2025-05-28
Effettuato,28/05/2025,28/05/2025,USB LAVORO PRIVATO,Aereo,PERSONALE NAVIGANTE SOC. EASYJET AIRLINES,4 ORE: DALLE 13.00 ALLE 17.00,Nazionale,null,09/05/2025,Italia,Tutte,09/05/2025 10:56,2025-05-28,2025-05-28
Effettuato,28/05/2025,28/05/2025,USB TAXI,Taxi,ADDETTI AL SERVIZIO TAXI  TERRITORIO COMUNALE DI NAPOLI,24 ORE,Locale,null,14/05/2025,Campania,Napoli,14/05/2025 11:49,2025-05-28,2025-05-28
Effettuato,28/05/2025,28/05/2025,USB TAXI,Taxi,ADDETTI AL SERVIZIO TAXI  TERRITORIO COMUNALE DI ROMA CAPITALE,24 ORE,Locale,null,14/05/2025,Lazio,Roma,14/05/2025 11:51,2025-05-28,2025-05-28
Effettuato,28/05/2025,28/05/2025,USB TAXI,Taxi,ADDETTI AL SERVIZIO TAXI  TERRITORIO COMUNALE DI TORINO,24 ORE,Locale,null,14/05/2025,Piemonte,Torino,14/05/2025 11:52,2025-05-28,2025-05-28
Effettuato,28/05/2025,28/05/2025,USB TAXI,Taxi,ADDETTI AL SERVIZIO TAXI  TERRITORIO COMUNALE DI LAMEZIA TERME,24 ORE,Locale,null,15/05/2025,Calabria,Catanzaro,15/05/2025 09:52,2025-05-28,2025-05-28
"Revocato (include le azioni di revoca, sospensione e differimento)",27/05/2025,28/05/2025,OSP ORSA FERROVIE,Ferroviario,PERSONALE SOC. TRENORD,23 ORE: DALLE 03.00 DEL 27/5 ALLE 02.00 DEL 28/5,Regionale,null,21/03/2025,Lombardia,Tutte,21/03/2025 19:25,2025-05-27,2025-05-28
"Revocato (include le azioni di revoca, sospensione e differimento)",27/05/2025,27/05/2025,USB LAVORO PRIVATO,Aereo,PERSONALE NAVIGANTE SOC. EASYJET AIRLINES,4 ORE: DALLE 13.00 ALLE 17.00,Nazionale,null,07/05/2025,Italia,Tutte,07/05/2025 12:14,2025-05-27,2025-05-27
"Revocato (include le azioni di revoca, sospensione e differimento)",26/05/2025,26/05/2025,OST CUB TRASPORTI,Aereo,PERSONALE AUTISTI SOC. SEA AEROPORTI DI MILANO LINATE E MALPENSA,24 ORE: DALLE 00.00 ALLE 23.59,Nazionale,null,15/04/2025,Italia,Tutte,15/04/2025 12:31,2025-05-26,2025-05-26
"Revocato (include le azioni di revoca, sospensione e differimento)",26/05/2025,26/05/2025,OST FILT-CGIL/FIT-CISL/UILT-UIL/FEDERMAR-CISAL/USCLAC-UNCDIM-SMACD/CONFINTESA MARE E PORTI + RSU,Marittimo,PERSONALE SOC. CARONTE E TOURIST AREA STRETTO DI MESSINA,8 ORE: DALLE 9.00 ALLE 17.00,Territoriale,null,14/05/2025,Sicilia,Messina,14/05/2025 19:29,2025-05-26,2025-05-26
Effettuato,24/05/2025,24/05/2025,OSR SGB,Trasporto pubblico locale,PERSONALE SOC. MOM DI TREVISO,4 ORE: DALLE 17.30 ALLE 21.30,Locale,null,13/05/2025,Veneto,Treviso,13/05/2025 12:22,2025-05-24,2025-05-24
Effettuato,23/05/2025,23/05/2025,ASSEMBLEA NAZIONALE PDM/PDB GRUPPO FSI,Ferroviario,PERSONALE DI MACCHINA E DI BORDO DEL GRUPPO FERROVIE DELLO STATO ITALIANE,8 ORE: DALLE 09.00 ALLE 17.00,Nazionale,null,13/05/2025,Italia,Tutte,13/05/2025 15:39,2025-05-23,2025-05-23
"Revocato (include le azioni di revoca, sospensione e differimento)",23/05/2025,23/05/2025,OSR FAISA-CONFAIL,Trasporto pubblico locale,PERSONALE CONTROL ROOM DIVISIONE TRASPORTO FERROVIARIO SOC. EAV DI NAPOLI,4 ORE: DALLE 08.30 ALLE 12.30,Locale,null,17/04/2025,Campania,Napoli,17/04/2025 13:06,2025-05-23,2025-05-23
Effettuato,23/05/2025,23/05/2025,SGB,Plurisettoriale,PERSONALE IMPRESE CHE SVOLGONO ATTIVITA' FERROVIARIA,SETTORE FERROVIARIO E TRASPORTO MERCI SU ROTAIA: 23 ORE DALLE 01.00 ALLE 23.59; *TPL: INTERA PRESTAZIONE DEL 23/5,Nazionale,"*PER TPL SOCC. GTT, TRENTINO TRASP., FERR. UDINE CIVIDALE, FERR. SUD EST, SIST. TERRITORIALI, TRASP. FERR.TOSCANO, F.A.S. - TUA, EAV, FERROTRAMVIARIA, FERR. GARGANO, FERR. CALABRIA",13/05/2025,Italia,Tutte,13/05/2025 10:49,2025-05-23,2025-05-23
Effettuato,23/05/2025,23/05/2025,USB LAVORO PRIVATO,Plurisettoriale,PERSONALE IMPRESE COMPARTO FERROVIARIO,SETTORE FERROVIARIO E TRASPORTO MERCI SU ROTAIA: 23 ORE DALLE 01.00 ALLE 23.59; *TPL: INTERA PRESTAZIONE DEL 23/5,Nazionale,"*PER TPL SOCC. GTT, FERR. UDINE CIVIDALE, SIST. TERRITORIALI, TRASP. FERR.TOSCANO, F.A.S. - TUA, EAV, FERROTRAMVIARIA, FERR. GARGANO, FERR. CALABRIA, FERR. SUD EST",13/05/2025,Italia,Tutte,13/05/2025 15:16,2025-05-23,2025-05-23
"Revocato (include le azioni di revoca, sospensione e differimento)",20/05/2025,21/05/2025,FILT-CGIL/FIT-CISL/UILT-UIL/UGL FERROVIERI/FAST-CONFSAL,Trasporto merci,PERSONALE VIAGGIANTE TRASPORTO MERCI SU FERRO SOC. GTS RAIL,24 ORE: DALLE 16.01 DEL 20/5 ALLE 16.00 DEL 21/5,Nazionale,null,07/04/2025,Italia,Tutte,07/04/2025 12:30,2025-05-20,2025-05-21
Effettuato,20/05/2025,20/05/2025,OSR FILT-CGIL/FIT-CISL/UGL AUTOFERRO/FAISA-CISAL/USB LAVORO PRIVATO,Trasporto pubblico locale,PERSONALE DIPENDENTE AZIENDE TPL REGIONE MOLISE,4 ORE: DALLE 19.00 ALLE 23.00,Regionale,null,12/04/2025,Molise,Tutte,14/04/2025 09:47,2025-05-20,2025-05-20
"Revocato (include le azioni di revoca, sospensione e differimento)",20/05/2025,20/05/2025,OSR FILT-CGIL/FIT-CISL/UILT-UIL/FAISA-CISAL,Trasporto pubblico locale,PERSONALE SOC. CONEROBUS DI ANCONA,4 ORE: DALLE 11.30 ALLE 15.30,Locale,null,07/05/2025,Marche,Ancona,07/05/2025 16:13,2025-05-20,2025-05-20
Effettuato,20/05/2025,20/05/2025,OSR USB LAVORO PRIVATO,Trasporto pubblico locale,PERSONALE SOC. BUSITALIA SITA NORD REGIONE UMBRIA,24 ORE: VARIE MODALITA',Regionale,null,06/05/2025,Umbria,Tutte,06/05/2025 10:52,2025-05-20,2025-05-20
"Revocato (include le azioni di revoca, sospensione e differimento)",19/05/2025,19/05/2025,OSR FILT-CGIL/FIT-CISL/UILT-UIL/FAISA-CISAL,Trasporto pubblico locale,PERSONALE SOC. CONTRAM DI MACERATA,4 ORE: DALLE 11.30 ALLE 15.30,Regionale,null,28/03/2025,Marche,Tutte,28/03/2025 13:47,2025-05-19,2025-05-19
Effettuato,19/05/2025,19/05/2025,RSA FIT-CISL/FAISA-CISAL/ORSA TRASPORTI,Trasporto pubblico locale,PERSONALE SOC. ATM DI MESSINA,24 ORE,Locale,null,23/04/2025,Sicilia,Messina,23/04/2025 10:49,2025-05-19,2025-05-19
"Revocato (include le azioni di revoca, sospensione e differimento)",18/05/2025,18/05/2025,USB LAVORO PRIVATO,Aereo,PERSONALE NAVIGANTE SOC. EASYJET AIRLINES,4 ORE: DALLE 13.00 ALLE 17.00,Nazionale,null,05/05/2025,Italia,Tutte,05/05/2025 12:20,2025-05-18,2025-05-18
"Revocato (include le azioni di revoca, sospensione e differimento)",17/05/2025,17/05/2025,ASSEMBLEA NAZIONALE PDM/PDB GRUPPO FSI,Ferroviario,PERSONALE DI MACCHINA E DI BORDO DEL GRUPPO FERROVIE DELLO STATO ITALIANE,8 ORE: DALLE 09.00 ALLE 17.00,Nazionale,null,07/05/2025,Italia,Tutte,07/05/2025 14:42,2025-05-17,2025-05-17
"Revocato (include le azioni di revoca, sospensione e differimento)",17/05/2025,17/05/2025,CUB TRASPORTI,Plurisettoriale,PERSONALE IMPRESE CHE SVOLGONO ATTIVITA' FERROVIARIA,SETTORE FERROVIARIO E TRASPORTO MERCI SU ROTAIA: 23 ORE DALLE 01.00 ALLE 23.59; TPL: 24 ORE,Nazionale,null,30/04/2025,Italia,Tutte,30/04/2025 11:45,2025-05-17,2025-05-17
"Revocato (include le azioni di revoca, sospensione e differimento)",17/05/2025,18/05/2025,OSR ORSA FERROVIE,Ferroviario,PERSONALE MOBILE SOC. TRENITALIA DIREZIONE BUSINESS REGIONALE PIEMONTE E VALLE D'AOSTA,23 ORE: DALLE 03.00 DEL 17/5 ALLE 02.00 DEL 18/5,Regionale,null,17/04/2025,Piemonte,Tutte,17/04/2025 13:36,2025-05-17,2025-05-18
"Revocato (include le azioni di revoca, sospensione e differimento)",17/05/2025,18/05/2025,OSR ORSA FERROVIE,Ferroviario,"PERSONALE SOC. TRENITALIA ADDETTO A VENDITA, ASSISTENZA DIREZIONE BUSINESS REGIONALE PIEMONTE E VALLE D'AOSTA",23 ORE: DALLE 03.00 DEL 17/5 ALLE 02.00 DEL 18/5,Regionale,null,17/04/2025,Piemonte,Tutte,17/04/2025 13:36,2025-05-17,2025-05-18
"Revocato (include le azioni di revoca, sospensione e differimento)",17/05/2025,18/05/2025,OSR UILT-UIL,Ferroviario,PERSONALE SOC. RFI SALA CIRCOLAZIONE E ORARIO DI CAGLIARI E UNITA' CIRCOLAZIONE SARDEGNA,24 ORE: DALLE 21.00 DEL 17/5 ALLE 20.59 DEL 18/5,Regionale,null,24/03/2025,Sardegna,Tutte,24/03/2025 22:13,2025-05-17,2025-05-18
Effettuato,17/05/2025,17/05/2025,RSA UGL AUTOFERRO,Trasporto pubblico locale,PERSONALE SOC. AMT DI GENOVA,24 ORE,Territoriale,null,30/04/2025,Liguria,Genova,30/04/2025 14:13,2025-05-17,2025-05-17
"Revocato (include le azioni di revoca, sospensione e differimento)",17/05/2025,17/05/2025,SGB,Plurisettoriale,PERSONALE IMPRESE CHE SVOLGONO ATTIVITA' FERROVIARIA,SETTORE FERROVIARIO E TRASPORTO MERCI SU ROTAIA: 23 ORE DALLE 01.00 ALLE 23.59; *TPL: INTERA PRESTAZIONE DEL 17/5,Nazionale,"ESCLUSO SETTORE MAN. INFRASTRUTTURE SOC. RFI - *PER TPL SOCC. GTT, TRENTINO TRASP., FERR. UDINE CIVIDALE, FERR. SUD EST, SIST. TERRITORIALI, TRASP. FERR.TOSCANO, F.A.S. - TUA, EAV, FERROTRAMVIARIA, FERR. GARGANO, FERR. CALABRIA",07/05/2025,Italia,Tutte,07/05/2025 00:01,2025-05-17,2025-05-17
"Revocato (include le azioni di revoca, sospensione e differimento)",17/05/2025,17/05/2025,USB LAVORO PRIVATO,Plurisettoriale,PERSONALE IMPRESE COMPARTO FERROVIARIO,23 ORE: DALLE 00.00 ALLE 23.00,Nazionale,"PER TPL SOCC. GTT, FERR. UDINE CIVIDALE, SIST. TERRITORIALI, TRASP. FERR.TOSCANO, FERR. ADR. SANGRITANA - TUA, FERROTRAMVIARIA, FERR. DEL GARGANO",30/04/2025,Italia,Tutte,30/04/2025 12:41,2025-05-17,2025-05-17
"Revocato (include le azioni di revoca, sospensione e differimento)",17/05/2025,17/05/2025,USB LAVORO PRIVATO,Plurisettoriale,PERSONALE IMPRESE COMPARTO FERROVIARIO,SETTORE FERROVIARIO E TRASPORTO MERCI SU ROTAIA: 23 ORE DALLE 01.00 ALLE 23.59; *TPL: INTERA PRESTAZIONE DEL 17/5,Nazionale,"*PER TPL SOCC. GTT, FERR. UDINE CIVIDALE, SIST. TERRITORIALI, TRASP. FERR.TOSCANO, F.A.S. - TUA, EAV, FERROTRAMVIARIA, FERR. GARGANO, FERR. CALABRIA, FERR. SUD EST",07/05/2025,Italia,Tutte,07/05/2025 00:05,2025-05-17,2025-05-17
"Revocato (include le azioni di revoca, sospensione e differimento)",13/05/2025,13/05/2025,OSR USB LAVORO PRIVATO,Trasporto pubblico locale,PERSONALE SOC. BUSITALIA SITA NORD REGIONE UMBRIA,24 ORE: VARIE MODALITA',Regionale,null,29/04/2025,Umbria,Tutte,29/04/2025 09:57,2025-05-13,2025-05-13
Effettuato,11/05/2025,11/05/2025,OSR ORSA TRASPORTI AUTOFERRO TPL,Trasporto pubblico locale,"PERSONALE VIAGGIANTE (MACCHINISTI, CAPITRENO E COORD.RI MOBILITA') DELLA SOC. EAV DI NAPOLI",24 ORE,Locale,null,01/04/2025,Campania,Napoli,01/04/2025 19:06,2025-05-11,2025-05-11
"Revocato (include le azioni di revoca, sospensione e differimento)",09/05/2025,09/05/2025,CUB TRASPORTI,Aereo,"LAVORATORI COMPARTO AEREO, AEROPORTUALE E INDOTTO AEROPORTI",4 ORE: DALLE 13.00 ALLE 17.00,Nazionale,null,03/04/2025,Italia,Tutte,03/04/2025 12:08,2025-05-09,2025-05-09
Effettuato,09/05/2025,09/05/2025,FLAI TRASPORTI E SERVIZI,Aereo,PERSONALE AZIENDE HANDLING ASSOCIATE ASSOHANDLERS OPERANTI NEI SEDIMI AEROPORTUALI ITALIANI,4 ORE: DALLE 13.00 ALLE 17.00,Nazionale,null,14/04/2025,Italia,Tutte,14/04/2025 17:47,2025-05-09,2025-05-09
Effettuato,09/05/2025,09/05/2025,FLAI TRASPORTI E SERVIZI,Aereo,PERSONALE SOC. AVIATION SERVICES AEROPORTO DI VENEZIA,4 ORE: DALLE 13.00 ALLE 17.00,Interregionale,null,22/04/2025,Italia,Tutte,22/04/2025 16:33,2025-05-09,2025-05-09
Effettuato,09/05/2025,09/05/2025,OSP COBAS LAVORO PRIVATO,Trasporto pubblico locale,PERSONALE SOC. BRESCIA TRASPORTI DI BRESCIA,4 ORE: DALLE 17.30 ALLE 21.30,Locale,null,09/04/2025,Lombardia,Brescia,09/04/2025 12:18,2025-05-09,2025-05-09
"Revocato (include le azioni di revoca, sospensione e differimento)",09/05/2025,09/05/2025,OSP CUB TRASPORTI,Trasporto pubblico locale,PERSONALE SOC. AMTS DI CATANIA,24 ORE,Locale,ASTENSIONE DAL LAVORO STRAORDINARIO PERIODI DAL 02 AL 08/05/2025 E DAL 10 AL 31/05/2025,02/04/2025,Sicilia,Catania,02/04/2025 15:20,2025-05-09,2025-05-09
Effettuato,09/05/2025,09/05/2025,OSP CUB TRASPORTI,Trasporto pubblico locale,PERSONALE SOC. AMTS DI CATANIA,24 ORE,Locale,ASTENSIONE DAL LAVORO STRAORDINARIO  DAL 02 05 2025 AL 31/05/2025,11/04/2025,Sicilia,Catania,11/04/2025 10:37,2025-05-09,2025-05-09
Effettuato,09/05/2025,09/05/2025,OSP ORSA TRASPORTI,Trasporto pubblico locale,PERSONALE SOC. BRESCIA TRASPORTI DI BRESCIA,4 ORE: DALLE 17.30 ALLE 21.30,Locale,null,09/04/2025,Lombardia,Brescia,09/04/2025 11:52,2025-05-09,2025-05-09
Effettuato,09/05/2025,09/05/2025,OST CUB TRASPORTI,Aereo,PERSONALE SOC. SWISSPORT ITALIA AEROPORTO DI MILANO LINATE,4 ORE: DALLE 13.00 ALLE 17.00,Nazionale,"ASTENSIONE DAL LAVORO STRAORDINARIO PERIODO 6-8, 10-14,17,20-23, 28 05 2025 E 3-4, 3-24 06 2025",16/04/2025,Italia,Tutte,16/04/2025 13:19,2025-05-09,2025-05-09
Effettuato,08/05/2025,09/05/2025,OSR FILT-CGIL,Circolazione e sicurezza stradale,PERSONALE SOC. SITAF CONCESSIONARIA AUTOSTRADA A32 TORINO-BARDONECCHIA,4 ORE DALLE 22.00 DELL'8/5 ALLE 22.00 DEL 9/5,Locale,null,25/03/2025,Piemonte,Torino,25/03/2025 09:32,2025-05-08,2025-05-09
Effettuato,07/05/2025,07/05/2025,OSR FILT-CGIL/FIT-CISL/UILT-UIL/FAISA-CISAL,Trasporto pubblico locale,PERSONALE SOC. TUA REGIONE ABRUZZO,4 ORE: DALLE 09.00 ALLE 13.00,Regionale,null,28/03/2025,Abruzzo,Tutte,30/03/2025 20:10,2025-05-07,2025-05-07
Effettuato,07/05/2025,07/05/2025,OSR UGL AUTOFERRO,Trasporto pubblico locale,PERSONALE SOC. TUA AREA METROPOLITANA DI CHIETI/PESCARA,4 ORE: DALLE 9.00 ALLE 13.00,Provinciale,null,09/04/2025,Abruzzo,Pescara,09/04/2025 10:21,2025-05-07,2025-05-07
Effettuato,07/05/2025,07/05/2025,OSR USB LAVORO PRIVATO,Trasporto pubblico locale,"PERSONALE SOC. AUTOGUIDOVIE PROVINCE DI MILANO, PAVIA, CREMONA, MONZA E DELLA BRIANZA",4 ORE: DALLE 11.00 ALLE 15.00,Territoriale,null,09/04/2025,Lombardia,Tutte,09/04/2025 15:01,2025-05-07,2025-05-07
Effettuato,06/05/2025,06/05/2025,FILT-CGIL/FIT-CISL/UILT-UIL,Plurisettoriale,"PERSONALE IMPRESE FERROVIARIE, SERVIZI FERROVIARI E GESTORE INFRASTRUTTURA FERROVIARIA",8 ORE: DALLE 09.01 ALLE 17.00,Nazionale,null,20/03/2025,Italia,Tutte,20/03/2025 00:00,2025-05-06,2025-05-06
"Revocato (include le azioni di revoca, sospensione e differimento)",06/05/2025,07/05/2025,OSR ORSA FERROVIE,Ferroviario,PERSONALE SOC. TRENORD,23 ORE: DALLE 03.00 DEL 6/5 ALLE 02.00 DEL 7/5,Regionale,null,06/03/2025,Lombardia,Tutte,06/03/2025 19:25,2025-05-06,2025-05-07
Effettuato,06/05/2025,06/05/2025,OSR UGL FERROVIERI/FAST-CONFSAL/ORSA FERROVIE,Ferroviario,PERSONALE EQUIPAGGI SOC. TRENITALIA DIREZIONE REGIONALE LIGURIA,8 ORE: DALLE 9.01 ALLE 17.00,Regionale,null,24/04/2025,Liguria,Tutte,24/04/2025 12:34,2025-05-06,2025-05-06
Effettuato,06/05/2025,06/05/2025,UGL FERROVIERI/FAST-CONFSAL/ORSA TRASPORTI,Plurisettoriale,"PERSONALE SOCC. GRUPPO FSI, TRENORD, TRENITALIA TPER, LEGACOOP, ANCP, CONFCOOPERATIVE, RAIL CARGO CARRIER, RAIL TRACTION COMPANY",8 ORE: DALLE 09.01 ALLE 16.59,Nazionale,null,11/04/2025,Italia,Tutte,11/04/2025 17:38,2025-05-06,2025-05-06
"Revocato (include le azioni di revoca, sospensione e differimento)",05/05/2025,05/05/2025,FAISA-CONFAIL,Trasporto pubblico locale,PERSONALE DELLE AZIENDE DI TRASPORTO PUBBLICO LOCALE,4 ORE CON MODALITA' TERRITORIALI,Nazionale,null,06/03/2025,Italia,Tutte,06/03/2025 15:58,2025-05-05,2025-05-05
Effettuato,05/05/2025,05/05/2025,OSP FILT-CGIL/FIT-CISL/UILT-UIL/FAISA-CISAL,Trasporto pubblico locale,PERSONALE SOC. AUTOLINEE TOSCANE PROVINCIA DI PRATO,4 ORE: DALLE 08.29 ALLE 12.29,Territoriale,ART.2 COMMA 7 L. 146/90 E S.M.I.,30/04/2025,Toscana,Prato,30/04/2025 13:18,2025-05-05,2025-05-05
Effettuato,05/05/2025,05/05/2025,OSR UILT-UIL,Trasporto pubblico locale,PERSONALE SETTORE FUNICOLARI SOC. ANM DI NAPOLI,8 ORE: DALLE 09.00 ALLE 17.00,Locale,null,09/04/2025,Campania,Napoli,09/04/2025 15:57,2025-05-05,2025-05-05
"Revocato (include le azioni di revoca, sospensione e differimento)",05/05/2025,06/05/2025,USB LAVORO PRIVATO,Plurisettoriale,PERSONALE IMPRESE COMPARTO FERROVIARIO,SETTORE FERROVIARIO E TRASPORTO MERCI SU ROTAIA 24 ORE: DALLE 21.00 DEL 5/5 ALLE 20.59 DEL 6/5 - SETTORE TPL SU ROTAIA INTERA PRESTAZIONE DEL 6/5*,Nazionale,"*PER TPL SOCC. GTT, SIST. TERRITORIALI, TRASP. FERR.TOSCANO, FERROTRAMVIARIA, FERR. ADR. SANGRITANA - TUA, FERROVIE SUD EST, FERR. GARGANO, FERR. UDINE CIVIDALE",04/04/2025,Italia,Tutte,04/04/2025 15:24,2025-05-05,2025-05-06
"Revocato (include le azioni di revoca, sospensione e differimento)",03/05/2025,03/05/2025,FILT-CGIL/UILT-UIL,Aereo,PILOTI SOC. EASYJET AIRLINES LIMITED,24 ORE,Nazionale,null,03/04/2025,Italia,Tutte,03/04/2025 14:46,2025-05-03,2025-05-03
Effettuato,01/05/2025,01/05/2025,USI-CIT,Generale,SCIOPERO GENERALE PERSONALE DIPENDENTE PUBBLICO E PRIVATO,INTERA GIORNATA,Nazionale,"ESCLUSI SETTORI TRASPORTO AEREO, FERROVIARIO, TRASPORTO PUBBLICO LOCALE, MARITTIMO, CIRCOLAZIONE E SICUREZZA STRADALE",07/04/2025,Italia,Tutte,07/04/2025 09:39,2025-05-01,2025-05-01
Effettuato,30/04/2025,30/04/2025,OSP COBAS LAVORO PRIVATO,Trasporto pubblico locale,PERSONALE SOC. GEST DI FIRENZE,4 ORE: DALLE 21.00 A TERMINE SERVIZIO,Territoriale,ART.2 COMMA 7 L. 146/90 E S.M.I.,27/04/2025,Toscana,Firenze,27/04/2025 20:05,2025-04-30,2025-04-30
"Revocato (include le azioni di revoca, sospensione e differimento)",28/04/2025,28/04/2025,OSP CUB TRASPORTI,Trasporto pubblico locale,PERSONALE SOC. AMT DI GENOVA,4 ORE: DALLE 11.45 ALLE 15.45,Territoriale,null,07/03/2025,Liguria,Genova,07/03/2025 16:03,2025-04-28,2025-04-28
"Revocato (include le azioni di revoca, sospensione e differimento)",28/04/2025,28/04/2025,OSP UILT UIL/UNICA TAXI CGIL/URITAXI/CONFARTIGIANATO TAXI/SITAFI FEDERTAXI CISAL/UGL TAXI,Taxi,ADDETTI AL SERVIZIO TAXI  TERRITORIO COMUNALE DI FIRENZE,24 ORE,Locale,null,16/04/2025,Toscana,Firenze,16/04/2025 00:13,2025-04-28,2025-04-28
"Revocato (include le azioni di revoca, sospensione e differimento)",26/04/2025,26/04/2025,FAISA-CONFAIL,Trasporto pubblico locale,PERSONALE DELLE AZIENDE DI TRASPORTO PUBBLICO LOCALE,4 ORE CON MODALITA' TERRITORIALI,Nazionale,null,06/03/2025,Italia,Tutte,06/03/2025 20:12,2025-04-26,2025-04-26
Effettuato,26/04/2025,26/04/2025,RSA UGL AUTOFERRO,Trasporto pubblico locale,PERSONALE SOC. AMT DI GENOVA,8 ORE: VARIE MODALITA',Territoriale,null,07/04/2025,Liguria,Genova,07/04/2025 14:50,2025-04-26,2025-04-26
Effettuato,24/04/2025,24/04/2025,COOPERATIVA TAXI BARI/INTAXI,Taxi,ADDETTI AL SERVIZIO TAXI  TERRITORIO COMUNALE DI BARI,8 ORE: DALLE 09.00 ALLE 18.00,Locale,null,16/04/2025,Puglia,Bari,16/04/2025 11:50,2025-04-24,2025-04-24
"Revocato (include le azioni di revoca, sospensione e differimento)",24/04/2025,24/04/2025,OSP UILT UIL/UNICA TAXI CGIL/URITAXI/CONFARTIGIANATO TAXI/SITAFI FEDERTAXI CISAL/UGL TAXI,Taxi,ADDETTI AL SERVIZIO TAXI  TERRITORIO COMUNALE DI FIRENZE,24 ORE,Locale,null,10/04/2025,Toscana,Firenze,13/04/2025 19:23,2025-04-24,2025-04-24
"Revocato (include le azioni di revoca, sospensione e differimento)",24/04/2025,24/04/2025,TAXI BARI SCARL,Taxi,ADDETTI AL SERVIZIO TAXI  TERRITORIO COMUNALE DI BARI,8 ORE: DALLE 09.00 ALLE 18.00,Locale,null,02/04/2025,Puglia,Bari,14/04/2025 09:50,2025-04-24,2025-04-24
"Revocato (include le azioni di revoca, sospensione e differimento)",24/04/2025,24/04/2025,USB TAXI,Taxi,ADDETTI AL SERVIZIO TAXI  TERRITORIO DI ROMA CAPITALE,14 ORE: DALLE 08.00 ALLE 22.00,Locale,null,14/04/2025,Lazio,Roma,14/04/2025 14:51,2025-04-24,2025-04-24
Effettuato,23/04/2025,23/04/2025,FILT-CGIL/FIT-CISL/UILT-UIL,Appalti ferroviari,PERSONALE SOC. LA GARDENIA APPALTI FERROVIARI GRUPPO FSI,MEZZO TURNO PER OGNI TURNO DI LAVORO,Nazionale,null,25/03/2025,Italia,Tutte,25/03/2025 10:04,2025-04-23,2025-04-23
Effettuato,18/04/2025,25/04/2025,OSR FAISA-CISAL,Trasporto pubblico locale,PERSONALE SOC. IAS TOURING DI CORIGLIANO-ROSSANO  (CS),DAL 18/4 ASTENSIONE COLLETTIVA DALLA PRESTAZIONE DELLE MANSIONI RITENUTE CONTRATTUALMENTE NON DOVUTE,Locale,null,10/04/2025,Calabria,Cosenza,11/04/2025 08:44,2025-04-18,2025-04-25
"Revocato (include le azioni di revoca, sospensione e differimento)",18/04/2025,18/04/2025,OSR UGL T.A.,Aereo,PERSONALE SOC. ROMEO GESTIONI - APPALTO GESAC PRESSO AEROPORTO NAPOLI CAPODICHINO,4 ORE: DALLE 12.00 ALLE 16.00,Interregionale,null,09/04/2025,Campania,Tutte,09/04/2025 18:00,2025-04-18,2025-04-18
Effettuato,14/04/2025,14/04/2025,OSP FAISA-CISAL,Trasporto pubblico locale,PERSONALE SOC. ATAF DI FOGGIA SETTORE TPL,4 ORE: DALLE 8.30 ALLE 12.30,Locale,null,25/03/2025,Puglia,Foggia,25/03/2025 17:35,2025-04-14,2025-04-14
"Revocato (include le azioni di revoca, sospensione e differimento)",14/04/2025,14/04/2025,OSR UILT-UIL,Trasporto pubblico locale,PERSONALE SETTORE FUNICOLARI SOC. ANM DI NAPOLI,8 ORE: DALLE 09.00 ALLE 17.00,Locale,null,01/04/2025,Campania,Napoli,01/04/2025 10:20,2025-04-14,2025-04-14
Effettuato,13/04/2025,13/04/2025,OSP CUB TRASPORTI,Trasporto pubblico locale,PERSONALE SOC. AMAT DI PALERMO,24 ORE,Locale,null,19/03/2025,Sicilia,Palermo,19/03/2025 06:20,2025-04-13,2025-04-13
Effettuato,13/04/2025,14/04/2025,UGL MARE E PORTI,Marittimo,PERSONALE MARITTIMO SOC. GNV - GRANDI NAVI VELOCI,24 ORE: DALLE 20.00 DEL 13/4 ALLE 19.59 DEL 14/4,Nazionale,null,24/03/2025,Italia,Tutte,24/03/2025 16:54,2025-04-13,2025-04-14
Effettuato,12/04/2025,13/04/2025,OSP ORSA TPL,Trasporto pubblico locale,PERSONALE SOC. AMT DI GENOVA,4 ORE: DALLE 22.30 DEL 12/4 ALLE 02.30 DEL 13/4,Locale,null,04/03/2025,Liguria,Genova,04/03/2025 08:38,2025-04-12,2025-04-13
"Revocato (include le azioni di revoca, sospensione e differimento)",12/04/2025,30/04/2025,OSR FAISA-CISAL,Trasporto pubblico locale,PERSONALE SOC. IAS TOURING DI CORIGLIANO-ROSSANO  (CS),DAL 12/4 ASTENSIONE COLLETTIVA DALLA PRESTAZIONE DELLE MANSIONI RITENUTE CONTRATTUALMENTE NON DOVUTE,Locale,null,04/04/2025,Calabria,Cosenza,04/04/2025 15:28,2025-04-12,2025-04-30
"Revocato (include le azioni di revoca, sospensione e differimento)",11/04/2025,12/04/2025,ASSEMBLEA NAZIONALE PDM/PDB,Ferroviario,PERSONALE DI MACCHINA E DI BORDO GRUPPO FSI,23 ORE: DALLE 03.00 DELL' 11/4 ALLE 02.00 DEL 12/4,Nazionale,null,21/03/2025,Italia,Tutte,21/03/2025 14:26,2025-04-11,2025-04-12
"Revocato (include le azioni di revoca, sospensione e differimento)",11/04/2025,11/04/2025,OSP COBAS LAVORO PRIVATO,Trasporto pubblico locale,PERSONALE SOC. BRESCIA TRASPORTI DI BRESCIA,4 ORE: DALLE 17.30 ALLE 21.30,Locale,null,29/03/2025,Lombardia,Brescia,29/03/2025 18:19,2025-04-11,2025-04-11
"Revocato (include le azioni di revoca, sospensione e differimento)",11/04/2025,11/04/2025,OSP ORSA TRASPORTI,Trasporto pubblico locale,PERSONALE SOC. BRESCIA TRASPORTI,4 ORE: DALLE 17.30 ALLE 21.30,Locale,null,29/03/2025,Lombardia,Brescia,29/03/2025 10:58,2025-04-11,2025-04-11
Effettuato,11/04/2025,12/04/2025,OSR ORSA FERROVIE,Ferroviario,PERSONALE MOBILE SOC. TRENITALIA DIREZIONE BUSINESS REGIONALE PIEMONTE E VALLE D'AOSTA,23 ORE: DALLE 03.00 DEL' 11/4 ALLE 02.00 DEL 12/4,Regionale,null,26/02/2025,Piemonte,Tutte,26/02/2025 15:02,2025-04-11,2025-04-12
Effettuato,11/04/2025,12/04/2025,OSR ORSA FERROVIE,Ferroviario,"PERSONALE SOC. TRENITALIA ADDETTO A VENDITA, ASSISTENZA DIV. BUSINESS REGIONALE E SVILUPPO INTERMODALE DELLA DIR. REGIONALE PIEMONTE",23 ORE: DALLE 03.00 DELL' 11/4 ALLE 02.00 DEL 12/4,Regionale,null,26/02/2025,Piemonte,Tutte,26/02/2025 15:02,2025-04-11,2025-04-12
Effettuato,11/04/2025,11/04/2025,SI-COBAS,Generale,SCIOPERO GENERALE DEI SETTORI PUBBLICI E PRIVATI,24 ORE,Nazionale,ESCLUSI BACINI DI UTENZA INTERESSATI DA SCIOPERI PRECEDENTEMENTE PROCLAMATI - ESCLUSA SOC. TRENITALIA DTR PIEMONTE E VALLE D'AOSTA - ESCLUSO SETTORE FERROVIARIO,26/03/2025,Italia,Tutte,26/03/2025 11:57,2025-04-11,2025-04-11
Effettuato,11/04/2025,12/04/2025,USB LAVORO PRIVATO,Ferroviario,PERSONALE SOC. RFI IMPIANTI MANUTENZIONE INFRASTRUTTURE - PERSONALE ADDETTO A SERVIZI FERROVIARI NON COLLEGATI CON LA CIRCOLAZIONE TRENI,23 ORE: DALLE 03.00 DELL'11/4 ALLE 02.00 DEL 12/4,Nazionale,null,20/03/2025,Italia,Tutte,20/03/2025 00:01,2025-04-11,2025-04-12
"Revocato (include le azioni di revoca, sospensione e differimento)",09/04/2025,09/04/2025,CUB TRASPORTI,Aereo,"LAVORATORI COMPARTO AEREO, AEROPORTUALE E INDOTTO AEROPORTI",4 ORE: DALLE 10.30 ALLE 14.30,Nazionale,ESCLUSO PERSONALE SOC. ENAV,26/03/2025,Italia,Tutte,26/03/2025 22:46,2025-04-09,2025-04-09
"Revocato (include le azioni di revoca, sospensione e differimento)",09/04/2025,09/04/2025,CUB TRASPORTI,Aereo,"LAVORATORI COMPARTO AEREO, AEROPORTUALE E INDOTTO AEROPORTI",4 ORE: DALLE 12.00 ALLE 16.00,Nazionale,null,13/03/2025,Italia,Tutte,13/03/2025 13:14,2025-04-09,2025-04-09
"Revocato (include le azioni di revoca, sospensione e differimento)",09/04/2025,09/04/2025,OSR FILT-CGIL/FIT-CISL/UILT-UIL/UGL T.A.,Aereo,PERSONALE SOC. GESAP AEROPORTO DI PALERMO,8 ORE: DALLE 10.30 ALLE 18.30,Interregionale,null,11/03/2025,Sicilia,Tutte,11/03/2025 13:26,2025-04-09,2025-04-09
Effettuato,09/04/2025,09/04/2025,OSR FILT-CGIL/FIT-CISL/UILT-UIL/UGL T.A.,Aereo,PERSONALE SOC. GESAP AEROPORTO DI PALERMO,8 ORE: DALLE 10.00 ALLE 18.00,Interregionale,null,20/03/2025,Italia,Tutte,20/03/2025 17:25,2025-04-09,2025-04-09
Effettuato,09/04/2025,09/04/2025,OST CUB TRASPORTI,Aereo,PERSONALE AUTISTI SOC. SEA AEROPORTI DI MILANO LINATE E MALPENSA,4 ORE: DALLE 10.30 ALLE 14.30,Nazionale,null,19/03/2025,Italia,Tutte,19/03/2025 16:09,2025-04-09,2025-04-09
Effettuato,09/04/2025,09/04/2025,RSA FILT-CGIL/FIT-CISL/UILT-UIL,Aereo,ASSISTENTI DI VOLO SOC. EASYJET AIRLINES LIMITED,4 ORE: DALLE 10.30 ALLE 14.30,Nazionale,null,28/03/2025,Italia,Tutte,28/03/2025 17:51,2025-04-09,2025-04-09
"Revocato (include le azioni di revoca, sospensione e differimento)",08/04/2025,09/04/2025,CUB TRASPORTI,Plurisettoriale,PERSONALE IMPRESE CHE SVOLGONO ATTIVITA' FERROVIARIA,SETTORE FERROVIARIO E TRASPORTO MERCI SU ROTAIA: 24 ORE DALLE 21.00 DELL'8/4 ALLE 20.59 DEL 9/4; SETTORE TPL SU ROTAIA INTERA PRESTAZIONE DEL 9/4*,Nazionale,"*PER TPL SOCC. GTT, SAD, TRENTINO TRASP.,  FER. UDINE C., SIST. TERRITORIALI, TFT, EAV, FERROTRAMVIARIA, FER.ADR. SANGRITANA, FER. GARGANO, FER. CALABRIA, FERROTRANVIARIA",26/02/2025,Italia,Tutte,26/02/2025 19:25,2025-04-08,2025-04-09
"Revocato (include le azioni di revoca, sospensione e differimento)",07/04/2025,07/04/2025,OSP CUB TRASPORTI,Trasporto pubblico locale,PERSONALE SOC. AMTS DI CATANIA,24 ORE,Locale,null,27/03/2025,Sicilia,Catania,27/03/2025 12:18,2025-04-07,2025-04-07
"Revocato (include le azioni di revoca, sospensione e differimento)",07/04/2025,30/04/2025,OSR FAISA-CISAL,Trasporto pubblico locale,PERSONALE SOC. IAS TOURING DI CORIGLIANO-ROSSANO  (CS),DAL 7/4 ASTENSIONE COLLETTIVA DALLA PRESTAZIONE DELLE MANSIONI RITENUTE CONTRATTUALMENTE NON DOVUTE,Locale,null,02/04/2025,Calabria,Cosenza,02/04/2025 17:58,2025-04-07,2025-04-30
"Revocato (include le azioni di revoca, sospensione e differimento)",06/04/2025,06/04/2025,OSR ORSA TRASPORTI AUTOFERRO TPL,Trasporto pubblico locale,"PERSONALE VIAGGIANTE (MACCHINISTI, CAPITRENO E COORD.RI MOBILITA') DELLA SOC. EAV DI NAPOLI",24 ORE,Locale,null,26/03/2025,Campania,Napoli,26/03/2025 18:31,2025-04-06,2025-04-06
Effettuato,04/04/2025,04/04/2025,24 ORE,Trasporto pubblico locale,PERSONALE SOC. LA PANORAMICA DI CHIETI,OSR FILT-CGIL/FIT-CISL/FAISA-CISAL,Territoriale,null,25/03/2025,Abruzzo,Chieti,25/03/2025 16:02,2025-04-04,2025-04-04
"Revocato (include le azioni di revoca, sospensione e differimento)",04/04/2025,04/04/2025,OSR FILT-CGIL/FIT-CISL/UILT-UIL/FAISA-CISAL,Trasporto pubblico locale,PERSONALE SOC. TUA REGIONE ABRUZZO,4 ORE: DALLE 9.00 ALLE 13.00,Regionale,null,25/03/2025,Abruzzo,Tutte,25/03/2025 21:22,2025-04-04,2025-04-04
"Revocato (include le azioni di revoca, sospensione e differimento)",01/04/2025,01/04/2025,FILT-CGIL/FIT-CISL/UILT-UIL/FAISA-CISAL/UGL-FNA,Trasporto pubblico locale,PERSONALE DELLE AZIENDE DI TRASPORTO PUBBLICO LOCALE,24 ORE CON MODALITA' TERRITORIALI,Nazionale,"ESCLUSE SOCC. ANM, AMAT, GTT, SIST. TERRITORIALI, FERROTRAMVIARIA, FERR. ADR. SANGRITANA/TUA, TFT, FERR. GARGANO, FERROVIE SUD-EST, FERR. UDINE CIVIDALE",07/03/2025,Italia,Tutte,07/03/2025 21:09,2025-04-01,2025-04-01
Effettuato,01/04/2025,01/04/2025,OSP CUB TRASPORTI,Trasporto pubblico locale,PERSONALE SOC. AMT DI GENOVA,4 ORE VARIE MODALITA',Territoriale,null,20/03/2025,Liguria,Genova,21/03/2025 09:32,2025-04-01,2025-04-01
Effettuato,01/04/2025,01/04/2025,OSP FILT-CGIL/FIT-CISL/UILT-UIL/UGL/FAISA-CISAL/SIAL COBAS + RSU,Trasporto pubblico locale,PERSONALE SOC. TPL LINEA DI SAVONA,4 ORE: DALLE 10.15 ALLE 14.15,Locale,null,15/03/2025,Liguria,Savona,15/03/2025 22:36,2025-04-01,2025-04-01
Effettuato,01/04/2025,01/04/2025,OSP FIT-CISL/FAISA-CISAL/USB LAVORO PRIVATO,Trasporto pubblico locale,PERSONALE SOC. SVT DI VICENZA,4 ORE: DALLE 17.00 ALLE 21.00,Locale,null,19/03/2025,Veneto,Vicenza,19/03/2025 00:00,2025-04-01,2025-04-01
Effettuato,01/04/2025,01/04/2025,RSA FIT-CISL/FAISA-CISAL/ORSA TRASPORTI,Trasporto pubblico locale,PERSONALE SOC. ATM DI MESSINA,8 ORE: DALLE 16.00 ALLE 23.59,Locale,null,12/02/2025,Sicilia,Messina,12/02/2025 11:58,2025-04-01,2025-04-01
Effettuato,31/03/2025,31/03/2025,FILT-CGIL/FIT-CISL/UILT-UIL/UGL FERROVIERI/FAST-CONFSAL,Trasporto merci,PERSONALE VIAGGIANTE TRASPORTO MERCI SU FERRO SOC. GTS RAIL,8 ORE: DALLE 16.01 ALLE 23.59,Nazionale,null,21/02/2025,Italia,Tutte,21/02/2025 14:08,2025-03-31,2025-03-31
"Revocato (include le azioni di revoca, sospensione e differimento)",31/03/2025,31/03/2025,OSP FILT-CGIL,Trasporto pubblico locale,PERSONALE SOC. AMAT DI PALERMO,24 ORE,Locale,null,05/03/2025,Sicilia,Palermo,06/03/2025 11:49,2025-03-31,2025-03-31
"Revocato (include le azioni di revoca, sospensione e differimento)",31/03/2025,04/04/2025,TRASPORTOUNITO FIAP,Trasporto merci,FERMO NAZIONALE SERVIZI AUTOTRASPORTO MERCI,120 ORE: DALLE 00.00 DEL 31/3 ALLE 24.00 DEL 4/4,Nazionale,ADESIONE ASR (AUTOTRASPORTATORI SARDI RIUNITI),04/03/2025,Italia,Tutte,05/03/2025 10:10,2025-03-31,2025-04-04
